"No.","Time","Source","Destination","Protocol","Length","Info"
"1","18:49:44.574094","192.168.0.227","5.28.195.2","TCP","78","49841  >  5222 [SYN] Seq=0 Win=65535 Len=0 MSS=1460 WS=16 TSval=4148034398 TSecr=0 SACK_PERM"
"2","18:49:44.574155","192.168.0.227","5.28.195.2","TCP","78","49840  >  80 [SYN] Seq=0 Win=65535 Len=0 MSS=1460 WS=16 TSval=1509608726 TSecr=0 SACK_PERM"
"3","18:49:45.551518","192.168.0.227","64.65.63.120","TLSv1.2","602","Application Data"
"4","18:49:45.575219","192.168.0.227","5.28.195.2","TCP","78","[TCP Retransmission] 49841  >  5222 [SYN] Seq=0 Win=65535 Len=0 MSS=1460 WS=16 TSval=4148035399 TSecr=0 SACK_PERM"
"5","18:49:45.575262","192.168.0.227","5.28.195.2","TCP","78","[TCP Retransmission] 49840  >  80 [SYN] Seq=0 Win=65535 Len=0 MSS=1460 WS=16 TSval=1509609727 TSecr=0 SACK_PERM"
"6","18:49:45.680161","64.65.63.120","192.168.0.227","TCP","66","443  >  64520 [ACK] Seq=1 Ack=537 Win=8077 Len=0 TSval=2517501216 TSecr=1566605109"
"7","18:49:46.575302","192.168.0.227","5.28.195.2","TCP","78","[TCP Retransmission] 49841  >  5222 [SYN] Seq=0 Win=65535 Len=0 MSS=1460 WS=16 TSval=4148036400 TSecr=0 SACK_PERM"
"8","18:49:46.575338","192.168.0.227","5.28.195.2","TCP","78","[TCP Retransmission] 49840  >  80 [SYN] Seq=0 Win=65535 Len=0 MSS=1460 WS=16 TSval=1509610728 TSecr=0 SACK_PERM"
"9","18:49:46.577427","192.168.0.220","192.168.0.227","MDNS","86","Standard query 0x0000 PTR _companion-link._tcp.local, ""QU"" question"
"10","18:49:46.618019","2a:32:1e:8d:54:98","16:a5:8a:ab:88:c1","ARP","42","Who has 192.168.0.220? Tell 192.168.0.227"
"11","18:49:46.618023","192.168.0.227","192.168.0.220","MDNS","436","Standard query response 0x0000 PTR NK MacBook Air._companion-link._tcp.local SRV, cache flush 0 0 52657 NK-MacBook-Air.local TXT, cache flush TXT AAAA, cache flush fe80::8f4:f6e1:77d0:ab3e AAAA, cache flush 2a02:ab88:b:4100:802:75bd:a912:68ed A, cache flush 192.168.0.227"
"12","18:49:46.624474","16:a5:8a:ab:88:c1","2a:32:1e:8d:54:98","ARP","42","192.168.0.220 is at 16:a5:8a:ab:88:c1"
"13","18:49:46.626348","fe80::1864:4d30:9585:912f","fe80::8f4:f6e1:77d0:ab3e","TCP","90","55492  >  52657 [PSH, ACK] Seq=1 Ack=1 Win=2048 Len=4 TSval=1106902039 TSecr=2789291726"
"14","18:49:46.626479","fe80::8f4:f6e1:77d0:ab3e","fe80::1864:4d30:9585:912f","TCP","86","52657  >  55492 [ACK] Seq=1 Ack=5 Win=2048 Len=0 TSval=2789489903 TSecr=1106902039"
"15","18:49:46.650145","192.168.0.220","224.0.0.251","MDNS","191","Standard query 0x0000 PTR _companion-link._tcp.local, ""QU"" question PTR _rdlink._tcp.local, ""QU"" question ANY Nikas-iPhone.local, ""QU"" question AAAA fe80::1864:4d30:9585:912f A 192.168.0.220 AAAA 2a02:ab88:b:4100:1438:22cd:a64a:6b34"
"16","18:49:46.650147","fe80::1864:4d30:9585:912f","ff02::fb","MDNS","211","Standard query 0x0000 PTR _companion-link._tcp.local, ""QU"" question PTR _rdlink._tcp.local, ""QU"" question ANY Nikas-iPhone.local, ""QU"" question AAAA fe80::1864:4d30:9585:912f A 192.168.0.220 AAAA 2a02:ab88:b:4100:1438:22cd:a64a:6b34"
"17","18:49:46.650149","192.168.0.220","224.0.0.251","MDNS","326","Standard query response 0x0000 PTR, cache flush Nikas-iPhone.local PTR, cache flush Nikas-iPhone.local PTR, cache flush Nikas-iPhone.local NSEC, cache flush F.2.1.9.5.8.5.9.0.3.D.4.4.6.8.1.0.0.0.0.0.0.0.0.0.0.0.0.0.8.E.F.ip6.arpa NSEC, cache flush 220.0.168.192.in-addr.arpa NSEC, cache flush 4.3.B.6.A.4.6.A.D.C.2.2.8.3.4.1.0.0.1.4.B.0.0.0.8.8.B.A.2.0.A.2.ip6.arpa"
"18","18:49:46.651210","fe80::1864:4d30:9585:912f","ff02::fb","MDNS","346","Standard query response 0x0000 PTR, cache flush Nikas-iPhone.local PTR, cache flush Nikas-iPhone.local PTR, cache flush Nikas-iPhone.local NSEC, cache flush F.2.1.9.5.8.5.9.0.3.D.4.4.6.8.1.0.0.0.0.0.0.0.0.0.0.0.0.0.8.E.F.ip6.arpa NSEC, cache flush 220.0.168.192.in-addr.arpa NSEC, cache flush 4.3.B.6.A.4.6.A.D.C.2.2.8.3.4.1.0.0.1.4.B.0.0.0.8.8.B.A.2.0.A.2.ip6.arpa"
"19","18:49:46.651212","192.168.0.220","224.0.0.251","IGMPv2","46","Membership Report group 224.0.0.251"
"20","18:49:46.699019","192.168.0.227","224.0.0.251","MDNS","477","Standard query response 0x0000 PTR NK MacBook Air._companion-link._tcp.local TXT TXT, cache flush SRV, cache flush 0 0 52657 NK-MacBook-Air.local AAAA, cache flush fe80::8f4:f6e1:77d0:ab3e AAAA, cache flush 2a02:ab88:b:4100:802:75bd:a912:68ed A, cache flush 192.168.0.227 NSEC, cache flush NK MacBook Air._companion-link._tcp.local NSEC, cache flush NK-MacBook-Air.local"
"21","18:49:46.699278","fe80::8f4:f6e1:77d0:ab3e","ff02::fb","MDNS","497","Standard query response 0x0000 PTR NK MacBook Air._companion-link._tcp.local TXT TXT, cache flush SRV, cache flush 0 0 52657 NK-MacBook-Air.local AAAA, cache flush fe80::8f4:f6e1:77d0:ab3e AAAA, cache flush 2a02:ab88:b:4100:802:75bd:a912:68ed A, cache flush 192.168.0.227 NSEC, cache flush NK MacBook Air._companion-link._tcp.local NSEC, cache flush NK-MacBook-Air.local"
"22","18:49:46.841635","2a02:ab88:b:4100:4977:d98a:d5e5:5d47","2a00:1450:400e:809::2003","TLSv1.2","170","Application Data"
"23","18:49:46.855122","192.168.0.220","224.0.0.251","MDNS","150","Standard query 0x0000 ANY Nikas-iPhone.local, ""QM"" question AAAA fe80::1864:4d30:9585:912f A 192.168.0.220 AAAA 2a02:ab88:b:4100:1438:22cd:a64a:6b34"
"24","18:49:46.855124","fe80::1864:4d30:9585:912f","ff02::fb","MDNS","170","Standard query 0x0000 ANY Nikas-iPhone.local, ""QM"" question AAAA fe80::1864:4d30:9585:912f A 192.168.0.220 AAAA 2a02:ab88:b:4100:1438:22cd:a64a:6b34"
"25","18:49:46.885606","2a00:1450:400e:809::2003","2a02:ab88:b:4100:4977:d98a:d5e5:5d47","TCP","86","443  >  50037 [ACK] Seq=1 Ack=85 Win=1048 Len=0 TSval=4138828418 TSecr=77302779"
"26","18:49:46.893451","2a00:1450:400e:809::2003","2a02:ab88:b:4100:4977:d98a:d5e5:5d47","TLSv1.2","158","Application Data"
"27","18:49:46.893455","2a00:1450:400e:809::2003","2a02:ab88:b:4100:4977:d98a:d5e5:5d47","TLSv1.2","160","Application Data"
"28","18:49:46.893458","2a00:1450:400e:809::2003","2a02:ab88:b:4100:4977:d98a:d5e5:5d47","TLSv1.2","117","Application Data"
"29","18:49:46.893460","2a00:1450:400e:809::2003","2a02:ab88:b:4100:4977:d98a:d5e5:5d47","TLSv1.2","125","Application Data"
"30","18:49:46.894660","2a02:ab88:b:4100:4977:d98a:d5e5:5d47","2a00:1450:400e:809::2003","TCP","86","50037  >  443 [ACK] Seq=85 Ack=217 Win=2045 Len=0 TSval=77302831 TSecr=4138828425"
"31","18:49:46.895234","2a02:ab88:b:4100:4977:d98a:d5e5:5d47","2a00:1450:400e:809::2003","TLSv1.2","125","Application Data"
"32","18:49:46.931669","2a00:1450:400e:809::2003","2a02:ab88:b:4100:4977:d98a:d5e5:5d47","TCP","86","443  >  50037 [ACK] Seq=217 Ack=124 Win=1048 Len=0 TSval=4138828466 TSecr=77302833"
"33","18:49:46.957528","192.168.0.220","224.0.0.251","MDNS","115","Standard query 0x0000 PTR _companion-link._tcp.local, ""QM"" question PTR NK MacBook Air._companion-link._tcp.local"
"34","18:49:46.957532","fe80::1864:4d30:9585:912f","ff02::fb","MDNS","135","Standard query 0x0000 PTR _companion-link._tcp.local, ""QM"" question PTR NK MacBook Air._companion-link._tcp.local"
"35","18:49:47.059925","192.168.0.220","224.0.0.251","MDNS","226","Standard query 0x0000 ANY 40157DD4-09B2-4EE7-8234-8FF04F58061A._asquic._udp.local, ""QU"" question ANY Nikas-iPhone.local, ""QU"" question SRV 0 0 59044 Nikas-iPhone.local AAAA fe80::1864:4d30:9585:912f A 192.168.0.220 AAAA 2a02:ab88:b:4100:1438:22cd:a64a:6b34"
"36","18:49:47.059928","fe80::1864:4d30:9585:912f","ff02::fb","MDNS","246","Standard query 0x0000 ANY 40157DD4-09B2-4EE7-8234-8FF04F58061A._asquic._udp.local, ""QU"" question ANY Nikas-iPhone.local, ""QU"" question SRV 0 0 59044 Nikas-iPhone.local AAAA fe80::1864:4d30:9585:912f A 192.168.0.220 AAAA 2a02:ab88:b:4100:1438:22cd:a64a:6b34"
"37","18:49:47.367224","192.168.0.220","224.0.0.251","MDNS","198","Standard query 0x0000 ANY 40157DD4-09B2-4EE7-8234-8FF04F58061A._asquic._udp.local, ""QM"" question ANY Nikas-iPhone.local, ""QM"" question SRV 0 0 59044 Nikas-iPhone.local AAAA fe80::1864:4d30:9585:912f A 192.168.0.220"
"38","18:49:47.367227","fe80::1864:4d30:9585:912f","ff02::fb","MDNS","218","Standard query 0x0000 ANY 40157DD4-09B2-4EE7-8234-8FF04F58061A._asquic._udp.local, ""QM"" question ANY Nikas-iPhone.local, ""QM"" question SRV 0 0 59044 Nikas-iPhone.local AAAA fe80::1864:4d30:9585:912f A 192.168.0.220"
"39","18:49:47.367229","192.168.0.220","224.0.0.251","MDNS","120","Standard query response 0x0000 AAAA, cache flush 2a02:ab88:b:4100:1438:22cd:a64a:6b34 NSEC, cache flush Nikas-iPhone.local"
"40","18:49:47.367231","fe80::1864:4d30:9585:912f","ff02::fb","MDNS","140","Standard query response 0x0000 AAAA, cache flush 2a02:ab88:b:4100:1438:22cd:a64a:6b34 NSEC, cache flush Nikas-iPhone.local"
"41","18:49:47.576272","192.168.0.220","224.0.0.251","MDNS","326","Standard query response 0x0000 PTR, cache flush Nikas-iPhone.local PTR, cache flush Nikas-iPhone.local PTR, cache flush Nikas-iPhone.local NSEC, cache flush F.2.1.9.5.8.5.9.0.3.D.4.4.6.8.1.0.0.0.0.0.0.0.0.0.0.0.0.0.8.E.F.ip6.arpa NSEC, cache flush 220.0.168.192.in-addr.arpa NSEC, cache flush 4.3.B.6.A.4.6.A.D.C.2.2.8.3.4.1.0.0.1.4.B.0.0.0.8.8.B.A.2.0.A.2.ip6.arpa"
"42","18:49:47.576273","fe80::1864:4d30:9585:912f","ff02::fb","MDNS","346","Standard query response 0x0000 PTR, cache flush Nikas-iPhone.local PTR, cache flush Nikas-iPhone.local PTR, cache flush Nikas-iPhone.local NSEC, cache flush F.2.1.9.5.8.5.9.0.3.D.4.4.6.8.1.0.0.0.0.0.0.0.0.0.0.0.0.0.8.E.F.ip6.arpa NSEC, cache flush 220.0.168.192.in-addr.arpa NSEC, cache flush 4.3.B.6.A.4.6.A.D.C.2.2.8.3.4.1.0.0.1.4.B.0.0.0.8.8.B.A.2.0.A.2.ip6.arpa"
"43","18:49:47.576274","192.168.0.220","224.0.0.251","MDNS","268","Standard query 0x0000 PTR _companion-link._tcp.local, ""QM"" question PTR _rdlink._tcp.local, ""QM"" question ANY 40157DD4-09B2-4EE7-8234-8FF04F58061A._asquic._udp.local, ""QM"" question ANY Nikas-iPhone.local, ""QM"" question PTR NK MacBook Air._companion-link._tcp.local SRV 0 0 59044 Nikas-iPhone.local AAAA fe80::1864:4d30:9585:912f A 192.168.0.220"
"44","18:49:47.576276","fe80::1864:4d30:9585:912f","ff02::fb","MDNS","288","Standard query 0x0000 PTR _companion-link._tcp.local, ""QM"" question PTR _rdlink._tcp.local, ""QM"" question ANY 40157DD4-09B2-4EE7-8234-8FF04F58061A._asquic._udp.local, ""QM"" question ANY Nikas-iPhone.local, ""QM"" question PTR NK MacBook Air._companion-link._tcp.local SRV 0 0 59044 Nikas-iPhone.local AAAA fe80::1864:4d30:9585:912f A 192.168.0.220"
"45","18:49:48.237493","192.168.0.227","192.87.28.82","TLSv1.2","602","Application Data"
"46","18:49:48.313709","192.87.28.82","192.168.0.227","TCP","66","9001  >  64519 [ACK] Seq=1 Ack=537 Win=3520 Len=0 TSval=1327452370 TSecr=1556421528"
"47","18:49:48.578395","192.168.0.227","5.28.195.2","TCP","78","49845  >  443 [SYN, ECE, CWR] Seq=0 Win=65535 Len=0 MSS=1460 WS=16 TSval=1339243705 TSecr=0 SACK_PERM"
"48","18:49:48.578403","192.168.0.227","5.28.195.2","TCP","78","49844  >  80 [SYN, ECE, CWR] Seq=0 Win=65535 Len=0 MSS=1460 WS=16 TSval=2854488139 TSecr=0 SACK_PERM"
"49","18:49:48.578479","192.168.0.227","5.28.195.2","TCP","78","49846  >  5222 [SYN, ECE, CWR] Seq=0 Win=65535 Len=0 MSS=1460 WS=16 TSval=37559920 TSecr=0 SACK_PERM"
"50","18:49:48.665370","2a06:98c1:3123:8000::1","2a02:ab88:b:4100:4977:d98a:d5e5:5d47","TLSv1.2","110","Application Data"
"51","18:49:48.666163","2a02:ab88:b:4100:4977:d98a:d5e5:5d47","2a06:98c1:3123:8000::1","TCP","86","50270  >  443 [ACK] Seq=1 Ack=25 Win=2048 Len=0 TSval=3947798622 TSecr=4189920761"
"52","18:49:48.666171","2a02:ab88:b:4100:4977:d98a:d5e5:5d47","2a06:98c1:3123:8000::1","TLSv1.2","110","Application Data"
"53","18:49:48.666173","2a02:ab88:b:4100:4977:d98a:d5e5:5d47","2a06:98c1:3123:8000::1","TLSv1.2","112","Application Data"
"54","18:49:48.692098","5.28.195.2","192.168.0.227","TCP","74","443  >  49845 [SYN, ACK, ECE] Seq=0 Ack=1 Win=65535 Len=0 MSS=1240 SACK_PERM TSval=840595750 TSecr=1339243705 WS=1024"
"55","18:49:48.692409","192.168.0.227","5.28.195.2","TCP","66","49845  >  443 [ACK] Seq=1 Ack=1 Win=1048560 Len=0 TSval=1339243819 TSecr=840595750"
"56","18:49:48.692784","192.168.0.227","5.28.195.2","TLSv1","583","Client Hello"
"57","18:49:48.713411","2a06:98c1:3123:8000::1","2a02:ab88:b:4100:4977:d98a:d5e5:5d47","TCP","86","443  >  50270 [ACK] Seq=25 Ack=51 Win=16 Len=0 TSval=4189920849 TSecr=3947798622"
"58","18:49:48.757468","5.28.195.2","192.168.0.227","TCP","66","443  >  49845 [ACK] Seq=1 Ack=518 Win=67584 Len=0 TSval=840595844 TSecr=1339243819"
"59","18:49:48.757472","5.28.195.2","192.168.0.227","TCP","66","443  >  49845 [FIN, ACK] Seq=1 Ack=518 Win=67584 Len=0 TSval=840595844 TSecr=1339243819"
"60","18:49:48.757753","192.168.0.227","5.28.195.2","TCP","66","49845  >  443 [ACK] Seq=518 Ack=2 Win=1048560 Len=0 TSval=1339243884 TSecr=840595844"
"61","18:49:48.758068","192.168.0.227","5.28.195.2","TCP","66","49845  >  443 [FIN, ACK] Seq=518 Ack=2 Win=1048560 Len=0 TSval=1339243884 TSecr=840595844"
"62","18:49:48.806293","5.28.195.2","192.168.0.227","TCP","56","443  >  49845 [RST] Seq=2 Win=0 Len=0"
"63","18:49:48.903233","192.168.0.220","224.0.0.251","MDNS","314","Standard query response 0x0000 TXT, cache flush PTR _asquic._udp.local PTR 40157DD4-09B2-4EE7-8234-8FF04F58061A._asquic._udp.local SRV, cache flush 0 0 59044 Nikas-iPhone.local AAAA, cache flush 2a02:ab88:b:4100:1438:22cd:a64a:6b34 AAAA, cache flush fe80::1864:4d30:9585:912f A, cache flush 192.168.0.220 NSEC, cache flush 40157DD4-09B2-4EE7-8234-8FF04F58061A._asquic._udp.local NSEC, cache flush Nikas-iPhone.local"
"64","18:49:48.903236","fe80::1864:4d30:9585:912f","ff02::fb","MDNS","334","Standard query response 0x0000 TXT, cache flush PTR _asquic._udp.local PTR 40157DD4-09B2-4EE7-8234-8FF04F58061A._asquic._udp.local SRV, cache flush 0 0 59044 Nikas-iPhone.local AAAA, cache flush 2a02:ab88:b:4100:1438:22cd:a64a:6b34 AAAA, cache flush fe80::1864:4d30:9585:912f A, cache flush 192.168.0.220 NSEC, cache flush 40157DD4-09B2-4EE7-8234-8FF04F58061A._asquic._udp.local NSEC, cache flush Nikas-iPhone.local"
"65","18:49:49.579748","192.168.0.227","5.28.195.2","TCP","78","[TCP Retransmission] 49846  >  5222 [SYN] Seq=0 Win=65535 Len=0 MSS=1460 WS=16 TSval=37560921 TSecr=0 SACK_PERM"
"66","18:49:49.579838","192.168.0.227","5.28.195.2","TCP","78","[TCP Retransmission] 49844  >  80 [SYN] Seq=0 Win=65535 Len=0 MSS=1460 WS=16 TSval=2854489140 TSecr=0 SACK_PERM"
"67","18:49:49.620056","192.168.0.220","224.0.0.251","MDNS","326","Standard query response 0x0000 PTR, cache flush Nikas-iPhone.local PTR, cache flush Nikas-iPhone.local PTR, cache flush Nikas-iPhone.local NSEC, cache flush F.2.1.9.5.8.5.9.0.3.D.4.4.6.8.1.0.0.0.0.0.0.0.0.0.0.0.0.0.8.E.F.ip6.arpa NSEC, cache flush 220.0.168.192.in-addr.arpa NSEC, cache flush 4.3.B.6.A.4.6.A.D.C.2.2.8.3.4.1.0.0.1.4.B.0.0.0.8.8.B.A.2.0.A.2.ip6.arpa"
"68","18:49:49.620060","fe80::1864:4d30:9585:912f","ff02::fb","MDNS","346","Standard query response 0x0000 PTR, cache flush Nikas-iPhone.local PTR, cache flush Nikas-iPhone.local PTR, cache flush Nikas-iPhone.local NSEC, cache flush F.2.1.9.5.8.5.9.0.3.D.4.4.6.8.1.0.0.0.0.0.0.0.0.0.0.0.0.0.8.E.F.ip6.arpa NSEC, cache flush 220.0.168.192.in-addr.arpa NSEC, cache flush 4.3.B.6.A.4.6.A.D.C.2.2.8.3.4.1.0.0.1.4.B.0.0.0.8.8.B.A.2.0.A.2.ip6.arpa"
"69","18:49:50.580115","192.168.0.227","5.28.195.2","TCP","78","[TCP Retransmission] 49846  >  5222 [SYN] Seq=0 Win=65535 Len=0 MSS=1460 WS=16 TSval=37561921 TSecr=0 SACK_PERM"
"70","18:49:50.580214","192.168.0.227","5.28.195.2","TCP","78","[TCP Retransmission] 49844  >  80 [SYN] Seq=0 Win=65535 Len=0 MSS=1460 WS=16 TSval=2854490140 TSecr=0 SACK_PERM"
"71","18:49:50.642662","192.168.0.220","224.0.0.251","MDNS","129","Standard query 0x0000 PTR _companion-link._tcp.local, ""QM"" question PTR _rdlink._tcp.local, ""QM"" question PTR NK MacBook Air._companion-link._tcp.local"
"72","18:49:50.642768","fe80::1864:4d30:9585:912f","ff02::fb","MDNS","149","Standard query 0x0000 PTR _companion-link._tcp.local, ""QM"" question PTR _rdlink._tcp.local, ""QM"" question PTR NK MacBook Air._companion-link._tcp.local"
"73","18:49:50.753287","2a02:ab88:b:4100:4977:d98a:d5e5:5d47","2a01:b740:1361:101::2:4","TLSv1.2","292","Application Data"
"74","18:49:50.753607","2a02:ab88:b:4100:4977:d98a:d5e5:5d47","2a01:b740:1361:101::2:4","TLSv1.2","482","Application Data"
"75","18:49:50.753667","2a02:ab88:b:4100:4977:d98a:d5e5:5d47","2a01:b740:1361:101::2:4","TLSv1.2","117","Application Data"
"76","18:49:50.831849","192.168.0.227","64.65.63.120","TLSv1.2","602","Application Data"
"77","18:49:50.850163","192.168.0.220","224.0.0.251","MDNS","314","Standard query response 0x0000 TXT, cache flush PTR _asquic._udp.local PTR 40157DD4-09B2-4EE7-8234-8FF04F58061A._asquic._udp.local SRV, cache flush 0 0 59044 Nikas-iPhone.local AAAA, cache flush 2a02:ab88:b:4100:1438:22cd:a64a:6b34 AAAA, cache flush fe80::1864:4d30:9585:912f A, cache flush 192.168.0.220 NSEC, cache flush 40157DD4-09B2-4EE7-8234-8FF04F58061A._asquic._udp.local NSEC, cache flush Nikas-iPhone.local"
"78","18:49:50.850165","fe80::1864:4d30:9585:912f","ff02::fb","MDNS","334","Standard query response 0x0000 TXT, cache flush PTR _asquic._udp.local PTR 40157DD4-09B2-4EE7-8234-8FF04F58061A._asquic._udp.local SRV, cache flush 0 0 59044 Nikas-iPhone.local AAAA, cache flush 2a02:ab88:b:4100:1438:22cd:a64a:6b34 AAAA, cache flush fe80::1864:4d30:9585:912f A, cache flush 192.168.0.220 NSEC, cache flush 40157DD4-09B2-4EE7-8234-8FF04F58061A._asquic._udp.local NSEC, cache flush Nikas-iPhone.local"
"79","18:49:50.874397","64.65.63.120","192.168.0.227","TCP","66","443  >  64520 [ACK] Seq=1 Ack=1073 Win=8073 Len=0 TSval=2517506497 TSecr=1566610389"
"80","18:49:51.009948","64.65.63.120","192.168.0.227","TLSv1.2","602","Application Data"
"81","18:49:51.010092","192.168.0.227","64.65.63.120","TCP","66","64520  >  443 [ACK] Seq=1073 Ack=537 Win=16208 Len=0 TSval=1566610568 TSecr=2517506630"
"82","18:49:51.011850","192.168.0.227","64.65.63.120","TCP","1474","64520  >  443 [ACK] Seq=1073 Ack=537 Win=16216 Len=1408 TSval=1566610569 TSecr=2517506630 [TCP PDU reassembled in 83]"
"83","18:49:51.011885","192.168.0.227","64.65.63.120","TLSv1.2","736","Application Data"
"84","18:49:51.035265","192.168.0.227","5.28.195.2","TCP","78","49848  >  443 [SYN, ECE, CWR] Seq=0 Win=65535 Len=0 MSS=1460 WS=16 TSval=871881432 TSecr=0 SACK_PERM"
"85","18:49:51.059818","64.65.63.120","192.168.0.227","TCP","66","443  >  64520 [ACK] Seq=537 Ack=2481 Win=8096 Len=0 TSval=2517506679 TSecr=1566610569"
"86","18:49:51.059820","64.65.63.120","192.168.0.227","TCP","66","443  >  64520 [ACK] Seq=537 Ack=3151 Win=8096 Len=0 TSval=2517506679 TSecr=1566610569"
"87","18:49:51.072261","2a01:b740:1361:101::2:4","2a02:ab88:b:4100:4977:d98a:d5e5:5d47","TCP","86","443  >  50273 [ACK] Seq=1 Ack=634 Win=35 Len=0 TSval=2815134038 TSecr=1042514103"
"88","18:49:51.074398","5.28.195.2","192.168.0.227","TCP","74","443  >  49848 [SYN, ACK, ECE] Seq=0 Ack=1 Win=65535 Len=0 MSS=1240 SACK_PERM TSval=2504493048 TSecr=871881432 WS=1024"
"89","18:49:51.074599","192.168.0.227","5.28.195.2","TCP","66","49848  >  443 [ACK] Seq=1 Ack=1 Win=1048560 Len=0 TSval=871881471 TSecr=2504493048"
"90","18:49:51.074959","192.168.0.227","5.28.195.2","TLSv1","583","Client Hello"
"91","18:49:51.117171","5.28.195.2","192.168.0.227","TCP","66","443  >  49848 [ACK] Seq=1 Ack=518 Win=67584 Len=0 TSval=2504493089 TSecr=871881471"
"92","18:49:51.117173","5.28.195.2","192.168.0.227","TCP","66","443  >  49848 [FIN, ACK] Seq=1 Ack=518 Win=67584 Len=0 TSval=2504493089 TSecr=871881471"
"93","18:49:51.117373","192.168.0.227","5.28.195.2","TCP","66","49848  >  443 [ACK] Seq=518 Ack=2 Win=1048560 Len=0 TSval=871881514 TSecr=2504493089"
"94","18:49:51.117565","192.168.0.227","5.28.195.2","TCP","66","49848  >  443 [FIN, ACK] Seq=518 Ack=2 Win=1048560 Len=0 TSval=871881514 TSecr=2504493089"
"95","18:49:51.160307","5.28.195.2","192.168.0.227","TCP","56","443  >  49848 [RST] Seq=2 Win=0 Len=0"
"96","18:49:51.182681","64.65.63.120","192.168.0.227","TCP","1474","443  >  64520 [ACK] Seq=537 Ack=3151 Win=8096 Len=1408 TSval=2517506800 TSecr=1566610569 [TCP PDU reassembled in 98]"
"97","18:49:51.182685","64.65.63.120","192.168.0.227","TCP","1474","443  >  64520 [PSH, ACK] Seq=1945 Ack=3151 Win=8096 Len=1408 TSval=2517506800 TSecr=1566610569 [TCP PDU reassembled in 98]"
"98","18:49:51.182688","64.65.63.120","192.168.0.227","TLSv1.2","870","Application Data"
"99","18:49:51.182953","192.168.0.227","64.65.63.120","TCP","66","64520  >  443 [ACK] Seq=3151 Ack=1945 Win=16194 Len=0 TSval=1566610740 TSecr=2517506800"
"100","18:49:51.183037","192.168.0.227","64.65.63.120","TCP","66","64520  >  443 [ACK] Seq=3151 Ack=4157 Win=16160 Len=0 TSval=1566610741 TSecr=2517506800"
"101","18:49:51.183163","192.168.0.227","64.65.63.120","TCP","66","[TCP Window Update] 64520  >  443 [ACK] Seq=3151 Ack=4157 Win=16216 Len=0 TSval=1566610741 TSecr=2517506800"
"102","18:49:51.188582","2a01:b740:1361:101::2:4","2a02:ab88:b:4100:4977:d98a:d5e5:5d47","TLSv1.2","785","Application Data"
"103","18:49:51.188942","2a02:ab88:b:4100:4977:d98a:d5e5:5d47","2a01:b740:1361:101::2:4","TCP","86","50273  >  443 [ACK] Seq=634 Ack=700 Win=2038 Len=0 TSval=1042514538 TSecr=2815134154"
"104","18:49:51.212122","64.65.63.120","192.168.0.227","TCP","1474","443  >  64520 [ACK] Seq=4157 Ack=3151 Win=8096 Len=1408 TSval=2517506831 TSecr=1566610569 [TCP PDU reassembled in 111]"
"105","18:49:51.212126","64.65.63.120","192.168.0.227","TCP","1474","443  >  64520 [PSH, ACK] Seq=5565 Ack=3151 Win=8096 Len=1408 TSval=2517506831 TSecr=1566610569 [TCP PDU reassembled in 111]"
"106","18:49:51.212339","192.168.0.227","64.65.63.120","TCP","66","64520  >  443 [ACK] Seq=3151 Ack=6973 Win=16172 Len=0 TSval=1566610770 TSecr=2517506831"
"107","18:49:51.212510","192.168.0.227","64.65.63.120","TCP","66","[TCP Window Update] 64520  >  443 [ACK] Seq=3151 Ack=6973 Win=16216 Len=0 TSval=1566610770 TSecr=2517506831"
"108","18:49:51.219054","2a02:ab88:b:4100:4977:d98a:d5e5:5d47","2a01:b740:1361:101::2:4","TLSv1.2","237","Application Data"
"109","18:49:51.219362","2a02:ab88:b:4100:4977:d98a:d5e5:5d47","2a01:b740:1361:101::2:4","TLSv1.2","752","Application Data"
"110","18:49:51.219452","2a02:ab88:b:4100:4977:d98a:d5e5:5d47","2a01:b740:1361:101::2:4","TLSv1.2","117","Application Data"
"111","18:49:51.227850","64.65.63.120","192.168.0.227","TLSv1.2","356","Application Data"
"112","18:49:51.228050","192.168.0.227","64.65.63.120","TCP","66","64520  >  443 [ACK] Seq=3151 Ack=7263 Win=16212 Len=0 TSval=1566610785 TSecr=2517506849"
"113","18:49:51.230485","192.168.0.227","64.65.63.120","TLSv1.2","602","Application Data"
"114","18:49:51.274943","64.65.63.120","192.168.0.227","TCP","66","443  >  64520 [ACK] Seq=7263 Ack=3687 Win=8096 Len=0 TSval=2517506893 TSecr=1566610788"
"115","18:49:51.275087","192.168.0.227","64.65.63.120","TLSv1.2","602","Application Data"
"116","18:49:51.297162","fe80::8f4:f6e1:77d0:ab3e","fe80::1864:4d30:9585:912f","ICMPv6","86","Neighbor Solicitation for fe80::1864:4d30:9585:912f from 2a:32:1e:8d:54:98"
"117","18:49:51.302383","fe80::1864:4d30:9585:912f","fe80::8f4:f6e1:77d0:ab3e","ICMPv6","78","Neighbor Advertisement fe80::1864:4d30:9585:912f (sol)"
"118","18:49:51.317025","2a02:ab88:b:4100:4977:d98a:d5e5:5d47","2a09:bac0:1008:1000:0:100:7b:46","UDP","103","53662  >  443 Len=41"
"119","18:49:51.318623","64.65.63.120","192.168.0.227","TCP","66","443  >  64520 [ACK] Seq=7263 Ack=4223 Win=8096 Len=0 TSval=2517506937 TSecr=1566610833"
"120","18:49:51.327950","2a09:bac0:1008:1000:0:100:7b:46","2a02:ab88:b:4100:4977:d98a:d5e5:5d47","UDP","93","443  >  53662 Len=31"
"121","18:49:51.389801","64.65.63.120","192.168.0.227","TLSv1.2","1116","Application Data"
"122","18:49:51.389959","192.168.0.227","64.65.63.120","TCP","66","64520  >  443 [ACK] Seq=4223 Ack=8313 Win=16200 Len=0 TSval=1566610947 TSecr=2517507007"
"123","18:49:51.390564","192.168.0.227","64.65.63.120","TLSv1.2","602","Application Data"
"124","18:49:51.436698","64.65.63.120","192.168.0.227","TCP","66","443  >  64520 [ACK] Seq=8313 Ack=4759 Win=8096 Len=0 TSval=2517507053 TSecr=1566610948"
"125","18:49:51.438124","192.168.0.227","149.154.167.41","SSL","251","Continuation Data"
"126","18:49:51.445426","64.65.63.120","192.168.0.227","TLSv1.2","602","Application Data"
"127","18:49:51.445606","192.168.0.227","64.65.63.120","TCP","66","64520  >  443 [ACK] Seq=4759 Ack=8849 Win=16208 Len=0 TSval=1566611003 TSecr=2517507063"
"128","18:49:51.480807","149.154.167.41","192.168.0.227","TCP","70","443  >  64334 [PSH, ACK] Seq=1 Ack=186 Win=13054 Len=4 TSval=78156216 TSecr=1541159400 [TCP PDU reassembled in 131]"
"129","18:49:51.480964","192.168.0.227","149.154.167.41","TCP","66","64334  >  443 [ACK] Seq=186 Ack=5 Win=65535 Len=0 TSval=1541159442 TSecr=78156216"
"130","18:49:51.513661","192.168.0.227","5.28.195.2","TCP","78","49849  >  443 [SYN, ECE, CWR] Seq=0 Win=65535 Len=0 MSS=1460 WS=16 TSval=7196305 TSecr=0 SACK_PERM"
"131","18:49:51.514230","149.154.167.41","192.168.0.227","SSL","299","Continuation Data"
"132","18:49:51.514314","192.168.0.227","149.154.167.41","TCP","66","64334  >  443 [ACK] Seq=186 Ack=238 Win=65522 Len=0 TSval=1541159476 TSecr=78156250"
"133","18:49:51.520860","64.65.63.120","192.168.0.227","TCP","1474","443  >  64520 [ACK] Seq=8849 Ack=4759 Win=8096 Len=1408 TSval=2517507138 TSecr=1566611003 [TCP PDU reassembled in 135]"
"134","18:49:51.520863","64.65.63.120","192.168.0.227","TCP","1474","443  >  64520 [PSH, ACK] Seq=10257 Ack=4759 Win=8096 Len=1408 TSval=2517507138 TSecr=1566611003 [TCP PDU reassembled in 135]"
"135","18:49:51.520865","64.65.63.120","192.168.0.227","TLSv1.2","870","Application Data"
"136","18:49:51.521034","192.168.0.227","64.65.63.120","TCP","66","64520  >  443 [ACK] Seq=4759 Ack=12469 Win=16160 Len=0 TSval=1566611078 TSecr=2517507138"
"137","18:49:51.521164","192.168.0.227","64.65.63.120","TCP","66","[TCP Window Update] 64520  >  443 [ACK] Seq=4759 Ack=12469 Win=16216 Len=0 TSval=1566611079 TSecr=2517507138"
"138","18:49:51.521397","192.168.0.227","64.65.63.120","TLSv1.2","602","Application Data"
"139","18:49:51.553054","5.28.195.2","192.168.0.227","TCP","74","443  >  49849 [SYN, ACK, ECE] Seq=0 Ack=1 Win=65535 Len=0 MSS=1240 SACK_PERM TSval=2910828352 TSecr=7196305 WS=1024"
"140","18:49:51.553057","2a01:b740:1361:101::2:4","2a02:ab88:b:4100:4977:d98a:d5e5:5d47","TCP","86","443  >  50273 [ACK] Seq=700 Ack=1482 Win=35 Len=0 TSval=2815134519 TSecr=1042514568"
"141","18:49:51.553255","192.168.0.227","5.28.195.2","TCP","66","49849  >  443 [ACK] Seq=1 Ack=1 Win=1048560 Len=0 TSval=7196345 TSecr=2910828352"
"142","18:49:51.553401","192.168.0.227","5.28.195.2","TLSv1","583","Client Hello"
"143","18:49:51.556340","64.65.63.120","192.168.0.227","TCP","1474","443  >  64520 [ACK] Seq=12469 Ack=4759 Win=8096 Len=1408 TSval=2517507177 TSecr=1566611003 [TCP PDU reassembled in 147]"
"144","18:49:51.556342","64.65.63.120","192.168.0.227","TCP","1474","443  >  64520 [PSH, ACK] Seq=13877 Ack=4759 Win=8096 Len=1408 TSval=2517507177 TSecr=1566611003 [TCP PDU reassembled in 147]"
"145","18:49:51.556445","192.168.0.227","64.65.63.120","TCP","66","64520  >  443 [ACK] Seq=5295 Ack=15285 Win=16172 Len=0 TSval=1566611114 TSecr=2517507177"
"146","18:49:51.556581","192.168.0.227","64.65.63.120","TCP","66","[TCP Window Update] 64520  >  443 [ACK] Seq=5295 Ack=15285 Win=16216 Len=0 TSval=1566611114 TSecr=2517507177"
"147","18:49:51.567641","64.65.63.120","192.168.0.227","TLSv1.2","870","Application Data"
"148","18:49:51.567743","192.168.0.227","64.65.63.120","TCP","66","64520  >  443 [ACK] Seq=5295 Ack=16089 Win=16204 Len=0 TSval=1566611125 TSecr=2517507187"
"149","18:49:51.580020","192.168.0.227","5.28.195.2","TCP","78","[TCP Retransmission] 49846  >  5222 [SYN] Seq=0 Win=65535 Len=0 MSS=1460 WS=16 TSval=37562921 TSecr=0 SACK_PERM"
"150","18:49:51.580079","192.168.0.227","5.28.195.2","TCP","78","[TCP Retransmission] 49844  >  80 [SYN] Seq=0 Win=65535 Len=0 MSS=1460 WS=16 TSval=2854491140 TSecr=0 SACK_PERM"
"151","18:49:51.596062","64.65.63.120","192.168.0.227","TCP","1474","443  >  64520 [ACK] Seq=16089 Ack=5295 Win=8096 Len=1408 TSval=2517507217 TSecr=1566611079 [TCP PDU reassembled in 153]"
"152","18:49:51.596066","64.65.63.120","192.168.0.227","TCP","1474","443  >  64520 [PSH, ACK] Seq=17497 Ack=5295 Win=8096 Len=1408 TSval=2517507217 TSecr=1566611079 [TCP PDU reassembled in 153]"
"153","18:49:51.596068","64.65.63.120","192.168.0.227","TLSv1.2","1474","Application Data"
"154","18:49:51.596281","192.168.0.227","64.65.63.120","TCP","66","64520  >  443 [ACK] Seq=5295 Ack=20313 Win=16150 Len=0 TSval=1566611154 TSecr=2517507217"
"155","18:49:51.596469","192.168.0.227","64.65.63.120","TCP","66","[TCP Window Update] 64520  >  443 [ACK] Seq=5295 Ack=20313 Win=16216 Len=0 TSval=1566611154 TSecr=2517507217"
"156","18:49:51.597782","5.28.195.2","192.168.0.227","TCP","66","443  >  49849 [ACK] Seq=1 Ack=518 Win=67584 Len=0 TSval=2910828442 TSecr=7196345"
"157","18:49:51.597784","5.28.195.2","192.168.0.227","TCP","66","443  >  49849 [FIN, ACK] Seq=1 Ack=518 Win=67584 Len=0 TSval=2910828442 TSecr=7196345"
"158","18:49:51.597896","192.168.0.227","5.28.195.2","TCP","66","49849  >  443 [ACK] Seq=518 Ack=2 Win=1048560 Len=0 TSval=7196389 TSecr=2910828442"
"159","18:49:51.598034","192.168.0.227","5.28.195.2","TCP","66","49849  >  443 [FIN, ACK] Seq=518 Ack=2 Win=1048560 Len=0 TSval=7196390 TSecr=2910828442"
"160","18:49:51.608315","64.65.63.120","192.168.0.227","TLSv1.2","512","Application Data"
"161","18:49:51.608446","192.168.0.227","64.65.63.120","TCP","66","64520  >  443 [ACK] Seq=5295 Ack=20759 Win=16210 Len=0 TSval=1566611166 TSecr=2517507230"
"162","18:49:51.642943","5.28.195.2","192.168.0.227","TCP","56","443  >  49849 [RST] Seq=2 Win=0 Len=0"
"163","18:49:51.659534","192.168.0.227","64.65.63.120","TLSv1.2","602","Application Data"
"164","18:49:51.697564","2a01:b740:1361:101::2:4","2a02:ab88:b:4100:4977:d98a:d5e5:5d47","TLSv1.2","738","Application Data"
"165","18:49:51.697566","2a01:b740:1361:101::2:4","2a02:ab88:b:4100:4977:d98a:d5e5:5d47","TLSv1.2","117","Application Data"
"166","18:49:51.697767","2a02:ab88:b:4100:4977:d98a:d5e5:5d47","2a01:b740:1361:101::2:4","TCP","86","50273  >  443 [ACK] Seq=1482 Ack=1383 Win=2038 Len=0 TSval=1042515047 TSecr=2815134664"
"167","18:49:51.741486","64.65.63.120","192.168.0.227","TCP","66","443  >  64520 [ACK] Seq=20759 Ack=5831 Win=8096 Len=0 TSval=2517507364 TSecr=1566611217"
"168","18:49:51.806038","192.168.0.227","64.65.63.120","TLSv1.2","602","Application Data"
"169","18:49:51.809975","64.65.63.120","192.168.0.227","TLSv1.2","602","Application Data"
"170","18:49:51.810041","192.168.0.227","64.65.63.120","TLSv1.2","602","Application Data"
"171","18:49:51.810679","192.168.0.227","64.65.63.120","TCP","1474","64520  >  443 [ACK] Seq=6903 Ack=21295 Win=16216 Len=1408 TSval=1566611368 TSecr=2517507432 [TCP PDU reassembled in 172]"
"172","18:49:51.810693","192.168.0.227","64.65.63.120","TLSv1.2","736","Application Data"
"173","18:49:51.847482","64.65.63.120","192.168.0.227","TCP","66","443  >  64520 [ACK] Seq=21295 Ack=6367 Win=8096 Len=0 TSval=2517507468 TSecr=1566611364"
"174","18:49:51.851650","64.65.63.120","192.168.0.227","TCP","66","443  >  64520 [ACK] Seq=21295 Ack=6903 Win=8096 Len=0 TSval=2517507472 TSecr=1566611368"
"175","18:49:51.856180","64.65.63.120","192.168.0.227","TCP","66","443  >  64520 [ACK] Seq=21295 Ack=8981 Win=8129 Len=0 TSval=2517507477 TSecr=1566611368"
"176","18:49:52.006226","64.65.63.120","192.168.0.227","TCP","1474","443  >  64520 [ACK] Seq=21295 Ack=8981 Win=8129 Len=1408 TSval=2517507626 TSecr=1566611368 [TCP PDU reassembled in 178]"
"177","18:49:52.006229","64.65.63.120","192.168.0.227","TCP","1474","443  >  64520 [PSH, ACK] Seq=22703 Ack=8981 Win=8129 Len=1408 TSval=2517507626 TSecr=1566611368 [TCP PDU reassembled in 178]"
"178","18:49:52.006230","64.65.63.120","192.168.0.227","TLSv1.2","870","Application Data"
"179","18:49:52.006340","192.168.0.227","64.65.63.120","TCP","66","64520  >  443 [ACK] Seq=8981 Ack=24915 Win=16160 Len=0 TSval=1566611564 TSecr=2517507626"
"180","18:49:52.006437","192.168.0.227","64.65.63.120","TCP","66","[TCP Window Update] 64520  >  443 [ACK] Seq=8981 Ack=24915 Win=16216 Len=0 TSval=1566611564 TSecr=2517507626"
"181","18:49:52.046018","64.65.63.120","192.168.0.227","TLSv1.2","1474","Application Data"
"182","18:49:52.046020","64.65.63.120","192.168.0.227","TCP","1474","443  >  64520 [PSH, ACK] Seq=26323 Ack=8981 Win=8129 Len=1408 TSval=2517507667 TSecr=1566611368 [TCP PDU reassembled in 184]"
"183","18:49:52.046022","64.65.63.120","192.168.0.227","TCP","1474","443  >  64520 [ACK] Seq=27731 Ack=8981 Win=8129 Len=1408 TSval=2517507667 TSecr=1566611368 [TCP PDU reassembled in 184]"
"184","18:49:52.046024","64.65.63.120","192.168.0.227","TLSv1.2","512","Application Data"
"185","18:49:52.046142","192.168.0.227","64.65.63.120","TCP","66","64520  >  443 [ACK] Seq=8981 Ack=29585 Win=16144 Len=0 TSval=1566611604 TSecr=2517507668"
"186","18:49:52.046252","192.168.0.227","64.65.63.120","TCP","66","[TCP Window Update] 64520  >  443 [ACK] Seq=8981 Ack=29585 Win=16216 Len=0 TSval=1566611604 TSecr=2517507668"
"187","18:49:52.046356","192.168.0.227","64.65.63.120","TLSv1.2","602","Application Data"
"188","18:49:52.069926","64.65.63.120","192.168.0.227","TCP","1474","443  >  64520 [ACK] Seq=29585 Ack=8981 Win=8129 Len=1408 TSval=2517507691 TSecr=1566611564 [TCP PDU reassembled in 192]"
"189","18:49:52.069928","64.65.63.120","192.168.0.227","TCP","1474","443  >  64520 [PSH, ACK] Seq=30993 Ack=8981 Win=8129 Len=1408 TSval=2517507691 TSecr=1566611564 [TCP PDU reassembled in 192]"
"190","18:49:52.070039","192.168.0.227","64.65.63.120","TCP","66","64520  >  443 [ACK] Seq=9517 Ack=32401 Win=16172 Len=0 TSval=1566611628 TSecr=2517507691"
"191","18:49:52.070179","192.168.0.227","64.65.63.120","TCP","66","[TCP Window Update] 64520  >  443 [ACK] Seq=9517 Ack=32401 Win=16216 Len=0 TSval=1566611628 TSecr=2517507691"
"192","18:49:52.086838","64.65.63.120","192.168.0.227","TLSv1.2","356","Application Data"
"193","18:49:52.086971","192.168.0.227","64.65.63.120","TCP","66","64520  >  443 [ACK] Seq=9517 Ack=32691 Win=16216 Len=0 TSval=1566611644 TSecr=2517507708"
"194","18:49:52.089135","192.168.0.227","64.65.63.120","TLSv1.2","1474","Application Data"
"195","18:49:52.089146","192.168.0.227","64.65.63.120","TLSv1.2","244","Application Data"
"196","18:49:52.090684","64.65.63.120","192.168.0.227","TCP","66","443  >  64520 [ACK] Seq=32691 Ack=9517 Win=8129 Len=0 TSval=2517507712 TSecr=1566611604"
"197","18:49:52.133737","64.65.63.120","192.168.0.227","TCP","66","443  >  64520 [ACK] Seq=32691 Ack=10925 Win=8151 Len=0 TSval=2517507754 TSecr=1566611647"
"198","18:49:52.133739","64.65.63.120","192.168.0.227","TCP","66","443  >  64520 [ACK] Seq=32691 Ack=11103 Win=8151 Len=0 TSval=2517507754 TSecr=1566611647"
"199","18:49:52.290173","64.65.63.120","192.168.0.227","TLSv1.2","602","Application Data"
"200","18:49:52.290342","192.168.0.227","64.65.63.120","TCP","66","64520  >  443 [ACK] Seq=11103 Ack=33227 Win=16216 Len=0 TSval=1566611848 TSecr=2517507908"
"201","18:49:52.373964","64.65.63.120","192.168.0.227","TLSv1.2","602","Application Data"
"202","18:49:52.374205","192.168.0.227","64.65.63.120","TCP","66","64520  >  443 [ACK] Seq=11103 Ack=33763 Win=16216 Len=0 TSval=1566611932 TSecr=2517507993"
"203","18:49:52.374746","192.168.0.227","64.65.63.120","TLSv1.2","602","Application Data"
"204","18:49:52.421964","64.65.63.120","192.168.0.227","TCP","66","443  >  64520 [ACK] Seq=33763 Ack=11639 Win=8151 Len=0 TSval=2517508042 TSecr=1566611932"
"205","18:49:52.579680","192.168.0.227","5.28.195.2","TCP","78","[TCP Retransmission] 49846  >  5222 [SYN] Seq=0 Win=65535 Len=0 MSS=1460 WS=16 TSval=37563921 TSecr=0 SACK_PERM"
"206","18:49:52.579758","192.168.0.227","5.28.195.2","TCP","78","[TCP Retransmission] 49844  >  80 [SYN] Seq=0 Win=65535 Len=0 MSS=1460 WS=16 TSval=2854492140 TSecr=0 SACK_PERM"
"207","18:49:52.735860","2a00:1450:400d:80f::200a","2a02:ab88:b:4100:4977:d98a:d5e5:5d47","TLSv1.2","171","Application Data"
"208","18:49:52.736090","2a02:ab88:b:4100:4977:d98a:d5e5:5d47","2a00:1450:400d:80f::200a","TCP","86","50034  >  443 [ACK] Seq=1 Ack=86 Win=2047 Len=0 TSval=4135572380 TSecr=1002305712"
"209","18:49:53.102889","64.65.63.120","192.168.0.227","TCP","1474","443  >  64520 [ACK] Seq=33763 Ack=11639 Win=8151 Len=1408 TSval=2517508578 TSecr=1566611932 [TCP PDU reassembled in 211]"
"210","18:49:53.102893","64.65.63.120","192.168.0.227","TCP","1474","443  >  64520 [PSH, ACK] Seq=35171 Ack=11639 Win=8151 Len=1408 TSval=2517508578 TSecr=1566611932 [TCP PDU reassembled in 211]"
"211","18:49:53.102896","64.65.63.120","192.168.0.227","TLSv1.2","870","Application Data"
"212","18:49:53.102898","64.65.63.120","192.168.0.227","TCP","1474","443  >  64520 [ACK] Seq=37383 Ack=11639 Win=8151 Len=1408 TSval=2517508623 TSecr=1566611932 [TCP PDU reassembled in 214]"
"213","18:49:53.103232","192.168.0.227","64.65.63.120","TCP","66","64520  >  443 [ACK] Seq=11639 Ack=38791 Win=16216 Len=0 TSval=1566612661 TSecr=2517508623"
"214","18:49:53.109796","64.65.63.120","192.168.0.227","TLSv1.2","1250","Application Data"
"215","18:49:53.109920","192.168.0.227","64.65.63.120","TCP","66","64520  >  443 [ACK] Seq=11639 Ack=39975 Win=16216 Len=0 TSval=1566612668 TSecr=2517508729"
"216","18:49:53.479187","2a02:ab88:b:4100:4977:d98a:d5e5:5d47","2603:1063:28::2","TLSv1.2","137","Application Data"
"217","18:49:53.511578","2603:1063:28::2","2a02:ab88:b:4100:4977:d98a:d5e5:5d47","TLSv1.2","126","Application Data"
"218","18:49:53.511748","2a02:ab88:b:4100:4977:d98a:d5e5:5d47","2603:1063:28::2","TCP","86","52605  >  443 [ACK] Seq=52 Ack=41 Win=2048 Len=0 TSval=3665412946 TSecr=503520666"
"219","18:49:53.574813","2a02:ab88:b:4100:4977:d98a:d5e5:5d47","2a09:bac0:1008:5000:1000::bc","UDP","103","60159  >  443 Len=41"
"220","18:49:53.614120","192.168.0.220","224.0.0.251","MDNS","568","Standard query response 0x0000 TXT, cache flush PTR _asquic._udp.local PTR 40157DD4-09B2-4EE7-8234-8FF04F58061A._asquic._udp.local SRV, cache flush 0 0 59044 Nikas-iPhone.local PTR, cache flush Nikas-iPhone.local PTR, cache flush Nikas-iPhone.local PTR, cache flush Nikas-iPhone.local AAAA, cache flush 2a02:ab88:b:4100:1438:22cd:a64a:6b34 AAAA, cache flush fe80::1864:4d30:9585:912f A, cache flush 192.168.0.220 NSEC, cache flush 40157DD4-09B2-4EE7-8234-8FF04F58061A._asquic._udp.local NSEC, cache flush F.2.1.9.5.8.5.9.0.3.D.4.4.6.8.1.0.0.0.0.0.0.0.0.0.0.0.0.0.8.E.F.ip6.arpa NSEC, cache flush 220.0.168.192.in-addr.arpa NSEC, cache flush 4.3.B.6.A.4.6.A.D.C.2.2.8.3.4.1.0.0.1.4.B.0.0.0.8.8.B.A.2.0.A.2.ip6.arpa NSEC, cache flush Nikas-iPhone.local"
"221","18:49:53.614124","fe80::1864:4d30:9585:912f","ff02::fb","MDNS","588","Standard query response 0x0000 TXT, cache flush PTR _asquic._udp.local PTR 40157DD4-09B2-4EE7-8234-8FF04F58061A._asquic._udp.local SRV, cache flush 0 0 59044 Nikas-iPhone.local PTR, cache flush Nikas-iPhone.local PTR, cache flush Nikas-iPhone.local PTR, cache flush Nikas-iPhone.local AAAA, cache flush 2a02:ab88:b:4100:1438:22cd:a64a:6b34 AAAA, cache flush fe80::1864:4d30:9585:912f A, cache flush 192.168.0.220 NSEC, cache flush 40157DD4-09B2-4EE7-8234-8FF04F58061A._asquic._udp.local NSEC, cache flush F.2.1.9.5.8.5.9.0.3.D.4.4.6.8.1.0.0.0.0.0.0.0.0.0.0.0.0.0.8.E.F.ip6.arpa NSEC, cache flush 220.0.168.192.in-addr.arpa NSEC, cache flush 4.3.B.6.A.4.6.A.D.C.2.2.8.3.4.1.0.0.1.4.B.0.0.0.8.8.B.A.2.0.A.2.ip6.arpa NSEC, cache flush Nikas-iPhone.local"
"222","18:49:53.637940","2a09:bac0:1008:5000:1000::bc","2a02:ab88:b:4100:4977:d98a:d5e5:5d47","UDP","93","443  >  60159 Len=31"
"223","18:49:54.222616","192.168.0.227","192.87.28.82","TLSv1.2","602","Application Data"
"224","18:49:54.301131","192.87.28.82","192.168.0.227","TCP","66","9001  >  64519 [ACK] Seq=1 Ack=1073 Win=3520 Len=0 TSval=1327458357 TSecr=1556427513"
"225","18:49:54.314514","64.65.63.120","192.168.0.227","TLSv1.2","602","Application Data"
