"No.","Time","Source","Destination","Protocol","Length","Info"
"1","18:51:13.023308","192.168.0.227","64.65.63.120","TLSv1.2","602","Application Data"
"2","18:51:13.023389","192.168.0.227","192.87.28.82","TLSv1.2","602","Application Data"
"3","18:51:13.068717","64.65.63.120","192.168.0.227","TCP","66","443  >  64520 [ACK] Seq=1 Ack=537 Win=8301 Len=0 TSval=2517588694 TSecr=1566692584"
"4","18:51:13.108731","192.87.28.82","192.168.0.227","TCP","66","9001  >  64519 [ACK] Seq=1 Ack=537 Win=3520 Len=0 TSval=1327537165 TSecr=1556506317"
"5","18:51:13.476637","2a02:ab88:b:4100:4977:d98a:d5e5:5d47","2603:1063:28::2","TLSv1.2","137","Application Data"
"6","18:51:13.510761","2603:1063:28::2","2a02:ab88:b:4100:4977:d98a:d5e5:5d47","TLSv1.2","126","Application Data"
"7","18:51:13.511079","2a02:ab88:b:4100:4977:d98a:d5e5:5d47","2603:1063:28::2","TCP","86","52605  >  443 [ACK] Seq=52 Ack=41 Win=2048 Len=0 TSval=3665492949 TSecr=503600663"
"8","18:51:13.587402","fe80::ae22:5ff:feaa:607e","2a02:ab88:b:4100:4977:d98a:d5e5:5d47","ICMPv6","86","Neighbor Solicitation for 2a02:ab88:b:4100:4977:d98a:d5e5:5d47 from ac:22:05:aa:60:7e"
"9","18:51:13.587579","fe80::8f4:f6e1:77d0:ab3e","fe80::ae22:5ff:feaa:607e","ICMPv6","78","Neighbor Advertisement 2a02:ab88:b:4100:4977:d98a:d5e5:5d47 (sol)"
"10","18:51:13.591391","192.168.0.227","5.28.195.2","TCP","78","49974  >  80 [SYN] Seq=0 Win=65535 Len=0 MSS=1460 WS=16 TSval=3724974179 TSecr=0 SACK_PERM"
"11","18:51:13.591435","192.168.0.227","5.28.195.2","TCP","78","49975  >  5222 [SYN] Seq=0 Win=65535 Len=0 MSS=1460 WS=16 TSval=2099942437 TSecr=0 SACK_PERM"
"12","18:51:14.592533","192.168.0.227","5.28.195.2","TCP","78","[TCP Retransmission] 49974  >  80 [SYN] Seq=0 Win=65535 Len=0 MSS=1460 WS=16 TSval=3724975181 TSecr=0 SACK_PERM"
"13","18:51:14.592572","192.168.0.227","5.28.195.2","TCP","78","[TCP Retransmission] 49975  >  5222 [SYN] Seq=0 Win=65535 Len=0 MSS=1460 WS=16 TSval=2099943439 TSecr=0 SACK_PERM"
"14","18:51:14.726163","2a00:1450:400d:80f::200a","2a02:ab88:b:4100:4977:d98a:d5e5:5d47","TLSv1.2","171","Application Data"
"15","18:51:14.726401","2a02:ab88:b:4100:4977:d98a:d5e5:5d47","2a00:1450:400d:80f::200a","TCP","86","50034  >  443 [ACK] Seq=1 Ack=86 Win=2047 Len=0 TSval=4135654373 TSecr=1002387704"
"16","18:51:15.477565","192.168.0.227","192.87.28.82","TLSv1.2","602","Application Data"
"17","18:51:15.558439","192.87.28.82","192.168.0.227","TCP","66","9001  >  64519 [ACK] Seq=1 Ack=1073 Win=3520 Len=0 TSval=1327539612 TSecr=1556508772"
"18","18:51:15.558443","64.65.63.120","192.168.0.227","TLSv1.2","602","Application Data"
"19","18:51:15.558753","192.168.0.227","64.65.63.120","TCP","66","64520  >  443 [ACK] Seq=537 Ack=537 Win=16208 Len=0 TSval=1566695120 TSecr=2517591185"
"20","18:51:15.594248","192.168.0.227","5.28.195.2","TCP","78","[TCP Retransmission] 49974  >  80 [SYN] Seq=0 Win=65535 Len=0 MSS=1460 WS=16 TSval=3724976182 TSecr=0 SACK_PERM"
"21","18:51:15.594330","192.168.0.227","5.28.195.2","TCP","78","[TCP Retransmission] 49975  >  5222 [SYN] Seq=0 Win=65535 Len=0 MSS=1460 WS=16 TSval=2099944440 TSecr=0 SACK_PERM"
"22","18:51:16.560098","CompalBroadb_aa:60:7e","2a:32:1e:8d:54:98","ARP","56","Who has 192.168.0.227? Tell 192.168.0.1"
"23","18:51:16.560200","2a:32:1e:8d:54:98","CompalBroadb_aa:60:7e","ARP","42","192.168.0.227 is at 2a:32:1e:8d:54:98"
"24","18:51:16.594876","192.168.0.227","5.28.195.2","TCP","78","[TCP Retransmission] 49974  >  80 [SYN] Seq=0 Win=65535 Len=0 MSS=1460 WS=16 TSval=3724977183 TSecr=0 SACK_PERM"
"25","18:51:16.594959","192.168.0.227","5.28.195.2","TCP","78","[TCP Retransmission] 49975  >  5222 [SYN] Seq=0 Win=65535 Len=0 MSS=1460 WS=16 TSval=2099945441 TSecr=0 SACK_PERM"
"26","18:51:16.917187","192.168.0.227","31.192.108.181","TLSv1.2","576","Application Data"
"27","18:51:16.973303","31.192.108.181","192.168.0.227","TCP","66","443  >  61494 [ACK] Seq=1 Ack=511 Win=41 Len=0 TSval=3132204317 TSecr=2676461644"
"28","18:51:17.009122","192.168.0.227","17.137.162.3","TCP","78","61507  >  443 [SYN, ECE, CWR] Seq=0 Win=65535 Len=0 MSS=1460 WS=64 TSval=2946680150 TSecr=0 SACK_PERM"
"29","18:51:17.021652","192.168.0.227","192.87.28.82","TLSv1.2","602","Application Data"
"30","18:51:17.060241","31.192.108.181","192.168.0.227","TLSv1.2","237","Application Data"
"31","18:51:17.060419","192.168.0.227","31.192.108.181","TCP","66","61494  >  443 [ACK] Seq=511 Ack=172 Win=2046 Len=0 TSval=2676461788 TSecr=3132204410"
"32","18:51:17.062119","192.168.0.227","17.137.162.3","TCP","78","61508  >  443 [SYN, ECE, CWR] Seq=0 Win=65535 Len=0 MSS=1460 WS=64 TSval=4000133895 TSecr=0 SACK_PERM"
"33","18:51:17.073911","31.192.108.181","192.168.0.227","TLSv1.2","276","Application Data"
"34","18:51:17.074096","192.168.0.227","31.192.108.181","TCP","66","61494  >  443 [ACK] Seq=511 Ack=382 Win=2045 Len=0 TSval=2676461801 TSecr=3132204423"
"35","18:51:17.075327","192.168.0.227","31.192.108.181","TLSv1.2","250","Application Data"
"36","18:51:17.080389","31.192.108.181","192.168.0.227","TLSv1.2","276","Application Data"
"37","18:51:17.080501","192.168.0.227","31.192.108.181","TCP","66","61494  >  443 [ACK] Seq=695 Ack=592 Win=2045 Len=0 TSval=2676461808 TSecr=3132204433"
"38","18:51:17.081506","192.168.0.227","31.192.108.181","TLSv1.2","250","Application Data"
"39","18:51:17.099441","192.87.28.82","192.168.0.227","TCP","66","9001  >  64519 [ACK] Seq=1 Ack=1609 Win=3520 Len=0 TSval=1327541154 TSecr=1556510316"
"40","18:51:17.125444","31.192.108.181","192.168.0.227","TLSv1.2","257","Application Data"
"41","18:51:17.125446","31.192.108.181","192.168.0.227","TLSv1.2","257","Application Data"
"42","18:51:17.125662","192.168.0.227","31.192.108.181","TCP","66","61494  >  443 [ACK] Seq=879 Ack=974 Win=2043 Len=0 TSval=2676461853 TSecr=3132204478"
"43","18:51:17.127016","31.192.108.181","192.168.0.227","TCP","66","443  >  61494 [ACK] Seq=592 Ack=695 Win=41 Len=0 TSval=3132204478 TSecr=2676461803"
"44","18:51:17.127018","31.192.108.181","192.168.0.227","TCP","66","443  >  61494 [ACK] Seq=592 Ack=879 Win=41 Len=0 TSval=3132204478 TSecr=2676461809"
"45","18:51:17.127104","192.168.0.227","31.192.108.181","TCP","66","[TCP Window Update] 61494  >  443 [ACK] Seq=879 Ack=974 Win=2048 Len=0 TSval=2676461854 TSecr=3132204478"
"46","18:51:17.180408","17.137.162.3","192.168.0.227","TCP","74","443  >  61507 [SYN, ACK, ECE] Seq=0 Ack=1 Win=28960 Len=0 MSS=1420 SACK_PERM TSval=3211618397 TSecr=2946680150 WS=2048"
"47","18:51:17.181381","192.168.0.227","17.137.162.3","TCP","66","61507  >  443 [ACK] Seq=1 Ack=1 Win=132352 Len=0 TSval=2946680322 TSecr=3211618397"
"48","18:51:17.181422","192.168.0.227","17.137.162.3","TCP","1474","61507  >  443 [ACK] Seq=1 Ack=1 Win=132352 Len=1408 TSval=2946680323 TSecr=3211618397 [TCP PDU reassembled in 49]"
"49","18:51:17.181428","192.168.0.227","17.137.162.3","TLSv1.3","192","Client Hello (SNI=gdmf.apple.com)"
"50","18:51:17.196700","64.65.63.120","192.168.0.227","TLSv1.2","602","Application Data"
"51","18:51:17.196826","192.168.0.227","64.65.63.120","TCP","66","64520  >  443 [ACK] Seq=537 Ack=1073 Win=16208 Len=0 TSval=1566696758 TSecr=2517592822"
"52","18:51:17.197781","192.168.0.227","192.87.28.82","TCP","1474","64519  >  9001 [ACK] Seq=1609 Ack=1 Win=22794 Len=1408 TSval=1556510492 TSecr=1327541154 [TCP PDU reassembled in 53]"
"53","18:51:17.197797","192.168.0.227","192.87.28.82","TLSv1.2","736","Application Data"
"54","18:51:17.236667","17.137.162.3","192.168.0.227","TCP","74","443  >  61508 [SYN, ACK, ECE] Seq=0 Ack=1 Win=28960 Len=0 MSS=1420 SACK_PERM TSval=2179404145 TSecr=4000133895 WS=2048"
"55","18:51:17.237602","192.168.0.227","17.137.162.3","TCP","66","61508  >  443 [ACK] Seq=1 Ack=1 Win=132352 Len=0 TSval=4000134070 TSecr=2179404145"
"56","18:51:17.237644","192.168.0.227","17.137.162.3","TCP","1474","61508  >  443 [ACK] Seq=1 Ack=1 Win=132352 Len=1408 TSval=4000134071 TSecr=2179404145 [TCP PDU reassembled in 57]"
"57","18:51:17.237648","192.168.0.227","17.137.162.3","TLSv1.3","192","Client Hello (SNI=gdmf.apple.com)"
"58","18:51:17.238418","192.87.28.82","192.168.0.227","TCP","66","9001  >  64519 [ACK] Seq=1 Ack=3687 Win=3488 Len=0 TSval=1327541295 TSecr=1556510492"
"59","18:51:17.291113","64.65.63.120","192.168.0.227","TCP","1474","443  >  64520 [ACK] Seq=1073 Ack=537 Win=8301 Len=1408 TSval=2517592913 TSecr=1566696758 [TCP PDU reassembled in 61]"
"60","18:51:17.291117","64.65.63.120","192.168.0.227","TCP","1474","443  >  64520 [PSH, ACK] Seq=2481 Ack=537 Win=8301 Len=1408 TSval=2517592913 TSecr=1566696758 [TCP PDU reassembled in 61]"
"61","18:51:17.291119","64.65.63.120","192.168.0.227","TLSv1.2","870","Application Data"
"62","18:51:17.291349","192.168.0.227","64.65.63.120","TCP","66","64520  >  443 [ACK] Seq=537 Ack=2481 Win=16194 Len=0 TSval=1566696852 TSecr=2517592913"
"63","18:51:17.291414","192.168.0.227","64.65.63.120","TCP","66","64520  >  443 [ACK] Seq=537 Ack=4693 Win=16160 Len=0 TSval=1566696853 TSecr=2517592913"
"64","18:51:17.291621","192.168.0.227","64.65.63.120","TCP","66","[TCP Window Update] 64520  >  443 [ACK] Seq=537 Ack=4693 Win=16216 Len=0 TSval=1566696853 TSecr=2517592913"
"65","18:51:17.333723","64.65.63.120","192.168.0.227","TCP","1474","443  >  64520 [ACK] Seq=4693 Ack=537 Win=8301 Len=1408 TSval=2517592961 TSecr=1566696758 [TCP PDU reassembled in 66]"
"66","18:51:17.333727","64.65.63.120","192.168.0.227","TLSv1.2","736","Application Data"
"67","18:51:17.333918","192.168.0.227","64.65.63.120","TCP","66","64520  >  443 [ACK] Seq=537 Ack=6771 Win=16184 Len=0 TSval=1566696895 TSecr=2517592961"
"68","18:51:17.334401","192.168.0.227","64.65.63.120","TLSv1.2","602","Application Data"
"69","18:51:17.336682","192.168.0.227","192.87.28.82","TLSv1.2","602","Application Data"
"70","18:51:17.338808","192.168.0.227","192.87.28.82","TCP","1474","64519  >  9001 [ACK] Seq=4223 Ack=1 Win=22794 Len=1408 TSval=1556510633 TSecr=1327541295 [TCP PDU reassembled in 72]"
"71","18:51:17.338813","192.168.0.227","192.87.28.82","TCP","1474","64519  >  9001 [ACK] Seq=5631 Ack=1 Win=22794 Len=1408 TSval=1556510633 TSecr=1327541295 [TCP PDU reassembled in 72]"
"72","18:51:17.338843","192.168.0.227","192.87.28.82","TLSv1.2","870","Application Data"
"73","18:51:17.358121","17.137.162.3","192.168.0.227","TCP","66","443  >  61507 [ACK] Seq=1 Ack=1409 Win=32768 Len=0 TSval=3211618574 TSecr=2946680323"
"74","18:51:17.358125","17.137.162.3","192.168.0.227","TCP","66","443  >  61507 [ACK] Seq=1 Ack=1535 Win=32768 Len=0 TSval=3211618574 TSecr=2946680323"
"75","18:51:17.364612","17.137.162.3","192.168.0.227","TLSv1.3","1474","Server Hello, Change Cipher Spec, Application Data"
"76","18:51:17.364617","17.137.162.3","192.168.0.227","TCP","1474","443  >  61507 [ACK] Seq=1409 Ack=1535 Win=32768 Len=1408 TSval=3211618580 TSecr=2946680323 [TCP PDU reassembled in 81]"
"77","18:51:17.365611","192.168.0.227","17.137.162.3","TCP","66","61507  >  443 [ACK] Seq=1535 Ack=2817 Win=129536 Len=0 TSval=2946680506 TSecr=3211618580"
"78","18:51:17.368438","17.137.162.3","192.168.0.227","TCP","1346","443  >  61507 [PSH, ACK] Seq=2817 Ack=1535 Win=32768 Len=1280 TSval=3211618580 TSecr=2946680323 [TCP PDU reassembled in 81]"
"79","18:51:17.368442","17.137.162.3","192.168.0.227","TCP","1474","443  >  61507 [ACK] Seq=4097 Ack=1535 Win=32768 Len=1408 TSval=3211618581 TSecr=2946680323 [TCP PDU reassembled in 81]"
"80","18:51:17.368444","17.137.162.3","192.168.0.227","TCP","1474","443  >  61507 [ACK] Seq=5505 Ack=1535 Win=32768 Len=1408 TSval=3211618581 TSecr=2946680323 [TCP PDU reassembled in 81]"
"81","18:51:17.368447","17.137.162.3","192.168.0.227","TLSv1.3","756","Application Data, Application Data, Application Data"
"82","18:51:17.369185","192.168.0.227","17.137.162.3","TCP","66","61507  >  443 [ACK] Seq=1535 Ack=7603 Win=126336 Len=0 TSval=2946680510 TSecr=3211618581"
"83","18:51:17.369195","192.168.0.227","17.137.162.3","TCP","66","[TCP Window Update] 61507  >  443 [ACK] Seq=1535 Ack=7603 Win=131072 Len=0 TSval=2946680510 TSecr=3211618581"
"84","18:51:17.373030","192.87.28.82","192.168.0.227","TCP","66","9001  >  64519 [ACK] Seq=1 Ack=5631 Win=3490 Len=0 TSval=1327541431 TSecr=1556510631"
"85","18:51:17.373033","192.87.28.82","192.168.0.227","TCP","66","9001  >  64519 [ACK] Seq=1 Ack=7843 Win=3456 Len=0 TSval=1327541431 TSecr=1556510633"
"86","18:51:17.378577","64.65.63.120","192.168.0.227","TCP","66","443  >  64520 [ACK] Seq=6771 Ack=1073 Win=8297 Len=0 TSval=2517593003 TSecr=1566696896"
"87","18:51:17.383315","192.168.0.227","17.137.162.3","TLSv1.3","146","Change Cipher Spec, Application Data"
"88","18:51:17.385237","192.168.0.227","17.137.162.3","TLSv1.3","539","Application Data"
"89","18:51:17.385575","192.168.0.227","17.137.162.3","TCP","1474","61507  >  443 [ACK] Seq=2088 Ack=7603 Win=131072 Len=1408 TSval=2946680527 TSecr=3211618581 [TCP PDU reassembled in 90]"
"90","18:51:17.385588","192.168.0.227","17.137.162.3","TLSv1.3","1057","Application Data"
"91","18:51:17.414402","17.137.162.3","192.168.0.227","TCP","66","443  >  61508 [ACK] Seq=1 Ack=1535 Win=32768 Len=0 TSval=2179404322 TSecr=4000134071"
"92","18:51:17.416442","17.137.162.3","192.168.0.227","TLSv1.3","1474","Server Hello, Change Cipher Spec, Application Data"
"93","18:51:17.416445","17.137.162.3","192.168.0.227","TCP","1474","443  >  61508 [ACK] Seq=1409 Ack=1535 Win=32768 Len=1408 TSval=2179404322 TSecr=4000134071 [TCP PDU reassembled in 99]"
"94","18:51:17.416448","17.137.162.3","192.168.0.227","TCP","1346","443  >  61508 [PSH, ACK] Seq=2817 Ack=1535 Win=32768 Len=1280 TSval=2179404322 TSecr=4000134071 [TCP PDU reassembled in 99]"
"95","18:51:17.417323","192.168.0.227","17.137.162.3","TCP","66","61508  >  443 [ACK] Seq=1535 Ack=4097 Win=128256 Len=0 TSval=4000134250 TSecr=2179404322"
"96","18:51:17.417329","192.168.0.227","17.137.162.3","TCP","66","[TCP Window Update] 61508  >  443 [ACK] Seq=1535 Ack=4097 Win=131072 Len=0 TSval=4000134250 TSecr=2179404322"
"97","18:51:17.419607","17.137.162.3","192.168.0.227","TCP","1474","443  >  61508 [ACK] Seq=4097 Ack=1535 Win=32768 Len=1408 TSval=2179404323 TSecr=4000134071 [TCP PDU reassembled in 99]"
"98","18:51:17.419610","17.137.162.3","192.168.0.227","TCP","1474","443  >  61508 [ACK] Seq=5505 Ack=1535 Win=32768 Len=1408 TSval=2179404323 TSecr=4000134071 [TCP PDU reassembled in 99]"
"99","18:51:17.419613","17.137.162.3","192.168.0.227","TLSv1.3","756","Application Data, Application Data, Application Data"
"100","18:51:17.420341","192.168.0.227","17.137.162.3","TCP","66","61508  >  443 [ACK] Seq=1535 Ack=7603 Win=127616 Len=0 TSval=4000134253 TSecr=2179404323"
"101","18:51:17.420346","192.168.0.227","17.137.162.3","TCP","66","[TCP Window Update] 61508  >  443 [ACK] Seq=1535 Ack=7603 Win=131072 Len=0 TSval=4000134253 TSecr=2179404323"
"102","18:51:17.421622","2a06:98c1:3123:8000::1","2a02:ab88:b:4100:4977:d98a:d5e5:5d47","TLSv1.2","110","Application Data"
"103","18:51:17.422118","2a02:ab88:b:4100:4977:d98a:d5e5:5d47","2a06:98c1:3123:8000::1","TCP","86","50236  >  443 [ACK] Seq=1 Ack=25 Win=2048 Len=0 TSval=3760260184 TSecr=1152693000"
"104","18:51:17.422124","2a02:ab88:b:4100:4977:d98a:d5e5:5d47","2a06:98c1:3123:8000::1","TLSv1.2","110","Application Data"
"105","18:51:17.422125","2a02:ab88:b:4100:4977:d98a:d5e5:5d47","2a06:98c1:3123:8000::1","TLSv1.2","112","Application Data"
"106","18:51:17.432721","192.168.0.227","17.137.162.3","TLSv1.3","146","Change Cipher Spec, Application Data"
"107","18:51:17.433993","192.87.28.82","192.168.0.227","TLSv1.2","602","Application Data"
"108","18:51:17.434202","192.168.0.227","192.87.28.82","TCP","66","64519  >  9001 [ACK] Seq=7843 Ack=537 Win=22786 Len=0 TSval=1556510728 TSecr=1327541489"
"109","18:51:17.435174","192.168.0.227","17.137.162.3","TLSv1.3","531","Application Data"
"110","18:51:17.435644","192.168.0.227","17.137.162.3","TCP","1474","61508  >  443 [ACK] Seq=2080 Ack=7603 Win=131072 Len=1408 TSval=4000134269 TSecr=2179404323 [TCP PDU reassembled in 111]"
"111","18:51:17.435662","192.168.0.227","17.137.162.3","TLSv1.3","543","Application Data"
"112","18:51:17.438349","64.65.63.120","192.168.0.227","TLSv1.2","602","Application Data"
"113","18:51:17.438532","192.168.0.227","64.65.63.120","TCP","66","64520  >  443 [ACK] Seq=1073 Ack=7307 Win=16208 Len=0 TSval=1566697000 TSecr=2517593066"
"114","18:51:17.439507","192.168.0.227","192.87.28.82","TLSv1.2","602","Application Data"
"115","18:51:17.443689","2a06:98c1:3123:8000::1","2a02:ab88:b:4100:4977:d98a:d5e5:5d47","TCP","86","443  >  50236 [ACK] Seq=25 Ack=51 Win=16 Len=0 TSval=1152693025 TSecr=3760260184"
"116","18:51:17.463352","64.65.63.120","192.168.0.227","TCP","1474","443  >  64520 [ACK] Seq=7307 Ack=1073 Win=8297 Len=1408 TSval=2517593091 TSecr=1566696896 [TCP PDU reassembled in 118]"
"117","18:51:17.463555","192.168.0.227","64.65.63.120","TCP","66","64520  >  443 [ACK] Seq=1073 Ack=8715 Win=16194 Len=0 TSval=1566697025 TSecr=2517593091"
"118","18:51:17.475719","64.65.63.120","192.168.0.227","TLSv1.2","222","Application Data"
"119","18:51:17.475921","192.168.0.227","64.65.63.120","TCP","66","64520  >  443 [ACK] Seq=1073 Ack=8871 Win=16214 Len=0 TSval=1566697037 TSecr=2517593103"
"120","18:51:17.512737","192.87.28.82","192.168.0.227","TCP","66","9001  >  64519 [ACK] Seq=537 Ack=8379 Win=3520 Len=0 TSval=1327541571 TSecr=1556510734"
"121","18:51:17.523502","192.168.0.227","192.87.28.82","TCP","1474","64519  >  9001 [ACK] Seq=8379 Ack=537 Win=22794 Len=1408 TSval=1556510818 TSecr=1327541571 [TCP PDU reassembled in 123]"
"122","18:51:17.523504","192.168.0.227","192.87.28.82","TCP","1474","64519  >  9001 [ACK] Seq=9787 Ack=537 Win=22794 Len=1408 TSval=1556510818 TSecr=1327541571 [TCP PDU reassembled in 123]"
"123","18:51:17.523525","192.168.0.227","192.87.28.82","TLSv1.2","870","Application Data"
"124","18:51:17.557192","17.137.162.3","192.168.0.227","TCP","66","443  >  61507 [ACK] Seq=7603 Ack=4487 Win=40960 Len=0 TSval=3211618772 TSecr=2946680524"
"125","18:51:17.557194","17.137.162.3","192.168.0.227","TLSv1.3","369","Application Data"
"126","18:51:17.557196","17.137.162.3","192.168.0.227","TLSv1.3","369","Application Data"
"127","18:51:17.557198","192.87.28.82","192.168.0.227","TCP","66","9001  >  64519 [ACK] Seq=537 Ack=11195 Win=3476 Len=0 TSval=1327541615 TSecr=1556510818"
"128","18:51:17.557659","192.168.0.227","17.137.162.3","TCP","66","61507  >  443 [ACK] Seq=4487 Ack=8209 Win=130560 Len=0 TSval=2946680699 TSecr=3211618773"
"129","18:51:17.571919","17.137.162.3","192.168.0.227","TCP","1474","443  >  61507 [ACK] Seq=8209 Ack=4487 Win=40960 Len=1408 TSval=3211618790 TSecr=2946680524 [TCP PDU reassembled in 130]"
"130","18:51:17.571922","17.137.162.3","192.168.0.227","TLSv1.3","483","Application Data"
"131","18:51:17.572269","192.168.0.227","17.137.162.3","TCP","66","61507  >  443 [ACK] Seq=4487 Ack=10034 Win=129280 Len=0 TSval=2946680713 TSecr=3211618790"
"132","18:51:17.599670","192.87.28.82","192.168.0.227","TCP","66","9001  >  64519 [ACK] Seq=537 Ack=11999 Win=3520 Len=0 TSval=1327541658 TSecr=1556510818"
"133","18:51:17.622616","17.137.162.3","192.168.0.227","TLSv1.3","369","Application Data"
"134","18:51:17.622619","17.137.162.3","192.168.0.227","TLSv1.3","369","Application Data"
"135","18:51:17.622621","17.137.162.3","192.168.0.227","TCP","1474","443  >  61508 [ACK] Seq=8209 Ack=3965 Win=40960 Len=1408 TSval=2179404522 TSecr=4000134269 [TCP PDU reassembled in 140]"
"136","18:51:17.622622","17.137.162.3","192.168.0.227","TCP","1474","443  >  61508 [ACK] Seq=9617 Ack=3965 Win=40960 Len=1408 TSval=2179404522 TSecr=4000134269 [TCP PDU reassembled in 140]"
"137","18:51:17.622624","17.137.162.3","192.168.0.227","TCP","1474","443  >  61508 [ACK] Seq=11025 Ack=3965 Win=40960 Len=1408 TSval=2179404522 TSecr=4000134269 [TCP PDU reassembled in 140]"
"138","18:51:17.622629","17.137.162.3","192.168.0.227","TCP","1474","443  >  61508 [ACK] Seq=12433 Ack=3965 Win=40960 Len=1408 TSval=2179404522 TSecr=4000134269 [TCP PDU reassembled in 140]"
"139","18:51:17.622631","17.137.162.3","192.168.0.227","TCP","1474","443  >  61508 [ACK] Seq=13841 Ack=3965 Win=40960 Len=1408 TSval=2179404522 TSecr=4000134269 [TCP PDU reassembled in 140]"
"140","18:51:17.622633","17.137.162.3","192.168.0.227","TLSv1.3","885","Application Data"
"141","18:51:17.622634","17.137.162.3","192.168.0.227","TCP","66","443  >  61508 [ACK] Seq=8209 Ack=3965 Win=40960 Len=0 TSval=2179404517 TSecr=4000134269"
"142","18:51:17.623189","192.168.0.227","17.137.162.3","TCP","66","61508  >  443 [ACK] Seq=3965 Ack=16068 Win=122752 Len=0 TSval=4000134456 TSecr=2179404522"
"143","18:51:17.623193","192.168.0.227","17.137.162.3","TCP","66","[TCP Window Update] 61508  >  443 [ACK] Seq=3965 Ack=16068 Win=131072 Len=0 TSval=4000134456 TSecr=2179404522"
"144","18:51:17.788576","64.65.63.120","192.168.0.227","TCP","1474","443  >  64520 [ACK] Seq=8871 Ack=1073 Win=8297 Len=1408 TSval=2517593415 TSecr=1566697037 [TCP PDU reassembled in 146]"
"145","18:51:17.788580","64.65.63.120","192.168.0.227","TCP","1474","443  >  64520 [PSH, ACK] Seq=10279 Ack=1073 Win=8297 Len=1408 TSval=2517593415 TSecr=1566697037 [TCP PDU reassembled in 146]"
"146","18:51:17.788583","64.65.63.120","192.168.0.227","TLSv1.2","870","Application Data"
"147","18:51:17.788813","192.168.0.227","64.65.63.120","TCP","66","64520  >  443 [ACK] Seq=1073 Ack=12491 Win=16160 Len=0 TSval=1566697350 TSecr=2517593415"
"148","18:51:17.789062","192.168.0.227","64.65.63.120","TCP","66","[TCP Window Update] 64520  >  443 [ACK] Seq=1073 Ack=12491 Win=16216 Len=0 TSval=1566697350 TSecr=2517593415"
"149","18:51:17.790815","192.87.28.82","192.168.0.227","TCP","1474","9001  >  64519 [ACK] Seq=537 Ack=11999 Win=3520 Len=1408 TSval=1327541845 TSecr=1556510818 [TCP PDU reassembled in 151]"
"150","18:51:17.790820","192.87.28.82","192.168.0.227","TCP","1474","9001  >  64519 [ACK] Seq=1945 Ack=11999 Win=3520 Len=1408 TSval=1327541845 TSecr=1556510818 [TCP PDU reassembled in 151]"
"151","18:51:17.790821","192.87.28.82","192.168.0.227","TLSv1.2","1320","Application Data"
"152","18:51:17.790823","192.87.28.82","192.168.0.227","TCP","1474","9001  >  64519 [ACK] Seq=4607 Ack=11999 Win=3520 Len=1408 TSval=1327541845 TSecr=1556510818 [TCP PDU reassembled in 154]"
"153","18:51:17.790825","192.87.28.82","192.168.0.227","TCP","1474","9001  >  64519 [ACK] Seq=6015 Ack=11999 Win=3520 Len=1408 TSval=1327541845 TSecr=1556510818 [TCP PDU reassembled in 154]"
"154","18:51:17.790828","192.87.28.82","192.168.0.227","TLSv1.2","1474","Application Data"
"155","18:51:17.790829","192.87.28.82","192.168.0.227","TCP","1474","9001  >  64519 [ACK] Seq=8831 Ack=11999 Win=3520 Len=1408 TSval=1327541845 TSecr=1556510818 [TCP PDU reassembled in 169]"
"156","18:51:17.790831","192.87.28.82","192.168.0.227","TCP","1474","9001  >  64519 [ACK] Seq=10239 Ack=11999 Win=3520 Len=1408 TSval=1327541845 TSecr=1556510818 [TCP PDU reassembled in 169]"
"157","18:51:17.791017","64.65.63.120","192.168.0.227","TCP","1474","443  >  64520 [ACK] Seq=12491 Ack=1073 Win=8297 Len=1408 TSval=2517593420 TSecr=1566697037 [TCP PDU reassembled in 164]"
"158","18:51:17.791018","192.168.0.227","192.87.28.82","TCP","66","64519  >  9001 [ACK] Seq=11999 Ack=1945 Win=22772 Len=0 TSval=1556511085 TSecr=1327541845"
"159","18:51:17.791019","64.65.63.120","192.168.0.227","TCP","1474","443  >  64520 [PSH, ACK] Seq=13899 Ack=1073 Win=8297 Len=1408 TSval=2517593420 TSecr=1566697037 [TCP PDU reassembled in 164]"
"160","18:51:17.791065","192.168.0.227","192.87.28.82","TCP","66","64519  >  9001 [ACK] Seq=11999 Ack=11647 Win=22621 Len=0 TSval=1556511085 TSecr=1327541845"
"161","18:51:17.791079","192.168.0.227","64.65.63.120","TCP","66","64520  >  443 [ACK] Seq=1073 Ack=15307 Win=16172 Len=0 TSval=1566697352 TSecr=2517593420"
"162","18:51:17.791215","192.168.0.227","192.87.28.82","TCP","66","[TCP Window Update] 64519  >  9001 [ACK] Seq=11999 Ack=11647 Win=22794 Len=0 TSval=1556511085 TSecr=1327541845"
"163","18:51:17.791359","192.168.0.227","64.65.63.120","TCP","66","[TCP Window Update] 64520  >  443 [ACK] Seq=1073 Ack=15307 Win=16216 Len=0 TSval=1566697353 TSecr=2517593420"
"164","18:51:17.796296","64.65.63.120","192.168.0.227","TLSv1.2","1474","Application Data"
"165","18:51:17.796299","64.65.63.120","192.168.0.227","TCP","1474","443  >  64520 [PSH, ACK] Seq=16715 Ack=1073 Win=8297 Len=1408 TSval=2517593423 TSecr=1566697037 [TCP PDU reassembled in 173]"
"166","18:51:17.796300","64.65.63.120","192.168.0.227","TCP","1474","443  >  64520 [ACK] Seq=18123 Ack=1073 Win=8297 Len=1408 TSval=2517593423 TSecr=1566697037 [TCP PDU reassembled in 173]"
"167","18:51:17.796496","192.168.0.227","64.65.63.120","TCP","66","64520  >  443 [ACK] Seq=1073 Ack=19531 Win=16150 Len=0 TSval=1566697358 TSecr=2517593423"
"168","18:51:17.796646","192.168.0.227","64.65.63.120","TCP","66","[TCP Window Update] 64520  >  443 [ACK] Seq=1073 Ack=19531 Win=16216 Len=0 TSval=1566697358 TSecr=2517593423"
"169","18:51:17.801793","192.87.28.82","192.168.0.227","TLSv1.2","1474","Application Data"
"170","18:51:17.801796","192.87.28.82","192.168.0.227","TCP","1474","9001  >  64519 [ACK] Seq=13055 Ack=11999 Win=3520 Len=1408 TSval=1327541861 TSecr=1556510818 [TCP PDU reassembled in 176]"
"171","18:51:17.801913","192.168.0.227","192.87.28.82","TCP","66","64519  >  9001 [ACK] Seq=11999 Ack=14463 Win=22750 Len=0 TSval=1556511096 TSecr=1327541861"
"172","18:51:17.802135","192.168.0.227","192.87.28.82","TCP","66","[TCP Window Update] 64519  >  9001 [ACK] Seq=11999 Ack=14463 Win=22794 Len=0 TSval=1556511096 TSecr=1327541861"
"173","18:51:17.824756","64.65.63.120","192.168.0.227","TLSv1.2","1316","Application Data, Application Data"
"174","18:51:17.824927","192.168.0.227","64.65.63.120","TCP","66","64520  >  443 [ACK] Seq=1073 Ack=20781 Win=16197 Len=0 TSval=1566697386 TSecr=2517593452"
"175","18:51:17.826130","192.87.28.82","192.168.0.227","TCP","1474","9001  >  64519 [ACK] Seq=14463 Ack=11999 Win=3520 Len=1408 TSval=1327541883 TSecr=1556511085 [TCP PDU reassembled in 176]"
"176","18:51:17.826133","192.87.28.82","192.168.0.227","TLSv1.2","1474","Application Data"
"177","18:51:17.826134","192.87.28.82","192.168.0.227","TCP","1474","9001  >  64519 [ACK] Seq=17279 Ack=11999 Win=3520 Len=1408 TSval=1327541883 TSecr=1556511085 [TCP PDU reassembled in 179]"
"178","18:51:17.826136","192.87.28.82","192.168.0.227","TCP","1474","9001  >  64519 [ACK] Seq=18687 Ack=11999 Win=3520 Len=1408 TSval=1327541883 TSecr=1556511085 [TCP PDU reassembled in 179]"
"179","18:51:17.826137","192.87.28.82","192.168.0.227","TLSv1.2","1474","Application Data"
"180","18:51:17.826139","192.87.28.82","192.168.0.227","TCP","1474","9001  >  64519 [ACK] Seq=21503 Ack=11999 Win=3520 Len=1408 TSval=1327541883 TSecr=1556511085 [TCP PDU reassembled in 181]"
"181","18:51:17.826140","192.87.28.82","192.168.0.227","TLSv1.2","1474","Application Data"
"182","18:51:17.826141","192.87.28.82","192.168.0.227","TCP","1474","9001  >  64519 [ACK] Seq=24319 Ack=11999 Win=3520 Len=1408 TSval=1327541883 TSecr=1556511085 [TCP PDU reassembled in 184]"
"183","18:51:17.826143","192.87.28.82","192.168.0.227","TCP","1474","9001  >  64519 [ACK] Seq=25727 Ack=11999 Win=3520 Len=1408 TSval=1327541883 TSecr=1556511085 [TCP PDU reassembled in 184]"
"184","18:51:17.826144","192.87.28.82","192.168.0.227","TLSv1.2","1474","Application Data"
"185","18:51:17.826145","192.87.28.82","192.168.0.227","TCP","1474","9001  >  64519 [ACK] Seq=28543 Ack=11999 Win=3520 Len=1408 TSval=1327541883 TSecr=1556511085 [TCP PDU reassembled in 192]"
"186","18:51:17.826146","192.87.28.82","192.168.0.227","TCP","1474","9001  >  64519 [ACK] Seq=29951 Ack=11999 Win=3520 Len=1408 TSval=1327541883 TSecr=1556511085 [TCP PDU reassembled in 192]"
"187","18:51:17.826282","192.168.0.227","192.87.28.82","TCP","66","64519  >  9001 [ACK] Seq=11999 Ack=29951 Win=22552 Len=0 TSval=1556511120 TSecr=1327541883"
"188","18:51:17.826315","192.168.0.227","192.87.28.82","TCP","66","64519  >  9001 [ACK] Seq=11999 Ack=31359 Win=22530 Len=0 TSval=1556511121 TSecr=1327541883"
"189","18:51:17.826467","192.168.0.227","192.87.28.82","TCP","66","[TCP Window Update] 64519  >  9001 [ACK] Seq=11999 Ack=31359 Win=22794 Len=0 TSval=1556511121 TSecr=1327541883"
"190","18:51:17.826735","192.168.0.227","192.87.28.82","TLSv1.2","602","Application Data"
"191","18:51:17.829420","192.168.0.227","31.192.108.181","TLSv1.2","574","Application Data"
"192","18:51:17.833813","192.87.28.82","192.168.0.227","TLSv1.2","1474","Application Data"
"193","18:51:17.833913","192.168.0.227","192.87.28.82","TCP","66","64519  >  9001 [ACK] Seq=12535 Ack=32767 Win=22772 Len=0 TSval=1556511128 TSecr=1327541892"
"194","18:51:17.835513","192.87.28.82","192.168.0.227","TCP","1474","9001  >  64519 [ACK] Seq=32767 Ack=11999 Win=3520 Len=1408 TSval=1327541892 TSecr=1556511096 [TCP PDU reassembled in 201]"
"195","18:51:17.835515","192.87.28.82","192.168.0.227","TCP","1474","9001  >  64519 [ACK] Seq=34175 Ack=11999 Win=3520 Len=1408 TSval=1327541892 TSecr=1556511096 [TCP PDU reassembled in 201]"
"196","18:51:17.835517","64.65.63.120","192.168.0.227","TCP","1474","443  >  64520 [ACK] Seq=20781 Ack=1073 Win=8297 Len=1408 TSval=2517593464 TSecr=1566697358 [TCP PDU reassembled in 205]"
"197","18:51:17.835627","192.168.0.227","192.87.28.82","TLSv1.2","602","Application Data"
"198","18:51:17.835666","192.168.0.227","64.65.63.120","TCP","66","64520  >  443 [ACK] Seq=1073 Ack=22189 Win=16194 Len=0 TSval=1566697397 TSecr=2517593464"
"199","18:51:17.835728","192.168.0.227","192.87.28.82","TCP","66","[TCP Window Update] 64519  >  9001 [ACK] Seq=13071 Ack=35583 Win=22794 Len=0 TSval=1556511130 TSecr=1327541892"
"200","18:51:17.837149","64.65.63.120","192.168.0.227","TCP","1474","443  >  64520 [PSH, ACK] Seq=22189 Ack=1073 Win=8297 Len=1408 TSval=2517593464 TSecr=1566697358 [TCP PDU reassembled in 205]"
"201","18:51:17.837150","192.87.28.82","192.168.0.227","TLSv1.2","1474","Application Data, Application Data"
"202","18:51:17.837181","192.168.0.227","192.87.28.82","TCP","66","64519  >  9001 [ACK] Seq=13071 Ack=36991 Win=22772 Len=0 TSval=1556511131 TSecr=1327541896"
"203","18:51:17.837200","192.168.0.227","64.65.63.120","TCP","66","64520  >  443 [ACK] Seq=1073 Ack=23597 Win=16194 Len=0 TSval=1566697398 TSecr=2517593464"
"204","18:51:17.839658","2a02:ab88:b:4100:4977:d98a:d5e5:5d47","2603:1063:12::2fb","TLSv1.2","144","Application Data"
"205","18:51:17.840530","64.65.63.120","192.168.0.227","TLSv1.2","1474","Application Data"
"206","18:51:17.840608","192.168.0.227","64.65.63.120","TCP","66","64520  >  443 [ACK] Seq=1073 Ack=25005 Win=16194 Len=0 TSval=1566697402 TSecr=2517593468"
"207","18:51:17.840833","192.168.0.227","64.65.63.120","TLSv1.2","602","Application Data"
"208","18:51:17.844828","64.65.63.120","192.168.0.227","TLSv1.2","1474","Application Data"
"209","18:51:17.844830","64.65.63.120","192.168.0.227","TCP","1474","443  >  64520 [PSH, ACK] Seq=26413 Ack=1073 Win=8297 Len=1408 TSval=2517593472 TSecr=1566697358 [TCP PDU reassembled in 212]"
"210","18:51:17.844864","192.168.0.227","64.65.63.120","TCP","66","64520  >  443 [ACK] Seq=1609 Ack=27821 Win=16172 Len=0 TSval=1566697406 TSecr=2517593472"
"211","18:51:17.844928","192.168.0.227","64.65.63.120","TCP","66","[TCP Window Update] 64520  >  443 [ACK] Seq=1609 Ack=27821 Win=16216 Len=0 TSval=1566697406 TSecr=2517593472"
"212","18:51:17.848903","64.65.63.120","192.168.0.227","TLSv1.2","1474","Application Data"
"213","18:51:17.848909","64.65.63.120","192.168.0.227","TCP","1474","443  >  64520 [PSH, ACK] Seq=29229 Ack=1073 Win=8297 Len=1408 TSval=2517593474 TSecr=1566697358 [TCP PDU reassembled in 215]"
"214","18:51:17.848911","64.65.63.120","192.168.0.227","TCP","1474","443  >  64520 [ACK] Seq=30637 Ack=1073 Win=8297 Len=1408 TSval=2517593474 TSecr=1566697358 [TCP PDU reassembled in 215]"
"215","18:51:17.848913","64.65.63.120","192.168.0.227","TLSv1.2","1474","Application Data"
"216","18:51:17.848915","64.65.63.120","192.168.0.227","TCP","1474","443  >  64520 [PSH, ACK] Seq=33453 Ack=1073 Win=8297 Len=1408 TSval=2517593474 TSecr=1566697358 [TCP PDU reassembled in 233]"
"217","18:51:17.848917","64.65.63.120","192.168.0.227","TCP","1474","443  >  64520 [ACK] Seq=34861 Ack=1073 Win=8297 Len=1408 TSval=2517593475 TSecr=1566697358 [TCP PDU reassembled in 233]"
"218","18:51:17.849108","192.168.0.227","64.65.63.120","TCP","66","64520  >  443 [ACK] Seq=1609 Ack=36269 Win=16216 Len=0 TSval=1566697410 TSecr=2517593475"
"219","18:51:17.860816","192.87.28.82","192.168.0.227","TCP","1474","9001  >  64519 [ACK] Seq=36991 Ack=11999 Win=3520 Len=1408 TSval=1327541915 TSecr=1556511120 [TCP PDU reassembled in 221]"
"220","18:51:17.860819","192.87.28.82","192.168.0.227","TCP","1474","9001  >  64519 [ACK] Seq=38399 Ack=11999 Win=3520 Len=1408 TSval=1327541915 TSecr=1556511120 [TCP PDU reassembled in 221]"
"221","18:51:17.860820","192.87.28.82","192.168.0.227","TLSv1.2","1474","Application Data"
"222","18:51:17.860821","192.87.28.82","192.168.0.227","TCP","1474","9001  >  64519 [ACK] Seq=41215 Ack=11999 Win=3520 Len=1408 TSval=1327541915 TSecr=1556511120 [TCP PDU reassembled in 224]"
"223","18:51:17.860823","192.87.28.82","192.168.0.227","TCP","1474","9001  >  64519 [ACK] Seq=42623 Ack=11999 Win=3520 Len=1408 TSval=1327541915 TSecr=1556511120 [TCP PDU reassembled in 224]"
"224","18:51:17.860825","192.87.28.82","192.168.0.227","TLSv1.2","1474","Application Data"
"225","18:51:17.860826","192.87.28.82","192.168.0.227","TCP","1474","9001  >  64519 [ACK] Seq=45439 Ack=11999 Win=3520 Len=1408 TSval=1327541915 TSecr=1556511120 [TCP PDU reassembled in 227]"
"226","18:51:17.860828","192.87.28.82","192.168.0.227","TCP","1474","9001  >  64519 [ACK] Seq=46847 Ack=11999 Win=3520 Len=1408 TSval=1327541915 TSecr=1556511120 [TCP PDU reassembled in 227]"
"227","18:51:17.860833","192.87.28.82","192.168.0.227","TLSv1.2","1474","Application Data"
"228","18:51:17.860834","192.87.28.82","192.168.0.227","TCP","1474","9001  >  64519 [ACK] Seq=49663 Ack=11999 Win=3520 Len=1408 TSval=1327541915 TSecr=1556511120 [TCP PDU reassembled in 230]"
"229","18:51:17.860836","192.87.28.82","192.168.0.227","TCP","1474","9001  >  64519 [ACK] Seq=51071 Ack=11999 Win=3520 Len=1408 TSval=1327541915 TSecr=1556511120 [TCP PDU reassembled in 230]"
"230","18:51:17.860837","192.87.28.82","192.168.0.227","TLSv1.2","1474","Application Data, Application Data"
"231","18:51:17.860839","192.87.28.82","192.168.0.227","TCP","1474","9001  >  64519 [ACK] Seq=53887 Ack=11999 Win=3520 Len=1408 TSval=1327541915 TSecr=1556511121 [TCP PDU reassembled in 238]"
"232","18:51:17.860840","192.87.28.82","192.168.0.227","TCP","1474","9001  >  64519 [ACK] Seq=55295 Ack=11999 Win=3520 Len=1408 TSval=1327541915 TSecr=1556511121 [TCP PDU reassembled in 238]"
"233","18:51:17.860841","64.65.63.120","192.168.0.227","TLSv1.2","1158","Application Data, Application Data"
"234","18:51:17.861010","192.168.0.227","192.87.28.82","TCP","66","64519  >  9001 [ACK] Seq=13071 Ack=52479 Win=22552 Len=0 TSval=1556511155 TSecr=1327541915"
"235","18:51:17.861051","192.168.0.227","192.87.28.82","TCP","66","64519  >  9001 [ACK] Seq=13071 Ack=56703 Win=22486 Len=0 TSval=1556511155 TSecr=1327541915"
"236","18:51:17.862705","192.168.0.227","64.65.63.120","TCP","66","64520  >  443 [ACK] Seq=1609 Ack=37361 Win=16216 Len=0 TSval=1566697424 TSecr=2517593488"
"237","18:51:17.863127","192.168.0.227","192.87.28.82","TLSv1.2","602","Application Data"
"238","18:51:17.868414","192.87.28.82","192.168.0.227","TLSv1.2","1474","Application Data, Application Data"
"239","18:51:17.868416","192.87.28.82","192.168.0.227","TCP","1474","9001  >  64519 [ACK] Seq=58111 Ack=12535 Win=3520 Len=1408 TSval=1327541925 TSecr=1556511121 [TCP PDU reassembled in 241]"
"240","18:51:17.868417","192.87.28.82","192.168.0.227","TCP","1474","9001  >  64519 [ACK] Seq=59519 Ack=12535 Win=3520 Len=1408 TSval=1327541925 TSecr=1556511121 [TCP PDU reassembled in 241]"
"241","18:51:17.868418","192.87.28.82","192.168.0.227","TLSv1.2","1474","Application Data"
"242","18:51:17.868420","192.87.28.82","192.168.0.227","TCP","1474","9001  >  64519 [ACK] Seq=62335 Ack=12535 Win=3520 Len=1408 TSval=1327541925 TSecr=1556511121 [TCP PDU reassembled in 243]"
"243","18:51:17.868421","192.87.28.82","192.168.0.227","TLSv1.2","1474","Application Data"
"244","18:51:17.868572","192.168.0.227","192.87.28.82","TCP","66","64519  >  9001 [ACK] Seq=13607 Ack=65151 Win=22662 Len=0 TSval=1556511163 TSecr=1327541925"
"245","18:51:17.868779","192.168.0.227","192.87.28.82","TCP","66","[TCP Window Update] 64519  >  9001 [ACK] Seq=13607 Ack=65151 Win=22794 Len=0 TSval=1556511163 TSecr=1327541925"
"246","18:51:17.873854","31.192.108.181","192.168.0.227","TLSv1.2","286","Application Data"
"247","18:51:17.873856","31.192.108.181","192.168.0.227","TLSv1.2","445","Application Data"
"248","18:51:17.874090","192.168.0.227","31.192.108.181","TCP","66","61494  >  443 [ACK] Seq=1387 Ack=1573 Win=2039 Len=0 TSval=2676462601 TSecr=3132205226"
"249","18:51:17.876187","192.168.0.227","31.192.108.181","TLSv1.2","412","Application Data"
"250","18:51:17.878982","64.65.63.120","192.168.0.227","TCP","1474","443  >  64520 [ACK] Seq=37361 Ack=1073 Win=8297 Len=1408 TSval=2517593504 TSecr=1566697402 [TCP PDU reassembled in 252]"
"251","18:51:17.878985","64.65.63.120","192.168.0.227","TCP","1474","443  >  64520 [PSH, ACK] Seq=38769 Ack=1073 Win=8297 Len=1408 TSval=2517593504 TSecr=1566697402 [TCP PDU reassembled in 252]"
"252","18:51:17.878986","64.65.63.120","192.168.0.227","TLSv1.2","1474","Application Data"
"253","18:51:17.878987","64.65.63.120","192.168.0.227","TCP","1474","443  >  64520 [PSH, ACK] Seq=41585 Ack=1073 Win=8297 Len=1408 TSval=2517593504 TSecr=1566697402 [TCP PDU reassembled in 260]"
"254","18:51:17.878988","64.65.63.120","192.168.0.227","TCP","1474","443  >  64520 [ACK] Seq=42993 Ack=1073 Win=8297 Len=1408 TSval=2517593505 TSecr=1566697402 [TCP PDU reassembled in 260]"
"255","18:51:17.878989","2603:1063:12::2fb","2a02:ab88:b:4100:4977:d98a:d5e5:5d47","TLSv1.2","133","Application Data"
"256","18:51:17.879139","2a02:ab88:b:4100:4977:d98a:d5e5:5d47","2603:1063:12::2fb","TCP","86","63423  >  443 [ACK] Seq=59 Ack=48 Win=2048 Len=0 TSval=2131295690 TSecr=585495011"
"257","18:51:17.879178","192.168.0.227","64.65.63.120","TCP","66","64520  >  443 [ACK] Seq=1609 Ack=44401 Win=16216 Len=0 TSval=1566697440 TSecr=2517593505"
"258","18:51:17.886833","64.65.63.120","192.168.0.227","TCP","66","443  >  64520 [ACK] Seq=44401 Ack=1609 Win=8293 Len=0 TSval=2517593511 TSecr=1566697402"
"259","18:51:17.886931","192.168.0.227","64.65.63.120","TLSv1.2","602","Application Data"
"260","18:51:17.888027","64.65.63.120","192.168.0.227","TLSv1.2","1474","Application Data"
"261","18:51:17.888029","64.65.63.120","192.168.0.227","TCP","1474","443  >  64520 [PSH, ACK] Seq=45809 Ack=1609 Win=8293 Len=1408 TSval=2517593516 TSecr=1566697410 [TCP PDU reassembled in 264]"
"262","18:51:17.888161","192.168.0.227","64.65.63.120","TCP","66","64520  >  443 [ACK] Seq=2145 Ack=47217 Win=16216 Len=0 TSval=1566697449 TSecr=2517593516"
"263","18:51:17.889440","64.65.63.120","192.168.0.227","TCP","1474","443  >  64520 [ACK] Seq=47217 Ack=1609 Win=8293 Len=1408 TSval=2517593516 TSecr=1566697410 [TCP PDU reassembled in 264]"
"264","18:51:17.892498","64.65.63.120","192.168.0.227","TLSv1.2","1474","Application Data, Application Data"
"265","18:51:17.892499","64.65.63.120","192.168.0.227","TCP","1474","443  >  64520 [PSH, ACK] Seq=50033 Ack=1609 Win=8293 Len=1408 TSval=2517593519 TSecr=1566697410 [TCP PDU reassembled in 267]"
"266","18:51:17.892501","64.65.63.120","192.168.0.227","TCP","1474","443  >  64520 [ACK] Seq=51441 Ack=1609 Win=8293 Len=1408 TSval=2517593519 TSecr=1566697410 [TCP PDU reassembled in 267]"
"267","18:51:17.892502","64.65.63.120","192.168.0.227","TLSv1.2","1474","Application Data"
"268","18:51:17.892503","64.65.63.120","192.168.0.227","TCP","1474","443  >  64520 [PSH, ACK] Seq=54257 Ack=1609 Win=8293 Len=1408 TSval=2517593519 TSecr=1566697410 [TCP PDU reassembled in 270]"
