"No.","Time","Source","Destination","Protocol","Length","Info"
"1","17:25:28.096972","192.168.0.74","5.28.195.2","TCP","78","52900  >  5222 [SYN] Seq=0 Win=65535 Len=0 MSS=1460 WS=16 TSval=3855856562 TSecr=0 SACK_PERM"
"2","17:25:28.097035","192.168.0.74","5.28.195.2","TCP","78","52898  >  80 [SYN] Seq=0 Win=65535 Len=0 MSS=1460 WS=16 TSval=3221470205 TSecr=0 SACK_PERM"
"3","17:25:29.963745","192.87.28.82","192.168.0.74","TLSv1.2","602","Application Data"
"4","17:25:29.963925","192.168.0.74","192.87.28.82","TCP","66","52516  >  9001 [ACK] Seq=1 Ack=537 Win=9066 Len=0 TSval=164117508 TSecr=1712753596"
"5","17:25:30.010413","192.87.28.82","192.168.0.74","TCP","602","[TCP Spurious Retransmission] 9001  >  52516 [PSH, ACK] Seq=1 Ack=1 Win=5280 Len=536 TSval=1712753836 TSecr=164112606"
"6","17:25:30.010417","2a00:ab00:533:6::100","2a02:ab88:b:4100:6163:ab1b:4f48:fc2c","TCP","86","443  >  56755 [ACK] Seq=1 Ack=1 Win=506 Len=0 TSval=3010264365 TSecr=2790418686"
"7","17:25:30.010599","192.168.0.74","192.87.28.82","TCP","78","[TCP Dup ACK 4#1] 52516  >  9001 [ACK] Seq=1 Ack=537 Win=9066 Len=0 TSval=164117554 TSecr=1712753836 SLE=1 SRE=537"
"8","17:25:30.010648","2a02:ab88:b:4100:6163:ab1b:4f48:fc2c","2a00:ab00:533:6::100","TCP","86","[TCP ACKed unseen segment] 56755  >  443 [ACK] Seq=1 Ack=2 Win=2048 Len=0 TSval=2790434094 TSecr=3010249013"
"9","17:25:30.095611","192.168.0.74","5.28.195.2","TCP","78","52904  >  80 [SYN, ECE, CWR] Seq=0 Win=65535 Len=0 MSS=1460 WS=16 TSval=2807383945 TSecr=0 SACK_PERM"
"10","17:25:30.095749","192.168.0.74","5.28.195.2","TCP","78","52903  >  443 [SYN, ECE, CWR] Seq=0 Win=65535 Len=0 MSS=1460 WS=16 TSval=1845375027 TSecr=0 SACK_PERM"
"11","17:25:30.096420","192.168.0.74","5.28.195.2","TCP","78","52905  >  5222 [SYN, ECE, CWR] Seq=0 Win=65535 Len=0 MSS=1460 WS=16 TSval=994956697 TSecr=0 SACK_PERM"
"12","17:25:30.135602","5.28.195.2","192.168.0.74","TCP","74","443  >  52903 [SYN, ACK, ECE] Seq=0 Ack=1 Win=65535 Len=0 MSS=1240 SACK_PERM TSval=3030843339 TSecr=1845375027 WS=1024"
"13","17:25:30.135857","192.168.0.74","5.28.195.2","TCP","66","52903  >  443 [ACK] Seq=1 Ack=1 Win=1048560 Len=0 TSval=1845375068 TSecr=3030843339"
"14","17:25:30.136514","192.168.0.74","5.28.195.2","TLSv1","583","Client Hello"
"15","17:25:30.178254","5.28.195.2","192.168.0.74","TCP","66","443  >  52903 [ACK] Seq=1 Ack=518 Win=67584 Len=0 TSval=3030843401 TSecr=1845375068"
"16","17:25:30.180793","5.28.195.2","192.168.0.74","TCP","66","443  >  52903 [FIN, ACK] Seq=1 Ack=518 Win=67584 Len=0 TSval=3030843403 TSecr=1845375068"
"17","17:25:30.180964","192.168.0.74","5.28.195.2","TCP","66","52903  >  443 [ACK] Seq=518 Ack=2 Win=1048560 Len=0 TSval=1845375113 TSecr=3030843403"
"18","17:25:30.181183","192.168.0.74","5.28.195.2","TCP","66","52903  >  443 [FIN, ACK] Seq=518 Ack=2 Win=1048560 Len=0 TSval=1845375113 TSecr=3030843403"
"19","17:25:30.230170","5.28.195.2","192.168.0.74","TCP","56","443  >  52903 [RST] Seq=2 Win=0 Len=0"
"20","17:25:30.688679","64.65.63.120","192.168.0.74","TLSv1.2","602","Application Data"
"21","17:25:30.688682","149.154.167.41","192.168.0.74","SSL","171","Continuation Data"
"22","17:25:30.688901","192.168.0.74","149.154.167.41","TCP","66","51643  >  443 [ACK] Seq=1 Ack=106 Win=65530 Len=0 TSval=2408373455 TSecr=1826597385"
"23","17:25:30.689139","192.168.0.74","64.65.63.120","TCP","66","52517  >  443 [ACK] Seq=1 Ack=537 Win=18790 Len=0 TSval=4083486892 TSecr=2614831709"
"24","17:25:31.095327","192.168.0.74","5.28.195.2","TCP","78","[TCP Retransmission] 52904  >  80 [SYN] Seq=0 Win=65535 Len=0 MSS=1460 WS=16 TSval=2807384945 TSecr=0 SACK_PERM"
"25","17:25:31.096559","192.168.0.74","5.28.195.2","TCP","78","[TCP Retransmission] 52905  >  5222 [SYN] Seq=0 Win=65535 Len=0 MSS=1460 WS=16 TSval=994957697 TSecr=0 SACK_PERM"
"26","17:25:32.095844","192.168.0.74","5.28.195.2","TCP","78","[TCP Retransmission] 52905  >  5222 [SYN] Seq=0 Win=65535 Len=0 MSS=1460 WS=16 TSval=994958697 TSecr=0 SACK_PERM"
"27","17:25:32.095900","192.168.0.74","5.28.195.2","TCP","78","[TCP Retransmission] 52904  >  80 [SYN] Seq=0 Win=65535 Len=0 MSS=1460 WS=16 TSval=2807385946 TSecr=0 SACK_PERM"
"28","17:25:33.096966","192.168.0.74","5.28.195.2","TCP","78","[TCP Retransmission] 52905  >  5222 [SYN] Seq=0 Win=65535 Len=0 MSS=1460 WS=16 TSval=994959698 TSecr=0 SACK_PERM"
"29","17:25:33.097003","192.168.0.74","5.28.195.2","TCP","78","[TCP Retransmission] 52904  >  80 [SYN] Seq=0 Win=65535 Len=0 MSS=1460 WS=16 TSval=2807386947 TSecr=0 SACK_PERM"
"30","17:25:33.501304","192.168.0.74","192.87.28.82","TLSv1.2","602","Application Data"
"31","17:25:33.588563","192.87.28.82","192.168.0.74","TCP","66","9001  >  52516 [ACK] Seq=537 Ack=537 Win=5280 Len=0 TSval=1712757421 TSecr=164121045"
"32","17:25:33.642687","192.168.0.74","5.28.195.2","TCP","78","52906  >  443 [SYN, ECE, CWR] Seq=0 Win=65535 Len=0 MSS=1460 WS=16 TSval=3405485310 TSecr=0 SACK_PERM"
"33","17:25:33.683025","5.28.195.2","192.168.0.74","TCP","74","443  >  52906 [SYN, ACK, ECE] Seq=0 Ack=1 Win=65535 Len=0 MSS=1240 SACK_PERM TSval=3030846859 TSecr=3405485310 WS=1024"
"34","17:25:33.683168","192.168.0.74","5.28.195.2","TCP","66","52906  >  443 [ACK] Seq=1 Ack=1 Win=1048560 Len=0 TSval=3405485351 TSecr=3030846859"
"35","17:25:33.683432","192.168.0.74","5.28.195.2","TLSv1","583","Client Hello"
"36","17:25:33.727834","5.28.195.2","192.168.0.74","TCP","66","443  >  52906 [ACK] Seq=1 Ack=518 Win=67584 Len=0 TSval=3030846946 TSecr=3405485351"
"37","17:25:33.727837","5.28.195.2","192.168.0.74","TCP","66","443  >  52906 [FIN, ACK] Seq=1 Ack=518 Win=67584 Len=0 TSval=3030846946 TSecr=3405485351"
"38","17:25:33.728061","192.168.0.74","5.28.195.2","TCP","66","52906  >  443 [ACK] Seq=518 Ack=2 Win=1048560 Len=0 TSval=3405485396 TSecr=3030846946"
"39","17:25:33.728296","192.168.0.74","5.28.195.2","TCP","66","52906  >  443 [FIN, ACK] Seq=518 Ack=2 Win=1048560 Len=0 TSval=3405485396 TSecr=3030846946"
"40","17:25:33.772386","5.28.195.2","192.168.0.74","TCP","56","443  >  52906 [RST] Seq=2 Win=0 Len=0"
"41","17:25:34.097719","192.168.0.74","5.28.195.2","TCP","78","[TCP Retransmission] 52905  >  5222 [SYN] Seq=0 Win=65535 Len=0 MSS=1460 WS=16 TSval=994960699 TSecr=0 SACK_PERM"
"42","17:25:34.097792","192.168.0.74","5.28.195.2","TCP","78","[TCP Retransmission] 52904  >  80 [SYN] Seq=0 Win=65535 Len=0 MSS=1460 WS=16 TSval=2807387948 TSecr=0 SACK_PERM"
"43","17:25:34.206306","192.168.0.74","64.65.63.120","TLSv1.2","602","Application Data"
"44","17:25:34.312976","64.65.63.120","192.168.0.74","TCP","66","443  >  52517 [ACK] Seq=537 Ack=537 Win=2627 Len=0 TSval=2614835506 TSecr=4083490409"
"45","17:25:34.440848","192.168.0.74","5.28.195.2","TCP","78","52907  >  443 [SYN, ECE, CWR] Seq=0 Win=65535 Len=0 MSS=1460 WS=16 TSval=3446847991 TSecr=0 SACK_PERM"
"46","17:25:34.449880","2a00:ab00:533:6::100","2a02:ab88:b:4100:6163:ab1b:4f48:fc2c","TLSv1.2","110","[TCP Previous segment not captured] , Application Data"
"47","17:25:34.450508","2a02:ab88:b:4100:6163:ab1b:4f48:fc2c","2a00:ab00:533:6::100","TCP","86","56755  >  443 [ACK] Seq=1 Ack=26 Win=2048 Len=0 TSval=2790438534 TSecr=3010268805"
"48","17:25:34.450511","2a02:ab88:b:4100:6163:ab1b:4f48:fc2c","2a00:ab00:533:6::100","TLSv1.2","110","Application Data"
"49","17:25:34.450511","2a02:ab88:b:4100:6163:ab1b:4f48:fc2c","2a00:ab00:533:6::100","TLSv1.2","112","Application Data"
"50","17:25:34.483047","5.28.195.2","192.168.0.74","TCP","74","443  >  52907 [SYN, ACK, ECE] Seq=0 Ack=1 Win=65535 Len=0 MSS=1240 SACK_PERM TSval=3031743044 TSecr=3446847991 WS=1024"
"51","17:25:34.483287","192.168.0.74","5.28.195.2","TCP","66","52907  >  443 [ACK] Seq=1 Ack=1 Win=1048560 Len=0 TSval=3446848033 TSecr=3031743044"
"52","17:25:34.483549","192.168.0.74","5.28.195.2","TLSv1","583","Client Hello"
"53","17:25:34.503450","2a00:ab00:533:6::100","2a02:ab88:b:4100:6163:ab1b:4f48:fc2c","TCP","86","443  >  56755 [ACK] Seq=26 Ack=25 Win=506 Len=0 TSval=3010268861 TSecr=2790438534"
"54","17:25:34.503453","2a00:ab00:533:6::100","2a02:ab88:b:4100:6163:ab1b:4f48:fc2c","TCP","86","443  >  56755 [ACK] Seq=26 Ack=51 Win=506 Len=0 TSval=3010268861 TSecr=2790438534"
"55","17:25:34.532276","5.28.195.2","192.168.0.74","TCP","66","443  >  52907 [ACK] Seq=1 Ack=518 Win=67584 Len=0 TSval=3031743093 TSecr=3446848034"
"56","17:25:34.532279","5.28.195.2","192.168.0.74","TCP","66","443  >  52907 [FIN, ACK] Seq=1 Ack=518 Win=67584 Len=0 TSval=3031743093 TSecr=3446848034"
"57","17:25:34.532496","192.168.0.74","5.28.195.2","TCP","66","52907  >  443 [ACK] Seq=518 Ack=2 Win=1048560 Len=0 TSval=3446848082 TSecr=3031743093"
"58","17:25:34.532686","192.168.0.74","5.28.195.2","TCP","66","52907  >  443 [FIN, ACK] Seq=518 Ack=2 Win=1048560 Len=0 TSval=3446848083 TSecr=3031743093"
"59","17:25:34.575044","5.28.195.2","192.168.0.74","TCP","56","443  >  52907 [RST] Seq=2 Win=0 Len=0"
"60","17:25:34.615068","2a00:1450:400d:80f::200e","2a02:ab88:b:4100:6163:ab1b:4f48:fc2c","TLSv1.2","159","Application Data"
"61","17:25:34.615451","2a02:ab88:b:4100:6163:ab1b:4f48:fc2c","2a00:1450:400d:80f::200e","TCP","86","56682  >  443 [ACK] Seq=1 Ack=74 Win=2047 Len=0 TSval=3519900031 TSecr=2268733038"
"62","17:25:34.615900","2a02:ab88:b:4100:6163:ab1b:4f48:fc2c","2a00:1450:400d:80f::200e","TCP","74","56682  >  443 [RST, ACK] Seq=1 Ack=74 Win=2048 Len=0"
"63","17:25:34.900141","192.168.0.74","64.65.63.120","TLSv1.2","602","Application Data"
"64","17:25:34.910152","149.154.167.41","192.168.0.74","SSL","171","Continuation Data"
"65","17:25:34.910250","192.168.0.74","149.154.167.41","TCP","66","51643  >  443 [ACK] Seq=1 Ack=211 Win=65530 Len=0 TSval=2408377676 TSecr=1826601647"
"66","17:25:34.950625","64.65.63.120","192.168.0.74","TCP","66","443  >  52517 [ACK] Seq=537 Ack=1073 Win=2623 Len=0 TSval=2614836144 TSecr=4083491103"
"67","17:25:34.969265","2a01:b740:1361:101::2:7","2a02:ab88:b:4100:6163:ab1b:4f48:fc2c","TLSv1.2","125","Application Data"
"68","17:25:34.969266","2a01:b740:1361:101::2:7","2a02:ab88:b:4100:6163:ab1b:4f48:fc2c","TLSv1.2","110","Application Data"
"69","17:25:34.969514","2a02:ab88:b:4100:6163:ab1b:4f48:fc2c","2a01:b740:1361:101::2:7","TCP","86","56771  >  443 [ACK] Seq=1 Ack=65 Win=2048 Len=0 TSval=1126225612 TSecr=4180491530"
"70","17:25:34.969650","2a02:ab88:b:4100:6163:ab1b:4f48:fc2c","2a01:b740:1361:101::2:7","TLSv1.2","125","Application Data"
"71","17:25:34.969897","2a02:ab88:b:4100:6163:ab1b:4f48:fc2c","2a01:b740:1361:101::2:7","TLSv1.2","110","Application Data"
"72","17:25:34.970235","2a02:ab88:b:4100:6163:ab1b:4f48:fc2c","2a01:b740:1361:101::2:7","TCP","86","56771  >  443 [FIN, ACK] Seq=64 Ack=65 Win=2048 Len=0 TSval=1126225613 TSecr=4180491530"
"73","17:25:35.088405","192.87.28.82","192.168.0.74","TCP","1474","9001  >  52516 [ACK, CWR] Seq=537 Ack=537 Win=5280 Len=1408 TSval=1712758923 TSecr=164121045 [TCP PDU reassembled in 76]"
"74","17:25:35.088611","192.168.0.74","192.87.28.82","TCP","66","52516  >  9001 [ACK] Seq=537 Ack=1945 Win=9044 Len=0 TSval=164122633 TSecr=1712758923"
"75","17:25:35.090657","192.87.28.82","192.168.0.74","TCP","1474","9001  >  52516 [ACK] Seq=1945 Ack=537 Win=5280 Len=1408 TSval=1712758923 TSecr=164121045 [TCP PDU reassembled in 76]"
"76","17:25:35.090661","192.87.28.82","192.168.0.74","TLSv1.2","1320","Application Data"
"77","17:25:35.090832","192.168.0.74","192.87.28.82","TCP","66","52516  >  9001 [ACK] Seq=537 Ack=4607 Win=9025 Len=0 TSval=164122635 TSecr=1712758923"
"78","17:25:35.091184","192.168.0.74","192.87.28.82","TLSv1.2","602","Application Data"
"79","17:25:35.091318","192.87.28.82","192.168.0.74","TCP","1474","9001  >  52516 [ACK] Seq=4607 Ack=537 Win=5280 Len=1408 TSval=1712758923 TSecr=164121045 [TCP PDU reassembled in 81]"
"80","17:25:35.091351","192.168.0.74","192.87.28.82","TCP","66","52516  >  9001 [ACK] Seq=1073 Ack=6015 Win=9044 Len=0 TSval=164122635 TSecr=1712758923"
"81","17:25:35.092704","192.87.28.82","192.168.0.74","TLSv1.2","800","Application Data"
"82","17:25:35.092824","192.168.0.74","192.87.28.82","TCP","66","52516  >  9001 [ACK] Seq=1073 Ack=6749 Win=9055 Len=0 TSval=164122637 TSecr=1712758923"
"83","17:25:35.104732","192.87.28.82","192.168.0.74","TCP","1474","9001  >  52516 [ACK] Seq=6749 Ack=537 Win=5280 Len=1408 TSval=1712758932 TSecr=164121045 [TCP PDU reassembled in 84]"
"84","17:25:35.104735","192.87.28.82","192.168.0.74","TLSv1.2","222","Application Data"
"85","17:25:35.104848","192.168.0.74","192.87.28.82","TCP","66","52516  >  9001 [ACK] Seq=1073 Ack=8157 Win=9044 Len=0 TSval=164122649 TSecr=1712758932"
"86","17:25:35.104885","192.168.0.74","192.87.28.82","TCP","66","52516  >  9001 [ACK] Seq=1073 Ack=8313 Win=9042 Len=0 TSval=164122649 TSecr=1712758932"
"87","17:25:35.114184","192.87.28.82","192.168.0.74","TCP","1474","9001  >  52516 [ACK] Seq=8313 Ack=537 Win=5280 Len=1408 TSval=1712758949 TSecr=164121045 [TCP PDU reassembled in 88]"
"88","17:25:35.114187","192.87.28.82","192.168.0.74","TLSv1.2","1250","Application Data"
"89","17:25:35.114327","192.168.0.74","192.87.28.82","TCP","66","52516  >  9001 [ACK] Seq=1073 Ack=10905 Win=9026 Len=0 TSval=164122658 TSecr=1712758949"
"90","17:25:35.166261","192.168.0.74","64.65.63.120","TLSv1.2","602","Application Data"
"91","17:25:35.168314","192.168.0.74","64.65.63.120","TCP","1474","52517  >  443 [ACK] Seq=1609 Ack=537 Win=18790 Len=1408 TSval=4083491371 TSecr=2614836144 [TCP PDU reassembled in 92]"
"92","17:25:35.168329","192.168.0.74","64.65.63.120","TLSv1.2","1250","Application Data"
"93","17:25:35.181786","192.87.28.82","192.168.0.74","TCP","66","9001  >  52516 [ACK] Seq=10905 Ack=1073 Win=5280 Len=0 TSval=1712759007 TSecr=164122635"
"94","17:25:35.200869","64.65.63.120","192.168.0.74","TCP","66","443  >  52517 [ACK] Seq=537 Ack=1609 Win=2619 Len=0 TSval=2614836399 TSecr=4083491369"
"95","17:25:35.206321","64.65.63.120","192.168.0.74","TCP","66","443  >  52517 [ACK] Seq=537 Ack=4201 Win=2660 Len=0 TSval=2614836404 TSecr=4083491371"
"96","17:25:35.284871","192.87.28.82","192.168.0.74","TCP","1474","9001  >  52516 [ACK] Seq=10905 Ack=1073 Win=5280 Len=1408 TSval=1712759119 TSecr=164122635 [TCP PDU reassembled in 98]"
"97","17:25:35.284873","192.87.28.82","192.168.0.74","TCP","1474","9001  >  52516 [ACK] Seq=12313 Ack=1073 Win=5280 Len=1408 TSval=1712759119 TSecr=164122635 [TCP PDU reassembled in 98]"
"98","17:25:35.284874","192.87.28.82","192.168.0.74","TLSv1.2","870","Application Data"
"99","17:25:35.284978","192.168.0.74","192.87.28.82","TCP","66","52516  >  9001 [ACK] Seq=1073 Ack=14525 Win=9010 Len=0 TSval=164122829 TSecr=1712759119"
"100","17:25:35.285101","192.168.0.74","192.87.28.82","TCP","66","[TCP Window Update] 52516  >  9001 [ACK] Seq=1073 Ack=14525 Win=9066 Len=0 TSval=164122829 TSecr=1712759119"
"101","17:25:35.287385","192.87.28.82","192.168.0.74","TCP","1474","9001  >  52516 [ACK] Seq=14525 Ack=1073 Win=5280 Len=1408 TSval=1712759121 TSecr=164122635 [TCP PDU reassembled in 103]"
"102","17:25:35.287386","192.87.28.82","192.168.0.74","TCP","1474","9001  >  52516 [ACK] Seq=15933 Ack=1073 Win=5280 Len=1408 TSval=1712759121 TSecr=164122635 [TCP PDU reassembled in 103]"
"103","17:25:35.287388","192.87.28.82","192.168.0.74","TLSv1.2","870","Application Data"
"104","17:25:35.287424","192.168.0.74","192.87.28.82","TCP","66","52516  >  9001 [ACK] Seq=1073 Ack=18145 Win=9010 Len=0 TSval=164122831 TSecr=1712759121"
"105","17:25:35.287472","192.168.0.74","192.87.28.82","TCP","66","[TCP Window Update] 52516  >  9001 [ACK] Seq=1073 Ack=18145 Win=9066 Len=0 TSval=164122832 TSecr=1712759121"
"106","17:25:35.300722","192.87.28.82","192.168.0.74","TCP","1474","9001  >  52516 [ACK] Seq=18145 Ack=1073 Win=5280 Len=1408 TSval=1712759132 TSecr=164122635 [TCP PDU reassembled in 108]"
"107","17:25:35.300724","192.87.28.82","192.168.0.74","TCP","1474","9001  >  52516 [ACK] Seq=19553 Ack=1073 Win=5280 Len=1408 TSval=1712759132 TSecr=164122635 [TCP PDU reassembled in 108]"
"108","17:25:35.300725","192.87.28.82","192.168.0.74","TLSv1.2","1320","Application Data"
"109","17:25:35.300727","192.87.28.82","192.168.0.74","TCP","1474","9001  >  52516 [ACK] Seq=22215 Ack=1073 Win=5280 Len=1408 TSval=1712759132 TSecr=164122635 [TCP PDU reassembled in 111]"
"110","17:25:35.300728","192.87.28.82","192.168.0.74","TCP","1474","9001  >  52516 [ACK] Seq=23623 Ack=1073 Win=5280 Len=1408 TSval=1712759132 TSecr=164122635 [TCP PDU reassembled in 111]"
"111","17:25:35.300729","192.87.28.82","192.168.0.74","TLSv1.2","1320","Application Data"
"112","17:25:35.300836","192.168.0.74","192.87.28.82","TCP","66","52516  >  9001 [ACK] Seq=1073 Ack=26285 Win=8939 Len=0 TSval=164122845 TSecr=1712759132"
"113","17:25:35.300939","192.168.0.74","192.87.28.82","TCP","66","[TCP Window Update] 52516  >  9001 [ACK] Seq=1073 Ack=26285 Win=9066 Len=0 TSval=164122845 TSecr=1712759132"
"114","17:25:35.301045","192.168.0.74","192.87.28.82","TLSv1.2","602","Application Data"
"115","17:25:35.301963","192.87.28.82","192.168.0.74","TLSv1.2","1474","Application Data"
"116","17:25:35.301964","192.87.28.82","192.168.0.74","TCP","1474","9001  >  52516 [ACK] Seq=27693 Ack=1073 Win=5280 Len=1408 TSval=1712759135 TSecr=164122635 [TCP PDU reassembled in 117]"
"117","17:25:35.301966","192.87.28.82","192.168.0.74","TLSv1.2","1470","Application Data"
"118","17:25:35.301967","2a01:b740:1361:101::2:7","2a02:ab88:b:4100:6163:ab1b:4f48:fc2c","TCP","86","443  >  56771 [ACK] Seq=65 Ack=40 Win=16 Len=0 TSval=4180491866 TSecr=1126225613"
"119","17:25:35.302043","192.168.0.74","192.87.28.82","TCP","66","52516  >  9001 [ACK] Seq=1609 Ack=30505 Win=9001 Len=0 TSval=164122846 TSecr=1712759135"
"120","17:25:35.302095","192.168.0.74","192.87.28.82","TCP","66","[TCP Window Update] 52516  >  9001 [ACK] Seq=1609 Ack=30505 Win=9066 Len=0 TSval=164122846 TSecr=1712759135"
"121","17:25:35.304174","2a01:b740:1361:101::2:7","2a02:ab88:b:4100:6163:ab1b:4f48:fc2c","TCP","86","443  >  56771 [ACK] Seq=65 Ack=64 Win=16 Len=0 TSval=4180491866 TSecr=1126225613"
"122","17:25:35.304175","2a01:b740:1361:101::2:7","2a02:ab88:b:4100:6163:ab1b:4f48:fc2c","TCP","86","443  >  56771 [ACK] Seq=65 Ack=65 Win=16 Len=0 TSval=4180491866 TSecr=1126225613"
"123","17:25:35.313731","192.87.28.82","192.168.0.74","TLSv1.2","1474","Application Data, Application Data"
"124","17:25:35.313733","192.87.28.82","192.168.0.74","TCP","1474","9001  >  52516 [ACK] Seq=31913 Ack=1073 Win=5280 Len=1408 TSval=1712759147 TSecr=164122635 [TCP PDU reassembled in 126]"
"125","17:25:35.313735","192.87.28.82","192.168.0.74","TCP","1474","9001  >  52516 [ACK] Seq=33321 Ack=1073 Win=5280 Len=1408 TSval=1712759147 TSecr=164122635 [TCP PDU reassembled in 126]"
"126","17:25:35.313736","192.87.28.82","192.168.0.74","TLSv1.2","598","Application Data"
"127","17:25:35.313827","192.168.0.74","192.87.28.82","TCP","66","52516  >  9001 [ACK] Seq=1609 Ack=35261 Win=8992 Len=0 TSval=164122858 TSecr=1712759147"
"128","17:25:35.313960","192.168.0.74","192.87.28.82","TCP","66","[TCP Window Update] 52516  >  9001 [ACK] Seq=1609 Ack=35261 Win=9066 Len=0 TSval=164122858 TSecr=1712759147"
"129","17:25:35.319875","192.87.28.82","192.168.0.74","TCP","1474","9001  >  52516 [ACK] Seq=35261 Ack=1073 Win=5280 Len=1408 TSval=1712759153 TSecr=164122829 [TCP PDU reassembled in 130]"
"130","17:25:35.319877","192.87.28.82","192.168.0.74","TLSv1.2","1474","Application Data"
"131","17:25:35.319878","192.87.28.82","192.168.0.74","TCP","1474","9001  >  52516 [ACK] Seq=38077 Ack=1073 Win=5280 Len=1408 TSval=1712759153 TSecr=164122829 [TCP PDU reassembled in 133]"
"132","17:25:35.319879","192.87.28.82","192.168.0.74","TCP","1474","9001  >  52516 [ACK] Seq=39485 Ack=1073 Win=5280 Len=1408 TSval=1712759153 TSecr=164122829 [TCP PDU reassembled in 133]"
"133","17:25:35.319880","192.87.28.82","192.168.0.74","TLSv1.2","646","Application Data"
"134","17:25:35.319930","192.168.0.74","192.87.28.82","TCP","66","52516  >  9001 [ACK] Seq=1609 Ack=41473 Win=8969 Len=0 TSval=164122864 TSecr=1712759153"
"135","17:25:35.319997","192.168.0.74","192.87.28.82","TCP","66","[TCP Window Update] 52516  >  9001 [ACK] Seq=1609 Ack=41473 Win=9066 Len=0 TSval=164122864 TSecr=1712759153"
"136","17:25:35.323285","192.87.28.82","192.168.0.74","TCP","1474","9001  >  52516 [ACK] Seq=41473 Ack=1073 Win=5280 Len=1408 TSval=1712759158 TSecr=164122832 [TCP PDU reassembled in 138]"
"137","17:25:35.323286","192.87.28.82","192.168.0.74","TCP","1474","9001  >  52516 [ACK] Seq=42881 Ack=1073 Win=5280 Len=1408 TSval=1712759158 TSecr=164122832 [TCP PDU reassembled in 138]"
"138","17:25:35.323288","192.87.28.82","192.168.0.74","TLSv1.2","1320","Application Data"
"139","17:25:35.323289","192.87.28.82","192.168.0.74","TCP","1474","9001  >  52516 [ACK] Seq=45543 Ack=1073 Win=5280 Len=1408 TSval=1712759158 TSecr=164122832 [TCP PDU reassembled in 140]"
"140","17:25:35.323290","192.87.28.82","192.168.0.74","TLSv1.2","800","Application Data"
"141","17:25:35.323331","192.168.0.74","192.87.28.82","TLSv1.2","602","Application Data"
"142","17:25:35.323392","192.168.0.74","192.87.28.82","TCP","66","[TCP Window Update] 52516  >  9001 [ACK] Seq=2145 Ack=47685 Win=9066 Len=0 TSval=164122867 TSecr=1712759158"
"143","17:25:35.334375","192.87.28.82","192.168.0.74","TCP","1474","9001  >  52516 [ACK] Seq=47685 Ack=1073 Win=5280 Len=1408 TSval=1712759169 TSecr=164122845 [TCP PDU reassembled in 145]"
"144","17:25:35.334377","192.87.28.82","192.168.0.74","TCP","1474","9001  >  52516 [ACK] Seq=49093 Ack=1073 Win=5280 Len=1408 TSval=1712759169 TSecr=164122845 [TCP PDU reassembled in 145]"
"145","17:25:35.334378","192.87.28.82","192.168.0.74","TLSv1.2","1474","Application Data"
"146","17:25:35.334379","192.87.28.82","192.168.0.74","TCP","1474","9001  >  52516 [ACK] Seq=51909 Ack=1073 Win=5280 Len=1408 TSval=1712759169 TSecr=164122845 [TCP PDU reassembled in 148]"
"147","17:25:35.334380","192.87.28.82","192.168.0.74","TCP","1474","9001  >  52516 [ACK] Seq=53317 Ack=1073 Win=5280 Len=1408 TSval=1712759169 TSecr=164122845 [TCP PDU reassembled in 148]"
"148","17:25:35.334381","192.87.28.82","192.168.0.74","TLSv1.2","1474","Application Data"
"149","17:25:35.334382","192.87.28.82","192.168.0.74","TCP","1474","9001  >  52516 [ACK] Seq=56133 Ack=1073 Win=5280 Len=1408 TSval=1712759169 TSecr=164122845 [TCP PDU reassembled in 150]"
"150","17:25:35.334383","192.87.28.82","192.168.0.74","TLSv1.2","1474","Application Data"
"151","17:25:35.334481","192.168.0.74","192.87.28.82","TCP","66","52516  >  9001 [ACK] Seq=2145 Ack=58949 Win=8890 Len=0 TSval=164122878 TSecr=1712759169"
"152","17:25:35.334608","192.168.0.74","192.87.28.82","TCP","66","[TCP Window Update] 52516  >  9001 [ACK] Seq=2145 Ack=58949 Win=9066 Len=0 TSval=164122879 TSecr=1712759169"
"153","17:25:35.339811","192.87.28.82","192.168.0.74","TCP","1474","9001  >  52516 [ACK] Seq=58949 Ack=1073 Win=5280 Len=1408 TSval=1712759174 TSecr=164122845 [TCP PDU reassembled in 154]"
"154","17:25:35.339813","192.87.28.82","192.168.0.74","TLSv1.2","1474","Application Data"
"155","17:25:35.339814","192.87.28.82","192.168.0.74","TCP","1474","9001  >  52516 [ACK] Seq=61765 Ack=1073 Win=5280 Len=1408 TSval=1712759174 TSecr=164122845 [TCP PDU reassembled in 157]"
"156","17:25:35.339815","192.87.28.82","192.168.0.74","TCP","1474","9001  >  52516 [ACK] Seq=63173 Ack=1073 Win=5280 Len=1408 TSval=1712759174 TSecr=164122845 [TCP PDU reassembled in 157]"
"157","17:25:35.339816","192.87.28.82","192.168.0.74","TLSv1.2","1474","Application Data"
"158","17:25:35.339903","192.168.0.74","192.87.28.82","TLSv1.2","602","Application Data"
"159","17:25:35.340009","192.168.0.74","192.87.28.82","TCP","66","[TCP Window Update] 52516  >  9001 [ACK] Seq=2681 Ack=65989 Win=9066 Len=0 TSval=164122884 TSecr=1712759174"
"160","17:25:35.346331","192.87.28.82","192.168.0.74","TLSv1.2","1474","Application Data"
"161","17:25:35.346333","192.87.28.82","192.168.0.74","TCP","1474","9001  >  52516 [ACK] Seq=67397 Ack=1609 Win=5280 Len=1408 TSval=1712759182 TSecr=164122845 [TCP PDU reassembled in 163]"
"162","17:25:35.346334","192.87.28.82","192.168.0.74","TCP","1474","9001  >  52516 [ACK] Seq=68805 Ack=1609 Win=5280 Len=1408 TSval=1712759182 TSecr=164122845 [TCP PDU reassembled in 163]"
"163","17:25:35.346335","192.87.28.82","192.168.0.74","TLSv1.2","1474","Application Data"
"164","17:25:35.346336","192.87.28.82","192.168.0.74","TLSv1.2","1474","Application Data"
"165","17:25:35.346437","192.168.0.74","192.87.28.82","TCP","66","52516  >  9001 [ACK] Seq=2681 Ack=73029 Win=8956 Len=0 TSval=164122890 TSecr=1712759182"
"166","17:25:35.346508","192.168.0.74","192.87.28.82","TCP","66","[TCP Window Update] 52516  >  9001 [ACK] Seq=2681 Ack=73029 Win=9066 Len=0 TSval=164122891 TSecr=1712759182"
"167","17:25:35.350430","192.87.28.82","192.168.0.74","TCP","1474","9001  >  52516 [ACK] Seq=73029 Ack=1609 Win=5280 Len=1408 TSval=1712759186 TSecr=164122858 [TCP PDU reassembled in 168]"
"168","17:25:35.355971","192.87.28.82","192.168.0.74","TLSv1.2","1474","Application Data"
"169","17:25:35.355973","192.87.28.82","192.168.0.74","TCP","1474","9001  >  52516 [ACK] Seq=75845 Ack=1609 Win=5280 Len=1408 TSval=1712759190 TSecr=164122864 [TCP PDU reassembled in 171]"
"170","17:25:35.355974","192.87.28.82","192.168.0.74","TCP","1474","9001  >  52516 [ACK] Seq=77253 Ack=1609 Win=5280 Len=1408 TSval=1712759190 TSecr=164122864 [TCP PDU reassembled in 171]"
"171","17:25:35.355975","192.87.28.82","192.168.0.74","TLSv1.2","1474","Application Data"
"172","17:25:35.355976","192.87.28.82","192.168.0.74","TLSv1.2","1474","Application Data"
"173","17:25:35.355976","192.87.28.82","192.168.0.74","TCP","1474","9001  >  52516 [ACK] Seq=81477 Ack=1609 Win=5280 Len=1408 TSval=1712759190 TSecr=164122864 [TCP PDU reassembled in 176]"
"174","17:25:35.355977","192.87.28.82","192.168.0.74","TCP","1474","9001  >  52516 [ACK] Seq=82885 Ack=1609 Win=5280 Len=1408 TSval=1712759190 TSecr=164122864 [TCP PDU reassembled in 176]"
"175","17:25:35.356088","192.168.0.74","192.87.28.82","TLSv1.2","602","Application Data"
"176","17:25:35.359614","192.87.28.82","192.168.0.74","TLSv1.2","1474","Application Data"
"177","17:25:35.359615","192.87.28.82","192.168.0.74","TCP","1474","9001  >  52516 [ACK] Seq=85701 Ack=2145 Win=5272 Len=1408 TSval=1712759194 TSecr=164122867 [TCP PDU reassembled in 178]"
"178","17:25:35.359616","192.87.28.82","192.168.0.74","TLSv1.2","1474","Application Data"
"179","17:25:35.359618","192.87.28.82","192.168.0.74","TCP","1474","9001  >  52516 [ACK] Seq=88517 Ack=2145 Win=5272 Len=1408 TSval=1712759194 TSecr=164122867 [TCP PDU reassembled in 181]"
"180","17:25:35.359619","192.87.28.82","192.168.0.74","TCP","1474","9001  >  52516 [ACK] Seq=89925 Ack=2145 Win=5272 Len=1408 TSval=1712759194 TSecr=164122867 [TCP PDU reassembled in 181]"
"181","17:25:35.359620","192.87.28.82","192.168.0.74","TLSv1.2","1474","Application Data, Application Data"
"182","17:25:35.359732","192.168.0.74","192.87.28.82","TCP","66","52516  >  9001 [ACK] Seq=3217 Ack=91333 Win=8956 Len=0 TSval=164122904 TSecr=1712759194"
"183","17:25:35.359834","192.168.0.74","192.87.28.82","TCP","66","52516  >  9001 [ACK] Seq=3217 Ack=92741 Win=9066 Len=0 TSval=164122904 TSecr=1712759194"
"184","17:25:35.367891","192.87.28.82","192.168.0.74","TCP","1474","9001  >  52516 [ACK] Seq=92741 Ack=2145 Win=5280 Len=1408 TSval=1712759203 TSecr=164122878 [TCP PDU reassembled in 185]"
"185","17:25:35.367892","192.87.28.82","192.168.0.74","TLSv1.2","1474","Application Data"
"186","17:25:35.367893","192.87.28.82","192.168.0.74","TCP","1474","9001  >  52516 [ACK] Seq=95557 Ack=2145 Win=5280 Len=1408 TSval=1712759203 TSecr=164122878 [TCP PDU reassembled in 188]"
"187","17:25:35.367894","192.87.28.82","192.168.0.74","TCP","1474","9001  >  52516 [ACK] Seq=96965 Ack=2145 Win=5280 Len=1408 TSval=1712759203 TSecr=164122878 [TCP PDU reassembled in 188]"
"188","17:25:35.367895","192.87.28.82","192.168.0.74","TLSv1.2","1474","Application Data"
"189","17:25:35.367895","192.87.28.82","192.168.0.74","TCP","1474","9001  >  52516 [ACK] Seq=99781 Ack=2145 Win=5280 Len=1408 TSval=1712759203 TSecr=164122878 [TCP PDU reassembled in 190]"
"190","17:25:35.367896","192.87.28.82","192.168.0.74","TLSv1.2","1474","Application Data"
"191","17:25:35.367897","192.87.28.82","192.168.0.74","TCP","1474","9001  >  52516 [ACK] Seq=102597 Ack=2145 Win=5280 Len=1408 TSval=1712759203 TSecr=164122878 [TCP PDU reassembled in 193]"
"192","17:25:35.367898","192.87.28.82","192.168.0.74","TCP","1474","9001  >  52516 [ACK] Seq=104005 Ack=2145 Win=5280 Len=1408 TSval=1712759203 TSecr=164122878 [TCP PDU reassembled in 193]"
"193","17:25:35.367899","192.87.28.82","192.168.0.74","TLSv1.2","1474","Application Data"
"194","17:25:35.368026","192.168.0.74","192.87.28.82","TLSv1.2","602","Application Data"
"195","17:25:35.373637","64.65.63.120","192.168.0.74","TCP","1474","443  >  52517 [ACK] Seq=537 Ack=4201 Win=2660 Len=1408 TSval=2614836569 TSecr=4083491371 [TCP PDU reassembled in 208]"
"196","17:25:35.373719","192.168.0.74","64.65.63.120","TCP","66","52517  >  443 [ACK] Seq=4201 Ack=1945 Win=18768 Len=0 TSval=4083491577 TSecr=2614836569"
"197","17:25:35.374912","64.65.63.120","192.168.0.74","TCP","1474","443  >  52517 [PSH, ACK] Seq=1945 Ack=4201 Win=2660 Len=1408 TSval=2614836569 TSecr=4083491371 [TCP PDU reassembled in 208]"
"198","17:25:35.374913","192.87.28.82","192.168.0.74","TLSv1.2","1474","Application Data"
"199","17:25:35.374914","192.87.28.82","192.168.0.74","TLSv1.2","1474","Application Data"
"200","17:25:35.374915","192.87.28.82","192.168.0.74","TCP","1474","9001  >  52516 [ACK] Seq=109637 Ack=2681 Win=5272 Len=1408 TSval=1712759211 TSecr=164122884 [TCP PDU reassembled in 202]"
"201","17:25:35.374915","192.87.28.82","192.168.0.74","TCP","1474","9001  >  52516 [ACK] Seq=111045 Ack=2681 Win=5272 Len=1408 TSval=1712759211 TSecr=164122884 [TCP PDU reassembled in 202]"
"202","17:25:35.374916","192.87.28.82","192.168.0.74","TLSv1.2","1474","Application Data"
"203","17:25:35.374917","192.87.28.82","192.168.0.74","TCP","1474","9001  >  52516 [ACK] Seq=113861 Ack=2681 Win=5272 Len=1408 TSval=1712759211 TSecr=164122884 [TCP PDU reassembled in 210]"
"204","17:25:35.374918","192.87.28.82","192.168.0.74","TCP","1474","9001  >  52516 [ACK] Seq=115269 Ack=2681 Win=5272 Len=1408 TSval=1712759211 TSecr=164122884 [TCP PDU reassembled in 210]"
"205","17:25:35.374969","192.168.0.74","192.87.28.82","TLSv1.2","602","Application Data"
"206","17:25:35.374992","192.168.0.74","64.65.63.120","TCP","66","52517  >  443 [ACK] Seq=4201 Ack=3353 Win=18768 Len=0 TSval=4083491578 TSecr=2614836569"
"207","17:25:35.375048","192.168.0.74","192.87.28.82","TCP","66","[TCP Window Update] 52516  >  9001 [ACK] Seq=4289 Ack=116677 Win=9066 Len=0 TSval=164122919 TSecr=1712759211"
"208","17:25:35.380351","64.65.63.120","192.168.0.74","TLSv1.2","1320","Application Data"
"209","17:25:35.380352","64.65.63.120","192.168.0.74","TCP","1474","443  >  52517 [ACK] Seq=4607 Ack=4201 Win=2660 Len=1408 TSval=2614836570 TSecr=4083491371 [TCP PDU reassembled in 213]"
"210","17:25:35.380353","192.87.28.82","192.168.0.74","TLSv1.2","1474","Application Data"
"211","17:25:35.380354","192.87.28.82","192.168.0.74","TLSv1.2","1474","Application Data"
"212","17:25:35.380355","192.87.28.82","192.168.0.74","TCP","1474","9001  >  52516 [ACK] Seq=119493 Ack=2681 Win=5280 Len=1408 TSval=1712759215 TSecr=164122890 [TCP PDU reassembled in 214]"
"213","17:25:35.380356","64.65.63.120","192.168.0.74","TLSv1.2","1474","Application Data"
"214","17:25:35.380357","192.87.28.82","192.168.0.74","TLSv1.2","1474","Application Data"
"215","17:25:35.380358","192.87.28.82","192.168.0.74","TCP","1474","9001  >  52516 [ACK] Seq=122309 Ack=2681 Win=5280 Len=1408 TSval=1712759215 TSecr=164122890 [TCP PDU reassembled in 216]"
"216","17:25:35.380359","192.87.28.82","192.168.0.74","TLSv1.2","1474","Application Data"
"217","17:25:35.380453","192.168.0.74","192.87.28.82","TCP","66","52516  >  9001 [ACK] Seq=4289 Ack=125125 Win=8934 Len=0 TSval=164122924 TSecr=1712759215"
"218","17:25:35.380487","192.168.0.74","64.65.63.120","TCP","66","52517  >  443 [ACK] Seq=4201 Ack=7423 Win=18727 Len=0 TSval=4083491584 TSecr=2614836570"
"219","17:25:35.380534","192.168.0.74","192.87.28.82","TCP","66","[TCP Window Update] 52516  >  9001 [ACK] Seq=4289 Ack=125125 Win=9066 Len=0 TSval=164122925 TSecr=1712759215"
"220","17:25:35.380637","192.168.0.74","64.65.63.120","TCP","66","[TCP Window Update] 52517  >  443 [ACK] Seq=4201 Ack=7423 Win=18790 Len=0 TSval=4083491584 TSecr=2614836570"
"221","17:25:35.382324","192.87.28.82","192.168.0.74","TLSv1.2","1474","Application Data"
"222","17:25:35.390168","192.87.28.82","192.168.0.74","TCP","1474","9001  >  52516 [ACK] Seq=126533 Ack=3217 Win=5272 Len=1408 TSval=1712759225 TSecr=164122900 [TCP PDU reassembled in 224]"
"223","17:25:35.390169","192.87.28.82","192.168.0.74","TCP","1474","9001  >  52516 [ACK] Seq=127941 Ack=3217 Win=5272 Len=1408 TSval=1712759225 TSecr=164122900 [TCP PDU reassembled in 224]"
"224","17:25:35.390170","192.87.28.82","192.168.0.74","TLSv1.2","1474","Application Data"
"225","17:25:35.390171","192.87.28.82","192.168.0.74","TLSv1.2","1474","Application Data"
"226","17:25:35.390172","192.87.28.82","192.168.0.74","TCP","1474","9001  >  52516 [ACK] Seq=132165 Ack=3217 Win=5272 Len=1408 TSval=1712759225 TSecr=164122900 [TCP PDU reassembled in 228]"
"227","17:25:35.390173","192.87.28.82","192.168.0.74","TCP","1474","9001  >  52516 [ACK] Seq=133573 Ack=3217 Win=5272 Len=1408 TSval=1712759225 TSecr=164122900 [TCP PDU reassembled in 228]"
"228","17:25:35.390174","192.87.28.82","192.168.0.74","TLSv1.2","1474","Application Data"
"229","17:25:35.390175","192.87.28.82","192.168.0.74","TCP","1474","9001  >  52516 [ACK] Seq=136389 Ack=3217 Win=5272 Len=1408 TSval=1712759225 TSecr=164122900 [TCP PDU reassembled in 233]"
"230","17:25:35.390176","192.87.28.82","192.168.0.74","TCP","1474","9001  >  52516 [ACK] Seq=137797 Ack=3217 Win=5272 Len=1408 TSval=1712759225 TSecr=164122900 [TCP PDU reassembled in 233]"
"231","17:25:35.390249","192.168.0.74","192.87.28.82","TLSv1.2","602","Application Data"
"232","17:25:35.390321","192.168.0.74","192.87.28.82","TCP","66","[TCP Window Update] 52516  >  9001 [ACK] Seq=4825 Ack=139205 Win=9066 Len=0 TSval=164122934 TSecr=1712759219"
"233","17:25:35.395073","192.87.28.82","192.168.0.74","TLSv1.2","1474","Application Data, Application Data"
"234","17:25:35.395075","192.87.28.82","192.168.0.74","TCP","1474","9001  >  52516 [ACK] Seq=140613 Ack=3217 Win=5280 Len=1408 TSval=1712759229 TSecr=164122904 [TCP PDU reassembled in 236]"
"235","17:25:35.395076","192.87.28.82","192.168.0.74","TCP","1474","9001  >  52516 [ACK] Seq=142021 Ack=3217 Win=5280 Len=1408 TSval=1712759229 TSecr=164122904 [TCP PDU reassembled in 236]"
"236","17:25:35.395077","192.87.28.82","192.168.0.74","TLSv1.2","1474","Application Data"
"237","17:25:35.395077","192.87.28.82","192.168.0.74","TLSv1.2","1474","Application Data"
"238","17:25:35.395078","192.87.28.82","192.168.0.74","TCP","1474","9001  >  52516 [ACK] Seq=146245 Ack=3217 Win=5280 Len=1408 TSval=1712759229 TSecr=164122904 [TCP PDU reassembled in 239]"
"239","17:25:35.395079","192.87.28.82","192.168.0.74","TLSv1.2","1474","Application Data"
"240","17:25:35.395080","192.87.28.82","192.168.0.74","TCP","1474","9001  >  52516 [ACK] Seq=149061 Ack=3217 Win=5280 Len=1408 TSval=1712759229 TSecr=164122904 [TCP PDU reassembled in 252]"
"241","17:25:35.395081","192.87.28.82","192.168.0.74","TCP","1474","9001  >  52516 [ACK] Seq=150469 Ack=3217 Win=5280 Len=1408 TSval=1712759229 TSecr=164122904 [TCP PDU reassembled in 252]"
"242","17:25:35.395082","64.65.63.120","192.168.0.74","TLSv1.2","1474","Application Data"
"243","17:25:35.395083","64.65.63.120","192.168.0.74","TCP","1474","443  >  52517 [PSH, ACK] Seq=8831 Ack=4201 Win=2660 Len=1408 TSval=2614836590 TSecr=4083491371 [TCP PDU reassembled in 245]"
"244","17:25:35.395084","64.65.63.120","192.168.0.74","TCP","1474","443  >  52517 [ACK] Seq=10239 Ack=4201 Win=2660 Len=1408 TSval=2614836590 TSecr=4083491371 [TCP PDU reassembled in 245]"
"245","17:25:35.395085","64.65.63.120","192.168.0.74","TLSv1.2","1474","Application Data, Application Data"
"246","17:25:35.395085","64.65.63.120","192.168.0.74","TCP","1474","443  >  52517 [PSH, ACK] Seq=13055 Ack=4201 Win=2660 Len=1408 TSval=2614836593 TSecr=4083491371 [TCP PDU reassembled in 290]"
"247","17:25:35.395158","192.168.0.74","192.87.28.82","TLSv1.2","602","Application Data"
"248","17:25:35.395193","192.168.0.74","64.65.63.120","TCP","66","52517  >  443 [ACK] Seq=4201 Ack=8831 Win=18768 Len=0 TSval=4083491598 TSecr=2614836590"
"249","17:25:35.395203","192.168.0.74","64.65.63.120","TCP","66","52517  >  443 [ACK] Seq=4201 Ack=14463 Win=18680 Len=0 TSval=4083491598 TSecr=2614836593"
"250","17:25:35.395240","192.168.0.74","192.87.28.82","TCP","66","[TCP Window Update] 52516  >  9001 [ACK] Seq=5361 Ack=151877 Win=9066 Len=0 TSval=164122939 TSecr=1712759229"
"251","17:25:35.395393","192.168.0.74","64.65.63.120","TCP","66","[TCP Window Update] 52517  >  443 [ACK] Seq=4201 Ack=14463 Win=18790 Len=0 TSval=4083491598 TSecr=2614836593"
"252","17:25:35.401273","192.87.28.82","192.168.0.74","TLSv1.2","1474","Application Data"
"253","17:25:35.401275","192.87.28.82","192.168.0.74","TCP","1474","9001  >  52516 [ACK] Seq=153285 Ack=3753 Win=5272 Len=1408 TSval=1712759237 TSecr=164122912 [TCP PDU reassembled in 257]"
"254","17:25:35.401373","192.168.0.74","192.87.28.82","TLSv1.2","602","Application Data"
"255","17:25:35.401451","192.168.0.74","192.87.28.82","TCP","66","[TCP Window Update] 52516  >  9001 [ACK] Seq=5897 Ack=154693 Win=9066 Len=0 TSval=164122945 TSecr=1712759237"
"256","17:25:35.402539","192.87.28.82","192.168.0.74","TCP","1474","9001  >  52516 [ACK] Seq=154693 Ack=3753 Win=5272 Len=1408 TSval=1712759237 TSecr=164122912 [TCP PDU reassembled in 257]"
"257","17:25:35.402541","192.87.28.82","192.168.0.74","TLSv1.2","1474","Application Data"
"258","17:25:35.402542","192.87.28.82","192.168.0.74","TCP","1474","9001  >  52516 [ACK] Seq=157509 Ack=3753 Win=5272 Len=1408 TSval=1712759237 TSecr=164122912 [TCP PDU reassembled in 259]"
"259","17:25:35.402543","192.87.28.82","192.168.0.74","TLSv1.2","1474","Application Data"
"260","17:25:35.402544","192.87.28.82","192.168.0.74","TCP","1474","9001  >  52516 [ACK] Seq=160325 Ack=3753 Win=5272 Len=1408 TSval=1712759237 TSecr=164122912 [TCP PDU reassembled in 262]"
"261","17:25:35.402545","192.87.28.82","192.168.0.74","TCP","1474","9001  >  52516 [ACK] Seq=161733 Ack=3753 Win=5272 Len=1408 TSval=1712759237 TSecr=164122912 [TCP PDU reassembled in 262]"
"262","17:25:35.402545","192.87.28.82","192.168.0.74","TLSv1.2","1474","Application Data"
"263","17:25:35.402546","192.87.28.82","192.168.0.74","TCP","1474","9001  >  52516 [ACK] Seq=164549 Ack=3753 Win=5272 Len=1408 TSval=1712759237 TSecr=164122912 [TCP PDU reassembled in 264]"
"264","17:25:35.402547","192.87.28.82","192.168.0.74","TLSv1.2","1474","Application Data, Application Data"
"265","17:25:35.402548","192.87.28.82","192.168.0.74","TCP","1474","9001  >  52516 [ACK] Seq=167365 Ack=3753 Win=5272 Len=1408 TSval=1712759237 TSecr=164122912 [TCP PDU reassembled in 268]"
"266","17:25:35.402642","192.168.0.74","192.87.28.82","TCP","66","52516  >  9001 [ACK] Seq=5897 Ack=168773 Win=9066 Len=0 TSval=164122947 TSecr=1712759237"
"267","17:25:35.410166","192.87.28.82","192.168.0.74","TCP","1474","9001  >  52516 [ACK] Seq=168773 Ack=4289 Win=5271 Len=1408 TSval=1712759244 TSecr=164122919 [TCP PDU reassembled in 268]"
"268","17:25:35.410167","192.87.28.82","192.168.0.74","TLSv1.2","1474","Application Data"
"269","17:25:35.410168","192.87.28.82","192.168.0.74","TCP","1474","9001  >  52516 [ACK] Seq=171589 Ack=4289 Win=5271 Len=1408 TSval=1712759244 TSecr=164122919 [TCP PDU reassembled in 271]"
"270","17:25:35.410169","192.87.28.82","192.168.0.74","TCP","1474","9001  >  52516 [ACK] Seq=172997 Ack=4289 Win=5271 Len=1408 TSval=1712759244 TSecr=164122919 [TCP PDU reassembled in 271]"
