"No.","Time","Source","Destination","Protocol","Length","Info"
"1","11:53:26.604682","192.168.0.74","5.28.195.2","TCP","78","63822  >  5222 [SYN] Seq=0 Win=65535 Len=0 MSS=1460 WS=16 TSval=3412260550 TSecr=0 SACK_PERM"
"2","11:53:26.604753","192.168.0.74","5.28.195.2","TCP","78","63821  >  80 [SYN] Seq=0 Win=65535 Len=0 MSS=1460 WS=16 TSval=2918077526 TSecr=0 SACK_PERM"
"3","11:53:27.270151","192.168.0.192","230.0.0.1","UDP","92","62979  >  6666 Len=50"
"4","11:53:27.605958","192.168.0.74","5.28.195.2","TCP","78","[TCP Retransmission] 63822  >  5222 [SYN] Seq=0 Win=65535 Len=0 MSS=1460 WS=16 TSval=3412261551 TSecr=0 SACK_PERM"
"5","11:53:27.605996","192.168.0.74","5.28.195.2","TCP","78","[TCP Retransmission] 63821  >  80 [SYN] Seq=0 Win=65535 Len=0 MSS=1460 WS=16 TSval=2918078527 TSecr=0 SACK_PERM"
"6","11:53:27.986098","192.168.0.192","230.0.0.1","UDP","92","58107  >  6666 Len=50"
"7","11:53:28.191672","192.168.0.192","230.0.0.1","UDP","92","62979  >  6666 Len=50"
"8","11:53:28.445047","192.168.0.74","64.65.63.120","TLSv1.2","1116","Application Data"
"9","11:53:28.492273","64.65.63.120","192.168.0.74","TCP","66","443  >  59487 [ACK] Seq=1 Ack=1051 Win=3453 Len=0 TSval=2681309681 TSecr=3164017003"
"10","11:53:28.655155","64.65.63.120","192.168.0.74","TLSv1.2","602","Application Data"
"11","11:53:28.655259","192.168.0.74","64.65.63.120","TCP","66","59487  >  443 [ACK] Seq=1051 Ack=537 Win=9190 Len=0 TSval=3164017214 TSecr=2681309842"
"12","11:53:28.775213","192.168.0.74","64.65.63.120","TLSv1.2","602","Application Data"
"13","11:53:28.791105","2a00:ab00:533:6::100","2a02:ab88:b:4100:6163:ab1b:4f48:fc2c","TLSv1.2","110","Application Data"
"14","11:53:28.791675","2a02:ab88:b:4100:6163:ab1b:4f48:fc2c","2a00:ab00:533:6::100","TCP","86","57688  >  443 [ACK] Seq=1 Ack=25 Win=2048 Len=0 TSval=3389118201 TSecr=3076743142"
"15","11:53:28.791678","2a02:ab88:b:4100:6163:ab1b:4f48:fc2c","2a00:ab00:533:6::100","TLSv1.2","110","Application Data"
"16","11:53:28.791678","2a02:ab88:b:4100:6163:ab1b:4f48:fc2c","2a00:ab00:533:6::100","TLSv1.2","112","Application Data"
"17","11:53:28.814055","64.65.63.120","192.168.0.74","TCP","66","443  >  59487 [ACK] Seq=537 Ack=1587 Win=3449 Len=0 TSval=2681310003 TSecr=3164017334"
"18","11:53:28.824411","192.168.0.74","192.87.28.82","TLSv1.2","602","Application Data"
"19","11:53:28.838905","2a00:ab00:533:6::100","2a02:ab88:b:4100:6163:ab1b:4f48:fc2c","TCP","86","443  >  57688 [ACK] Seq=25 Ack=25 Win=505 Len=0 TSval=3076743190 TSecr=3389118201"
"20","11:53:28.843917","2a00:ab00:533:6::100","2a02:ab88:b:4100:6163:ab1b:4f48:fc2c","TCP","86","443  >  57688 [ACK] Seq=25 Ack=51 Win=505 Len=0 TSval=3076743194 TSecr=3389118201"
"21","11:53:28.902061","192.87.28.82","192.168.0.74","TCP","66","9001  >  59488 [ACK] Seq=1 Ack=537 Win=3520 Len=0 TSval=2693359369 TSecr=3832886338"
"22","11:53:29.003843","192.168.0.192","230.0.0.1","UDP","92","58107  >  6666 Len=50"
"23","11:53:29.017865","64.65.63.120","192.168.0.74","TCP","1474","443  >  59487 [ACK] Seq=537 Ack=1587 Win=3449 Len=1408 TSval=2681310206 TSecr=3164017334 [TCP PDU reassembled in 25]"
"24","11:53:29.017870","64.65.63.120","192.168.0.74","TCP","1474","443  >  59487 [PSH, ACK] Seq=1945 Ack=1587 Win=3449 Len=1408 TSval=2681310206 TSecr=3164017334 [TCP PDU reassembled in 25]"
"25","11:53:29.017872","64.65.63.120","192.168.0.74","TLSv1.2","870","Application Data"
"26","11:53:29.018121","192.168.0.74","64.65.63.120","TCP","66","59487  >  443 [ACK] Seq=1587 Ack=1945 Win=9176 Len=0 TSval=3164017576 TSecr=2681310206"
"27","11:53:29.018205","192.168.0.74","64.65.63.120","TCP","66","59487  >  443 [ACK] Seq=1587 Ack=4157 Win=9142 Len=0 TSval=3164017577 TSecr=2681310206"
"28","11:53:29.018340","192.168.0.74","64.65.63.120","TCP","66","[TCP Window Update] 59487  >  443 [ACK] Seq=1587 Ack=4157 Win=9198 Len=0 TSval=3164017577 TSecr=2681310206"
"29","11:53:29.018559","192.168.0.74","64.65.63.120","TLSv1.2","602","Application Data"
"30","11:53:29.045466","64.65.63.120","192.168.0.74","TCP","1474","443  >  59487 [ACK] Seq=4157 Ack=1587 Win=3449 Len=1408 TSval=2681310236 TSecr=3164017334 [TCP PDU reassembled in 34]"
"31","11:53:29.045468","64.65.63.120","192.168.0.74","TCP","1474","443  >  59487 [PSH, ACK] Seq=5565 Ack=1587 Win=3449 Len=1408 TSval=2681310236 TSecr=3164017334 [TCP PDU reassembled in 34]"
"32","11:53:29.045576","192.168.0.74","64.65.63.120","TCP","66","59487  >  443 [ACK] Seq=2123 Ack=6973 Win=9154 Len=0 TSval=3164017604 TSecr=2681310236"
"33","11:53:29.045710","192.168.0.74","64.65.63.120","TCP","66","[TCP Window Update] 59487  >  443 [ACK] Seq=2123 Ack=6973 Win=9198 Len=0 TSval=3164017604 TSecr=2681310236"
"34","11:53:29.053167","64.65.63.120","192.168.0.74","TLSv1.2","870","Application Data"
"35","11:53:29.053169","64.65.63.120","192.168.0.74","TCP","66","[TCP Dup ACK 34#1] 443  >  59487 [ACK] Seq=7777 Ack=2123 Win=3445 Len=0 TSval=2681310245 TSecr=3164017577"
"36","11:53:29.053265","192.168.0.74","64.65.63.120","TCP","66","59487  >  443 [ACK] Seq=2123 Ack=7777 Win=9186 Len=0 TSval=3164017612 TSecr=2681310245"
"37","11:53:29.106974","64.65.63.120","192.168.0.74","TCP","1474","443  >  59487 [ACK] Seq=7777 Ack=2123 Win=3445 Len=1408 TSval=2681310298 TSecr=3164017612 [TCP PDU reassembled in 39]"
"38","11:53:29.106975","64.65.63.120","192.168.0.74","TCP","1474","443  >  59487 [PSH, ACK] Seq=9185 Ack=2123 Win=3445 Len=1408 TSval=2681310298 TSecr=3164017612 [TCP PDU reassembled in 39]"
"39","11:53:29.106977","64.65.63.120","192.168.0.74","TLSv1.2","870","Application Data"
"40","11:53:29.107071","192.168.0.74","64.65.63.120","TCP","66","59487  >  443 [ACK] Seq=2123 Ack=11397 Win=9142 Len=0 TSval=3164017666 TSecr=2681310298"
"41","11:53:29.107186","192.168.0.74","64.65.63.120","TCP","66","[TCP Window Update] 59487  >  443 [ACK] Seq=2123 Ack=11397 Win=9198 Len=0 TSval=3164017666 TSecr=2681310298"
"42","11:53:29.110365","192.168.0.74","64.65.63.120","TLSv1.2","602","Application Data"
"43","11:53:29.121491","64.65.63.120","192.168.0.74","TCP","1474","443  >  59487 [ACK] Seq=11397 Ack=2123 Win=3445 Len=1408 TSval=2681310311 TSecr=3164017612 [TCP PDU reassembled in 45]"
"44","11:53:29.121494","64.65.63.120","192.168.0.74","TCP","1474","443  >  59487 [PSH, ACK] Seq=12805 Ack=2123 Win=3445 Len=1408 TSval=2681310311 TSecr=3164017612 [TCP PDU reassembled in 45]"
"45","11:53:29.121496","64.65.63.120","192.168.0.74","TLSv1.2","1474","Application Data"
"46","11:53:29.121497","64.65.63.120","192.168.0.74","TCP","1474","443  >  59487 [PSH, ACK] Seq=15621 Ack=2123 Win=3445 Len=1408 TSval=2681310311 TSecr=3164017612 [TCP PDU reassembled in 50]"
"47","11:53:29.121499","64.65.63.120","192.168.0.74","TCP","1474","443  >  59487 [ACK] Seq=17029 Ack=2123 Win=3445 Len=1408 TSval=2681310311 TSecr=3164017612 [TCP PDU reassembled in 50]"
"48","11:53:29.121616","192.168.0.74","64.65.63.120","TLSv1.2","1116","Application Data"
"49","11:53:29.121740","192.168.0.74","64.65.63.120","TCP","66","[TCP Window Update] 59487  >  443 [ACK] Seq=3709 Ack=18437 Win=9198 Len=0 TSval=3164017680 TSecr=2681310311"
"50","11:53:29.130779","64.65.63.120","192.168.0.74","TLSv1.2","1474","Application Data"
"51","11:53:29.130891","192.168.0.74","64.65.63.120","TCP","66","59487  >  443 [ACK] Seq=3709 Ack=19845 Win=9176 Len=0 TSval=3164017689 TSecr=2681310322"
"52","11:53:29.132291","64.65.63.120","192.168.0.74","TLSv1.2","1474","Application Data"
"53","11:53:29.132361","192.168.0.74","64.65.63.120","TLSv1.2","602","Application Data"
"54","11:53:29.147175","64.65.63.120","192.168.0.74","TCP","1474","443  >  59487 [ACK] Seq=21253 Ack=2123 Win=3445 Len=1408 TSval=2681310337 TSecr=3164017666 [TCP PDU reassembled in 56]"
"55","11:53:29.147177","64.65.63.120","192.168.0.74","TCP","1474","443  >  59487 [PSH, ACK] Seq=22661 Ack=2123 Win=3445 Len=1408 TSval=2681310337 TSecr=3164017666 [TCP PDU reassembled in 56]"
"56","11:53:29.147178","64.65.63.120","192.168.0.74","TLSv1.2","1474","Application Data"
"57","11:53:29.147180","64.65.63.120","192.168.0.74","TCP","1474","443  >  59487 [PSH, ACK] Seq=25477 Ack=2123 Win=3445 Len=1408 TSval=2681310337 TSecr=3164017666 [TCP PDU reassembled in 59]"
"58","11:53:29.147181","64.65.63.120","192.168.0.74","TCP","1474","443  >  59487 [ACK] Seq=26885 Ack=2659 Win=3441 Len=1408 TSval=2681310337 TSecr=3164017669 [TCP PDU reassembled in 59]"
"59","11:53:29.147182","64.65.63.120","192.168.0.74","TLSv1.2","1292","Application Data, Application Data"
"60","11:53:29.147299","192.168.0.74","64.65.63.120","TLSv1.2","1138","Application Data, Application Data"
"61","11:53:29.147340","192.168.0.74","64.65.63.120","TCP","66","59487  >  443 [ACK] Seq=5317 Ack=29519 Win=9069 Len=0 TSval=3164017706 TSecr=2681310337"
"62","11:53:29.147382","192.168.0.74","64.65.63.120","TCP","66","[TCP Window Update] 59487  >  443 [ACK] Seq=5317 Ack=29519 Win=9198 Len=0 TSval=3164017706 TSecr=2681310337"
"63","11:53:29.158002","64.65.63.120","192.168.0.74","TCP","1474","443  >  59487 [ACK] Seq=29519 Ack=3709 Win=3433 Len=1408 TSval=2681310348 TSecr=3164017680 [TCP PDU reassembled in 65]"
"64","11:53:29.158004","64.65.63.120","192.168.0.74","TCP","1474","443  >  59487 [PSH, ACK] Seq=30927 Ack=3709 Win=3433 Len=1408 TSval=2681310348 TSecr=3164017680 [TCP PDU reassembled in 65]"
"65","11:53:29.158006","64.65.63.120","192.168.0.74","TLSv1.2","1474","Application Data"
"66","11:53:29.158007","64.65.63.120","192.168.0.74","TCP","1474","443  >  59487 [PSH, ACK] Seq=33743 Ack=3709 Win=3433 Len=1408 TSval=2681310348 TSecr=3164017680 [TCP PDU reassembled in 68]"
"67","11:53:29.158008","64.65.63.120","192.168.0.74","TCP","1474","443  >  59487 [ACK] Seq=35151 Ack=3709 Win=3433 Len=1408 TSval=2681310348 TSecr=3164017680 [TCP PDU reassembled in 68]"
"68","11:53:29.158010","64.65.63.120","192.168.0.74","TLSv1.2","1474","Application Data"
"69","11:53:29.158011","64.65.63.120","192.168.0.74","TCP","1474","443  >  59487 [ACK] Seq=37967 Ack=3709 Win=3433 Len=1408 TSval=2681310348 TSecr=3164017680 [TCP PDU reassembled in 71]"
"70","11:53:29.158013","64.65.63.120","192.168.0.74","TCP","1474","443  >  59487 [PSH, ACK] Seq=39375 Ack=3709 Win=3433 Len=1408 TSval=2681310348 TSecr=3164017680 [TCP PDU reassembled in 71]"
"71","11:53:29.158014","64.65.63.120","192.168.0.74","TLSv1.2","1474","Application Data"
"72","11:53:29.158018","64.65.63.120","192.168.0.74","TCP","1474","443  >  59487 [PSH, ACK] Seq=42191 Ack=3709 Win=3433 Len=1408 TSval=2681310348 TSecr=3164017680 [TCP PDU reassembled in 75]"
"73","11:53:29.158129","192.168.0.74","64.65.63.120","TCP","66","59487  >  443 [ACK] Seq=5317 Ack=43599 Win=8978 Len=0 TSval=3164017717 TSecr=2681310348"
"74","11:53:29.158248","192.168.0.74","64.65.63.120","TCP","66","[TCP Window Update] 59487  >  443 [ACK] Seq=5317 Ack=43599 Win=9198 Len=0 TSval=3164017717 TSecr=2681310348"
"75","11:53:29.166585","64.65.63.120","192.168.0.74","TLSv1.2","1474","Application Data"
"76","11:53:29.166711","192.168.0.74","64.65.63.120","TLSv1.2","602","Application Data"
"77","11:53:29.183256","64.65.63.120","192.168.0.74","TLSv1.2","622","Application Data"
"78","11:53:29.183402","192.168.0.74","64.65.63.120","TCP","66","59487  >  443 [ACK] Seq=5853 Ack=45563 Win=9190 Len=0 TSval=3164017742 TSecr=2681310374"
"79","11:53:29.197390","64.65.63.120","192.168.0.74","TCP","1474","443  >  59487 [ACK] Seq=45563 Ack=5317 Win=3421 Len=1408 TSval=2681310387 TSecr=3164017717 [TCP PDU reassembled in 81]"
"80","11:53:29.197392","64.65.63.120","192.168.0.74","TCP","1474","443  >  59487 [PSH, ACK] Seq=46971 Ack=5317 Win=3421 Len=1408 TSval=2681310387 TSecr=3164017717 [TCP PDU reassembled in 81]"
"81","11:53:29.197394","64.65.63.120","192.168.0.74","TLSv1.2","1474","Application Data"
"82","11:53:29.197396","64.65.63.120","192.168.0.74","TCP","1474","443  >  59487 [PSH, ACK] Seq=49787 Ack=5317 Win=3421 Len=1408 TSval=2681310387 TSecr=3164017717 [TCP PDU reassembled in 84]"
"83","11:53:29.197397","64.65.63.120","192.168.0.74","TCP","1474","443  >  59487 [ACK] Seq=51195 Ack=5317 Win=3421 Len=1408 TSval=2681310387 TSecr=3164017717 [TCP PDU reassembled in 84]"
"84","11:53:29.197399","64.65.63.120","192.168.0.74","TLSv1.2","1474","Application Data"
"85","11:53:29.197401","64.65.63.120","192.168.0.74","TCP","1474","443  >  59487 [ACK] Seq=54011 Ack=5317 Win=3421 Len=1408 TSval=2681310387 TSecr=3164017717 [TCP PDU reassembled in 89]"
"86","11:53:29.197403","64.65.63.120","192.168.0.74","TCP","1474","443  >  59487 [PSH, ACK] Seq=55419 Ack=5317 Win=3421 Len=1408 TSval=2681310387 TSecr=3164017717 [TCP PDU reassembled in 89]"
"87","11:53:29.197513","192.168.0.74","64.65.63.120","TCP","66","59487  >  443 [ACK] Seq=5853 Ack=56827 Win=9022 Len=0 TSval=3164017756 TSecr=2681310387"
"88","11:53:29.197627","192.168.0.74","64.65.63.120","TCP","66","[TCP Window Update] 59487  >  443 [ACK] Seq=5853 Ack=56827 Win=9198 Len=0 TSval=3164017756 TSecr=2681310387"
"89","11:53:29.199520","64.65.63.120","192.168.0.74","TLSv1.2","1474","Application Data"
"90","11:53:29.199527","64.65.63.120","192.168.0.74","TCP","1474","443  >  59487 [PSH, ACK] Seq=58235 Ack=5317 Win=3421 Len=1408 TSval=2681310391 TSecr=3164017717 [TCP PDU reassembled in 94]"
"91","11:53:29.199616","192.168.0.74","64.65.63.120","TLSv1.2","602","Application Data"
"92","11:53:29.199688","192.168.0.74","64.65.63.120","TCP","66","[TCP Window Update] 59487  >  443 [ACK] Seq=6389 Ack=59643 Win=9198 Len=0 TSval=3164017758 TSecr=2681310391"
"93","11:53:29.201517","64.65.63.120","192.168.0.74","TCP","1474","443  >  59487 [ACK] Seq=59643 Ack=5317 Win=3421 Len=1408 TSval=2681310391 TSecr=3164017717 [TCP PDU reassembled in 94]"
"94","11:53:29.201524","64.65.63.120","192.168.0.74","TLSv1.2","1474","Application Data"
"95","11:53:29.201527","64.65.63.120","192.168.0.74","TCP","1474","443  >  59487 [PSH, ACK] Seq=62459 Ack=5317 Win=3421 Len=1408 TSval=2681310391 TSecr=3164017717 [TCP PDU reassembled in 97]"
"96","11:53:29.201529","64.65.63.120","192.168.0.74","TCP","1474","443  >  59487 [ACK] Seq=63867 Ack=5317 Win=3421 Len=1408 TSval=2681310391 TSecr=3164017717 [TCP PDU reassembled in 97]"
"97","11:53:29.201531","64.65.63.120","192.168.0.74","TLSv1.2","1474","Application Data"
"98","11:53:29.201533","64.65.63.120","192.168.0.74","TCP","1474","443  >  59487 [ACK] Seq=66683 Ack=5317 Win=3421 Len=1408 TSval=2681310391 TSecr=3164017717 [TCP PDU reassembled in 102]"
"99","11:53:29.201535","64.65.63.120","192.168.0.74","TCP","1474","443  >  59487 [PSH, ACK] Seq=68091 Ack=5317 Win=3421 Len=1408 TSval=2681310391 TSecr=3164017717 [TCP PDU reassembled in 102]"
"100","11:53:29.201668","192.168.0.74","64.65.63.120","TCP","66","59487  >  443 [ACK] Seq=6389 Ack=69499 Win=9198 Len=0 TSval=3164017760 TSecr=2681310391"
"101","11:53:29.208476","192.168.0.192","230.0.0.1","UDP","92","62979  >  6666 Len=50"
"102","11:53:29.210152","64.65.63.120","192.168.0.74","TLSv1.2","1474","Application Data, Application Data"
"103","11:53:29.210154","64.65.63.120","192.168.0.74","TCP","1474","443  >  59487 [PSH, ACK] Seq=70907 Ack=5853 Win=3417 Len=1408 TSval=2681310400 TSecr=3164017725 [TCP PDU reassembled in 109]"
"104","11:53:29.210155","64.65.63.120","192.168.0.74","TCP","1474","443  >  59487 [ACK] Seq=72315 Ack=5853 Win=3417 Len=1408 TSval=2681310400 TSecr=3164017725 [TCP PDU reassembled in 109]"
"105","11:53:29.210252","192.168.0.74","64.65.63.120","TCP","66","59487  >  443 [ACK] Seq=6389 Ack=73723 Win=9132 Len=0 TSval=3164017769 TSecr=2681310400"
"106","11:53:29.210349","192.168.0.74","64.65.63.120","TCP","66","[TCP Window Update] 59487  >  443 [ACK] Seq=6389 Ack=73723 Win=9198 Len=0 TSval=3164017769 TSecr=2681310400"
"107","11:53:29.213723","192.168.0.74","64.65.63.120","TLSv1.2","1474","Application Data, Application Data"
"108","11:53:29.213743","192.168.0.74","64.65.63.120","TLSv1.2","266","Application Data"
"109","11:53:29.214595","64.65.63.120","192.168.0.74","TLSv1.2","1474","Application Data, Application Data"
"110","11:53:29.214597","64.65.63.120","192.168.0.74","TCP","1474","443  >  59487 [PSH, ACK] Seq=75131 Ack=5853 Win=3417 Len=1408 TSval=2681310404 TSecr=3164017725 [TCP PDU reassembled in 112]"
"111","11:53:29.214598","64.65.63.120","192.168.0.74","TCP","1474","443  >  59487 [ACK] Seq=76539 Ack=5853 Win=3417 Len=1408 TSval=2681310404 TSecr=3164017725 [TCP PDU reassembled in 112]"
"112","11:53:29.214600","64.65.63.120","192.168.0.74","TLSv1.2","1474","Application Data"
"113","11:53:29.214601","64.65.63.120","192.168.0.74","TCP","1474","443  >  59487 [PSH, ACK] Seq=79355 Ack=5853 Win=3417 Len=1408 TSval=2681310404 TSecr=3164017725 [TCP PDU reassembled in 114]"
"114","11:53:29.214602","64.65.63.120","192.168.0.74","TLSv1.2","1474","Application Data"
"115","11:53:29.214603","64.65.63.120","192.168.0.74","TCP","1474","443  >  59487 [ACK] Seq=82171 Ack=5853 Win=3417 Len=1408 TSval=2681310404 TSecr=3164017725 [TCP PDU reassembled in 118]"
"116","11:53:29.214604","64.65.63.120","192.168.0.74","TCP","1474","443  >  59487 [PSH, ACK] Seq=83579 Ack=5853 Win=3417 Len=1408 TSval=2681310404 TSecr=3164017725 [TCP PDU reassembled in 118]"
"117","11:53:29.214727","192.168.0.74","64.65.63.120","TCP","66","59487  >  443 [ACK] Seq=7997 Ack=84987 Win=9198 Len=0 TSval=3164017773 TSecr=2681310404"
"118","11:53:29.217560","64.65.63.120","192.168.0.74","TLSv1.2","998","Application Data"
"119","11:53:29.217643","192.168.0.74","64.65.63.120","TCP","66","59487  >  443 [ACK] Seq=7997 Ack=85919 Win=9198 Len=0 TSval=3164017776 TSecr=2681310408"
"120","11:53:29.219229","192.168.0.74","64.65.63.120","TLSv1.2","1474","Application Data"
"121","11:53:29.219239","192.168.0.74","64.65.63.120","TLSv1.2","244","Application Data"
"122","11:53:29.222769","64.65.63.120","192.168.0.74","TCP","1474","443  >  59487 [ACK] Seq=85919 Ack=5853 Win=3417 Len=1408 TSval=2681310412 TSecr=3164017742 [TCP PDU reassembled in 124]"
"123","11:53:29.222772","64.65.63.120","192.168.0.74","TCP","1474","443  >  59487 [PSH, ACK] Seq=87327 Ack=5853 Win=3417 Len=1408 TSval=2681310412 TSecr=3164017742 [TCP PDU reassembled in 124]"
"124","11:53:29.222774","64.65.63.120","192.168.0.74","TLSv1.2","1474","Application Data"
"125","11:53:29.222776","64.65.63.120","192.168.0.74","TCP","1474","443  >  59487 [PSH, ACK] Seq=90143 Ack=5853 Win=3417 Len=1408 TSval=2681310413 TSecr=3164017742 [TCP PDU reassembled in 128]"
"126","11:53:29.222782","64.65.63.120","192.168.0.74","TCP","1474","443  >  59487 [ACK] Seq=91551 Ack=5853 Win=3417 Len=1408 TSval=2681310413 TSecr=3164017742 [TCP PDU reassembled in 128]"
"127","11:53:29.222946","192.168.0.74","64.65.63.120","TCP","66","59487  >  443 [ACK] Seq=9583 Ack=92959 Win=9198 Len=0 TSval=3164017781 TSecr=2681310413"
"128","11:53:29.226389","64.65.63.120","192.168.0.74","TLSv1.2","1474","Application Data, Application Data"
"129","11:53:29.233133","64.65.63.120","192.168.0.74","TLSv1.2","1474","Application Data"
"130","11:53:29.233348","192.168.0.74","64.65.63.120","TCP","66","59487  >  443 [ACK] Seq=9583 Ack=95775 Win=9198 Len=0 TSval=3164017792 TSecr=2681310417"
"131","11:53:29.250322","64.65.63.120","192.168.0.74","TLSv1.2","600","Application Data"
"132","11:53:29.250427","192.168.0.74","64.65.63.120","TCP","66","59487  >  443 [ACK] Seq=9583 Ack=96309 Win=9190 Len=0 TSval=3164017809 TSecr=2681310441"
"133","11:53:29.253019","192.168.0.74","64.65.63.120","TLSv1.2","1474","Application Data"
"134","11:53:29.253020","192.168.0.74","64.65.63.120","TCP","1474","59487  >  443 [ACK] Seq=10991 Ack=96309 Win=9198 Len=1408 TSval=3164017811 TSecr=2681310441 [TCP PDU reassembled in 136]"
"135","11:53:29.253021","192.168.0.74","64.65.63.120","TCP","1474","59487  >  443 [ACK] Seq=12399 Ack=96309 Win=9198 Len=1408 TSval=3164017811 TSecr=2681310441 [TCP PDU reassembled in 136]"
"136","11:53:29.253034","192.168.0.74","64.65.63.120","TLSv1.2","448","Application Data"
"137","11:53:29.253050","192.168.0.74","64.65.63.120","TCP","1474","59487  >  443 [ACK] Seq=14189 Ack=96309 Win=9198 Len=1408 TSval=3164017812 TSecr=2681310441 [TCP PDU reassembled in 139]"
"138","11:53:29.253051","192.168.0.74","64.65.63.120","TCP","1474","59487  >  443 [ACK] Seq=15597 Ack=96309 Win=9198 Len=1408 TSval=3164017812 TSecr=2681310441 [TCP PDU reassembled in 139]"
"139","11:53:29.253053","192.168.0.74","64.65.63.120","TLSv1.2","420","Application Data"
"140","11:53:29.254642","64.65.63.120","192.168.0.74","TCP","66","443  >  59487 [ACK] Seq=96309 Ack=9583 Win=3389 Len=0 TSval=2681310446 TSecr=3164017778"
"141","11:53:29.254865","192.168.0.74","64.65.63.120","TCP","1474","59487  >  443 [ACK] Seq=17359 Ack=96309 Win=9198 Len=1408 TSval=3164017813 TSecr=2681310446 [TCP PDU reassembled in 143]"
"142","11:53:29.254866","192.168.0.74","64.65.63.120","TCP","1474","59487  >  443 [ACK] Seq=18767 Ack=96309 Win=9198 Len=1408 TSval=3164017813 TSecr=2681310446 [TCP PDU reassembled in 143]"
"143","11:53:29.254884","192.168.0.74","64.65.63.120","TLSv1.2","1320","Application Data"
"144","11:53:29.277429","64.65.63.120","192.168.0.74","TLSv1.2","1474","Application Data"
"145","11:53:29.277431","64.65.63.120","192.168.0.74","TCP","1474","443  >  59487 [ACK] Seq=97717 Ack=9583 Win=3389 Len=1408 TSval=2681310468 TSecr=3164017792 [TCP PDU reassembled in 148]"
"146","11:53:29.277433","64.65.63.120","192.168.0.74","TCP","1474","443  >  59487 [PSH, ACK] Seq=99125 Ack=9583 Win=3389 Len=1408 TSval=2681310468 TSecr=3164017792 [TCP PDU reassembled in 148]"
"147","11:53:29.277594","192.168.0.74","64.65.63.120","TLSv1.2","666","Application Data"
"148","11:53:29.279794","64.65.63.120","192.168.0.74","TLSv1.2","1474","Application Data"
"149","11:53:29.279795","64.65.63.120","192.168.0.74","TCP","1474","443  >  59487 [ACK] Seq=101941 Ack=9583 Win=3389 Len=1408 TSval=2681310470 TSecr=3164017792 [TCP PDU reassembled in 151]"
"150","11:53:29.279796","64.65.63.120","192.168.0.74","TCP","1474","443  >  59487 [PSH, ACK] Seq=103349 Ack=9583 Win=3389 Len=1408 TSval=2681310470 TSecr=3164017792 [TCP PDU reassembled in 151]"
"151","11:53:29.279797","64.65.63.120","192.168.0.74","TLSv1.2","1474","Application Data"
"152","11:53:29.279798","64.65.63.120","192.168.0.74","TCP","1474","443  >  59487 [ACK] Seq=106165 Ack=9583 Win=3389 Len=1408 TSval=2681310470 TSecr=3164017792 [TCP PDU reassembled in 154]"
"153","11:53:29.279798","64.65.63.120","192.168.0.74","TCP","1474","443  >  59487 [PSH, ACK] Seq=107573 Ack=9583 Win=3389 Len=1408 TSval=2681310470 TSecr=3164017792 [TCP PDU reassembled in 154]"
"154","11:53:29.279799","64.65.63.120","192.168.0.74","TLSv1.2","1474","Application Data"
"155","11:53:29.279800","64.65.63.120","192.168.0.74","TCP","1474","443  >  59487 [PSH, ACK] Seq=110389 Ack=9583 Win=3389 Len=1408 TSval=2681310470 TSecr=3164017792 [TCP PDU reassembled in 156]"
"156","11:53:29.279801","64.65.63.120","192.168.0.74","TLSv1.2","1474","Application Data"
"157","11:53:29.279802","64.65.63.120","192.168.0.74","TCP","1474","443  >  59487 [ACK] Seq=113205 Ack=9583 Win=3389 Len=1408 TSval=2681310470 TSecr=3164017792 [TCP PDU reassembled in 159]"
"158","11:53:29.279802","64.65.63.120","192.168.0.74","TCP","1474","443  >  59487 [PSH, ACK] Seq=114613 Ack=9583 Win=3389 Len=1408 TSval=2681310470 TSecr=3164017792 [TCP PDU reassembled in 159]"
"159","11:53:29.279803","64.65.63.120","192.168.0.74","TLSv1.2","1474","Application Data"
"160","11:53:29.280134","192.168.0.74","64.65.63.120","TLSv1.2","1116","Application Data"
"161","11:53:29.280156","64.65.63.120","192.168.0.74","TLSv1.2","1474","Application Data"
"162","11:53:29.280157","64.65.63.120","192.168.0.74","TCP","1474","443  >  59487 [PSH, ACK] Seq=118837 Ack=9583 Win=3389 Len=1408 TSval=2681310470 TSecr=3164017792 [TCP PDU reassembled in 163]"
"163","11:53:29.280158","64.65.63.120","192.168.0.74","TLSv1.2","1474","Application Data"
"164","11:53:29.280159","64.65.63.120","192.168.0.74","TCP","1474","443  >  59487 [ACK] Seq=121653 Ack=9583 Win=3389 Len=1408 TSval=2681310470 TSecr=3164017792 [TCP PDU reassembled in 166]"
"165","11:53:29.280160","64.65.63.120","192.168.0.74","TCP","1474","443  >  59487 [PSH, ACK] Seq=123061 Ack=9583 Win=3389 Len=1408 TSval=2681310470 TSecr=3164017792 [TCP PDU reassembled in 166]"
"166","11:53:29.280161","64.65.63.120","192.168.0.74","TLSv1.2","1474","Application Data"
"167","11:53:29.280162","64.65.63.120","192.168.0.74","TCP","1474","443  >  59487 [ACK] Seq=125877 Ack=9583 Win=3389 Len=1408 TSval=2681310470 TSecr=3164017792 [TCP PDU reassembled in 169]"
"168","11:53:29.280163","64.65.63.120","192.168.0.74","TCP","1474","443  >  59487 [PSH, ACK] Seq=127285 Ack=9583 Win=3389 Len=1408 TSval=2681310470 TSecr=3164017792 [TCP PDU reassembled in 169]"
"169","11:53:29.280164","64.65.63.120","192.168.0.74","TLSv1.2","1474","Application Data"
"170","11:53:29.280164","64.65.63.120","192.168.0.74","TCP","1474","443  >  59487 [ACK] Seq=130101 Ack=9583 Win=3389 Len=1408 TSval=2681310470 TSecr=3164017792 [TCP PDU reassembled in 172]"
"171","11:53:29.280165","64.65.63.120","192.168.0.74","TCP","1474","443  >  59487 [PSH, ACK] Seq=131509 Ack=9583 Win=3389 Len=1408 TSval=2681310470 TSecr=3164017792 [TCP PDU reassembled in 172]"
"172","11:53:29.280166","64.65.63.120","192.168.0.74","TLSv1.2","1474","Application Data, Application Data"
"173","11:53:29.280167","64.65.63.120","192.168.0.74","TCP","1474","443  >  59487 [ACK] Seq=134325 Ack=9583 Win=3389 Len=1408 TSval=2681310470 TSecr=3164017792 [TCP PDU reassembled in 178]"
"174","11:53:29.280168","64.65.63.120","192.168.0.74","TCP","1474","443  >  59487 [PSH, ACK] Seq=135733 Ack=9583 Win=3389 Len=1408 TSval=2681310470 TSecr=3164017792 [TCP PDU reassembled in 178]"
"175","11:53:29.280168","192.87.28.82","192.168.0.74","TCP","1474","9001  >  59488 [ACK] Seq=1 Ack=537 Win=3520 Len=1408 TSval=2693359748 TSecr=3832886338 [TCP PDU reassembled in 204]"
"176","11:53:29.280224","192.168.0.74","192.87.28.82","TCP","66","59488  >  9001 [ACK] Seq=537 Ack=1409 Win=7350 Len=0 TSval=3832886794 TSecr=2693359748"
"177","11:53:29.280441","192.168.0.74","64.65.63.120","TCP","66","59487  >  443 [ACK] Seq=23079 Ack=137141 Win=9198 Len=0 TSval=3164017839 TSecr=2681310470"
"178","11:53:29.282953","64.65.63.120","192.168.0.74","TLSv1.2","1474","Application Data, Application Data"
"179","11:53:29.282954","64.65.63.120","192.168.0.74","TCP","1474","443  >  59487 [ACK] Seq=138549 Ack=9583 Win=3389 Len=1408 TSval=2681310474 TSecr=3164017792 [TCP PDU reassembled in 181]"
"180","11:53:29.282955","64.65.63.120","192.168.0.74","TCP","1474","443  >  59487 [PSH, ACK] Seq=139957 Ack=9583 Win=3389 Len=1408 TSval=2681310474 TSecr=3164017792 [TCP PDU reassembled in 181]"
"181","11:53:29.282956","64.65.63.120","192.168.0.74","TLSv1.2","1474","Application Data"
"182","11:53:29.282956","64.65.63.120","192.168.0.74","TCP","1474","443  >  59487 [ACK] Seq=142773 Ack=9583 Win=3389 Len=1408 TSval=2681310474 TSecr=3164017792 [TCP PDU reassembled in 184]"
"183","11:53:29.282957","64.65.63.120","192.168.0.74","TCP","1474","443  >  59487 [PSH, ACK] Seq=144181 Ack=9583 Win=3389 Len=1408 TSval=2681310474 TSecr=3164017792 [TCP PDU reassembled in 184]"
"184","11:53:29.282958","64.65.63.120","192.168.0.74","TLSv1.2","1474","Application Data"
"185","11:53:29.282959","64.65.63.120","192.168.0.74","TCP","1474","443  >  59487 [ACK] Seq=146997 Ack=9583 Win=3389 Len=1408 TSval=2681310474 TSecr=3164017792 [TCP PDU reassembled in 187]"
"186","11:53:29.282960","64.65.63.120","192.168.0.74","TCP","1474","443  >  59487 [PSH, ACK] Seq=148405 Ack=9583 Win=3389 Len=1408 TSval=2681310474 TSecr=3164017792 [TCP PDU reassembled in 187]"
"187","11:53:29.282961","64.65.63.120","192.168.0.74","TLSv1.2","1474","Application Data"
"188","11:53:29.282961","64.65.63.120","192.168.0.74","TCP","1474","443  >  59487 [ACK] Seq=151221 Ack=9583 Win=3389 Len=1408 TSval=2681310474 TSecr=3164017792 [TCP PDU reassembled in 191]"
"189","11:53:29.282967","64.65.63.120","192.168.0.74","TCP","1474","443  >  59487 [PSH, ACK] Seq=152629 Ack=9583 Win=3389 Len=1408 TSval=2681310474 TSecr=3164017792 [TCP PDU reassembled in 191]"
"190","11:53:29.282968","192.87.28.82","192.168.0.74","TCP","1474","9001  >  59488 [ACK] Seq=1409 Ack=537 Win=3520 Len=1408 TSval=2693359748 TSecr=3832886338 [TCP PDU reassembled in 204]"
"191","11:53:29.282969","64.65.63.120","192.168.0.74","TLSv1.2","1474","Application Data, Application Data"
"192","11:53:29.282970","64.65.63.120","192.168.0.74","TCP","1474","443  >  59487 [ACK] Seq=155445 Ack=9583 Win=3389 Len=1408 TSval=2681310475 TSecr=3164017792 [TCP PDU reassembled in 196]"
"193","11:53:29.282971","64.65.63.120","192.168.0.74","TCP","1474","443  >  59487 [PSH, ACK] Seq=156853 Ack=9583 Win=3389 Len=1408 TSval=2681310475 TSecr=3164017792 [TCP PDU reassembled in 196]"
"194","11:53:29.283006","192.168.0.74","192.87.28.82","TCP","66","59488  >  9001 [ACK] Seq=537 Ack=2817 Win=7350 Len=0 TSval=3832886797 TSecr=2693359748"
"195","11:53:29.283237","192.168.0.74","64.65.63.120","TLSv1.2","1138","Application Data, Application Data"
"196","11:53:29.283986","64.65.63.120","192.168.0.74","TLSv1.2","1474","Application Data"
"197","11:53:29.283987","64.65.63.120","192.168.0.74","TCP","1474","443  >  59487 [ACK] Seq=159669 Ack=9583 Win=3389 Len=1408 TSval=2681310475 TSecr=3164017792 [TCP PDU reassembled in 200]"
"198","11:53:29.284043","192.168.0.74","64.65.63.120","TCP","66","59487  >  443 [ACK] Seq=24151 Ack=161077 Win=9198 Len=0 TSval=3164017843 TSecr=2681310475"
"199","11:53:29.285432","64.65.63.120","192.168.0.74","TCP","1474","443  >  59487 [PSH, ACK] Seq=161077 Ack=9583 Win=3389 Len=1408 TSval=2681310475 TSecr=3164017792 [TCP PDU reassembled in 200]"
"200","11:53:29.285433","64.65.63.120","192.168.0.74","TLSv1.2","1474","Application Data"
"201","11:53:29.285434","64.65.63.120","192.168.0.74","TCP","1474","443  >  59487 [ACK] Seq=163893 Ack=9583 Win=3389 Len=1408 TSval=2681310475 TSecr=3164017792 [TCP PDU reassembled in 203]"
"202","11:53:29.285435","64.65.63.120","192.168.0.74","TCP","1474","443  >  59487 [PSH, ACK] Seq=165301 Ack=9583 Win=3389 Len=1408 TSval=2681310475 TSecr=3164017792 [TCP PDU reassembled in 203]"
"203","11:53:29.285436","64.65.63.120","192.168.0.74","TLSv1.2","1474","Application Data"
"204","11:53:29.285437","192.87.28.82","192.168.0.74","TLSv1.2","870","Application Data"
"205","11:53:29.285438","64.65.63.120","192.168.0.74","TCP","1474","443  >  59487 [ACK] Seq=168117 Ack=9583 Win=3389 Len=1408 TSval=2681310475 TSecr=3164017792 [TCP PDU reassembled in 206]"
"206","11:53:29.285438","64.65.63.120","192.168.0.74","TLSv1.2","1474","Application Data"
"207","11:53:29.285439","64.65.63.120","192.168.0.74","TLSv1.2","1474","Application Data"
"208","11:53:29.285440","64.65.63.120","192.168.0.74","TCP","1474","443  >  59487 [PSH, ACK] Seq=172341 Ack=9583 Win=3389 Len=1408 TSval=2681310475 TSecr=3164017792 [TCP PDU reassembled in 209]"
"209","11:53:29.285440","64.65.63.120","192.168.0.74","TLSv1.2","790","Application Data"
"210","11:53:29.285478","192.168.0.74","192.87.28.82","TCP","66","59488  >  9001 [ACK] Seq=537 Ack=3621 Win=7360 Len=0 TSval=3832886799 TSecr=2693359748"
"211","11:53:29.285568","192.168.0.74","64.65.63.120","TCP","66","59487  >  443 [ACK] Seq=24151 Ack=174473 Win=9198 Len=0 TSval=3164017844 TSecr=2681310476"
"212","11:53:29.285928","64.65.63.120","192.168.0.74","TCP","1474","443  >  59487 [ACK] Seq=174473 Ack=9583 Win=3389 Len=1408 TSval=2681310477 TSecr=3164017809 [TCP PDU reassembled in 221]"
"213","11:53:29.285929","192.87.28.82","192.168.0.74","TCP","1474","9001  >  59488 [ACK] Seq=3621 Ack=537 Win=3520 Len=1408 TSval=2693359751 TSecr=3832886338 [TCP PDU reassembled in 216]"
"214","11:53:29.285952","192.168.0.74","192.87.28.82","TCP","66","59488  >  9001 [ACK] Seq=537 Ack=5029 Win=7350 Len=0 TSval=3832886799 TSecr=2693359751"
"215","11:53:29.287489","192.87.28.82","192.168.0.74","TCP","1474","9001  >  59488 [ACK] Seq=5029 Ack=537 Win=3520 Len=1408 TSval=2693359751 TSecr=3832886338 [TCP PDU reassembled in 216]"
"216","11:53:29.287490","192.87.28.82","192.168.0.74","TLSv1.2","1320","Application Data"
"217","11:53:29.287491","192.87.28.82","192.168.0.74","TCP","1474","9001  >  59488 [ACK] Seq=7691 Ack=537 Win=3520 Len=1408 TSval=2693359751 TSecr=3832886338 [TCP PDU reassembled in 219]"
"218","11:53:29.287492","192.87.28.82","192.168.0.74","TCP","1474","9001  >  59488 [ACK] Seq=9099 Ack=537 Win=3520 Len=1408 TSval=2693359751 TSecr=3832886338 [TCP PDU reassembled in 219]"
"219","11:53:29.287493","192.87.28.82","192.168.0.74","TLSv1.2","1320","Application Data"
"220","11:53:29.287494","64.65.63.120","192.168.0.74","TCP","1474","443  >  59487 [PSH, ACK] Seq=175881 Ack=9583 Win=3389 Len=1408 TSval=2681310477 TSecr=3164017809 [TCP PDU reassembled in 221]"
"221","11:53:29.287494","64.65.63.120","192.168.0.74","TLSv1.2","1474","Application Data"
"222","11:53:29.287495","64.65.63.120","192.168.0.74","TCP","1474","443  >  59487 [ACK] Seq=178697 Ack=9583 Win=3389 Len=1408 TSval=2681310478 TSecr=3164017809 [TCP PDU reassembled in 224]"
"223","11:53:29.287496","64.65.63.120","192.168.0.74","TCP","1474","443  >  59487 [PSH, ACK] Seq=180105 Ack=9583 Win=3389 Len=1408 TSval=2681310478 TSecr=3164017809 [TCP PDU reassembled in 224]"
"224","11:53:29.287497","64.65.63.120","192.168.0.74","TLSv1.2","1474","Application Data"
"225","11:53:29.287537","192.168.0.74","192.87.28.82","TCP","66","59488  >  9001 [ACK] Seq=537 Ack=11761 Win=7267 Len=0 TSval=3832886801 TSecr=2693359751"
"226","11:53:29.287582","192.168.0.74","192.87.28.82","TCP","66","[TCP Window Update] 59488  >  9001 [ACK] Seq=537 Ack=11761 Win=7372 Len=0 TSval=3832886801 TSecr=2693359751"
"227","11:53:29.287661","192.168.0.74","64.65.63.120","TLSv1.2","1138","Application Data, Application Data"
"228","11:53:29.288902","192.168.0.74","192.87.28.82","TLSv1.2","602","Application Data"
"229","11:53:29.289078","64.65.63.120","192.168.0.74","TCP","66","443  >  59487 [ACK] Seq=182921 Ack=12399 Win=3367 Len=0 TSval=2681310482 TSecr=3164017811"
"230","11:53:29.291933","64.65.63.120","192.168.0.74","TCP","66","443  >  59487 [ACK] Seq=182921 Ack=17359 Win=3329 Len=0 TSval=2681310483 TSecr=3164017811"
"231","11:53:29.295454","192.87.28.82","192.168.0.74","TLSv1.2","1474","Application Data"
"232","11:53:29.295456","64.65.63.120","192.168.0.74","TCP","66","443  >  59487 [ACK] Seq=182921 Ack=21429 Win=3298 Len=0 TSval=2681310487 TSecr=3164017813"
"233","11:53:29.295539","192.168.0.74","192.87.28.82","TCP","66","59488  >  9001 [ACK] Seq=1073 Ack=13169 Win=7350 Len=0 TSval=3832886809 TSecr=2693359764"
"234","11:53:29.299987","64.65.63.120","192.168.0.74","TLSv1.2","1474","Application Data"
"235","11:53:29.299989","64.65.63.120","192.168.0.74","TCP","1474","443  >  59487 [ACK] Seq=184329 Ack=21429 Win=3298 Len=1408 TSval=2681310489 TSecr=3164017813 [TCP PDU reassembled in 237]"
"236","11:53:29.299991","64.65.63.120","192.168.0.74","TCP","1474","443  >  59487 [PSH, ACK] Seq=185737 Ack=21429 Win=3298 Len=1408 TSval=2681310489 TSecr=3164017813 [TCP PDU reassembled in 237]"
"237","11:53:29.299992","64.65.63.120","192.168.0.74","TLSv1.2","1474","Application Data"
"238","11:53:29.299994","64.65.63.120","192.168.0.74","TCP","1474","443  >  59487 [ACK] Seq=188553 Ack=21429 Win=3298 Len=1408 TSval=2681310489 TSecr=3164017813 [TCP PDU reassembled in 240]"
"239","11:53:29.299996","64.65.63.120","192.168.0.74","TCP","1474","443  >  59487 [PSH, ACK] Seq=189961 Ack=21429 Win=3298 Len=1408 TSval=2681310489 TSecr=3164017813 [TCP PDU reassembled in 240]"
"240","11:53:29.299997","64.65.63.120","192.168.0.74","TLSv1.2","1474","Application Data"
"241","11:53:29.299999","64.65.63.120","192.168.0.74","TCP","1474","443  >  59487 [ACK] Seq=192777 Ack=21429 Win=3298 Len=1408 TSval=2681310489 TSecr=3164017813 [TCP PDU reassembled in 242]"
"242","11:53:29.300001","64.65.63.120","192.168.0.74","TLSv1.2","1474","Application Data"
"243","11:53:29.300151","192.168.0.74","64.65.63.120","TLSv1.2","602","Application Data"
"244","11:53:29.301486","64.65.63.120","192.168.0.74","TLSv1.2","1474","Application Data"
"245","11:53:29.301488","64.65.63.120","192.168.0.74","TCP","1474","443  >  59487 [PSH, ACK] Seq=197001 Ack=21429 Win=3298 Len=1408 TSval=2681310493 TSecr=3164017813 [TCP PDU reassembled in 248]"
"246","11:53:29.301565","192.168.0.74","64.65.63.120","TCP","66","59487  >  443 [ACK] Seq=25759 Ack=198409 Win=9198 Len=0 TSval=3164017860 TSecr=2681310493"
"247","11:53:29.314681","64.65.63.120","192.168.0.74","TCP","1474","443  >  59487 [ACK] Seq=198409 Ack=22029 Win=3294 Len=1408 TSval=2681310504 TSecr=3164017836 [TCP PDU reassembled in 248]"
"248","11:53:29.314683","64.65.63.120","192.168.0.74","TLSv1.2","1474","Application Data"
"249","11:53:29.314684","64.65.63.120","192.168.0.74","TCP","1474","443  >  59487 [PSH, ACK] Seq=201225 Ack=22029 Win=3294 Len=1408 TSval=2681310504 TSecr=3164017836 [TCP PDU reassembled in 250]"
"250","11:53:29.314685","64.65.63.120","192.168.0.74","TLSv1.2","1474","Application Data"
"251","11:53:29.314687","64.65.63.120","192.168.0.74","TCP","1474","443  >  59487 [ACK] Seq=204041 Ack=22029 Win=3294 Len=1408 TSval=2681310504 TSecr=3164017836 [TCP PDU reassembled in 255]"
"252","11:53:29.314688","64.65.63.120","192.168.0.74","TCP","1474","443  >  59487 [PSH, ACK] Seq=205449 Ack=22029 Win=3294 Len=1408 TSval=2681310504 TSecr=3164017836 [TCP PDU reassembled in 255]"
"253","11:53:29.314796","192.168.0.74","64.65.63.120","TLSv1.2","602","Application Data"
"254","11:53:29.314858","192.168.0.74","64.65.63.120","TCP","66","[TCP Window Update] 59487  >  443 [ACK] Seq=26295 Ack=206857 Win=9198 Len=0 TSval=3164017873 TSecr=2681310504"
"255","11:53:29.317853","64.65.63.120","192.168.0.74","TLSv1.2","1474","Application Data"
"256","11:53:29.317855","64.65.63.120","192.168.0.74","TCP","1474","443  >  59487 [ACK] Seq=208265 Ack=23079 Win=3286 Len=1408 TSval=2681310508 TSecr=3164017839 [TCP PDU reassembled in 260]"
"257","11:53:29.317912","192.168.0.74","64.65.63.120","TCP","66","59487  >  443 [ACK] Seq=26295 Ack=209673 Win=9154 Len=0 TSval=3164017876 TSecr=2681310508"
"258","11:53:29.317975","192.168.0.74","64.65.63.120","TCP","66","[TCP Window Update] 59487  >  443 [ACK] Seq=26295 Ack=209673 Win=9198 Len=0 TSval=3164017876 TSecr=2681310508"
"259","11:53:29.319163","64.65.63.120","192.168.0.74","TCP","1474","443  >  59487 [ACK] Seq=209673 Ack=23079 Win=3286 Len=1408 TSval=2681310508 TSecr=3164017839 [TCP PDU reassembled in 260]"
"260","11:53:29.319165","64.65.63.120","192.168.0.74","TLSv1.2","1474","Application Data"
"261","11:53:29.319166","64.65.63.120","192.168.0.74","TCP","1474","443  >  59487 [ACK] Seq=212489 Ack=23079 Win=3286 Len=1408 TSval=2681310508 TSecr=3164017839 [TCP PDU reassembled in 263]"
"262","11:53:29.319167","64.65.63.120","192.168.0.74","TCP","1474","443  >  59487 [ACK] Seq=213897 Ack=23079 Win=3286 Len=1408 TSval=2681310508 TSecr=3164017839 [TCP PDU reassembled in 263]"
"263","11:53:29.319168","64.65.63.120","192.168.0.74","TLSv1.2","1474","Application Data, Application Data"
"264","11:53:29.319169","64.65.63.120","192.168.0.74","TCP","1474","443  >  59487 [PSH, ACK] Seq=216713 Ack=23079 Win=3286 Len=1408 TSval=2681310508 TSecr=3164017839 [TCP PDU reassembled in 266]"
"265","11:53:29.319170","64.65.63.120","192.168.0.74","TCP","1474","443  >  59487 [ACK] Seq=218121 Ack=23079 Win=3286 Len=1408 TSval=2681310508 TSecr=3164017839 [TCP PDU reassembled in 266]"
"266","11:53:29.319171","64.65.63.120","192.168.0.74","TLSv1.2","1474","Application Data"
"267","11:53:29.319172","64.65.63.120","192.168.0.74","TCP","1474","443  >  59487 [PSH, ACK] Seq=220937 Ack=23079 Win=3286 Len=1408 TSval=2681310508 TSecr=3164017839 [TCP PDU reassembled in 269]"
"268","11:53:29.319173","64.65.63.120","192.168.0.74","TCP","1474","443  >  59487 [ACK] Seq=222345 Ack=23079 Win=3286 Len=1408 TSval=2681310508 TSecr=3164017839 [TCP PDU reassembled in 269]"
"269","11:53:29.319174","64.65.63.120","192.168.0.74","TLSv1.2","1474","Application Data"
