"No.","Time","Source","Destination","Protocol","Length","Info"
"1","11:52:54.194517","192.168.0.192","230.0.0.1","UDP","92","62979  >  6666 Len=50"
"2","11:52:54.594265","192.168.0.74","5.28.195.2","TCP","78","63795  >  5222 [SYN] Seq=0 Win=65535 Len=0 MSS=1460 WS=16 TSval=2436710414 TSecr=0 SACK_PERM"
"3","11:52:54.594382","192.168.0.74","5.28.195.2","TCP","78","63794  >  80 [SYN] Seq=0 Win=65535 Len=0 MSS=1460 WS=16 TSval=2889932484 TSecr=0 SACK_PERM"
"4","11:52:55.013952","192.168.0.192","230.0.0.1","UDP","92","58107  >  6666 Len=50"
"5","11:52:55.217303","192.168.0.192","230.0.0.1","UDP","92","62979  >  6666 Len=50"
"6","11:52:55.594176","192.168.0.74","5.28.195.2","TCP","78","[TCP Retransmission] 63795  >  5222 [SYN] Seq=0 Win=65535 Len=0 MSS=1460 WS=16 TSval=2436711414 TSecr=0 SACK_PERM"
"7","11:52:55.594217","192.168.0.74","5.28.195.2","TCP","78","[TCP Retransmission] 63794  >  80 [SYN] Seq=0 Win=65535 Len=0 MSS=1460 WS=16 TSval=2889933484 TSecr=0 SACK_PERM"
"8","11:52:55.662315","192.168.0.74","64.65.63.120","TLSv1.2","1116","Application Data"
"9","11:52:55.701772","64.65.63.120","192.168.0.74","TCP","66","443  >  59487 [ACK] Seq=1 Ack=1051 Win=3502 Len=0 TSval=2681276892 TSecr=3163984219"
"10","11:52:55.865520","64.65.63.120","192.168.0.74","TLSv1.2","602","Application Data"
"11","11:52:55.865612","192.168.0.74","64.65.63.120","TCP","66","59487  >  443 [ACK] Seq=1051 Ack=537 Win=9190 Len=0 TSval=3163984423 TSecr=2681277054"
"12","11:52:55.943581","192.168.0.74","64.65.63.120","TLSv1.2","602","Application Data"
"13","11:52:55.984645","64.65.63.120","192.168.0.74","TCP","66","443  >  59487 [ACK] Seq=537 Ack=1587 Win=3524 Len=0 TSval=2681277174 TSecr=3163984501"
"14","11:52:56.030490","192.168.0.192","230.0.0.1","UDP","92","58107  >  6666 Len=50"
"15","11:52:56.185145","64.65.63.120","192.168.0.74","TCP","1474","443  >  59487 [ACK] Seq=537 Ack=1587 Win=3524 Len=1408 TSval=2681277374 TSecr=3163984501 [TCP PDU reassembled in 17]"
"16","11:52:56.185149","64.65.63.120","192.168.0.74","TCP","1474","443  >  59487 [PSH, ACK] Seq=1945 Ack=1587 Win=3524 Len=1408 TSval=2681277374 TSecr=3163984501 [TCP PDU reassembled in 17]"
"17","11:52:56.185150","64.65.63.120","192.168.0.74","TLSv1.2","870","Application Data"
"18","11:52:56.185260","192.168.0.74","64.65.63.120","TCP","66","59487  >  443 [ACK] Seq=1587 Ack=1945 Win=9176 Len=0 TSval=3163984742 TSecr=2681277374"
"19","11:52:56.185300","192.168.0.74","64.65.63.120","TCP","66","59487  >  443 [ACK] Seq=1587 Ack=4157 Win=9142 Len=0 TSval=3163984743 TSecr=2681277374"
"20","11:52:56.185392","192.168.0.74","64.65.63.120","TCP","66","[TCP Window Update] 59487  >  443 [ACK] Seq=1587 Ack=4157 Win=9198 Len=0 TSval=3163984743 TSecr=2681277374"
"21","11:52:56.209531","64.65.63.120","192.168.0.74","TCP","1474","443  >  59487 [ACK] Seq=4157 Ack=1587 Win=3524 Len=1408 TSval=2681277400 TSecr=3163984501 [TCP PDU reassembled in 25]"
"22","11:52:56.209533","64.65.63.120","192.168.0.74","TCP","1474","443  >  59487 [PSH, ACK] Seq=5565 Ack=1587 Win=3524 Len=1408 TSval=2681277400 TSecr=3163984501 [TCP PDU reassembled in 25]"
"23","11:52:56.209632","192.168.0.74","64.65.63.120","TCP","66","59487  >  443 [ACK] Seq=1587 Ack=6973 Win=9154 Len=0 TSval=3163984767 TSecr=2681277400"
"24","11:52:56.209768","192.168.0.74","64.65.63.120","TCP","66","[TCP Window Update] 59487  >  443 [ACK] Seq=1587 Ack=6973 Win=9198 Len=0 TSval=3163984767 TSecr=2681277400"
"25","11:52:56.222955","64.65.63.120","192.168.0.74","TLSv1.2","870","Application Data"
"26","11:52:56.223058","192.168.0.74","64.65.63.120","TCP","66","59487  >  443 [ACK] Seq=1587 Ack=7777 Win=9186 Len=0 TSval=3163984780 TSecr=2681277414"
"27","11:52:56.235866","192.168.0.192","230.0.0.1","UDP","92","62979  >  6666 Len=50"
"28","11:52:56.277543","64.65.63.120","192.168.0.74","TCP","1474","443  >  59487 [ACK] Seq=7777 Ack=1587 Win=3524 Len=1408 TSval=2681277468 TSecr=3163984780 [TCP PDU reassembled in 30]"
"29","11:52:56.277544","64.65.63.120","192.168.0.74","TCP","1474","443  >  59487 [PSH, ACK] Seq=9185 Ack=1587 Win=3524 Len=1408 TSval=2681277468 TSecr=3163984780 [TCP PDU reassembled in 30]"
"30","11:52:56.277546","64.65.63.120","192.168.0.74","TLSv1.2","1320","Application Data"
"31","11:52:56.277548","64.65.63.120","192.168.0.74","TCP","1474","443  >  59487 [ACK] Seq=11847 Ack=1587 Win=3524 Len=1408 TSval=2681277468 TSecr=3163984780 [TCP PDU reassembled in 35]"
"32","11:52:56.277549","64.65.63.120","192.168.0.74","TCP","1474","443  >  59487 [PSH, ACK] Seq=13255 Ack=1587 Win=3524 Len=1408 TSval=2681277468 TSecr=3163984780 [TCP PDU reassembled in 35]"
"33","11:52:56.277653","192.168.0.74","64.65.63.120","TCP","66","59487  >  443 [ACK] Seq=1587 Ack=14663 Win=9091 Len=0 TSval=3163984835 TSecr=2681277468"
"34","11:52:56.277772","192.168.0.74","64.65.63.120","TCP","66","[TCP Window Update] 59487  >  443 [ACK] Seq=1587 Ack=14663 Win=9198 Len=0 TSval=3163984835 TSecr=2681277468"
"35","11:52:56.302975","64.65.63.120","192.168.0.74","TLSv1.2","1474","Application Data"
"36","11:52:56.302977","64.65.63.120","192.168.0.74","TCP","1474","443  >  59487 [PSH, ACK] Seq=16071 Ack=1587 Win=3524 Len=1408 TSval=2681277494 TSecr=3163984780 [TCP PDU reassembled in 38]"
"37","11:52:56.302978","64.65.63.120","192.168.0.74","TCP","1474","443  >  59487 [ACK] Seq=17479 Ack=1587 Win=3524 Len=1408 TSval=2681277494 TSecr=3163984780 [TCP PDU reassembled in 38]"
"38","11:52:56.302980","64.65.63.120","192.168.0.74","TLSv1.2","1474","Application Data"
"39","11:52:56.302981","64.65.63.120","192.168.0.74","TCP","1474","443  >  59487 [PSH, ACK] Seq=20295 Ack=1587 Win=3524 Len=1408 TSval=2681277494 TSecr=3163984780 [TCP PDU reassembled in 44]"
"40","11:52:56.303074","192.168.0.74","64.65.63.120","TCP","66","59487  >  443 [ACK] Seq=1587 Ack=21703 Win=9088 Len=0 TSval=3163984860 TSecr=2681277494"
"41","11:52:56.303202","192.168.0.74","64.65.63.120","TCP","66","[TCP Window Update] 59487  >  443 [ACK] Seq=1587 Ack=21703 Win=9198 Len=0 TSval=3163984860 TSecr=2681277494"
"42","11:52:56.303331","192.168.0.74","64.65.63.120","TLSv1.2","602","Application Data"
"43","11:52:56.315222","64.65.63.120","192.168.0.74","TCP","1474","443  >  59487 [ACK] Seq=21703 Ack=1587 Win=3524 Len=1408 TSval=2681277506 TSecr=3163984835 [TCP PDU reassembled in 44]"
"44","11:52:56.315224","64.65.63.120","192.168.0.74","TLSv1.2","1474","Application Data"
"45","11:52:56.315225","64.65.63.120","192.168.0.74","TCP","1474","443  >  59487 [ACK] Seq=24519 Ack=1587 Win=3524 Len=1408 TSval=2681277506 TSecr=3163984835 [TCP PDU reassembled in 47]"
"46","11:52:56.315227","64.65.63.120","192.168.0.74","TCP","1474","443  >  59487 [PSH, ACK] Seq=25927 Ack=1587 Win=3524 Len=1408 TSval=2681277506 TSecr=3163984835 [TCP PDU reassembled in 47]"
"47","11:52:56.315228","64.65.63.120","192.168.0.74","TLSv1.2","1474","Application Data"
"48","11:52:56.315230","64.65.63.120","192.168.0.74","TCP","1474","443  >  59487 [PSH, ACK] Seq=28743 Ack=1587 Win=3524 Len=1408 TSval=2681277506 TSecr=3163984835 [TCP PDU reassembled in 49]"
"49","11:52:56.315231","64.65.63.120","192.168.0.74","TLSv1.2","1468","Application Data"
"50","11:52:56.315325","192.168.0.74","64.65.63.120","TCP","66","59487  >  443 [ACK] Seq=2123 Ack=31553 Win=9045 Len=0 TSval=3163984872 TSecr=2681277506"
"51","11:52:56.315442","192.168.0.74","64.65.63.120","TCP","66","[TCP Window Update] 59487  >  443 [ACK] Seq=2123 Ack=31553 Win=9198 Len=0 TSval=3163984873 TSecr=2681277506"
"52","11:52:56.323476","64.65.63.120","192.168.0.74","TCP","1474","443  >  59487 [ACK] Seq=31553 Ack=1587 Win=3524 Len=1408 TSval=2681277514 TSecr=3163984835 [TCP PDU reassembled in 54]"
"53","11:52:56.323477","64.65.63.120","192.168.0.74","TCP","1474","443  >  59487 [PSH, ACK] Seq=32961 Ack=1587 Win=3524 Len=1408 TSval=2681277514 TSecr=3163984835 [TCP PDU reassembled in 54]"
"54","11:52:56.323479","64.65.63.120","192.168.0.74","TLSv1.2","1474","Application Data"
"55","11:52:56.323538","192.168.0.74","64.65.63.120","TLSv1.2","602","Application Data"
"56","11:52:56.323621","192.168.0.74","64.65.63.120","TCP","66","[TCP Window Update] 59487  >  443 [ACK] Seq=2659 Ack=35777 Win=9198 Len=0 TSval=3163984881 TSecr=2681277514"
"57","11:52:56.337857","64.65.63.120","192.168.0.74","TCP","66","443  >  59487 [ACK] Seq=35777 Ack=2123 Win=3532 Len=0 TSval=2681277529 TSecr=3163984861"
"58","11:52:56.350309","64.65.63.120","192.168.0.74","TLSv1.2","1048","Application Data, Application Data"
"59","11:52:56.350407","192.168.0.74","64.65.63.120","TCP","66","59487  >  443 [ACK] Seq=2659 Ack=36759 Win=9183 Len=0 TSval=3163984908 TSecr=2681277541"
"60","11:52:56.367667","64.65.63.120","192.168.0.74","TCP","1474","443  >  59487 [ACK] Seq=36759 Ack=2659 Win=3541 Len=1408 TSval=2681277558 TSecr=3163984881 [TCP PDU reassembled in 62]"
"61","11:52:56.367669","64.65.63.120","192.168.0.74","TCP","1474","443  >  59487 [PSH, ACK] Seq=38167 Ack=2659 Win=3541 Len=1408 TSval=2681277558 TSecr=3163984881 [TCP PDU reassembled in 62]"
"62","11:52:56.367671","64.65.63.120","192.168.0.74","TLSv1.2","1474","Application Data"
"63","11:52:56.367672","64.65.63.120","192.168.0.74","TCP","1474","443  >  59487 [PSH, ACK] Seq=40983 Ack=2659 Win=3541 Len=1408 TSval=2681277558 TSecr=3163984881 [TCP PDU reassembled in 65]"
"64","11:52:56.367674","64.65.63.120","192.168.0.74","TCP","1474","443  >  59487 [ACK] Seq=42391 Ack=2659 Win=3541 Len=1408 TSval=2681277558 TSecr=3163984881 [TCP PDU reassembled in 65]"
"65","11:52:56.367675","64.65.63.120","192.168.0.74","TLSv1.2","1474","Application Data"
"66","11:52:56.367676","64.65.63.120","192.168.0.74","TCP","1474","443  >  59487 [PSH, ACK] Seq=45207 Ack=2659 Win=3541 Len=1408 TSval=2681277558 TSecr=3163984881 [TCP PDU reassembled in 68]"
"67","11:52:56.367678","64.65.63.120","192.168.0.74","TCP","1474","443  >  59487 [ACK] Seq=46615 Ack=2659 Win=3541 Len=1408 TSval=2681277558 TSecr=3163984881 [TCP PDU reassembled in 68]"
"68","11:52:56.367678","64.65.63.120","192.168.0.74","TLSv1.2","1474","Application Data"
"69","11:52:56.367680","64.65.63.120","192.168.0.74","TCP","1474","443  >  59487 [ACK] Seq=49431 Ack=2659 Win=3541 Len=1408 TSval=2681277558 TSecr=3163984881 [TCP PDU reassembled in 74]"
"70","11:52:56.367794","192.168.0.74","64.65.63.120","TCP","66","59487  >  443 [ACK] Seq=2659 Ack=50839 Win=8978 Len=0 TSval=3163984925 TSecr=2681277558"
"71","11:52:56.367920","192.168.0.74","64.65.63.120","TCP","66","[TCP Window Update] 59487  >  443 [ACK] Seq=2659 Ack=50839 Win=9198 Len=0 TSval=3163984925 TSecr=2681277558"
"72","11:52:56.368065","192.168.0.74","64.65.63.120","TLSv1.2","602","Application Data"
"73","11:52:56.368807","64.65.63.120","192.168.0.74","TCP","1474","443  >  59487 [PSH, ACK] Seq=50839 Ack=2659 Win=3541 Len=1408 TSval=2681277558 TSecr=3163984881 [TCP PDU reassembled in 74]"
"74","11:52:56.368809","64.65.63.120","192.168.0.74","TLSv1.2","1474","Application Data, Application Data"
"75","11:52:56.368811","64.65.63.120","192.168.0.74","TCP","1474","443  >  59487 [PSH, ACK] Seq=53655 Ack=2659 Win=3541 Len=1408 TSval=2681277559 TSecr=3163984881 [TCP PDU reassembled in 77]"
"76","11:52:56.368812","64.65.63.120","192.168.0.74","TCP","1474","443  >  59487 [ACK] Seq=55063 Ack=2659 Win=3541 Len=1408 TSval=2681277559 TSecr=3163984881 [TCP PDU reassembled in 77]"
"77","11:52:56.368813","64.65.63.120","192.168.0.74","TLSv1.2","1474","Application Data"
"78","11:52:56.368814","64.65.63.120","192.168.0.74","TCP","1474","443  >  59487 [PSH, ACK] Seq=57879 Ack=2659 Win=3541 Len=1408 TSval=2681277559 TSecr=3163984881 [TCP PDU reassembled in 82]"
"79","11:52:56.368883","192.168.0.74","64.65.63.120","TCP","66","59487  >  443 [ACK] Seq=3195 Ack=59287 Win=9066 Len=0 TSval=3163984926 TSecr=2681277559"
"80","11:52:56.368936","192.168.0.74","64.65.63.120","TCP","66","[TCP Window Update] 59487  >  443 [ACK] Seq=3195 Ack=59287 Win=9198 Len=0 TSval=3163984926 TSecr=2681277559"
"81","11:52:56.369580","64.65.63.120","192.168.0.74","TCP","1474","443  >  59487 [ACK] Seq=59287 Ack=2659 Win=3541 Len=1408 TSval=2681277559 TSecr=3163984881 [TCP PDU reassembled in 82]"
"82","11:52:56.369581","64.65.63.120","192.168.0.74","TLSv1.2","1474","Application Data"
"83","11:52:56.369641","192.168.0.74","64.65.63.120","TCP","66","59487  >  443 [ACK] Seq=3195 Ack=62103 Win=9154 Len=0 TSval=3163984927 TSecr=2681277559"
"84","11:52:56.369687","192.168.0.74","64.65.63.120","TCP","66","[TCP Window Update] 59487  >  443 [ACK] Seq=3195 Ack=62103 Win=9198 Len=0 TSval=3163984927 TSecr=2681277559"
"85","11:52:56.370073","64.65.63.120","192.168.0.74","TCP","1474","443  >  59487 [ACK] Seq=62103 Ack=2659 Win=3541 Len=1408 TSval=2681277559 TSecr=3163984881 [TCP PDU reassembled in 91]"
"86","11:52:56.370074","64.65.63.120","192.168.0.74","TCP","1474","443  >  59487 [PSH, ACK] Seq=63511 Ack=2659 Win=3541 Len=1408 TSval=2681277559 TSecr=3163984881 [TCP PDU reassembled in 91]"
"87","11:52:56.370103","192.168.0.74","64.65.63.120","TCP","66","59487  >  443 [ACK] Seq=3195 Ack=64919 Win=9154 Len=0 TSval=3163984927 TSecr=2681277559"
"88","11:52:56.370137","192.168.0.74","64.65.63.120","TCP","66","[TCP Window Update] 59487  >  443 [ACK] Seq=3195 Ack=64919 Win=9198 Len=0 TSval=3163984927 TSecr=2681277559"
"89","11:52:56.379602","192.168.0.74","64.65.63.120","TLSv1.2","1474","Application Data"
"90","11:52:56.379622","192.168.0.74","64.65.63.120","TLSv1.2","758","Application Data"
"91","11:52:56.379795","64.65.63.120","192.168.0.74","TLSv1.2","1474","Application Data"
"92","11:52:56.379797","64.65.63.120","192.168.0.74","TCP","1474","443  >  59487 [PSH, ACK] Seq=66327 Ack=2659 Win=3541 Len=1408 TSval=2681277570 TSecr=3163984881 [TCP PDU reassembled in 96]"
"93","11:52:56.379799","64.65.63.120","192.168.0.74","TCP","1474","443  >  59487 [ACK] Seq=67735 Ack=2659 Win=3541 Len=1408 TSval=2681277570 TSecr=3163984881 [TCP PDU reassembled in 96]"
"94","11:52:56.379866","192.168.0.74","64.65.63.120","TCP","66","59487  >  443 [ACK] Seq=5295 Ack=69143 Win=9132 Len=0 TSval=3163984937 TSecr=2681277570"
"95","11:52:56.379917","192.168.0.74","64.65.63.120","TCP","66","[TCP Window Update] 59487  >  443 [ACK] Seq=5295 Ack=69143 Win=9198 Len=0 TSval=3163984937 TSecr=2681277570"
"96","11:52:56.385019","64.65.63.120","192.168.0.74","TLSv1.2","284","Application Data, Application Data"
"97","11:52:56.385152","192.168.0.74","64.65.63.120","TLSv1.2","602","Application Data"
"98","11:52:56.389375","64.65.63.120","192.168.0.74","TCP","1474","443  >  59487 [ACK] Seq=69361 Ack=2659 Win=3541 Len=1408 TSval=2681277581 TSecr=3163984908 [TCP PDU reassembled in 100]"
"99","11:52:56.389377","64.65.63.120","192.168.0.74","TCP","1474","443  >  59487 [PSH, ACK] Seq=70769 Ack=2659 Win=3541 Len=1408 TSval=2681277581 TSecr=3163984908 [TCP PDU reassembled in 100]"
"100","11:52:56.389379","64.65.63.120","192.168.0.74","TLSv1.2","1474","Application Data"
"101","11:52:56.389380","64.65.63.120","192.168.0.74","TCP","1474","443  >  59487 [PSH, ACK] Seq=73585 Ack=2659 Win=3541 Len=1408 TSval=2681277581 TSecr=3163984908 [TCP PDU reassembled in 104]"
"102","11:52:56.389548","192.168.0.74","64.65.63.120","TCP","66","59487  >  443 [ACK] Seq=5831 Ack=74993 Win=9198 Len=0 TSval=3163984947 TSecr=2681277581"
"103","11:52:56.390626","64.65.63.120","192.168.0.74","TCP","1474","443  >  59487 [ACK] Seq=74993 Ack=2659 Win=3541 Len=1408 TSval=2681277581 TSecr=3163984908 [TCP PDU reassembled in 104]"
"104","11:52:56.390628","64.65.63.120","192.168.0.74","TLSv1.2","1474","Application Data"
"105","11:52:56.390767","192.168.0.74","64.65.63.120","TCP","66","59487  >  443 [ACK] Seq=5831 Ack=77809 Win=9198 Len=0 TSval=3163984948 TSecr=2681277581"
"106","11:52:56.392817","64.65.63.120","192.168.0.74","TCP","1474","443  >  59487 [ACK] Seq=77809 Ack=2659 Win=3541 Len=1408 TSval=2681277584 TSecr=3163984908 [TCP PDU reassembled in 108]"
"107","11:52:56.411955","64.65.63.120","192.168.0.74","TCP","1474","443  >  59487 [ACK] Seq=79217 Ack=2659 Win=3541 Len=1408 TSval=2681277593 TSecr=3163984925 [TCP PDU reassembled in 108]"
"108","11:52:56.411958","64.65.63.120","192.168.0.74","TLSv1.2","1474","Application Data"
"109","11:52:56.411960","64.65.63.120","192.168.0.74","TCP","1474","443  >  59487 [ACK] Seq=82033 Ack=2659 Win=3541 Len=1408 TSval=2681277593 TSecr=3163984925 [TCP PDU reassembled in 112]"
"110","11:52:56.411961","64.65.63.120","192.168.0.74","TCP","1474","443  >  59487 [PSH, ACK] Seq=83441 Ack=2659 Win=3541 Len=1408 TSval=2681277593 TSecr=3163984925 [TCP PDU reassembled in 112]"
"111","11:52:56.412144","192.168.0.74","64.65.63.120","TCP","66","59487  >  443 [ACK] Seq=5831 Ack=84849 Win=9198 Len=0 TSval=3163984969 TSecr=2681277584"
"112","11:52:56.412969","64.65.63.120","192.168.0.74","TLSv1.2","1474","Application Data, Application Data"
"113","11:52:56.412970","64.65.63.120","192.168.0.74","TLSv1.2","1474","Application Data"
"114","11:52:56.412972","64.65.63.120","192.168.0.74","TCP","1474","443  >  59487 [ACK] Seq=87665 Ack=2659 Win=3541 Len=1408 TSval=2681277593 TSecr=3163984925 [TCP PDU reassembled in 118]"
"115","11:52:56.413051","192.168.0.74","64.65.63.120","TLSv1.2","602","Application Data"
"116","11:52:56.413716","64.65.63.120","192.168.0.74","TCP","1474","443  >  59487 [PSH, ACK] Seq=89073 Ack=2659 Win=3541 Len=1408 TSval=2681277593 TSecr=3163984925 [TCP PDU reassembled in 118]"
"117","11:52:56.413791","192.168.0.74","64.65.63.120","TCP","66","59487  >  443 [ACK] Seq=6367 Ack=90481 Win=9198 Len=0 TSval=3163984971 TSecr=2681277593"
"118","11:52:56.414256","64.65.63.120","192.168.0.74","TLSv1.2","1474","Application Data"
"119","11:52:56.414258","64.65.63.120","192.168.0.74","TCP","1474","443  >  59487 [PSH, ACK] Seq=91889 Ack=2659 Win=3541 Len=1408 TSval=2681277593 TSecr=3163984925 [TCP PDU reassembled in 121]"
"120","11:52:56.414329","192.168.0.74","64.65.63.120","TCP","66","59487  >  443 [ACK] Seq=6367 Ack=93297 Win=9198 Len=0 TSval=3163984972 TSecr=2681277593"
"121","11:52:56.414827","64.65.63.120","192.168.0.74","TLSv1.2","1474","Application Data"
"122","11:52:56.415828","64.65.63.120","192.168.0.74","TCP","66","443  >  59487 [ACK] Seq=94705 Ack=5295 Win=3521 Len=0 TSval=2681277607 TSecr=3163984925"
"123","11:52:56.420861","64.65.63.120","192.168.0.74","TLSv1.2","1156","Application Data, Application Data"
"124","11:52:56.420926","192.168.0.74","64.65.63.120","TCP","66","59487  >  443 [ACK] Seq=6367 Ack=95795 Win=9181 Len=0 TSval=3163984978 TSecr=2681277593"
"125","11:52:56.490420","64.65.63.120","192.168.0.74","TCP","66","443  >  59487 [ACK] Seq=95795 Ack=6367 Win=3513 Len=0 TSval=2681277682 TSecr=3163984970"
"126","11:52:56.490550","192.168.0.74","64.65.63.120","TLSv1.2","602","Application Data"
"127","11:52:56.525557","64.65.63.120","192.168.0.74","TCP","66","443  >  59487 [ACK] Seq=95795 Ack=6903 Win=3509 Len=0 TSval=2681277716 TSecr=3163985048"
"128","11:52:56.535362","64.65.63.120","192.168.0.74","TCP","1474","443  >  59487 [ACK] Seq=95795 Ack=6903 Win=3509 Len=1408 TSval=2681277726 TSecr=3163985048 [TCP PDU reassembled in 129]"
"129","11:52:56.535370","64.65.63.120","192.168.0.74","TLSv1.2","1250","Application Data"
"130","11:52:56.535563","192.168.0.74","64.65.63.120","TCP","66","59487  >  443 [ACK] Seq=6903 Ack=98387 Win=9198 Len=0 TSval=3163985093 TSecr=2681277726"
"131","11:52:56.594517","192.168.0.74","5.28.195.2","TCP","78","[TCP Retransmission] 63795  >  5222 [SYN] Seq=0 Win=65535 Len=0 MSS=1460 WS=16 TSval=2436712415 TSecr=0 SACK_PERM"
"132","11:52:56.594563","192.168.0.74","5.28.195.2","TCP","78","[TCP Retransmission] 63794  >  80 [SYN] Seq=0 Win=65535 Len=0 MSS=1460 WS=16 TSval=2889934485 TSecr=0 SACK_PERM"
"133","11:52:56.600137","64.65.63.120","192.168.0.74","TCP","1474","443  >  59487 [ACK] Seq=98387 Ack=6903 Win=3509 Len=1408 TSval=2681277789 TSecr=3163985093 [TCP PDU reassembled in 135]"
"134","11:52:56.600140","64.65.63.120","192.168.0.74","TCP","1474","443  >  59487 [ACK] Seq=99795 Ack=6903 Win=3509 Len=1408 TSval=2681277789 TSecr=3163985093 [TCP PDU reassembled in 135]"
"135","11:52:56.600141","64.65.63.120","192.168.0.74","TLSv1.2","1320","Application Data"
"136","11:52:56.600143","64.65.63.120","192.168.0.74","TCP","1474","443  >  59487 [ACK] Seq=102457 Ack=6903 Win=3509 Len=1408 TSval=2681277789 TSecr=3163985093 [TCP PDU reassembled in 138]"
"137","11:52:56.600144","64.65.63.120","192.168.0.74","TCP","1474","443  >  59487 [ACK] Seq=103865 Ack=6903 Win=3509 Len=1408 TSval=2681277789 TSecr=3163985093 [TCP PDU reassembled in 138]"
"138","11:52:56.600146","64.65.63.120","192.168.0.74","TLSv1.2","1474","Application Data"
"139","11:52:56.600147","64.65.63.120","192.168.0.74","TCP","1474","443  >  59487 [ACK] Seq=106681 Ack=6903 Win=3509 Len=1408 TSval=2681277790 TSecr=3163985093 [TCP PDU reassembled in 142]"
"140","11:52:56.600149","64.65.63.120","192.168.0.74","TCP","1474","443  >  59487 [PSH, ACK] Seq=108089 Ack=6903 Win=3509 Len=1408 TSval=2681277790 TSecr=3163985093 [TCP PDU reassembled in 142]"
"141","11:52:56.600330","192.168.0.74","64.65.63.120","TCP","66","59487  >  443 [ACK] Seq=6903 Ack=109497 Win=9198 Len=0 TSval=3163985158 TSecr=2681277790"
"142","11:52:56.603737","64.65.63.120","192.168.0.74","TLSv1.2","1474","Application Data"
"143","11:52:56.603738","64.65.63.120","192.168.0.74","TCP","1474","443  >  59487 [ACK] Seq=110905 Ack=6903 Win=3509 Len=1408 TSval=2681277793 TSecr=3163985093 [TCP PDU reassembled in 145]"
"144","11:52:56.603740","64.65.63.120","192.168.0.74","TCP","1474","443  >  59487 [PSH, ACK] Seq=112313 Ack=6903 Win=3509 Len=1408 TSval=2681277793 TSecr=3163985093 [TCP PDU reassembled in 145]"
"145","11:52:56.603741","64.65.63.120","192.168.0.74","TLSv1.2","1474","Application Data"
"146","11:52:56.603742","64.65.63.120","192.168.0.74","TCP","1474","443  >  59487 [ACK] Seq=115129 Ack=6903 Win=3509 Len=1408 TSval=2681277793 TSecr=3163985093 [TCP PDU reassembled in 148]"
"147","11:52:56.603744","64.65.63.120","192.168.0.74","TCP","1474","443  >  59487 [PSH, ACK] Seq=116537 Ack=6903 Win=3509 Len=1408 TSval=2681277793 TSecr=3163985093 [TCP PDU reassembled in 148]"
"148","11:52:56.603745","64.65.63.120","192.168.0.74","TLSv1.2","1474","Application Data"
"149","11:52:56.603746","64.65.63.120","192.168.0.74","TCP","1474","443  >  59487 [ACK] Seq=119353 Ack=6903 Win=3509 Len=1408 TSval=2681277793 TSecr=3163985093 [TCP PDU reassembled in 151]"
"150","11:52:56.603748","64.65.63.120","192.168.0.74","TCP","1474","443  >  59487 [PSH, ACK] Seq=120761 Ack=6903 Win=3509 Len=1408 TSval=2681277793 TSecr=3163985093 [TCP PDU reassembled in 151]"
"151","11:52:56.603749","64.65.63.120","192.168.0.74","TLSv1.2","1474","Application Data"
"152","11:52:56.603750","64.65.63.120","192.168.0.74","TCP","1474","443  >  59487 [ACK] Seq=123577 Ack=6903 Win=3509 Len=1408 TSval=2681277793 TSecr=3163985093 [TCP PDU reassembled in 156]"
"153","11:52:56.603751","64.65.63.120","192.168.0.74","TCP","1474","443  >  59487 [PSH, ACK] Seq=124985 Ack=6903 Win=3509 Len=1408 TSval=2681277793 TSecr=3163985093 [TCP PDU reassembled in 156]"
"154","11:52:56.603922","192.168.0.74","64.65.63.120","TCP","66","59487  >  443 [ACK] Seq=6903 Ack=126393 Win=9198 Len=0 TSval=3163985161 TSecr=2681277793"
"155","11:52:56.604102","192.168.0.74","64.65.63.120","TLSv1.2","602","Application Data"
"156","11:52:56.605553","64.65.63.120","192.168.0.74","TLSv1.2","1474","Application Data, Application Data"
"157","11:52:56.605554","64.65.63.120","192.168.0.74","TCP","1474","443  >  59487 [ACK] Seq=127801 Ack=6903 Win=3509 Len=1408 TSval=2681277795 TSecr=3163985093 [TCP PDU reassembled in 159]"
"158","11:52:56.605556","64.65.63.120","192.168.0.74","TCP","1474","443  >  59487 [PSH, ACK] Seq=129209 Ack=6903 Win=3509 Len=1408 TSval=2681277795 TSecr=3163985093 [TCP PDU reassembled in 159]"
"159","11:52:56.605557","64.65.63.120","192.168.0.74","TLSv1.2","1474","Application Data"
"160","11:52:56.605558","64.65.63.120","192.168.0.74","TCP","1474","443  >  59487 [ACK] Seq=132025 Ack=6903 Win=3509 Len=1408 TSval=2681277795 TSecr=3163985093 [TCP PDU reassembled in 161]"
"161","11:52:56.605559","64.65.63.120","192.168.0.74","TLSv1.2","1474","Application Data"
"162","11:52:56.605561","64.65.63.120","192.168.0.74","TCP","1474","443  >  59487 [ACK] Seq=134841 Ack=6903 Win=3509 Len=1408 TSval=2681277795 TSecr=3163985093 [TCP PDU reassembled in 165]"
"163","11:52:56.605562","64.65.63.120","192.168.0.74","TCP","1474","443  >  59487 [ACK] Seq=136249 Ack=6903 Win=3509 Len=1408 TSval=2681277795 TSecr=3163985093 [TCP PDU reassembled in 165]"
"164","11:52:56.605757","192.168.0.74","64.65.63.120","TLSv1.2","602","Application Data"
"165","11:52:56.606526","64.65.63.120","192.168.0.74","TLSv1.2","1474","Application Data"
"166","11:52:56.606528","64.65.63.120","192.168.0.74","TCP","1474","443  >  59487 [ACK] Seq=139065 Ack=6903 Win=3509 Len=1408 TSval=2681277795 TSecr=3163985093 [TCP PDU reassembled in 168]"
"167","11:52:56.606529","64.65.63.120","192.168.0.74","TCP","1474","443  >  59487 [ACK] Seq=140473 Ack=6903 Win=3509 Len=1408 TSval=2681277795 TSecr=3163985093 [TCP PDU reassembled in 168]"
"168","11:52:56.606530","64.65.63.120","192.168.0.74","TLSv1.2","1474","Application Data"
"169","11:52:56.606531","64.65.63.120","192.168.0.74","TLSv1.2","1474","Application Data, Application Data"
"170","11:52:56.606532","64.65.63.120","192.168.0.74","TCP","1474","443  >  59487 [ACK] Seq=144697 Ack=6903 Win=3509 Len=1408 TSval=2681277797 TSecr=3163985093 [TCP PDU reassembled in 172]"
"171","11:52:56.606533","64.65.63.120","192.168.0.74","TCP","1474","443  >  59487 [PSH, ACK] Seq=146105 Ack=6903 Win=3509 Len=1408 TSval=2681277797 TSecr=3163985093 [TCP PDU reassembled in 172]"
"172","11:52:56.606534","64.65.63.120","192.168.0.74","TLSv1.2","1474","Application Data"
"173","11:52:56.606536","64.65.63.120","192.168.0.74","TCP","1474","443  >  59487 [ACK] Seq=148921 Ack=6903 Win=3509 Len=1408 TSval=2681277797 TSecr=3163985093 [TCP PDU reassembled in 175]"
"174","11:52:56.606537","64.65.63.120","192.168.0.74","TCP","1474","443  >  59487 [PSH, ACK] Seq=150329 Ack=6903 Win=3509 Len=1408 TSval=2681277797 TSecr=3163985093 [TCP PDU reassembled in 175]"
"175","11:52:56.606538","64.65.63.120","192.168.0.74","TLSv1.2","1474","Application Data"
"176","11:52:56.606539","64.65.63.120","192.168.0.74","TCP","1474","443  >  59487 [ACK] Seq=153145 Ack=6903 Win=3509 Len=1408 TSval=2681277797 TSecr=3163985093 [TCP PDU reassembled in 178]"
"177","11:52:56.606539","64.65.63.120","192.168.0.74","TCP","1474","443  >  59487 [PSH, ACK] Seq=154553 Ack=6903 Win=3509 Len=1408 TSval=2681277797 TSecr=3163985093 [TCP PDU reassembled in 178]"
"178","11:52:56.606541","64.65.63.120","192.168.0.74","TLSv1.2","1474","Application Data"
"179","11:52:56.606541","64.65.63.120","192.168.0.74","TCP","1474","443  >  59487 [ACK] Seq=157369 Ack=6903 Win=3509 Len=1408 TSval=2681277797 TSecr=3163985093 [TCP PDU reassembled in 181]"
"180","11:52:56.606543","64.65.63.120","192.168.0.74","TCP","1474","443  >  59487 [PSH, ACK] Seq=158777 Ack=6903 Win=3509 Len=1408 TSval=2681277797 TSecr=3163985093 [TCP PDU reassembled in 181]"
"181","11:52:56.606544","64.65.63.120","192.168.0.74","TLSv1.2","1474","Application Data, Application Data"
"182","11:52:56.606545","64.65.63.120","192.168.0.74","TCP","1474","443  >  59487 [PSH, ACK] Seq=161593 Ack=6903 Win=3509 Len=1408 TSval=2681277797 TSecr=3163985093 [TCP PDU reassembled in 183]"
"183","11:52:56.606546","64.65.63.120","192.168.0.74","TLSv1.2","1474","Application Data"
"184","11:52:56.606547","64.65.63.120","192.168.0.74","TCP","1474","443  >  59487 [ACK] Seq=164409 Ack=6903 Win=3509 Len=1408 TSval=2681277797 TSecr=3163985093 [TCP PDU reassembled in 186]"
"185","11:52:56.606548","64.65.63.120","192.168.0.74","TCP","1474","443  >  59487 [PSH, ACK] Seq=165817 Ack=6903 Win=3509 Len=1408 TSval=2681277797 TSecr=3163985093 [TCP PDU reassembled in 186]"
"186","11:52:56.606549","64.65.63.120","192.168.0.74","TLSv1.2","1474","Application Data"
"187","11:52:56.606551","64.65.63.120","192.168.0.74","TCP","1474","443  >  59487 [ACK] Seq=168633 Ack=6903 Win=3509 Len=1408 TSval=2681277797 TSecr=3163985093 [TCP PDU reassembled in 189]"
"188","11:52:56.606552","64.65.63.120","192.168.0.74","TCP","1474","443  >  59487 [PSH, ACK] Seq=170041 Ack=6903 Win=3509 Len=1408 TSval=2681277797 TSecr=3163985093 [TCP PDU reassembled in 189]"
"189","11:52:56.606553","64.65.63.120","192.168.0.74","TLSv1.2","1474","Application Data"
"190","11:52:56.606554","64.65.63.120","192.168.0.74","TCP","1474","443  >  59487 [ACK] Seq=172857 Ack=6903 Win=3509 Len=1408 TSval=2681277797 TSecr=3163985093 [TCP PDU reassembled in 193]"
"191","11:52:56.606555","64.65.63.120","192.168.0.74","TCP","1474","443  >  59487 [PSH, ACK] Seq=174265 Ack=6903 Win=3509 Len=1408 TSval=2681277797 TSecr=3163985093 [TCP PDU reassembled in 193]"
"192","11:52:56.607045","192.168.0.74","64.65.63.120","TCP","66","59487  >  443 [ACK] Seq=7975 Ack=175673 Win=9198 Len=0 TSval=3163985164 TSecr=2681277797"
"193","11:52:56.608467","64.65.63.120","192.168.0.74","TLSv1.2","1474","Application Data, Application Data"
"194","11:52:56.608468","64.65.63.120","192.168.0.74","TCP","1474","443  >  59487 [ACK] Seq=177081 Ack=6903 Win=3509 Len=1408 TSval=2681277798 TSecr=3163985093 [TCP PDU reassembled in 196]"
"195","11:52:56.608470","64.65.63.120","192.168.0.74","TCP","1474","443  >  59487 [PSH, ACK] Seq=178489 Ack=6903 Win=3509 Len=1408 TSval=2681277798 TSecr=3163985093 [TCP PDU reassembled in 196]"
"196","11:52:56.608471","64.65.63.120","192.168.0.74","TLSv1.2","1474","Application Data"
"197","11:52:56.608472","64.65.63.120","192.168.0.74","TCP","1474","443  >  59487 [ACK] Seq=181305 Ack=6903 Win=3509 Len=1408 TSval=2681277798 TSecr=3163985093 [TCP PDU reassembled in 199]"
"198","11:52:56.608473","64.65.63.120","192.168.0.74","TCP","1474","443  >  59487 [PSH, ACK] Seq=182713 Ack=6903 Win=3509 Len=1408 TSval=2681277798 TSecr=3163985093 [TCP PDU reassembled in 199]"
"199","11:52:56.608474","64.65.63.120","192.168.0.74","TLSv1.2","1474","Application Data"
"200","11:52:56.608476","64.65.63.120","192.168.0.74","TCP","1474","443  >  59487 [ACK] Seq=185529 Ack=6903 Win=3509 Len=1408 TSval=2681277798 TSecr=3163985093 [TCP PDU reassembled in 203]"
"201","11:52:56.608477","64.65.63.120","192.168.0.74","TCP","1474","443  >  59487 [PSH, ACK] Seq=186937 Ack=6903 Win=3509 Len=1408 TSval=2681277798 TSecr=3163985093 [TCP PDU reassembled in 203]"
"202","11:52:56.608723","192.168.0.74","64.65.63.120","TLSv1.2","1116","Application Data"
"203","11:52:56.623250","64.65.63.120","192.168.0.74","TLSv1.2","1474","Application Data"
"204","11:52:56.623252","64.65.63.120","192.168.0.74","TCP","1474","443  >  59487 [PSH, ACK] Seq=189753 Ack=6903 Win=3509 Len=1408 TSval=2681277814 TSecr=3163985093 [TCP PDU reassembled in 205]"
"205","11:52:56.623253","64.65.63.120","192.168.0.74","TLSv1.2","1474","Application Data"
"206","11:52:56.623545","192.168.0.74","64.65.63.120","TLSv1.2","1138","Application Data, Application Data"
"207","11:52:56.638077","64.65.63.120","192.168.0.74","TLSv1.2","70","Application Data"
"208","11:52:56.638213","192.168.0.74","64.65.63.120","TCP","66","59487  >  443 [ACK] Seq=10097 Ack=192573 Win=9198 Len=0 TSval=3163985195 TSecr=2681277829"
"209","11:52:56.643622","64.65.63.120","192.168.0.74","TCP","66","443  >  59487 [ACK] Seq=192573 Ack=7975 Win=3501 Len=0 TSval=2681277835 TSecr=3163985161"
"210","11:52:56.654313","64.65.63.120","192.168.0.74","TCP","1474","443  >  59487 [ACK] Seq=192573 Ack=9025 Win=3493 Len=1408 TSval=2681277841 TSecr=3163985166 [TCP PDU reassembled in 217]"
"211","11:52:56.654411","192.168.0.74","64.65.63.120","TCP","66","59487  >  443 [ACK] Seq=10097 Ack=193981 Win=9176 Len=0 TSval=3163985212 TSecr=2681277841"
"212","11:52:56.665033","192.168.0.74","64.65.63.120","TLSv1.2","1474","Application Data"
"213","11:52:56.665036","192.168.0.74","64.65.63.120","TCP","1474","59487  >  443 [ACK] Seq=11505 Ack=193981 Win=9198 Len=1408 TSval=3163985222 TSecr=2681277841 [TCP PDU reassembled in 214]"
"214","11:52:56.665054","192.168.0.74","64.65.63.120","TLSv1.2","892","Application Data"
"215","11:52:56.666935","192.168.0.74","64.65.63.120","TCP","1474","59487  >  443 [ACK] Seq=13739 Ack=193981 Win=9198 Len=1408 TSval=3163985224 TSecr=2681277841 [TCP PDU reassembled in 216]"
"216","11:52:56.666955","192.168.0.74","64.65.63.120","TLSv1.2","736","Application Data"
"217","11:52:56.672213","64.65.63.120","192.168.0.74","TLSv1.2","736","Application Data"
"218","11:52:56.672311","192.168.0.74","64.65.63.120","TLSv1.2","602","Application Data"
"219","11:52:56.701864","64.65.63.120","192.168.0.74","TCP","66","443  >  59487 [ACK] Seq=194651 Ack=12913 Win=3529 Len=0 TSval=2681277893 TSecr=3163985222"
"220","11:52:56.705738","64.65.63.120","192.168.0.74","TCP","66","443  >  59487 [ACK] Seq=194651 Ack=15817 Win=3584 Len=0 TSval=2681277897 TSecr=3163985222"
"221","11:52:56.749921","64.65.63.120","192.168.0.74","TCP","66","443  >  59487 [ACK] Seq=194651 Ack=16353 Win=3606 Len=0 TSval=2681277941 TSecr=3163985229"
"222","11:52:56.774587","64.65.63.120","192.168.0.74","TLSv1.2","602","Application Data"
"223","11:52:56.774704","192.168.0.74","64.65.63.120","TCP","66","59487  >  443 [ACK] Seq=16353 Ack=195187 Win=9190 Len=0 TSval=3163985332 TSecr=2681277965"
"224","11:52:56.790734","64.65.63.120","192.168.0.74","TCP","1474","443  >  59487 [ACK] Seq=195187 Ack=16353 Win=3606 Len=1408 TSval=2681277980 TSecr=3163985229 [TCP PDU reassembled in 226]"
"225","11:52:56.790741","64.65.63.120","192.168.0.74","TCP","1474","443  >  59487 [PSH, ACK] Seq=196595 Ack=16353 Win=3606 Len=1408 TSval=2681277980 TSecr=3163985229 [TCP PDU reassembled in 226]"
"226","11:52:56.790743","64.65.63.120","192.168.0.74","TLSv1.2","1474","Application Data"
"227","11:52:56.790744","64.65.63.120","192.168.0.74","TCP","1474","443  >  59487 [ACK] Seq=199411 Ack=16353 Win=3606 Len=1408 TSval=2681277980 TSecr=3163985229 [TCP PDU reassembled in 230]"
"228","11:52:56.790746","64.65.63.120","192.168.0.74","TCP","1474","443  >  59487 [PSH, ACK] Seq=200819 Ack=16353 Win=3606 Len=1408 TSval=2681277980 TSecr=3163985229 [TCP PDU reassembled in 230]"
"229","11:52:56.790935","192.168.0.74","64.65.63.120","TCP","66","59487  >  443 [ACK] Seq=16353 Ack=202227 Win=9198 Len=0 TSval=3163985348 TSecr=2681277980"
"230","11:52:56.795013","64.65.63.120","192.168.0.74","TLSv1.2","1474","Application Data"
"231","11:52:56.795016","64.65.63.120","192.168.0.74","TCP","1474","443  >  59487 [ACK] Seq=203635 Ack=16353 Win=3606 Len=1408 TSval=2681277984 TSecr=3163985229 [TCP PDU reassembled in 233]"
"232","11:52:56.795017","64.65.63.120","192.168.0.74","TCP","1474","443  >  59487 [PSH, ACK] Seq=205043 Ack=16353 Win=3606 Len=1408 TSval=2681277984 TSecr=3163985229 [TCP PDU reassembled in 233]"
"233","11:52:56.795018","64.65.63.120","192.168.0.74","TLSv1.2","1474","Application Data"
"234","11:52:56.795019","64.65.63.120","192.168.0.74","TCP","1474","443  >  59487 [ACK] Seq=207859 Ack=16353 Win=3606 Len=1408 TSval=2681277984 TSecr=3163985229 [TCP PDU reassembled in 236]"
"235","11:52:56.795020","64.65.63.120","192.168.0.74","TCP","1474","443  >  59487 [PSH, ACK] Seq=209267 Ack=16353 Win=3606 Len=1408 TSval=2681277984 TSecr=3163985229 [TCP PDU reassembled in 236]"
"236","11:52:56.795023","64.65.63.120","192.168.0.74","TLSv1.2","1474","Application Data"
"237","11:52:56.795025","64.65.63.120","192.168.0.74","TCP","1474","443  >  59487 [ACK] Seq=212083 Ack=16353 Win=3606 Len=1408 TSval=2681277984 TSecr=3163985229 [TCP PDU reassembled in 239]"
"238","11:52:56.795026","64.65.63.120","192.168.0.74","TCP","1474","443  >  59487 [PSH, ACK] Seq=213491 Ack=16353 Win=3606 Len=1408 TSval=2681277984 TSecr=3163985229 [TCP PDU reassembled in 239]"
"239","11:52:56.795028","64.65.63.120","192.168.0.74","TLSv1.2","1474","Application Data"
"240","11:52:56.795029","64.65.63.120","192.168.0.74","TCP","1474","443  >  59487 [ACK] Seq=216307 Ack=16353 Win=3606 Len=1408 TSval=2681277984 TSecr=3163985229 [TCP PDU reassembled in 244]"
"241","11:52:56.795030","64.65.63.120","192.168.0.74","TCP","1474","443  >  59487 [PSH, ACK] Seq=217715 Ack=16353 Win=3606 Len=1408 TSval=2681277984 TSecr=3163985229 [TCP PDU reassembled in 244]"
"242","11:52:56.795197","192.168.0.74","64.65.63.120","TCP","66","59487  >  443 [ACK] Seq=16353 Ack=219123 Win=9198 Len=0 TSval=3163985352 TSecr=2681277984"
"243","11:52:56.795362","192.168.0.74","64.65.63.120","TLSv1.2","602","Application Data"
"244","11:52:56.796901","64.65.63.120","192.168.0.74","TLSv1.2","1474","Application Data, Application Data"
"245","11:52:56.796903","64.65.63.120","192.168.0.74","TCP","1474","443  >  59487 [PSH, ACK] Seq=220531 Ack=16353 Win=3606 Len=1408 TSval=2681277987 TSecr=3163985229 [TCP PDU reassembled in 246]"
"246","11:52:56.796905","64.65.63.120","192.168.0.74","TLSv1.2","1474","Application Data"
"247","11:52:56.796906","64.65.63.120","192.168.0.74","TCP","1474","443  >  59487 [ACK] Seq=223347 Ack=16353 Win=3606 Len=1408 TSval=2681277987 TSecr=3163985229 [TCP PDU reassembled in 249]"
"248","11:52:56.796908","64.65.63.120","192.168.0.74","TCP","1474","443  >  59487 [PSH, ACK] Seq=224755 Ack=16353 Win=3606 Len=1408 TSval=2681277987 TSecr=3163985229 [TCP PDU reassembled in 249]"
"249","11:52:56.796910","64.65.63.120","192.168.0.74","TLSv1.2","1474","Application Data"
"250","11:52:56.796911","64.65.63.120","192.168.0.74","TCP","1474","443  >  59487 [ACK] Seq=227571 Ack=16353 Win=3606 Len=1408 TSval=2681277987 TSecr=3163985229 [TCP PDU reassembled in 252]"
"251","11:52:56.796913","64.65.63.120","192.168.0.74","TCP","1474","443  >  59487 [ACK] Seq=228979 Ack=16353 Win=3606 Len=1408 TSval=2681277987 TSecr=3163985229 [TCP PDU reassembled in 252]"
"252","11:52:56.796914","64.65.63.120","192.168.0.74","TLSv1.2","1474","Application Data"
"253","11:52:56.796916","64.65.63.120","192.168.0.74","TCP","1474","443  >  59487 [ACK] Seq=231795 Ack=16353 Win=3606 Len=1408 TSval=2681277987 TSecr=3163985229 [TCP PDU reassembled in 255]"
"254","11:52:56.796917","64.65.63.120","192.168.0.74","TCP","1474","443  >  59487 [PSH, ACK] Seq=233203 Ack=16353 Win=3606 Len=1408 TSval=2681277987 TSecr=3163985229 [TCP PDU reassembled in 255]"
"255","11:52:56.796919","64.65.63.120","192.168.0.74","TLSv1.2","1474","Application Data"
"256","11:52:56.796920","64.65.63.120","192.168.0.74","TLSv1.2","1474","Application Data"
"257","11:52:56.796921","64.65.63.120","192.168.0.74","TCP","1474","443  >  59487 [PSH, ACK] Seq=237427 Ack=16353 Win=3606 Len=1408 TSval=2681277987 TSecr=3163985229 [TCP PDU reassembled in 258]"
"258","11:52:56.796923","64.65.63.120","192.168.0.74","TLSv1.2","1474","Application Data"
"259","11:52:56.796924","64.65.63.120","192.168.0.74","TCP","1474","443  >  59487 [ACK] Seq=240243 Ack=16353 Win=3606 Len=1408 TSval=2681277987 TSecr=3163985229 [TCP PDU reassembled in 261]"
"260","11:52:56.796926","64.65.63.120","192.168.0.74","TCP","1474","443  >  59487 [PSH, ACK] Seq=241651 Ack=16353 Win=3606 Len=1408 TSval=2681277987 TSecr=3163985229 [TCP PDU reassembled in 261]"
"261","11:52:56.796927","64.65.63.120","192.168.0.74","TLSv1.2","1474","Application Data"
"262","11:52:56.796928","64.65.63.120","192.168.0.74","TCP","1474","443  >  59487 [ACK] Seq=244467 Ack=16353 Win=3606 Len=1408 TSval=2681277987 TSecr=3163985229 [TCP PDU reassembled in 264]"
"263","11:52:56.796929","64.65.63.120","192.168.0.74","TCP","1474","443  >  59487 [PSH, ACK] Seq=245875 Ack=16353 Win=3606 Len=1408 TSval=2681277987 TSecr=3163985229 [TCP PDU reassembled in 264]"
"264","11:52:56.796931","64.65.63.120","192.168.0.74","TLSv1.2","1474","Application Data"
"265","11:52:56.796933","64.65.63.120","192.168.0.74","TCP","1474","443  >  59487 [ACK] Seq=248691 Ack=16353 Win=3606 Len=1408 TSval=2681277987 TSecr=3163985229 [TCP PDU reassembled in 267]"
"266","11:52:56.796935","64.65.63.120","192.168.0.74","TCP","1474","443  >  59487 [PSH, ACK] Seq=250099 Ack=16353 Win=3606 Len=1408 TSval=2681277987 TSecr=3163985229 [TCP PDU reassembled in 267]"
