"No.","Time","Source","Destination","Protocol","Length","Info"
"1","11:52:26.232012","192.168.0.192","230.0.0.1","UDP","92","62979  >  6666 Len=50"
"2","11:52:26.588174","192.168.0.74","5.28.195.2","TCP","78","63759  >  5222 [SYN] Seq=0 Win=65535 Len=0 MSS=1460 WS=16 TSval=2071048009 TSecr=0 SACK_PERM"
"3","11:52:26.588264","192.168.0.74","5.28.195.2","TCP","78","63757  >  80 [SYN] Seq=0 Win=65535 Len=0 MSS=1460 WS=16 TSval=1340401491 TSecr=0 SACK_PERM"
"4","11:52:26.995548","192.168.0.74","64.65.63.120","TLSv1.2","602","Application Data"
"5","11:52:27.021194","192.168.0.74","224.0.0.251","MDNS","150","Standard query 0x0000 ANY AFD641B9-2F6D-4575-8F75-66BF3602B67B._asquic._udp.local, ""QU"" question SRV 0 0 55616 NK-MacBook-Air.local"
"6","11:52:27.021245","fe80::49c:fb07:3c9a:aa62","ff02::fb","MDNS","170","Standard query 0x0000 ANY AFD641B9-2F6D-4575-8F75-66BF3602B67B._asquic._udp.local, ""QU"" question SRV 0 0 55616 NK-MacBook-Air.local"
"7","11:52:27.040629","64.65.63.120","192.168.0.74","TCP","66","443  >  59487 [ACK] Seq=1 Ack=537 Win=3520 Len=0 TSval=2681248229 TSecr=3163955552"
"8","11:52:27.153496","192.168.0.192","230.0.0.1","UDP","92","62979  >  6666 Len=50"
"9","11:52:27.153498","fe80::1817:fddd:60ce:b28f","fe80::49c:fb07:3c9a:aa62","UDP","92","57026  >  55616 Len=30"
"10","11:52:27.153499","fe80::1817:fddd:60ce:b28f","fe80::49c:fb07:3c9a:aa62","UDP","87","57026  >  55616 Len=25"
"11","11:52:27.153500","fe80::1817:fddd:60ce:b28f","fe80::49c:fb07:3c9a:aa62","UDP","88","57026  >  55616 Len=26"
"12","11:52:27.272186","192.168.0.74","224.0.0.251","MDNS","150","Standard query 0x0000 ANY AFD641B9-2F6D-4575-8F75-66BF3602B67B._asquic._udp.local, ""QM"" question SRV 0 0 55616 NK-MacBook-Air.local"
"13","11:52:27.272244","fe80::49c:fb07:3c9a:aa62","ff02::fb","MDNS","170","Standard query 0x0000 ANY AFD641B9-2F6D-4575-8F75-66BF3602B67B._asquic._udp.local, ""QM"" question SRV 0 0 55616 NK-MacBook-Air.local"
"14","11:52:27.282117","192.168.0.74","64.65.63.120","TLSv1.2","1116","Application Data"
"15","11:52:27.324867","64.65.63.120","192.168.0.74","TCP","66","443  >  59487 [ACK] Seq=1 Ack=1587 Win=3512 Len=0 TSval=2681248514 TSecr=3163955838"
"16","11:52:27.520695","192.87.28.82","192.168.0.74","TLSv1.2","602","Application Data"
"17","11:52:27.520958","192.168.0.74","192.87.28.82","TCP","66","59488  >  9001 [ACK] Seq=1 Ack=537 Win=7372 Len=0 TSval=3832825032 TSecr=2693297940"
"18","11:52:27.523586","192.168.0.74","224.0.0.251","MDNS","150","Standard query 0x0000 ANY AFD641B9-2F6D-4575-8F75-66BF3602B67B._asquic._udp.local, ""QM"" question SRV 0 0 55616 NK-MacBook-Air.local"
"19","11:52:27.523746","fe80::49c:fb07:3c9a:aa62","ff02::fb","MDNS","170","Standard query 0x0000 ANY AFD641B9-2F6D-4575-8F75-66BF3602B67B._asquic._udp.local, ""QM"" question SRV 0 0 55616 NK-MacBook-Air.local"
"20","11:52:27.556910","192.168.0.74","64.65.63.120","TLSv1.2","602","Application Data"
"21","11:52:27.588590","192.168.0.74","5.28.195.2","TCP","78","[TCP Retransmission] 63759  >  5222 [SYN] Seq=0 Win=65535 Len=0 MSS=1460 WS=16 TSval=2071049010 TSecr=0 SACK_PERM"
"22","11:52:27.588627","192.168.0.74","5.28.195.2","TCP","78","[TCP Retransmission] 63757  >  80 [SYN] Seq=0 Win=65535 Len=0 MSS=1460 WS=16 TSval=1340402492 TSecr=0 SACK_PERM"
"23","11:52:27.592160","64.65.63.120","192.168.0.74","TCP","66","443  >  59487 [ACK] Seq=1 Ack=2123 Win=3508 Len=0 TSval=2681248783 TSecr=3163956113"
"24","11:52:27.774221","192.168.0.74","224.0.0.251","MDNS","316","Standard query response 0x0000 TXT, cache flush PTR _asquic._udp.local PTR AFD641B9-2F6D-4575-8F75-66BF3602B67B._asquic._udp.local SRV, cache flush 0 0 55616 NK-MacBook-Air.local AAAA, cache flush fe80::49c:fb07:3c9a:aa62 A, cache flush 192.168.0.74 AAAA, cache flush 2a02:ab88:b:4100:8a2:2611:1782:be29 NSEC, cache flush NK-MacBook-Air.local NSEC, cache flush AFD641B9-2F6D-4575-8F75-66BF3602B67B._asquic._udp.local"
"25","11:52:27.774281","fe80::49c:fb07:3c9a:aa62","ff02::fb","MDNS","336","Standard query response 0x0000 TXT, cache flush PTR _asquic._udp.local PTR AFD641B9-2F6D-4575-8F75-66BF3602B67B._asquic._udp.local SRV, cache flush 0 0 55616 NK-MacBook-Air.local AAAA, cache flush fe80::49c:fb07:3c9a:aa62 A, cache flush 192.168.0.74 AAAA, cache flush 2a02:ab88:b:4100:8a2:2611:1782:be29 NSEC, cache flush NK-MacBook-Air.local NSEC, cache flush AFD641B9-2F6D-4575-8F75-66BF3602B67B._asquic._udp.local"
"26","11:52:27.784559","192.87.28.82","192.168.0.74","TCP","1474","9001  >  59488 [ACK] Seq=537 Ack=1 Win=3520 Len=1408 TSval=2693298248 TSecr=3832825032 [TCP PDU reassembled in 28]"
"27","11:52:27.784562","192.87.28.82","192.168.0.74","TCP","1474","9001  >  59488 [ACK] Seq=1945 Ack=1 Win=3520 Len=1408 TSval=2693298248 TSecr=3832825032 [TCP PDU reassembled in 28]"
"28","11:52:27.784563","192.87.28.82","192.168.0.74","TLSv1.2","870","Application Data"
"29","11:52:27.784723","192.168.0.74","192.87.28.82","TCP","66","59488  >  9001 [ACK] Seq=1 Ack=4157 Win=7372 Len=0 TSval=3832825296 TSecr=2693298248"
"30","11:52:27.789887","192.87.28.82","192.168.0.74","TCP","1474","9001  >  59488 [ACK] Seq=4157 Ack=1 Win=3520 Len=1408 TSval=2693298260 TSecr=3832825032 [TCP PDU reassembled in 33]"
"31","11:52:27.789890","192.87.28.82","192.168.0.74","TCP","1474","9001  >  59488 [ACK] Seq=5565 Ack=1 Win=3520 Len=1408 TSval=2693298260 TSecr=3832825032 [TCP PDU reassembled in 33]"
"32","11:52:27.790180","192.168.0.74","192.87.28.82","TCP","66","59488  >  9001 [ACK] Seq=1 Ack=6973 Win=7372 Len=0 TSval=3832825301 TSecr=2693298260"
"33","11:52:27.791287","192.87.28.82","192.168.0.74","TLSv1.2","1320","Application Data"
"34","11:52:27.791289","192.87.28.82","192.168.0.74","TCP","1474","9001  >  59488 [ACK] Seq=8227 Ack=1 Win=3520 Len=1408 TSval=2693298260 TSecr=3832825032 [TCP PDU reassembled in 36]"
"35","11:52:27.791290","192.87.28.82","192.168.0.74","TCP","1474","9001  >  59488 [ACK] Seq=9635 Ack=1 Win=3520 Len=1408 TSval=2693298260 TSecr=3832825032 [TCP PDU reassembled in 36]"
"36","11:52:27.791292","192.87.28.82","192.168.0.74","TLSv1.2","1320","Application Data"
"37","11:52:27.791294","192.87.28.82","192.168.0.74","TCP","1474","9001  >  59488 [ACK] Seq=12297 Ack=1 Win=3520 Len=1408 TSval=2693298260 TSecr=3832825032 [TCP PDU reassembled in 40]"
"38","11:52:27.791295","192.87.28.82","192.168.0.74","TCP","1474","9001  >  59488 [ACK] Seq=13705 Ack=1 Win=3520 Len=1408 TSval=2693298260 TSecr=3832825032 [TCP PDU reassembled in 40]"
"39","11:52:27.791417","192.168.0.74","192.87.28.82","TCP","66","59488  >  9001 [ACK] Seq=1 Ack=15113 Win=7372 Len=0 TSval=3832825303 TSecr=2693298260"
"40","11:52:27.819858","192.87.28.82","192.168.0.74","TLSv1.2","1474","Application Data"
"41","11:52:27.819860","192.87.28.82","192.168.0.74","TCP","1474","9001  >  59488 [ACK] Seq=16521 Ack=1 Win=3520 Len=1408 TSval=2693298288 TSecr=3832825296 [TCP PDU reassembled in 43]"
"42","11:52:27.819862","192.87.28.82","192.168.0.74","TCP","1474","9001  >  59488 [ACK] Seq=17929 Ack=1 Win=3520 Len=1408 TSval=2693298288 TSecr=3832825296 [TCP PDU reassembled in 43]"
"43","11:52:27.819863","192.87.28.82","192.168.0.74","TLSv1.2","1474","Application Data, Application Data"
"44","11:52:27.820091","192.168.0.74","192.87.28.82","TCP","66","59488  >  9001 [ACK] Seq=1 Ack=20745 Win=7372 Len=0 TSval=3832825331 TSecr=2693298288"
"45","11:52:27.820239","192.168.0.74","192.87.28.82","TLSv1.2","602","Application Data"
"46","11:52:27.824458","192.87.28.82","192.168.0.74","TCP","1474","9001  >  59488 [ACK] Seq=20745 Ack=1 Win=3520 Len=1408 TSval=2693298292 TSecr=3832825301 [TCP PDU reassembled in 48]"
"47","11:52:27.824461","192.87.28.82","192.168.0.74","TCP","1474","9001  >  59488 [ACK] Seq=22153 Ack=1 Win=3520 Len=1408 TSval=2693298292 TSecr=3832825301 [TCP PDU reassembled in 48]"
"48","11:52:27.824462","192.87.28.82","192.168.0.74","TLSv1.2","1474","Application Data"
"49","11:52:27.824466","192.87.28.82","192.168.0.74","TCP","1474","9001  >  59488 [ACK] Seq=24969 Ack=1 Win=3520 Len=1408 TSval=2693298292 TSecr=3832825301 [TCP PDU reassembled in 51]"
"50","11:52:27.824467","192.87.28.82","192.168.0.74","TCP","1474","9001  >  59488 [ACK] Seq=26377 Ack=1 Win=3520 Len=1408 TSval=2693298292 TSecr=3832825303 [TCP PDU reassembled in 51]"
"51","11:52:27.824469","192.87.28.82","192.168.0.74","TLSv1.2","1474","Application Data"
"52","11:52:27.824470","192.87.28.82","192.168.0.74","TCP","1474","9001  >  59488 [ACK] Seq=29193 Ack=1 Win=3520 Len=1408 TSval=2693298292 TSecr=3832825303 [TCP PDU reassembled in 54]"
"53","11:52:27.824472","192.87.28.82","192.168.0.74","TCP","1474","9001  >  59488 [ACK] Seq=30601 Ack=1 Win=3520 Len=1408 TSval=2693298292 TSecr=3832825303 [TCP PDU reassembled in 54]"
"54","11:52:27.824473","192.87.28.82","192.168.0.74","TLSv1.2","1474","Application Data"
"55","11:52:27.824474","192.87.28.82","192.168.0.74","TCP","1474","9001  >  59488 [ACK] Seq=33417 Ack=1 Win=3520 Len=1408 TSval=2693298292 TSecr=3832825303 [TCP PDU reassembled in 57]"
"56","11:52:27.824476","192.87.28.82","192.168.0.74","TCP","1474","9001  >  59488 [ACK] Seq=34825 Ack=1 Win=3520 Len=1408 TSval=2693298292 TSecr=3832825303 [TCP PDU reassembled in 57]"
"57","11:52:27.824477","192.87.28.82","192.168.0.74","TLSv1.2","1474","Application Data"
"58","11:52:27.824720","192.168.0.74","192.87.28.82","TCP","66","59488  >  9001 [ACK] Seq=537 Ack=37641 Win=7372 Len=0 TSval=3832825336 TSecr=2693298292"
"59","11:52:27.853753","192.87.28.82","192.168.0.74","TCP","1474","9001  >  59488 [ACK] Seq=37641 Ack=1 Win=3520 Len=1408 TSval=2693298322 TSecr=3832825331 [TCP PDU reassembled in 61]"
"60","11:52:27.853755","192.87.28.82","192.168.0.74","TCP","1474","9001  >  59488 [ACK] Seq=39049 Ack=1 Win=3520 Len=1408 TSval=2693298322 TSecr=3832825331 [TCP PDU reassembled in 61]"
"61","11:52:27.853757","192.87.28.82","192.168.0.74","TLSv1.2","1474","Application Data"
"62","11:52:27.853758","192.87.28.82","192.168.0.74","TCP","1474","9001  >  59488 [ACK] Seq=41865 Ack=1 Win=3520 Len=1408 TSval=2693298322 TSecr=3832825331 [TCP PDU reassembled in 64]"
"63","11:52:27.853760","192.87.28.82","192.168.0.74","TCP","1474","9001  >  59488 [ACK] Seq=43273 Ack=1 Win=3520 Len=1408 TSval=2693298322 TSecr=3832825331 [TCP PDU reassembled in 64]"
"64","11:52:27.853761","192.87.28.82","192.168.0.74","TLSv1.2","1474","Application Data, Application Data, Application Data"
"65","11:52:27.853967","192.168.0.74","192.87.28.82","TLSv1.2","602","Application Data"
"66","11:52:27.858130","192.87.28.82","192.168.0.74","TCP","1474","9001  >  59488 [ACK] Seq=46089 Ack=537 Win=3512 Len=1408 TSval=2693298326 TSecr=3832825331 [TCP PDU reassembled in 68]"
"67","11:52:27.858132","192.87.28.82","192.168.0.74","TCP","1474","9001  >  59488 [ACK] Seq=47497 Ack=537 Win=3512 Len=1408 TSval=2693298326 TSecr=3832825331 [TCP PDU reassembled in 68]"
"68","11:52:27.858134","192.87.28.82","192.168.0.74","TLSv1.2","1474","Application Data"
"69","11:52:27.858135","192.87.28.82","192.168.0.74","TCP","1474","9001  >  59488 [ACK] Seq=50313 Ack=537 Win=3512 Len=1408 TSval=2693298326 TSecr=3832825331 [TCP PDU reassembled in 71]"
"70","11:52:27.858136","192.87.28.82","192.168.0.74","TCP","1474","9001  >  59488 [ACK] Seq=51721 Ack=537 Win=3512 Len=1408 TSval=2693298326 TSecr=3832825331 [TCP PDU reassembled in 71]"
"71","11:52:27.858137","192.87.28.82","192.168.0.74","TLSv1.2","1474","Application Data"
"72","11:52:27.858138","192.87.28.82","192.168.0.74","TCP","1474","9001  >  59488 [ACK] Seq=54537 Ack=537 Win=3512 Len=1408 TSval=2693298326 TSecr=3832825331 [TCP PDU reassembled in 74]"
"73","11:52:27.858140","192.87.28.82","192.168.0.74","TCP","1474","9001  >  59488 [ACK] Seq=55945 Ack=537 Win=3512 Len=1408 TSval=2693298326 TSecr=3832825331 [TCP PDU reassembled in 74]"
"74","11:52:27.858141","192.87.28.82","192.168.0.74","TLSv1.2","1474","Application Data"
"75","11:52:27.858142","192.87.28.82","192.168.0.74","TCP","1474","9001  >  59488 [ACK] Seq=58761 Ack=537 Win=3512 Len=1408 TSval=2693298326 TSecr=3832825331 [TCP PDU reassembled in 77]"
"76","11:52:27.858143","192.87.28.82","192.168.0.74","TCP","1474","9001  >  59488 [ACK] Seq=60169 Ack=537 Win=3512 Len=1408 TSval=2693298326 TSecr=3832825331 [TCP PDU reassembled in 77]"
"77","11:52:27.858144","192.87.28.82","192.168.0.74","TLSv1.2","1474","Application Data, Application Data"
"78","11:52:27.858145","192.87.28.82","192.168.0.74","TCP","1474","9001  >  59488 [ACK] Seq=62985 Ack=537 Win=3512 Len=1408 TSval=2693298326 TSecr=3832825331 [TCP PDU reassembled in 83]"
"79","11:52:27.858147","192.87.28.82","192.168.0.74","TCP","1474","9001  >  59488 [ACK] Seq=64393 Ack=537 Win=3512 Len=1408 TSval=2693298326 TSecr=3832825331 [TCP PDU reassembled in 83]"
"80","11:52:27.858250","192.168.0.74","192.87.28.82","TCP","66","59488  >  9001 [ACK] Seq=1073 Ack=61577 Win=7130 Len=0 TSval=3832825369 TSecr=2693298326"
"81","11:52:27.858592","192.168.0.74","192.87.28.82","TLSv1.2","1116","Application Data"
"82","11:52:27.885305","192.168.0.74","5.28.195.2","TCP","78","63762  >  443 [SYN, ECE, CWR] Seq=0 Win=65535 Len=0 MSS=1460 WS=16 TSval=3548078285 TSecr=0 SACK_PERM"
"83","11:52:27.890487","192.87.28.82","192.168.0.74","TLSv1.2","1474","Application Data"
"84","11:52:27.890489","192.87.28.82","192.168.0.74","TCP","1474","9001  >  59488 [ACK] Seq=67209 Ack=1073 Win=3512 Len=1408 TSval=2693298358 TSecr=3832825365 [TCP PDU reassembled in 86]"
"85","11:52:27.890491","192.87.28.82","192.168.0.74","TCP","1474","9001  >  59488 [ACK] Seq=68617 Ack=1073 Win=3512 Len=1408 TSval=2693298358 TSecr=3832825365 [TCP PDU reassembled in 86]"
"86","11:52:27.890492","192.87.28.82","192.168.0.74","TLSv1.2","1474","Application Data"
"87","11:52:27.890493","192.87.28.82","192.168.0.74","TCP","1474","9001  >  59488 [ACK] Seq=71433 Ack=1073 Win=3512 Len=1408 TSval=2693298358 TSecr=3832825365 [TCP PDU reassembled in 89]"
"88","11:52:27.890494","192.87.28.82","192.168.0.74","TCP","1474","9001  >  59488 [ACK] Seq=72841 Ack=1073 Win=3512 Len=1408 TSval=2693298358 TSecr=3832825365 [TCP PDU reassembled in 89]"
"89","11:52:27.890496","192.87.28.82","192.168.0.74","TLSv1.2","1474","Application Data"
"90","11:52:27.890497","192.87.28.82","192.168.0.74","TCP","1474","9001  >  59488 [ACK] Seq=75657 Ack=1073 Win=3512 Len=1408 TSval=2693298358 TSecr=3832825365 [TCP PDU reassembled in 94]"
"91","11:52:27.890596","192.168.0.74","192.87.28.82","TCP","66","59488  >  9001 [ACK] Seq=2123 Ack=77065 Win=7196 Len=0 TSval=3832825402 TSecr=2693298358"
"92","11:52:27.890723","192.168.0.74","192.87.28.82","TCP","66","[TCP Window Update] 59488  >  9001 [ACK] Seq=2123 Ack=77065 Win=7372 Len=0 TSval=3832825402 TSecr=2693298358"
"93","11:52:27.893362","192.87.28.82","192.168.0.74","TCP","1474","9001  >  59488 [ACK] Seq=77065 Ack=1073 Win=3520 Len=1408 TSval=2693298362 TSecr=3832825369 [TCP PDU reassembled in 94]"
"94","11:52:27.893365","192.87.28.82","192.168.0.74","TLSv1.2","1474","Application Data"
"95","11:52:27.893367","192.87.28.82","192.168.0.74","TCP","1474","9001  >  59488 [ACK] Seq=79881 Ack=1073 Win=3520 Len=1408 TSval=2693298362 TSecr=3832825369 [TCP PDU reassembled in 96]"
"96","11:52:27.893368","192.87.28.82","192.168.0.74","TLSv1.2","1474","Application Data"
"97","11:52:27.893370","192.87.28.82","192.168.0.74","TCP","1474","9001  >  59488 [ACK] Seq=82697 Ack=1073 Win=3520 Len=1408 TSval=2693298362 TSecr=3832825369 [TCP PDU reassembled in 99]"
"98","11:52:27.893371","192.87.28.82","192.168.0.74","TCP","1474","9001  >  59488 [ACK] Seq=84105 Ack=1073 Win=3520 Len=1408 TSval=2693298362 TSecr=3832825369 [TCP PDU reassembled in 99]"
"99","11:52:27.893372","192.87.28.82","192.168.0.74","TLSv1.2","1474","Application Data"
"100","11:52:27.893374","192.87.28.82","192.168.0.74","TCP","1474","9001  >  59488 [ACK] Seq=86921 Ack=1073 Win=3520 Len=1408 TSval=2693298362 TSecr=3832825369 [TCP PDU reassembled in 102]"
"101","11:52:27.893374","192.87.28.82","192.168.0.74","TCP","1474","9001  >  59488 [ACK] Seq=88329 Ack=1073 Win=3520 Len=1408 TSval=2693298362 TSecr=3832825369 [TCP PDU reassembled in 102]"
"102","11:52:27.893376","192.87.28.82","192.168.0.74","TLSv1.2","1474","Application Data"
"103","11:52:27.893377","192.87.28.82","192.168.0.74","TLSv1.2","1474","Application Data"
"104","11:52:27.893379","192.87.28.82","192.168.0.74","TCP","1474","9001  >  59488 [ACK] Seq=92553 Ack=1073 Win=3520 Len=1408 TSval=2693298362 TSecr=3832825369 [TCP PDU reassembled in 105]"
"105","11:52:27.893380","192.87.28.82","192.168.0.74","TLSv1.2","1320","Application Data"
"106","11:52:27.893488","192.168.0.74","192.87.28.82","TCP","66","59488  >  9001 [ACK] Seq=2123 Ack=92553 Win=7130 Len=0 TSval=3832825405 TSecr=2693298362"
"107","11:52:27.893801","192.168.0.74","192.87.28.82","TLSv1.2","602","Application Data"
"108","11:52:27.922567","192.168.0.74","5.28.195.2","TCP","78","63763  >  443 [SYN, ECE, CWR] Seq=0 Win=65535 Len=0 MSS=1460 WS=16 TSval=2354340567 TSecr=0 SACK_PERM"
"109","11:52:27.926493","5.28.195.2","192.168.0.74","TCP","74","443  >  63762 [SYN, ACK, ECE] Seq=0 Ack=1 Win=65535 Len=0 MSS=1240 SACK_PERM TSval=3098156484 TSecr=3548078285 WS=1024"
"110","11:52:27.926615","192.168.0.74","5.28.195.2","TCP","66","63762  >  443 [ACK] Seq=1 Ack=1 Win=1048560 Len=0 TSval=3548078327 TSecr=3098156484"
"111","11:52:27.926792","192.168.0.74","5.28.195.2","TLSv1","583","Client Hello"
"112","11:52:27.930555","192.87.28.82","192.168.0.74","TCP","66","9001  >  59488 [ACK] Seq=95215 Ack=2659 Win=3512 Len=0 TSval=2693298398 TSecr=3832825370"
"113","11:52:27.930655","192.168.0.74","192.87.28.82","TLSv1.2","602","Application Data"
"114","11:52:28.018631","192.168.0.74","64.65.63.120","TLSv1.2","602","Application Data"
"115","11:52:28.020031","192.168.0.74","64.65.63.120","TCP","1474","59487  >  443 [ACK] Seq=2659 Ack=1 Win=9198 Len=1408 TSval=3163956576 TSecr=2681248783 [TCP PDU reassembled in 116]"
"116","11:52:28.020042","192.168.0.74","64.65.63.120","TLSv1.2","736","Application Data"
"117","11:52:28.031134","192.168.0.74","64.65.63.120","TLSv1.2","1474","Application Data, Application Data"
"118","11:52:28.031136","192.168.0.74","64.65.63.120","TCP","1474","59487  >  443 [ACK] Seq=6145 Ack=1 Win=9198 Len=1408 TSval=3163956587 TSecr=2681248783 [TCP PDU reassembled in 120]"
"119","11:52:28.031137","192.168.0.74","64.65.63.120","TCP","1474","59487  >  443 [ACK] Seq=7553 Ack=1 Win=9198 Len=1408 TSval=3163956587 TSecr=2681248783 [TCP PDU reassembled in 120]"
"120","11:52:28.031153","192.168.0.74","64.65.63.120","TLSv1.2","984","Application Data"
"121","11:52:28.031168","192.168.0.74","64.65.63.120","TCP","1474","59487  >  443 [ACK] Seq=9879 Ack=1 Win=9198 Len=1408 TSval=3163956587 TSecr=2681248783 [TCP PDU reassembled in 123]"
"122","11:52:28.031168","192.168.0.74","64.65.63.120","TCP","1474","59487  >  443 [ACK] Seq=11287 Ack=1 Win=9198 Len=1408 TSval=3163956587 TSecr=2681248783 [TCP PDU reassembled in 123]"
"123","11:52:28.031171","192.168.0.74","64.65.63.120","TLSv1.2","420","Application Data"
"124","11:52:28.033117","192.168.0.74","64.65.63.120","TCP","1474","59487  >  443 [ACK] Seq=13049 Ack=1 Win=9198 Len=1408 TSval=3163956589 TSecr=2681248783 [TCP PDU reassembled in 126]"
"125","11:52:28.033119","192.168.0.74","64.65.63.120","TCP","1474","59487  >  443 [ACK] Seq=14457 Ack=1 Win=9198 Len=1408 TSval=3163956589 TSecr=2681248783 [TCP PDU reassembled in 126]"
"126","11:52:28.033131","192.168.0.74","64.65.63.120","TLSv1.2","1320","Application Data"
"127","11:52:28.054891","5.28.195.2","192.168.0.74","TCP","74","443  >  63763 [SYN, ACK, ECE] Seq=0 Ack=1 Win=65535 Len=0 MSS=1240 SACK_PERM TSval=1730960038 TSecr=2354340567 WS=1024"
"128","11:52:28.054893","5.28.195.2","192.168.0.74","TCP","66","443  >  63762 [ACK] Seq=1 Ack=518 Win=67584 Len=0 TSval=3098156526 TSecr=3548078327"
"129","11:52:28.054895","5.28.195.2","192.168.0.74","TCP","66","443  >  63762 [FIN, ACK] Seq=1 Ack=518 Win=67584 Len=0 TSval=3098156527 TSecr=3548078327"
"130","11:52:28.054897","192.87.28.82","192.168.0.74","TCP","66","9001  >  59488 [ACK] Seq=95215 Ack=3195 Win=3520 Len=0 TSval=2693298475 TSecr=3832825442"
"131","11:52:28.055123","192.168.0.74","5.28.195.2","TCP","66","63763  >  443 [ACK] Seq=1 Ack=1 Win=1048560 Len=0 TSval=2354340699 TSecr=1730960038"
"132","11:52:28.055194","192.168.0.74","5.28.195.2","TCP","66","63762  >  443 [ACK] Seq=518 Ack=2 Win=1048560 Len=0 TSval=3548078455 TSecr=3098156527"
"133","11:52:28.055388","192.168.0.74","5.28.195.2","TCP","66","63762  >  443 [FIN, ACK] Seq=518 Ack=2 Win=1048560 Len=0 TSval=3548078455 TSecr=3098156527"
"134","11:52:28.055419","192.168.0.74","5.28.195.2","TLSv1","583","Client Hello"
"135","11:52:28.094237","64.65.63.120","192.168.0.74","TCP","66","443  >  59487 [ACK] Seq=1 Ack=2659 Win=3504 Len=0 TSval=2681249284 TSecr=3163956575"
"136","11:52:28.094239","64.65.63.120","192.168.0.74","TCP","66","443  >  59487 [ACK] Seq=1 Ack=4737 Win=3488 Len=0 TSval=2681249284 TSecr=3163956576"
"137","11:52:28.094240","64.65.63.120","192.168.0.74","TCP","66","443  >  59487 [ACK] Seq=1 Ack=7553 Win=3466 Len=0 TSval=2681249284 TSecr=3163956587"
"138","11:52:28.094241","64.65.63.120","192.168.0.74","TCP","66","443  >  59487 [ACK] Seq=1 Ack=8961 Win=3455 Len=0 TSval=2681249284 TSecr=3163956587"
"139","11:52:28.094242","64.65.63.120","192.168.0.74","TCP","66","443  >  59487 [ACK] Seq=1 Ack=9879 Win=3448 Len=0 TSval=2681249285 TSecr=3163956587"
"140","11:52:28.094243","64.65.63.120","192.168.0.74","TCP","66","443  >  59487 [ACK] Seq=1 Ack=11287 Win=3437 Len=0 TSval=2681249285 TSecr=3163956587"
"141","11:52:28.094243","64.65.63.120","192.168.0.74","TCP","66","443  >  59487 [ACK] Seq=1 Ack=12695 Win=3426 Len=0 TSval=2681249285 TSecr=3163956587"
"142","11:52:28.094244","64.65.63.120","192.168.0.74","TCP","66","443  >  59487 [ACK] Seq=1 Ack=13049 Win=3424 Len=0 TSval=2681249285 TSecr=3163956587"
"143","11:52:28.094246","64.65.63.120","192.168.0.74","TCP","66","443  >  59487 [ACK] Seq=1 Ack=15865 Win=3402 Len=0 TSval=2681249287 TSecr=3163956589"
"144","11:52:28.094247","64.65.63.120","192.168.0.74","TCP","66","443  >  59487 [ACK] Seq=1 Ack=17119 Win=3393 Len=0 TSval=2681249287 TSecr=3163956589"
"145","11:52:28.094405","192.168.0.74","64.65.63.120","TLSv1.2","666","Application Data"
"146","11:52:28.100836","5.28.195.2","192.168.0.74","TCP","56","443  >  63762 [RST] Seq=2 Win=0 Len=0"
"147","11:52:28.100839","5.28.195.2","192.168.0.74","TCP","66","443  >  63763 [ACK] Seq=1 Ack=518 Win=67584 Len=0 TSval=1730960213 TSecr=2354340700"
"148","11:52:28.129318","64.65.63.120","192.168.0.74","TCP","66","443  >  59487 [ACK] Seq=1 Ack=17719 Win=3389 Len=0 TSval=2681249321 TSecr=3163956650"
"149","11:52:28.136664","192.87.28.82","192.168.0.74","TLSv1.2","602","Application Data"
"150","11:52:28.136861","192.168.0.74","192.87.28.82","TCP","66","59488  >  9001 [ACK] Seq=3195 Ack=95751 Win=7372 Len=0 TSval=3832825648 TSecr=2693298604"
"151","11:52:28.138562","192.87.28.82","192.168.0.74","TCP","1474","9001  >  59488 [ACK] Seq=95751 Ack=3195 Win=3520 Len=1408 TSval=2693298606 TSecr=3832825442 [TCP PDU reassembled in 153]"
"152","11:52:28.138565","192.87.28.82","192.168.0.74","TCP","1474","9001  >  59488 [ACK] Seq=97159 Ack=3195 Win=3520 Len=1408 TSval=2693298606 TSecr=3832825442 [TCP PDU reassembled in 153]"
"153","11:52:28.138568","192.87.28.82","192.168.0.74","TLSv1.2","870","Application Data"
"154","11:52:28.138661","192.168.0.74","192.87.28.82","TCP","66","59488  >  9001 [ACK] Seq=3195 Ack=99371 Win=7372 Len=0 TSval=3832825650 TSecr=2693298606"
"155","11:52:28.140515","192.87.28.82","192.168.0.74","TCP","1474","9001  >  59488 [ACK] Seq=99371 Ack=3195 Win=3520 Len=1408 TSval=2693298610 TSecr=3832825442 [TCP PDU reassembled in 157]"
"156","11:52:28.140517","192.87.28.82","192.168.0.74","TCP","1474","9001  >  59488 [ACK] Seq=100779 Ack=3195 Win=3520 Len=1408 TSval=2693298610 TSecr=3832825442 [TCP PDU reassembled in 157]"
"157","11:52:28.140518","192.87.28.82","192.168.0.74","TLSv1.2","1320","Application Data"
"158","11:52:28.140605","192.168.0.74","192.87.28.82","TCP","66","59488  >  9001 [ACK] Seq=3195 Ack=103441 Win=7372 Len=0 TSval=3832825652 TSecr=2693298610"
"159","11:52:28.149581","192.87.28.82","192.168.0.74","TLSv1.2","1474","Application Data"
"160","11:52:28.149584","192.87.28.82","192.168.0.74","TCP","1474","9001  >  59488 [ACK] Seq=104849 Ack=3195 Win=3520 Len=1408 TSval=2693298618 TSecr=3832825442 [TCP PDU reassembled in 161]"
"161","11:52:28.149585","192.87.28.82","192.168.0.74","TLSv1.2","1406","Application Data"
"162","11:52:28.149587","192.87.28.82","192.168.0.74","TCP","1474","9001  >  59488 [ACK] Seq=107597 Ack=3195 Win=3520 Len=1408 TSval=2693298618 TSecr=3832825442 [TCP PDU reassembled in 164]"
"163","11:52:28.149593","192.87.28.82","192.168.0.74","TCP","1474","9001  >  59488 [ACK] Seq=109005 Ack=3195 Win=3520 Len=1408 TSval=2693298618 TSecr=3832825442 [TCP PDU reassembled in 164]"
"164","11:52:28.149595","192.87.28.82","192.168.0.74","TLSv1.2","1320","Application Data"
"165","11:52:28.149751","192.168.0.74","192.87.28.82","TCP","66","59488  >  9001 [ACK] Seq=3195 Ack=111667 Win=7372 Len=0 TSval=3832825661 TSecr=2693298618"
"166","11:52:28.149908","192.168.0.74","192.87.28.82","TLSv1.2","602","Application Data"
"167","11:52:28.151277","192.87.28.82","192.168.0.74","TLSv1.2","1474","Application Data"
"168","11:52:28.151280","192.87.28.82","192.168.0.74","TCP","1474","9001  >  59488 [ACK] Seq=113075 Ack=3195 Win=3520 Len=1408 TSval=2693298620 TSecr=3832825442 [TCP PDU reassembled in 170]"
"169","11:52:28.151286","192.87.28.82","192.168.0.74","TCP","1474","9001  >  59488 [ACK] Seq=114483 Ack=3195 Win=3520 Len=1408 TSval=2693298620 TSecr=3832825442 [TCP PDU reassembled in 170]"
"170","11:52:28.151288","192.87.28.82","192.168.0.74","TLSv1.2","576","Application Data"
"171","11:52:28.151290","192.87.28.82","192.168.0.74","TCP","1474","9001  >  59488 [ACK] Seq=116401 Ack=3195 Win=3520 Len=1408 TSval=2693298620 TSecr=3832825442 [TCP PDU reassembled in 173]"
"172","11:52:28.151293","192.87.28.82","192.168.0.74","TCP","1474","9001  >  59488 [ACK] Seq=117809 Ack=3195 Win=3520 Len=1408 TSval=2693298620 TSecr=3832825442 [TCP PDU reassembled in 173]"
"173","11:52:28.151295","192.87.28.82","192.168.0.74","TLSv1.2","1320","Application Data"
"174","11:52:28.151298","192.87.28.82","192.168.0.74","TCP","1474","9001  >  59488 [ACK] Seq=120471 Ack=3195 Win=3520 Len=1408 TSval=2693298620 TSecr=3832825442 [TCP PDU reassembled in 176]"
"175","11:52:28.151303","192.87.28.82","192.168.0.74","TCP","1474","9001  >  59488 [ACK] Seq=121879 Ack=3195 Win=3520 Len=1408 TSval=2693298620 TSecr=3832825442 [TCP PDU reassembled in 176]"
"176","11:52:28.151305","192.87.28.82","192.168.0.74","TLSv1.2","998","Application Data"
"177","11:52:28.151411","192.168.0.74","192.87.28.82","TCP","66","59488  >  9001 [ACK] Seq=3731 Ack=124219 Win=7372 Len=0 TSval=3832825663 TSecr=2693298620"
"178","11:52:28.153541","192.87.28.82","192.168.0.74","TCP","1474","9001  >  59488 [ACK] Seq=124219 Ack=3195 Win=3520 Len=1408 TSval=2693298622 TSecr=3832825442 [TCP PDU reassembled in 180]"
"179","11:52:28.153542","192.87.28.82","192.168.0.74","TCP","1474","9001  >  59488 [ACK] Seq=125627 Ack=3195 Win=3520 Len=1408 TSval=2693298622 TSecr=3832825442 [TCP PDU reassembled in 180]"
"180","11:52:28.153544","192.87.28.82","192.168.0.74","TLSv1.2","1320","Application Data"
"181","11:52:28.153545","192.87.28.82","192.168.0.74","TCP","1474","9001  >  59488 [ACK] Seq=128289 Ack=3195 Win=3520 Len=1408 TSval=2693298622 TSecr=3832825442 [TCP PDU reassembled in 183]"
"182","11:52:28.153547","192.87.28.82","192.168.0.74","TCP","1474","9001  >  59488 [ACK] Seq=129697 Ack=3195 Win=3520 Len=1408 TSval=2693298622 TSecr=3832825442 [TCP PDU reassembled in 183]"
"183","11:52:28.153548","192.87.28.82","192.168.0.74","TLSv1.2","1320","Application Data"
"184","11:52:28.153549","192.87.28.82","192.168.0.74","TCP","1474","9001  >  59488 [ACK] Seq=132359 Ack=3195 Win=3520 Len=1408 TSval=2693298622 TSecr=3832825442 [TCP PDU reassembled in 186]"
"185","11:52:28.153550","192.87.28.82","192.168.0.74","TCP","1474","9001  >  59488 [ACK] Seq=133767 Ack=3195 Win=3520 Len=1408 TSval=2693298622 TSecr=3832825442 [TCP PDU reassembled in 186]"
"186","11:52:28.153552","192.87.28.82","192.168.0.74","TLSv1.2","1320","Application Data"
"187","11:52:28.153553","192.87.28.82","192.168.0.74","TCP","1474","9001  >  59488 [ACK] Seq=136429 Ack=3195 Win=3520 Len=1408 TSval=2693298622 TSecr=3832825442 [TCP PDU reassembled in 189]"
"188","11:52:28.153554","192.87.28.82","192.168.0.74","TCP","1474","9001  >  59488 [ACK] Seq=137837 Ack=3195 Win=3520 Len=1408 TSval=2693298622 TSecr=3832825442 [TCP PDU reassembled in 189]"
"189","11:52:28.153555","192.87.28.82","192.168.0.74","TLSv1.2","1320","Application Data"
"190","11:52:28.153680","192.168.0.74","192.87.28.82","TCP","66","59488  >  9001 [ACK] Seq=3731 Ack=140499 Win=7372 Len=0 TSval=3832825665 TSecr=2693298622"
"191","11:52:28.159252","64.65.63.120","192.168.0.74","TLSv1.2","602","Application Data"
"192","11:52:28.159337","192.168.0.74","64.65.63.120","TCP","66","59487  >  443 [ACK] Seq=17719 Ack=537 Win=9190 Len=0 TSval=3163956715 TSecr=2681249348"
"193","11:52:28.171376","192.87.28.82","192.168.0.74","TLSv1.2","1474","Application Data"
"194","11:52:28.171378","192.87.28.82","192.168.0.74","TCP","1474","9001  >  59488 [ACK] Seq=141907 Ack=3195 Win=3520 Len=1408 TSval=2693298638 TSecr=3832825650 [TCP PDU reassembled in 195]"
"195","11:52:28.171379","192.87.28.82","192.168.0.74","TLSv1.2","1474","Application Data"
"196","11:52:28.171380","192.87.28.82","192.168.0.74","TCP","1474","9001  >  59488 [ACK] Seq=144723 Ack=3195 Win=3520 Len=1408 TSval=2693298638 TSecr=3832825650 [TCP PDU reassembled in 207]"
"197","11:52:28.171382","192.87.28.82","192.168.0.74","TCP","1474","9001  >  59488 [ACK] Seq=146131 Ack=3195 Win=3520 Len=1408 TSval=2693298638 TSecr=3832825650 [TCP PDU reassembled in 207]"
"198","11:52:28.171383","64.65.63.120","192.168.0.74","TCP","1474","443  >  59487 [ACK] Seq=537 Ack=17719 Win=3389 Len=1408 TSval=2681249360 TSecr=3163956650 [TCP PDU reassembled in 200]"
"199","11:52:28.171385","64.65.63.120","192.168.0.74","TCP","1474","443  >  59487 [PSH, ACK] Seq=1945 Ack=17719 Win=3389 Len=1408 TSval=2681249360 TSecr=3163956650 [TCP PDU reassembled in 200]"
"200","11:52:28.171386","64.65.63.120","192.168.0.74","TLSv1.2","1474","Application Data"
"201","11:52:28.171387","64.65.63.120","192.168.0.74","TCP","1474","443  >  59487 [ACK] Seq=4761 Ack=17719 Win=3389 Len=1408 TSval=2681249360 TSecr=3163956650 [TCP PDU reassembled in 230]"
"202","11:52:28.171389","64.65.63.120","192.168.0.74","TCP","1474","443  >  59487 [PSH, ACK] Seq=6169 Ack=17719 Win=3389 Len=1408 TSval=2681249360 TSecr=3163956650 [TCP PDU reassembled in 230]"
"203","11:52:28.171510","192.168.0.74","64.65.63.120","TCP","66","59487  >  443 [ACK] Seq=17719 Ack=1945 Win=9176 Len=0 TSval=3163956728 TSecr=2681249360"
"204","11:52:28.171538","192.168.0.74","64.65.63.120","TCP","66","59487  >  443 [ACK] Seq=17719 Ack=7577 Win=9088 Len=0 TSval=3163956728 TSecr=2681249360"
"205","11:52:28.171560","192.168.0.74","192.87.28.82","TLSv1.2","602","Application Data"
"206","11:52:28.171692","192.168.0.74","64.65.63.120","TCP","66","[TCP Window Update] 59487  >  443 [ACK] Seq=17719 Ack=7577 Win=9198 Len=0 TSval=3163956728 TSecr=2681249360"
"207","11:52:28.173059","192.87.28.82","192.168.0.74","TLSv1.2","1474","Application Data"
"208","11:52:28.173061","192.87.28.82","192.168.0.74","TCP","1474","9001  >  59488 [ACK] Seq=148947 Ack=3195 Win=3520 Len=1408 TSval=2693298642 TSecr=3832825652 [TCP PDU reassembled in 210]"
"209","11:52:28.173063","192.87.28.82","192.168.0.74","TCP","1474","9001  >  59488 [ACK] Seq=150355 Ack=3195 Win=3520 Len=1408 TSval=2693298642 TSecr=3832825652 [TCP PDU reassembled in 210]"
"210","11:52:28.173065","192.87.28.82","192.168.0.74","TLSv1.2","1474","Application Data"
"211","11:52:28.173066","192.87.28.82","192.168.0.74","TCP","1474","9001  >  59488 [ACK] Seq=153171 Ack=3195 Win=3520 Len=1408 TSval=2693298642 TSecr=3832825652 [TCP PDU reassembled in 215]"
"212","11:52:28.173168","192.168.0.74","192.87.28.82","TLSv1.2","602","Application Data"
"213","11:52:28.177623","192.168.0.192","230.0.0.1","UDP","92","62979  >  6666 Len=50"
"214","11:52:28.183140","192.87.28.82","192.168.0.74","TCP","1474","9001  >  59488 [ACK] Seq=154579 Ack=3195 Win=3520 Len=1408 TSval=2693298651 TSecr=3832825652 [TCP PDU reassembled in 215]"
"215","11:52:28.183143","192.87.28.82","192.168.0.74","TLSv1.2","1474","Application Data, Application Data"
"216","11:52:28.183145","192.87.28.82","192.168.0.74","TCP","1474","9001  >  59488 [ACK] Seq=157395 Ack=3195 Win=3520 Len=1408 TSval=2693298651 TSecr=3832825652 [TCP PDU reassembled in 218]"
"217","11:52:28.183146","192.87.28.82","192.168.0.74","TCP","1474","9001  >  59488 [ACK] Seq=158803 Ack=3195 Win=3520 Len=1408 TSval=2693298651 TSecr=3832825652 [TCP PDU reassembled in 218]"
"218","11:52:28.183148","192.87.28.82","192.168.0.74","TLSv1.2","1474","Application Data"
"219","11:52:28.183149","192.87.28.82","192.168.0.74","TCP","1474","9001  >  59488 [ACK] Seq=161619 Ack=3195 Win=3520 Len=1408 TSval=2693298651 TSecr=3832825652 [TCP PDU reassembled in 221]"
"220","11:52:28.183151","192.87.28.82","192.168.0.74","TCP","1474","9001  >  59488 [ACK] Seq=163027 Ack=3195 Win=3520 Len=1408 TSval=2693298651 TSecr=3832825652 [TCP PDU reassembled in 221]"
"221","11:52:28.183152","192.87.28.82","192.168.0.74","TLSv1.2","1474","Application Data"
"222","11:52:28.183153","192.87.28.82","192.168.0.74","TCP","1474","9001  >  59488 [ACK] Seq=165843 Ack=3195 Win=3520 Len=1408 TSval=2693298651 TSecr=3832825652 [TCP PDU reassembled in 224]"
"223","11:52:28.183155","192.87.28.82","192.168.0.74","TCP","1474","9001  >  59488 [ACK] Seq=167251 Ack=3195 Win=3520 Len=1408 TSval=2693298651 TSecr=3832825652 [TCP PDU reassembled in 224]"
"224","11:52:28.183156","192.87.28.82","192.168.0.74","TLSv1.2","1474","Application Data"
"225","11:52:28.183158","192.87.28.82","192.168.0.74","TCP","1474","9001  >  59488 [ACK] Seq=170067 Ack=3195 Win=3520 Len=1408 TSval=2693298651 TSecr=3832825652 [TCP PDU reassembled in 227]"
"226","11:52:28.183159","192.87.28.82","192.168.0.74","TCP","1474","9001  >  59488 [ACK] Seq=171475 Ack=3195 Win=3520 Len=1408 TSval=2693298651 TSecr=3832825652 [TCP PDU reassembled in 227]"
"227","11:52:28.183160","192.87.28.82","192.168.0.74","TLSv1.2","1474","Application Data, Application Data"
"228","11:52:28.183162","192.87.28.82","192.168.0.74","TCP","1474","9001  >  59488 [ACK] Seq=174291 Ack=3195 Win=3520 Len=1408 TSval=2693298651 TSecr=3832825652 [TCP PDU reassembled in 236]"
"229","11:52:28.183163","192.87.28.82","192.168.0.74","TCP","1474","9001  >  59488 [ACK] Seq=175699 Ack=3195 Win=3520 Len=1408 TSval=2693298651 TSecr=3832825652 [TCP PDU reassembled in 236]"
"230","11:52:28.183165","64.65.63.120","192.168.0.74","TLSv1.2","1474","Application Data"
"231","11:52:28.183166","64.65.63.120","192.168.0.74","TCP","1474","443  >  59487 [ACK] Seq=8985 Ack=17719 Win=3389 Len=1408 TSval=2681249374 TSecr=3163956650 [TCP PDU reassembled in 252]"
"232","11:52:28.183167","64.65.63.120","192.168.0.74","TCP","1474","443  >  59487 [PSH, ACK] Seq=10393 Ack=17719 Win=3389 Len=1408 TSval=2681249374 TSecr=3163956650 [TCP PDU reassembled in 252]"
"233","11:52:28.183337","192.168.0.74","64.65.63.120","TCP","66","59487  >  443 [ACK] Seq=17719 Ack=11801 Win=9132 Len=0 TSval=3163956739 TSecr=2681249374"
"234","11:52:28.183603","192.168.0.74","64.65.63.120","TCP","66","[TCP Window Update] 59487  >  443 [ACK] Seq=17719 Ack=11801 Win=9198 Len=0 TSval=3163956740 TSecr=2681249374"
"235","11:52:28.183738","192.168.0.74","192.87.28.82","TLSv1.2","602","Application Data"
"236","11:52:28.187159","192.87.28.82","192.168.0.74","TLSv1.2","1474","Application Data"
"237","11:52:28.187161","192.87.28.82","192.168.0.74","TCP","1474","9001  >  59488 [ACK] Seq=178515 Ack=3731 Win=3512 Len=1408 TSval=2693298655 TSecr=3832825661 [TCP PDU reassembled in 238]"
"238","11:52:28.187162","192.87.28.82","192.168.0.74","TLSv1.2","1474","Application Data"
"239","11:52:28.187164","192.87.28.82","192.168.0.74","TCP","1474","9001  >  59488 [ACK] Seq=181331 Ack=3731 Win=3512 Len=1408 TSval=2693298655 TSecr=3832825661 [TCP PDU reassembled in 241]"
"240","11:52:28.187165","192.87.28.82","192.168.0.74","TCP","1474","9001  >  59488 [ACK] Seq=182739 Ack=3731 Win=3512 Len=1408 TSval=2693298655 TSecr=3832825661 [TCP PDU reassembled in 241]"
"241","11:52:28.187166","192.87.28.82","192.168.0.74","TLSv1.2","1474","Application Data"
"242","11:52:28.187167","192.87.28.82","192.168.0.74","TCP","1474","9001  >  59488 [ACK] Seq=185555 Ack=3731 Win=3512 Len=1408 TSval=2693298655 TSecr=3832825661 [TCP PDU reassembled in 244]"
"243","11:52:28.187169","192.87.28.82","192.168.0.74","TCP","1474","9001  >  59488 [ACK] Seq=186963 Ack=3731 Win=3512 Len=1408 TSval=2693298655 TSecr=3832825661 [TCP PDU reassembled in 244]"
"244","11:52:28.187170","192.87.28.82","192.168.0.74","TLSv1.2","1474","Application Data"
"245","11:52:28.187171","192.87.28.82","192.168.0.74","TCP","1474","9001  >  59488 [ACK] Seq=189779 Ack=3731 Win=3512 Len=1408 TSval=2693298655 TSecr=3832825661 [TCP PDU reassembled in 247]"
"246","11:52:28.187172","192.87.28.82","192.168.0.74","TCP","1474","9001  >  59488 [ACK] Seq=191187 Ack=3731 Win=3512 Len=1408 TSval=2693298655 TSecr=3832825661 [TCP PDU reassembled in 247]"
"247","11:52:28.187174","192.87.28.82","192.168.0.74","TLSv1.2","1474","Application Data"
"248","11:52:28.187175","192.87.28.82","192.168.0.74","TCP","1474","9001  >  59488 [ACK] Seq=194003 Ack=3731 Win=3512 Len=1408 TSval=2693298655 TSecr=3832825661 [TCP PDU reassembled in 258]"
"249","11:52:28.187176","192.87.28.82","192.168.0.74","TCP","1474","9001  >  59488 [ACK] Seq=195411 Ack=3731 Win=3512 Len=1408 TSval=2693298655 TSecr=3832825661 [TCP PDU reassembled in 258]"
"250","11:52:28.187276","192.168.0.74","192.87.28.82","TCP","66","59488  >  9001 [ACK] Seq=5339 Ack=192595 Win=7130 Len=0 TSval=3832825698 TSecr=2693298655"
"251","11:52:28.187574","192.168.0.74","192.87.28.82","TLSv1.2","1116","Application Data"
"252","11:52:28.196082","64.65.63.120","192.168.0.74","TLSv1.2","1474","Application Data, Application Data"
"253","11:52:28.196084","64.65.63.120","192.168.0.74","TCP","1474","443  >  59487 [ACK] Seq=13209 Ack=17719 Win=3389 Len=1408 TSval=2681249387 TSecr=3163956715 [TCP PDU reassembled in 276]"
"254","11:52:28.196085","64.65.63.120","192.168.0.74","TCP","1474","443  >  59487 [PSH, ACK] Seq=14617 Ack=17719 Win=3389 Len=1408 TSval=2681249387 TSecr=3163956715 [TCP PDU reassembled in 276]"
"255","11:52:28.196176","192.168.0.74","64.65.63.120","TCP","66","59487  >  443 [ACK] Seq=17719 Ack=16025 Win=9132 Len=0 TSval=3163956752 TSecr=2681249387"
"256","11:52:28.196275","192.168.0.74","64.65.63.120","TCP","66","[TCP Window Update] 59487  >  443 [ACK] Seq=17719 Ack=16025 Win=9198 Len=0 TSval=3163956752 TSecr=2681249387"
"257","11:52:28.196360","192.168.0.74","64.65.63.120","TLSv1.2","602","Application Data"
"258","11:52:28.206064","192.87.28.82","192.168.0.74","TLSv1.2","1474","Application Data, Application Data"
"259","11:52:28.206065","192.87.28.82","192.168.0.74","TCP","1474","9001  >  59488 [ACK] Seq=198227 Ack=4267 Win=3512 Len=1408 TSval=2693298674 TSecr=3832825683 [TCP PDU reassembled in 261]"
"260","11:52:28.206067","192.87.28.82","192.168.0.74","TCP","1474","9001  >  59488 [ACK] Seq=199635 Ack=4267 Win=3512 Len=1408 TSval=2693298674 TSecr=3832825683 [TCP PDU reassembled in 261]"
"261","11:52:28.206069","192.87.28.82","192.168.0.74","TLSv1.2","1474","Application Data"
"262","11:52:28.206070","192.87.28.82","192.168.0.74","TCP","1474","9001  >  59488 [ACK] Seq=202451 Ack=4267 Win=3512 Len=1408 TSval=2693298674 TSecr=3832825683 [TCP PDU reassembled in 264]"
