"No.","Time","Source","Destination","Protocol","Length","Info"
"1","11:51:56.177478","2606:4700:4700::1111","2a02:ab88:b:4100:6163:ab1b:4f48:fc2c","TCP","86","443  >  57753 [ACK] Seq=1 Ack=1 Win=16 Len=0 TSval=4054935714 TSecr=4117672438"
"2","11:51:56.179730","2606:4700:4700::1111","2a02:ab88:b:4100:6163:ab1b:4f48:fc2c","TLSv1.3","1434","Server Hello, Change Cipher Spec"
"3","11:51:56.181821","2606:4700:4700::1111","2a02:ab88:b:4100:6163:ab1b:4f48:fc2c","TCP","1434","443  >  57753 [ACK] Seq=1349 Ack=1 Win=16 Len=1348 TSval=4054935715 TSecr=4117672438 [TCP PDU reassembled in 4]"
"4","11:51:56.181823","2606:4700:4700::1111","2a02:ab88:b:4100:6163:ab1b:4f48:fc2c","TLSv1.3","1428","Application Data"
"5","11:51:56.187541","2a02:ab88:b:4100:6163:ab1b:4f48:fc2c","2606:4700:4700::1111","TCP","86","57753  >  443 [ACK] Seq=1 Ack=4039 Win=2002 Len=0 TSval=4117672471 TSecr=4054935715"
"6","11:51:56.187544","2a02:ab88:b:4100:6163:ab1b:4f48:fc2c","2606:4700:4700::1111","TCP","86","[TCP Window Update] 57753  >  443 [ACK] Seq=1 Ack=4039 Win=2048 Len=0 TSval=4117672471 TSecr=4054935715"
"7","11:51:56.189630","2a02:ab88:b:4100:6163:ab1b:4f48:fc2c","2606:4700:4700::1111","TCP","98","57754  >  443 [SYN, ECE, CWR] Seq=0 Win=65535 Len=0 MSS=1440 WS=64 TSval=3732011788 TSecr=0 SACK_PERM"
"8","11:51:56.195034","2a02:ab88:b:4100:6163:ab1b:4f48:fc2c","2606:4700:4700::1111","TCP","98","57755  >  853 [SYN, ECE, CWR] Seq=0 Win=65535 Len=0 MSS=1440 WS=64 TSval=3732059047 TSecr=0 SACK_PERM"
"9","11:51:56.204135","2a02:ab88:b:4100:6163:ab1b:4f48:fc2c","2606:4700:4700::1111","TLSv1.3","166","Change Cipher Spec, Application Data"
"10","11:51:56.205390","2606:4700:4700::1111","2a02:ab88:b:4100:6163:ab1b:4f48:fc2c","TCP","94","443  >  57754 [SYN, ACK, ECE] Seq=0 Ack=1 Win=65535 Len=0 MSS=1360 SACK_PERM TSval=2121428698 TSecr=3732011788 WS=8192"
"11","11:51:56.205550","2a02:ab88:b:4100:6163:ab1b:4f48:fc2c","2606:4700:4700::1111","TLSv1.3","406","Application Data"
"12","11:51:56.206264","2a02:ab88:b:4100:6163:ab1b:4f48:fc2c","2606:4700:4700::1111","TCP","86","57754  >  443 [ACK] Seq=1 Ack=1 Win=132160 Len=0 TSval=3732011804 TSecr=2121428698"
"13","11:51:56.206286","2a02:ab88:b:4100:6163:ab1b:4f48:fc2c","2606:4700:4700::1111","TCP","1434","57754  >  443 [ACK] Seq=1 Ack=1 Win=132160 Len=1348 TSval=3732011805 TSecr=2121428698 [TCP PDU reassembled in 14]"
"14","11:51:56.206290","2a02:ab88:b:4100:6163:ab1b:4f48:fc2c","2606:4700:4700::1111","TLSv1.3","267","Client Hello (SNI=one.one.one.one)"
"15","11:51:56.210195","2606:4700:4700::1111","2a02:ab88:b:4100:6163:ab1b:4f48:fc2c","TCP","94","853  >  57755 [SYN, ACK, ECE] Seq=0 Ack=1 Win=65535 Len=0 MSS=1360 SACK_PERM TSval=3558857050 TSecr=3732059047 WS=8192"
"16","11:51:56.211037","2a02:ab88:b:4100:6163:ab1b:4f48:fc2c","2606:4700:4700::1111","TCP","86","57755  >  853 [ACK] Seq=1 Ack=1 Win=132160 Len=0 TSval=3732059062 TSecr=3558857050"
"17","11:51:56.211063","2a02:ab88:b:4100:6163:ab1b:4f48:fc2c","2606:4700:4700::1111","TCP","1434","57755  >  853 [ACK] Seq=1 Ack=1 Win=132160 Len=1348 TSval=3732059063 TSecr=3558857050 [TCP PDU reassembled in 18]"
"18","11:51:56.211066","2a02:ab88:b:4100:6163:ab1b:4f48:fc2c","2606:4700:4700::1111","TLSv1.3","268","Client Hello (SNI=one.one.one.one)"
"19","11:51:56.223093","2606:4700:4700::1111","2a02:ab88:b:4100:6163:ab1b:4f48:fc2c","TCP","86","443  >  57753 [ACK] Seq=4039 Ack=401 Win=16 Len=0 TSval=4054935755 TSecr=4117672488"
"20","11:51:56.223095","2606:4700:4700::1111","2a02:ab88:b:4100:6163:ab1b:4f48:fc2c","TLSv1.3","655","Application Data, Application Data"
"21","11:51:56.223097","2606:4700:4700::1111","2a02:ab88:b:4100:6163:ab1b:4f48:fc2c","TLSv1.3","248","Application Data"
"22","11:51:56.223098","2606:4700:4700::1111","2a02:ab88:b:4100:6163:ab1b:4f48:fc2c","TLSv1.3","585","Application Data"
"23","11:51:56.223540","2a02:ab88:b:4100:6163:ab1b:4f48:fc2c","2606:4700:4700::1111","TCP","86","57753  >  443 [ACK] Seq=401 Ack=5269 Win=2029 Len=0 TSval=4117672507 TSecr=4054935756"
"24","11:51:56.223767","2a02:ab88:b:4100:6163:ab1b:4f48:fc2c","2606:4700:4700::1111","TLSv1.3","117","Application Data"
"25","11:51:56.228323","192.168.0.192","230.0.0.1","UDP","92","62979  >  6666 Len=50"
"26","11:51:56.230698","2606:4700:4700::1111","2a02:ab88:b:4100:6163:ab1b:4f48:fc2c","TCP","86","443  >  57754 [ACK] Seq=1 Ack=1530 Win=131072 Len=0 TSval=2121428720 TSecr=3732011805"
"27","11:51:56.230700","2606:4700:4700::1111","2a02:ab88:b:4100:6163:ab1b:4f48:fc2c","TCP","86","853  >  57755 [ACK] Seq=1 Ack=1349 Win=131072 Len=0 TSval=3558857067 TSecr=3732059063"
"28","11:51:56.230701","2606:4700:4700::1111","2a02:ab88:b:4100:6163:ab1b:4f48:fc2c","TLSv1.3","1434","Server Hello, Change Cipher Spec"
"29","11:51:56.230706","2606:4700:4700::1111","2a02:ab88:b:4100:6163:ab1b:4f48:fc2c","TCP","1434","443  >  57754 [ACK] Seq=1349 Ack=1530 Win=131072 Len=1348 TSval=2121428721 TSecr=3732011805 [TCP PDU reassembled in 31]"
"30","11:51:56.231721","2a02:ab88:b:4100:6163:ab1b:4f48:fc2c","2606:4700:4700::1111","TCP","86","57754  >  443 [ACK] Seq=1530 Ack=2697 Win=129472 Len=0 TSval=3732011830 TSecr=2121428721"
"31","11:51:56.231810","2606:4700:4700::1111","2a02:ab88:b:4100:6163:ab1b:4f48:fc2c","TLSv1.3","1428","Application Data"
"32","11:51:56.232065","2a02:ab88:b:4100:6163:ab1b:4f48:fc2c","2606:4700:4700::1111","TCP","86","57754  >  443 [ACK] Seq=1530 Ack=4039 Win=129792 Len=0 TSval=3732011831 TSecr=2121428721"
"33","11:51:56.234961","2606:4700:4700::1111","2a02:ab88:b:4100:6163:ab1b:4f48:fc2c","TCP","86","853  >  57755 [ACK] Seq=1 Ack=1531 Win=131072 Len=0 TSval=3558857070 TSecr=3732059063"
"34","11:51:56.235764","2606:4700:4700::1111","2a02:ab88:b:4100:6163:ab1b:4f48:fc2c","TLSv1.3","1434","Server Hello, Change Cipher Spec"
"35","11:51:56.236143","2a02:ab88:b:4100:6163:ab1b:4f48:fc2c","2606:4700:4700::1111","TCP","86","57755  >  853 [ACK] Seq=1531 Ack=1349 Win=130816 Len=0 TSval=3732059088 TSecr=3558857070"
"36","11:51:56.237679","2606:4700:4700::1111","2a02:ab88:b:4100:6163:ab1b:4f48:fc2c","TCP","1434","853  >  57755 [ACK] Seq=1349 Ack=1531 Win=131072 Len=1348 TSval=3558857070 TSecr=3732059063 [TCP PDU reassembled in 38]"
"37","11:51:56.237681","2606:4700:4700::1111","2a02:ab88:b:4100:6163:ab1b:4f48:fc2c","TCP","1434","853  >  57755 [ACK] Seq=2697 Ack=1531 Win=131072 Len=1348 TSval=3558857070 TSecr=3732059063 [TCP PDU reassembled in 38]"
"38","11:51:56.237682","2606:4700:4700::1111","2a02:ab88:b:4100:6163:ab1b:4f48:fc2c","TLSv1.3","413","Application Data"
"39","11:51:56.238016","2a02:ab88:b:4100:6163:ab1b:4f48:fc2c","2606:4700:4700::1111","TCP","86","57755  >  853 [ACK] Seq=1531 Ack=4372 Win=128064 Len=0 TSval=3732059090 TSecr=3558857070"
"40","11:51:56.238018","2a02:ab88:b:4100:6163:ab1b:4f48:fc2c","2606:4700:4700::1111","TCP","86","[TCP Window Update] 57755  >  853 [ACK] Seq=1531 Ack=4372 Win=131072 Len=0 TSval=3732059090 TSecr=3558857070"
"41","11:51:56.239435","2a02:ab88:b:4100:6163:ab1b:4f48:fc2c","2606:4700:4700::1111","TLSv1.3","166","Change Cipher Spec, Application Data"
"42","11:51:56.240365","2a02:ab88:b:4100:6163:ab1b:4f48:fc2c","2606:4700:4700::1111","TLSv1.3","110","Application Data"
"43","11:51:56.244614","2a02:ab88:b:4100:6163:ab1b:4f48:fc2c","2606:4700:4700::1111","TLSv1.3","166","Change Cipher Spec, Application Data"
"44","11:51:56.246076","2a02:ab88:b:4100:6163:ab1b:4f48:fc2c","2606:4700:4700::1111","TLSv1.3","110","Application Data"
"45","11:51:56.260283","2606:4700:4700::1111","2a02:ab88:b:4100:6163:ab1b:4f48:fc2c","TCP","86","443  >  57754 [ACK] Seq=4039 Ack=1635 Win=131072 Len=0 TSval=2121428751 TSecr=3732011838"
"46","11:51:56.260286","2606:4700:4700::1111","2a02:ab88:b:4100:6163:ab1b:4f48:fc2c","TCP","86","443  >  57754 [FIN, ACK] Seq=4039 Ack=1635 Win=131072 Len=0 TSval=2121428752 TSecr=3732011838"
"47","11:51:56.260469","2a02:ab88:b:4100:6163:ab1b:4f48:fc2c","2606:4700:4700::1111","TCP","86","57754  >  443 [ACK] Seq=1635 Ack=4040 Win=131072 Len=0 TSval=3732011859 TSecr=2121428752"
"48","11:51:56.263415","2606:4700:4700::1111","2a02:ab88:b:4100:6163:ab1b:4f48:fc2c","TCP","86","853  >  57755 [ACK] Seq=4372 Ack=1636 Win=131072 Len=0 TSval=3558857102 TSecr=3732059096"
"49","11:51:56.263417","2606:4700:4700::1111","2a02:ab88:b:4100:6163:ab1b:4f48:fc2c","TCP","86","853  >  57755 [FIN, ACK] Seq=4372 Ack=1636 Win=131072 Len=0 TSval=3558857102 TSecr=3732059096"
"50","11:51:56.263538","2a02:ab88:b:4100:6163:ab1b:4f48:fc2c","2606:4700:4700::1111","TCP","86","57755  >  853 [ACK] Seq=1636 Ack=4373 Win=131072 Len=0 TSval=3732059115 TSecr=3558857102"
"51","11:51:56.274927","2606:4700:4700::1111","2a02:ab88:b:4100:6163:ab1b:4f48:fc2c","TCP","86","443  >  57753 [ACK] Seq=5269 Ack=432 Win=16 Len=0 TSval=4054935814 TSecr=4117672508"
"52","11:51:56.579440","192.168.0.74","5.28.195.2","TCP","78","63716  >  5222 [SYN] Seq=0 Win=65535 Len=0 MSS=1460 WS=16 TSval=2926742452 TSecr=0 SACK_PERM"
"53","11:51:56.579491","192.168.0.74","5.28.195.2","TCP","78","63715  >  80 [SYN] Seq=0 Win=65535 Len=0 MSS=1460 WS=16 TSval=1088331676 TSecr=0 SACK_PERM"
"54","11:51:56.682126","fe80::1817:fddd:60ce:b28f","fe80::49c:fb07:3c9a:aa62","TCP","210","64548  >  58855 [PSH, ACK] Seq=1 Ack=1 Win=2048 Len=124 TSval=3884573914 TSecr=408719270"
"55","11:51:56.682487","fe80::49c:fb07:3c9a:aa62","fe80::1817:fddd:60ce:b28f","TCP","86","58855  >  64548 [ACK] Seq=1 Ack=125 Win=2048 Len=0 TSval=408752520 TSecr=3884573914"
"56","11:51:56.683306","fe80::49c:fb07:3c9a:aa62","fe80::1817:fddd:60ce:b28f","TCP","142","58855  >  64548 [PSH, ACK] Seq=1 Ack=125 Win=2048 Len=56 TSval=408752521 TSecr=3884573914"
"57","11:51:56.688302","fe80::1817:fddd:60ce:b28f","fe80::49c:fb07:3c9a:aa62","TCP","86","64548  >  58855 [ACK] Seq=125 Ack=57 Win=2048 Len=0 TSval=3884573921 TSecr=408752521"
"58","11:51:56.689581","fe80::1817:fddd:60ce:b28f","fe80::49c:fb07:3c9a:aa62","TCP","565","64548  >  58855 [PSH, ACK] Seq=125 Ack=57 Win=2048 Len=479 TSval=3884573922 TSecr=408752521"
"59","11:51:56.689744","fe80::49c:fb07:3c9a:aa62","fe80::1817:fddd:60ce:b28f","TCP","86","58855  >  64548 [ACK] Seq=57 Ack=604 Win=2048 Len=0 TSval=408752528 TSecr=3884573922"
"60","11:51:56.692269","fe80::49c:fb07:3c9a:aa62","fe80::1817:fddd:60ce:b28f","TCP","489","58855  >  64548 [PSH, ACK] Seq=57 Ack=604 Win=2048 Len=403 TSval=408752530 TSecr=3884573922"
"61","11:51:56.696309","192.168.0.74","224.0.0.251","MDNS","188","Standard query response 0x0000 AAAA, cache flush fe80::49c:fb07:3c9a:aa62 A, cache flush 192.168.0.74 AAAA, cache flush 2a02:ab88:b:4100:8a2:2611:1782:be29 NSEC, cache flush 65b7ed82-f4d7-49c7-99e3-8826d6de022d.local"
"62","11:51:56.696372","fe80::49c:fb07:3c9a:aa62","ff02::fb","MDNS","208","Standard query response 0x0000 AAAA, cache flush fe80::49c:fb07:3c9a:aa62 A, cache flush 192.168.0.74 AAAA, cache flush 2a02:ab88:b:4100:8a2:2611:1782:be29 NSEC, cache flush 65b7ed82-f4d7-49c7-99e3-8826d6de022d.local"
"63","11:51:56.697308","fe80::1817:fddd:60ce:b28f","fe80::49c:fb07:3c9a:aa62","TCP","86","64548  >  58855 [ACK] Seq=604 Ack=460 Win=2042 Len=0 TSval=3884573929 TSecr=408752530"
"64","11:51:56.701286","fe80::1817:fddd:60ce:b28f","fe80::49c:fb07:3c9a:aa62","TCP","166","64548  >  58855 [PSH, ACK] Seq=604 Ack=460 Win=2048 Len=80 TSval=3884573934 TSecr=408752530"
"65","11:51:56.701405","fe80::49c:fb07:3c9a:aa62","fe80::1817:fddd:60ce:b28f","TCP","86","58855  >  64548 [ACK] Seq=460 Ack=684 Win=2047 Len=0 TSval=408752539 TSecr=3884573934"
"66","11:51:56.702575","fe80::49c:fb07:3c9a:aa62","fe80::1817:fddd:60ce:b28f","TCP","132","58855  >  64548 [PSH, ACK] Seq=460 Ack=684 Win=2048 Len=46 TSval=408752540 TSecr=3884573934"
"67","11:51:56.707280","fe80::1817:fddd:60ce:b28f","fe80::49c:fb07:3c9a:aa62","TCP","86","64548  >  58855 [ACK] Seq=684 Ack=506 Win=2048 Len=0 TSval=3884573940 TSecr=408752540"
"68","11:51:56.734295","fe80::1817:fddd:60ce:b28f","fe80::49c:fb07:3c9a:aa62","QUIC","1262","Initial, DCID=671c96d6030c8ca2, SCID=6ba1ec78, PKN: 0, CRYPTO, PADDING"
"69","11:51:56.734297","fe80::1817:fddd:60ce:b28f","fe80::49c:fb07:3c9a:aa62","QUIC","1262","Initial, DCID=671c96d6030c8ca2, SCID=6ba1ec78, PKN: 1, CRYPTO, PADDING"
"70","11:51:56.747575","fe80::49c:fb07:3c9a:aa62","fe80::1817:fddd:60ce:b28f","QUIC","1262","Initial, DCID=6ba1ec78, SCID=3d707e36, PKN: 0, CRYPTO, ACK_ECN, PADDING"
"71","11:51:56.747655","fe80::49c:fb07:3c9a:aa62","fe80::1817:fddd:60ce:b28f","QUIC","1262","Initial, DCID=6ba1ec78, SCID=3d707e36, PKN: 1, CRYPTO, PADDING"
"72","11:51:56.747681","fe80::49c:fb07:3c9a:aa62","fe80::1817:fddd:60ce:b28f","QUIC","1224","Handshake, DCID=6ba1ec78, SCID=3d707e36"
"73","11:51:56.853101","192.168.0.74","224.0.0.251","MDNS","172","Standard query 0x0000 ANY AFD641B9-2F6D-4575-8F75-66BF3602B67B._asquic._udp.local, ""QU"" question SRV 0 0 55616 65b7ed82-f4d7-49c7-99e3-8826d6de022d.local"
"74","11:51:56.853135","fe80::49c:fb07:3c9a:aa62","ff02::fb","MDNS","192","Standard query 0x0000 ANY AFD641B9-2F6D-4575-8F75-66BF3602B67B._asquic._udp.local, ""QU"" question SRV 0 0 55616 65b7ed82-f4d7-49c7-99e3-8826d6de022d.local"
"75","11:51:56.946123","192.168.0.192","230.0.0.1","UDP","92","58107  >  6666 Len=50"
"76","11:51:56.962489","fe80::49c:fb07:3c9a:aa62","fe80::1817:fddd:60ce:b28f","QUIC","1100","Initial, DCID=6ba1ec78, SCID=3d707e36, PKN: 2, CRYPTO"
"77","11:51:56.962543","fe80::49c:fb07:3c9a:aa62","fe80::1817:fddd:60ce:b28f","QUIC","1262","Initial, DCID=6ba1ec78, SCID=3d707e36, PKN: 3, CRYPTO, PADDING"
"78","11:51:57.049253","fe80::1817:fddd:60ce:b28f","fe80::49c:fb07:3c9a:aa62","QUIC","1262","Initial, DCID=3d707e36, SCID=6ba1ec78, PKN: 2, ACK_ECN, PADDING"
"79","11:51:57.049255","fe80::1817:fddd:60ce:b28f","fe80::49c:fb07:3c9a:aa62","QUIC","104","Handshake, DCID=3d707e36, SCID=6ba1ec78"
"80","11:51:57.049256","fe80::1817:fddd:60ce:b28f","fe80::49c:fb07:3c9a:aa62","QUIC","1066","Handshake, DCID=3d707e36, SCID=6ba1ec78"
"81","11:51:57.049257","fe80::1817:fddd:60ce:b28f","fe80::49c:fb07:3c9a:aa62","QUIC","1510","Protected Payload (KP0), DCID=3d707e36"
"82","11:51:57.049259","fe80::1817:fddd:60ce:b28f","fe80::49c:fb07:3c9a:aa62","QUIC","276","Protected Payload (KP0), DCID=3d707e36"
"83","11:51:57.049260","fe80::1817:fddd:60ce:b28f","fe80::49c:fb07:3c9a:aa62","QUIC","1066","Handshake, DCID=3d707e36, SCID=6ba1ec78"
"84","11:51:57.049261","fe80::1817:fddd:60ce:b28f","fe80::49c:fb07:3c9a:aa62","QUIC","276","Protected Payload (KP0), DCID=3d707e36"
"85","11:51:57.049703","fe80::49c:fb07:3c9a:aa62","fe80::1817:fddd:60ce:b28f","QUIC","104","Handshake, DCID=6ba1ec78, SCID=3d707e36"
"86","11:51:57.053367","fe80::49c:fb07:3c9a:aa62","fe80::1817:fddd:60ce:b28f","QUIC","93","Protected Payload (KP0), DCID=6ba1ec78"
"87","11:51:57.053730","fe80::49c:fb07:3c9a:aa62","fe80::1817:fddd:60ce:b28f","QUIC","276","Protected Payload (KP0), DCID=6ba1ec78"
"88","11:51:57.054264","fe80::49c:fb07:3c9a:aa62","fe80::1817:fddd:60ce:b28f","QUIC","91","Protected Payload (KP0), DCID=6ba1ec78"
"89","11:51:57.054405","fe80::1817:fddd:60ce:b28f","fe80::49c:fb07:3c9a:aa62","QUIC","1511","Protected Payload (KP0), DCID=3d707e36"
"90","11:51:57.054407","fe80::1817:fddd:60ce:b28f","fe80::49c:fb07:3c9a:aa62","QUIC","1511","Protected Payload (KP0), DCID=3d707e36"
"91","11:51:57.054408","fe80::1817:fddd:60ce:b28f","fe80::49c:fb07:3c9a:aa62","QUIC","201","Protected Payload (KP0), DCID=3d707e36"
"92","11:51:57.054901","fe80::49c:fb07:3c9a:aa62","fe80::1817:fddd:60ce:b28f","QUIC","92","Protected Payload (KP0), DCID=6ba1ec78"
"93","11:51:57.059892","fe80::1817:fddd:60ce:b28f","fe80::49c:fb07:3c9a:aa62","QUIC","92","Protected Payload (KP0), DCID=3d707e36"
"94","11:51:57.064168","fe80::49c:fb07:3c9a:aa62","fe80::1817:fddd:60ce:b28f","QUIC","160","Protected Payload (KP0), DCID=6ba1ec78"
"95","11:51:57.064238","fe80::49c:fb07:3c9a:aa62","fe80::1817:fddd:60ce:b28f","QUIC","304","Protected Payload (KP0), DCID=6ba1ec78"
"96","11:51:57.068987","fe80::1817:fddd:60ce:b28f","fe80::49c:fb07:3c9a:aa62","QUIC","92","Protected Payload (KP0), DCID=3d707e36"
"97","11:51:57.088940","fe80::49c:fb07:3c9a:aa62","fe80::1817:fddd:60ce:b28f","QUIC","162","Protected Payload (KP0), DCID=6ba1ec78"
"98","11:51:57.089244","fe80::49c:fb07:3c9a:aa62","fe80::1817:fddd:60ce:b28f","QUIC","1511","Protected Payload (KP0), DCID=6ba1ec78"
"99","11:51:57.089246","fe80::49c:fb07:3c9a:aa62","fe80::1817:fddd:60ce:b28f","QUIC","1511","Protected Payload (KP0), DCID=6ba1ec78"
"100","11:51:57.089248","fe80::49c:fb07:3c9a:aa62","fe80::1817:fddd:60ce:b28f","QUIC","1010","Protected Payload (KP0), DCID=6ba1ec78"
"101","11:51:57.097791","fe80::1817:fddd:60ce:b28f","fe80::49c:fb07:3c9a:aa62","QUIC","92","Protected Payload (KP0), DCID=3d707e36"
"102","11:51:57.097794","fe80::1817:fddd:60ce:b28f","fe80::49c:fb07:3c9a:aa62","QUIC","92","Protected Payload (KP0), DCID=3d707e36"
"103","11:51:57.104083","192.168.0.74","224.0.0.251","MDNS","172","Standard query 0x0000 ANY AFD641B9-2F6D-4575-8F75-66BF3602B67B._asquic._udp.local, ""QM"" question SRV 0 0 55616 65b7ed82-f4d7-49c7-99e3-8826d6de022d.local"
"104","11:51:57.104136","fe80::49c:fb07:3c9a:aa62","ff02::fb","MDNS","192","Standard query 0x0000 ANY AFD641B9-2F6D-4575-8F75-66BF3602B67B._asquic._udp.local, ""QM"" question SRV 0 0 55616 65b7ed82-f4d7-49c7-99e3-8826d6de022d.local"
"105","11:51:57.112007","fe80::1817:fddd:60ce:b28f","fe80::49c:fb07:3c9a:aa62","QUIC","162","Protected Payload (KP0), DCID=3d707e36"
"106","11:51:57.112009","fe80::1817:fddd:60ce:b28f","fe80::49c:fb07:3c9a:aa62","QUIC","304","Protected Payload (KP0), DCID=3d707e36"
"107","11:51:57.112368","fe80::49c:fb07:3c9a:aa62","fe80::1817:fddd:60ce:b28f","QUIC","92","Protected Payload (KP0), DCID=6ba1ec78"
"108","11:51:57.132009","fe80::1817:fddd:60ce:b28f","fe80::49c:fb07:3c9a:aa62","QUIC","162","Protected Payload (KP0), DCID=3d707e36"
"109","11:51:57.132011","fe80::1817:fddd:60ce:b28f","fe80::49c:fb07:3c9a:aa62","QUIC","410","Protected Payload (KP0), DCID=3d707e36"
"110","11:51:57.132248","fe80::49c:fb07:3c9a:aa62","fe80::1817:fddd:60ce:b28f","QUIC","92","Protected Payload (KP0), DCID=6ba1ec78"
"111","11:51:57.140169","fe80::49c:fb07:3c9a:aa62","fe80::1817:fddd:60ce:b28f","QUIC","162","Protected Payload (KP0), DCID=6ba1ec78"
"112","11:51:57.140238","fe80::49c:fb07:3c9a:aa62","fe80::1817:fddd:60ce:b28f","QUIC","304","Protected Payload (KP0), DCID=6ba1ec78"
"113","11:51:57.151009","192.168.0.192","230.0.0.1","UDP","92","62979  >  6666 Len=50"
"114","11:51:57.161529","2a02:ab88:b:4100:6163:ab1b:4f48:fc2c","2606:4700:4700::1111","TLSv1.3","271","Application Data"
"115","11:51:57.171091","fe80::1817:fddd:60ce:b28f","fe80::49c:fb07:3c9a:aa62","QUIC","92","Protected Payload (KP0), DCID=3d707e36"
"116","11:51:57.172907","2606:4700:4700::1111","2a02:ab88:b:4100:6163:ab1b:4f48:fc2c","TCP","86","443  >  57753 [ACK] Seq=5269 Ack=617 Win=16 Len=0 TSval=4054936712 TSecr=4117673445"
"117","11:51:57.175346","2606:4700:4700::1111","2a02:ab88:b:4100:6163:ab1b:4f48:fc2c","TLSv1.3","166","Application Data"
"118","11:51:57.175348","2606:4700:4700::1111","2a02:ab88:b:4100:6163:ab1b:4f48:fc2c","TLSv1.3","585","Application Data"
"119","11:51:57.175557","2a02:ab88:b:4100:6163:ab1b:4f48:fc2c","2606:4700:4700::1111","TCP","86","57753  >  443 [ACK] Seq=617 Ack=5848 Win=2039 Len=0 TSval=4117673459 TSecr=4054936714"
"120","11:51:57.355582","192.168.0.74","224.0.0.251","MDNS","172","Standard query 0x0000 ANY AFD641B9-2F6D-4575-8F75-66BF3602B67B._asquic._udp.local, ""QM"" question SRV 0 0 55616 65b7ed82-f4d7-49c7-99e3-8826d6de022d.local"
"121","11:51:57.355803","fe80::49c:fb07:3c9a:aa62","ff02::fb","MDNS","192","Standard query 0x0000 ANY AFD641B9-2F6D-4575-8F75-66BF3602B67B._asquic._udp.local, ""QM"" question SRV 0 0 55616 65b7ed82-f4d7-49c7-99e3-8826d6de022d.local"
"122","11:51:57.567258","192.168.0.74","31.192.108.181","TLSv1.2","414","Application Data"
"123","11:51:57.580050","192.168.0.74","5.28.195.2","TCP","78","[TCP Retransmission] 63716  >  5222 [SYN] Seq=0 Win=65535 Len=0 MSS=1460 WS=16 TSval=2926743453 TSecr=0 SACK_PERM"
"124","11:51:57.580091","192.168.0.74","5.28.195.2","TCP","78","[TCP Retransmission] 63715  >  80 [SYN] Seq=0 Win=65535 Len=0 MSS=1460 WS=16 TSval=1088332677 TSecr=0 SACK_PERM"
"125","11:51:57.607073","192.168.0.74","224.0.0.251","MDNS","246","Standard query response 0x0000 TXT, cache flush PTR _asquic._udp.local PTR AFD641B9-2F6D-4575-8F75-66BF3602B67B._asquic._udp.local SRV, cache flush 0 0 55616 65b7ed82-f4d7-49c7-99e3-8826d6de022d.local NSEC, cache flush AFD641B9-2F6D-4575-8F75-66BF3602B67B._asquic._udp.local"
"126","11:51:57.607126","fe80::49c:fb07:3c9a:aa62","ff02::fb","MDNS","266","Standard query response 0x0000 TXT, cache flush PTR _asquic._udp.local PTR AFD641B9-2F6D-4575-8F75-66BF3602B67B._asquic._udp.local SRV, cache flush 0 0 55616 65b7ed82-f4d7-49c7-99e3-8826d6de022d.local NSEC, cache flush AFD641B9-2F6D-4575-8F75-66BF3602B67B._asquic._udp.local"
"127","11:51:57.689278","31.192.108.181","192.168.0.74","TCP","66","443  >  60169 [ACK] Seq=1 Ack=349 Win=51 Len=0 TSval=2536171240 TSecr=1828799508"
"128","11:51:57.708343","192.168.0.74","224.0.0.251","MDNS","188","Standard query response 0x0000 AAAA, cache flush fe80::49c:fb07:3c9a:aa62 A, cache flush 192.168.0.74 AAAA, cache flush 2a02:ab88:b:4100:8a2:2611:1782:be29 NSEC, cache flush 65b7ed82-f4d7-49c7-99e3-8826d6de022d.local"
"129","11:51:57.708673","fe80::49c:fb07:3c9a:aa62","ff02::fb","MDNS","208","Standard query response 0x0000 AAAA, cache flush fe80::49c:fb07:3c9a:aa62 A, cache flush 192.168.0.74 AAAA, cache flush 2a02:ab88:b:4100:8a2:2611:1782:be29 NSEC, cache flush 65b7ed82-f4d7-49c7-99e3-8826d6de022d.local"
"130","11:51:57.951055","31.192.108.181","192.168.0.74","TLSv1.2","389","Application Data"
"131","11:51:57.951440","192.168.0.74","31.192.108.181","TCP","66","60169  >  443 [ACK] Seq=349 Ack=324 Win=2043 Len=0 TSval=1828799892 TSecr=2536171502"
"132","11:51:57.956331","192.168.0.74","31.192.108.181","TLSv1.2","252","Application Data"
"133","11:51:57.969237","192.168.0.192","230.0.0.1","UDP","92","58107  >  6666 Len=50"
"134","11:51:57.976959","31.192.108.181","192.168.0.74","TLSv1.2","331","Application Data"
"135","11:51:57.977195","192.168.0.74","31.192.108.181","TCP","66","60169  >  443 [ACK] Seq=535 Ack=589 Win=2044 Len=0 TSval=1828799918 TSecr=2536171529"
"136","11:51:57.978678","192.168.0.74","31.192.108.181","TLSv1.2","252","Application Data"
"137","11:51:57.999609","31.192.108.181","192.168.0.74","TCP","66","443  >  60169 [ACK] Seq=589 Ack=535 Win=51 Len=0 TSval=2536171553 TSecr=1828799897"
"138","11:51:58.004321","31.192.108.181","192.168.0.74","TLSv1.2","295","Application Data"
"139","11:51:58.004557","192.168.0.74","31.192.108.181","TCP","66","60169  >  443 [ACK] Seq=721 Ack=818 Win=2045 Len=0 TSval=1828799945 TSecr=2536171557"
"140","11:51:58.038566","31.192.108.181","192.168.0.74","TLSv1.2","238","Application Data"
"141","11:51:58.038764","192.168.0.74","31.192.108.181","TCP","66","60169  >  443 [ACK] Seq=721 Ack=990 Win=2046 Len=0 TSval=1828799980 TSecr=2536171589"
"142","11:51:58.040466","192.168.0.74","20.50.201.206","TCP","78","63721  >  443 [SYN, ECE, CWR] Seq=0 Win=65535 Len=0 MSS=1460 WS=64 TSval=2179501496 TSecr=0 SACK_PERM"
"143","11:51:58.164731","20.50.201.206","192.168.0.74","TCP","74","443  >  63721 [SYN, ACK, ECE] Seq=0 Ack=1 Win=65535 Len=0 MSS=1420 WS=256 SACK_PERM TSval=13179322 TSecr=2179501496"
"144","11:51:58.164855","192.168.0.74","20.50.201.206","TCP","66","63721  >  443 [ACK] Seq=1 Ack=1 Win=132352 Len=0 TSval=2179501621 TSecr=13179322"
"145","11:51:58.165338","192.168.0.74","20.50.201.206","TCP","1474","63721  >  443 [ACK] Seq=1 Ack=1 Win=132352 Len=1408 TSval=2179501621 TSecr=13179322 [TCP PDU reassembled in 146]"
"146","11:51:58.165347","192.168.0.74","20.50.201.206","TLSv1.3","466","Client Hello (SNI=eu-teams.events.data.microsoft.com)"
"147","11:51:58.173913","192.168.0.192","230.0.0.1","UDP","92","62979  >  6666 Len=50"
"148","11:51:58.211377","20.50.201.206","192.168.0.74","TCP","66","443  >  63721 [ACK] Seq=1 Ack=1809 Win=4194304 Len=0 TSval=13179450 TSecr=2179501621"
"149","11:51:58.211379","20.50.201.206","192.168.0.74","TLSv1.3","165","Hello Retry Request, Change Cipher Spec"
"150","11:51:58.211504","192.168.0.74","20.50.201.206","TCP","66","63721  >  443 [ACK] Seq=1809 Ack=100 Win=132288 Len=0 TSval=2179501667 TSecr=13179450"
"151","11:51:58.212633","192.168.0.74","20.50.201.206","TLSv1.3","720","Change Cipher Spec, Client Hello (SNI=eu-teams.events.data.microsoft.com)"
"152","11:51:58.267055","20.50.201.206","192.168.0.74","TLSv1.3","1474","Server Hello"
"153","11:51:58.267058","20.50.201.206","192.168.0.74","TCP","1474","443  >  63721 [ACK] Seq=1508 Ack=2463 Win=4193536 Len=1408 TSval=13179507 TSecr=2179501669 [TCP PDU reassembled in 156]"
"154","11:51:58.267061","20.50.201.206","192.168.0.74","TCP","1474","443  >  63721 [ACK] Seq=2916 Ack=2463 Win=4193536 Len=1408 TSval=13179507 TSecr=2179501669 [TCP PDU reassembled in 156]"
"155","11:51:58.267063","20.50.201.206","192.168.0.74","TCP","1474","443  >  63721 [ACK] Seq=4324 Ack=2463 Win=4193536 Len=1408 TSval=13179507 TSecr=2179501669 [TCP PDU reassembled in 156]"
"156","11:51:58.267065","20.50.201.206","192.168.0.74","TLSv1.3","802","Application Data"
"157","11:51:58.267222","192.168.0.74","20.50.201.206","TCP","66","63721  >  443 [ACK] Seq=2463 Ack=1508 Win=130880 Len=0 TSval=2179501723 TSecr=13179507"
"158","11:51:58.267264","192.168.0.74","20.50.201.206","TCP","66","63721  >  443 [ACK] Seq=2463 Ack=6468 Win=125952 Len=0 TSval=2179501723 TSecr=13179507"
"159","11:51:58.267309","192.168.0.74","20.50.201.206","TCP","66","[TCP Window Update] 63721  >  443 [ACK] Seq=2463 Ack=6468 Win=131072 Len=0 TSval=2179501723 TSecr=13179507"
"160","11:51:58.286949","192.168.0.74","20.50.201.206","TLSv1.3","140","Application Data"
"161","11:51:58.287075","192.168.0.74","20.50.201.206","TLSv1.3","158","Application Data"
"162","11:51:58.287237","192.168.0.74","20.50.201.206","TLSv1.3","727","Application Data"
"163","11:51:58.287261","192.168.0.74","20.50.201.206","TCP","1474","63721  >  443 [ACK] Seq=3290 Ack=6468 Win=131072 Len=1408 TSval=2179501743 TSecr=13179507 [TCP PDU reassembled in 166]"
"164","11:51:58.287261","192.168.0.74","20.50.201.206","TCP","1474","63721  >  443 [ACK] Seq=4698 Ack=6468 Win=131072 Len=1408 TSval=2179501743 TSecr=13179507 [TCP PDU reassembled in 166]"
"165","11:51:58.287262","192.168.0.74","20.50.201.206","TCP","1474","63721  >  443 [ACK] Seq=6106 Ack=6468 Win=131072 Len=1408 TSval=2179501743 TSecr=13179507 [TCP PDU reassembled in 166]"
"166","11:51:58.287264","192.168.0.74","20.50.201.206","TLSv1.3","259","Application Data"
"167","11:51:58.392595","20.50.201.206","192.168.0.74","TLSv1.3","169","Application Data"
"168","11:51:58.392597","20.50.201.206","192.168.0.74","TLSv1.3","128","Application Data"
"169","11:51:58.392745","192.168.0.74","20.50.201.206","TCP","66","63721  >  443 [ACK] Seq=7707 Ack=6633 Win=130944 Len=0 TSval=2179501849 TSecr=13179636"
"170","11:51:58.392984","192.168.0.74","20.50.201.206","TLSv1.3","97","Application Data"
"171","11:51:58.396287","20.50.201.206","192.168.0.74","TCP","66","443  >  63721 [ACK] Seq=6468 Ack=6106 Win=4194304 Len=0 TSval=13179635 TSecr=2179501743"
"172","11:51:58.396289","20.50.201.206","192.168.0.74","TCP","66","443  >  63721 [ACK] Seq=6468 Ack=7707 Win=4194304 Len=0 TSval=13179636 TSecr=2179501743"
"173","11:51:58.396406","192.168.0.74","20.50.201.206","TCP","66","[TCP Dup ACK 169#1] 63721  >  443 [ACK] Seq=7738 Ack=6633 Win=131072 Len=0 TSval=2179501852 TSecr=13179636"
"174","11:51:58.428556","20.50.201.206","192.168.0.74","TLSv1.3","396","Application Data, Application Data"
"175","11:51:58.428719","192.168.0.74","20.50.201.206","TCP","66","63721  >  443 [ACK] Seq=7738 Ack=6963 Win=130752 Len=0 TSval=2179501885 TSecr=13179672"
"176","11:51:58.552956","192.168.0.74","64.65.63.120","TLSv1.2","602","Application Data"
"177","11:51:58.594668","64.65.63.120","192.168.0.74","TCP","66","443  >  59487 [ACK] Seq=1 Ack=537 Win=3663 Len=0 TSval=2681219784 TSecr=3163927108"
"178","11:51:58.608148","192.168.0.74","224.0.0.251","MDNS","246","Standard query response 0x0000 TXT, cache flush PTR _asquic._udp.local PTR AFD641B9-2F6D-4575-8F75-66BF3602B67B._asquic._udp.local SRV, cache flush 0 0 55616 65b7ed82-f4d7-49c7-99e3-8826d6de022d.local NSEC, cache flush AFD641B9-2F6D-4575-8F75-66BF3602B67B._asquic._udp.local"
"179","11:51:58.608297","fe80::49c:fb07:3c9a:aa62","ff02::fb","MDNS","266","Standard query response 0x0000 TXT, cache flush PTR _asquic._udp.local PTR AFD641B9-2F6D-4575-8F75-66BF3602B67B._asquic._udp.local SRV, cache flush 0 0 55616 65b7ed82-f4d7-49c7-99e3-8826d6de022d.local NSEC, cache flush AFD641B9-2F6D-4575-8F75-66BF3602B67B._asquic._udp.local"
"180","11:51:58.762711","64.65.63.120","192.168.0.74","TLSv1.2","602","Application Data"
"181","11:51:58.762863","192.168.0.74","64.65.63.120","TCP","66","59487  >  443 [ACK] Seq=537 Ack=537 Win=9190 Len=0 TSval=3163927318 TSecr=2681219948"
"182","11:51:58.764773","192.168.0.74","64.65.63.120","TCP","1474","59487  >  443 [ACK] Seq=537 Ack=537 Win=9198 Len=1408 TSval=3163927320 TSecr=2681219948 [TCP PDU reassembled in 183]"
"183","11:51:58.764804","192.168.0.74","64.65.63.120","TLSv1.2","736","Application Data"
"184","11:51:58.871744","192.168.0.74","64.65.63.120","TCP","1474","[TCP Retransmission] 59487  >  443 [PSH, ACK] Seq=1207 Ack=537 Win=9198 Len=1408 TSval=3163927427 TSecr=2681219948 [TCP PDU reassembled in 183]"
"185","11:51:58.881684","64.65.63.120","192.168.0.74","TCP","66","443  >  59487 [ACK] Seq=537 Ack=1945 Win=3686 Len=0 TSval=2681219997 TSecr=3163927320"
"186","11:51:58.881689","64.65.63.120","192.168.0.74","TCP","66","443  >  59487 [ACK] Seq=537 Ack=2615 Win=3693 Len=0 TSval=2681219997 TSecr=3163927320"
"187","11:51:58.917347","64.65.63.120","192.168.0.74","TCP","78","[TCP Dup ACK 186#1] 443  >  59487 [ACK] Seq=537 Ack=2615 Win=3693 Len=0 TSval=2681220108 TSecr=3163927427 SLE=1207 SRE=2615"
"188","11:51:58.978967","64.65.63.120","192.168.0.74","TCP","1474","443  >  59487 [ACK] Seq=537 Ack=2615 Win=3693 Len=1408 TSval=2681220167 TSecr=3163927427 [TCP PDU reassembled in 190]"
"189","11:51:58.978971","64.65.63.120","192.168.0.74","TCP","1474","443  >  59487 [PSH, ACK] Seq=1945 Ack=2615 Win=3693 Len=1408 TSval=2681220167 TSecr=3163927427 [TCP PDU reassembled in 190]"
"190","11:51:58.978974","64.65.63.120","192.168.0.74","TLSv1.2","870","Application Data"
"191","11:51:58.979182","192.168.0.74","64.65.63.120","TCP","66","59487  >  443 [ACK] Seq=2615 Ack=1945 Win=9176 Len=0 TSval=3163927534 TSecr=2681220167"
"192","11:51:58.979265","192.168.0.74","64.65.63.120","TCP","66","59487  >  443 [ACK] Seq=2615 Ack=4157 Win=9142 Len=0 TSval=3163927534 TSecr=2681220167"
"193","11:51:58.979546","192.168.0.74","64.65.63.120","TCP","66","[TCP Window Update] 59487  >  443 [ACK] Seq=2615 Ack=4157 Win=9198 Len=0 TSval=3163927534 TSecr=2681220167"
"194","11:51:58.993668","192.168.0.192","230.0.0.1","UDP","92","58107  >  6666 Len=50"
"195","11:51:59.013594","64.65.63.120","192.168.0.74","TLSv1.2","1116","Application Data"
"196","11:51:59.013758","192.168.0.74","64.65.63.120","TCP","66","59487  >  443 [ACK] Seq=2615 Ack=5207 Win=9182 Len=0 TSval=3163927569 TSecr=2681220204"
"197","11:51:59.023493","64.65.63.120","192.168.0.74","TCP","1474","443  >  59487 [ACK] Seq=5207 Ack=2615 Win=3693 Len=1408 TSval=2681220214 TSecr=3163927534 [TCP PDU reassembled in 199]"
"198","11:51:59.023635","192.168.0.74","64.65.63.120","TCP","66","59487  >  443 [ACK] Seq=2615 Ack=6615 Win=9176 Len=0 TSval=3163927579 TSecr=2681220214"
"199","11:51:59.048259","64.65.63.120","192.168.0.74","TLSv1.2","1250","Application Data"
"200","11:51:59.048385","192.168.0.74","64.65.63.120","TCP","66","59487  >  443 [ACK] Seq=2615 Ack=7799 Win=9180 Len=0 TSval=3163927603 TSecr=2681220239"
"201","11:51:59.050364","192.168.0.74","64.65.63.120","TLSv1.2","602","Application Data"
"202","11:51:59.084762","64.65.63.120","192.168.0.74","TCP","66","443  >  59487 [ACK] Seq=7799 Ack=3151 Win=3703 Len=0 TSval=2681220276 TSecr=3163927605"
"203","11:51:59.084978","192.168.0.74","64.65.63.120","TLSv1.2","1116","Application Data"
"204","11:51:59.119454","64.65.63.120","192.168.0.74","TCP","66","443  >  59487 [ACK] Seq=7799 Ack=4201 Win=3703 Len=0 TSval=2681220311 TSecr=3163927640"
"205","11:51:59.255484","64.65.63.120","192.168.0.74","TLSv1.2","1116","Application Data"
"206","11:51:59.255717","192.168.0.74","64.65.63.120","TCP","66","59487  >  443 [ACK] Seq=4201 Ack=8849 Win=9182 Len=0 TSval=3163927811 TSecr=2681220446"
"207","11:51:59.404169","64.65.63.120","192.168.0.74","TLSv1.2","602","Application Data"
"208","11:51:59.404374","192.168.0.74","64.65.63.120","TCP","66","59487  >  443 [ACK] Seq=4201 Ack=9385 Win=9190 Len=0 TSval=3163927959 TSecr=2681220552"
"209","11:51:59.453484","192.168.0.74","64.65.63.120","TLSv1.2","602","Application Data"
"210","11:51:59.489208","64.65.63.120","192.168.0.74","TCP","66","443  >  59487 [ACK] Seq=9385 Ack=4737 Win=3703 Len=0 TSval=2681220680 TSecr=3163928008"
"211","11:51:59.579140","192.168.0.74","5.28.195.2","TCP","78","63724  >  80 [SYN, ECE, CWR] Seq=0 Win=65535 Len=0 MSS=1460 WS=16 TSval=1745796615 TSecr=0 SACK_PERM"
"212","11:51:59.579288","192.168.0.74","5.28.195.2","TCP","78","63725  >  5222 [SYN, ECE, CWR] Seq=0 Win=65535 Len=0 MSS=1460 WS=16 TSval=342323519 TSecr=0 SACK_PERM"
"213","11:51:59.579324","192.168.0.74","5.28.195.2","TCP","78","63723  >  443 [SYN, ECE, CWR] Seq=0 Win=65535 Len=0 MSS=1460 WS=16 TSval=3089758654 TSecr=0 SACK_PERM"
"214","11:51:59.620593","5.28.195.2","192.168.0.74","TCP","74","443  >  63723 [SYN, ACK, ECE] Seq=0 Ack=1 Win=65535 Len=0 MSS=1240 SACK_PERM TSval=1907547800 TSecr=3089758654 WS=1024"
"215","11:51:59.620920","192.168.0.74","5.28.195.2","TCP","66","63723  >  443 [ACK] Seq=1 Ack=1 Win=1048560 Len=0 TSval=3089758696 TSecr=1907547800"
"216","11:51:59.621295","192.168.0.74","5.28.195.2","TLSv1","583","Client Hello"
"217","11:51:59.708692","192.168.0.74","224.0.0.251","MDNS","338","Standard query response 0x0000 AAAA, cache flush fe80::49c:fb07:3c9a:aa62 A, cache flush 192.168.0.74 AAAA, cache flush 2a02:ab88:b:4100:8a2:2611:1782:be29 TXT, cache flush PTR _asquic._udp.local PTR AFD641B9-2F6D-4575-8F75-66BF3602B67B._asquic._udp.local SRV, cache flush 0 0 55616 65b7ed82-f4d7-49c7-99e3-8826d6de022d.local NSEC, cache flush 65b7ed82-f4d7-49c7-99e3-8826d6de022d.local NSEC, cache flush AFD641B9-2F6D-4575-8F75-66BF3602B67B._asquic._udp.local"
"218","11:51:59.708742","fe80::49c:fb07:3c9a:aa62","ff02::fb","MDNS","358","Standard query response 0x0000 AAAA, cache flush fe80::49c:fb07:3c9a:aa62 A, cache flush 192.168.0.74 AAAA, cache flush 2a02:ab88:b:4100:8a2:2611:1782:be29 TXT, cache flush PTR _asquic._udp.local PTR AFD641B9-2F6D-4575-8F75-66BF3602B67B._asquic._udp.local SRV, cache flush 0 0 55616 65b7ed82-f4d7-49c7-99e3-8826d6de022d.local NSEC, cache flush 65b7ed82-f4d7-49c7-99e3-8826d6de022d.local NSEC, cache flush AFD641B9-2F6D-4575-8F75-66BF3602B67B._asquic._udp.local"
"219","11:51:59.740189","5.28.195.2","192.168.0.74","TCP","66","443  >  63723 [ACK] Seq=1 Ack=518 Win=67584 Len=0 TSval=1907547867 TSecr=3089758696"
"220","11:51:59.740193","5.28.195.2","192.168.0.74","TCP","66","443  >  63723 [FIN, ACK] Seq=1 Ack=518 Win=67584 Len=0 TSval=1907547867 TSecr=3089758696"
"221","11:51:59.740195","64.65.63.120","192.168.0.74","TCP","1474","443  >  59487 [ACK] Seq=9385 Ack=4737 Win=3703 Len=1408 TSval=2681220927 TSecr=3163928008 [TCP PDU reassembled in 223]"
"222","11:51:59.740201","64.65.63.120","192.168.0.74","TCP","1474","443  >  59487 [PSH, ACK] Seq=10793 Ack=4737 Win=3703 Len=1408 TSval=2681220927 TSecr=3163928008 [TCP PDU reassembled in 223]"
"223","11:51:59.740204","64.65.63.120","192.168.0.74","TLSv1.2","870","Application Data"
"224","11:51:59.740459","192.168.0.74","5.28.195.2","TCP","66","63723  >  443 [ACK] Seq=518 Ack=2 Win=1048560 Len=0 TSval=3089758815 TSecr=1907547867"
"225","11:51:59.740514","192.168.0.74","64.65.63.120","TCP","66","59487  >  443 [ACK] Seq=4737 Ack=13005 Win=9142 Len=0 TSval=3163928295 TSecr=2681220927"
"226","11:51:59.740670","192.168.0.74","64.65.63.120","TCP","66","[TCP Window Update] 59487  >  443 [ACK] Seq=4737 Ack=13005 Win=9198 Len=0 TSval=3163928296 TSecr=2681220927"
"227","11:51:59.740712","192.168.0.74","5.28.195.2","TCP","66","63723  >  443 [FIN, ACK] Seq=518 Ack=2 Win=1048560 Len=0 TSval=3089758816 TSecr=1907547867"
"228","11:51:59.779243","5.28.195.2","192.168.0.74","TCP","56","443  >  63723 [RST] Seq=2 Win=0 Len=0"
"229","11:51:59.784859","64.65.63.120","192.168.0.74","TCP","1474","443  >  59487 [ACK] Seq=13005 Ack=4737 Win=3703 Len=1408 TSval=2681220976 TSecr=3163928296 [TCP PDU reassembled in 231]"
"230","11:51:59.784861","64.65.63.120","192.168.0.74","TCP","1474","443  >  59487 [PSH, ACK] Seq=14413 Ack=4737 Win=3703 Len=1408 TSval=2681220976 TSecr=3163928296 [TCP PDU reassembled in 231]"
"231","11:51:59.784862","64.65.63.120","192.168.0.74","TLSv1.2","870","Application Data"
"232","11:51:59.784963","192.168.0.74","64.65.63.120","TCP","66","59487  >  443 [ACK] Seq=4737 Ack=16625 Win=9142 Len=0 TSval=3163928340 TSecr=2681220976"
"233","11:51:59.785073","192.168.0.74","64.65.63.120","TCP","66","[TCP Window Update] 59487  >  443 [ACK] Seq=4737 Ack=16625 Win=9198 Len=0 TSval=3163928340 TSecr=2681220976"
"234","11:51:59.785195","192.168.0.74","64.65.63.120","TLSv1.2","602","Application Data"
"235","11:51:59.823425","64.65.63.120","192.168.0.74","TCP","66","443  >  59487 [ACK] Seq=16625 Ack=5273 Win=3703 Len=0 TSval=2681221014 TSecr=3163928340"
"236","11:51:59.835520","64.65.63.120","192.168.0.74","TCP","1474","443  >  59487 [ACK] Seq=16625 Ack=5273 Win=3703 Len=1408 TSval=2681221026 TSecr=3163928340 [TCP PDU reassembled in 238]"
"237","11:51:59.835523","64.65.63.120","192.168.0.74","TCP","1474","443  >  59487 [PSH, ACK] Seq=18033 Ack=5273 Win=3703 Len=1408 TSval=2681221026 TSecr=3163928340 [TCP PDU reassembled in 238]"
"238","11:51:59.835525","64.65.63.120","192.168.0.74","TLSv1.2","870","Application Data"
"239","11:51:59.835676","192.168.0.74","64.65.63.120","TCP","66","59487  >  443 [ACK] Seq=5273 Ack=20245 Win=9142 Len=0 TSval=3163928391 TSecr=2681221026"
"240","11:51:59.835793","192.168.0.74","64.65.63.120","TCP","66","[TCP Window Update] 59487  >  443 [ACK] Seq=5273 Ack=20245 Win=9198 Len=0 TSval=3163928391 TSecr=2681221026"
"241","11:51:59.840650","64.65.63.120","192.168.0.74","TCP","1474","443  >  59487 [ACK] Seq=20245 Ack=5273 Win=3703 Len=1408 TSval=2681221032 TSecr=3163928340 [TCP PDU reassembled in 243]"
"242","11:51:59.840653","64.65.63.120","192.168.0.74","TCP","1474","443  >  59487 [PSH, ACK] Seq=21653 Ack=5273 Win=3703 Len=1408 TSval=2681221032 TSecr=3163928340 [TCP PDU reassembled in 243]"
"243","11:51:59.840655","64.65.63.120","192.168.0.74","TLSv1.2","1474","Application Data"
"244","11:51:59.840657","64.65.63.120","192.168.0.74","TCP","1474","443  >  59487 [PSH, ACK] Seq=24469 Ack=5273 Win=3703 Len=1408 TSval=2681221032 TSecr=3163928340 [TCP PDU reassembled in 248]"
"245","11:51:59.840660","64.65.63.120","192.168.0.74","TCP","1474","443  >  59487 [ACK] Seq=25877 Ack=5273 Win=3703 Len=1408 TSval=2681221032 TSecr=3163928340 [TCP PDU reassembled in 248]"
"246","11:51:59.840749","192.168.0.74","64.65.63.120","TCP","66","59487  >  443 [ACK] Seq=5273 Ack=27285 Win=9088 Len=0 TSval=3163928396 TSecr=2681221032"
"247","11:51:59.840827","192.168.0.74","64.65.63.120","TCP","66","[TCP Window Update] 59487  >  443 [ACK] Seq=5273 Ack=27285 Win=9198 Len=0 TSval=3163928396 TSecr=2681221032"
"248","11:51:59.931574","64.65.63.120","192.168.0.74","TLSv1.2","1474","Application Data"
"249","11:51:59.931576","64.65.63.120","192.168.0.74","TCP","1474","443  >  59487 [PSH, ACK] Seq=28693 Ack=5273 Win=3703 Len=1408 TSval=2681221045 TSecr=3163928340 [TCP PDU reassembled in 251]"
"250","11:51:59.931578","64.65.63.120","192.168.0.74","TCP","1474","443  >  59487 [ACK] Seq=30101 Ack=5273 Win=3703 Len=1408 TSval=2681221061 TSecr=3163928391 [TCP PDU reassembled in 251]"
