"No.","Time","Source","Destination","Protocol","Length","Info"
"1","11:46:07.286850","192.168.0.227","5.28.195.2","TCP","78","61154  >  443 [SYN, ECE, CWR] Seq=0 Win=65535 Len=0 MSS=1460 WS=16 TSval=955171549 TSecr=0 SACK_PERM"
"2","11:46:07.325555","5.28.195.2","192.168.0.227","TCP","74","443  >  61154 [SYN, ACK, ECE] Seq=0 Ack=1 Win=65535 Len=0 MSS=1240 SACK_PERM TSval=2565469293 TSecr=955171549 WS=1024"
"3","11:46:07.325680","192.168.0.227","5.28.195.2","TCP","66","61154  >  443 [ACK] Seq=1 Ack=1 Win=1048560 Len=0 TSval=955171588 TSecr=2565469293"
"4","11:46:07.325970","192.168.0.227","5.28.195.2","TLSv1","583","Client Hello"
"5","11:46:07.370102","5.28.195.2","192.168.0.227","TCP","66","443  >  61154 [ACK] Seq=1 Ack=518 Win=67584 Len=0 TSval=2565469339 TSecr=955171588"
"6","11:46:07.370103","5.28.195.2","192.168.0.227","TCP","66","443  >  61154 [FIN, ACK] Seq=1 Ack=518 Win=67584 Len=0 TSval=2565469339 TSecr=955171588"
"7","11:46:07.370166","192.168.0.227","5.28.195.2","TCP","66","61154  >  443 [ACK] Seq=518 Ack=2 Win=1048560 Len=0 TSval=955171632 TSecr=2565469339"
"8","11:46:07.370498","192.168.0.227","5.28.195.2","TCP","66","61154  >  443 [FIN, ACK] Seq=518 Ack=2 Win=1048560 Len=0 TSval=955171632 TSecr=2565469339"
"9","11:46:07.410830","5.28.195.2","192.168.0.227","TCP","56","443  >  61154 [RST] Seq=2 Win=0 Len=0"
"10","11:46:07.411036","192.168.0.227","5.28.195.2","TCP","78","61155  >  5222 [SYN, ECE, CWR] Seq=0 Win=65535 Len=0 MSS=1460 WS=16 TSval=1512655165 TSecr=0 SACK_PERM"
"11","11:46:07.411039","192.168.0.227","5.28.195.2","TCP","78","61156  >  80 [SYN, ECE, CWR] Seq=0 Win=65535 Len=0 MSS=1460 WS=16 TSval=3786477189 TSecr=0 SACK_PERM"
"12","11:46:07.411142","192.168.0.227","5.28.195.2","TCP","78","61157  >  443 [SYN, ECE, CWR] Seq=0 Win=65535 Len=0 MSS=1460 WS=16 TSval=3512549729 TSecr=0 SACK_PERM"
"13","11:46:07.453458","5.28.195.2","192.168.0.227","TCP","74","443  >  61157 [SYN, ACK, ECE] Seq=0 Ack=1 Win=65535 Len=0 MSS=1240 SACK_PERM TSval=901574544 TSecr=3512549729 WS=1024"
"14","11:46:07.453601","192.168.0.227","5.28.195.2","TCP","66","61157  >  443 [ACK] Seq=1 Ack=1 Win=1048560 Len=0 TSval=3512549771 TSecr=901574544"
"15","11:46:07.453810","192.168.0.227","5.28.195.2","TLSv1","583","Client Hello"
"16","11:46:07.484525","2a02:ab88:b:4100:4977:d98a:d5e5:5d47","2a00:1450:400d:808::200e","TCP","1494","51190  >  443 [ACK] Seq=1 Ack=1 Win=2048 Len=1408 TSval=4055115267 TSecr=872563705 [TCP PDU reassembled in 17]"
"17","11:46:07.484557","2a02:ab88:b:4100:4977:d98a:d5e5:5d47","2a00:1450:400d:808::200e","TLSv1.2","1243","Application Data"
"18","11:46:07.484809","2a02:ab88:b:4100:4977:d98a:d5e5:5d47","2a00:1450:400d:808::200e","TCP","1494","51190  >  443 [ACK] Seq=2566 Ack=1 Win=2048 Len=1408 TSval=4055115268 TSecr=872563705 [TCP PDU reassembled in 21]"
"19","11:46:07.484810","2a02:ab88:b:4100:4977:d98a:d5e5:5d47","2a00:1450:400d:808::200e","TCP","1494","51190  >  443 [ACK] Seq=3974 Ack=1 Win=2048 Len=1408 TSval=4055115268 TSecr=872563705 [TCP PDU reassembled in 21]"
"20","11:46:07.484810","2a02:ab88:b:4100:4977:d98a:d5e5:5d47","2a00:1450:400d:808::200e","TCP","1494","51190  >  443 [ACK] Seq=5382 Ack=1 Win=2048 Len=1408 TSval=4055115268 TSecr=872563705 [TCP PDU reassembled in 21]"
"21","11:46:07.484817","2a02:ab88:b:4100:4977:d98a:d5e5:5d47","2a00:1450:400d:808::200e","TLSv1.2","1161","Application Data"
"22","11:46:07.497121","2a02:ab88:b:4100:4977:d98a:d5e5:5d47","2a00:1450:400d:809::200e","TCP","74","51403  >  443 [ACK] Seq=1 Ack=1 Win=2048 Len=0"
"23","11:46:07.500191","5.28.195.2","192.168.0.227","TCP","66","443  >  61157 [ACK] Seq=1 Ack=518 Win=67584 Len=0 TSval=901574587 TSecr=3512549772"
"24","11:46:07.500193","5.28.195.2","192.168.0.227","TCP","66","443  >  61157 [FIN, ACK] Seq=1 Ack=518 Win=67584 Len=0 TSval=901574587 TSecr=3512549772"
"25","11:46:07.500464","192.168.0.227","5.28.195.2","TCP","66","61157  >  443 [ACK] Seq=518 Ack=2 Win=1048560 Len=0 TSval=3512549818 TSecr=901574587"
"26","11:46:07.500780","192.168.0.227","5.28.195.2","TCP","66","61157  >  443 [FIN, ACK] Seq=518 Ack=2 Win=1048560 Len=0 TSval=3512549819 TSecr=901574587"
"27","11:46:07.502343","2a00:1450:400d:808::200e","2a02:ab88:b:4100:4977:d98a:d5e5:5d47","TCP","86","443  >  51190 [ACK] Seq=1 Ack=1409 Win=335 Len=0 TSval=872609596 TSecr=4055115267"
"28","11:46:07.511504","2a00:1450:400d:808::200e","2a02:ab88:b:4100:4977:d98a:d5e5:5d47","TCP","86","443  >  51190 [ACK] Seq=1 Ack=2566 Win=335 Len=0 TSval=872609602 TSecr=4055115267"
"29","11:46:07.511507","2a00:1450:400d:808::200e","2a02:ab88:b:4100:4977:d98a:d5e5:5d47","TCP","86","443  >  51190 [ACK] Seq=1 Ack=3974 Win=332 Len=0 TSval=872609602 TSecr=4055115268"
"30","11:46:07.511509","2a00:1450:400d:808::200e","2a02:ab88:b:4100:4977:d98a:d5e5:5d47","TCP","86","443  >  51190 [ACK] Seq=1 Ack=5382 Win=330 Len=0 TSval=872609602 TSecr=4055115268"
"31","11:46:07.511510","2a00:1450:400d:808::200e","2a02:ab88:b:4100:4977:d98a:d5e5:5d47","TCP","86","443  >  51190 [ACK] Seq=1 Ack=6790 Win=327 Len=0 TSval=872609602 TSecr=4055115268"
"32","11:46:07.511511","2a00:1450:400d:808::200e","2a02:ab88:b:4100:4977:d98a:d5e5:5d47","TCP","86","443  >  51190 [ACK] Seq=1 Ack=7865 Win=335 Len=0 TSval=872609604 TSecr=4055115268"
"33","11:46:07.516162","2a00:1450:400d:809::200e","2a02:ab88:b:4100:4977:d98a:d5e5:5d47","TCP","86","[TCP ACKed unseen segment] 443  >  51403 [ACK] Seq=1 Ack=2 Win=690 Len=0 TSval=2982027611 TSecr=3481442704"
"34","11:46:07.541228","5.28.195.2","192.168.0.227","TCP","56","443  >  61157 [RST] Seq=2 Win=0 Len=0"
"35","11:46:07.556348","2a00:1450:400d:808::200e","2a02:ab88:b:4100:4977:d98a:d5e5:5d47","TLSv1.2","623","Application Data"
"36","11:46:07.556351","2a00:1450:400d:808::200e","2a02:ab88:b:4100:4977:d98a:d5e5:5d47","TLSv1.2","323","Application Data"
"37","11:46:07.556353","2a00:1450:400d:808::200e","2a02:ab88:b:4100:4977:d98a:d5e5:5d47","TLSv1.2","117","Application Data"
"38","11:46:07.556355","2a00:1450:400d:808::200e","2a02:ab88:b:4100:4977:d98a:d5e5:5d47","TLSv1.2","125","Application Data"
"39","11:46:07.560067","2a02:ab88:b:4100:4977:d98a:d5e5:5d47","2a00:1450:400d:808::200e","TCP","86","51190  >  443 [ACK] Seq=7865 Ack=845 Win=2035 Len=0 TSval=4055115339 TSecr=872609654"
"40","11:46:07.560482","2a02:ab88:b:4100:4977:d98a:d5e5:5d47","2a00:1450:400d:808::200e","TLSv1.2","125","Application Data"
"41","11:46:07.580817","2a00:1450:400d:808::200e","2a02:ab88:b:4100:4977:d98a:d5e5:5d47","TCP","86","443  >  51190 [ACK] Seq=845 Ack=7904 Win=338 Len=0 TSval=872609679 TSecr=4055115343"
"42","11:46:08.292441","192.168.0.227","31.192.108.181","TLSv1.2","412","Application Data"
"43","11:46:08.293516","2a02:ab88:b:4100:4977:d98a:d5e5:5d47","2a03:2880:f32e:122:face:b00c:0:167","TCP","98","51440  >  443 [SYN, ECE, CWR] Seq=0 Win=65535 Len=0 MSS=1440 WS=64 TSval=1158378040 TSecr=0 SACK_PERM"
"44","11:46:08.335491","192.87.28.82","192.168.0.227","TLSv1.2","602","Application Data"
"45","11:46:08.335673","192.168.0.227","192.87.28.82","TCP","66","55094  >  9001 [ACK] Seq=1 Ack=537 Win=7012 Len=0 TSval=4102693482 TSecr=2015342486"
"46","11:46:08.346842","2a03:2880:f32e:122:face:b00c:0:167","2a02:ab88:b:4100:4977:d98a:d5e5:5d47","TCP","94","443  >  51440 [SYN, ACK] Seq=0 Ack=1 Win=65535 Len=0 MSS=1392 SACK_PERM TSval=775685976 TSecr=1158378040 WS=256"
"47","11:46:08.348299","2a02:ab88:b:4100:4977:d98a:d5e5:5d47","2a03:2880:f32e:122:face:b00c:0:167","TCP","86","51440  >  443 [ACK] Seq=1 Ack=1 Win=131136 Len=0 TSval=1158378094 TSecr=775685976"
"48","11:46:08.348348","2a02:ab88:b:4100:4977:d98a:d5e5:5d47","2a03:2880:f32e:122:face:b00c:0:167","TCP","1466","51440  >  443 [ACK] Seq=1 Ack=1 Win=131136 Len=1380 TSval=1158378095 TSecr=775685976 [TCP PDU reassembled in 49]"
"49","11:46:08.348352","2a02:ab88:b:4100:4977:d98a:d5e5:5d47","2a03:2880:f32e:122:face:b00c:0:167","TLSv1.3","247","Client Hello (SNI=graph.whatsapp.net)"
"50","11:46:08.348689","31.192.108.181","192.168.0.227","TCP","66","443  >  62197 [ACK] Seq=1 Ack=347 Win=51 Len=0 TSval=3193095694 TSecr=544556593"
"51","11:46:08.348691","31.192.108.181","192.168.0.227","TLSv1.2","228","Application Data"
"52","11:46:08.348692","31.192.108.181","192.168.0.227","TLSv1.2","216","Application Data"
"53","11:46:08.348956","192.168.0.227","31.192.108.181","TCP","66","62197  >  443 [ACK] Seq=347 Ack=313 Win=2044 Len=0 TSval=544556650 TSecr=3193095694"
"54","11:46:08.380941","192.168.0.227","13.89.179.11","TCP","54","61057  >  443 [ACK] Seq=1 Ack=1 Win=2048 Len=0"
"55","11:46:08.391558","2a03:2880:f32e:122:face:b00c:0:167","2a02:ab88:b:4100:4977:d98a:d5e5:5d47","TCP","86","443  >  51440 [ACK] Seq=1 Ack=1542 Win=68864 Len=0 TSval=775686025 TSecr=1158378095"
"56","11:46:08.391560","2a03:2880:f32e:122:face:b00c:0:167","2a02:ab88:b:4100:4977:d98a:d5e5:5d47","TLSv1.3","1466","Server Hello, Change Cipher Spec"
"57","11:46:08.391562","2a03:2880:f32e:122:face:b00c:0:167","2a02:ab88:b:4100:4977:d98a:d5e5:5d47","TLSv1.3","1466","Application Data"
"58","11:46:08.392430","2a02:ab88:b:4100:4977:d98a:d5e5:5d47","2a03:2880:f32e:122:face:b00c:0:167","TCP","86","51440  >  443 [ACK] Seq=1542 Ack=2761 Win=128384 Len=0 TSval=1158378139 TSecr=775686026"
"59","11:46:08.394207","2a03:2880:f32e:122:face:b00c:0:167","2a02:ab88:b:4100:4977:d98a:d5e5:5d47","TLSv1.3","825","Application Data"
"60","11:46:08.394887","2a02:ab88:b:4100:4977:d98a:d5e5:5d47","2a03:2880:f32e:122:face:b00c:0:167","TCP","86","51440  >  443 [ACK] Seq=1542 Ack=3500 Win=130368 Len=0 TSval=1158378141 TSecr=775686026"
"61","11:46:08.412166","192.168.0.227","5.28.195.2","TCP","78","[TCP Retransmission] 61156  >  80 [SYN] Seq=0 Win=65535 Len=0 MSS=1460 WS=16 TSval=3786478190 TSecr=0 SACK_PERM"
"62","11:46:08.412232","192.168.0.227","5.28.195.2","TCP","78","[TCP Retransmission] 61155  >  5222 [SYN] Seq=0 Win=65535 Len=0 MSS=1460 WS=16 TSval=1512656166 TSecr=0 SACK_PERM"
"63","11:46:08.416010","2a02:ab88:b:4100:4977:d98a:d5e5:5d47","2a03:2880:f32e:122:face:b00c:0:167","TLSv1.3","150","Change Cipher Spec, Application Data"
"64","11:46:08.417374","2a02:ab88:b:4100:4977:d98a:d5e5:5d47","2a03:2880:f32e:122:face:b00c:0:167","TLSv1.3","480","Application Data"
"65","11:46:08.417543","2a02:ab88:b:4100:4977:d98a:d5e5:5d47","2a03:2880:f32e:122:face:b00c:0:167","TLSv1.3","347","Application Data"
"66","11:46:08.458112","2a03:2880:f32e:122:face:b00c:0:167","2a02:ab88:b:4100:4977:d98a:d5e5:5d47","TCP","86","443  >  51440 [ACK] Seq=3500 Ack=2261 Win=74240 Len=0 TSval=775686091 TSecr=1158378163"
"67","11:46:08.458114","2a03:2880:f32e:122:face:b00c:0:167","2a02:ab88:b:4100:4977:d98a:d5e5:5d47","TLSv1.3","265","Application Data"
"68","11:46:08.458116","2a03:2880:f32e:122:face:b00c:0:167","2a02:ab88:b:4100:4977:d98a:d5e5:5d47","TLSv1.3","160","Application Data"
"69","11:46:08.458117","2a03:2880:f32e:122:face:b00c:0:167","2a02:ab88:b:4100:4977:d98a:d5e5:5d47","TLSv1.3","130","Application Data"
"70","11:46:08.458775","2a02:ab88:b:4100:4977:d98a:d5e5:5d47","2a03:2880:f32e:122:face:b00c:0:167","TCP","86","51440  >  443 [ACK] Seq=2261 Ack=3797 Win=130816 Len=0 TSval=1158378205 TSecr=775686092"
"71","11:46:08.458922","2a02:ab88:b:4100:4977:d98a:d5e5:5d47","2a03:2880:f32e:122:face:b00c:0:167","TLSv1.3","117","Application Data"
"72","11:46:08.497646","2a03:2880:f32e:122:face:b00c:0:167","2a02:ab88:b:4100:4977:d98a:d5e5:5d47","TLSv1.3","566","Application Data"
"73","11:46:08.498072","2a02:ab88:b:4100:4977:d98a:d5e5:5d47","2a03:2880:f32e:122:face:b00c:0:167","TCP","86","51440  >  443 [ACK] Seq=2292 Ack=4277 Win=130624 Len=0 TSval=1158378245 TSecr=775686134"
"74","11:46:08.503084","2a02:ab88:b:4100:4977:d98a:d5e5:5d47","2a03:2880:f32e:122:face:b00c:0:167","TLSv1.3","125","Application Data"
"75","11:46:08.503399","2a02:ab88:b:4100:4977:d98a:d5e5:5d47","2a03:2880:f32e:122:face:b00c:0:167","TLSv1.3","110","Application Data"
"76","11:46:08.503698","2a02:ab88:b:4100:4977:d98a:d5e5:5d47","2a03:2880:f32e:122:face:b00c:0:167","TCP","86","51440  >  443 [FIN, ACK] Seq=2355 Ack=4277 Win=131072 Len=0 TSval=1158378251 TSecr=775686134"
"77","11:46:08.527112","13.89.179.11","192.168.0.227","TCP","66","[TCP ACKed unseen segment] 443  >  61057 [ACK] Seq=1 Ack=2 Win=16384 Len=0 TSval=379748403 TSecr=2951814761"
"78","11:46:08.529377","192.168.0.227","192.87.28.82","TCP","54","[TCP Keep-Alive] 55094  >  9001 [ACK] Seq=0 Ack=537 Win=7020 Len=0"
"79","11:46:08.539036","2a03:2880:f32e:122:face:b00c:0:167","2a02:ab88:b:4100:4977:d98a:d5e5:5d47","TCP","86","443  >  51440 [ACK] Seq=4277 Ack=2355 Win=74240 Len=0 TSval=775686175 TSecr=1158378250"
"80","11:46:08.539037","2a03:2880:f32e:122:face:b00c:0:167","2a02:ab88:b:4100:4977:d98a:d5e5:5d47","TLSv1.3","110","Application Data"
"81","11:46:08.539038","2a03:2880:f32e:122:face:b00c:0:167","2a02:ab88:b:4100:4977:d98a:d5e5:5d47","TCP","86","443  >  51440 [FIN, ACK] Seq=4301 Ack=2355 Win=74240 Len=0 TSval=775686175 TSecr=1158378250"
"82","11:46:08.539302","2a02:ab88:b:4100:4977:d98a:d5e5:5d47","2a03:2880:f32e:122:face:b00c:0:167","TCP","74","51440  >  443 [RST] Seq=2355 Win=0 Len=0"
"83","11:46:08.539306","2a02:ab88:b:4100:4977:d98a:d5e5:5d47","2a03:2880:f32e:122:face:b00c:0:167","TCP","74","51440  >  443 [RST] Seq=2355 Win=0 Len=0"
"84","11:46:08.544389","2a03:2880:f32e:122:face:b00c:0:167","2a02:ab88:b:4100:4977:d98a:d5e5:5d47","TCP","86","443  >  51440 [ACK] Seq=4302 Ack=2356 Win=74240 Len=0 TSval=775686178 TSecr=1158378251"
"85","11:46:08.544567","2a02:ab88:b:4100:4977:d98a:d5e5:5d47","2a03:2880:f32e:122:face:b00c:0:167","TCP","74","51440  >  443 [RST] Seq=2356 Win=0 Len=0"
"86","11:46:08.565803","192.87.28.82","192.168.0.227","TCP","66","[TCP Keep-Alive ACK] 9001  >  55094 [ACK] Seq=537 Ack=1 Win=1043 Len=0 TSval=2015342715 TSecr=4102693482"
"87","11:46:09.008147","192.168.0.227","31.192.108.181","TCP","54","[TCP Keep-Alive] 62197  >  443 [ACK] Seq=346 Ack=313 Win=2048 Len=0"
"88","11:46:09.079493","31.192.108.181","192.168.0.227","TCP","66","[TCP Keep-Alive ACK] 443  >  62197 [ACK] Seq=313 Ack=347 Win=51 Len=0 TSval=3193096407 TSecr=544556650"
"89","11:46:09.099102","2a06:98c1:3122:8000::1","2a02:ab88:b:4100:4977:d98a:d5e5:5d47","TLSv1.2","110","Application Data"
"90","11:46:09.099622","2a02:ab88:b:4100:4977:d98a:d5e5:5d47","2a06:98c1:3122:8000::1","TCP","86","51389  >  443 [ACK] Seq=1 Ack=25 Win=2048 Len=0 TSval=1933980374 TSecr=161226753"
"91","11:46:09.099629","2a02:ab88:b:4100:4977:d98a:d5e5:5d47","2a06:98c1:3122:8000::1","TLSv1.2","110","Application Data"
"92","11:46:09.099630","2a02:ab88:b:4100:4977:d98a:d5e5:5d47","2a06:98c1:3122:8000::1","TLSv1.2","112","Application Data"
"93","11:46:09.122190","2a06:98c1:3122:8000::1","2a02:ab88:b:4100:4977:d98a:d5e5:5d47","TCP","86","443  >  51389 [ACK] Seq=25 Ack=51 Win=16 Len=0 TSval=161226777 TSecr=1933980375"
"94","11:46:09.413415","192.168.0.227","5.28.195.2","TCP","78","[TCP Retransmission] 61156  >  80 [SYN] Seq=0 Win=65535 Len=0 MSS=1460 WS=16 TSval=3786479191 TSecr=0 SACK_PERM"
"95","11:46:09.413467","192.168.0.227","5.28.195.2","TCP","78","[TCP Retransmission] 61155  >  5222 [SYN] Seq=0 Win=65535 Len=0 MSS=1460 WS=16 TSval=1512657167 TSecr=0 SACK_PERM"
"96","11:46:09.715801","2a02:ab88:b:4100:4977:d98a:d5e5:5d47","2a00:1450:4025:401::5e","TLSv1.2","170","Application Data"
"97","11:46:09.716053","2a02:ab88:b:4100:4977:d98a:d5e5:5d47","2a00:1450:400d:80f::200a","TLSv1.2","125","Application Data"
"98","11:46:09.736358","2a00:1450:400d:80f::200a","2a02:ab88:b:4100:4977:d98a:d5e5:5d47","TCP","86","443  >  51272 [ACK] Seq=1 Ack=40 Win=622 Len=0 TSval=242990250 TSecr=3319389193"
"99","11:46:09.736360","2a00:1450:400d:80f::200a","2a02:ab88:b:4100:4977:d98a:d5e5:5d47","TLSv1.2","125","Application Data"
"100","11:46:09.736622","2a02:ab88:b:4100:4977:d98a:d5e5:5d47","2a00:1450:400d:80f::200a","TCP","86","51272  >  443 [ACK] Seq=40 Ack=40 Win=2048 Len=0 TSval=3319389214 TSecr=242990250"
"101","11:46:09.752068","2a00:1450:4025:401::5e","2a02:ab88:b:4100:4977:d98a:d5e5:5d47","TCP","86","443  >  51283 [ACK] Seq=1 Ack=85 Win=1047 Len=0 TSval=284116268 TSecr=3610211817"
"102","11:46:09.756341","2a00:1450:4025:401::5e","2a02:ab88:b:4100:4977:d98a:d5e5:5d47","TLSv1.2","158","Application Data"
"103","11:46:09.756342","2a00:1450:4025:401::5e","2a02:ab88:b:4100:4977:d98a:d5e5:5d47","TLSv1.2","160","Application Data"
"104","11:46:09.756343","2a00:1450:4025:401::5e","2a02:ab88:b:4100:4977:d98a:d5e5:5d47","TLSv1.2","117","Application Data"
"105","11:46:09.756344","2a00:1450:4025:401::5e","2a02:ab88:b:4100:4977:d98a:d5e5:5d47","TLSv1.2","125","Application Data"
"106","11:46:09.757093","2a02:ab88:b:4100:4977:d98a:d5e5:5d47","2a00:1450:4025:401::5e","TCP","86","51283  >  443 [ACK] Seq=85 Ack=217 Win=2045 Len=0 TSval=3610211858 TSecr=284116272"
"107","11:46:09.757424","2a02:ab88:b:4100:4977:d98a:d5e5:5d47","2a00:1450:4025:401::5e","TLSv1.2","125","Application Data"
"108","11:46:09.797420","2a00:1450:4025:401::5e","2a02:ab88:b:4100:4977:d98a:d5e5:5d47","TCP","86","443  >  51283 [ACK] Seq=217 Ack=124 Win=1047 Len=0 TSval=284116315 TSecr=3610211858"
"109","11:46:09.797641","2a02:ab88:b:4100:4977:d98a:d5e5:5d47","2a00:1450:400d:80f::200a","TCP","74","[TCP Keep-Alive] 51272  >  443 [ACK] Seq=39 Ack=40 Win=2048 Len=0"
"110","11:46:09.811617","2a00:1450:400d:80f::200a","2a02:ab88:b:4100:4977:d98a:d5e5:5d47","TCP","86","[TCP Keep-Alive ACK] 443  >  51272 [ACK] Seq=40 Ack=40 Win=622 Len=0 TSval=242990326 TSecr=3319389214"
"111","11:46:10.414460","192.168.0.227","5.28.195.2","TCP","78","[TCP Retransmission] 61156  >  80 [SYN] Seq=0 Win=65535 Len=0 MSS=1460 WS=16 TSval=3786480192 TSecr=0 SACK_PERM"
"112","11:46:10.414504","192.168.0.227","5.28.195.2","TCP","78","[TCP Retransmission] 61155  >  5222 [SYN] Seq=0 Win=65535 Len=0 MSS=1460 WS=16 TSval=1512658168 TSecr=0 SACK_PERM"
"113","11:46:10.434595","17.57.146.139","192.168.0.227","TLSv1.2","785","Application Data"
"114","11:46:10.434926","192.168.0.227","17.57.146.139","TCP","66","60877  >  5223 [ACK] Seq=1 Ack=720 Win=2037 Len=0 TSval=447261272 TSecr=166258023"
"115","11:46:10.438803","192.168.0.227","17.57.146.139","TLSv1.2","98","Application Data"
"116","11:46:10.599605","192.168.0.227","17.57.146.139","TCP","54","60877  >  5223 [ACK] Seq=0 Ack=720 Win=2048 Len=0"
"117","11:46:10.617310","17.57.146.139","192.168.0.227","TCP","66","5223  >  60877 [ACK] Seq=720 Ack=33 Win=3989 Len=0 TSval=166258082 TSecr=447261276"
"118","11:46:10.696159","17.57.146.139","192.168.0.227","TCP","66","[TCP Dup ACK 117#1] 5223  >  60877 [ACK] Seq=720 Ack=33 Win=3989 Len=0 TSval=166258261 TSecr=447261276"
"119","11:46:10.858207","192.168.0.227","64.65.63.120","TLSv1.2","602","Application Data"
"120","11:46:10.897123","64.65.63.120","192.168.0.227","TCP","66","443  >  55087 [ACK] Seq=1 Ack=537 Win=1769 Len=0 TSval=2578486521 TSecr=1560668206"
"121","11:46:10.963710","64.65.63.120","192.168.0.227","TLSv1.2","602","Application Data"
"122","11:46:10.963824","192.168.0.227","64.65.63.120","TCP","66","55087  >  443 [ACK] Seq=537 Ack=537 Win=10312 Len=0 TSval=1560668312 TSecr=2578486588"
"123","11:46:10.964837","192.168.0.227","64.65.63.120","TCP","1474","55087  >  443 [ACK] Seq=537 Ack=537 Win=10320 Len=1408 TSval=1560668313 TSecr=2578486588 [TCP PDU reassembled in 124]"
"124","11:46:10.964859","192.168.0.227","64.65.63.120","TLSv1.2","736","Application Data"
"125","11:46:11.005176","64.65.63.120","192.168.0.227","TCP","66","443  >  55087 [ACK] Seq=537 Ack=1945 Win=1792 Len=0 TSval=2578486630 TSecr=1560668313"
"126","11:46:11.005179","64.65.63.120","192.168.0.227","TCP","66","443  >  55087 [ACK] Seq=537 Ack=2615 Win=1814 Len=0 TSval=2578486630 TSecr=1560668313"
"127","11:46:11.057603","64.65.63.120","192.168.0.227","TCP","1474","443  >  55087 [ACK] Seq=537 Ack=2615 Win=1814 Len=1408 TSval=2578486680 TSecr=1560668313 [TCP PDU reassembled in 129]"
"128","11:46:11.057606","64.65.63.120","192.168.0.227","TCP","1474","443  >  55087 [PSH, ACK] Seq=1945 Ack=2615 Win=1814 Len=1408 TSval=2578486680 TSecr=1560668313 [TCP PDU reassembled in 129]"
"129","11:46:11.057607","64.65.63.120","192.168.0.227","TLSv1.2","870","Application Data"
"130","11:46:11.057753","192.168.0.227","64.65.63.120","TCP","66","55087  >  443 [ACK] Seq=2615 Ack=1945 Win=10298 Len=0 TSval=1560668406 TSecr=2578486680"
"131","11:46:11.057803","192.168.0.227","64.65.63.120","TCP","66","55087  >  443 [ACK] Seq=2615 Ack=4157 Win=10264 Len=0 TSval=1560668406 TSecr=2578486680"
"132","11:46:11.057913","192.168.0.227","64.65.63.120","TCP","66","[TCP Window Update] 55087  >  443 [ACK] Seq=2615 Ack=4157 Win=10320 Len=0 TSval=1560668406 TSecr=2578486680"
"133","11:46:11.068938","2a02:ab88:b:4100:4977:d98a:d5e5:5d47","2603:1063:12::2fd","TLSv1.2","143","Application Data"
"134","11:46:11.072443","64.65.63.120","192.168.0.227","TCP","1474","443  >  55087 [ACK] Seq=4157 Ack=2615 Win=1814 Len=1408 TSval=2578486698 TSecr=1560668313 [TCP PDU reassembled in 138]"
"135","11:46:11.072446","64.65.63.120","192.168.0.227","TCP","1474","443  >  55087 [PSH, ACK] Seq=5565 Ack=2615 Win=1814 Len=1408 TSval=2578486698 TSecr=1560668313 [TCP PDU reassembled in 138]"
"136","11:46:11.072597","192.168.0.227","64.65.63.120","TCP","66","55087  >  443 [ACK] Seq=2615 Ack=6973 Win=10276 Len=0 TSval=1560668421 TSecr=2578486698"
"137","11:46:11.072735","192.168.0.227","64.65.63.120","TCP","66","[TCP Window Update] 55087  >  443 [ACK] Seq=2615 Ack=6973 Win=10320 Len=0 TSval=1560668421 TSecr=2578486698"
"138","11:46:11.081496","64.65.63.120","192.168.0.227","TLSv1.2","1474","Application Data"
"139","11:46:11.081619","192.168.0.227","64.65.63.120","TCP","66","55087  >  443 [ACK] Seq=2615 Ack=8381 Win=10298 Len=0 TSval=1560668430 TSecr=2578486708"
"140","11:46:11.094235","64.65.63.120","192.168.0.227","TLSv1.2","512","Application Data"
"141","11:46:11.094345","192.168.0.227","64.65.63.120","TCP","66","55087  >  443 [ACK] Seq=2615 Ack=8827 Win=10314 Len=0 TSval=1560668442 TSecr=2578486720"
"142","11:46:11.095652","192.168.0.227","64.65.63.120","TLSv1.2","602","Application Data"
"143","11:46:11.097118","192.168.0.227","64.65.63.120","TCP","1474","55087  >  443 [ACK] Seq=3151 Ack=8827 Win=10320 Len=1408 TSval=1560668445 TSecr=2578486720 [TCP PDU reassembled in 144]"
"144","11:46:11.097134","192.168.0.227","64.65.63.120","TLSv1.2","736","Application Data"
"145","11:46:11.109308","2603:1063:12::2fd","2a02:ab88:b:4100:4977:d98a:d5e5:5d47","TLSv1.2","132","Application Data"
"146","11:46:11.109489","2a02:ab88:b:4100:4977:d98a:d5e5:5d47","2603:1063:12::2fd","TCP","86","59052  >  443 [ACK] Seq=58 Ack=47 Win=2048 Len=0 TSval=392704182 TSecr=739133453"
"147","11:46:11.132946","64.65.63.120","192.168.0.227","TCP","66","443  >  55087 [ACK] Seq=8827 Ack=3151 Win=1836 Len=0 TSval=2578486760 TSecr=1560668444"
"148","11:46:11.132949","64.65.63.120","192.168.0.227","TCP","66","443  >  55087 [ACK] Seq=8827 Ack=5229 Win=1869 Len=0 TSval=2578486760 TSecr=1560668445"
"149","11:46:11.189480","64.65.63.120","192.168.0.227","TCP","1474","443  >  55087 [ACK] Seq=8827 Ack=5229 Win=1869 Len=1408 TSval=2578486815 TSecr=1560668445 [TCP PDU reassembled in 150]"
"150","11:46:11.189483","64.65.63.120","192.168.0.227","TLSv1.2","222","Application Data"
"151","11:46:11.189680","192.168.0.227","64.65.63.120","TCP","66","55087  >  443 [ACK] Seq=5229 Ack=10391 Win=10296 Len=0 TSval=1560668538 TSecr=2578486815"
"152","11:46:11.189992","192.168.0.227","64.65.63.120","TLSv1.2","602","Application Data"
"153","11:46:11.198814","2a02:ab88:b:4100:4977:d98a:d5e5:5d47","2603:1063:12::2fd","TCP","74","[TCP Keep-Alive] 59052  >  443 [ACK] Seq=57 Ack=47 Win=2048 Len=0"
"154","11:46:11.230234","64.65.63.120","192.168.0.227","TCP","66","443  >  55087 [ACK] Seq=10391 Ack=5765 Win=1891 Len=0 TSval=2578486855 TSecr=1560668538"
"155","11:46:11.230336","192.168.0.227","64.65.63.120","TLSv1.2","602","Application Data"
"156","11:46:11.235183","2603:1063:12::2fd","2a02:ab88:b:4100:4977:d98a:d5e5:5d47","TCP","86","[TCP Keep-Alive ACK] 443  >  59052 [ACK] Seq=47 Ack=58 Win=16380 Len=0 TSval=739133579 TSecr=392704182"
"157","11:46:11.264589","64.65.63.120","192.168.0.227","TCP","66","443  >  55087 [ACK] Seq=10391 Ack=6301 Win=1899 Len=0 TSval=2578486891 TSecr=1560668578"
"158","11:46:11.264763","192.168.0.227","64.65.63.120","TLSv1.2","602","Application Data"
"159","11:46:11.299095","64.65.63.120","192.168.0.227","TCP","66","443  >  55087 [ACK] Seq=10391 Ack=6837 Win=1907 Len=0 TSval=2578486926 TSecr=1560668613"
"160","11:46:11.328520","64.65.63.120","192.168.0.227","TLSv1.2","602","Application Data"
"161","11:46:11.328689","192.168.0.227","64.65.63.120","TCP","66","55087  >  443 [ACK] Seq=6837 Ack=10927 Win=10312 Len=0 TSval=1560668677 TSecr=2578486955"
"162","11:46:11.374081","64.65.63.120","192.168.0.227","TLSv1.2","602","Application Data"
"163","11:46:11.374282","192.168.0.227","64.65.63.120","TCP","66","55087  >  443 [ACK] Seq=6837 Ack=11463 Win=10312 Len=0 TSval=1560668722 TSecr=2578487000"
"164","11:46:11.375724","192.168.0.227","64.65.63.120","TCP","1474","55087  >  443 [ACK] Seq=6837 Ack=11463 Win=10320 Len=1408 TSval=1560668724 TSecr=2578487000 [TCP PDU reassembled in 165]"
"165","11:46:11.375753","192.168.0.227","64.65.63.120","TLSv1.2","736","Application Data"
"166","11:46:11.413923","64.65.63.120","192.168.0.227","TCP","66","443  >  55087 [ACK] Seq=11463 Ack=8915 Win=1891 Len=0 TSval=2578487041 TSecr=1560668724"
"167","11:46:11.414409","192.168.0.227","5.28.195.2","TCP","78","[TCP Retransmission] 61156  >  80 [SYN] Seq=0 Win=65535 Len=0 MSS=1460 WS=16 TSval=3786481192 TSecr=0 SACK_PERM"
"168","11:46:11.414451","192.168.0.227","5.28.195.2","TCP","78","[TCP Retransmission] 61155  >  5222 [SYN] Seq=0 Win=65535 Len=0 MSS=1460 WS=16 TSval=1512659168 TSecr=0 SACK_PERM"
"169","11:46:11.462985","64.65.63.120","192.168.0.227","TCP","1474","443  >  55087 [ACK] Seq=11463 Ack=8915 Win=1891 Len=1408 TSval=2578487089 TSecr=1560668724 [TCP PDU reassembled in 171]"
"170","11:46:11.462987","64.65.63.120","192.168.0.227","TCP","1474","443  >  55087 [PSH, ACK] Seq=12871 Ack=8915 Win=1891 Len=1408 TSval=2578487089 TSecr=1560668724 [TCP PDU reassembled in 171]"
"171","11:46:11.462989","64.65.63.120","192.168.0.227","TLSv1.2","870","Application Data"
"172","11:46:11.463109","192.168.0.227","64.65.63.120","TCP","66","55087  >  443 [ACK] Seq=8915 Ack=15083 Win=10264 Len=0 TSval=1560668811 TSecr=2578487089"
"173","11:46:11.463240","192.168.0.227","64.65.63.120","TCP","66","[TCP Window Update] 55087  >  443 [ACK] Seq=8915 Ack=15083 Win=10320 Len=0 TSval=1560668811 TSecr=2578487089"
"174","11:46:11.481933","64.65.63.120","192.168.0.227","TCP","1474","443  >  55087 [ACK] Seq=15083 Ack=8915 Win=1891 Len=1408 TSval=2578487108 TSecr=1560668724 [TCP PDU reassembled in 178]"
"175","11:46:11.481936","64.65.63.120","192.168.0.227","TCP","1474","443  >  55087 [PSH, ACK] Seq=16491 Ack=8915 Win=1891 Len=1408 TSval=2578487108 TSecr=1560668724 [TCP PDU reassembled in 178]"
"176","11:46:11.482150","192.168.0.227","64.65.63.120","TCP","66","55087  >  443 [ACK] Seq=8915 Ack=17899 Win=10276 Len=0 TSval=1560668830 TSecr=2578487108"
"177","11:46:11.482316","192.168.0.227","64.65.63.120","TCP","66","[TCP Window Update] 55087  >  443 [ACK] Seq=8915 Ack=17899 Win=10320 Len=0 TSval=1560668830 TSecr=2578487108"
"178","11:46:11.484682","64.65.63.120","192.168.0.227","TLSv1.2","1474","Application Data"
"179","11:46:11.484746","192.168.0.227","64.65.63.120","TCP","66","55087  >  443 [ACK] Seq=8915 Ack=19307 Win=10298 Len=0 TSval=1560668833 TSecr=2578487112"
"180","11:46:11.496476","64.65.63.120","192.168.0.227","TLSv1.2","512","Application Data"
"181","11:46:11.496609","192.168.0.227","64.65.63.120","TCP","66","55087  >  443 [ACK] Seq=8915 Ack=19753 Win=10314 Len=0 TSval=1560668845 TSecr=2578487123"
"182","11:46:11.497861","192.168.0.227","64.65.63.120","TLSv1.2","602","Application Data"
"183","11:46:11.499437","192.168.0.227","64.65.63.120","TCP","1474","55087  >  443 [ACK] Seq=9451 Ack=19753 Win=10320 Len=1408 TSval=1560668848 TSecr=2578487123 [TCP PDU reassembled in 184]"
"184","11:46:11.499462","192.168.0.227","64.65.63.120","TLSv1.2","736","Application Data"
"185","11:46:11.561047","64.65.63.120","192.168.0.227","TCP","66","443  >  55087 [ACK] Seq=19753 Ack=11529 Win=1871 Len=0 TSval=2578487187 TSecr=1560668846"
"186","11:46:11.613486","64.65.63.120","192.168.0.227","TLSv1.2","602","Application Data"
"187","11:46:11.613718","192.168.0.227","64.65.63.120","TCP","66","55087  >  443 [ACK] Seq=11529 Ack=20289 Win=10312 Len=0 TSval=1560668962 TSecr=2578487239"
"188","11:46:11.614450","192.168.0.227","64.65.63.120","TLSv1.2","602","Application Data"
"189","11:46:11.622707","64.65.63.120","192.168.0.227","TCP","1474","443  >  55087 [ACK] Seq=20289 Ack=11529 Win=1871 Len=1408 TSval=2578487247 TSecr=1560668846 [TCP PDU reassembled in 191]"
"190","11:46:11.622711","64.65.63.120","192.168.0.227","TCP","1474","443  >  55087 [PSH, ACK] Seq=21697 Ack=11529 Win=1871 Len=1408 TSval=2578487247 TSecr=1560668846 [TCP PDU reassembled in 191]"
"191","11:46:11.622714","64.65.63.120","192.168.0.227","TLSv1.2","1474","Application Data"
"192","11:46:11.622716","64.65.63.120","192.168.0.227","TCP","1474","443  >  55087 [PSH, ACK] Seq=24513 Ack=11529 Win=1871 Len=1408 TSval=2578487247 TSecr=1560668846 [TCP PDU reassembled in 196]"
"193","11:46:11.622718","64.65.63.120","192.168.0.227","TCP","1474","443  >  55087 [ACK] Seq=25921 Ack=11529 Win=1871 Len=1408 TSval=2578487247 TSecr=1560668846 [TCP PDU reassembled in 196]"
"194","11:46:11.622887","192.168.0.227","64.65.63.120","TCP","66","55087  >  443 [ACK] Seq=12065 Ack=27329 Win=10210 Len=0 TSval=1560668971 TSecr=2578487247"
"195","11:46:11.623020","192.168.0.227","64.65.63.120","TCP","66","[TCP Window Update] 55087  >  443 [ACK] Seq=12065 Ack=27329 Win=10320 Len=0 TSval=1560668971 TSecr=2578487247"
"196","11:46:11.624379","64.65.63.120","192.168.0.227","TLSv1.2","1474","Application Data"
"197","11:46:11.624434","192.168.0.227","64.65.63.120","TCP","66","55087  >  443 [ACK] Seq=12065 Ack=28737 Win=10298 Len=0 TSval=1560668973 TSecr=2578487251"
"198","11:46:11.648908","64.65.63.120","192.168.0.227","TCP","1474","443  >  55087 [ACK] Seq=28737 Ack=11529 Win=1871 Len=1408 TSval=2578487275 TSecr=1560668962 [TCP PDU reassembled in 201]"
"199","11:46:11.649302","192.168.0.227","64.65.63.120","TLSv1.2","602","Application Data"
"200","11:46:11.658445","64.65.63.120","192.168.0.227","TCP","1474","443  >  55087 [ACK] Seq=30145 Ack=12065 Win=1867 Len=1408 TSval=2578487283 TSecr=1560668963 [TCP PDU reassembled in 201]"
"201","11:46:11.658449","64.65.63.120","192.168.0.227","TLSv1.2","1474","Application Data, Application Data"
"202","11:46:11.658452","64.65.63.120","192.168.0.227","TCP","1474","443  >  55087 [ACK] Seq=32961 Ack=12065 Win=1867 Len=1408 TSval=2578487283 TSecr=1560668963 [TCP PDU reassembled in 204]"
"203","11:46:11.658454","64.65.63.120","192.168.0.227","TCP","1474","443  >  55087 [PSH, ACK] Seq=34369 Ack=12065 Win=1867 Len=1408 TSval=2578487283 TSecr=1560668963 [TCP PDU reassembled in 204]"
"204","11:46:11.658456","64.65.63.120","192.168.0.227","TLSv1.2","1474","Application Data"
"205","11:46:11.658680","192.168.0.227","64.65.63.120","TCP","66","55087  >  443 [ACK] Seq=12601 Ack=37185 Win=10210 Len=0 TSval=1560669007 TSecr=2578487284"
"206","11:46:11.658895","192.168.0.227","64.65.63.120","TCP","66","[TCP Window Update] 55087  >  443 [ACK] Seq=12601 Ack=37185 Win=10320 Len=0 TSval=1560669007 TSecr=2578487284"
"207","11:46:11.660392","64.65.63.120","192.168.0.227","TLSv1.2","1474","Application Data, Application Data"
"208","11:46:11.660395","64.65.63.120","192.168.0.227","TLSv1.2","1474","Application Data"
"209","11:46:11.660587","192.168.0.227","64.65.63.120","TCP","66","55087  >  443 [ACK] Seq=12601 Ack=40001 Win=10320 Len=0 TSval=1560669009 TSecr=2578487287"
"210","11:46:11.683538","64.65.63.120","192.168.0.227","TCP","1474","443  >  55087 [ACK] Seq=40001 Ack=12601 Win=1863 Len=1408 TSval=2578487310 TSecr=1560668997 [TCP PDU reassembled in 213]"
"211","11:46:11.683653","192.168.0.227","64.65.63.120","TCP","66","55087  >  443 [ACK] Seq=12601 Ack=41409 Win=10298 Len=0 TSval=1560669032 TSecr=2578487310"
"212","11:46:11.694406","64.65.63.120","192.168.0.227","TCP","1474","443  >  55087 [ACK] Seq=41409 Ack=12601 Win=1863 Len=1408 TSval=2578487319 TSecr=1560669007 [TCP PDU reassembled in 213]"
"213","11:46:11.694408","64.65.63.120","192.168.0.227","TLSv1.2","1474","Application Data, Application Data"
"214","11:46:11.694410","64.65.63.120","192.168.0.227","TCP","1474","443  >  55087 [ACK] Seq=44225 Ack=12601 Win=1863 Len=1408 TSval=2578487319 TSecr=1560669007 [TCP PDU reassembled in 215]"
"215","11:46:11.694411","64.65.63.120","192.168.0.227","TLSv1.2","1474","Application Data"
"216","11:46:11.694412","64.65.63.120","192.168.0.227","TCP","1474","443  >  55087 [ACK] Seq=47041 Ack=12601 Win=1863 Len=1408 TSval=2578487321 TSecr=1560669007 [TCP PDU reassembled in 220]"
"217","11:46:11.694641","192.168.0.227","64.65.63.120","TCP","66","55087  >  443 [ACK] Seq=12601 Ack=48449 Win=10320 Len=0 TSval=1560669043 TSecr=2578487321"
"218","11:46:11.695096","192.168.0.227","64.65.63.120","TLSv1.2","602","Application Data"
"219","11:46:11.696517","64.65.63.120","192.168.0.227","TCP","1474","443  >  55087 [ACK] Seq=48449 Ack=12601 Win=1863 Len=1408 TSval=2578487323 TSecr=1560669009 [TCP PDU reassembled in 220]"
"220","11:46:11.696519","64.65.63.120","192.168.0.227","TLSv1.2","1474","Application Data, Application Data"
"221","11:46:11.696682","192.168.0.227","64.65.63.120","TCP","66","55087  >  443 [ACK] Seq=13137 Ack=51265 Win=10320 Len=0 TSval=1560669045 TSecr=2578487323"
"222","11:46:11.717443","64.65.63.120","192.168.0.227","TLSv1.2","1474","Application Data"
"223","11:46:11.729161","64.65.63.120","192.168.0.227","TCP","1474","443  >  55087 [ACK] Seq=52673 Ack=12601 Win=1863 Len=1408 TSval=2578487354 TSecr=1560669043 [TCP PDU reassembled in 225]"
"224","11:46:11.729163","64.65.63.120","192.168.0.227","TCP","1474","443  >  55087 [PSH, ACK] Seq=54081 Ack=12601 Win=1863 Len=1408 TSval=2578487354 TSecr=1560669043 [TCP PDU reassembled in 225]"
"225","11:46:11.729164","64.65.63.120","192.168.0.227","TLSv1.2","1474","Application Data"
"226","11:46:11.729165","64.65.63.120","192.168.0.227","TCP","1474","443  >  55087 [PSH, ACK] Seq=56897 Ack=12601 Win=1863 Len=1408 TSval=2578487354 TSecr=1560669043 [TCP PDU reassembled in 227]"
"227","11:46:11.729166","64.65.63.120","192.168.0.227","TLSv1.2","1474","Application Data"
"228","11:46:11.729322","192.168.0.227","64.65.63.120","TCP","66","55087  >  443 [ACK] Seq=13137 Ack=59713 Win=10320 Len=0 TSval=1560669077 TSecr=2578487344"
"229","11:46:11.732500","64.65.63.120","192.168.0.227","TCP","1474","443  >  55087 [ACK] Seq=59713 Ack=13137 Win=1859 Len=1408 TSval=2578487358 TSecr=1560669043 [TCP PDU reassembled in 230]"
"230","11:46:11.732502","64.65.63.120","192.168.0.227","TLSv1.2","1474","Application Data"
"231","11:46:11.732585","192.168.0.227","64.65.63.120","TLSv1.2","602","Application Data"
"232","11:46:11.732676","192.168.0.227","64.65.63.120","TCP","66","[TCP Window Update] 55087  >  443 [ACK] Seq=13673 Ack=62529 Win=10320 Len=0 TSval=1560669081 TSecr=2578487358"
"233","11:46:11.737572","192.168.0.227","64.65.63.120","TLSv1.2","1474","Application Data"
"234","11:46:11.737594","192.168.0.227","64.65.63.120","TLSv1.2","244","Application Data"
"235","11:46:11.737613","192.168.0.227","192.87.28.82","TLSv1.2","602","Application Data"
"236","11:46:11.764253","64.65.63.120","192.168.0.227","TLSv1.2","1474","Application Data"
"237","11:46:11.764255","64.65.63.120","192.168.0.227","TCP","1474","443  >  55087 [PSH, ACK] Seq=63937 Ack=13137 Win=1859 Len=1408 TSval=2578487389 TSecr=1560669077 [TCP PDU reassembled in 239]"
"238","11:46:11.764256","64.65.63.120","192.168.0.227","TCP","1474","443  >  55087 [ACK] Seq=65345 Ack=13137 Win=1859 Len=1408 TSval=2578487389 TSecr=1560669077 [TCP PDU reassembled in 239]"
"239","11:46:11.764257","64.65.63.120","192.168.0.227","TLSv1.2","1474","Application Data"
"240","11:46:11.764259","64.65.63.120","192.168.0.227","TCP","1474","443  >  55087 [ACK] Seq=68161 Ack=13137 Win=1859 Len=1408 TSval=2578487389 TSecr=1560669077 [TCP PDU reassembled in 241]"
"241","11:46:11.764260","64.65.63.120","192.168.0.227","TLSv1.2","1474","Application Data"
"242","11:46:11.764423","192.168.0.227","64.65.63.120","TCP","66","55087  >  443 [ACK] Seq=15259 Ack=70977 Win=10320 Len=0 TSval=1560669113 TSecr=2578487389"
"243","11:46:11.767165","64.65.63.120","192.168.0.227","TCP","1474","443  >  55087 [ACK] Seq=70977 Ack=13673 Win=1855 Len=1408 TSval=2578487394 TSecr=1560669081 [TCP PDU reassembled in 244]"
"244","11:46:11.767166","64.65.63.120","192.168.0.227","TLSv1.2","1474","Application Data, Application Data"
"245","11:46:11.767209","192.168.0.227","64.65.63.120","TCP","66","55087  >  443 [ACK] Seq=15259 Ack=73793 Win=10276 Len=0 TSval=1560669115 TSecr=2578487394"
"246","11:46:11.767265","192.168.0.227","64.65.63.120","TCP","66","[TCP Window Update] 55087  >  443 [ACK] Seq=15259 Ack=73793 Win=10320 Len=0 TSval=1560669115 TSecr=2578487394"
"247","11:46:11.771244","64.65.63.120","192.168.0.227","TCP","66","443  >  55087 [ACK] Seq=73793 Ack=15259 Win=1843 Len=0 TSval=2578487398 TSecr=1560669086"
"248","11:46:11.799441","64.65.63.120","192.168.0.227","TCP","1474","443  >  55087 [ACK] Seq=73793 Ack=15259 Win=1843 Len=1408 TSval=2578487424 TSecr=1560669113 [TCP PDU reassembled in 250]"
"249","11:46:11.799443","64.65.63.120","192.168.0.227","TCP","1474","443  >  55087 [PSH, ACK] Seq=75201 Ack=15259 Win=1843 Len=1408 TSval=2578487424 TSecr=1560669113 [TCP PDU reassembled in 250]"
"250","11:46:11.799444","64.65.63.120","192.168.0.227","TLSv1.2","1474","Application Data"
"251","11:46:11.799445","64.65.63.120","192.168.0.227","TCP","1474","443  >  55087 [PSH, ACK] Seq=78017 Ack=15259 Win=1843 Len=1408 TSval=2578487424 TSecr=1560669113 [TCP PDU reassembled in 253]"
"252","11:46:11.799446","64.65.63.120","192.168.0.227","TCP","1474","443  >  55087 [ACK] Seq=79425 Ack=15259 Win=1843 Len=1408 TSval=2578487424 TSecr=1560669113 [TCP PDU reassembled in 253]"
"253","11:46:11.799447","64.65.63.120","192.168.0.227","TLSv1.2","1474","Application Data"
"254","11:46:11.799448","64.65.63.120","192.168.0.227","TCP","1474","443  >  55087 [ACK] Seq=82241 Ack=15259 Win=1843 Len=1408 TSval=2578487427 TSecr=1560669113 [TCP PDU reassembled in 257]"
"255","11:46:11.799613","192.168.0.227","64.65.63.120","TCP","66","55087  >  443 [ACK] Seq=15259 Ack=83649 Win=10320 Len=0 TSval=1560669148 TSecr=2578487427"
"256","11:46:11.799739","192.168.0.227","64.65.63.120","TLSv1.2","602","Application Data"
"257","11:46:11.801650","64.65.63.120","192.168.0.227","TLSv1.2","1474","Application Data"
"258","11:46:11.801651","64.65.63.120","192.168.0.227","TCP","1474","443  >  55087 [PSH, ACK] Seq=85057 Ack=15259 Win=1843 Len=1408 TSval=2578487428 TSecr=1560669115 [TCP PDU reassembled in 262]"
"259","11:46:11.801705","192.168.0.227","64.65.63.120","TCP","66","55087  >  443 [ACK] Seq=15795 Ack=86465 Win=10320 Len=0 TSval=1560669150 TSecr=2578487428"
"260","11:46:11.816205","192.87.28.82","192.168.0.227","TCP","66","9001  >  55094 [ACK] Seq=537 Ack=537 Win=1043 Len=0 TSval=2015345967 TSecr=4102696884"
"261","11:46:11.833926","64.65.63.120","192.168.0.227","TCP","1474","443  >  55087 [ACK] Seq=86465 Ack=15259 Win=1843 Len=1408 TSval=2578487459 TSecr=1560669148 [TCP PDU reassembled in 262]"
"262","11:46:11.833928","64.65.63.120","192.168.0.227","TLSv1.2","1474","Application Data"
"263","11:46:11.833930","64.65.63.120","192.168.0.227","TCP","1474","443  >  55087 [ACK] Seq=89281 Ack=15259 Win=1843 Len=1408 TSval=2578487459 TSecr=1560669148 [TCP PDU reassembled in 265]"
"264","11:46:11.833932","64.65.63.120","192.168.0.227","TCP","1474","443  >  55087 [PSH, ACK] Seq=90689 Ack=15259 Win=1843 Len=1408 TSval=2578487459 TSecr=1560669148 [TCP PDU reassembled in 265]"
"265","11:46:11.833933","64.65.63.120","192.168.0.227","TLSv1.2","1474","Application Data"
