"No.","Time","Source","Destination","Protocol","Length","Info"
"1","11:47:15.421217","17.248.214.68","192.168.0.227","TCP","66","443  >  62211 [ACK] Seq=1 Ack=1 Win=16 Len=0 TSval=2934776661 TSecr=1290374882"
"2","11:47:15.451015","192.168.0.227","5.28.195.2","TCP","78","61235  >  5222 [SYN] Seq=0 Win=65535 Len=0 MSS=1460 WS=16 TSval=4048049642 TSecr=0 SACK_PERM"
"3","11:47:15.451070","192.168.0.227","5.28.195.2","TCP","78","61233  >  80 [SYN] Seq=0 Win=65535 Len=0 MSS=1460 WS=16 TSval=3897924079 TSecr=0 SACK_PERM"
"4","11:47:15.524077","2620:1ec:bdf::45","2a02:ab88:b:4100:4977:d98a:d5e5:5d47","TLSv1.2","125","Application Data"
"5","11:47:15.524079","2620:1ec:bdf::45","2a02:ab88:b:4100:4977:d98a:d5e5:5d47","TLSv1.2","110","Application Data"
"6","11:47:15.524080","2620:1ec:bdf::45","2a02:ab88:b:4100:4977:d98a:d5e5:5d47","TCP","86","443  >  61139 [FIN, ACK] Seq=64 Ack=1 Win=148 Len=0 TSval=3892410278 TSecr=1070180966"
"7","11:47:15.524223","2a02:ab88:b:4100:4977:d98a:d5e5:5d47","2620:1ec:bdf::45","TCP","86","61139  >  443 [ACK] Seq=1 Ack=64 Win=2048 Len=0 TSval=1070270912 TSecr=3892410277"
"8","11:47:15.524291","2a02:ab88:b:4100:4977:d98a:d5e5:5d47","2620:1ec:bdf::45","TCP","86","61139  >  443 [ACK] Seq=1 Ack=65 Win=2048 Len=0 TSval=1070270912 TSecr=3892410278"
"9","11:47:15.524537","2a02:ab88:b:4100:4977:d98a:d5e5:5d47","2620:1ec:bdf::45","TCP","86","61139  >  443 [FIN, ACK] Seq=1 Ack=65 Win=2048 Len=0 TSval=1070270912 TSecr=3892410278"
"10","11:47:15.560426","2620:1ec:bdf::45","2a02:ab88:b:4100:4977:d98a:d5e5:5d47","TCP","86","443  >  61139 [ACK] Seq=65 Ack=2 Win=148 Len=0 TSval=3892410314 TSecr=1070270912"
"11","11:47:16.336194","192.168.0.227","192.87.28.82","TLSv1.2","602","Application Data"
"12","11:47:16.412566","192.87.28.82","192.168.0.227","TCP","66","9001  >  55094 [ACK] Seq=1 Ack=537 Win=1043 Len=0 TSval=2015410563 TSecr=4102761485"
"13","11:47:16.427927","64.65.63.120","192.168.0.227","TLSv1.2","602","Application Data"
"14","11:47:16.428049","192.168.0.227","64.65.63.120","TCP","66","55087  >  443 [ACK] Seq=1 Ack=537 Win=10312 Len=0 TSval=1560733779 TSecr=2578552051"
"15","11:47:16.452122","192.168.0.227","5.28.195.2","TCP","78","[TCP Retransmission] 61235  >  5222 [SYN] Seq=0 Win=65535 Len=0 MSS=1460 WS=16 TSval=4048050643 TSecr=0 SACK_PERM"
"16","11:47:16.452189","192.168.0.227","5.28.195.2","TCP","78","[TCP Retransmission] 61233  >  80 [SYN] Seq=0 Win=65535 Len=0 MSS=1460 WS=16 TSval=3897925080 TSecr=0 SACK_PERM"
"17","11:47:16.641328","192.168.0.227","64.65.63.120","TCP","54","[TCP Keep-Alive] 55087  >  443 [ACK] Seq=0 Ack=537 Win=10320 Len=0"
"18","11:47:16.678384","64.65.63.120","192.168.0.227","TCP","66","[TCP Keep-Alive ACK] 443  >  55087 [ACK] Seq=537 Ack=1 Win=1491 Len=0 TSval=2578552303 TSecr=1560733779"
"19","11:47:16.713740","149.154.167.41","192.168.0.227","SSL","171","Continuation Data"
"20","11:47:16.714010","192.168.0.227","149.154.167.41","TCP","66","59561  >  443 [ACK] Seq=1 Ack=106 Win=65530 Len=0 TSval=2752748454 TSecr=660263867"
"21","11:47:16.854461","192.168.0.227","149.154.167.41","TCP","54","[TCP Keep-Alive] 59561  >  443 [ACK] Seq=0 Ack=106 Win=65535 Len=0"
"22","11:47:16.892965","149.154.167.41","192.168.0.227","TCP","66","[TCP Keep-Alive ACK] 443  >  59561 [ACK] Seq=106 Ack=1 Win=15990 Len=0 TSval=660264047 TSecr=2752748454"
"23","11:47:17.341275","192.168.0.227","192.87.28.82","TCP","1474","55094  >  9001 [ACK] Seq=537 Ack=1 Win=7020 Len=1408 TSval=4102762490 TSecr=2015410563 [TCP PDU reassembled in 24]"
"24","11:47:17.341302","192.168.0.227","192.87.28.82","TLSv1.2","736","Application Data"
"25","11:47:17.379695","192.87.28.82","192.168.0.227","TCP","66","9001  >  55094 [ACK] Seq=1 Ack=2615 Win=1011 Len=0 TSval=2015411530 TSecr=4102762490"
"26","11:47:17.411222","192.168.0.227","5.28.195.2","TCP","78","61236  >  443 [SYN, ECE, CWR] Seq=0 Win=65535 Len=0 MSS=1460 WS=16 TSval=3591139647 TSecr=0 SACK_PERM"
"27","11:47:17.413950","64.65.63.120","192.168.0.227","TLSv1.2","602","Application Data"
"28","11:47:17.414102","192.168.0.227","64.65.63.120","TCP","66","55087  >  443 [ACK] Seq=1 Ack=1073 Win=10312 Len=0 TSval=1560734765 TSecr=2578553038"
"29","11:47:17.435338","64.65.63.120","192.168.0.227","TLSv1.2","1474","Application Data"
"30","11:47:17.435462","192.168.0.227","64.65.63.120","TCP","66","55087  >  443 [ACK] Seq=1 Ack=2481 Win=10298 Len=0 TSval=1560734786 TSecr=2578553062"
"31","11:47:17.448165","5.28.195.2","192.168.0.227","TCP","74","443  >  61236 [SYN, ACK, ECE] Seq=0 Ack=1 Win=65535 Len=0 MSS=1240 SACK_PERM TSval=2565539404 TSecr=3591139647 WS=1024"
"32","11:47:17.448415","192.168.0.227","5.28.195.2","TCP","66","61236  >  443 [ACK] Seq=1 Ack=1 Win=1048560 Len=0 TSval=3591139684 TSecr=2565539404"
"33","11:47:17.448622","192.168.0.227","5.28.195.2","TLSv1","583","Client Hello"
"34","11:47:17.450007","64.65.63.120","192.168.0.227","TLSv1.2","244","Application Data"
"35","11:47:17.450096","192.168.0.227","64.65.63.120","TCP","66","55087  >  443 [ACK] Seq=1 Ack=2659 Win=10318 Len=0 TSval=1560734801 TSecr=2578553077"
"36","11:47:17.453593","192.168.0.227","5.28.195.2","TCP","78","[TCP Retransmission] 61235  >  5222 [SYN] Seq=0 Win=65535 Len=0 MSS=1460 WS=16 TSval=4048051644 TSecr=0 SACK_PERM"
"37","11:47:17.453630","192.168.0.227","5.28.195.2","TCP","78","[TCP Retransmission] 61233  >  80 [SYN] Seq=0 Win=65535 Len=0 MSS=1460 WS=16 TSval=3897926081 TSecr=0 SACK_PERM"
"38","11:47:17.490097","5.28.195.2","192.168.0.227","TCP","66","443  >  61236 [ACK] Seq=1 Ack=518 Win=67584 Len=0 TSval=2565539460 TSecr=3591139684"
"39","11:47:17.492634","5.28.195.2","192.168.0.227","TCP","66","443  >  61236 [FIN, ACK] Seq=1 Ack=518 Win=67584 Len=0 TSval=2565539460 TSecr=3591139684"
"40","11:47:17.492748","192.168.0.227","5.28.195.2","TCP","66","61236  >  443 [ACK] Seq=518 Ack=2 Win=1048560 Len=0 TSval=3591139728 TSecr=2565539460"
"41","11:47:17.492999","192.168.0.227","5.28.195.2","TCP","66","61236  >  443 [FIN, ACK] Seq=518 Ack=2 Win=1048560 Len=0 TSval=3591139729 TSecr=2565539460"
"42","11:47:17.535076","5.28.195.2","192.168.0.227","TCP","56","443  >  61236 [RST] Seq=2 Win=0 Len=0"
"43","11:47:17.663947","192.168.0.227","64.65.63.120","TCP","54","[TCP Keep-Alive] 55087  >  443 [ACK] Seq=0 Ack=2659 Win=10320 Len=0"
"44","11:47:17.700234","64.65.63.120","192.168.0.227","TCP","66","[TCP Keep-Alive ACK] 443  >  55087 [ACK] Seq=2659 Ack=1 Win=1491 Len=0 TSval=2578553323 TSecr=1560734801"
"45","11:47:18.346417","192.168.0.227","192.87.28.82","TLSv1.2","602","Application Data"
"46","11:47:18.421862","192.87.28.82","192.168.0.227","TCP","66","9001  >  55094 [ACK] Seq=1 Ack=3151 Win=1043 Len=0 TSval=2015412573 TSecr=4102763495"
"47","11:47:18.768914","192.168.0.227","192.87.28.82","TCP","1474","55094  >  9001 [ACK] Seq=3151 Ack=1 Win=7020 Len=1408 TSval=4102763918 TSecr=2015412573 [TCP PDU reassembled in 48]"
"48","11:47:18.768931","192.168.0.227","192.87.28.82","TLSv1.2","222","Application Data"
"49","11:47:18.804637","192.87.28.82","192.168.0.227","TCP","66","9001  >  55094 [ACK] Seq=1 Ack=4715 Win=1019 Len=0 TSval=2015412954 TSecr=4102763918"
"50","11:47:18.849614","192.87.28.82","192.168.0.227","TLSv1.2","602","Application Data"
"51","11:47:18.849780","192.168.0.227","192.87.28.82","TCP","66","55094  >  9001 [ACK] Seq=4715 Ack=537 Win=7012 Len=0 TSval=4102763999 TSecr=2015413000"
"52","11:47:18.859618","64.65.63.120","192.168.0.227","TCP","1474","443  >  55087 [ACK] Seq=2659 Ack=1 Win=1491 Len=1408 TSval=2578554483 TSecr=1560734801 [TCP PDU reassembled in 56]"
"53","11:47:18.859756","192.168.0.227","64.65.63.120","TCP","66","55087  >  443 [ACK] Seq=1 Ack=4067 Win=10298 Len=0 TSval=1560736211 TSecr=2578554483"
"54","11:47:18.861738","64.65.63.120","192.168.0.227","TCP","1474","443  >  55087 [PSH, ACK] Seq=4067 Ack=1 Win=1491 Len=1408 TSval=2578554483 TSecr=1560734801 [TCP PDU reassembled in 56]"
"55","11:47:18.861792","192.168.0.227","64.65.63.120","TCP","66","55087  >  443 [ACK] Seq=1 Ack=5475 Win=10298 Len=0 TSval=1560736213 TSecr=2578554483"
"56","11:47:18.862669","64.65.63.120","192.168.0.227","TLSv1.2","1320","Application Data"
"57","11:47:18.862672","64.65.63.120","192.168.0.227","TCP","1474","443  >  55087 [ACK] Seq=6729 Ack=1 Win=1491 Len=1408 TSval=2578554483 TSecr=1560734801 [TCP PDU reassembled in 62]"
"58","11:47:18.862674","64.65.63.120","192.168.0.227","TCP","1474","443  >  55087 [PSH, ACK] Seq=8137 Ack=1 Win=1491 Len=1408 TSval=2578554483 TSecr=1560734801 [TCP PDU reassembled in 62]"
"59","11:47:18.862733","192.168.0.227","64.65.63.120","TCP","66","55087  >  443 [ACK] Seq=1 Ack=9545 Win=10257 Len=0 TSval=1560736214 TSecr=2578554483"
"60","11:47:18.862829","192.168.0.227","64.65.63.120","TCP","66","[TCP Window Update] 55087  >  443 [ACK] Seq=1 Ack=9545 Win=10320 Len=0 TSval=1560736214 TSecr=2578554483"
"61","11:47:18.862926","192.168.0.227","64.65.63.120","TLSv1.2","602","Application Data"
"62","11:47:18.881334","64.65.63.120","192.168.0.227","TLSv1.2","1474","Application Data"
"63","11:47:18.881338","64.65.63.120","192.168.0.227","TCP","1474","443  >  55087 [PSH, ACK] Seq=10953 Ack=1 Win=1491 Len=1408 TSval=2578554498 TSecr=1560734801 [TCP PDU reassembled in 65]"
"64","11:47:18.881340","64.65.63.120","192.168.0.227","TCP","1474","443  >  55087 [ACK] Seq=12361 Ack=1 Win=1491 Len=1408 TSval=2578554498 TSecr=1560734801 [TCP PDU reassembled in 65]"
"65","11:47:18.881342","64.65.63.120","192.168.0.227","TLSv1.2","1474","Application Data, Application Data"
"66","11:47:18.881343","64.65.63.120","192.168.0.227","TCP","1474","443  >  55087 [PSH, ACK] Seq=15177 Ack=1 Win=1491 Len=1408 TSval=2578554502 TSecr=1560734801 [TCP PDU reassembled in 71]"
"67","11:47:18.881524","192.168.0.227","64.65.63.120","TCP","66","55087  >  443 [ACK] Seq=537 Ack=10953 Win=10298 Len=0 TSval=1560736232 TSecr=2578554498"
"68","11:47:18.881594","192.168.0.227","64.65.63.120","TCP","66","55087  >  443 [ACK] Seq=537 Ack=16585 Win=10210 Len=0 TSval=1560736232 TSecr=2578554502"
"69","11:47:18.881646","192.168.0.227","64.65.63.120","TCP","66","[TCP Window Update] 55087  >  443 [ACK] Seq=537 Ack=16585 Win=10320 Len=0 TSval=1560736232 TSecr=2578554502"
"70","11:47:18.903683","64.65.63.120","192.168.0.227","TCP","1474","443  >  55087 [ACK] Seq=16585 Ack=1 Win=1491 Len=1408 TSval=2578554529 TSecr=1560736211 [TCP PDU reassembled in 71]"
"71","11:47:18.903688","64.65.63.120","192.168.0.227","TLSv1.2","1474","Application Data"
"72","11:47:18.903690","64.65.63.120","192.168.0.227","TCP","1474","443  >  55087 [ACK] Seq=19401 Ack=1 Win=1491 Len=1408 TSval=2578554529 TSecr=1560736213 [TCP PDU reassembled in 74]"
"73","11:47:18.903693","64.65.63.120","192.168.0.227","TCP","1474","443  >  55087 [PSH, ACK] Seq=20809 Ack=1 Win=1491 Len=1408 TSval=2578554529 TSecr=1560736213 [TCP PDU reassembled in 74]"
"74","11:47:18.903695","64.65.63.120","192.168.0.227","TLSv1.2","1474","Application Data"
"75","11:47:18.903697","64.65.63.120","192.168.0.227","TCP","1474","443  >  55087 [PSH, ACK] Seq=23625 Ack=1 Win=1491 Len=1408 TSval=2578554529 TSecr=1560736214 [TCP PDU reassembled in 77]"
"76","11:47:18.903699","64.65.63.120","192.168.0.227","TCP","1474","443  >  55087 [ACK] Seq=25033 Ack=1 Win=1491 Len=1408 TSval=2578554529 TSecr=1560736214 [TCP PDU reassembled in 77]"
"77","11:47:18.903702","64.65.63.120","192.168.0.227","TLSv1.2","1474","Application Data"
"78","11:47:18.903705","64.65.63.120","192.168.0.227","TCP","1474","443  >  55087 [ACK] Seq=27849 Ack=1 Win=1491 Len=1408 TSval=2578554529 TSecr=1560736214 [TCP PDU reassembled in 79]"
"79","11:47:18.903708","64.65.63.120","192.168.0.227","TLSv1.2","1422","Application Data, Application Data"
"80","11:47:18.903907","192.168.0.227","64.65.63.120","TCP","66","55087  >  443 [ACK] Seq=537 Ack=30613 Win=10101 Len=0 TSval=1560736255 TSecr=2578554529"
"81","11:47:18.904071","192.168.0.227","64.65.63.120","TCP","66","[TCP Window Update] 55087  >  443 [ACK] Seq=537 Ack=30613 Win=10320 Len=0 TSval=1560736255 TSecr=2578554529"
"82","11:47:18.906916","64.65.63.120","192.168.0.227","TCP","66","443  >  55087 [ACK] Seq=30613 Ack=537 Win=1487 Len=0 TSval=2578554533 TSecr=1560736214"
"83","11:47:18.907023","192.168.0.227","64.65.63.120","TLSv1.2","602","Application Data"
"84","11:47:18.918129","64.65.63.120","192.168.0.227","TCP","1474","443  >  55087 [ACK] Seq=30613 Ack=537 Win=1491 Len=1408 TSval=2578554543 TSecr=1560736232 [TCP PDU reassembled in 86]"
"85","11:47:18.918131","64.65.63.120","192.168.0.227","TCP","1474","443  >  55087 [PSH, ACK] Seq=32021 Ack=537 Win=1491 Len=1408 TSval=2578554543 TSecr=1560736232 [TCP PDU reassembled in 86]"
"86","11:47:18.918132","64.65.63.120","192.168.0.227","TLSv1.2","1474","Application Data"
"87","11:47:18.918133","64.65.63.120","192.168.0.227","TCP","1474","443  >  55087 [PSH, ACK] Seq=34837 Ack=537 Win=1491 Len=1408 TSval=2578554543 TSecr=1560736232 [TCP PDU reassembled in 89]"
"88","11:47:18.918135","64.65.63.120","192.168.0.227","TCP","1474","443  >  55087 [ACK] Seq=36245 Ack=537 Win=1491 Len=1408 TSval=2578554543 TSecr=1560736232 [TCP PDU reassembled in 89]"
"89","11:47:18.918136","64.65.63.120","192.168.0.227","TLSv1.2","1474","Application Data"
"90","11:47:18.918137","64.65.63.120","192.168.0.227","TCP","1474","443  >  55087 [ACK] Seq=39061 Ack=537 Win=1491 Len=1408 TSval=2578554543 TSecr=1560736232 [TCP PDU reassembled in 92]"
"91","11:47:18.918139","64.65.63.120","192.168.0.227","TCP","1474","443  >  55087 [PSH, ACK] Seq=40469 Ack=537 Win=1491 Len=1408 TSval=2578554543 TSecr=1560736232 [TCP PDU reassembled in 92]"
"92","11:47:18.918140","64.65.63.120","192.168.0.227","TLSv1.2","1474","Application Data"
"93","11:47:18.918141","64.65.63.120","192.168.0.227","TCP","1474","443  >  55087 [PSH, ACK] Seq=43285 Ack=537 Win=1491 Len=1408 TSval=2578554543 TSecr=1560736232 [TCP PDU reassembled in 97]"
"94","11:47:18.918254","192.168.0.227","64.65.63.120","TCP","66","55087  >  443 [ACK] Seq=1073 Ack=44693 Win=10100 Len=0 TSval=1560736269 TSecr=2578554543"
"95","11:47:18.918394","192.168.0.227","64.65.63.120","TCP","66","[TCP Window Update] 55087  >  443 [ACK] Seq=1073 Ack=44693 Win=10320 Len=0 TSval=1560736269 TSecr=2578554543"
"96","11:47:18.939032","64.65.63.120","192.168.0.227","TCP","1474","443  >  55087 [ACK] Seq=44693 Ack=537 Win=1491 Len=1408 TSval=2578554564 TSecr=1560736255 [TCP PDU reassembled in 97]"
"97","11:47:18.939034","64.65.63.120","192.168.0.227","TLSv1.2","1474","Application Data, Application Data"
"98","11:47:18.939036","64.65.63.120","192.168.0.227","TCP","1474","443  >  55087 [ACK] Seq=47509 Ack=537 Win=1491 Len=1408 TSval=2578554564 TSecr=1560736255 [TCP PDU reassembled in 99]"
"99","11:47:18.939037","64.65.63.120","192.168.0.227","TLSv1.2","1474","Application Data"
"100","11:47:18.939038","64.65.63.120","192.168.0.227","TLSv1.2","1474","Application Data"
"101","11:47:18.939039","64.65.63.120","192.168.0.227","TCP","1474","443  >  55087 [PSH, ACK] Seq=51733 Ack=537 Win=1491 Len=1408 TSval=2578554564 TSecr=1560736255 [TCP PDU reassembled in 103]"
"102","11:47:18.939040","64.65.63.120","192.168.0.227","TCP","1474","443  >  55087 [ACK] Seq=53141 Ack=537 Win=1491 Len=1408 TSval=2578554564 TSecr=1560736255 [TCP PDU reassembled in 103]"
"103","11:47:18.939042","64.65.63.120","192.168.0.227","TLSv1.2","1474","Application Data"
"104","11:47:18.939043","64.65.63.120","192.168.0.227","TCP","1474","443  >  55087 [ACK] Seq=55957 Ack=537 Win=1491 Len=1408 TSval=2578554564 TSecr=1560736255 [TCP PDU reassembled in 106]"
"105","11:47:18.939044","64.65.63.120","192.168.0.227","TCP","1474","443  >  55087 [PSH, ACK] Seq=57365 Ack=537 Win=1491 Len=1408 TSval=2578554564 TSecr=1560736255 [TCP PDU reassembled in 106]"
"106","11:47:18.939045","64.65.63.120","192.168.0.227","TLSv1.2","1474","Application Data"
"107","11:47:18.939046","64.65.63.120","192.168.0.227","TCP","1474","443  >  55087 [PSH, ACK] Seq=60181 Ack=537 Win=1491 Len=1408 TSval=2578554564 TSecr=1560736255 [TCP PDU reassembled in 109]"
"108","11:47:18.939048","64.65.63.120","192.168.0.227","TCP","1474","443  >  55087 [ACK] Seq=61589 Ack=537 Win=1491 Len=1408 TSval=2578554564 TSecr=1560736255 [TCP PDU reassembled in 109]"
"109","11:47:18.939049","64.65.63.120","192.168.0.227","TLSv1.2","1474","Application Data"
"110","11:47:18.939050","64.65.63.120","192.168.0.227","TCP","1474","443  >  55087 [ACK] Seq=64405 Ack=537 Win=1491 Len=1408 TSval=2578554564 TSecr=1560736255 [TCP PDU reassembled in 115]"
"111","11:47:18.939052","64.65.63.120","192.168.0.227","TCP","1474","443  >  55087 [PSH, ACK] Seq=65813 Ack=537 Win=1491 Len=1408 TSval=2578554564 TSecr=1560736255 [TCP PDU reassembled in 115]"
"112","11:47:18.939181","192.168.0.227","64.65.63.120","TLSv1.2","602","Application Data"
"113","11:47:18.939216","192.168.0.227","64.65.63.120","TCP","66","55087  >  443 [ACK] Seq=1609 Ack=67221 Win=9968 Len=0 TSval=1560736290 TSecr=2578554564"
"114","11:47:18.939508","192.168.0.227","64.65.63.120","TLSv1.2","602","Application Data"
"115","11:47:18.940915","64.65.63.120","192.168.0.227","TLSv1.2","1474","Application Data, Application Data"
"116","11:47:18.940918","64.65.63.120","192.168.0.227","TCP","1474","443  >  55087 [PSH, ACK] Seq=68629 Ack=537 Win=1491 Len=1408 TSval=2578554564 TSecr=1560736255 [TCP PDU reassembled in 118]"
"117","11:47:18.940919","64.65.63.120","192.168.0.227","TCP","1474","443  >  55087 [ACK] Seq=70037 Ack=537 Win=1491 Len=1408 TSval=2578554564 TSecr=1560736255 [TCP PDU reassembled in 118]"
"118","11:47:18.940920","64.65.63.120","192.168.0.227","TLSv1.2","1474","Application Data, Application Data"
"119","11:47:18.941059","192.168.0.227","64.65.63.120","TCP","66","55087  >  443 [ACK] Seq=2145 Ack=72853 Win=10320 Len=0 TSval=1560736292 TSecr=2578554564"
"120","11:47:18.952364","64.65.63.120","192.168.0.227","TCP","1474","443  >  55087 [ACK] Seq=72853 Ack=1073 Win=1491 Len=1408 TSval=2578554577 TSecr=1560736258 [TCP PDU reassembled in 122]"
"121","11:47:18.952367","64.65.63.120","192.168.0.227","TCP","1474","443  >  55087 [PSH, ACK] Seq=74261 Ack=1073 Win=1491 Len=1408 TSval=2578554577 TSecr=1560736258 [TCP PDU reassembled in 122]"
"122","11:47:18.952368","64.65.63.120","192.168.0.227","TLSv1.2","1474","Application Data"
"123","11:47:18.952370","64.65.63.120","192.168.0.227","TCP","1474","443  >  55087 [PSH, ACK] Seq=77077 Ack=1073 Win=1491 Len=1408 TSval=2578554577 TSecr=1560736258 [TCP PDU reassembled in 125]"
"124","11:47:18.952371","64.65.63.120","192.168.0.227","TCP","1474","443  >  55087 [ACK] Seq=78485 Ack=1073 Win=1491 Len=1408 TSval=2578554577 TSecr=1560736258 [TCP PDU reassembled in 125]"
"125","11:47:18.952372","64.65.63.120","192.168.0.227","TLSv1.2","1474","Application Data"
"126","11:47:18.952373","64.65.63.120","192.168.0.227","TCP","1474","443  >  55087 [ACK] Seq=81301 Ack=1073 Win=1491 Len=1408 TSval=2578554577 TSecr=1560736258 [TCP PDU reassembled in 128]"
"127","11:47:18.952375","64.65.63.120","192.168.0.227","TCP","1474","443  >  55087 [PSH, ACK] Seq=82709 Ack=1073 Win=1491 Len=1408 TSval=2578554577 TSecr=1560736258 [TCP PDU reassembled in 128]"
"128","11:47:18.952376","64.65.63.120","192.168.0.227","TLSv1.2","1474","Application Data"
"129","11:47:18.952377","64.65.63.120","192.168.0.227","TCP","1474","443  >  55087 [PSH, ACK] Seq=85525 Ack=1073 Win=1491 Len=1408 TSval=2578554577 TSecr=1560736258 [TCP PDU reassembled in 131]"
"130","11:47:18.952378","64.65.63.120","192.168.0.227","TCP","1474","443  >  55087 [ACK] Seq=86933 Ack=1073 Win=1491 Len=1408 TSval=2578554577 TSecr=1560736258 [TCP PDU reassembled in 131]"
"131","11:47:18.952379","64.65.63.120","192.168.0.227","TLSv1.2","1474","Application Data, Application Data"
"132","11:47:18.952380","64.65.63.120","192.168.0.227","TCP","1474","443  >  55087 [ACK] Seq=89749 Ack=1073 Win=1491 Len=1408 TSval=2578554577 TSecr=1560736258 [TCP PDU reassembled in 134]"
"133","11:47:18.952381","64.65.63.120","192.168.0.227","TCP","1474","443  >  55087 [PSH, ACK] Seq=91157 Ack=1073 Win=1491 Len=1408 TSval=2578554577 TSecr=1560736258 [TCP PDU reassembled in 134]"
"134","11:47:18.952382","64.65.63.120","192.168.0.227","TLSv1.2","1474","Application Data"
"135","11:47:18.952383","64.65.63.120","192.168.0.227","TCP","1474","443  >  55087 [PSH, ACK] Seq=93973 Ack=1073 Win=1491 Len=1408 TSval=2578554577 TSecr=1560736258 [TCP PDU reassembled in 140]"
"136","11:47:18.952508","192.168.0.227","64.65.63.120","TLSv1.2","602","Application Data"
"137","11:47:18.953040","192.168.0.227","64.65.63.120","TLSv1.2","602","Application Data"
"138","11:47:18.970330","192.168.0.227","192.87.28.82","TLSv1.2","602","Application Data"
"139","11:47:18.972303","64.65.63.120","192.168.0.227","TCP","1474","443  >  55087 [ACK] Seq=95381 Ack=1609 Win=1487 Len=1408 TSval=2578554599 TSecr=1560736290 [TCP PDU reassembled in 140]"
"140","11:47:18.972305","64.65.63.120","192.168.0.227","TLSv1.2","1474","Application Data"
"141","11:47:18.972307","64.65.63.120","192.168.0.227","TLSv1.2","814","Application Data"
"142","11:47:18.972415","192.168.0.227","64.65.63.120","TCP","66","55087  >  443 [ACK] Seq=3217 Ack=98945 Win=10265 Len=0 TSval=1560736323 TSecr=2578554599"
"143","11:47:18.972502","192.168.0.227","64.65.63.120","TCP","66","[TCP Window Update] 55087  >  443 [ACK] Seq=3217 Ack=98945 Win=10320 Len=0 TSval=1560736323 TSecr=2578554599"
"144","11:47:18.988967","64.65.63.120","192.168.0.227","TCP","66","443  >  55087 [ACK] Seq=98945 Ack=2681 Win=1482 Len=0 TSval=2578554613 TSecr=1560736290"
"145","11:47:19.033015","64.65.63.120","192.168.0.227","TCP","66","443  >  55087 [ACK] Seq=98945 Ack=3217 Win=1491 Len=0 TSval=2578554660 TSecr=1560736304"
"146","11:47:19.042138","192.87.28.82","192.168.0.227","TCP","66","9001  >  55094 [ACK] Seq=537 Ack=5251 Win=1043 Len=0 TSval=2015413195 TSecr=4102764119"
"147","11:47:19.380127","192.168.0.227","192.87.28.82","TLSv1.2","602","Application Data"
"148","11:47:19.381824","192.87.28.82","192.168.0.227","TLSv1.2","602","Application Data"
"149","11:47:19.381880","192.168.0.227","192.87.28.82","TCP","66","55094  >  9001 [ACK] Seq=5787 Ack=1073 Win=7012 Len=0 TSval=4102764531 TSecr=2015413472"
"150","11:47:19.391975","192.168.0.227","64.65.63.120","TLSv1.2","602","Application Data"
"151","11:47:19.425242","64.65.63.120","192.168.0.227","TCP","66","443  >  55087 [ACK] Seq=98945 Ack=3753 Win=1487 Len=0 TSval=2578555052 TSecr=1560736743"
"152","11:47:19.450230","192.168.0.227","5.28.195.2","TCP","78","61237  >  443 [SYN, ECE, CWR] Seq=0 Win=65535 Len=0 MSS=1460 WS=16 TSval=3087920158 TSecr=0 SACK_PERM"
"153","11:47:19.450256","192.168.0.227","5.28.195.2","TCP","78","61238  >  80 [SYN, ECE, CWR] Seq=0 Win=65535 Len=0 MSS=1460 WS=16 TSval=2708784843 TSecr=0 SACK_PERM"
"154","11:47:19.450317","192.168.0.227","5.28.195.2","TCP","78","61239  >  5222 [SYN, ECE, CWR] Seq=0 Win=65535 Len=0 MSS=1460 WS=16 TSval=3485019890 TSecr=0 SACK_PERM"
"155","11:47:19.451614","192.87.28.82","192.168.0.227","TCP","66","9001  >  55094 [ACK] Seq=1073 Ack=5787 Win=1043 Len=0 TSval=2015413605 TSecr=4102764529"
"156","11:47:19.451669","192.168.0.227","192.87.28.82","TLSv1.2","1138","Application Data, Application Data"
"157","11:47:19.476468","192.168.0.227","192.87.28.82","TLSv1.2","1474","Application Data"
"158","11:47:19.476470","192.168.0.227","192.87.28.82","TCP","1474","55094  >  9001 [ACK] Seq=8267 Ack=1073 Win=7020 Len=1408 TSval=4102764625 TSecr=2015413605 [TCP PDU reassembled in 159]"
"159","11:47:19.476486","192.168.0.227","192.87.28.82","TLSv1.2","378","Application Data"
"160","11:47:19.485552","64.65.63.120","192.168.0.227","TLSv1.2","602","Application Data"
"161","11:47:19.485555","5.28.195.2","192.168.0.227","TCP","74","443  >  61237 [SYN, ACK, ECE] Seq=0 Ack=1 Win=65535 Len=0 MSS=1240 SACK_PERM TSval=1880210459 TSecr=3087920158 WS=1024"
"162","11:47:19.485729","192.168.0.227","5.28.195.2","TCP","66","61237  >  443 [ACK] Seq=1 Ack=1 Win=1048560 Len=0 TSval=3087920193 TSecr=1880210459"
"163","11:47:19.485786","192.168.0.227","64.65.63.120","TCP","66","55087  >  443 [ACK] Seq=3753 Ack=99481 Win=10312 Len=0 TSval=1560736837 TSecr=2578555112"
"164","11:47:19.485991","192.168.0.227","5.28.195.2","TLSv1","583","Client Hello"
"165","11:47:19.510070","192.87.28.82","192.168.0.227","TCP","66","9001  >  55094 [ACK] Seq=1073 Ack=8267 Win=1021 Len=0 TSval=2015413663 TSecr=4102764601"
"166","11:47:19.510073","192.87.28.82","192.168.0.227","TCP","66","9001  >  55094 [ACK] Seq=1073 Ack=9987 Win=995 Len=0 TSval=2015413663 TSecr=4102764625"
"167","11:47:19.523846","5.28.195.2","192.168.0.227","TCP","66","443  >  61237 [ACK] Seq=1 Ack=518 Win=67584 Len=0 TSval=1880210495 TSecr=3087920194"
"168","11:47:19.523848","5.28.195.2","192.168.0.227","TCP","66","443  >  61237 [FIN, ACK] Seq=1 Ack=518 Win=67584 Len=0 TSval=1880210495 TSecr=3087920194"
"169","11:47:19.523952","192.168.0.227","5.28.195.2","TCP","66","61237  >  443 [ACK] Seq=518 Ack=2 Win=1048560 Len=0 TSval=3087920232 TSecr=1880210495"
"170","11:47:19.524163","192.168.0.227","5.28.195.2","TCP","66","61237  >  443 [FIN, ACK] Seq=518 Ack=2 Win=1048560 Len=0 TSval=3087920232 TSecr=1880210495"
"171","11:47:19.543981","192.168.0.227","192.87.28.82","TLSv1.2","602","Application Data"
"172","11:47:19.563619","5.28.195.2","192.168.0.227","TCP","56","443  >  61237 [RST] Seq=2 Win=0 Len=0"
"173","11:47:19.574600","64.65.63.120","192.168.0.227","TLSv1.2","602","Application Data"
"174","11:47:19.574734","192.168.0.227","64.65.63.120","TCP","66","55087  >  443 [ACK] Seq=3753 Ack=100017 Win=10312 Len=0 TSval=1560736926 TSecr=2578555201"
"175","11:47:19.616032","192.87.28.82","192.168.0.227","TCP","66","9001  >  55094 [ACK] Seq=1073 Ack=10523 Win=1043 Len=0 TSval=2015413769 TSecr=4102764693"
"176","11:47:19.616171","192.168.0.227","192.87.28.82","TLSv1.2","602","Application Data"
"177","11:47:19.632568","192.168.0.227","192.87.28.82","TCP","1474","55094  >  9001 [ACK] Seq=11059 Ack=1073 Win=7020 Len=1408 TSval=4102764781 TSecr=2015413769 [TCP PDU reassembled in 178]"
"178","11:47:19.632588","192.168.0.227","192.87.28.82","TLSv1.2","736","Application Data"
"179","11:47:19.648039","64.65.63.120","192.168.0.227","TLSv1.2","1116","Application Data"
"180","11:47:19.648169","192.168.0.227","64.65.63.120","TCP","66","55087  >  443 [ACK] Seq=3753 Ack=101067 Win=10304 Len=0 TSval=1560736999 TSecr=2578555274"
"181","11:47:19.664755","192.87.28.82","192.168.0.227","TCP","66","9001  >  55094 [ACK] Seq=1073 Ack=12467 Win=1021 Len=0 TSval=2015413817 TSecr=4102764765"
"182","11:47:19.689234","64.65.63.120","192.168.0.227","TLSv1.2","602","Application Data"
"183","11:47:19.689371","192.168.0.227","64.65.63.120","TCP","66","55087  >  443 [ACK] Seq=3753 Ack=101603 Win=10312 Len=0 TSval=1560737040 TSecr=2578555316"
"184","11:47:19.703900","192.87.28.82","192.168.0.227","TCP","66","9001  >  55094 [ACK] Seq=1073 Ack=13137 Win=1043 Len=0 TSval=2015413857 TSecr=4102764781"
"185","11:47:19.715910","64.65.63.120","192.168.0.227","TCP","1474","443  >  55087 [ACK] Seq=101603 Ack=3753 Win=1491 Len=1408 TSval=2578555342 TSecr=1560736999 [TCP PDU reassembled in 187]"
"186","11:47:19.716039","192.168.0.227","64.65.63.120","TCP","66","55087  >  443 [ACK] Seq=3753 Ack=103011 Win=10298 Len=0 TSval=1560737067 TSecr=2578555342"
"187","11:47:19.724403","64.65.63.120","192.168.0.227","TLSv1.2","222","Application Data"
"188","11:47:19.724498","192.168.0.227","64.65.63.120","TCP","66","55087  >  443 [ACK] Seq=3753 Ack=103167 Win=10318 Len=0 TSval=1560737075 TSecr=2578555351"
"189","11:47:19.724659","192.168.0.227","64.65.63.120","TLSv1.2","602","Application Data"
"190","11:47:19.749073","64.65.63.120","192.168.0.227","TLSv1.2","1474","Application Data"
"191","11:47:19.749076","64.65.63.120","192.168.0.227","TCP","1474","443  >  55087 [PSH, ACK] Seq=104575 Ack=3753 Win=1491 Len=1408 TSval=2578555375 TSecr=1560737040 [TCP PDU reassembled in 194]"
"192","11:47:19.749218","192.168.0.227","64.65.63.120","TCP","66","55087  >  443 [ACK] Seq=4289 Ack=105983 Win=10276 Len=0 TSval=1560737100 TSecr=2578555375"
"193","11:47:19.749393","192.168.0.227","64.65.63.120","TCP","66","[TCP Window Update] 55087  >  443 [ACK] Seq=4289 Ack=105983 Win=10320 Len=0 TSval=1560737100 TSecr=2578555375"
"194","11:47:19.758477","64.65.63.120","192.168.0.227","TLSv1.2","1406","Application Data"
"195","11:47:19.758608","192.168.0.227","64.65.63.120","TCP","66","55087  >  443 [ACK] Seq=4289 Ack=107323 Win=10300 Len=0 TSval=1560737109 TSecr=2578555385"
"196","11:47:19.762178","64.65.63.120","192.168.0.227","TCP","66","443  >  55087 [ACK] Seq=107323 Ack=4289 Win=1487 Len=0 TSval=2578555388 TSecr=1560737076"
"197","11:47:19.828747","192.168.0.227","192.87.28.82","TLSv1.2","602","Application Data"
"198","11:47:19.901269","192.87.28.82","192.168.0.227","TCP","66","9001  >  55094 [ACK] Seq=1073 Ack=13673 Win=1043 Len=0 TSval=2015414054 TSecr=4102764978"
"199","11:47:19.932952","64.65.63.120","192.168.0.227","TCP","1474","443  >  55087 [ACK] Seq=107323 Ack=4289 Win=1491 Len=1408 TSval=2578555559 TSecr=1560737109 [TCP PDU reassembled in 200]"
"200","11:47:19.932954","64.65.63.120","192.168.0.227","TLSv1.2","736","Application Data"
"201","11:47:19.933092","192.168.0.227","64.65.63.120","TCP","66","55087  >  443 [ACK] Seq=4289 Ack=109401 Win=10288 Len=0 TSval=1560737284 TSecr=2578555559"
"202","11:47:20.033408","192.168.0.227","192.87.28.82","TLSv1.2","602","Application Data"
"203","11:47:20.048306","192.168.0.227","5.28.195.2","TCP","78","61241  >  443 [SYN, ECE, CWR] Seq=0 Win=65535 Len=0 MSS=1460 WS=16 TSval=1132200940 TSecr=0 SACK_PERM"
"204","11:47:20.085726","5.28.195.2","192.168.0.227","TCP","74","443  >  61241 [SYN, ACK, ECE] Seq=0 Ack=1 Win=65535 Len=0 MSS=1240 SACK_PERM TSval=2040512959 TSecr=1132200940 WS=1024"
"205","11:47:20.085855","192.168.0.227","5.28.195.2","TCP","66","61241  >  443 [ACK] Seq=1 Ack=1 Win=1048560 Len=0 TSval=1132200978 TSecr=2040512959"
"206","11:47:20.086011","192.168.0.227","5.28.195.2","TLSv1","583","Client Hello"
"207","11:47:20.104829","192.87.28.82","192.168.0.227","TCP","66","9001  >  55094 [ACK] Seq=1073 Ack=14209 Win=1043 Len=0 TSval=2015414258 TSecr=4102765182"
"208","11:47:20.115602","64.65.63.120","192.168.0.227","TLSv1.2","602","Application Data"
"209","11:47:20.115730","192.168.0.227","64.65.63.120","TCP","66","55087  >  443 [ACK] Seq=4289 Ack=109937 Win=10312 Len=0 TSval=1560737467 TSecr=2578555742"
"210","11:47:20.116508","192.168.0.227","192.87.28.82","TCP","1474","55094  >  9001 [ACK] Seq=14209 Ack=1073 Win=7020 Len=1408 TSval=4102765265 TSecr=2015414258 [TCP PDU reassembled in 211]"
"211","11:47:20.116526","192.168.0.227","192.87.28.82","TLSv1.2","736","Application Data"
"212","11:47:20.123985","192.87.28.82","192.168.0.227","TLSv1.2","1116","Application Data"
"213","11:47:20.123987","5.28.195.2","192.168.0.227","TCP","66","443  >  61241 [ACK] Seq=1 Ack=518 Win=67584 Len=0 TSval=2040512998 TSecr=1132200978"
"214","11:47:20.123988","5.28.195.2","192.168.0.227","TCP","66","443  >  61241 [FIN, ACK] Seq=1 Ack=518 Win=67584 Len=0 TSval=2040512998 TSecr=1132200978"
"215","11:47:20.124078","192.168.0.227","192.87.28.82","TCP","66","55094  >  9001 [ACK] Seq=16287 Ack=2123 Win=7004 Len=0 TSval=4102765273 TSecr=2015414276"
"216","11:47:20.124130","192.168.0.227","5.28.195.2","TCP","66","61241  >  443 [ACK] Seq=518 Ack=2 Win=1048560 Len=0 TSval=1132201016 TSecr=2040512998"
"217","11:47:20.124263","192.168.0.227","5.28.195.2","TCP","66","61241  >  443 [FIN, ACK] Seq=518 Ack=2 Win=1048560 Len=0 TSval=1132201016 TSecr=2040512998"
"218","11:47:20.140780","192.168.0.227","192.87.28.82","TLSv1.2","1474","Application Data, Application Data"
"219","11:47:20.140782","192.168.0.227","192.87.28.82","TCP","1474","55094  >  9001 [ACK] Seq=17695 Ack=2123 Win=7020 Len=1408 TSval=4102765290 TSecr=2015414276 [TCP PDU reassembled in 221]"
"220","11:47:20.140782","192.168.0.227","192.87.28.82","TCP","1474","55094  >  9001 [ACK] Seq=19103 Ack=2123 Win=7020 Len=1408 TSval=4102765290 TSecr=2015414276 [TCP PDU reassembled in 221]"
"221","11:47:20.140799","192.168.0.227","192.87.28.82","TLSv1.2","984","Application Data"
"222","11:47:20.153960","192.87.28.82","192.168.0.227","TCP","66","9001  >  55094 [ACK] Seq=2123 Ack=16287 Win=1011 Len=0 TSval=2015414307 TSecr=4102765265"
"223","11:47:20.157256","64.65.63.120","192.168.0.227","TLSv1.2","602","Application Data"
"224","11:47:20.157330","192.168.0.227","64.65.63.120","TCP","66","55087  >  443 [ACK] Seq=4289 Ack=110473 Win=10312 Len=0 TSval=1560737508 TSecr=2578555782"
"225","11:47:20.175515","192.87.28.82","192.168.0.227","TCP","66","9001  >  55094 [ACK] Seq=2123 Ack=19103 Win=1021 Len=0 TSval=2015414328 TSecr=4102765290"
"226","11:47:20.175518","192.87.28.82","192.168.0.227","TCP","66","9001  >  55094 [ACK] Seq=2123 Ack=21429 Win=1029 Len=0 TSval=2015414328 TSecr=4102765290"
"227","11:47:20.175638","192.168.0.227","192.87.28.82","TLSv1.2","152","Application Data"
"228","11:47:20.206325","64.65.63.120","192.168.0.227","TCP","1474","443  >  55087 [ACK] Seq=110473 Ack=4289 Win=1491 Len=1408 TSval=2578555832 TSecr=1560737508 [TCP PDU reassembled in 230]"
"229","11:47:20.206327","64.65.63.120","192.168.0.227","TCP","1474","443  >  55087 [PSH, ACK] Seq=111881 Ack=4289 Win=1491 Len=1408 TSval=2578555832 TSecr=1560737508 [TCP PDU reassembled in 230]"
"230","11:47:20.206328","64.65.63.120","192.168.0.227","TLSv1.2","870","Application Data"
"231","11:47:20.206437","192.168.0.227","64.65.63.120","TCP","66","55087  >  443 [ACK] Seq=4289 Ack=114093 Win=10264 Len=0 TSval=1560737557 TSecr=2578555832"
"232","11:47:20.206541","192.168.0.227","64.65.63.120","TCP","66","[TCP Window Update] 55087  >  443 [ACK] Seq=4289 Ack=114093 Win=10320 Len=0 TSval=1560737557 TSecr=2578555832"
"233","11:47:20.240258","64.65.63.120","192.168.0.227","TLSv1.2","602","Application Data"
"234","11:47:20.240406","192.168.0.227","64.65.63.120","TCP","66","55087  >  443 [ACK] Seq=4289 Ack=114629 Win=10312 Len=0 TSval=1560737591 TSecr=2578555867"
"235","11:47:20.242489","192.168.0.227","192.87.28.82","TLSv1.2","1474","Application Data, Application Data"
"236","11:47:20.242505","192.168.0.227","192.87.28.82","TLSv1.2","780","Application Data"
"237","11:47:20.247993","192.87.28.82","192.168.0.227","TCP","66","9001  >  55094 [ACK] Seq=2123 Ack=21515 Win=1043 Len=0 TSval=2015414400 TSecr=4102765324"
"238","11:47:20.278565","192.87.28.82","192.168.0.227","TCP","66","9001  >  55094 [ACK] Seq=2123 Ack=23637 Win=1010 Len=0 TSval=2015414431 TSecr=4102765391"
"239","11:47:20.327663","64.65.63.120","192.168.0.227","TLSv1.2","1116","Application Data"
"240","11:47:20.327790","192.168.0.227","64.65.63.120","TCP","66","55087  >  443 [ACK] Seq=4289 Ack=115679 Win=10304 Len=0 TSval=1560737679 TSecr=2578555954"
"241","11:47:20.328345","192.168.0.227","192.87.28.82","TLSv1.2","602","Application Data"
"242","11:47:20.329475","192.87.28.82","192.168.0.227","TLSv1.2","602","Application Data"
"243","11:47:20.329520","192.168.0.227","192.87.28.82","TCP","66","55094  >  9001 [ACK] Seq=24173 Ack=2659 Win=7012 Len=0 TSval=4102765478 TSecr=2015414482"
"244","11:47:20.360599","64.65.63.120","192.168.0.227","TLSv1.2","1116","Application Data"
"245","11:47:20.360734","192.168.0.227","64.65.63.120","TCP","66","55087  >  443 [ACK] Seq=4289 Ack=116729 Win=10304 Len=0 TSval=1560737712 TSecr=2578555987"
"246","11:47:20.391217","192.87.28.82","192.168.0.227","TLSv1.2","602","Application Data"
"247","11:47:20.391466","192.168.0.227","192.87.28.82","TLSv1.2","602","Application Data"
"248","11:47:20.393142","64.65.63.120","192.168.0.227","TLSv1.2","602","Application Data"
"249","11:47:20.393212","192.168.0.227","64.65.63.120","TCP","66","55087  >  443 [ACK] Seq=4289 Ack=117265 Win=10312 Len=0 TSval=1560737744 TSecr=2578556020"
"250","11:47:20.399629","192.168.0.227","192.87.28.82","TLSv1.2","1474","Application Data"
"251","11:47:20.399655","192.168.0.227","192.87.28.82","TLSv1.2","244","Application Data"
"252","11:47:20.420408","192.168.0.227","5.28.195.2","TCP","66","[TCP Retransmission] 61241  >  443 [FIN, ACK] Seq=518 Ack=2 Win=1048560 Len=0 TSval=1132201312 TSecr=2040512998"
"253","11:47:20.431564","192.168.0.227","192.87.28.82","TLSv1.2","1474","Application Data"
"254","11:47:20.431587","192.168.0.227","192.87.28.82","TLSv1.2","1272","Application Data"
"255","11:47:20.432987","192.87.28.82","192.168.0.227","TCP","66","9001  >  55094 [ACK] Seq=3195 Ack=26117 Win=1021 Len=0 TSval=2015414586 TSecr=4102765540"
"256","11:47:20.438235","192.168.0.227","192.87.28.82","TLSv1.2","1474","Application Data, Application Data"
"257","11:47:20.438264","192.168.0.227","192.87.28.82","TLSv1.2","266","Application Data"
"258","11:47:20.440417","192.168.0.227","192.87.28.82","TCP","1474","55094  >  9001 [ACK] Seq=30517 Ack=3195 Win=7020 Len=1408 TSval=4102765589 TSecr=2015414586 [TCP PDU reassembled in 259]"
"259","11:47:20.440434","192.168.0.227","192.87.28.82","TLSv1.2","736","Application Data"
"260","11:47:20.451577","192.168.0.227","5.28.195.2","TCP","78","[TCP Retransmission] 61239  >  5222 [SYN] Seq=0 Win=65535 Len=0 MSS=1460 WS=16 TSval=3485020891 TSecr=0 SACK_PERM"
"261","11:47:20.451619","192.168.0.227","5.28.195.2","TCP","78","[TCP Retransmission] 61238  >  80 [SYN] Seq=0 Win=65535 Len=0 MSS=1460 WS=16 TSval=2708785844 TSecr=0 SACK_PERM"
"262","11:47:20.460302","5.28.195.2","192.168.0.227","TCP","56","443  >  61241 [RST] Seq=2 Win=0 Len=0"
"263","11:47:20.465119","192.87.28.82","192.168.0.227","TCP","66","9001  >  55094 [ACK] Seq=3195 Ack=27703 Win=1021 Len=0 TSval=2015414618 TSecr=4102765548"
"264","11:47:20.471155","192.87.28.82","192.168.0.227","TCP","66","9001  >  55094 [ACK] Seq=3195 Ack=30317 Win=1021 Len=0 TSval=2015414624 TSecr=4102765580"
"265","11:47:20.475947","192.87.28.82","192.168.0.227","TCP","66","9001  >  55094 [ACK] Seq=3195 Ack=31925 Win=1021 Len=0 TSval=2015414628 TSecr=4102765587"
"266","11:47:20.514940","192.87.28.82","192.168.0.227","TCP","66","9001  >  55094 [ACK] Seq=3195 Ack=32595 Win=1043 Len=0 TSval=2015414668 TSecr=4102765589"
"267","11:47:20.527948","64.65.63.120","192.168.0.227","TLSv1.2","602","Application Data"
"268","11:47:20.528187","192.168.0.227","64.65.63.120","TCP","66","55087  >  443 [ACK] Seq=4289 Ack=117801 Win=10320 Len=0 TSval=1560737879 TSecr=2578556153"
"269","11:47:20.543748","fe80::8f4:f6e1:77d0:ab3e","fe80::1864:4d30:9585:912f","UDP","66","3722  >  3722 Len=4"
"270","11:47:20.572614","192.87.28.82","192.168.0.227","TLSv1.2","1116","Application Data"
"271","11:47:20.572787","192.168.0.227","192.87.28.82","TCP","66","55094  >  9001 [ACK] Seq=32595 Ack=4245 Win=7004 Len=0 TSval=4102765722 TSecr=2015414724"
"272","11:47:20.578926","fe80::8f4:f6e1:77d0:ab3e","fe80::ae22:5ff:feaa:607e","ICMPv6","86","Neighbor Solicitation for fe80::ae22:5ff:feaa:607e from 2a:32:1e:8d:54:98"
"273","11:47:20.585700","64.65.63.120","192.168.0.227","TCP","1474","443  >  55087 [ACK] Seq=117801 Ack=4289 Win=1491 Len=1408 TSval=2578556210 TSecr=1560737879 [TCP PDU reassembled in 276]"
"274","11:47:20.585703","fe80::ae22:5ff:feaa:607e","fe80::8f4:f6e1:77d0:ab3e","ICMPv6","78","Neighbor Advertisement fe80::ae22:5ff:feaa:607e (rtr, sol)"
"275","11:47:20.585705","64.65.63.120","192.168.0.227","TCP","1474","443  >  55087 [PSH, ACK] Seq=119209 Ack=4289 Win=1491 Len=1408 TSval=2578556210 TSecr=1560737879 [TCP PDU reassembled in 276]"
"276","11:47:20.585708","64.65.63.120","192.168.0.227","TLSv1.2","1320","Application Data"
"277","11:47:20.585711","64.65.63.120","192.168.0.227","TLSv1.2","1474","Application Data"
"278","11:47:20.585713","64.65.63.120","192.168.0.227","TCP","1474","443  >  55087 [PSH, ACK] Seq=123279 Ack=4289 Win=1491 Len=1408 TSval=2578556211 TSecr=1560737879 [TCP PDU reassembled in 280]"
"279","11:47:20.585715","64.65.63.120","192.168.0.227","TCP","1474","443  >  55087 [ACK] Seq=124687 Ack=4289 Win=1491 Len=1408 TSval=2578556211 TSecr=1560737879 [TCP PDU reassembled in 280]"
"280","11:47:20.585717","64.65.63.120","192.168.0.227","TLSv1.2","1474","Application Data"
