"No.","Time","Source","Destination","Protocol","Length","Info"
"1","11:47:55.459276","192.168.0.227","5.28.195.2","TCP","78","61307  >  443 [SYN, ECE, CWR] Seq=0 Win=65535 Len=0 MSS=1460 WS=16 TSval=3140427806 TSecr=0 SACK_PERM"
"2","11:47:55.459349","192.168.0.227","5.28.195.2","TCP","78","61308  >  5222 [SYN, ECE, CWR] Seq=0 Win=65535 Len=0 MSS=1460 WS=16 TSval=2292361798 TSecr=0 SACK_PERM"
"3","11:47:55.459436","192.168.0.227","5.28.195.2","TCP","78","61309  >  80 [SYN, ECE, CWR] Seq=0 Win=65535 Len=0 MSS=1460 WS=16 TSval=1372471473 TSecr=0 SACK_PERM"
"4","11:47:55.469181","17.248.214.68","192.168.0.227","TLSv1.2","1474","Ignored Unknown Record"
"5","11:47:55.469184","17.248.214.68","192.168.0.227","TLSv1.2","1474","Ignored Unknown Record"
"6","11:47:55.469186","17.248.214.68","192.168.0.227","TLSv1.2","268","Ignored Unknown Record"
"7","11:47:55.469414","192.168.0.227","17.248.214.68","TCP","78","62216  >  443 [ACK] Seq=1 Ack=4294965889 Win=2048 Len=0 TSval=3342733285 TSecr=195735464 SLE=1 SRE=3019"
"8","11:47:55.511174","17.248.214.68","192.168.0.227","TCP","268","[TCP Retransmission] 443  >  62216 [PSH, ACK] Seq=2817 Ack=1 Win=16 Len=202 TSval=195735832 TSecr=3342732908"
"9","11:47:55.511389","192.168.0.227","17.248.214.68","TCP","86","[TCP Dup ACK 7#1] 62216  >  443 [ACK] Seq=1 Ack=4294965889 Win=2048 Len=0 TSval=3342733327 TSecr=195735464 SLE=2817 SRE=3019 SLE=1 SRE=3019"
"10","11:47:55.537304","17.248.214.68","192.168.0.227","TCP","1474","[TCP Retransmission] 443  >  62216 [ACK] Seq=4294965889 Ack=1 Win=16 Len=1408 TSval=195735858 TSecr=3342733285"
"11","11:47:55.537576","192.168.0.227","17.248.214.68","TCP","66","62216  >  443 [ACK] Seq=1 Ack=3019 Win=1979 Len=0 TSval=3342733353 TSecr=195735858"
"12","11:47:55.537578","192.168.0.227","17.248.214.68","TCP","66","[TCP Window Update] 62216  >  443 [ACK] Seq=1 Ack=3019 Win=2048 Len=0 TSval=3342733353 TSecr=195735858"
"13","11:47:55.586943","5.28.195.2","192.168.0.227","TCP","74","443  >  61307 [SYN, ACK, ECE] Seq=0 Ack=1 Win=65535 Len=0 MSS=1240 SACK_PERM TSval=2971912320 TSecr=3140427806 WS=1024"
"14","11:47:55.587216","192.168.0.227","5.28.195.2","TCP","66","61307  >  443 [ACK] Seq=1 Ack=1 Win=1048560 Len=0 TSval=3140427933 TSecr=2971912320"
"15","11:47:55.587588","192.168.0.227","5.28.195.2","TLSv1","583","Client Hello"
"16","11:47:55.637310","5.28.195.2","192.168.0.227","TCP","66","443  >  61307 [ACK] Seq=1 Ack=518 Win=67584 Len=0 TSval=2971912480 TSecr=3140427934"
"17","11:47:55.637313","5.28.195.2","192.168.0.227","TCP","66","443  >  61307 [FIN, ACK] Seq=1 Ack=518 Win=67584 Len=0 TSval=2971912480 TSecr=3140427934"
"18","11:47:55.637459","192.168.0.227","5.28.195.2","TCP","66","61307  >  443 [ACK] Seq=518 Ack=2 Win=1048560 Len=0 TSval=3140427984 TSecr=2971912480"
"19","11:47:55.637811","192.168.0.227","5.28.195.2","TCP","66","61307  >  443 [FIN, ACK] Seq=518 Ack=2 Win=1048560 Len=0 TSval=3140427984 TSecr=2971912480"
"20","11:47:55.680119","5.28.195.2","192.168.0.227","TCP","56","443  >  61307 [RST] Seq=2 Win=0 Len=0"
"21","11:47:55.873017","192.168.0.227","17.248.214.68","TLSv1.2","198","Application Data"
"22","11:47:55.873312","192.168.0.227","17.248.214.68","TLSv1.2","942","Application Data"
"23","11:47:55.873436","192.168.0.227","17.248.214.68","TLSv1.2","97","Application Data"
"24","11:47:55.874384","192.168.0.227","17.248.214.68","TCP","54","62216  >  443 [ACK] Seq=0 Ack=3019 Win=2048 Len=0"
"25","11:47:55.925275","17.248.214.68","192.168.0.227","TCP","66","443  >  62216 [ACK] Seq=3019 Ack=133 Win=16 Len=0 TSval=195736245 TSecr=3342733688"
"26","11:47:55.925277","17.248.214.68","192.168.0.227","TCP","66","443  >  62216 [ACK] Seq=3019 Ack=1009 Win=16 Len=0 TSval=195736245 TSecr=3342733689"
"27","11:47:55.925279","17.248.214.68","192.168.0.227","TCP","66","443  >  62216 [ACK] Seq=3019 Ack=1040 Win=16 Len=0 TSval=195736245 TSecr=3342733689"
"28","11:47:55.925280","17.248.214.68","192.168.0.227","TCP","66","[TCP Dup ACK 27#1] 443  >  62216 [ACK] Seq=3019 Ack=1040 Win=16 Len=0 TSval=195736245 TSecr=3342733689"
"29","11:47:56.361580","17.248.214.68","192.168.0.227","TLSv1.2","712","Application Data"
"30","11:47:56.362032","192.168.0.227","17.248.214.68","TCP","66","62216  >  443 [ACK] Seq=1040 Ack=3665 Win=2038 Len=0 TSval=3342734177 TSecr=195736478"
"31","11:47:56.459974","192.168.0.227","5.28.195.2","TCP","78","[TCP Retransmission] 61309  >  80 [SYN] Seq=0 Win=65535 Len=0 MSS=1460 WS=16 TSval=1372472473 TSecr=0 SACK_PERM"
"32","11:47:56.460036","192.168.0.227","5.28.195.2","TCP","78","[TCP Retransmission] 61308  >  5222 [SYN] Seq=0 Win=65535 Len=0 MSS=1460 WS=16 TSval=2292362798 TSecr=0 SACK_PERM"
"33","11:47:56.863241","192.168.0.227","17.248.214.68","TCP","54","[TCP Keep-Alive] 62216  >  443 [ACK] Seq=1039 Ack=3665 Win=2048 Len=0"
"34","11:47:56.907711","17.248.214.68","192.168.0.227","TCP","66","[TCP Keep-Alive ACK] 443  >  62216 [ACK] Seq=3665 Ack=1040 Win=16 Len=0 TSval=195737229 TSecr=3342734177"
"35","11:47:57.411545","192.168.0.227","192.87.28.82","TLSv1.2","602","Application Data"
"36","11:47:57.461236","192.168.0.227","5.28.195.2","TCP","78","[TCP Retransmission] 61309  >  80 [SYN] Seq=0 Win=65535 Len=0 MSS=1460 WS=16 TSval=1372473474 TSecr=0 SACK_PERM"
"37","11:47:57.461323","192.168.0.227","5.28.195.2","TCP","78","[TCP Retransmission] 61308  >  5222 [SYN] Seq=0 Win=65535 Len=0 MSS=1460 WS=16 TSval=2292363799 TSecr=0 SACK_PERM"
"38","11:47:57.494610","192.87.28.82","192.168.0.227","TCP","66","9001  >  55094 [ACK] Seq=1 Ack=537 Win=1043 Len=0 TSval=2015451645 TSecr=4102802562"
"39","11:47:57.829554","192.168.0.227","5.28.195.2","TCP","78","61310  >  443 [SYN, ECE, CWR] Seq=0 Win=65535 Len=0 MSS=1460 WS=16 TSval=1369511581 TSecr=0 SACK_PERM"
"40","11:47:57.866795","5.28.195.2","192.168.0.227","TCP","74","443  >  61310 [SYN, ACK, ECE] Seq=0 Ack=1 Win=65535 Len=0 MSS=1240 SACK_PERM TSval=1861066508 TSecr=1369511581 WS=1024"
"41","11:47:57.866948","192.168.0.227","5.28.195.2","TCP","66","61310  >  443 [ACK] Seq=1 Ack=1 Win=1048560 Len=0 TSval=1369511618 TSecr=1861066508"
"42","11:47:57.867120","192.168.0.227","5.28.195.2","TLSv1","583","Client Hello"
"43","11:47:57.909361","5.28.195.2","192.168.0.227","TCP","66","443  >  61310 [ACK] Seq=1 Ack=518 Win=67584 Len=0 TSval=1861066549 TSecr=1369511619"
"44","11:47:57.909363","5.28.195.2","192.168.0.227","TCP","66","443  >  61310 [FIN, ACK] Seq=1 Ack=518 Win=67584 Len=0 TSval=1861066549 TSecr=1369511619"
"45","11:47:57.909485","192.168.0.227","5.28.195.2","TCP","66","61310  >  443 [ACK] Seq=518 Ack=2 Win=1048560 Len=0 TSval=1369511661 TSecr=1861066549"
"46","11:47:57.909639","192.168.0.227","5.28.195.2","TCP","66","61310  >  443 [FIN, ACK] Seq=518 Ack=2 Win=1048560 Len=0 TSval=1369511661 TSecr=1861066549"
"47","11:47:57.949736","5.28.195.2","192.168.0.227","TCP","56","443  >  61310 [RST] Seq=2 Win=0 Len=0"
"48","11:47:58.319156","192.168.0.227","17.248.214.68","TLSv1.2","105","Application Data"
"49","11:47:58.319835","192.168.0.227","17.248.214.68","TLSv1.2","90","Application Data"
"50","11:47:58.321419","192.168.0.227","17.248.214.68","TCP","66","62216  >  443 [FIN, ACK] Seq=1103 Ack=3665 Win=2048 Len=0 TSval=3342736137 TSecr=195737229"
"51","11:47:58.321520","64.65.63.120","192.168.0.227","TLSv1.2","602","Application Data"
"52","11:47:58.321720","192.168.0.227","64.65.63.120","TCP","66","55087  >  443 [ACK] Seq=1 Ack=537 Win=10312 Len=0 TSval=1560775674 TSecr=2578593882"
"53","11:47:58.369236","17.248.214.68","192.168.0.227","TCP","66","443  >  62216 [ACK] Seq=3665 Ack=1079 Win=16 Len=0 TSval=195738687 TSecr=3342736134"
"54","11:47:58.371653","17.248.214.68","192.168.0.227","TCP","66","443  >  62216 [ACK] Seq=3665 Ack=1103 Win=16 Len=0 TSval=195738691 TSecr=3342736135"
"55","11:47:58.371654","17.248.214.68","192.168.0.227","TCP","66","443  >  62216 [FIN, ACK] Seq=3665 Ack=1104 Win=16 Len=0 TSval=195738691 TSecr=3342736137"
"56","11:47:58.371747","192.168.0.227","17.248.214.68","TCP","66","62216  >  443 [ACK] Seq=1104 Ack=3666 Win=2048 Len=0 TSval=3342736187 TSecr=195738691"
"57","11:47:58.462106","192.168.0.227","5.28.195.2","TCP","78","[TCP Retransmission] 61309  >  80 [SYN] Seq=0 Win=65535 Len=0 MSS=1460 WS=16 TSval=1372474475 TSecr=0 SACK_PERM"
"58","11:47:58.462181","192.168.0.227","5.28.195.2","TCP","78","[TCP Retransmission] 61308  >  5222 [SYN] Seq=0 Win=65535 Len=0 MSS=1460 WS=16 TSval=2292364800 TSecr=0 SACK_PERM"
"59","11:47:58.679346","192.168.0.227","64.65.63.120","TCP","54","[TCP Keep-Alive] 55087  >  443 [ACK] Seq=0 Ack=537 Win=10320 Len=0"
"60","11:47:58.720376","64.65.63.120","192.168.0.227","TCP","66","[TCP Keep-Alive ACK] 443  >  55087 [ACK] Seq=537 Ack=1 Win=1876 Len=0 TSval=2578594342 TSecr=1560775674"
"61","11:47:59.462766","192.168.0.227","5.28.195.2","TCP","78","[TCP Retransmission] 61309  >  80 [SYN] Seq=0 Win=65535 Len=0 MSS=1460 WS=16 TSval=1372475476 TSecr=0 SACK_PERM"
"62","11:47:59.462854","192.168.0.227","5.28.195.2","TCP","78","[TCP Retransmission] 61308  >  5222 [SYN] Seq=0 Win=65535 Len=0 MSS=1460 WS=16 TSval=2292365801 TSecr=0 SACK_PERM"
"63","11:48:00.250137","149.154.167.41","192.168.0.227","SSL","171","Continuation Data"
"64","11:48:00.250239","192.168.0.227","149.154.167.41","TCP","66","59561  >  443 [ACK] Seq=1 Ack=106 Win=65530 Len=0 TSval=2752791992 TSecr=660307213"
"65","11:48:00.337800","192.168.0.227","64.65.63.120","TCP","1474","55087  >  443 [ACK] Seq=1 Ack=537 Win=10320 Len=1408 TSval=1560777690 TSecr=2578594342 [TCP PDU reassembled in 66]"
"66","11:48:00.337821","192.168.0.227","64.65.63.120","TLSv1.2","736","Application Data"
"67","11:48:00.368743","192.168.0.227","149.154.167.41","TCP","54","[TCP Keep-Alive] 59561  >  443 [ACK] Seq=0 Ack=106 Win=65535 Len=0"
"68","11:48:00.398799","64.65.63.120","192.168.0.227","TCP","66","443  >  55087 [ACK] Seq=537 Ack=1409 Win=1899 Len=0 TSval=2578596023 TSecr=1560777690"
"69","11:48:00.404276","64.65.63.120","192.168.0.227","TCP","66","443  >  55087 [ACK] Seq=537 Ack=2079 Win=1921 Len=0 TSval=2578596027 TSecr=1560777690"
"70","11:48:00.404372","192.168.0.227","64.65.63.120","TLSv1.2","602","Application Data"
"71","11:48:00.408028","149.154.167.41","192.168.0.227","TCP","66","[TCP Keep-Alive ACK] 443  >  59561 [ACK] Seq=106 Ack=1 Win=16061 Len=0 TSval=660307561 TSecr=2752791992"
"72","11:48:00.440730","64.65.63.120","192.168.0.227","TCP","66","443  >  55087 [ACK] Seq=537 Ack=2615 Win=1943 Len=0 TSval=2578596067 TSecr=1560777757"
"73","11:48:00.455443","192.87.28.82","192.168.0.227","TCP","1474","9001  >  55094 [ACK] Seq=1 Ack=537 Win=1043 Len=1408 TSval=2015454604 TSecr=4102802562 [TCP PDU reassembled in 75]"
"74","11:48:00.455446","192.87.28.82","192.168.0.227","TCP","1474","9001  >  55094 [ACK] Seq=1409 Ack=537 Win=1043 Len=1408 TSval=2015454604 TSecr=4102802562 [TCP PDU reassembled in 75]"
"75","11:48:00.455448","192.87.28.82","192.168.0.227","TLSv1.2","1320","Application Data"
"76","11:48:00.455449","192.87.28.82","192.168.0.227","TCP","1474","9001  >  55094 [ACK] Seq=4071 Ack=537 Win=1043 Len=1408 TSval=2015454604 TSecr=4102802562 [TCP PDU reassembled in 80]"
"77","11:48:00.455450","192.87.28.82","192.168.0.227","TCP","1474","9001  >  55094 [ACK] Seq=5479 Ack=537 Win=1043 Len=1408 TSval=2015454604 TSecr=4102802562 [TCP PDU reassembled in 80]"
"78","11:48:00.455562","192.168.0.227","192.87.28.82","TCP","66","55094  >  9001 [ACK] Seq=537 Ack=6887 Win=6913 Len=0 TSval=4102805606 TSecr=2015454604"
"79","11:48:00.455717","192.168.0.227","192.87.28.82","TCP","66","[TCP Window Update] 55094  >  9001 [ACK] Seq=537 Ack=6887 Win=7020 Len=0 TSval=4102805606 TSecr=2015454604"
"80","11:48:00.456601","192.87.28.82","192.168.0.227","TLSv1.2","1474","Application Data"
"81","11:48:00.456627","192.168.0.227","192.87.28.82","TCP","66","55094  >  9001 [ACK] Seq=537 Ack=8295 Win=6998 Len=0 TSval=4102805607 TSecr=2015454605"
"82","11:48:00.459426","192.87.28.82","192.168.0.227","TCP","1474","9001  >  55094 [ACK] Seq=8295 Ack=537 Win=1043 Len=1408 TSval=2015454605 TSecr=4102802562 [TCP PDU reassembled in 84]"
"83","11:48:00.459456","192.168.0.227","192.87.28.82","TCP","66","55094  >  9001 [ACK] Seq=537 Ack=9703 Win=6998 Len=0 TSval=4102805610 TSecr=2015454605"
"84","11:48:00.465047","192.87.28.82","192.168.0.227","TLSv1.2","1474","Application Data"
"85","11:48:00.465049","192.87.28.82","192.168.0.227","TCP","1474","9001  >  55094 [ACK] Seq=11111 Ack=537 Win=1043 Len=1408 TSval=2015454614 TSecr=4102802562 [TCP PDU reassembled in 92]"
"86","11:48:00.465050","192.87.28.82","192.168.0.227","TCP","1474","9001  >  55094 [ACK] Seq=12519 Ack=537 Win=1043 Len=1408 TSval=2015454614 TSecr=4102802562 [TCP PDU reassembled in 92]"
"87","11:48:00.465145","192.168.0.227","192.87.28.82","TCP","66","55094  >  9001 [ACK] Seq=537 Ack=11111 Win=6998 Len=0 TSval=4102805616 TSecr=2015454614"
"88","11:48:00.465179","192.168.0.227","192.87.28.82","TCP","66","55094  >  9001 [ACK] Seq=537 Ack=13927 Win=6954 Len=0 TSval=4102805616 TSecr=2015454614"
"89","11:48:00.465352","192.168.0.227","192.87.28.82","TCP","66","[TCP Window Update] 55094  >  9001 [ACK] Seq=537 Ack=13927 Win=7020 Len=0 TSval=4102805616 TSecr=2015454614"
"90","11:48:00.465497","192.168.0.227","192.87.28.82","TLSv1.2","602","Application Data"
"91","11:48:00.474490","192.168.0.227","5.28.195.2","TCP","78","61311  >  443 [SYN, ECE, CWR] Seq=0 Win=65535 Len=0 MSS=1460 WS=16 TSval=2278291368 TSecr=0 SACK_PERM"
"92","11:48:00.497400","192.87.28.82","192.168.0.227","TLSv1.2","1474","Application Data"
"93","11:48:00.497402","192.87.28.82","192.168.0.227","TCP","1474","9001  >  55094 [ACK] Seq=15335 Ack=537 Win=1043 Len=1408 TSval=2015454648 TSecr=4102805606 [TCP PDU reassembled in 95]"
"94","11:48:00.497404","192.87.28.82","192.168.0.227","TCP","1474","9001  >  55094 [ACK] Seq=16743 Ack=537 Win=1043 Len=1408 TSval=2015454648 TSecr=4102805606 [TCP PDU reassembled in 95]"
"95","11:48:00.497406","192.87.28.82","192.168.0.227","TLSv1.2","1474","Application Data"
"96","11:48:00.497407","192.87.28.82","192.168.0.227","TCP","1474","9001  >  55094 [ACK] Seq=19559 Ack=537 Win=1043 Len=1408 TSval=2015454648 TSecr=4102805606 [TCP PDU reassembled in 98]"
"97","11:48:00.497410","192.87.28.82","192.168.0.227","TCP","1474","9001  >  55094 [ACK] Seq=20967 Ack=537 Win=1043 Len=1408 TSval=2015454648 TSecr=4102805606 [TCP PDU reassembled in 98]"
"98","11:48:00.497411","192.87.28.82","192.168.0.227","TLSv1.2","1474","Application Data"
"99","11:48:00.497520","192.168.0.227","192.87.28.82","TCP","66","55094  >  9001 [ACK] Seq=1073 Ack=23783 Win=6866 Len=0 TSval=4102805648 TSecr=2015454648"
"100","11:48:00.497890","192.168.0.227","192.87.28.82","TCP","66","[TCP Window Update] 55094  >  9001 [ACK] Seq=1073 Ack=23783 Win=7020 Len=0 TSval=4102805648 TSecr=2015454648"
"101","11:48:00.499963","192.87.28.82","192.168.0.227","TCP","1474","9001  >  55094 [ACK] Seq=23783 Ack=537 Win=1043 Len=1408 TSval=2015454652 TSecr=4102805606 [TCP PDU reassembled in 103]"
"102","11:48:00.499965","192.87.28.82","192.168.0.227","TCP","1474","9001  >  55094 [ACK] Seq=25191 Ack=537 Win=1043 Len=1408 TSval=2015454652 TSecr=4102805607 [TCP PDU reassembled in 103]"
"103","11:48:00.499966","192.87.28.82","192.168.0.227","TLSv1.2","1474","Application Data, Application Data, Application Data"
"104","11:48:00.499967","192.87.28.82","192.168.0.227","TCP","1474","9001  >  55094 [ACK] Seq=28007 Ack=537 Win=1043 Len=1408 TSval=2015454652 TSecr=4102805610 [TCP PDU reassembled in 108]"
"105","11:48:00.500028","192.168.0.227","192.87.28.82","TCP","66","55094  >  9001 [ACK] Seq=1073 Ack=29415 Win=6932 Len=0 TSval=4102805651 TSecr=2015454652"
"106","11:48:00.500272","192.168.0.227","192.87.28.82","TCP","66","[TCP Window Update] 55094  >  9001 [ACK] Seq=1073 Ack=29415 Win=7020 Len=0 TSval=4102805651 TSecr=2015454652"
"107","11:48:00.503531","192.87.28.82","192.168.0.227","TCP","1474","9001  >  55094 [ACK] Seq=29415 Ack=537 Win=1043 Len=1408 TSval=2015454656 TSecr=4102805616 [TCP PDU reassembled in 108]"
"108","11:48:00.503533","192.87.28.82","192.168.0.227","TLSv1.2","1474","Application Data"
"109","11:48:00.503535","192.87.28.82","192.168.0.227","TCP","1474","9001  >  55094 [ACK] Seq=32231 Ack=537 Win=1043 Len=1408 TSval=2015454656 TSecr=4102805616 [TCP PDU reassembled in 111]"
"110","11:48:00.503536","192.87.28.82","192.168.0.227","TCP","1474","9001  >  55094 [ACK] Seq=33639 Ack=537 Win=1043 Len=1408 TSval=2015454656 TSecr=4102805616 [TCP PDU reassembled in 111]"
"111","11:48:00.503537","192.87.28.82","192.168.0.227","TLSv1.2","1474","Application Data"
"112","11:48:00.503538","192.87.28.82","192.168.0.227","TCP","1474","9001  >  55094 [ACK] Seq=36455 Ack=537 Win=1043 Len=1408 TSval=2015454656 TSecr=4102805616 [TCP PDU reassembled in 118]"
"113","11:48:00.503641","192.168.0.227","192.87.28.82","TLSv1.2","602","Application Data"
"114","11:48:00.503796","192.168.0.227","192.87.28.82","TCP","66","[TCP Window Update] 55094  >  9001 [ACK] Seq=1609 Ack=37863 Win=7020 Len=0 TSval=4102805654 TSecr=2015454656"
"115","11:48:00.512469","5.28.195.2","192.168.0.227","TCP","74","443  >  61311 [SYN, ACK, ECE] Seq=0 Ack=1 Win=65535 Len=0 MSS=1240 SACK_PERM TSval=2121021780 TSecr=2278291368 WS=1024"
"116","11:48:00.512611","192.168.0.227","5.28.195.2","TCP","66","61311  >  443 [ACK] Seq=1 Ack=1 Win=1048560 Len=0 TSval=2278291406 TSecr=2121021780"
"117","11:48:00.512821","192.168.0.227","5.28.195.2","TLSv1","583","Client Hello"
"118","11:48:00.531529","192.87.28.82","192.168.0.227","TLSv1.2","1474","Application Data"
"119","11:48:00.531531","192.87.28.82","192.168.0.227","TLSv1.2","1474","Application Data"
"120","11:48:00.531532","192.87.28.82","192.168.0.227","TCP","1474","9001  >  55094 [ACK] Seq=40679 Ack=1073 Win=1043 Len=1408 TSval=2015454683 TSecr=4102805616 [TCP PDU reassembled in 122]"
"121","11:48:00.531534","192.87.28.82","192.168.0.227","TCP","1474","9001  >  55094 [ACK] Seq=42087 Ack=1073 Win=1043 Len=1408 TSval=2015454683 TSecr=4102805616 [TCP PDU reassembled in 122]"
"122","11:48:00.531536","192.87.28.82","192.168.0.227","TLSv1.2","1474","Application Data"
"123","11:48:00.531537","192.87.28.82","192.168.0.227","TCP","1474","9001  >  55094 [ACK] Seq=44903 Ack=1073 Win=1043 Len=1408 TSval=2015454683 TSecr=4102805616 [TCP PDU reassembled in 125]"
"124","11:48:00.531538","192.87.28.82","192.168.0.227","TCP","1474","9001  >  55094 [ACK] Seq=46311 Ack=1073 Win=1043 Len=1408 TSval=2015454683 TSecr=4102805616 [TCP PDU reassembled in 125]"
"125","11:48:00.531539","192.87.28.82","192.168.0.227","TLSv1.2","1474","Application Data"
"126","11:48:00.531540","192.87.28.82","192.168.0.227","TCP","1474","9001  >  55094 [ACK] Seq=49127 Ack=1073 Win=1043 Len=1408 TSval=2015454683 TSecr=4102805616 [TCP PDU reassembled in 130]"
"127","11:48:00.531541","192.87.28.82","192.168.0.227","TCP","1474","9001  >  55094 [ACK] Seq=50535 Ack=1073 Win=1043 Len=1408 TSval=2015454683 TSecr=4102805648 [TCP PDU reassembled in 130]"
"128","11:48:00.531654","192.168.0.227","192.87.28.82","TCP","66","55094  >  9001 [ACK] Seq=1609 Ack=51943 Win=6800 Len=0 TSval=4102805682 TSecr=2015454683"
"129","11:48:00.531802","192.168.0.227","192.87.28.82","TCP","66","[TCP Window Update] 55094  >  9001 [ACK] Seq=1609 Ack=51943 Win=7020 Len=0 TSval=4102805682 TSecr=2015454683"
"130","11:48:00.533691","192.87.28.82","192.168.0.227","TLSv1.2","1474","Application Data"
"131","11:48:00.533692","192.87.28.82","192.168.0.227","TCP","1474","9001  >  55094 [ACK] Seq=53351 Ack=1073 Win=1043 Len=1408 TSval=2015454687 TSecr=4102805651 [TCP PDU reassembled in 133]"
"132","11:48:00.533694","192.87.28.82","192.168.0.227","TCP","1474","9001  >  55094 [ACK] Seq=54759 Ack=1073 Win=1043 Len=1408 TSval=2015454687 TSecr=4102805651 [TCP PDU reassembled in 133]"
"133","11:48:00.533695","192.87.28.82","192.168.0.227","TLSv1.2","1474","Application Data"
"134","11:48:00.533696","192.87.28.82","192.168.0.227","TCP","1474","9001  >  55094 [ACK] Seq=57575 Ack=1073 Win=1043 Len=1408 TSval=2015454687 TSecr=4102805651 [TCP PDU reassembled in 138]"
"135","11:48:00.533697","192.87.28.82","192.168.0.227","TCP","1474","9001  >  55094 [ACK] Seq=58983 Ack=1073 Win=1043 Len=1408 TSval=2015454687 TSecr=4102805651 [TCP PDU reassembled in 138]"
"136","11:48:00.533724","192.168.0.227","192.87.28.82","TLSv1.2","602","Application Data"
"137","11:48:00.533797","192.168.0.227","192.87.28.82","TCP","66","[TCP Window Update] 55094  >  9001 [ACK] Seq=2145 Ack=60391 Win=7020 Len=0 TSval=4102805684 TSecr=2015454687"
"138","11:48:00.539152","192.87.28.82","192.168.0.227","TLSv1.2","1474","Application Data"
"139","11:48:00.539154","192.87.28.82","192.168.0.227","TCP","1474","9001  >  55094 [ACK] Seq=61799 Ack=1073 Win=1043 Len=1408 TSval=2015454691 TSecr=4102805651 [TCP PDU reassembled in 140]"
"140","11:48:00.539156","192.87.28.82","192.168.0.227","TLSv1.2","1474","Application Data"
"141","11:48:00.539158","192.87.28.82","192.168.0.227","TLSv1.2","1474","Application Data"
"142","11:48:00.539159","192.87.28.82","192.168.0.227","TCP","1474","9001  >  55094 [ACK] Seq=66023 Ack=1073 Win=1043 Len=1408 TSval=2015454691 TSecr=4102805651 [TCP PDU reassembled in 143]"
"143","11:48:00.539160","192.87.28.82","192.168.0.227","TLSv1.2","1474","Application Data"
"144","11:48:00.539162","192.87.28.82","192.168.0.227","TCP","1474","9001  >  55094 [ACK] Seq=68839 Ack=1073 Win=1043 Len=1408 TSval=2015454691 TSecr=4102805651 [TCP PDU reassembled in 152]"
"145","11:48:00.539262","192.168.0.227","192.87.28.82","TCP","66","55094  >  9001 [ACK] Seq=2145 Ack=70247 Win=6866 Len=0 TSval=4102805690 TSecr=2015454691"
"146","11:48:00.539510","192.168.0.227","192.87.28.82","TLSv1.2","602","Application Data"
"147","11:48:00.555451","5.28.195.2","192.168.0.227","TCP","66","443  >  61311 [ACK] Seq=1 Ack=518 Win=67584 Len=0 TSval=2121021823 TSecr=2278291406"
"148","11:48:00.555453","5.28.195.2","192.168.0.227","TCP","66","443  >  61311 [FIN, ACK] Seq=1 Ack=518 Win=67584 Len=0 TSval=2121021823 TSecr=2278291406"
"149","11:48:00.555617","192.168.0.227","5.28.195.2","TCP","66","61311  >  443 [ACK] Seq=518 Ack=2 Win=1048560 Len=0 TSval=2278291449 TSecr=2121021823"
"150","11:48:00.555769","192.168.0.227","5.28.195.2","TCP","66","61311  >  443 [FIN, ACK] Seq=518 Ack=2 Win=1048560 Len=0 TSval=2278291449 TSecr=2121021823"
"151","11:48:00.565169","192.87.28.82","192.168.0.227","TCP","1474","9001  >  55094 [ACK] Seq=70247 Ack=1609 Win=1043 Len=1408 TSval=2015454716 TSecr=4102805654 [TCP PDU reassembled in 152]"
"152","11:48:00.565171","192.87.28.82","192.168.0.227","TLSv1.2","1474","Application Data"
"153","11:48:00.565173","192.87.28.82","192.168.0.227","TCP","1474","9001  >  55094 [ACK] Seq=73063 Ack=1609 Win=1043 Len=1408 TSval=2015454716 TSecr=4102805654 [TCP PDU reassembled in 155]"
"154","11:48:00.565174","192.87.28.82","192.168.0.227","TCP","1474","9001  >  55094 [ACK] Seq=74471 Ack=1609 Win=1043 Len=1408 TSval=2015454716 TSecr=4102805654 [TCP PDU reassembled in 155]"
"155","11:48:00.565176","192.87.28.82","192.168.0.227","TLSv1.2","1474","Application Data"
"156","11:48:00.565177","192.87.28.82","192.168.0.227","TCP","1474","9001  >  55094 [ACK] Seq=77287 Ack=1609 Win=1043 Len=1408 TSval=2015454716 TSecr=4102805654 [TCP PDU reassembled in 158]"
"157","11:48:00.565178","192.87.28.82","192.168.0.227","TCP","1474","9001  >  55094 [ACK] Seq=78695 Ack=1609 Win=1043 Len=1408 TSval=2015454716 TSecr=4102805654 [TCP PDU reassembled in 158]"
"158","11:48:00.565179","192.87.28.82","192.168.0.227","TLSv1.2","1474","Application Data, Application Data"
"159","11:48:00.565180","192.87.28.82","192.168.0.227","TCP","1474","9001  >  55094 [ACK] Seq=81511 Ack=1609 Win=1043 Len=1408 TSval=2015454716 TSecr=4102805654 [TCP PDU reassembled in 161]"
"160","11:48:00.565181","192.87.28.82","192.168.0.227","TCP","1474","9001  >  55094 [ACK] Seq=82919 Ack=1609 Win=1043 Len=1408 TSval=2015454716 TSecr=4102805654 [TCP PDU reassembled in 161]"
"161","11:48:00.565183","192.87.28.82","192.168.0.227","TLSv1.2","1474","Application Data, Application Data"
"162","11:48:00.565184","192.87.28.82","192.168.0.227","TCP","1474","9001  >  55094 [ACK] Seq=85735 Ack=1609 Win=1043 Len=1408 TSval=2015454716 TSecr=4102805654 [TCP PDU reassembled in 167]"
"163","11:48:00.565185","192.87.28.82","192.168.0.227","TCP","1474","9001  >  55094 [ACK] Seq=87143 Ack=1609 Win=1043 Len=1408 TSval=2015454716 TSecr=4102805682 [TCP PDU reassembled in 167]"
"164","11:48:00.565315","192.168.0.227","192.87.28.82","TCP","66","55094  >  9001 [ACK] Seq=2681 Ack=85735 Win=6778 Len=0 TSval=4102805716 TSecr=2015454716"
"165","11:48:00.565352","192.168.0.227","192.87.28.82","TCP","66","55094  >  9001 [ACK] Seq=2681 Ack=88551 Win=6734 Len=0 TSval=4102805716 TSecr=2015454716"
"166","11:48:00.565932","192.168.0.227","192.87.28.82","TLSv1.2","602","Application Data"
"167","11:48:00.569165","192.87.28.82","192.168.0.227","TLSv1.2","1474","Application Data"
"168","11:48:00.569167","192.87.28.82","192.168.0.227","TCP","1474","9001  >  55094 [ACK] Seq=89959 Ack=2145 Win=1035 Len=1408 TSval=2015454720 TSecr=4102805684 [TCP PDU reassembled in 169]"
"169","11:48:00.569169","192.87.28.82","192.168.0.227","TLSv1.2","1474","Application Data"
"170","11:48:00.569170","192.87.28.82","192.168.0.227","TCP","1474","9001  >  55094 [ACK] Seq=92775 Ack=2145 Win=1035 Len=1408 TSval=2015454720 TSecr=4102805684 [TCP PDU reassembled in 175]"
"171","11:48:00.569172","192.87.28.82","192.168.0.227","TCP","1474","9001  >  55094 [ACK] Seq=94183 Ack=2145 Win=1035 Len=1408 TSval=2015454720 TSecr=4102805684 [TCP PDU reassembled in 175]"
"172","11:48:00.569276","192.168.0.227","192.87.28.82","TCP","66","55094  >  9001 [ACK] Seq=3217 Ack=95591 Win=6910 Len=0 TSval=4102805720 TSecr=2015454720"
"173","11:48:00.569414","192.168.0.227","192.87.28.82","TCP","66","[TCP Window Update] 55094  >  9001 [ACK] Seq=3217 Ack=95591 Win=7020 Len=0 TSval=4102805720 TSecr=2015454720"
"174","11:48:00.596949","5.28.195.2","192.168.0.227","TCP","56","443  >  61311 [RST] Seq=2 Win=0 Len=0"
"175","11:48:00.602224","192.87.28.82","192.168.0.227","TLSv1.2","248","Application Data, Application Data"
"176","11:48:00.602323","192.168.0.227","192.87.28.82","TLSv1.2","602","Application Data"
"177","11:48:00.676446","192.87.28.82","192.168.0.227","TCP","66","9001  >  55094 [ACK] Seq=95773 Ack=3753 Win=1043 Len=0 TSval=2015454827 TSecr=4102805753"
"178","11:48:00.701954","149.154.167.41","192.168.0.227","SSL","171","Continuation Data"
"179","11:48:00.702060","192.168.0.227","149.154.167.41","TCP","66","59561  >  443 [ACK] Seq=1 Ack=211 Win=65530 Len=0 TSval=2752792444 TSecr=660307855"
"180","11:48:00.810794","192.168.0.227","149.154.167.41","SSL","299","Continuation Data"
"181","11:48:00.821970","192.168.0.227","149.154.167.41","TCP","54","59561  >  443 [ACK] Seq=0 Ack=211 Win=65535 Len=0"
"182","11:48:00.845819","149.154.167.41","192.168.0.227","TCP","70","443  >  59561 [PSH, ACK] Seq=211 Ack=234 Win=16097 Len=4 TSval=660308002 TSecr=2752792552 [TCP PDU reassembled in 184]"
"183","11:48:00.845920","192.168.0.227","149.154.167.41","TCP","66","59561  >  443 [ACK] Seq=234 Ack=215 Win=65535 Len=0 TSval=2752792587 TSecr=660308002"
"184","11:48:00.852992","149.154.167.41","192.168.0.227","SSL","219","Continuation Data"
"185","11:48:00.853028","192.168.0.227","149.154.167.41","TCP","66","59561  >  443 [ACK] Seq=234 Ack=368 Win=65527 Len=0 TSval=2752792595 TSecr=660308009"
"186","11:48:00.854783","192.168.0.227","64.65.63.120","TLSv1.2","1116","Application Data"
"187","11:48:00.890743","64.65.63.120","192.168.0.227","TCP","66","443  >  55087 [ACK] Seq=537 Ack=3665 Win=1943 Len=0 TSval=2578596517 TSecr=1560778207"
"188","11:48:00.943222","192.168.0.227","149.154.167.41","SSL","267","Continuation Data"
"189","11:48:00.971095","192.168.0.227","149.154.167.41","TCP","54","59561  >  443 [ACK] Seq=233 Ack=368 Win=65535 Len=0"
"190","11:48:00.982381","149.154.167.41","192.168.0.227","TCP","70","443  >  59561 [PSH, ACK] Seq=368 Ack=435 Win=16132 Len=4 TSval=660308138 TSecr=2752792685 [TCP PDU reassembled in 192]"
"191","11:48:00.982525","192.168.0.227","149.154.167.41","TCP","66","59561  >  443 [ACK] Seq=435 Ack=372 Win=65535 Len=0 TSval=2752792724 TSecr=660308138"
"192","11:48:00.991652","149.154.167.41","192.168.0.227","TCP","219","443  >  59561 [PSH, ACK] Seq=372 Ack=435 Win=16132 Len=153 TSval=660308147 TSecr=2752792685"
"193","11:48:00.991772","192.168.0.227","149.154.167.41","TCP","66","59561  >  443 [ACK] Seq=435 Ack=525 Win=65527 Len=0 TSval=2752792733 TSecr=660308147"
"194","11:48:01.010985","149.154.167.41","192.168.0.227","TCP","66","[TCP Dup ACK 190#1] 443  >  59561 [ACK] Seq=525 Ack=435 Win=16132 Len=0 TSval=660308163 TSecr=2752792685"
"195","11:48:01.020160","192.168.0.227","64.65.63.120","TLSv1.2","602","Application Data"
"196","11:48:01.035448","64.65.63.120","192.168.0.227","TLSv1.2","1116","Application Data"
"197","11:48:01.035582","192.168.0.227","64.65.63.120","TCP","66","55087  >  443 [ACK] Seq=4201 Ack=1587 Win=10304 Len=0 TSval=1560778388 TSecr=2578596658"
"198","11:48:01.059213","64.65.63.120","192.168.0.227","TCP","66","443  >  55087 [ACK] Seq=1587 Ack=4201 Win=1943 Len=0 TSval=2578596685 TSecr=1560778373"
"199","11:48:01.070063","64.65.63.120","192.168.0.227","TLSv1.2","602","Application Data"
"200","11:48:01.070131","192.168.0.227","64.65.63.120","TCP","66","55087  >  443 [ACK] Seq=4201 Ack=2123 Win=10312 Len=0 TSval=1560778423 TSecr=2578596693"
"201","11:48:01.129509","64.65.63.120","192.168.0.227","TLSv1.2","602","Application Data"
"202","11:48:01.129602","192.168.0.227","64.65.63.120","TCP","66","55087  >  443 [ACK] Seq=4201 Ack=2659 Win=10312 Len=0 TSval=1560778482 TSecr=2578596756"
"203","11:48:01.129857","192.168.0.227","64.65.63.120","TCP","1474","55087  >  443 [ACK] Seq=4201 Ack=2659 Win=10320 Len=1408 TSval=1560778482 TSecr=2578596756 [TCP PDU reassembled in 204]"
"204","11:48:01.129867","192.168.0.227","64.65.63.120","TLSv1.2","736","Application Data"
"205","11:48:01.149273","2a02:ab88:b:4100:4977:d98a:d5e5:5d47","2603:1063:12::2fd","TLSv1.2","143","Application Data"
"206","11:48:01.168533","64.65.63.120","192.168.0.227","TCP","66","443  >  55087 [ACK] Seq=2659 Ack=6279 Win=1933 Len=0 TSval=2578596795 TSecr=1560778482"
"207","11:48:01.168675","192.168.0.227","64.65.63.120","TLSv1.2","1138","Application Data, Application Data"
"208","11:48:01.183613","192.168.0.227","64.65.63.120","TCP","1474","55087  >  443 [ACK] Seq=7351 Ack=2659 Win=10320 Len=1408 TSval=1560778536 TSecr=2578596795 [TCP PDU reassembled in 209]"
"209","11:48:01.183629","192.168.0.227","64.65.63.120","TLSv1.2","736","Application Data"
"210","11:48:01.184989","2603:1063:12::2fd","2a02:ab88:b:4100:4977:d98a:d5e5:5d47","TLSv1.2","132","Application Data"
"211","11:48:01.185101","2a02:ab88:b:4100:4977:d98a:d5e5:5d47","2603:1063:12::2fd","TCP","86","59052  >  443 [ACK] Seq=58 Ack=47 Win=2048 Len=0 TSval=392814262 TSecr=739243526"
"212","11:48:01.217642","64.65.63.120","192.168.0.227","TCP","66","443  >  55087 [ACK] Seq=2659 Ack=9429 Win=1933 Len=0 TSval=2578596844 TSecr=1560778521"
"213","11:48:01.255333","64.65.63.120","192.168.0.227","TCP","1474","443  >  55087 [ACK] Seq=2659 Ack=9429 Win=1943 Len=1408 TSval=2578596881 TSecr=1560778521 [TCP PDU reassembled in 214]"
"214","11:48:01.255335","64.65.63.120","192.168.0.227","TLSv1.2","222","Application Data"
"215","11:48:01.255482","192.168.0.227","64.65.63.120","TCP","66","55087  >  443 [ACK] Seq=9429 Ack=4223 Win=10296 Len=0 TSval=1560778608 TSecr=2578596881"
"216","11:48:01.280398","2a02:ab88:b:4100:4977:d98a:d5e5:5d47","2603:1063:12::2fd","TCP","74","[TCP Keep-Alive] 59052  >  443 [ACK] Seq=57 Ack=47 Win=2048 Len=0"
"217","11:48:01.288592","64.65.63.120","192.168.0.227","TLSv1.2","1116","Application Data"
"218","11:48:01.288705","192.168.0.227","64.65.63.120","TCP","66","55087  >  443 [ACK] Seq=9429 Ack=5273 Win=10304 Len=0 TSval=1560778641 TSecr=2578596915"
"219","11:48:01.317097","2603:1063:12::2fd","2a02:ab88:b:4100:4977:d98a:d5e5:5d47","TCP","86","[TCP Keep-Alive ACK] 443  >  59052 [ACK] Seq=47 Ack=58 Win=16380 Len=0 TSval=739243657 TSecr=392814262"
"220","11:48:01.323331","64.65.63.120","192.168.0.227","TLSv1.2","602","Application Data"
"221","11:48:01.323429","192.168.0.227","64.65.63.120","TCP","66","55087  >  443 [ACK] Seq=9429 Ack=5809 Win=10312 Len=0 TSval=1560778676 TSecr=2578596950"
"222","11:48:01.327492","64.65.63.120","192.168.0.227","TCP","1474","443  >  55087 [ACK] Seq=5809 Ack=9429 Win=1943 Len=1408 TSval=2578596954 TSecr=1560778641 [TCP PDU reassembled in 226]"
"223","11:48:01.327494","64.65.63.120","192.168.0.227","TCP","1474","443  >  55087 [PSH, ACK] Seq=7217 Ack=9429 Win=1943 Len=1408 TSval=2578596954 TSecr=1560778641 [TCP PDU reassembled in 226]"
"224","11:48:01.327586","192.168.0.227","64.65.63.120","TCP","66","55087  >  443 [ACK] Seq=9429 Ack=8625 Win=10276 Len=0 TSval=1560778680 TSecr=2578596954"
"225","11:48:01.327688","192.168.0.227","64.65.63.120","TCP","66","[TCP Window Update] 55087  >  443 [ACK] Seq=9429 Ack=8625 Win=10320 Len=0 TSval=1560778680 TSecr=2578596954"
"226","11:48:01.356811","64.65.63.120","192.168.0.227","TLSv1.2","870","Application Data"
"227","11:48:01.356908","192.168.0.227","64.65.63.120","TCP","66","55087  >  443 [ACK] Seq=9429 Ack=9429 Win=10308 Len=0 TSval=1560778709 TSecr=2578596983"
"228","11:48:01.417774","192.168.0.227","64.65.63.120","TLSv1.2","602","Application Data"
"229","11:48:01.460312","192.168.0.227","5.28.195.2","TCP","78","61312  >  443 [SYN, ECE, CWR] Seq=0 Win=65535 Len=0 MSS=1460 WS=16 TSval=3048201287 TSecr=0 SACK_PERM"
"230","11:48:01.460358","192.168.0.227","5.28.195.2","TCP","78","61313  >  80 [SYN, ECE, CWR] Seq=0 Win=65535 Len=0 MSS=1460 WS=16 TSval=151535527 TSecr=0 SACK_PERM"
"231","11:48:01.460408","192.168.0.227","5.28.195.2","TCP","78","61314  >  5222 [SYN, ECE, CWR] Seq=0 Win=65535 Len=0 MSS=1460 WS=16 TSval=1950220990 TSecr=0 SACK_PERM"
"232","11:48:01.494899","64.65.63.120","192.168.0.227","TCP","66","443  >  55087 [ACK] Seq=9429 Ack=9965 Win=1943 Len=0 TSval=2578597122 TSecr=1560778770"
"233","11:48:01.494901","5.28.195.2","192.168.0.227","TCP","74","443  >  61312 [SYN, ACK, ECE] Seq=0 Ack=1 Win=65535 Len=0 MSS=1240 SACK_PERM TSval=2121022718 TSecr=3048201287 WS=1024"
"234","11:48:01.495033","192.168.0.227","5.28.195.2","TCP","66","61312  >  443 [ACK] Seq=1 Ack=1 Win=1048560 Len=0 TSval=3048201322 TSecr=2121022718"
"235","11:48:01.495579","192.168.0.227","5.28.195.2","TLSv1","583","Client Hello"
"236","11:48:01.525361","64.65.63.120","192.168.0.227","TCP","1474","443  >  55087 [ACK] Seq=9429 Ack=9965 Win=1943 Len=1408 TSval=2578597151 TSecr=1560778770 [TCP PDU reassembled in 237]"
"237","11:48:01.525363","64.65.63.120","192.168.0.227","TLSv1.2","222","Application Data"
"238","11:48:01.525457","192.168.0.227","64.65.63.120","TCP","66","55087  >  443 [ACK] Seq=9965 Ack=10993 Win=10296 Len=0 TSval=1560778878 TSecr=2578597151"
"239","11:48:01.535393","5.28.195.2","192.168.0.227","TCP","66","443  >  61312 [ACK] Seq=1 Ack=518 Win=67584 Len=0 TSval=2121022804 TSecr=3048201322"
"240","11:48:01.537421","5.28.195.2","192.168.0.227","TCP","66","443  >  61312 [FIN, ACK] Seq=1 Ack=518 Win=67584 Len=0 TSval=2121022805 TSecr=3048201322"
"241","11:48:01.537483","192.168.0.227","5.28.195.2","TCP","66","61312  >  443 [ACK] Seq=518 Ack=2 Win=1048560 Len=0 TSval=3048201364 TSecr=2121022805"
"242","11:48:01.537618","192.168.0.227","5.28.195.2","TCP","66","61312  >  443 [FIN, ACK] Seq=518 Ack=2 Win=1048560 Len=0 TSval=3048201364 TSecr=2121022805"
"243","11:48:01.549593","192.168.0.227","64.65.63.120","TLSv1.2","602","Application Data"
"244","11:48:01.578402","5.28.195.2","192.168.0.227","TCP","56","443  >  61312 [RST] Seq=2 Win=0 Len=0"
"245","11:48:01.588879","64.65.63.120","192.168.0.227","TCP","66","443  >  55087 [ACK] Seq=10993 Ack=10501 Win=1943 Len=0 TSval=2578597215 TSecr=1560778902"
"246","11:48:01.603244","fe80::1864:4d30:9585:912f","fe80::8f4:f6e1:77d0:ab3e","TCP","74","56476  >  54855 [ACK] Seq=1 Ack=1 Win=2048 Len=0"
"247","11:48:01.603353","fe80::8f4:f6e1:77d0:ab3e","fe80::1864:4d30:9585:912f","TCP","86","[TCP ACKed unseen segment] 54855  >  56476 [ACK] Seq=1 Ack=2 Win=2048 Len=0 TSval=2999032436 TSecr=144426511"
"248","11:48:01.635614","64.65.63.120","192.168.0.227","TLSv1.2","602","Application Data"
"249","11:48:01.635708","192.168.0.227","64.65.63.120","TCP","66","55087  >  443 [ACK] Seq=10501 Ack=11529 Win=10312 Len=0 TSval=1560778988 TSecr=2578597262"
"250","11:48:01.636540","192.168.0.227","64.65.63.120","TCP","1474","55087  >  443 [ACK] Seq=10501 Ack=11529 Win=10320 Len=1408 TSval=1560778989 TSecr=2578597262 [TCP PDU reassembled in 251]"
"251","11:48:01.636553","192.168.0.227","64.65.63.120","TLSv1.2","736","Application Data"
"252","11:48:01.672339","64.65.63.120","192.168.0.227","TCP","66","443  >  55087 [ACK] Seq=11529 Ack=12579 Win=1927 Len=0 TSval=2578597299 TSecr=1560778989"
"253","11:48:01.722280","64.65.63.120","192.168.0.227","TLSv1.2","602","Application Data"
"254","11:48:01.722470","192.168.0.227","64.65.63.120","TCP","66","55087  >  443 [ACK] Seq=12579 Ack=12065 Win=10312 Len=0 TSval=1560779075 TSecr=2578597349"
"255","11:48:01.736246","64.65.63.120","192.168.0.227","TCP","1474","443  >  55087 [ACK] Seq=12065 Ack=12579 Win=1927 Len=1408 TSval=2578597362 TSecr=1560778989 [TCP PDU reassembled in 259]"
"256","11:48:01.736250","64.65.63.120","192.168.0.227","TCP","1474","443  >  55087 [PSH, ACK] Seq=13473 Ack=12579 Win=1927 Len=1408 TSval=2578597362 TSecr=1560778989 [TCP PDU reassembled in 259]"
"257","11:48:01.736473","192.168.0.227","64.65.63.120","TCP","66","55087  >  443 [ACK] Seq=12579 Ack=14881 Win=10276 Len=0 TSval=1560779089 TSecr=2578597362"
"258","11:48:01.736641","192.168.0.227","64.65.63.120","TCP","66","[TCP Window Update] 55087  >  443 [ACK] Seq=12579 Ack=14881 Win=10320 Len=0 TSval=1560779089 TSecr=2578597362"
"259","11:48:01.755796","64.65.63.120","192.168.0.227","TLSv1.2","1406","Application Data, Application Data"
"260","11:48:01.755971","192.168.0.227","64.65.63.120","TCP","66","55087  >  443 [ACK] Seq=12579 Ack=16221 Win=10300 Len=0 TSval=1560779108 TSecr=2578597382"
"261","11:48:01.756263","192.168.0.227","64.65.63.120","TLSv1.2","602","Application Data"
"262","11:48:01.759598","192.168.0.227","64.65.63.120","TLSv1.2","1474","Application Data"
"263","11:48:01.759626","192.168.0.227","64.65.63.120","TLSv1.2","244","Application Data"
"264","11:48:01.795415","64.65.63.120","192.168.0.227","TCP","66","443  >  55087 [ACK] Seq=16221 Ack=13115 Win=1923 Len=0 TSval=2578597421 TSecr=1560779109"
"265","11:48:01.795417","64.65.63.120","192.168.0.227","TCP","66","443  >  55087 [ACK] Seq=16221 Ack=14701 Win=1911 Len=0 TSval=2578597421 TSecr=1560779112"
"266","11:48:01.813849","64.65.63.120","192.168.0.227","TLSv1.2","1116","Application Data"
"267","11:48:01.814001","192.168.0.227","64.65.63.120","TCP","66","55087  >  443 [ACK] Seq=14701 Ack=17271 Win=10304 Len=0 TSval=1560779166 TSecr=2578597440"
"268","11:48:01.828639","192.168.0.227","64.65.63.120","TLSv1.2","602","Application Data"
"269","11:48:01.842244","192.168.0.227","64.65.63.120","TCP","1474","55087  >  443 [ACK] Seq=15237 Ack=17271 Win=10320 Len=1408 TSval=1560779195 TSecr=2578597440 [TCP PDU reassembled in 270]"
"270","11:48:01.842269","192.168.0.227","64.65.63.120","TLSv1.2","1250","Application Data"
"271","11:48:01.843554","192.168.0.227","64.65.63.120","TCP","1474","55087  >  443 [ACK] Seq=17829 Ack=17271 Win=10320 Len=1408 TSval=1560779196 TSecr=2578597440 [TCP PDU reassembled in 272]"
"272","11:48:01.843565","192.168.0.227","64.65.63.120","TLSv1.2","222","Application Data"
"273","11:48:01.854573","64.65.63.120","192.168.0.227","TCP","1474","443  >  55087 [ACK] Seq=17271 Ack=14701 Win=1911 Len=1408 TSval=2578597481 TSecr=1560779166 [TCP PDU reassembled in 274]"
"274","11:48:01.854576","64.65.63.120","192.168.0.227","TLSv1.2","222","Application Data"
