"No.","Time","Source","Destination","Protocol","Length","Info"
"1","11:00:04.264983","104.46.162.224","192.168.0.74","TCP","66","443  >  59502 [ACK] Seq=1 Ack=1 Win=16381 Len=0 TSval=138813507 TSecr=4154796950"
"2","11:00:04.744225","192.168.0.74","5.28.195.2","TCP","78","59574  >  5222 [SYN, ECE, CWR] Seq=0 Win=65535 Len=0 MSS=1460 WS=16 TSval=3821862264 TSecr=0 SACK_PERM"
"3","11:00:04.744233","192.168.0.74","5.28.195.2","TCP","78","59575  >  80 [SYN, ECE, CWR] Seq=0 Win=65535 Len=0 MSS=1460 WS=16 TSval=416418205 TSecr=0 SACK_PERM"
"4","11:00:04.744234","192.168.0.74","5.28.195.2","TCP","78","59576  >  443 [SYN, ECE, CWR] Seq=0 Win=65535 Len=0 MSS=1460 WS=16 TSval=1454609456 TSecr=0 SACK_PERM"
"5","11:00:04.793158","5.28.195.2","192.168.0.74","TCP","74","443  >  59576 [SYN, ACK, ECE] Seq=0 Ack=1 Win=65535 Len=0 MSS=1240 SACK_PERM TSval=1727816870 TSecr=1454609456 WS=1024"
"6","11:00:04.793421","192.168.0.74","5.28.195.2","TCP","66","59576  >  443 [ACK] Seq=1 Ack=1 Win=1048560 Len=0 TSval=1454609505 TSecr=1727816870"
"7","11:00:04.793721","192.168.0.74","5.28.195.2","TLSv1","583","Client Hello"
"8","11:00:04.843521","5.28.195.2","192.168.0.74","TCP","66","443  >  59576 [ACK] Seq=1 Ack=518 Win=67584 Len=0 TSval=1727816958 TSecr=1454609506"
"9","11:00:04.843523","5.28.195.2","192.168.0.74","TCP","66","443  >  59576 [FIN, ACK] Seq=1 Ack=518 Win=67584 Len=0 TSval=1727816958 TSecr=1454609506"
"10","11:00:04.843745","192.168.0.74","5.28.195.2","TCP","66","59576  >  443 [ACK] Seq=518 Ack=2 Win=1048560 Len=0 TSval=1454609556 TSecr=1727816958"
"11","11:00:04.843920","192.168.0.74","5.28.195.2","TCP","66","59576  >  443 [FIN, ACK] Seq=518 Ack=2 Win=1048560 Len=0 TSval=1454609556 TSecr=1727816958"
"12","11:00:04.876200","192.168.0.192","230.0.0.1","UDP","92","58107  >  6666 Len=50"
"13","11:00:04.883038","5.28.195.2","192.168.0.74","TCP","56","443  >  59576 [RST] Seq=2 Win=0 Len=0"
"14","11:00:04.922688","64.65.63.120","192.168.0.74","TLSv1.2","602","Application Data"
"15","11:00:04.922825","192.168.0.74","64.65.63.120","TCP","66","59487  >  443 [ACK] Seq=1 Ack=537 Win=9190 Len=0 TSval=3160813354 TSecr=2678106116"
"16","11:00:05.081163","192.168.0.192","230.0.0.1","UDP","92","59448  >  6666 Len=50"
"17","11:00:05.189622","192.168.0.192","230.0.0.1","UDP","92","62979  >  6666 Len=50"
"18","11:00:05.745505","192.168.0.74","5.28.195.2","TCP","78","[TCP Retransmission] 59575  >  80 [SYN] Seq=0 Win=65535 Len=0 MSS=1460 WS=16 TSval=416419206 TSecr=0 SACK_PERM"
"19","11:00:05.745546","192.168.0.74","5.28.195.2","TCP","78","[TCP Retransmission] 59574  >  5222 [SYN] Seq=0 Win=65535 Len=0 MSS=1460 WS=16 TSval=3821863265 TSecr=0 SACK_PERM"
"20","11:00:05.817964","192.168.0.74","64.65.63.120","TLSv1.2","602","Application Data"
"21","11:00:05.856341","64.65.63.120","192.168.0.74","TCP","66","443  >  59487 [ACK] Seq=537 Ack=537 Win=472 Len=0 TSval=2678107051 TSecr=3160814249"
"22","11:00:05.900398","192.168.0.192","230.0.0.1","UDP","92","58107  >  6666 Len=50"
"23","11:00:06.002862","192.168.0.192","230.0.0.1","UDP","92","59448  >  6666 Len=50"
"24","11:00:06.027545","64.65.63.120","192.168.0.74","TCP","1474","443  >  59487 [ACK] Seq=537 Ack=537 Win=476 Len=1408 TSval=2678107222 TSecr=3160814249 [TCP PDU reassembled in 28]"
"25","11:00:06.027548","64.65.63.120","192.168.0.74","TCP","1474","443  >  59487 [PSH, ACK] Seq=1945 Ack=537 Win=476 Len=1408 TSval=2678107222 TSecr=3160814249 [TCP PDU reassembled in 28]"
"26","11:00:06.027693","192.168.0.74","64.65.63.120","TCP","66","59487  >  443 [ACK] Seq=537 Ack=3353 Win=9154 Len=0 TSval=3160814459 TSecr=2678107222"
"27","11:00:06.027886","192.168.0.74","64.65.63.120","TCP","66","[TCP Window Update] 59487  >  443 [ACK] Seq=537 Ack=3353 Win=9198 Len=0 TSval=3160814459 TSecr=2678107222"
"28","11:00:06.029450","64.65.63.120","192.168.0.74","TLSv1.2","1320","Application Data"
"29","11:00:06.029452","64.65.63.120","192.168.0.74","TCP","1474","443  >  59487 [ACK] Seq=4607 Ack=537 Win=476 Len=1408 TSval=2678107222 TSecr=3160814249 [TCP PDU reassembled in 34]"
"30","11:00:06.029454","64.65.63.120","192.168.0.74","TCP","1474","443  >  59487 [PSH, ACK] Seq=6015 Ack=537 Win=476 Len=1408 TSval=2678107222 TSecr=3160814249 [TCP PDU reassembled in 34]"
"31","11:00:06.029492","192.168.0.74","64.65.63.120","TCP","66","59487  >  443 [ACK] Seq=537 Ack=7423 Win=9135 Len=0 TSval=3160814460 TSecr=2678107222"
"32","11:00:06.029604","192.168.0.74","64.65.63.120","TCP","66","[TCP Window Update] 59487  >  443 [ACK] Seq=537 Ack=7423 Win=9198 Len=0 TSval=3160814461 TSecr=2678107222"
"33","11:00:06.029855","192.168.0.74","64.65.63.120","TLSv1.2","602","Application Data"
"34","11:00:06.042401","64.65.63.120","192.168.0.74","TLSv1.2","1474","Application Data"
"35","11:00:06.042404","64.65.63.120","192.168.0.74","TCP","1474","443  >  59487 [PSH, ACK] Seq=8831 Ack=537 Win=476 Len=1408 TSval=2678107237 TSecr=3160814249 [TCP PDU reassembled in 40]"
"36","11:00:06.042406","64.65.63.120","192.168.0.74","TCP","1474","443  >  59487 [ACK] Seq=10239 Ack=537 Win=476 Len=1408 TSval=2678107237 TSecr=3160814249 [TCP PDU reassembled in 40]"
"37","11:00:06.042539","192.168.0.74","64.65.63.120","TCP","66","59487  >  443 [ACK] Seq=1073 Ack=8831 Win=9176 Len=0 TSval=3160814473 TSecr=2678107237"
"38","11:00:06.042576","192.168.0.74","64.65.63.120","TCP","66","59487  >  443 [ACK] Seq=1073 Ack=11647 Win=9132 Len=0 TSval=3160814474 TSecr=2678107237"
"39","11:00:06.042684","192.168.0.74","64.65.63.120","TCP","66","[TCP Window Update] 59487  >  443 [ACK] Seq=1073 Ack=11647 Win=9198 Len=0 TSval=3160814474 TSecr=2678107237"
"40","11:00:06.069813","64.65.63.120","192.168.0.74","TLSv1.2","866","Application Data, Application Data"
"41","11:00:06.069916","192.168.0.74","64.65.63.120","TCP","66","59487  >  443 [ACK] Seq=1073 Ack=12447 Win=9186 Len=0 TSval=3160814501 TSecr=2678107265"
"42","11:00:06.075453","64.65.63.120","192.168.0.74","TCP","66","443  >  59487 [ACK] Seq=12447 Ack=1073 Win=472 Len=0 TSval=2678107270 TSecr=3160814461"
"43","11:00:06.105557","192.168.0.192","230.0.0.1","UDP","92","62979  >  6666 Len=50"
"44","11:00:06.116906","64.65.63.120","192.168.0.74","TCP","1474","443  >  59487 [ACK] Seq=12447 Ack=1073 Win=476 Len=1408 TSval=2678107313 TSecr=3160814501 [TCP PDU reassembled in 46]"
"45","11:00:06.116907","64.65.63.120","192.168.0.74","TCP","1474","443  >  59487 [PSH, ACK] Seq=13855 Ack=1073 Win=476 Len=1408 TSval=2678107313 TSecr=3160814501 [TCP PDU reassembled in 46]"
"46","11:00:06.116909","64.65.63.120","192.168.0.74","TLSv1.2","870","Application Data"
"47","11:00:06.117022","192.168.0.74","64.65.63.120","TCP","66","59487  >  443 [ACK] Seq=1073 Ack=16067 Win=9142 Len=0 TSval=3160814548 TSecr=2678107313"
"48","11:00:06.117178","192.168.0.74","64.65.63.120","TCP","66","[TCP Window Update] 59487  >  443 [ACK] Seq=1073 Ack=16067 Win=9198 Len=0 TSval=3160814548 TSecr=2678107313"
"49","11:00:06.119626","64.65.63.120","192.168.0.74","TCP","1474","443  >  59487 [ACK] Seq=16067 Ack=1073 Win=476 Len=1408 TSval=2678107316 TSecr=3160814501 [TCP PDU reassembled in 51]"
"50","11:00:06.119629","64.65.63.120","192.168.0.74","TCP","1474","443  >  59487 [PSH, ACK] Seq=17475 Ack=1073 Win=476 Len=1408 TSval=2678107316 TSecr=3160814501 [TCP PDU reassembled in 51]"
"51","11:00:06.119630","64.65.63.120","192.168.0.74","TLSv1.2","1474","Application Data"
"52","11:00:06.119730","192.168.0.74","64.65.63.120","TCP","66","59487  >  443 [ACK] Seq=1073 Ack=20291 Win=9132 Len=0 TSval=3160814551 TSecr=2678107316"
"53","11:00:06.120065","64.65.63.120","192.168.0.74","TCP","1474","443  >  59487 [PSH, ACK] Seq=20291 Ack=1073 Win=476 Len=1408 TSval=2678107316 TSecr=3160814501 [TCP PDU reassembled in 55]"
"54","11:00:06.120067","64.65.63.120","192.168.0.74","TCP","1474","443  >  59487 [ACK] Seq=21699 Ack=1073 Win=476 Len=1408 TSval=2678107316 TSecr=3160814501 [TCP PDU reassembled in 55]"
"55","11:00:06.120068","64.65.63.120","192.168.0.74","TLSv1.2","1474","Application Data"
"56","11:00:06.120069","64.65.63.120","192.168.0.74","TCP","1474","443  >  59487 [PSH, ACK] Seq=24515 Ack=1073 Win=476 Len=1408 TSval=2678107316 TSecr=3160814501 [TCP PDU reassembled in 58]"
"57","11:00:06.120070","64.65.63.120","192.168.0.74","TCP","1474","443  >  59487 [ACK] Seq=25923 Ack=1073 Win=476 Len=1408 TSval=2678107316 TSecr=3160814501 [TCP PDU reassembled in 58]"
"58","11:00:06.120071","64.65.63.120","192.168.0.74","TLSv1.2","1474","Application Data"
"59","11:00:06.120072","64.65.63.120","192.168.0.74","TCP","1474","443  >  59487 [PSH, ACK] Seq=28739 Ack=1073 Win=476 Len=1408 TSval=2678107316 TSecr=3160814501 [TCP PDU reassembled in 60]"
"60","11:00:06.120073","64.65.63.120","192.168.0.74","TLSv1.2","1474","Application Data"
"61","11:00:06.120074","64.65.63.120","192.168.0.74","TCP","1474","443  >  59487 [PSH, ACK] Seq=31555 Ack=1073 Win=476 Len=1408 TSval=2678107316 TSecr=3160814501 [TCP PDU reassembled in 68]"
"62","11:00:06.120075","64.65.63.120","192.168.0.74","TCP","1474","443  >  59487 [ACK] Seq=32963 Ack=1073 Win=476 Len=1408 TSval=2678107316 TSecr=3160814501 [TCP PDU reassembled in 68]"
"63","11:00:06.120145","192.168.0.74","64.65.63.120","TCP","66","59487  >  443 [ACK] Seq=1073 Ack=34371 Win=8912 Len=0 TSval=3160814551 TSecr=2678107316"
"64","11:00:06.120407","192.168.0.74","64.65.63.120","TCP","66","[TCP Window Update] 59487  >  443 [ACK] Seq=1073 Ack=34371 Win=9198 Len=0 TSval=3160814551 TSecr=2678107316"
"65","11:00:06.120676","192.168.0.74","64.65.63.120","TLSv1.2","602","Application Data"
"66","11:00:06.146813","192.168.0.74","64.65.63.120","TLSv1.2","1474","Application Data"
"67","11:00:06.146832","192.168.0.74","64.65.63.120","TLSv1.2","244","Application Data"
"68","11:00:06.156883","64.65.63.120","192.168.0.74","TLSv1.2","1474","Application Data"
"69","11:00:06.156885","64.65.63.120","192.168.0.74","TCP","1474","443  >  59487 [PSH, ACK] Seq=35779 Ack=1073 Win=476 Len=1408 TSval=2678107352 TSecr=3160814548 [TCP PDU reassembled in 70]"
"70","11:00:06.156886","64.65.63.120","192.168.0.74","TLSv1.2","1474","Application Data"
"71","11:00:06.156888","64.65.63.120","192.168.0.74","TCP","1474","443  >  59487 [PSH, ACK] Seq=38595 Ack=1073 Win=476 Len=1408 TSval=2678107352 TSecr=3160814548 [TCP PDU reassembled in 73]"
"72","11:00:06.156889","64.65.63.120","192.168.0.74","TCP","66","443  >  59487 [ACK] Seq=40003 Ack=1609 Win=472 Len=0 TSval=2678107352 TSecr=3160814552"
"73","11:00:06.156890","64.65.63.120","192.168.0.74","TLSv1.2","956","Application Data"
"74","11:00:06.156990","192.168.0.74","64.65.63.120","TCP","66","59487  >  443 [ACK] Seq=3195 Ack=40003 Win=9110 Len=0 TSval=3160814588 TSecr=2678107352"
"75","11:00:06.157034","192.168.0.74","64.65.63.120","TCP","66","59487  >  443 [ACK] Seq=3195 Ack=40893 Win=9097 Len=0 TSval=3160814588 TSecr=2678107352"
"76","11:00:06.157103","192.168.0.74","64.65.63.120","TCP","66","[TCP Window Update] 59487  >  443 [ACK] Seq=3195 Ack=40893 Win=9198 Len=0 TSval=3160814588 TSecr=2678107352"
"77","11:00:06.182525","64.65.63.120","192.168.0.74","TCP","66","443  >  59487 [ACK] Seq=40893 Ack=3195 Win=460 Len=0 TSval=2678107379 TSecr=3160814578"
"78","11:00:06.182633","192.168.0.74","64.65.63.120","TLSv1.2","602","Application Data"
"79","11:00:06.212187","64.65.63.120","192.168.0.74","TCP","1474","443  >  59487 [ACK] Seq=40893 Ack=3195 Win=460 Len=1408 TSval=2678107408 TSecr=3160814588 [TCP PDU reassembled in 81]"
"80","11:00:06.212189","64.65.63.120","192.168.0.74","TCP","1474","443  >  59487 [PSH, ACK] Seq=42301 Ack=3195 Win=460 Len=1408 TSval=2678107408 TSecr=3160814588 [TCP PDU reassembled in 81]"
"81","11:00:06.212191","64.65.63.120","192.168.0.74","TLSv1.2","870","Application Data"
"82","11:00:06.212303","192.168.0.74","64.65.63.120","TCP","66","59487  >  443 [ACK] Seq=3731 Ack=44513 Win=9142 Len=0 TSval=3160814643 TSecr=2678107408"
"83","11:00:06.213079","192.168.0.74","64.65.63.120","TCP","66","[TCP Window Update] 59487  >  443 [ACK] Seq=3731 Ack=44513 Win=9198 Len=0 TSval=3160814644 TSecr=2678107408"
"84","11:00:06.215025","64.65.63.120","192.168.0.74","TCP","1474","443  >  59487 [ACK] Seq=44513 Ack=3195 Win=460 Len=1408 TSval=2678107411 TSecr=3160814588 [TCP PDU reassembled in 86]"
"85","11:00:06.215027","64.65.63.120","192.168.0.74","TCP","1474","443  >  59487 [PSH, ACK] Seq=45921 Ack=3195 Win=460 Len=1408 TSval=2678107411 TSecr=3160814588 [TCP PDU reassembled in 86]"
"86","11:00:06.215029","64.65.63.120","192.168.0.74","TLSv1.2","1474","Application Data"
"87","11:00:06.215030","64.65.63.120","192.168.0.74","TCP","1474","443  >  59487 [PSH, ACK] Seq=48737 Ack=3195 Win=460 Len=1408 TSval=2678107411 TSecr=3160814588 [TCP PDU reassembled in 89]"
"88","11:00:06.215032","64.65.63.120","192.168.0.74","TCP","1474","443  >  59487 [ACK] Seq=50145 Ack=3195 Win=460 Len=1408 TSval=2678107411 TSecr=3160814588 [TCP PDU reassembled in 89]"
"89","11:00:06.215033","64.65.63.120","192.168.0.74","TLSv1.2","1474","Application Data"
"90","11:00:06.215034","64.65.63.120","192.168.0.74","TCP","1474","443  >  59487 [ACK] Seq=52961 Ack=3195 Win=460 Len=1408 TSval=2678107411 TSecr=3160814588 [TCP PDU reassembled in 92]"
"91","11:00:06.215035","64.65.63.120","192.168.0.74","TCP","1474","443  >  59487 [PSH, ACK] Seq=54369 Ack=3195 Win=460 Len=1408 TSval=2678107411 TSecr=3160814588 [TCP PDU reassembled in 92]"
"92","11:00:06.215037","64.65.63.120","192.168.0.74","TLSv1.2","1474","Application Data"
"93","11:00:06.215038","64.65.63.120","192.168.0.74","TCP","1474","443  >  59487 [PSH, ACK] Seq=57185 Ack=3195 Win=460 Len=1408 TSval=2678107411 TSecr=3160814588 [TCP PDU reassembled in 95]"
"94","11:00:06.215039","64.65.63.120","192.168.0.74","TCP","1474","443  >  59487 [ACK] Seq=58593 Ack=3195 Win=460 Len=1408 TSval=2678107411 TSecr=3160814588 [TCP PDU reassembled in 95]"
"95","11:00:06.215040","64.65.63.120","192.168.0.74","TLSv1.2","1474","Application Data, Application Data"
"96","11:00:06.215041","64.65.63.120","192.168.0.74","TCP","1474","443  >  59487 [PSH, ACK] Seq=61409 Ack=3195 Win=460 Len=1408 TSval=2678107411 TSecr=3160814588 [TCP PDU reassembled in 98]"
"97","11:00:06.215042","64.65.63.120","192.168.0.74","TCP","1474","443  >  59487 [ACK] Seq=62817 Ack=3195 Win=460 Len=1408 TSval=2678107411 TSecr=3160814588 [TCP PDU reassembled in 98]"
"98","11:00:06.215044","64.65.63.120","192.168.0.74","TLSv1.2","1474","Application Data"
"99","11:00:06.215045","64.65.63.120","192.168.0.74","TCP","1474","443  >  59487 [PSH, ACK] Seq=65633 Ack=3195 Win=460 Len=1408 TSval=2678107411 TSecr=3160814588 [TCP PDU reassembled in 101]"
"100","11:00:06.215046","64.65.63.120","192.168.0.74","TCP","1474","443  >  59487 [ACK] Seq=67041 Ack=3195 Win=460 Len=1408 TSval=2678107411 TSecr=3160814588 [TCP PDU reassembled in 101]"
"101","11:00:06.215048","64.65.63.120","192.168.0.74","TLSv1.2","1474","Application Data"
"102","11:00:06.215050","64.65.63.120","192.168.0.74","TCP","1474","443  >  59487 [ACK] Seq=69857 Ack=3195 Win=460 Len=1408 TSval=2678107411 TSecr=3160814588 [TCP PDU reassembled in 104]"
"103","11:00:06.215051","64.65.63.120","192.168.0.74","TCP","1474","443  >  59487 [PSH, ACK] Seq=71265 Ack=3195 Win=460 Len=1408 TSval=2678107411 TSecr=3160814588 [TCP PDU reassembled in 104]"
"104","11:00:06.215052","64.65.63.120","192.168.0.74","TLSv1.2","1474","Application Data"
"105","11:00:06.215053","64.65.63.120","192.168.0.74","TCP","1474","443  >  59487 [PSH, ACK] Seq=74081 Ack=3195 Win=460 Len=1408 TSval=2678107411 TSecr=3160814588 [TCP PDU reassembled in 110]"
"106","11:00:06.215189","192.168.0.74","64.65.63.120","TCP","66","59487  >  443 [ACK] Seq=3731 Ack=60001 Win=8956 Len=0 TSval=3160814646 TSecr=2678107411"
"107","11:00:06.215229","192.168.0.74","64.65.63.120","TCP","66","59487  >  443 [ACK] Seq=3731 Ack=75489 Win=8714 Len=0 TSval=3160814646 TSecr=2678107411"
"108","11:00:06.215891","192.168.0.74","64.65.63.120","TLSv1.2","602","Application Data"
"109","11:00:06.216095","64.65.63.120","192.168.0.74","TCP","1474","443  >  59487 [ACK] Seq=75489 Ack=3195 Win=460 Len=1408 TSval=2678107411 TSecr=3160814588 [TCP PDU reassembled in 110]"
"110","11:00:06.216096","64.65.63.120","192.168.0.74","TLSv1.2","1474","Application Data, Application Data"
"111","11:00:06.216128","192.168.0.74","64.65.63.120","TCP","66","59487  >  443 [ACK] Seq=4267 Ack=78305 Win=9154 Len=0 TSval=3160814647 TSecr=2678107411"
"112","11:00:06.216926","64.65.63.120","192.168.0.74","TCP","1474","443  >  59487 [ACK] Seq=78305 Ack=3195 Win=460 Len=1408 TSval=2678107411 TSecr=3160814588 [TCP PDU reassembled in 114]"
"113","11:00:06.216928","64.65.63.120","192.168.0.74","TCP","1474","443  >  59487 [PSH, ACK] Seq=79713 Ack=3195 Win=460 Len=1408 TSval=2678107411 TSecr=3160814588 [TCP PDU reassembled in 114]"
"114","11:00:06.216929","64.65.63.120","192.168.0.74","TLSv1.2","1474","Application Data"
"115","11:00:06.216931","64.65.63.120","192.168.0.74","TCP","1474","443  >  59487 [PSH, ACK] Seq=82529 Ack=3195 Win=460 Len=1408 TSval=2678107411 TSecr=3160814588 [TCP PDU reassembled in 116]"
"116","11:00:06.216932","64.65.63.120","192.168.0.74","TLSv1.2","1474","Application Data"
"117","11:00:06.216980","192.168.0.74","64.65.63.120","TCP","66","59487  >  443 [ACK] Seq=4267 Ack=85345 Win=9044 Len=0 TSval=3160814648 TSecr=2678107412"
"118","11:00:06.217287","192.168.0.74","64.65.63.120","TCP","66","[TCP Window Update] 59487  >  443 [ACK] Seq=4267 Ack=85345 Win=9198 Len=0 TSval=3160814648 TSecr=2678107412"
"119","11:00:06.248688","64.65.63.120","192.168.0.74","TCP","1474","443  >  59487 [ACK] Seq=85345 Ack=3731 Win=456 Len=1408 TSval=2678107443 TSecr=3160814614 [TCP PDU reassembled in 121]"
"120","11:00:06.248690","64.65.63.120","192.168.0.74","TCP","1474","443  >  59487 [PSH, ACK] Seq=86753 Ack=3731 Win=456 Len=1408 TSval=2678107443 TSecr=3160814614 [TCP PDU reassembled in 121]"
"121","11:00:06.248692","64.65.63.120","192.168.0.74","TLSv1.2","1474","Application Data"
"122","11:00:06.248694","64.65.63.120","192.168.0.74","TCP","1474","443  >  59487 [PSH, ACK] Seq=89569 Ack=3731 Win=456 Len=1408 TSval=2678107443 TSecr=3160814614 [TCP PDU reassembled in 124]"
"123","11:00:06.248695","64.65.63.120","192.168.0.74","TCP","1474","443  >  59487 [ACK] Seq=90977 Ack=3731 Win=456 Len=1408 TSval=2678107443 TSecr=3160814614 [TCP PDU reassembled in 124]"
"124","11:00:06.248696","64.65.63.120","192.168.0.74","TLSv1.2","1474","Application Data"
"125","11:00:06.248811","192.168.0.74","64.65.63.120","TLSv1.2","1116","Application Data"
"126","11:00:06.248923","192.168.0.74","64.65.63.120","TCP","66","[TCP Window Update] 59487  >  443 [ACK] Seq=5317 Ack=93793 Win=9198 Len=0 TSval=3160814680 TSecr=2678107443"
"127","11:00:06.252691","64.65.63.120","192.168.0.74","TLSv1.2","1474","Application Data, Application Data"
"128","11:00:06.252693","64.65.63.120","192.168.0.74","TCP","1474","443  >  59487 [PSH, ACK] Seq=95201 Ack=3731 Win=456 Len=1408 TSval=2678107448 TSecr=3160814644 [TCP PDU reassembled in 130]"
"129","11:00:06.252694","64.65.63.120","192.168.0.74","TCP","1474","443  >  59487 [ACK] Seq=96609 Ack=3731 Win=456 Len=1408 TSval=2678107448 TSecr=3160814644 [TCP PDU reassembled in 130]"
"130","11:00:06.252695","64.65.63.120","192.168.0.74","TLSv1.2","1474","Application Data"
"131","11:00:06.252697","64.65.63.120","192.168.0.74","TLSv1.2","1084","Application Data, Application Data"
"132","11:00:06.252859","192.168.0.74","64.65.63.120","TCP","66","59487  >  443 [ACK] Seq=5317 Ack=100443 Win=9198 Len=0 TSval=3160814684 TSecr=2678107448"
"133","11:00:06.284109","64.65.63.120","192.168.0.74","TCP","66","443  >  59487 [ACK] Seq=100443 Ack=5317 Win=456 Len=0 TSval=2678107480 TSecr=3160814644"
"134","11:00:06.284216","192.168.0.74","64.65.63.120","TLSv1.2","602","Application Data"
"135","11:00:06.287613","64.65.63.120","192.168.0.74","TLSv1.2","602","Application Data"
"136","11:00:06.287755","192.168.0.74","64.65.63.120","TCP","66","59487  >  443 [ACK] Seq=5853 Ack=100979 Win=9198 Len=0 TSval=3160814719 TSecr=2678107484"
"137","11:00:06.305800","64.65.63.120","192.168.0.74","TCP","1474","443  >  59487 [ACK] Seq=100979 Ack=5317 Win=456 Len=1408 TSval=2678107502 TSecr=3160814684 [TCP PDU reassembled in 139]"
"138","11:00:06.305802","64.65.63.120","192.168.0.74","TCP","1474","443  >  59487 [PSH, ACK] Seq=102387 Ack=5317 Win=456 Len=1408 TSval=2678107502 TSecr=3160814684 [TCP PDU reassembled in 139]"
"139","11:00:06.311033","64.65.63.120","192.168.0.74","TLSv1.2","1474","Application Data"
"140","11:00:06.311035","64.65.63.120","192.168.0.74","TCP","1474","443  >  59487 [ACK] Seq=105203 Ack=5317 Win=456 Len=1408 TSval=2678107505 TSecr=3160814684 [TCP PDU reassembled in 142]"
"141","11:00:06.311036","64.65.63.120","192.168.0.74","TCP","1474","443  >  59487 [PSH, ACK] Seq=106611 Ack=5317 Win=456 Len=1408 TSval=2678107505 TSecr=3160814684 [TCP PDU reassembled in 142]"
"142","11:00:06.311038","64.65.63.120","192.168.0.74","TLSv1.2","1474","Application Data"
"143","11:00:06.311039","64.65.63.120","192.168.0.74","TCP","1474","443  >  59487 [ACK] Seq=109427 Ack=5317 Win=456 Len=1408 TSval=2678107505 TSecr=3160814684 [TCP PDU reassembled in 145]"
"144","11:00:06.311041","64.65.63.120","192.168.0.74","TCP","1474","443  >  59487 [PSH, ACK] Seq=110835 Ack=5317 Win=456 Len=1408 TSval=2678107505 TSecr=3160814684 [TCP PDU reassembled in 145]"
"145","11:00:06.311042","64.65.63.120","192.168.0.74","TLSv1.2","1474","Application Data"
"146","11:00:06.311043","64.65.63.120","192.168.0.74","TCP","1474","443  >  59487 [ACK] Seq=113651 Ack=5317 Win=456 Len=1408 TSval=2678107505 TSecr=3160814684 [TCP PDU reassembled in 148]"
"147","11:00:06.311045","64.65.63.120","192.168.0.74","TCP","1474","443  >  59487 [PSH, ACK] Seq=115059 Ack=5317 Win=456 Len=1408 TSval=2678107505 TSecr=3160814684 [TCP PDU reassembled in 148]"
"148","11:00:06.311046","64.65.63.120","192.168.0.74","TLSv1.2","1474","Application Data"
"149","11:00:06.311048","64.65.63.120","192.168.0.74","TCP","1474","443  >  59487 [ACK] Seq=117875 Ack=5317 Win=456 Len=1408 TSval=2678107505 TSecr=3160814684 [TCP PDU reassembled in 151]"
"150","11:00:06.311049","64.65.63.120","192.168.0.74","TCP","1474","443  >  59487 [PSH, ACK] Seq=119283 Ack=5317 Win=456 Len=1408 TSval=2678107505 TSecr=3160814684 [TCP PDU reassembled in 151]"
"151","11:00:06.311050","64.65.63.120","192.168.0.74","TLSv1.2","1474","Application Data, Application Data"
"152","11:00:06.312974","64.65.63.120","192.168.0.74","TLSv1.2","1474","Application Data"
"153","11:00:06.312977","64.65.63.120","192.168.0.74","TCP","1474","443  >  59487 [ACK] Seq=123507 Ack=5317 Win=456 Len=1408 TSval=2678107508 TSecr=3160814684 [TCP PDU reassembled in 155]"
"154","11:00:06.312978","64.65.63.120","192.168.0.74","TCP","1474","443  >  59487 [PSH, ACK] Seq=124915 Ack=5317 Win=456 Len=1408 TSval=2678107508 TSecr=3160814684 [TCP PDU reassembled in 155]"
"155","11:00:06.312980","64.65.63.120","192.168.0.74","TLSv1.2","1474","Application Data"
"156","11:00:06.312981","64.65.63.120","192.168.0.74","TLSv1.2","1474","Application Data"
"157","11:00:06.312983","64.65.63.120","192.168.0.74","TCP","1474","443  >  59487 [PSH, ACK] Seq=129139 Ack=5317 Win=456 Len=1408 TSval=2678107508 TSecr=3160814684 [TCP PDU reassembled in 159]"
"158","11:00:06.312984","64.65.63.120","192.168.0.74","TCP","1474","443  >  59487 [ACK] Seq=130547 Ack=5317 Win=456 Len=1408 TSval=2678107508 TSecr=3160814684 [TCP PDU reassembled in 159]"
"159","11:00:06.312986","64.65.63.120","192.168.0.74","TLSv1.2","1474","Application Data"
"160","11:00:06.312987","64.65.63.120","192.168.0.74","TCP","1474","443  >  59487 [PSH, ACK] Seq=133363 Ack=5317 Win=456 Len=1408 TSval=2678107508 TSecr=3160814684 [TCP PDU reassembled in 162]"
"161","11:00:06.312988","64.65.63.120","192.168.0.74","TCP","1474","443  >  59487 [ACK] Seq=134771 Ack=5317 Win=456 Len=1408 TSval=2678107508 TSecr=3160814684 [TCP PDU reassembled in 162]"
"162","11:00:06.312989","64.65.63.120","192.168.0.74","TLSv1.2","1474","Application Data"
"163","11:00:06.312990","64.65.63.120","192.168.0.74","TCP","1474","443  >  59487 [PSH, ACK] Seq=137587 Ack=5317 Win=456 Len=1408 TSval=2678107508 TSecr=3160814684 [TCP PDU reassembled in 165]"
"164","11:00:06.312991","64.65.63.120","192.168.0.74","TCP","1474","443  >  59487 [ACK] Seq=138995 Ack=5317 Win=456 Len=1408 TSval=2678107508 TSecr=3160814684 [TCP PDU reassembled in 165]"
"165","11:00:06.312992","64.65.63.120","192.168.0.74","TLSv1.2","1474","Application Data"
"166","11:00:06.312994","64.65.63.120","192.168.0.74","TCP","1474","443  >  59487 [PSH, ACK] Seq=141811 Ack=5317 Win=456 Len=1408 TSval=2678107508 TSecr=3160814684 [TCP PDU reassembled in 168]"
"167","11:00:06.313409","192.168.0.74","64.65.63.120","TLSv1.2","602","Application Data"
"168","11:00:06.317625","64.65.63.120","192.168.0.74","TLSv1.2","1474","Application Data"
"169","11:00:06.317627","64.65.63.120","192.168.0.74","TCP","1474","443  >  59487 [PSH, ACK] Seq=144627 Ack=5317 Win=456 Len=1408 TSval=2678107515 TSecr=3160814684 [TCP PDU reassembled in 171]"
"170","11:00:06.317922","192.168.0.74","64.65.63.120","TLSv1.2","602","Application Data"
"171","11:00:06.323163","64.65.63.120","192.168.0.74","TLSv1.2","1064","Application Data"
"172","11:00:06.323280","192.168.0.74","64.65.63.120","TCP","66","59487  >  443 [ACK] Seq=6925 Ack=147033 Win=9183 Len=0 TSval=3160814754 TSecr=2678107519"
"173","11:00:06.352576","64.65.63.120","192.168.0.74","TCP","66","443  >  59487 [ACK] Seq=147033 Ack=6925 Win=456 Len=0 TSval=2678107549 TSecr=3160814744"
"174","11:00:06.352674","192.168.0.74","64.65.63.120","TLSv1.2","602","Application Data"
"175","11:00:06.431129","64.65.63.120","192.168.0.74","TCP","66","443  >  59487 [ACK] Seq=147033 Ack=7461 Win=456 Len=0 TSval=2678107628 TSecr=3160814784"
"176","11:00:06.589025","192.168.0.74","64.65.63.120","TLSv1.2","602","Application Data"
"177","11:00:06.624350","64.65.63.120","192.168.0.74","TCP","66","443  >  59487 [ACK] Seq=147033 Ack=7997 Win=456 Len=0 TSval=2678107821 TSecr=3160815020"
"178","11:00:06.679075","64.65.63.120","192.168.0.74","TLSv1.2","602","Application Data"
"179","11:00:06.679230","192.168.0.74","64.65.63.120","TCP","66","59487  >  443 [ACK] Seq=7997 Ack=147569 Win=9198 Len=0 TSval=3160815110 TSecr=2678107875"
"180","11:00:06.745874","192.168.0.74","5.28.195.2","TCP","78","[TCP Retransmission] 59575  >  80 [SYN] Seq=0 Win=65535 Len=0 MSS=1460 WS=16 TSval=416420207 TSecr=0 SACK_PERM"
"181","11:00:06.745907","192.168.0.74","5.28.195.2","TCP","78","[TCP Retransmission] 59574  >  5222 [SYN] Seq=0 Win=65535 Len=0 MSS=1460 WS=16 TSval=3821864266 TSecr=0 SACK_PERM"
"182","11:00:06.825665","192.168.0.74","64.65.63.120","TLSv1.2","602","Application Data"
"183","11:00:06.862614","64.65.63.120","192.168.0.74","TCP","66","443  >  59487 [ACK] Seq=147569 Ack=8533 Win=456 Len=0 TSval=2678108059 TSecr=3160815257"
"184","11:00:06.924240","192.168.0.192","230.0.0.1","UDP","92","58107  >  6666 Len=50"
"185","11:00:06.960389","64.65.63.120","192.168.0.74","TCP","1474","443  >  59487 [ACK] Seq=147569 Ack=8533 Win=456 Len=1408 TSval=2678108155 TSecr=3160815257 [TCP PDU reassembled in 187]"
"186","11:00:06.960391","64.65.63.120","192.168.0.74","TCP","1474","443  >  59487 [PSH, ACK] Seq=148977 Ack=8533 Win=456 Len=1408 TSval=2678108155 TSecr=3160815257 [TCP PDU reassembled in 187]"
"187","11:00:06.960393","64.65.63.120","192.168.0.74","TLSv1.2","870","Application Data"
"188","11:00:06.960395","64.65.63.120","192.168.0.74","TCP","1474","443  >  59487 [ACK] Seq=151189 Ack=8533 Win=456 Len=1408 TSval=2678108158 TSecr=3160815257 [TCP PDU reassembled in 192]"
"189","11:00:06.960396","64.65.63.120","192.168.0.74","TCP","1474","443  >  59487 [PSH, ACK] Seq=152597 Ack=8533 Win=456 Len=1408 TSval=2678108158 TSecr=3160815257 [TCP PDU reassembled in 192]"
"190","11:00:06.960576","192.168.0.74","64.65.63.120","TCP","66","59487  >  443 [ACK] Seq=8533 Ack=154005 Win=9198 Len=0 TSval=3160815392 TSecr=2678108158"
"191","11:00:06.960703","192.168.0.74","64.65.63.120","TLSv1.2","602","Application Data"
"192","11:00:06.978824","64.65.63.120","192.168.0.74","TLSv1.2","1474","Application Data, Application Data"
"193","11:00:06.978825","64.65.63.120","192.168.0.74","TCP","1474","443  >  59487 [PSH, ACK] Seq=155413 Ack=8533 Win=456 Len=1408 TSval=2678108173 TSecr=3160815257 [TCP PDU reassembled in 195]"
"194","11:00:06.978827","64.65.63.120","192.168.0.74","TCP","1474","443  >  59487 [ACK] Seq=156821 Ack=8533 Win=456 Len=1408 TSval=2678108173 TSecr=3160815257 [TCP PDU reassembled in 195]"
"195","11:00:06.978828","64.65.63.120","192.168.0.74","TLSv1.2","1474","Application Data"
"196","11:00:06.979011","192.168.0.74","64.65.63.120","TCP","66","59487  >  443 [ACK] Seq=9069 Ack=159637 Win=9198 Len=0 TSval=3160815410 TSecr=2678108174"
"197","11:00:06.995184","64.65.63.120","192.168.0.74","TLSv1.2","444","Application Data"
"198","11:00:06.995341","192.168.0.74","64.65.63.120","TCP","66","59487  >  443 [ACK] Seq=9069 Ack=160015 Win=9198 Len=0 TSval=3160815426 TSecr=2678108191"
"199","11:00:06.999348","64.65.63.120","192.168.0.74","TCP","66","443  >  59487 [ACK] Seq=160015 Ack=9069 Win=456 Len=0 TSval=2678108196 TSecr=3160815392"
"200","11:00:07.026771","192.168.0.192","230.0.0.1","UDP","92","59448  >  6666 Len=50"
"201","11:00:07.129029","192.168.0.192","230.0.0.1","UDP","92","62979  >  6666 Len=50"
"202","11:00:07.645878","192.87.28.82","192.168.0.74","TLSv1.2","1474","Application Data"
"203","11:00:07.645881","64.65.63.120","192.168.0.74","TCP","1474","443  >  59487 [ACK] Seq=160015 Ack=9069 Win=456 Len=1408 TSval=2678108765 TSecr=3160815426 [TCP PDU reassembled in 205]"
"204","11:00:07.645882","64.65.63.120","192.168.0.74","TCP","1474","443  >  59487 [PSH, ACK] Seq=161423 Ack=9069 Win=456 Len=1408 TSval=2678108765 TSecr=3160815426 [TCP PDU reassembled in 205]"
"205","11:00:07.645883","64.65.63.120","192.168.0.74","TLSv1.2","1320","Application Data"
"206","11:00:07.645885","64.65.63.120","192.168.0.74","TCP","1474","443  >  59487 [ACK] Seq=164085 Ack=9069 Win=456 Len=1408 TSval=2678108765 TSecr=3160815426 [TCP PDU reassembled in 208]"
"207","11:00:07.645885","64.65.63.120","192.168.0.74","TCP","1474","443  >  59487 [PSH, ACK] Seq=165493 Ack=9069 Win=456 Len=1408 TSval=2678108765 TSecr=3160815426 [TCP PDU reassembled in 208]"
"208","11:00:07.645887","64.65.63.120","192.168.0.74","TLSv1.2","1474","Application Data"
"209","11:00:07.645888","64.65.63.120","192.168.0.74","TCP","1474","443  >  59487 [PSH, ACK] Seq=168309 Ack=9069 Win=456 Len=1408 TSval=2678108765 TSecr=3160815426 [TCP PDU reassembled in 211]"
"210","11:00:07.645889","64.65.63.120","192.168.0.74","TCP","1474","443  >  59487 [ACK] Seq=169717 Ack=9069 Win=456 Len=1408 TSval=2678108765 TSecr=3160815426 [TCP PDU reassembled in 211]"
"211","11:00:07.645891","64.65.63.120","192.168.0.74","TLSv1.2","1474","Application Data"
"212","11:00:07.645892","64.65.63.120","192.168.0.74","TCP","1474","443  >  59487 [PSH, ACK] Seq=172533 Ack=9069 Win=456 Len=1408 TSval=2678108779 TSecr=3160815426 [TCP PDU reassembled in 217]"
"213","11:00:07.646040","192.168.0.74","192.87.28.82","TCP","78","59488  >  9001 [ACK] Seq=1 Ack=4294955473 Win=3720 Len=0 TSval=3829685032 TSecr=2690154344 SLE=1 SRE=1409"
"214","11:00:07.646193","192.168.0.74","64.65.63.120","TCP","66","59487  >  443 [ACK] Seq=9069 Ack=173941 Win=9198 Len=0 TSval=3160816077 TSecr=2678108779"
"215","11:00:07.646359","192.168.0.74","64.65.63.120","TLSv1.2","602","Application Data"
"216","11:00:07.667814","64.65.63.120","192.168.0.74","TCP","1474","443  >  59487 [ACK] Seq=173941 Ack=9069 Win=456 Len=1408 TSval=2678108864 TSecr=3160815426 [TCP PDU reassembled in 217]"
"217","11:00:07.683372","64.65.63.120","192.168.0.74","TLSv1.2","1474","Application Data"
"218","11:00:07.683375","64.65.63.120","192.168.0.74","TCP","1474","443  >  59487 [PSH, ACK] Seq=176757 Ack=9069 Win=456 Len=1408 TSval=2678108878 TSecr=3160816077 [TCP PDU reassembled in 220]"
"219","11:00:07.683381","64.65.63.120","192.168.0.74","TCP","1474","443  >  59487 [ACK] Seq=178165 Ack=9069 Win=456 Len=1408 TSval=2678108878 TSecr=3160816077 [TCP PDU reassembled in 220]"
"220","11:00:07.684001","64.65.63.120","192.168.0.74","TLSv1.2","1474","Application Data"
"221","11:00:07.684004","64.65.63.120","192.168.0.74","TCP","66","443  >  59487 [ACK] Seq=180981 Ack=9605 Win=456 Len=0 TSval=2678108878 TSecr=3160816077"
"222","11:00:07.684004","64.65.63.120","192.168.0.74","TCP","1474","443  >  59487 [ACK] Seq=180981 Ack=9605 Win=456 Len=1408 TSval=2678108878 TSecr=3160816077 [TCP PDU reassembled in 224]"
"223","11:00:07.684006","64.65.63.120","192.168.0.74","TCP","1474","443  >  59487 [PSH, ACK] Seq=182389 Ack=9605 Win=456 Len=1408 TSval=2678108878 TSecr=3160816077 [TCP PDU reassembled in 224]"
"224","11:00:07.684008","64.65.63.120","192.168.0.74","TLSv1.2","1474","Application Data"
"225","11:00:07.684009","64.65.63.120","192.168.0.74","TCP","1474","443  >  59487 [PSH, ACK] Seq=185205 Ack=9605 Win=456 Len=1408 TSval=2678108878 TSecr=3160816077 [TCP PDU reassembled in 226]"
"226","11:00:07.684011","64.65.63.120","192.168.0.74","TLSv1.2","1474","Application Data, Application Data"
"227","11:00:07.684012","64.65.63.120","192.168.0.74","TLSv1.2","1042","Application Data"
"228","11:00:07.684229","192.168.0.74","64.65.63.120","TCP","66","59487  >  443 [ACK] Seq=9605 Ack=188997 Win=9198 Len=0 TSval=3160816115 TSecr=2678108864"
"229","11:00:07.684435","192.168.0.74","64.65.63.120","TLSv1.2","602","Application Data"
"230","11:00:07.685466","64.65.63.120","192.168.0.74","TCP","1474","443  >  59487 [ACK] Seq=188997 Ack=9605 Win=456 Len=1408 TSval=2678108880 TSecr=3160816077 [TCP PDU reassembled in 232]"
"231","11:00:07.685468","64.65.63.120","192.168.0.74","TCP","1474","443  >  59487 [PSH, ACK] Seq=190405 Ack=9605 Win=456 Len=1408 TSval=2678108880 TSecr=3160816077 [TCP PDU reassembled in 232]"
"232","11:00:07.685469","64.65.63.120","192.168.0.74","TLSv1.2","1474","Application Data"
"233","11:00:07.685471","64.65.63.120","192.168.0.74","TCP","1474","443  >  59487 [PSH, ACK] Seq=193221 Ack=9605 Win=456 Len=1408 TSval=2678108880 TSecr=3160816077 [TCP PDU reassembled in 235]"
"234","11:00:07.685472","64.65.63.120","192.168.0.74","TCP","1474","443  >  59487 [ACK] Seq=194629 Ack=9605 Win=456 Len=1408 TSval=2678108880 TSecr=3160816077 [TCP PDU reassembled in 235]"
"235","11:00:07.685473","64.65.63.120","192.168.0.74","TLSv1.2","1474","Application Data"
"236","11:00:07.685475","64.65.63.120","192.168.0.74","TCP","1474","443  >  59487 [PSH, ACK] Seq=197445 Ack=9605 Win=456 Len=1408 TSval=2678108880 TSecr=3160816077 [TCP PDU reassembled in 238]"
"237","11:00:07.685476","64.65.63.120","192.168.0.74","TCP","1474","443  >  59487 [ACK] Seq=198853 Ack=9605 Win=456 Len=1408 TSval=2678108880 TSecr=3160816077 [TCP PDU reassembled in 238]"
"238","11:00:07.685477","64.65.63.120","192.168.0.74","TLSv1.2","1474","Application Data"
"239","11:00:07.685558","192.168.0.74","64.65.63.120","TCP","66","59487  >  443 [ACK] Seq=10141 Ack=201669 Win=9198 Len=0 TSval=3160816117 TSecr=2678108880"
"240","11:00:07.689453","192.87.28.82","192.168.0.74","TCP","1474","9001  >  59488 [ACK] Seq=1409 Ack=1 Win=1565 Len=1408 TSval=2690158158 TSecr=3829685032 [TCP PDU reassembled in 286]"
"241","11:00:07.689551","192.168.0.74","192.87.28.82","TCP","78","[TCP Dup ACK 213#1] 59488  >  9001 [ACK] Seq=1 Ack=4294955473 Win=3720 Len=0 TSval=3829685076 TSecr=2690154344 SLE=1 SRE=2817"
"242","11:00:07.721534","64.65.63.120","192.168.0.74","TCP","1474","443  >  59487 [ACK] Seq=201669 Ack=9605 Win=456 Len=1408 TSval=2678108915 TSecr=3160816077 [TCP PDU reassembled in 244]"
"243","11:00:07.721538","64.65.63.120","192.168.0.74","TCP","1474","443  >  59487 [PSH, ACK] Seq=203077 Ack=9605 Win=456 Len=1408 TSval=2678108915 TSecr=3160816077 [TCP PDU reassembled in 244]"
"244","11:00:07.721540","64.65.63.120","192.168.0.74","TLSv1.2","1474","Application Data, Application Data"
"245","11:00:07.721554","64.65.63.120","192.168.0.74","TCP","1474","443  >  59487 [PSH, ACK] Seq=205893 Ack=9605 Win=456 Len=1408 TSval=2678108915 TSecr=3160816077 [TCP PDU reassembled in 247]"
"246","11:00:07.721557","64.65.63.120","192.168.0.74","TCP","1474","443  >  59487 [ACK] Seq=207301 Ack=10141 Win=456 Len=1408 TSval=2678108916 TSecr=3160816077 [TCP PDU reassembled in 247]"
"247","11:00:07.721559","64.65.63.120","192.168.0.74","TLSv1.2","1474","Application Data"
"248","11:00:07.721562","64.65.63.120","192.168.0.74","TCP","1474","443  >  59487 [ACK] Seq=210117 Ack=10141 Win=456 Len=1408 TSval=2678108916 TSecr=3160816077 [TCP PDU reassembled in 250]"
"249","11:00:07.721564","64.65.63.120","192.168.0.74","TCP","1474","443  >  59487 [PSH, ACK] Seq=211525 Ack=10141 Win=456 Len=1408 TSval=2678108916 TSecr=3160816077 [TCP PDU reassembled in 250]"
"250","11:00:07.721566","64.65.63.120","192.168.0.74","TLSv1.2","1474","Application Data"
"251","11:00:07.721568","64.65.63.120","192.168.0.74","TCP","1474","443  >  59487 [PSH, ACK] Seq=214341 Ack=10141 Win=456 Len=1408 TSval=2678108916 TSecr=3160816077 [TCP PDU reassembled in 253]"
"252","11:00:07.721570","64.65.63.120","192.168.0.74","TCP","1474","443  >  59487 [ACK] Seq=215749 Ack=10141 Win=456 Len=1408 TSval=2678108916 TSecr=3160816077 [TCP PDU reassembled in 253]"
"253","11:00:07.721573","64.65.63.120","192.168.0.74","TLSv1.2","1474","Application Data"
"254","11:00:07.721807","192.168.0.74","64.65.63.120","TLSv1.2","602","Application Data"
"255","11:00:07.721871","192.168.0.74","64.65.63.120","TCP","66","[TCP Window Update] 59487  >  443 [ACK] Seq=10677 Ack=218565 Win=9198 Len=0 TSval=3160816153 TSecr=2678108915"
"256","11:00:07.725105","64.65.63.120","192.168.0.74","TCP","1474","443  >  59487 [ACK] Seq=218565 Ack=10141 Win=456 Len=1408 TSval=2678108918 TSecr=3160816077 [TCP PDU reassembled in 258]"
"257","11:00:07.725107","64.65.63.120","192.168.0.74","TCP","1474","443  >  59487 [PSH, ACK] Seq=219973 Ack=10141 Win=456 Len=1408 TSval=2678108918 TSecr=3160816077 [TCP PDU reassembled in 258]"
"258","11:00:07.725108","64.65.63.120","192.168.0.74","TLSv1.2","1474","Application Data, Application Data"
"259","11:00:07.725110","64.65.63.120","192.168.0.74","TCP","1474","443  >  59487 [PSH, ACK] Seq=222789 Ack=10141 Win=456 Len=1408 TSval=2678108918 TSecr=3160816077 [TCP PDU reassembled in 261]"
"260","11:00:07.725111","64.65.63.120","192.168.0.74","TCP","1474","443  >  59487 [ACK] Seq=224197 Ack=10141 Win=456 Len=1408 TSval=2678108919 TSecr=3160816077 [TCP PDU reassembled in 261]"
"261","11:00:07.725112","64.65.63.120","192.168.0.74","TLSv1.2","1474","Application Data"
"262","11:00:07.725113","64.65.63.120","192.168.0.74","TLSv1.2","1474","Application Data"
"263","11:00:07.725114","64.65.63.120","192.168.0.74","TLSv1.2","1474","Application Data"
"264","11:00:07.725115","64.65.63.120","192.168.0.74","TCP","1474","443  >  59487 [ACK] Seq=229829 Ack=10141 Win=456 Len=1408 TSval=2678108920 TSecr=3160816077 [TCP PDU reassembled in 266]"
"265","11:00:07.725117","64.65.63.120","192.168.0.74","TCP","1474","443  >  59487 [PSH, ACK] Seq=231237 Ack=10141 Win=456 Len=1408 TSval=2678108920 TSecr=3160816077 [TCP PDU reassembled in 266]"
"266","11:00:07.725118","64.65.63.120","192.168.0.74","TLSv1.2","1474","Application Data"
"267","11:00:07.725119","64.65.63.120","192.168.0.74","TCP","1474","443  >  59487 [PSH, ACK] Seq=234053 Ack=10141 Win=456 Len=1408 TSval=2678108920 TSecr=3160816077 [TCP PDU reassembled in 270]"
"268","11:00:07.725383","192.168.0.74","64.65.63.120","TLSv1.2","602","Application Data"
"269","11:00:07.726905","64.65.63.120","192.168.0.74","TCP","1474","443  >  59487 [ACK] Seq=235461 Ack=10141 Win=456 Len=1408 TSval=2678108921 TSecr=3160816077 [TCP PDU reassembled in 270]"
"270","11:00:07.726907","64.65.63.120","192.168.0.74","TLSv1.2","1474","Application Data"
"271","11:00:07.726908","64.65.63.120","192.168.0.74","TCP","1474","443  >  59487 [ACK] Seq=238277 Ack=10141 Win=456 Len=1408 TSval=2678108921 TSecr=3160816077 [TCP PDU reassembled in 273]"
