"No.","Time","Source","Destination","Protocol","Length","Info"
"1","10:59:31.448342","149.154.167.41","192.168.0.74","TCP","219","443  >  59400 [PSH, ACK] Seq=1 Ack=1 Win=2048 Len=153 TSval=322477744 TSecr=1842764609"
"2","10:59:31.448428","192.168.0.74","149.154.167.41","TCP","66","59400  >  443 [ACK] Seq=1 Ack=154 Win=65527 Len=0 TSval=1842764656 TSecr=322477744"
"3","10:59:31.593386","2a06:98c1:3107::6812:2715","2a02:ab88:b:4100:6163:ab1b:4f48:fc2c","TLSv1.2","110","Application Data"
"4","10:59:31.594077","2a02:ab88:b:4100:6163:ab1b:4f48:fc2c","2a06:98c1:3107::6812:2715","TCP","86","57522  >  443 [ACK] Seq=1 Ack=25 Win=2048 Len=0 TSval=3071477266 TSecr=1943951324"
"5","10:59:31.594080","2a02:ab88:b:4100:6163:ab1b:4f48:fc2c","2a06:98c1:3107::6812:2715","TLSv1.2","110","Application Data"
"6","10:59:31.594082","2a02:ab88:b:4100:6163:ab1b:4f48:fc2c","2a06:98c1:3107::6812:2715","TLSv1.2","112","Application Data"
"7","10:59:31.620020","2a06:98c1:3107::6812:2715","2a02:ab88:b:4100:6163:ab1b:4f48:fc2c","TCP","86","443  >  57522 [ACK] Seq=25 Ack=51 Win=16 Len=0 TSval=1943951349 TSecr=3071477267"
"8","10:59:31.739814","192.168.0.74","5.28.195.2","TCP","78","59548  >  5222 [SYN] Seq=0 Win=65535 Len=0 MSS=1460 WS=16 TSval=1170873768 TSecr=0 SACK_PERM"
"9","10:59:31.739854","192.168.0.74","5.28.195.2","TCP","78","59547  >  80 [SYN] Seq=0 Win=65535 Len=0 MSS=1460 WS=16 TSval=1427140332 TSecr=0 SACK_PERM"
"10","10:59:31.903133","192.168.0.192","230.0.0.1","UDP","92","58107  >  6666 Len=50"
"11","10:59:32.008601","192.168.0.192","230.0.0.1","UDP","92","59448  >  6666 Len=50"
"12","10:59:32.108739","192.168.0.192","230.0.0.1","UDP","92","62979  >  6666 Len=50"
"13","10:59:32.156465","192.168.0.74","64.65.63.120","TLSv1.2","602","Application Data"
"14","10:59:32.204820","64.65.63.120","192.168.0.74","TCP","66","443  >  59487 [ACK] Seq=1 Ack=537 Win=472 Len=0 TSval=2678073399 TSecr=3160780586"
"15","10:59:32.739980","192.168.0.74","5.28.195.2","TCP","78","[TCP Retransmission] 59548  >  5222 [SYN] Seq=0 Win=65535 Len=0 MSS=1460 WS=16 TSval=1170874769 TSecr=0 SACK_PERM"
"16","10:59:32.740053","192.168.0.74","5.28.195.2","TCP","78","[TCP Retransmission] 59547  >  80 [SYN] Seq=0 Win=65535 Len=0 MSS=1460 WS=16 TSval=1427141333 TSecr=0 SACK_PERM"
"17","10:59:32.927064","192.168.0.192","230.0.0.1","UDP","92","58107  >  6666 Len=50"
"18","10:59:33.032698","192.168.0.192","230.0.0.1","UDP","92","59448  >  6666 Len=50"
"19","10:59:33.078046","192.168.0.74","104.46.162.224","TCP","54","59501  >  443 [ACK] Seq=1 Ack=1 Win=2048 Len=0"
"20","10:59:33.131950","192.168.0.192","230.0.0.1","UDP","92","62979  >  6666 Len=50"
"21","10:59:33.544586","104.46.162.224","192.168.0.74","TCP","66","[TCP ACKed unseen segment] 443  >  59501 [ACK] Seq=1 Ack=2 Win=16384 Len=0 TSval=99915271 TSecr=4190382531"
"22","10:59:33.764456","192.168.0.74","64.65.63.120","TLSv1.2","602","Application Data"
"23","10:59:33.803976","64.65.63.120","192.168.0.74","TCP","66","443  >  59487 [ACK] Seq=1 Ack=1073 Win=468 Len=0 TSval=2678074998 TSecr=3160782194"
"24","10:59:33.958804","192.168.0.192","230.0.0.1","UDP","92","58107  >  6666 Len=50"
"25","10:59:34.056286","192.168.0.192","230.0.0.1","UDP","92","59448  >  6666 Len=50"
"26","10:59:34.056457","64.65.63.120","192.168.0.74","TCP","1474","443  >  59487 [ACK] Seq=1 Ack=1073 Win=476 Len=1408 TSval=2678075127 TSecr=3160782194 [TCP PDU reassembled in 28]"
"27","10:59:34.056460","64.65.63.120","192.168.0.74","TCP","1474","443  >  59487 [PSH, ACK] Seq=1409 Ack=1073 Win=476 Len=1408 TSval=2678075127 TSecr=3160782194 [TCP PDU reassembled in 28]"
"28","10:59:34.056463","64.65.63.120","192.168.0.74","TLSv1.2","1320","Application Data"
"29","10:59:34.056466","64.65.63.120","192.168.0.74","TCP","1474","443  >  59487 [ACK] Seq=4071 Ack=1073 Win=476 Len=1408 TSval=2678075127 TSecr=3160782194 [TCP PDU reassembled in 31]"
"30","10:59:34.056469","64.65.63.120","192.168.0.74","TCP","1474","443  >  59487 [PSH, ACK] Seq=5479 Ack=1073 Win=476 Len=1408 TSval=2678075127 TSecr=3160782194 [TCP PDU reassembled in 31]"
"31","10:59:34.056471","64.65.63.120","192.168.0.74","TLSv1.2","1474","Application Data"
"32","10:59:34.056473","64.65.63.120","192.168.0.74","TCP","1474","443  >  59487 [PSH, ACK] Seq=8295 Ack=1073 Win=476 Len=1408 TSval=2678075141 TSecr=3160782194 [TCP PDU reassembled in 33]"
"33","10:59:34.056475","64.65.63.120","192.168.0.74","TLSv1.2","1474","Application Data"
"34","10:59:34.056478","64.65.63.120","192.168.0.74","TCP","1474","443  >  59487 [PSH, ACK] Seq=11111 Ack=1073 Win=476 Len=1408 TSval=2678075221 TSecr=3160782194 [TCP PDU reassembled in 40]"
"35","10:59:34.056480","64.65.63.120","192.168.0.74","TCP","1474","443  >  59487 [ACK] Seq=12519 Ack=1073 Win=476 Len=1408 TSval=2678075225 TSecr=3160782194 [TCP PDU reassembled in 40]"
"36","10:59:34.056663","192.168.0.74","64.65.63.120","TCP","66","59487  >  443 [ACK] Seq=1073 Ack=8295 Win=9069 Len=0 TSval=3160782486 TSecr=2678075141"
"37","10:59:34.056731","192.168.0.74","64.65.63.120","TCP","66","59487  >  443 [ACK] Seq=1073 Ack=13927 Win=8981 Len=0 TSval=3160782487 TSecr=2678075225"
"38","10:59:34.056917","192.168.0.74","64.65.63.120","TCP","66","[TCP Window Update] 59487  >  443 [ACK] Seq=1073 Ack=13927 Win=9198 Len=0 TSval=3160782487 TSecr=2678075225"
"39","10:59:34.057384","192.168.0.74","64.65.63.120","TLSv1.2","602","Application Data"
"40","10:59:34.094250","64.65.63.120","192.168.0.74","TLSv1.2","1474","Application Data"
"41","10:59:34.094252","64.65.63.120","192.168.0.74","TCP","1474","443  >  59487 [PSH, ACK] Seq=15335 Ack=1073 Win=476 Len=1408 TSval=2678075290 TSecr=3160782486 [TCP PDU reassembled in 43]"
"42","10:59:34.094254","64.65.63.120","192.168.0.74","TCP","1474","443  >  59487 [ACK] Seq=16743 Ack=1073 Win=476 Len=1408 TSval=2678075290 TSecr=3160782486 [TCP PDU reassembled in 43]"
"43","10:59:34.094255","64.65.63.120","192.168.0.74","TLSv1.2","1474","Application Data"
"44","10:59:34.094257","64.65.63.120","192.168.0.74","TCP","1474","443  >  59487 [ACK] Seq=19559 Ack=1073 Win=476 Len=1408 TSval=2678075290 TSecr=3160782486 [TCP PDU reassembled in 46]"
"45","10:59:34.094258","64.65.63.120","192.168.0.74","TCP","1474","443  >  59487 [PSH, ACK] Seq=20967 Ack=1073 Win=476 Len=1408 TSval=2678075290 TSecr=3160782486 [TCP PDU reassembled in 46]"
"46","10:59:34.094259","64.65.63.120","192.168.0.74","TLSv1.2","1474","Application Data"
"47","10:59:34.094261","64.65.63.120","192.168.0.74","TCP","1474","443  >  59487 [PSH, ACK] Seq=23783 Ack=1073 Win=476 Len=1408 TSval=2678075290 TSecr=3160782486 [TCP PDU reassembled in 51]"
"48","10:59:34.094356","192.168.0.74","64.65.63.120","TCP","66","59487  >  443 [ACK] Seq=1609 Ack=25191 Win=9022 Len=0 TSval=3160782524 TSecr=2678075290"
"49","10:59:34.094501","192.168.0.74","64.65.63.120","TCP","66","[TCP Window Update] 59487  >  443 [ACK] Seq=1609 Ack=25191 Win=9198 Len=0 TSval=3160782524 TSecr=2678075290"
"50","10:59:34.095631","64.65.63.120","192.168.0.74","TCP","1474","443  >  59487 [ACK] Seq=25191 Ack=1073 Win=476 Len=1408 TSval=2678075290 TSecr=3160782486 [TCP PDU reassembled in 51]"
"51","10:59:34.095632","64.65.63.120","192.168.0.74","TLSv1.2","1422","Application Data, Application Data, Application Data"
"52","10:59:34.095634","64.65.63.120","192.168.0.74","TCP","1474","443  >  59487 [ACK] Seq=27955 Ack=1073 Win=476 Len=1408 TSval=2678075292 TSecr=3160782486 [TCP PDU reassembled in 56]"
"53","10:59:34.095635","64.65.63.120","192.168.0.74","TCP","1474","443  >  59487 [PSH, ACK] Seq=29363 Ack=1073 Win=476 Len=1408 TSval=2678075292 TSecr=3160782486 [TCP PDU reassembled in 56]"
"54","10:59:34.095671","192.168.0.74","64.65.63.120","TCP","66","59487  >  443 [ACK] Seq=1609 Ack=30771 Win=9111 Len=0 TSval=3160782525 TSecr=2678075292"
"55","10:59:34.095749","192.168.0.74","64.65.63.120","TCP","66","[TCP Window Update] 59487  >  443 [ACK] Seq=1609 Ack=30771 Win=9198 Len=0 TSval=3160782526 TSecr=2678075292"
"56","10:59:34.098155","64.65.63.120","192.168.0.74","TLSv1.2","1474","Application Data"
"57","10:59:34.098156","64.65.63.120","192.168.0.74","TCP","1474","443  >  59487 [PSH, ACK] Seq=32179 Ack=1073 Win=476 Len=1408 TSval=2678075295 TSecr=3160782487 [TCP PDU reassembled in 61]"
"58","10:59:34.098157","64.65.63.120","192.168.0.74","TCP","1474","443  >  59487 [ACK] Seq=33587 Ack=1073 Win=476 Len=1408 TSval=2678075295 TSecr=3160782487 [TCP PDU reassembled in 61]"
"59","10:59:34.098209","192.168.0.74","64.65.63.120","TLSv1.2","602","Application Data"
"60","10:59:34.098311","192.168.0.74","64.65.63.120","TCP","66","[TCP Window Update] 59487  >  443 [ACK] Seq=2145 Ack=34995 Win=9198 Len=0 TSval=3160782528 TSecr=2678075295"
"61","10:59:34.098808","64.65.63.120","192.168.0.74","TLSv1.2","1474","Application Data"
"62","10:59:34.098810","64.65.63.120","192.168.0.74","TCP","1474","443  >  59487 [ACK] Seq=36403 Ack=1073 Win=476 Len=1408 TSval=2678075295 TSecr=3160782487 [TCP PDU reassembled in 67]"
"63","10:59:34.098811","64.65.63.120","192.168.0.74","TCP","1474","443  >  59487 [PSH, ACK] Seq=37811 Ack=1073 Win=476 Len=1408 TSval=2678075295 TSecr=3160782487 [TCP PDU reassembled in 67]"
"64","10:59:34.098839","192.168.0.74","64.65.63.120","TCP","66","59487  >  443 [ACK] Seq=2145 Ack=39219 Win=9132 Len=0 TSval=3160782529 TSecr=2678075295"
"65","10:59:34.098892","192.168.0.74","64.65.63.120","TCP","66","[TCP Window Update] 59487  >  443 [ACK] Seq=2145 Ack=39219 Win=9198 Len=0 TSval=3160782529 TSecr=2678075295"
"66","10:59:34.112531","64.65.63.120","192.168.0.74","TCP","66","443  >  59487 [ACK] Seq=39219 Ack=1609 Win=472 Len=0 TSval=2678075295 TSecr=3160782487"
"67","10:59:34.120093","64.65.63.120","192.168.0.74","TLSv1.2","1474","Application Data, Application Data"
"68","10:59:34.120095","64.65.63.120","192.168.0.74","TCP","1474","443  >  59487 [PSH, ACK] Seq=40627 Ack=1609 Win=476 Len=1408 TSval=2678075316 TSecr=3160782487 [TCP PDU reassembled in 72]"
"69","10:59:34.120190","192.168.0.74","64.65.63.120","TCP","66","59487  >  443 [ACK] Seq=2145 Ack=42035 Win=9154 Len=0 TSval=3160782550 TSecr=2678075316"
"70","10:59:34.120281","192.168.0.74","64.65.63.120","TCP","66","[TCP Window Update] 59487  >  443 [ACK] Seq=2145 Ack=42035 Win=9198 Len=0 TSval=3160782550 TSecr=2678075316"
"71","10:59:34.135702","64.65.63.120","192.168.0.74","TCP","1474","443  >  59487 [ACK] Seq=42035 Ack=1609 Win=476 Len=1408 TSval=2678075327 TSecr=3160782524 [TCP PDU reassembled in 72]"
"72","10:59:34.135704","64.65.63.120","192.168.0.74","TLSv1.2","1474","Application Data"
"73","10:59:34.135706","64.65.63.120","192.168.0.74","TCP","1474","443  >  59487 [ACK] Seq=44851 Ack=1609 Win=476 Len=1408 TSval=2678075327 TSecr=3160782524 [TCP PDU reassembled in 75]"
"74","10:59:34.135707","64.65.63.120","192.168.0.74","TCP","1474","443  >  59487 [PSH, ACK] Seq=46259 Ack=1609 Win=476 Len=1408 TSval=2678075327 TSecr=3160782524 [TCP PDU reassembled in 75]"
"75","10:59:34.135708","64.65.63.120","192.168.0.74","TLSv1.2","1474","Application Data"
"76","10:59:34.135710","64.65.63.120","192.168.0.74","TCP","1474","443  >  59487 [PSH, ACK] Seq=49075 Ack=1609 Win=476 Len=1408 TSval=2678075327 TSecr=3160782526 [TCP PDU reassembled in 78]"
"77","10:59:34.135711","64.65.63.120","192.168.0.74","TCP","1474","443  >  59487 [ACK] Seq=50483 Ack=1609 Win=476 Len=1408 TSval=2678075327 TSecr=3160782526 [TCP PDU reassembled in 78]"
"78","10:59:34.135713","64.65.63.120","192.168.0.74","TLSv1.2","1474","Application Data"
"79","10:59:34.135714","64.65.63.120","192.168.0.74","TCP","1474","443  >  59487 [ACK] Seq=53299 Ack=1609 Win=476 Len=1408 TSval=2678075327 TSecr=3160782526 [TCP PDU reassembled in 81]"
"80","10:59:34.135715","64.65.63.120","192.168.0.74","TCP","1474","443  >  59487 [PSH, ACK] Seq=54707 Ack=1609 Win=476 Len=1408 TSval=2678075327 TSecr=3160782526 [TCP PDU reassembled in 81]"
"81","10:59:34.135716","64.65.63.120","192.168.0.74","TLSv1.2","1474","Application Data, Application Data"
"82","10:59:34.135717","64.65.63.120","192.168.0.74","TCP","1474","443  >  59487 [PSH, ACK] Seq=57523 Ack=1609 Win=476 Len=1408 TSval=2678075327 TSecr=3160782526 [TCP PDU reassembled in 84]"
"83","10:59:34.135718","64.65.63.120","192.168.0.74","TCP","1474","443  >  59487 [ACK] Seq=58931 Ack=1609 Win=476 Len=1408 TSval=2678075327 TSecr=3160782526 [TCP PDU reassembled in 84]"
"84","10:59:34.135720","64.65.63.120","192.168.0.74","TLSv1.2","1474","Application Data"
"85","10:59:34.135721","64.65.63.120","192.168.0.74","TCP","1474","443  >  59487 [ACK] Seq=61747 Ack=1609 Win=476 Len=1408 TSval=2678075327 TSecr=3160782526 [TCP PDU reassembled in 87]"
"86","10:59:34.135722","64.65.63.120","192.168.0.74","TCP","1474","443  >  59487 [PSH, ACK] Seq=63155 Ack=1609 Win=476 Len=1408 TSval=2678075327 TSecr=3160782526 [TCP PDU reassembled in 87]"
"87","10:59:34.135723","64.65.63.120","192.168.0.74","TLSv1.2","1474","Application Data"
"88","10:59:34.135724","64.65.63.120","192.168.0.74","TCP","1474","443  >  59487 [PSH, ACK] Seq=65971 Ack=1609 Win=476 Len=1408 TSval=2678075328 TSecr=3160782526 [TCP PDU reassembled in 89]"
"89","10:59:34.135725","64.65.63.120","192.168.0.74","TLSv1.2","1474","Application Data"
"90","10:59:34.135726","64.65.63.120","192.168.0.74","TLSv1.2","1154","Application Data"
"91","10:59:34.135727","64.65.63.120","192.168.0.74","TCP","1474","443  >  59487 [ACK] Seq=69875 Ack=1609 Win=476 Len=1408 TSval=2678075330 TSecr=3160782526 [TCP PDU reassembled in 93]"
"92","10:59:34.135729","64.65.63.120","192.168.0.74","TCP","1474","443  >  59487 [PSH, ACK] Seq=71283 Ack=1609 Win=476 Len=1408 TSval=2678075330 TSecr=3160782526 [TCP PDU reassembled in 93]"
"93","10:59:34.135730","64.65.63.120","192.168.0.74","TLSv1.2","1474","Application Data"
"94","10:59:34.135731","64.65.63.120","192.168.0.74","TCP","1474","443  >  59487 [PSH, ACK] Seq=74099 Ack=1609 Win=476 Len=1408 TSval=2678075330 TSecr=3160782526 [TCP PDU reassembled in 96]"
"95","10:59:34.135732","64.65.63.120","192.168.0.74","TCP","1474","443  >  59487 [ACK] Seq=75507 Ack=2145 Win=472 Len=1408 TSval=2678075331 TSecr=3160782528 [TCP PDU reassembled in 96]"
"96","10:59:34.135733","64.65.63.120","192.168.0.74","TLSv1.2","1474","Application Data"
"97","10:59:34.135851","192.168.0.74","64.65.63.120","TLSv1.2","602","Application Data"
"98","10:59:34.135884","192.168.0.74","64.65.63.120","TCP","66","59487  >  443 [ACK] Seq=2681 Ack=72691 Win=8719 Len=0 TSval=3160782566 TSecr=2678075330"
"99","10:59:34.135893","192.168.0.74","64.65.63.120","TCP","66","59487  >  443 [ACK] Seq=2681 Ack=75507 Win=8675 Len=0 TSval=3160782566 TSecr=2678075330"
"100","10:59:34.135910","192.168.0.74","64.65.63.120","TCP","66","59487  >  443 [ACK] Seq=2681 Ack=78323 Win=8631 Len=0 TSval=3160782566 TSecr=2678075331"
"101","10:59:34.136303","192.168.0.74","64.65.63.120","TLSv1.2","602","Application Data"
"102","10:59:34.137680","64.65.63.120","192.168.0.74","TCP","1474","443  >  59487 [ACK] Seq=78323 Ack=2145 Win=472 Len=1408 TSval=2678075331 TSecr=3160782528 [TCP PDU reassembled in 104]"
"103","10:59:34.137682","64.65.63.120","192.168.0.74","TCP","1474","443  >  59487 [PSH, ACK] Seq=79731 Ack=2145 Win=472 Len=1408 TSval=2678075331 TSecr=3160782528 [TCP PDU reassembled in 104]"
"104","10:59:34.137683","64.65.63.120","192.168.0.74","TLSv1.2","1474","Application Data"
"105","10:59:34.137685","64.65.63.120","192.168.0.74","TCP","1474","443  >  59487 [PSH, ACK] Seq=82547 Ack=2145 Win=472 Len=1408 TSval=2678075331 TSecr=3160782529 [TCP PDU reassembled in 107]"
"106","10:59:34.137686","64.65.63.120","192.168.0.74","TCP","1474","443  >  59487 [ACK] Seq=83955 Ack=2145 Win=472 Len=1408 TSval=2678075331 TSecr=3160782529 [TCP PDU reassembled in 107]"
"107","10:59:34.137687","64.65.63.120","192.168.0.74","TLSv1.2","1474","Application Data"
"108","10:59:34.137688","64.65.63.120","192.168.0.74","TCP","1474","443  >  59487 [ACK] Seq=86771 Ack=2145 Win=472 Len=1408 TSval=2678075331 TSecr=3160782529 [TCP PDU reassembled in 109]"
"109","10:59:34.137689","64.65.63.120","192.168.0.74","TLSv1.2","1474","Application Data"
"110","10:59:34.137690","64.65.63.120","192.168.0.74","TCP","1474","443  >  59487 [ACK] Seq=89587 Ack=2145 Win=472 Len=1408 TSval=2678075332 TSecr=3160782529 [TCP PDU reassembled in 114]"
"111","10:59:34.137762","192.168.0.74","64.65.63.120","TLSv1.2","602","Application Data"
"112","10:59:34.137827","192.168.0.74","64.65.63.120","TCP","66","[TCP Window Update] 59487  >  443 [ACK] Seq=3753 Ack=90995 Win=9198 Len=0 TSval=3160782568 TSecr=2678075332"
"113","10:59:34.155904","192.168.0.192","230.0.0.1","UDP","92","62979  >  6666 Len=50"
"114","10:59:34.161903","64.65.63.120","192.168.0.74","TLSv1.2","1474","Application Data"
"115","10:59:34.161904","64.65.63.120","192.168.0.74","TCP","1474","443  >  59487 [PSH, ACK] Seq=92403 Ack=2145 Win=476 Len=1408 TSval=2678075358 TSecr=3160782550 [TCP PDU reassembled in 125]"
"116","10:59:34.161969","192.168.0.74","64.65.63.120","TLSv1.2","1138","Application Data, Application Data"
"117","10:59:34.162035","192.168.0.74","64.65.63.120","TCP","66","[TCP Window Update] 59487  >  443 [ACK] Seq=4825 Ack=93811 Win=9198 Len=0 TSval=3160782592 TSecr=2678075358"
"118","10:59:34.162233","192.168.0.74","64.65.63.120","TCP","1474","59487  >  443 [ACK] Seq=4825 Ack=93811 Win=9198 Len=1408 TSval=3160782592 TSecr=2678075358 [TCP PDU reassembled in 120]"
"119","10:59:34.162234","192.168.0.74","64.65.63.120","TCP","1474","59487  >  443 [ACK] Seq=6233 Ack=93811 Win=9198 Len=1408 TSval=3160782592 TSecr=2678075358 [TCP PDU reassembled in 120]"
"120","10:59:34.162237","192.168.0.74","64.65.63.120","TLSv1.2","356","Application Data"
"121","10:59:34.163731","192.168.0.74","64.65.63.120","TCP","1474","59487  >  443 [ACK] Seq=7931 Ack=93811 Win=9198 Len=1408 TSval=3160782594 TSecr=2678075358 [TCP PDU reassembled in 122]"
"122","10:59:34.163755","192.168.0.74","64.65.63.120","TLSv1.2","736","Application Data"
"123","10:59:34.170495","192.168.0.74","64.65.63.120","TLSv1.2","1474","Application Data, Application Data"
"124","10:59:34.170513","192.168.0.74","64.65.63.120","TLSv1.2","266","Application Data"
"125","10:59:34.171191","64.65.63.120","192.168.0.74","TLSv1.2","1470","Application Data"
"126","10:59:34.171263","192.168.0.74","64.65.63.120","TCP","66","59487  >  443 [ACK] Seq=11617 Ack=95215 Win=9177 Len=0 TSval=3160782601 TSecr=2678075367"
"127","10:59:34.175160","64.65.63.120","192.168.0.74","TCP","1474","443  >  59487 [ACK] Seq=95215 Ack=3753 Win=468 Len=1408 TSval=2678075371 TSecr=3160782566 [TCP PDU reassembled in 129]"
"128","10:59:34.175163","64.65.63.120","192.168.0.74","TCP","1474","443  >  59487 [PSH, ACK] Seq=96623 Ack=3753 Win=468 Len=1408 TSval=2678075371 TSecr=3160782566 [TCP PDU reassembled in 129]"
"129","10:59:34.175164","64.65.63.120","192.168.0.74","TLSv1.2","1474","Application Data"
"130","10:59:34.175276","192.168.0.74","64.65.63.120","TCP","66","59487  >  443 [ACK] Seq=11617 Ack=99439 Win=9132 Len=0 TSval=3160782605 TSecr=2678075372"
"131","10:59:34.175418","192.168.0.74","64.65.63.120","TCP","66","[TCP Window Update] 59487  >  443 [ACK] Seq=11617 Ack=99439 Win=9198 Len=0 TSval=3160782605 TSecr=2678075372"
"132","10:59:34.202757","64.65.63.120","192.168.0.74","TCP","66","443  >  59487 [ACK] Seq=99439 Ack=7641 Win=520 Len=0 TSval=2678075399 TSecr=3160782592"
"133","10:59:34.202759","64.65.63.120","192.168.0.74","TCP","66","443  >  59487 [ACK] Seq=99439 Ack=10009 Win=575 Len=0 TSval=2678075399 TSecr=3160782592"
"134","10:59:34.207055","64.65.63.120","192.168.0.74","TCP","66","443  >  59487 [ACK] Seq=99439 Ack=11617 Win=587 Len=0 TSval=2678075403 TSecr=3160782600"
"135","10:59:34.207056","64.65.63.120","192.168.0.74","TLSv1.2","512","Application Data"
"136","10:59:34.207150","192.168.0.74","64.65.63.120","TLSv1.2","1138","Application Data, Application Data"
"137","10:59:34.207177","192.168.0.74","64.65.63.120","TCP","66","59487  >  443 [ACK] Seq=12689 Ack=99885 Win=9192 Len=0 TSval=3160782637 TSecr=2678075403"
"138","10:59:34.220650","64.65.63.120","192.168.0.74","TCP","1474","443  >  59487 [ACK] Seq=99885 Ack=11617 Win=587 Len=1408 TSval=2678075415 TSecr=3160782605 [TCP PDU reassembled in 140]"
"139","10:59:34.220653","64.65.63.120","192.168.0.74","TCP","1474","443  >  59487 [PSH, ACK] Seq=101293 Ack=11617 Win=587 Len=1408 TSval=2678075415 TSecr=3160782605 [TCP PDU reassembled in 140]"
"140","10:59:34.220655","64.65.63.120","192.168.0.74","TLSv1.2","1474","Application Data"
"141","10:59:34.220656","64.65.63.120","192.168.0.74","TLSv1.2","1474","Application Data"
"142","10:59:34.220658","64.65.63.120","192.168.0.74","TCP","1474","443  >  59487 [ACK] Seq=105517 Ack=11617 Win=587 Len=1408 TSval=2678075416 TSecr=3160782605 [TCP PDU reassembled in 144]"
"143","10:59:34.220659","64.65.63.120","192.168.0.74","TCP","1474","443  >  59487 [PSH, ACK] Seq=106925 Ack=11617 Win=587 Len=1408 TSval=2678075416 TSecr=3160782605 [TCP PDU reassembled in 144]"
"144","10:59:34.220661","64.65.63.120","192.168.0.74","TLSv1.2","1474","Application Data"
"145","10:59:34.220663","64.65.63.120","192.168.0.74","TCP","1474","443  >  59487 [PSH, ACK] Seq=109741 Ack=11617 Win=587 Len=1408 TSval=2678075416 TSecr=3160782605 [TCP PDU reassembled in 147]"
"146","10:59:34.220664","64.65.63.120","192.168.0.74","TCP","1474","443  >  59487 [ACK] Seq=111149 Ack=11617 Win=587 Len=1408 TSval=2678075416 TSecr=3160782605 [TCP PDU reassembled in 147]"
"147","10:59:34.221329","64.65.63.120","192.168.0.74","TLSv1.2","1474","Application Data"
"148","10:59:34.221519","192.168.0.74","64.65.63.120","TCP","66","59487  >  443 [ACK] Seq=12689 Ack=113965 Win=9198 Len=0 TSval=3160782651 TSecr=2678075416"
"149","10:59:34.222946","64.65.63.120","192.168.0.74","TCP","1474","443  >  59487 [ACK] Seq=113965 Ack=11617 Win=587 Len=1408 TSval=2678075416 TSecr=3160782605 [TCP PDU reassembled in 150]"
"150","10:59:34.222948","64.65.63.120","192.168.0.74","TLSv1.2","1474","Application Data"
"151","10:59:34.222949","64.65.63.120","192.168.0.74","TCP","1474","443  >  59487 [ACK] Seq=116781 Ack=11617 Win=587 Len=1408 TSval=2678075417 TSecr=3160782605 [TCP PDU reassembled in 153]"
"152","10:59:34.222950","64.65.63.120","192.168.0.74","TCP","1474","443  >  59487 [PSH, ACK] Seq=118189 Ack=11617 Win=587 Len=1408 TSval=2678075417 TSecr=3160782605 [TCP PDU reassembled in 153]"
"153","10:59:34.222951","64.65.63.120","192.168.0.74","TLSv1.2","1474","Application Data"
"154","10:59:34.222952","64.65.63.120","192.168.0.74","TLSv1.2","1474","Application Data"
"155","10:59:34.222953","64.65.63.120","192.168.0.74","TCP","1474","443  >  59487 [ACK] Seq=122413 Ack=11617 Win=587 Len=1408 TSval=2678075418 TSecr=3160782605 [TCP PDU reassembled in 156]"
"156","10:59:34.222954","64.65.63.120","192.168.0.74","TLSv1.2","1474","Application Data"
"157","10:59:34.222955","64.65.63.120","192.168.0.74","TCP","1474","443  >  59487 [ACK] Seq=125229 Ack=11617 Win=587 Len=1408 TSval=2678075418 TSecr=3160782605 [TCP PDU reassembled in 159]"
"158","10:59:34.222956","64.65.63.120","192.168.0.74","TCP","1474","443  >  59487 [PSH, ACK] Seq=126637 Ack=11617 Win=587 Len=1408 TSval=2678075418 TSecr=3160782605 [TCP PDU reassembled in 159]"
"159","10:59:34.222957","64.65.63.120","192.168.0.74","TLSv1.2","1474","Application Data"
"160","10:59:34.222958","64.65.63.120","192.168.0.74","TCP","1474","443  >  59487 [PSH, ACK] Seq=129453 Ack=11617 Win=587 Len=1408 TSval=2678075418 TSecr=3160782605 [TCP PDU reassembled in 162]"
"161","10:59:34.222960","64.65.63.120","192.168.0.74","TCP","1474","443  >  59487 [ACK] Seq=130861 Ack=11617 Win=587 Len=1408 TSval=2678075418 TSecr=3160782605 [TCP PDU reassembled in 162]"
"162","10:59:34.222961","64.65.63.120","192.168.0.74","TLSv1.2","1474","Application Data"
"163","10:59:34.222962","64.65.63.120","192.168.0.74","TCP","1474","443  >  59487 [ACK] Seq=133677 Ack=11617 Win=587 Len=1408 TSval=2678075418 TSecr=3160782605 [TCP PDU reassembled in 165]"
"164","10:59:34.222963","64.65.63.120","192.168.0.74","TCP","1474","443  >  59487 [PSH, ACK] Seq=135085 Ack=11617 Win=587 Len=1408 TSval=2678075418 TSecr=3160782605 [TCP PDU reassembled in 165]"
"165","10:59:34.222965","64.65.63.120","192.168.0.74","TLSv1.2","1474","Application Data, Application Data"
"166","10:59:34.222966","64.65.63.120","192.168.0.74","TCP","1474","443  >  59487 [PSH, ACK] Seq=137901 Ack=11617 Win=587 Len=1408 TSval=2678075418 TSecr=3160782605 [TCP PDU reassembled in 169]"
"167","10:59:34.222967","64.65.63.120","192.168.0.74","TCP","1474","443  >  59487 [ACK] Seq=139309 Ack=11617 Win=587 Len=1408 TSval=2678075418 TSecr=3160782605 [TCP PDU reassembled in 169]"
"168","10:59:34.223336","192.168.0.74","64.65.63.120","TLSv1.2","1138","Application Data, Application Data"
"169","10:59:34.229956","64.65.63.120","192.168.0.74","TLSv1.2","1474","Application Data, Application Data"
"170","10:59:34.229958","64.65.63.120","192.168.0.74","TCP","1474","443  >  59487 [PSH, ACK] Seq=142125 Ack=11617 Win=587 Len=1408 TSval=2678075426 TSecr=3160782605 [TCP PDU reassembled in 172]"
"171","10:59:34.230098","192.168.0.74","64.65.63.120","TLSv1.2","602","Application Data"
"172","10:59:34.241834","64.65.63.120","192.168.0.74","TLSv1.2","438","Application Data"
"173","10:59:34.241934","192.168.0.74","64.65.63.120","TCP","66","59487  >  443 [ACK] Seq=14297 Ack=143905 Win=9193 Len=0 TSval=3160782672 TSecr=2678075438"
"174","10:59:34.255552","64.65.63.120","192.168.0.74","TCP","1474","443  >  59487 [ACK] Seq=143905 Ack=12689 Win=609 Len=1408 TSval=2678075452 TSecr=3160782637 [TCP PDU reassembled in 178]"
"175","10:59:34.255554","64.65.63.120","192.168.0.74","TCP","1474","443  >  59487 [PSH, ACK] Seq=145313 Ack=12689 Win=609 Len=1408 TSval=2678075452 TSecr=3160782637 [TCP PDU reassembled in 178]"
"176","10:59:34.255701","192.168.0.74","64.65.63.120","TCP","66","59487  >  443 [ACK] Seq=14297 Ack=146721 Win=9198 Len=0 TSval=3160782685 TSecr=2678075452"
"177","10:59:34.264821","64.65.63.120","192.168.0.74","TCP","66","443  >  59487 [ACK] Seq=146721 Ack=14297 Win=643 Len=0 TSval=2678075461 TSecr=3160782653"
"178","10:59:34.274137","64.65.63.120","192.168.0.74","TLSv1.2","1474","Application Data"
"179","10:59:34.274139","64.65.63.120","192.168.0.74","TCP","1474","443  >  59487 [ACK] Seq=148129 Ack=14297 Win=643 Len=1408 TSval=2678075470 TSecr=3160782653 [TCP PDU reassembled in 182]"
"180","10:59:34.274141","64.65.63.120","192.168.0.74","TCP","1474","443  >  59487 [PSH, ACK] Seq=149537 Ack=14297 Win=643 Len=1408 TSval=2678075470 TSecr=3160782653 [TCP PDU reassembled in 182]"
"181","10:59:34.274310","192.168.0.74","64.65.63.120","TCP","66","59487  >  443 [ACK] Seq=14297 Ack=150945 Win=9198 Len=0 TSval=3160782704 TSecr=2678075470"
"182","10:59:34.276006","64.65.63.120","192.168.0.74","TLSv1.2","266","Application Data"
"183","10:59:34.276113","192.168.0.74","64.65.63.120","TCP","66","59487  >  443 [ACK] Seq=14297 Ack=151145 Win=9198 Len=0 TSval=3160782706 TSecr=2678075473"
"184","10:59:34.284176","64.65.63.120","192.168.0.74","TCP","1474","443  >  59487 [ACK] Seq=151145 Ack=14297 Win=643 Len=1408 TSval=2678075481 TSecr=3160782672 [TCP PDU reassembled in 187]"
"185","10:59:34.284178","64.65.63.120","192.168.0.74","TCP","1474","443  >  59487 [PSH, ACK] Seq=152553 Ack=14297 Win=643 Len=1408 TSval=2678075481 TSecr=3160782672 [TCP PDU reassembled in 187]"
"186","10:59:34.284263","192.168.0.74","64.65.63.120","TCP","66","59487  >  443 [ACK] Seq=14297 Ack=153961 Win=9198 Len=0 TSval=3160782714 TSecr=2678075481"
"187","10:59:34.292520","64.65.63.120","192.168.0.74","TLSv1.2","1474","Application Data, Application Data"
"188","10:59:34.292522","64.65.63.120","192.168.0.74","TCP","1474","443  >  59487 [ACK] Seq=155369 Ack=14297 Win=643 Len=1408 TSval=2678075487 TSecr=3160782685 [TCP PDU reassembled in 190]"
"189","10:59:34.292524","64.65.63.120","192.168.0.74","TCP","1474","443  >  59487 [PSH, ACK] Seq=156777 Ack=14297 Win=643 Len=1408 TSval=2678075487 TSecr=3160782685 [TCP PDU reassembled in 190]"
"190","10:59:34.292525","64.65.63.120","192.168.0.74","TLSv1.2","1474","Application Data"
"191","10:59:34.292527","64.65.63.120","192.168.0.74","TCP","1474","443  >  59487 [ACK] Seq=159593 Ack=14297 Win=643 Len=1408 TSval=2678075487 TSecr=3160782685 [TCP PDU reassembled in 193]"
"192","10:59:34.292528","64.65.63.120","192.168.0.74","TCP","1474","443  >  59487 [PSH, ACK] Seq=161001 Ack=14297 Win=643 Len=1408 TSval=2678075487 TSecr=3160782685 [TCP PDU reassembled in 193]"
"193","10:59:34.292529","64.65.63.120","192.168.0.74","TLSv1.2","1474","Application Data"
"194","10:59:34.292531","64.65.63.120","192.168.0.74","TCP","1474","443  >  59487 [ACK] Seq=163817 Ack=14297 Win=643 Len=1408 TSval=2678075487 TSecr=3160782685 [TCP PDU reassembled in 198]"
"195","10:59:34.292532","64.65.63.120","192.168.0.74","TCP","1474","443  >  59487 [PSH, ACK] Seq=165225 Ack=14297 Win=643 Len=1408 TSval=2678075487 TSecr=3160782685 [TCP PDU reassembled in 198]"
"196","10:59:34.292690","192.168.0.74","64.65.63.120","TCP","66","59487  >  443 [ACK] Seq=14297 Ack=166633 Win=9198 Len=0 TSval=3160782722 TSecr=2678075487"
"197","10:59:34.292820","192.168.0.74","64.65.63.120","TLSv1.2","602","Application Data"
"198","10:59:34.296946","64.65.63.120","192.168.0.74","TLSv1.2","1474","Application Data"
"199","10:59:34.296948","64.65.63.120","192.168.0.74","TCP","1474","443  >  59487 [ACK] Seq=168041 Ack=14297 Win=643 Len=1408 TSval=2678075494 TSecr=3160782685 [TCP PDU reassembled in 201]"
"200","10:59:34.296949","64.65.63.120","192.168.0.74","TCP","1474","443  >  59487 [PSH, ACK] Seq=169449 Ack=14297 Win=643 Len=1408 TSval=2678075494 TSecr=3160782685 [TCP PDU reassembled in 201]"
"201","10:59:34.296950","64.65.63.120","192.168.0.74","TLSv1.2","1474","Application Data"
"202","10:59:34.297052","192.168.0.74","64.65.63.120","TCP","66","59487  >  443 [ACK] Seq=14833 Ack=172265 Win=9198 Len=0 TSval=3160782727 TSecr=2678075494"
"203","10:59:34.301169","192.87.28.82","192.168.0.74","TCP","1474","9001  >  59488 [ACK] Seq=1 Ack=1 Win=1565 Len=1408 TSval=2690124772 TSecr=3829647629 [TCP PDU reassembled in 210]"
"204","10:59:34.301223","192.168.0.74","192.87.28.82","TCP","66","59488  >  9001 [ACK] Seq=1 Ack=1409 Win=3698 Len=0 TSval=3829651686 TSecr=2690124772"
"205","10:59:34.305946","64.65.63.120","192.168.0.74","TLSv1.2","1474","Application Data"
"206","10:59:34.305949","192.87.28.82","192.168.0.74","TCP","1474","9001  >  59488 [ACK] Seq=1409 Ack=1 Win=1565 Len=1408 TSval=2690124772 TSecr=3829647629 [TCP PDU reassembled in 210]"
"207","10:59:34.305951","64.65.63.120","192.168.0.74","TCP","1474","443  >  59487 [PSH, ACK] Seq=173673 Ack=14297 Win=643 Len=1408 TSval=2678075501 TSecr=3160782685 [TCP PDU reassembled in 208]"
"208","10:59:34.305952","64.65.63.120","192.168.0.74","TLSv1.2","1474","Application Data"
"209","10:59:34.305953","64.65.63.120","192.168.0.74","TCP","1474","443  >  59487 [ACK] Seq=176489 Ack=14297 Win=643 Len=1408 TSval=2678075501 TSecr=3160782685 [TCP PDU reassembled in 218]"
"210","10:59:34.305954","192.87.28.82","192.168.0.74","TLSv1.2","1320","Application Data"
"211","10:59:34.305956","64.65.63.120","192.168.0.74","TCP","1474","443  >  59487 [PSH, ACK] Seq=177897 Ack=14297 Win=643 Len=1408 TSval=2678075501 TSecr=3160782685 [TCP PDU reassembled in 218]"
"212","10:59:34.305960","192.87.28.82","192.168.0.74","TCP","1474","9001  >  59488 [ACK] Seq=4071 Ack=1 Win=1565 Len=1408 TSval=2690124772 TSecr=3829647629 [TCP PDU reassembled in 214]"
"213","10:59:34.305961","192.87.28.82","192.168.0.74","TCP","1474","9001  >  59488 [ACK] Seq=5479 Ack=1 Win=1565 Len=1408 TSval=2690124772 TSecr=3829647629 [TCP PDU reassembled in 214]"
"214","10:59:34.305963","192.87.28.82","192.168.0.74","TLSv1.2","934","Application Data"
"215","10:59:34.306095","192.168.0.74","192.87.28.82","TCP","66","59488  >  9001 [ACK] Seq=1 Ack=7755 Win=3621 Len=0 TSval=3829651691 TSecr=2690124772"
"216","10:59:34.306163","192.168.0.74","64.65.63.120","TCP","66","59487  >  443 [ACK] Seq=14833 Ack=179305 Win=9198 Len=0 TSval=3160782736 TSecr=2678075501"
"217","10:59:34.306237","192.168.0.74","192.87.28.82","TCP","66","[TCP Window Update] 59488  >  9001 [ACK] Seq=1 Ack=7755 Win=3720 Len=0 TSval=3829651691 TSecr=2690124772"
"218","10:59:34.311409","64.65.63.120","192.168.0.74","TLSv1.2","1474","Application Data"
"219","10:59:34.311411","64.65.63.120","192.168.0.74","TCP","1474","443  >  59487 [ACK] Seq=180713 Ack=14297 Win=643 Len=1408 TSval=2678075508 TSecr=3160782704 [TCP PDU reassembled in 221]"
"220","10:59:34.311413","64.65.63.120","192.168.0.74","TCP","1474","443  >  59487 [PSH, ACK] Seq=182121 Ack=14297 Win=643 Len=1408 TSval=2678075508 TSecr=3160782704 [TCP PDU reassembled in 221]"
"221","10:59:34.311414","64.65.63.120","192.168.0.74","TLSv1.2","820","Application Data, Application Data"
"222","10:59:34.311550","192.168.0.74","64.65.63.120","TLSv1.2","602","Application Data"
"223","10:59:34.317421","192.87.28.82","192.168.0.74","TCP","1474","9001  >  59488 [ACK] Seq=7755 Ack=1 Win=1565 Len=1408 TSval=2690124787 TSecr=3829647629 [TCP PDU reassembled in 225]"
"224","10:59:34.317422","192.87.28.82","192.168.0.74","TCP","1474","9001  >  59488 [ACK] Seq=9163 Ack=1 Win=1565 Len=1408 TSval=2690124787 TSecr=3829647629 [TCP PDU reassembled in 225]"
"225","10:59:34.317424","192.87.28.82","192.168.0.74","TLSv1.2","1320","Application Data"
"226","10:59:34.317477","192.168.0.74","192.87.28.82","TCP","66","59488  >  9001 [ACK] Seq=1 Ack=9163 Win=3698 Len=0 TSval=3829651702 TSecr=2690124787"
"227","10:59:34.317528","192.168.0.74","192.87.28.82","TCP","66","59488  >  9001 [ACK] Seq=1 Ack=11825 Win=3657 Len=0 TSval=3829651702 TSecr=2690124787"
"228","10:59:34.317549","192.168.0.74","192.87.28.82","TCP","66","[TCP Window Update] 59488  >  9001 [ACK] Seq=1 Ack=11825 Win=3720 Len=0 TSval=3829651702 TSecr=2690124787"
"229","10:59:34.326064","64.65.63.120","192.168.0.74","TCP","1474","443  >  59487 [ACK] Seq=184283 Ack=14297 Win=643 Len=1408 TSval=2678075520 TSecr=3160782714 [TCP PDU reassembled in 231]"
"230","10:59:34.326067","64.65.63.120","192.168.0.74","TCP","1474","443  >  59487 [PSH, ACK] Seq=185691 Ack=14297 Win=643 Len=1408 TSval=2678075520 TSecr=3160782714 [TCP PDU reassembled in 231]"
"231","10:59:34.326069","64.65.63.120","192.168.0.74","TLSv1.2","1474","Application Data"
"232","10:59:34.326070","64.65.63.120","192.168.0.74","TCP","1474","443  >  59487 [ACK] Seq=188507 Ack=14297 Win=643 Len=1408 TSval=2678075520 TSecr=3160782714 [TCP PDU reassembled in 234]"
"233","10:59:34.326072","64.65.63.120","192.168.0.74","TCP","1474","443  >  59487 [PSH, ACK] Seq=189915 Ack=14297 Win=643 Len=1408 TSval=2678075520 TSecr=3160782714 [TCP PDU reassembled in 234]"
"234","10:59:34.326073","64.65.63.120","192.168.0.74","TLSv1.2","1474","Application Data"
"235","10:59:34.326074","64.65.63.120","192.168.0.74","TCP","1474","443  >  59487 [ACK] Seq=192731 Ack=14297 Win=643 Len=1408 TSval=2678075520 TSecr=3160782714 [TCP PDU reassembled in 237]"
"236","10:59:34.326076","64.65.63.120","192.168.0.74","TCP","1474","443  >  59487 [PSH, ACK] Seq=194139 Ack=14297 Win=643 Len=1408 TSval=2678075520 TSecr=3160782714 [TCP PDU reassembled in 237]"
"237","10:59:34.326077","64.65.63.120","192.168.0.74","TLSv1.2","1474","Application Data"
"238","10:59:34.326079","64.65.63.120","192.168.0.74","TCP","1474","443  >  59487 [ACK] Seq=196955 Ack=14297 Win=643 Len=1408 TSval=2678075520 TSecr=3160782714 [TCP PDU reassembled in 243]"
"239","10:59:34.326080","64.65.63.120","192.168.0.74","TCP","1474","443  >  59487 [PSH, ACK] Seq=198363 Ack=14297 Win=643 Len=1408 TSval=2678075520 TSecr=3160782714 [TCP PDU reassembled in 243]"
"240","10:59:34.326081","192.87.28.82","192.168.0.74","TLSv1.2","1474","Application Data"
"241","10:59:34.326216","192.168.0.74","192.87.28.82","TCP","66","59488  >  9001 [ACK] Seq=1 Ack=13233 Win=3698 Len=0 TSval=3829651711 TSecr=2690124800"
"242","10:59:34.326291","192.168.0.74","64.65.63.120","TCP","66","59487  >  443 [ACK] Seq=15369 Ack=199771 Win=9198 Len=0 TSval=3160782756 TSecr=2678075520"
"243","10:59:34.327892","64.65.63.120","192.168.0.74","TLSv1.2","1474","Application Data, Application Data"
"244","10:59:34.327893","64.65.63.120","192.168.0.74","TCP","1474","443  >  59487 [ACK] Seq=201179 Ack=14297 Win=643 Len=1408 TSval=2678075524 TSecr=3160782722 [TCP PDU reassembled in 246]"
"245","10:59:34.327894","64.65.63.120","192.168.0.74","TCP","1474","443  >  59487 [PSH, ACK] Seq=202587 Ack=14297 Win=643 Len=1408 TSval=2678075524 TSecr=3160782722 [TCP PDU reassembled in 246]"
"246","10:59:34.327895","64.65.63.120","192.168.0.74","TLSv1.2","1474","Application Data"
"247","10:59:34.327896","64.65.63.120","192.168.0.74","TCP","1474","443  >  59487 [ACK] Seq=205403 Ack=14297 Win=643 Len=1408 TSval=2678075524 TSecr=3160782722 [TCP PDU reassembled in 249]"
"248","10:59:34.327898","64.65.63.120","192.168.0.74","TCP","1474","443  >  59487 [PSH, ACK] Seq=206811 Ack=14297 Win=643 Len=1408 TSval=2678075524 TSecr=3160782722 [TCP PDU reassembled in 249]"
"249","10:59:34.327899","64.65.63.120","192.168.0.74","TLSv1.2","1474","Application Data"
"250","10:59:34.327900","64.65.63.120","192.168.0.74","TCP","1474","443  >  59487 [ACK] Seq=209627 Ack=14297 Win=643 Len=1408 TSval=2678075524 TSecr=3160782722 [TCP PDU reassembled in 252]"
"251","10:59:34.327901","64.65.63.120","192.168.0.74","TCP","1474","443  >  59487 [PSH, ACK] Seq=211035 Ack=14297 Win=643 Len=1408 TSval=2678075524 TSecr=3160782722 [TCP PDU reassembled in 252]"
"252","10:59:34.327902","64.65.63.120","192.168.0.74","TLSv1.2","1474","Application Data"
"253","10:59:34.327903","64.65.63.120","192.168.0.74","TCP","1474","443  >  59487 [PSH, ACK] Seq=213851 Ack=14297 Win=643 Len=1408 TSval=2678075524 TSecr=3160782722 [TCP PDU reassembled in 255]"
"254","10:59:34.328184","192.168.0.74","64.65.63.120","TLSv1.2","1138","Application Data, Application Data"
"255","10:59:34.339222","64.65.63.120","192.168.0.74","TLSv1.2","1474","Application Data"
"256","10:59:34.339224","64.65.63.120","192.168.0.74","TCP","1474","443  >  59487 [ACK] Seq=216667 Ack=14833 Win=649 Len=1408 TSval=2678075534 TSecr=3160782723 [TCP PDU reassembled in 258]"
"257","10:59:34.339226","64.65.63.120","192.168.0.74","TCP","1474","443  >  59487 [PSH, ACK] Seq=218075 Ack=14833 Win=649 Len=1408 TSval=2678075534 TSecr=3160782723 [TCP PDU reassembled in 258]"
"258","10:59:34.339227","64.65.63.120","192.168.0.74","TLSv1.2","1474","Application Data"
"259","10:59:34.339228","64.65.63.120","192.168.0.74","TCP","1474","443  >  59487 [ACK] Seq=220891 Ack=14833 Win=649 Len=1408 TSval=2678075534 TSecr=3160782723 [TCP PDU reassembled in 261]"
"260","10:59:34.339229","64.65.63.120","192.168.0.74","TCP","1474","443  >  59487 [PSH, ACK] Seq=222299 Ack=14833 Win=649 Len=1408 TSval=2678075534 TSecr=3160782723 [TCP PDU reassembled in 261]"
"261","10:59:34.339233","64.65.63.120","192.168.0.74","TLSv1.2","1474","Application Data"
"262","10:59:34.339235","64.65.63.120","192.168.0.74","TCP","1474","443  >  59487 [ACK] Seq=225115 Ack=14833 Win=649 Len=1408 TSval=2678075534 TSecr=3160782723 [TCP PDU reassembled in 264]"
"263","10:59:34.339236","64.65.63.120","192.168.0.74","TCP","1474","443  >  59487 [PSH, ACK] Seq=226523 Ack=14833 Win=649 Len=1408 TSval=2678075534 TSecr=3160782723 [TCP PDU reassembled in 264]"
"264","10:59:34.339238","64.65.63.120","192.168.0.74","TLSv1.2","1474","Application Data"
"265","10:59:34.339239","64.65.63.120","192.168.0.74","TCP","1474","443  >  59487 [ACK] Seq=229339 Ack=14833 Win=649 Len=1408 TSval=2678075534 TSecr=3160782723 [TCP PDU reassembled in 266]"
"266","10:59:34.339240","64.65.63.120","192.168.0.74","TLSv1.2","1474","Application Data"
"267","10:59:34.339242","64.65.63.120","192.168.0.74","TLSv1.2","1474","Application Data"
"268","10:59:34.339243","64.65.63.120","192.168.0.74","TCP","1474","443  >  59487 [PSH, ACK] Seq=233563 Ack=14833 Win=649 Len=1408 TSval=2678075535 TSecr=3160782723 [TCP PDU reassembled in 269]"
"269","10:59:34.339245","64.65.63.120","192.168.0.74","TLSv1.2","1474","Application Data"
