"No.","Time","Source","Destination","Protocol","Length","Info"
"1","11:00:37.755506","192.168.0.74","5.28.195.2","TCP","78","59600  >  5222 [SYN] Seq=0 Win=65535 Len=0 MSS=1460 WS=16 TSval=2749188808 TSecr=0 SACK_PERM"
"2","11:00:37.755558","192.168.0.74","5.28.195.2","TCP","78","59601  >  80 [SYN] Seq=0 Win=65535 Len=0 MSS=1460 WS=16 TSval=484107729 TSecr=0 SACK_PERM"
"3","11:00:37.923666","192.87.28.82","192.168.0.74","TLSv1.2","602","Application Data"
"4","11:00:37.923844","192.168.0.74","192.87.28.82","TCP","66","59488  >  9001 [ACK] Seq=1 Ack=537 Win=4086 Len=0 TSval=3829715311 TSecr=2690188387"
"5","11:00:37.952331","192.168.0.192","230.0.0.1","UDP","92","58107  >  6666 Len=50"
"6","11:00:38.054910","192.168.0.192","230.0.0.1","UDP","92","59448  >  6666 Len=50"
"7","11:00:38.163872","192.168.0.192","230.0.0.1","UDP","92","62979  >  6666 Len=50"
"8","11:00:38.569702","CompalBroadb_aa:60:7e","ee:99:94:f5:59:fd","ARP","56","Who has 192.168.0.74? Tell 192.168.0.1"
"9","11:00:38.569795","ee:99:94:f5:59:fd","CompalBroadb_aa:60:7e","ARP","42","192.168.0.74 is at ee:99:94:f5:59:fd"
"10","11:00:38.756706","192.168.0.74","5.28.195.2","TCP","78","[TCP Retransmission] 59600  >  5222 [SYN] Seq=0 Win=65535 Len=0 MSS=1460 WS=16 TSval=2749189809 TSecr=0 SACK_PERM"
"11","11:00:38.756783","192.168.0.74","5.28.195.2","TCP","78","[TCP Retransmission] 59601  >  80 [SYN] Seq=0 Win=65535 Len=0 MSS=1460 WS=16 TSval=484108730 TSecr=0 SACK_PERM"
"12","11:00:38.873556","192.168.0.192","230.0.0.1","UDP","92","58107  >  6666 Len=50"
"13","11:00:39.085824","192.168.0.192","230.0.0.1","UDP","92","59448  >  6666 Len=50"
"14","11:00:39.188086","192.168.0.192","230.0.0.1","UDP","92","62979  >  6666 Len=50"
"15","11:00:39.650674","192.168.0.74","64.65.63.120","TLSv1.2","602","Application Data"
"16","11:00:39.698270","64.65.63.120","192.168.0.74","TCP","66","443  >  59487 [ACK] Seq=1 Ack=537 Win=480 Len=0 TSval=2678140891 TSecr=3160848083"
"17","11:00:39.832186","64.65.63.120","192.168.0.74","TCP","1474","443  >  59487 [ACK] Seq=1 Ack=537 Win=480 Len=1408 TSval=2678141026 TSecr=3160848083 [TCP PDU reassembled in 20]"
"18","11:00:39.832416","192.168.0.74","64.65.63.120","TCP","66","59487  >  443 [ACK] Seq=537 Ack=1409 Win=9176 Len=0 TSval=3160848265 TSecr=2678141026"
"19","11:00:39.833701","64.65.63.120","192.168.0.74","TCP","1474","443  >  59487 [PSH, ACK] Seq=1409 Ack=537 Win=480 Len=1408 TSval=2678141026 TSecr=3160848083 [TCP PDU reassembled in 20]"
"20","11:00:39.833703","64.65.63.120","192.168.0.74","TLSv1.2","1320","Application Data"
"21","11:00:39.833766","192.168.0.74","64.65.63.120","TCP","66","59487  >  443 [ACK] Seq=537 Ack=4071 Win=9157 Len=0 TSval=3160848266 TSecr=2678141026"
"22","11:00:39.834701","64.65.63.120","192.168.0.74","TCP","1474","443  >  59487 [ACK] Seq=4071 Ack=537 Win=480 Len=1408 TSval=2678141026 TSecr=3160848083 [TCP PDU reassembled in 26]"
"23","11:00:39.834704","64.65.63.120","192.168.0.74","TCP","1474","443  >  59487 [PSH, ACK] Seq=5479 Ack=537 Win=480 Len=1408 TSval=2678141026 TSecr=3160848083 [TCP PDU reassembled in 26]"
"24","11:00:39.834777","192.168.0.74","64.65.63.120","TCP","66","59487  >  443 [ACK] Seq=537 Ack=6887 Win=9154 Len=0 TSval=3160848267 TSecr=2678141026"
"25","11:00:39.834879","192.168.0.74","64.65.63.120","TCP","66","[TCP Window Update] 59487  >  443 [ACK] Seq=537 Ack=6887 Win=9198 Len=0 TSval=3160848267 TSecr=2678141026"
"26","11:00:39.847232","64.65.63.120","192.168.0.74","TLSv1.2","1474","Application Data"
"27","11:00:39.847236","64.65.63.120","192.168.0.74","TCP","1474","443  >  59487 [PSH, ACK] Seq=8295 Ack=537 Win=480 Len=1408 TSval=2678141039 TSecr=3160848083 [TCP PDU reassembled in 32]"
"28","11:00:39.847243","64.65.63.120","192.168.0.74","TCP","1474","443  >  59487 [ACK] Seq=9703 Ack=537 Win=480 Len=1408 TSval=2678141039 TSecr=3160848083 [TCP PDU reassembled in 32]"
"29","11:00:39.847410","192.168.0.74","64.65.63.120","TCP","66","59487  >  443 [ACK] Seq=537 Ack=8295 Win=9176 Len=0 TSval=3160848280 TSecr=2678141039"
"30","11:00:39.847479","192.168.0.74","64.65.63.120","TCP","66","59487  >  443 [ACK] Seq=537 Ack=11111 Win=9132 Len=0 TSval=3160848280 TSecr=2678141039"
"31","11:00:39.847604","192.168.0.74","64.65.63.120","TCP","66","[TCP Window Update] 59487  >  443 [ACK] Seq=537 Ack=11111 Win=9198 Len=0 TSval=3160848280 TSecr=2678141039"
"32","11:00:39.872185","64.65.63.120","192.168.0.74","TLSv1.2","866","Application Data, Application Data"
"33","11:00:39.872298","192.168.0.74","64.65.63.120","TCP","66","59487  >  443 [ACK] Seq=537 Ack=11911 Win=9186 Len=0 TSval=3160848305 TSecr=2678141068"
"34","11:00:39.872994","192.168.0.74","64.65.63.120","TLSv1.2","602","Application Data"
"35","11:00:39.897404","192.168.0.192","230.0.0.1","UDP","92","58107  >  6666 Len=50"
"36","11:00:39.915713","64.65.63.120","192.168.0.74","TCP","66","443  >  59487 [ACK] Seq=11911 Ack=1073 Win=480 Len=0 TSval=2678141107 TSecr=3160848305"
"37","11:00:39.937974","64.65.63.120","192.168.0.74","TCP","1474","443  >  59487 [ACK] Seq=11911 Ack=1073 Win=480 Len=1408 TSval=2678141133 TSecr=3160848305 [TCP PDU reassembled in 39]"
"38","11:00:39.937976","64.65.63.120","192.168.0.74","TCP","1474","443  >  59487 [PSH, ACK] Seq=13319 Ack=1073 Win=480 Len=1408 TSval=2678141133 TSecr=3160848305 [TCP PDU reassembled in 39]"
"39","11:00:39.937977","64.65.63.120","192.168.0.74","TLSv1.2","1320","Application Data"
"40","11:00:39.937978","64.65.63.120","192.168.0.74","TCP","1474","443  >  59487 [ACK] Seq=15981 Ack=1073 Win=480 Len=1408 TSval=2678141133 TSecr=3160848305 [TCP PDU reassembled in 42]"
"41","11:00:39.937980","64.65.63.120","192.168.0.74","TCP","1474","443  >  59487 [PSH, ACK] Seq=17389 Ack=1073 Win=480 Len=1408 TSval=2678141133 TSecr=3160848305 [TCP PDU reassembled in 42]"
"42","11:00:39.937981","64.65.63.120","192.168.0.74","TLSv1.2","1474","Application Data, Application Data"
"43","11:00:39.937982","64.65.63.120","192.168.0.74","TCP","1474","443  >  59487 [PSH, ACK] Seq=20205 Ack=1073 Win=480 Len=1408 TSval=2678141133 TSecr=3160848305 [TCP PDU reassembled in 46]"
"44","11:00:39.937983","64.65.63.120","192.168.0.74","TCP","1474","443  >  59487 [ACK] Seq=21613 Ack=1073 Win=480 Len=1408 TSval=2678141133 TSecr=3160848305 [TCP PDU reassembled in 46]"
"45","11:00:39.938089","192.168.0.74","64.65.63.120","TCP","66","59487  >  443 [ACK] Seq=1073 Ack=23021 Win=9025 Len=0 TSval=3160848370 TSecr=2678141133"
"46","11:00:39.939170","64.65.63.120","192.168.0.74","TLSv1.2","1474","Application Data"
"47","11:00:39.939172","64.65.63.120","192.168.0.74","TCP","1474","443  >  59487 [ACK] Seq=24429 Ack=1073 Win=480 Len=1408 TSval=2678141134 TSecr=3160848305 [TCP PDU reassembled in 51]"
"48","11:00:39.939173","64.65.63.120","192.168.0.74","TCP","1474","443  >  59487 [PSH, ACK] Seq=25837 Ack=1073 Win=480 Len=1408 TSval=2678141134 TSecr=3160848305 [TCP PDU reassembled in 51]"
"49","11:00:39.939269","192.168.0.74","64.65.63.120","TCP","66","59487  >  443 [ACK] Seq=1073 Ack=27245 Win=8959 Len=0 TSval=3160848372 TSecr=2678141134"
"50","11:00:39.939641","192.168.0.74","64.65.63.120","TCP","66","[TCP Window Update] 59487  >  443 [ACK] Seq=1073 Ack=27245 Win=9198 Len=0 TSval=3160848372 TSecr=2678141134"
"51","11:00:39.954703","64.65.63.120","192.168.0.74","TLSv1.2","1474","Application Data, Application Data"
"52","11:00:39.954705","64.65.63.120","192.168.0.74","TCP","1474","443  >  59487 [PSH, ACK] Seq=28653 Ack=1073 Win=480 Len=1408 TSval=2678141141 TSecr=3160848305 [TCP PDU reassembled in 54]"
"53","11:00:39.954706","64.65.63.120","192.168.0.74","TCP","1474","443  >  59487 [ACK] Seq=30061 Ack=1073 Win=480 Len=1408 TSval=2678141141 TSecr=3160848305 [TCP PDU reassembled in 54]"
"54","11:00:39.954708","64.65.63.120","192.168.0.74","TLSv1.2","1474","Application Data"
"55","11:00:39.954710","64.65.63.120","192.168.0.74","TCP","1474","443  >  59487 [PSH, ACK] Seq=32877 Ack=1073 Win=480 Len=1408 TSval=2678141141 TSecr=3160848305 [TCP PDU reassembled in 60]"
"56","11:00:39.954814","192.168.0.74","64.65.63.120","TCP","66","59487  >  443 [ACK] Seq=1073 Ack=34285 Win=9088 Len=0 TSval=3160848387 TSecr=2678141141"
"57","11:00:39.954925","192.168.0.74","64.65.63.120","TCP","66","[TCP Window Update] 59487  >  443 [ACK] Seq=1073 Ack=34285 Win=9198 Len=0 TSval=3160848387 TSecr=2678141141"
"58","11:00:39.955055","192.168.0.74","64.65.63.120","TLSv1.2","602","Application Data"
"59","11:00:39.955769","64.65.63.120","192.168.0.74","TCP","1474","443  >  59487 [ACK] Seq=34285 Ack=1073 Win=480 Len=1408 TSval=2678141142 TSecr=3160848305 [TCP PDU reassembled in 60]"
"60","11:00:39.955771","64.65.63.120","192.168.0.74","TLSv1.2","1474","Application Data"
"61","11:00:39.955833","192.168.0.74","64.65.63.120","TCP","66","59487  >  443 [ACK] Seq=1609 Ack=37101 Win=9154 Len=0 TSval=3160848388 TSecr=2678141142"
"62","11:00:39.955891","192.168.0.74","64.65.63.120","TCP","66","[TCP Window Update] 59487  >  443 [ACK] Seq=1609 Ack=37101 Win=9198 Len=0 TSval=3160848388 TSecr=2678141142"
"63","11:00:39.959146","192.168.0.74","64.65.63.120","TLSv1.2","1474","Application Data"
"64","11:00:39.959148","192.168.0.74","64.65.63.120","TCP","1474","59487  >  443 [ACK] Seq=3017 Ack=37101 Win=9198 Len=1408 TSval=3160848391 TSecr=2678141142 [TCP PDU reassembled in 66]"
"65","11:00:39.959149","192.168.0.74","64.65.63.120","TCP","1474","59487  >  443 [ACK] Seq=4425 Ack=37101 Win=9198 Len=1408 TSval=3160848391 TSecr=2678141142 [TCP PDU reassembled in 66]"
"66","11:00:39.959166","192.168.0.74","64.65.63.120","TLSv1.2","448","Application Data"
"67","11:00:39.967469","192.168.0.74","64.65.63.120","TLSv1.2","1474","Application Data, Application Data, Application Data"
"68","11:00:39.967471","192.168.0.74","64.65.63.120","TCP","1474","59487  >  443 [ACK] Seq=7623 Ack=37101 Win=9198 Len=1408 TSval=3160848400 TSecr=2678141142 [TCP PDU reassembled in 69]"
"69","11:00:39.967487","192.168.0.74","64.65.63.120","TLSv1.2","486","Application Data"
"70","11:00:39.972027","64.65.63.120","192.168.0.74","TCP","1474","443  >  59487 [ACK] Seq=37101 Ack=1073 Win=480 Len=1408 TSval=2678141169 TSecr=3160848370 [TCP PDU reassembled in 72]"
"71","11:00:39.972029","64.65.63.120","192.168.0.74","TCP","1474","443  >  59487 [PSH, ACK] Seq=38509 Ack=1073 Win=480 Len=1408 TSval=2678141169 TSecr=3160848370 [TCP PDU reassembled in 72]"
"72","11:00:39.972031","64.65.63.120","192.168.0.74","TLSv1.2","528","Application Data"
"73","11:00:39.972138","192.168.0.74","64.65.63.120","TLSv1.2","1116","Application Data"
"74","11:00:39.972216","192.168.0.74","64.65.63.120","TCP","66","[TCP Window Update] 59487  >  443 [ACK] Seq=10501 Ack=40379 Win=9198 Len=0 TSval=3160848405 TSecr=2678141169"
"75","11:00:39.994452","64.65.63.120","192.168.0.74","TCP","66","443  >  59487 [ACK] Seq=40379 Ack=3017 Win=503 Len=0 TSval=2678141190 TSecr=3160848387"
"76","11:00:39.999951","192.168.0.192","230.0.0.1","UDP","92","59448  >  6666 Len=50"
"77","11:00:40.009666","64.65.63.120","192.168.0.74","TCP","66","443  >  59487 [ACK] Seq=40379 Ack=5833 Win=548 Len=0 TSval=2678141195 TSecr=3160848391"
"78","11:00:40.009668","64.65.63.120","192.168.0.74","TCP","66","443  >  59487 [ACK] Seq=40379 Ack=7623 Win=593 Len=0 TSval=2678141200 TSecr=3160848391"
"79","11:00:40.009669","64.65.63.120","192.168.0.74","TCP","66","443  >  59487 [ACK] Seq=40379 Ack=9451 Win=594 Len=0 TSval=2678141200 TSecr=3160848400"
"80","11:00:40.017619","64.65.63.120","192.168.0.74","TCP","1474","443  >  59487 [ACK] Seq=40379 Ack=10501 Win=614 Len=1408 TSval=2678141212 TSecr=3160848404 [TCP PDU reassembled in 82]"
"81","11:00:40.017622","64.65.63.120","192.168.0.74","TCP","1474","443  >  59487 [PSH, ACK] Seq=41787 Ack=10501 Win=614 Len=1408 TSval=2678141212 TSecr=3160848404 [TCP PDU reassembled in 82]"
"82","11:00:40.017623","64.65.63.120","192.168.0.74","TLSv1.2","1320","Application Data"
"83","11:00:40.017625","64.65.63.120","192.168.0.74","TCP","1474","443  >  59487 [ACK] Seq=44449 Ack=10501 Win=614 Len=1408 TSval=2678141212 TSecr=3160848404 [TCP PDU reassembled in 85]"
"84","11:00:40.017626","64.65.63.120","192.168.0.74","TCP","1474","443  >  59487 [PSH, ACK] Seq=45857 Ack=10501 Win=614 Len=1408 TSval=2678141212 TSecr=3160848404 [TCP PDU reassembled in 85]"
"85","11:00:40.017629","64.65.63.120","192.168.0.74","TLSv1.2","1474","Application Data"
"86","11:00:40.017630","64.65.63.120","192.168.0.74","TCP","1474","443  >  59487 [PSH, ACK] Seq=48673 Ack=10501 Win=614 Len=1408 TSval=2678141212 TSecr=3160848404 [TCP PDU reassembled in 88]"
"87","11:00:40.017632","64.65.63.120","192.168.0.74","TCP","1474","443  >  59487 [ACK] Seq=50081 Ack=10501 Win=614 Len=1408 TSval=2678141212 TSecr=3160848404 [TCP PDU reassembled in 88]"
"88","11:00:40.017634","64.65.63.120","192.168.0.74","TLSv1.2","1474","Application Data"
"89","11:00:40.017636","64.65.63.120","192.168.0.74","TCP","1474","443  >  59487 [ACK] Seq=52897 Ack=10501 Win=614 Len=1408 TSval=2678141212 TSecr=3160848404 [TCP PDU reassembled in 91]"
"90","11:00:40.017637","64.65.63.120","192.168.0.74","TCP","1474","443  >  59487 [PSH, ACK] Seq=54305 Ack=10501 Win=614 Len=1408 TSval=2678141212 TSecr=3160848404 [TCP PDU reassembled in 91]"
"91","11:00:40.017639","64.65.63.120","192.168.0.74","TLSv1.2","1474","Application Data, Application Data"
"92","11:00:40.017641","64.65.63.120","192.168.0.74","TCP","1474","443  >  59487 [PSH, ACK] Seq=57121 Ack=10501 Win=614 Len=1408 TSval=2678141214 TSecr=3160848404 [TCP PDU reassembled in 94]"
"93","11:00:40.017642","64.65.63.120","192.168.0.74","TCP","1474","443  >  59487 [ACK] Seq=58529 Ack=10501 Win=614 Len=1408 TSval=2678141214 TSecr=3160848404 [TCP PDU reassembled in 94]"
"94","11:00:40.017643","64.65.63.120","192.168.0.74","TLSv1.2","1474","Application Data"
"95","11:00:40.017645","64.65.63.120","192.168.0.74","TCP","1474","443  >  59487 [PSH, ACK] Seq=61345 Ack=10501 Win=614 Len=1408 TSval=2678141214 TSecr=3160848404 [TCP PDU reassembled in 100]"
"96","11:00:40.017781","192.168.0.74","64.65.63.120","TLSv1.2","1138","Application Data, Application Data"
"97","11:00:40.017827","192.168.0.74","64.65.63.120","TCP","66","59487  >  443 [ACK] Seq=11573 Ack=62753 Win=8849 Len=0 TSval=3160848450 TSecr=2678141214"
"98","11:00:40.018129","192.168.0.74","64.65.63.120","TLSv1.2","602","Application Data"
"99","11:00:40.019190","64.65.63.120","192.168.0.74","TCP","1474","443  >  59487 [ACK] Seq=62753 Ack=10501 Win=614 Len=1408 TSval=2678141214 TSecr=3160848404 [TCP PDU reassembled in 100]"
"100","11:00:40.019192","64.65.63.120","192.168.0.74","TLSv1.2","1474","Application Data"
"101","11:00:40.019193","64.65.63.120","192.168.0.74","TCP","1474","443  >  59487 [ACK] Seq=65569 Ack=10501 Win=614 Len=1408 TSval=2678141214 TSecr=3160848404 [TCP PDU reassembled in 103]"
"102","11:00:40.019195","64.65.63.120","192.168.0.74","TCP","1474","443  >  59487 [PSH, ACK] Seq=66977 Ack=10501 Win=614 Len=1408 TSval=2678141214 TSecr=3160848404 [TCP PDU reassembled in 103]"
"103","11:00:40.019196","64.65.63.120","192.168.0.74","TLSv1.2","1474","Application Data"
"104","11:00:40.019197","64.65.63.120","192.168.0.74","TCP","1474","443  >  59487 [PSH, ACK] Seq=69793 Ack=10501 Win=614 Len=1408 TSval=2678141216 TSecr=3160848404 [TCP PDU reassembled in 108]"
"105","11:00:40.019257","192.168.0.74","64.65.63.120","TCP","66","59487  >  443 [ACK] Seq=12109 Ack=71201 Win=9066 Len=0 TSval=3160848452 TSecr=2678141216"
"106","11:00:40.019350","192.168.0.74","64.65.63.120","TCP","66","[TCP Window Update] 59487  >  443 [ACK] Seq=12109 Ack=71201 Win=9198 Len=0 TSval=3160848452 TSecr=2678141216"
"107","11:00:40.021104","64.65.63.120","192.168.0.74","TCP","1474","443  >  59487 [ACK] Seq=71201 Ack=10501 Win=614 Len=1408 TSval=2678141216 TSecr=3160848404 [TCP PDU reassembled in 108]"
"108","11:00:40.021106","64.65.63.120","192.168.0.74","TLSv1.2","1474","Application Data"
"109","11:00:40.021107","64.65.63.120","192.168.0.74","TCP","1474","443  >  59487 [PSH, ACK] Seq=74017 Ack=10501 Win=614 Len=1408 TSval=2678141216 TSecr=3160848404 [TCP PDU reassembled in 111]"
"110","11:00:40.021108","64.65.63.120","192.168.0.74","TCP","1474","443  >  59487 [ACK] Seq=75425 Ack=10501 Win=614 Len=1408 TSval=2678141216 TSecr=3160848404 [TCP PDU reassembled in 111]"
"111","11:00:40.021110","64.65.63.120","192.168.0.74","TLSv1.2","1474","Application Data"
"112","11:00:40.021111","64.65.63.120","192.168.0.74","TCP","1474","443  >  59487 [ACK] Seq=78241 Ack=10501 Win=614 Len=1408 TSval=2678141216 TSecr=3160848404 [TCP PDU reassembled in 113]"
"113","11:00:40.021112","64.65.63.120","192.168.0.74","TLSv1.2","1474","Application Data"
"114","11:00:40.021113","64.65.63.120","192.168.0.74","TCP","1474","443  >  59487 [PSH, ACK] Seq=81057 Ack=10501 Win=614 Len=1408 TSval=2678141216 TSecr=3160848404 [TCP PDU reassembled in 116]"
"115","11:00:40.021115","64.65.63.120","192.168.0.74","TCP","1474","443  >  59487 [ACK] Seq=82465 Ack=10501 Win=614 Len=1408 TSval=2678141216 TSecr=3160848404 [TCP PDU reassembled in 116]"
"116","11:00:40.021116","64.65.63.120","192.168.0.74","TLSv1.2","1474","Application Data"
"117","11:00:40.021117","64.65.63.120","192.168.0.74","TCP","1474","443  >  59487 [ACK] Seq=85281 Ack=10501 Win=614 Len=1408 TSval=2678141216 TSecr=3160848404 [TCP PDU reassembled in 119]"
"118","11:00:40.021118","64.65.63.120","192.168.0.74","TCP","1474","443  >  59487 [PSH, ACK] Seq=86689 Ack=10501 Win=614 Len=1408 TSval=2678141216 TSecr=3160848404 [TCP PDU reassembled in 119]"
"119","11:00:40.021119","64.65.63.120","192.168.0.74","TLSv1.2","1474","Application Data"
"120","11:00:40.021120","64.65.63.120","192.168.0.74","TCP","1474","443  >  59487 [PSH, ACK] Seq=89505 Ack=10501 Win=614 Len=1408 TSval=2678141216 TSecr=3160848404 [TCP PDU reassembled in 124]"
"121","11:00:40.021201","192.168.0.74","64.65.63.120","TLSv1.2","602","Application Data"
"122","11:00:40.021227","192.168.0.74","64.65.63.120","TCP","66","59487  >  443 [ACK] Seq=12645 Ack=90913 Win=8890 Len=0 TSval=3160848454 TSecr=2678141216"
"123","11:00:40.021460","192.168.0.74","64.65.63.120","TLSv1.2","602","Application Data"
"124","11:00:40.031912","64.65.63.120","192.168.0.74","TLSv1.2","1474","Application Data"
"125","11:00:40.031914","64.65.63.120","192.168.0.74","TCP","1474","443  >  59487 [PSH, ACK] Seq=92321 Ack=10501 Win=614 Len=1408 TSval=2678141228 TSecr=3160848404 [TCP PDU reassembled in 129]"
"126","11:00:40.031915","64.65.63.120","192.168.0.74","TCP","1474","443  >  59487 [ACK] Seq=93729 Ack=10501 Win=614 Len=1408 TSval=2678141228 TSecr=3160848404 [TCP PDU reassembled in 129]"
"127","11:00:40.032003","192.168.0.74","64.65.63.120","TCP","66","59487  >  443 [ACK] Seq=13181 Ack=95137 Win=9132 Len=0 TSval=3160848464 TSecr=2678141228"
"128","11:00:40.032119","192.168.0.74","64.65.63.120","TCP","66","[TCP Window Update] 59487  >  443 [ACK] Seq=13181 Ack=95137 Win=9198 Len=0 TSval=3160848464 TSecr=2678141228"
"129","11:00:40.054140","64.65.63.120","192.168.0.74","TLSv1.2","1474","Application Data"
"130","11:00:40.054142","64.65.63.120","192.168.0.74","TCP","1474","443  >  59487 [PSH, ACK] Seq=96545 Ack=11573 Win=614 Len=1408 TSval=2678141249 TSecr=3160848450 [TCP PDU reassembled in 132]"
"131","11:00:40.054143","64.65.63.120","192.168.0.74","TCP","1474","443  >  59487 [ACK] Seq=97953 Ack=11573 Win=614 Len=1408 TSval=2678141249 TSecr=3160848450 [TCP PDU reassembled in 132]"
"132","11:00:40.054144","64.65.63.120","192.168.0.74","TLSv1.2","1474","Application Data, Application Data"
"133","11:00:40.054146","64.65.63.120","192.168.0.74","TCP","1474","443  >  59487 [ACK] Seq=100769 Ack=11573 Win=614 Len=1408 TSval=2678141249 TSecr=3160848450 [TCP PDU reassembled in 135]"
"134","11:00:40.054147","64.65.63.120","192.168.0.74","TCP","1474","443  >  59487 [PSH, ACK] Seq=102177 Ack=11573 Win=614 Len=1408 TSval=2678141249 TSecr=3160848450 [TCP PDU reassembled in 135]"
"135","11:00:40.054148","64.65.63.120","192.168.0.74","TLSv1.2","1474","Application Data"
"136","11:00:40.054150","64.65.63.120","192.168.0.74","TCP","1474","443  >  59487 [PSH, ACK] Seq=104993 Ack=11573 Win=614 Len=1408 TSval=2678141249 TSecr=3160848450 [TCP PDU reassembled in 137]"
"137","11:00:40.054151","64.65.63.120","192.168.0.74","TLSv1.2","1282","Application Data"
"138","11:00:40.054266","192.168.0.74","64.65.63.120","TLSv1.2","602","Application Data"
"139","11:00:40.054600","192.168.0.74","64.65.63.120","TCP","66","[TCP Window Update] 59487  >  443 [ACK] Seq=13717 Ack=107617 Win=9198 Len=0 TSval=3160848487 TSecr=2678141249"
"140","11:00:40.063752","64.65.63.120","192.168.0.74","TCP","66","443  >  59487 [ACK] Seq=107617 Ack=12645 Win=614 Len=0 TSval=2678141253 TSecr=3160848450"
"141","11:00:40.068556","192.87.28.82","192.168.0.74","TCP","1474","9001  >  59488 [ACK] Seq=537 Ack=1 Win=1565 Len=1408 TSval=2690190539 TSecr=3829715311 [TCP PDU reassembled in 143]"
"142","11:00:40.068559","192.87.28.82","192.168.0.74","TCP","1474","9001  >  59488 [ACK] Seq=1945 Ack=1 Win=1565 Len=1408 TSval=2690190539 TSecr=3829715311 [TCP PDU reassembled in 143]"
"143","11:00:40.068560","192.87.28.82","192.168.0.74","TLSv1.2","1320","Application Data"
"144","11:00:40.068562","192.87.28.82","192.168.0.74","TCP","1474","9001  >  59488 [ACK] Seq=4607 Ack=1 Win=1565 Len=1408 TSval=2690190539 TSecr=3829715311 [TCP PDU reassembled in 148]"
"145","11:00:40.068563","192.87.28.82","192.168.0.74","TCP","1474","9001  >  59488 [ACK] Seq=6015 Ack=1 Win=1565 Len=1408 TSval=2690190539 TSecr=3829715311 [TCP PDU reassembled in 148]"
"146","11:00:40.068664","192.168.0.74","192.87.28.82","TCP","66","59488  >  9001 [ACK] Seq=1 Ack=7423 Win=3987 Len=0 TSval=3829717456 TSecr=2690190539"
"147","11:00:40.068771","192.168.0.74","192.87.28.82","TCP","66","[TCP Window Update] 59488  >  9001 [ACK] Seq=1 Ack=7423 Win=4094 Len=0 TSval=3829717456 TSecr=2690190539"
"148","11:00:40.070474","192.87.28.82","192.168.0.74","TLSv1.2","934","Application Data"
"149","11:00:40.070561","192.168.0.74","192.87.28.82","TCP","66","59488  >  9001 [ACK] Seq=1 Ack=8291 Win=4081 Len=0 TSval=3829717458 TSecr=2690190539"
"150","11:00:40.070740","192.168.0.74","192.87.28.82","TLSv1.2","602","Application Data"
"151","11:00:40.075301","64.65.63.120","192.168.0.74","TCP","1474","443  >  59487 [ACK] Seq=107617 Ack=13181 Win=614 Len=1408 TSval=2678141269 TSecr=3160848454 [TCP PDU reassembled in 161]"
"152","11:00:40.075303","64.65.63.120","192.168.0.74","TCP","1474","443  >  59487 [PSH, ACK] Seq=109025 Ack=13181 Win=614 Len=1408 TSval=2678141269 TSecr=3160848454 [TCP PDU reassembled in 161]"
"153","11:00:40.075397","192.168.0.74","64.65.63.120","TCP","66","59487  >  443 [ACK] Seq=13717 Ack=110433 Win=9154 Len=0 TSval=3160848508 TSecr=2678141269"
"154","11:00:40.075483","192.168.0.74","64.65.63.120","TCP","66","[TCP Window Update] 59487  >  443 [ACK] Seq=13717 Ack=110433 Win=9198 Len=0 TSval=3160848508 TSecr=2678141269"
"155","11:00:40.080051","192.87.28.82","192.168.0.74","TCP","1474","9001  >  59488 [ACK] Seq=8291 Ack=1 Win=1565 Len=1408 TSval=2690190552 TSecr=3829715311 [TCP PDU reassembled in 157]"
"156","11:00:40.080054","192.87.28.82","192.168.0.74","TCP","1474","9001  >  59488 [ACK] Seq=9699 Ack=1 Win=1565 Len=1408 TSval=2690190552 TSecr=3829715311 [TCP PDU reassembled in 157]"
"157","11:00:40.080055","192.87.28.82","192.168.0.74","TLSv1.2","1320","Application Data"
"158","11:00:40.080160","192.168.0.74","192.87.28.82","TCP","66","59488  >  9001 [ACK] Seq=537 Ack=9699 Win=4072 Len=0 TSval=3829717467 TSecr=2690190552"
"159","11:00:40.080194","192.168.0.74","192.87.28.82","TCP","66","59488  >  9001 [ACK] Seq=537 Ack=12361 Win=4031 Len=0 TSval=3829717467 TSecr=2690190552"
"160","11:00:40.081090","192.168.0.74","192.87.28.82","TCP","66","[TCP Window Update] 59488  >  9001 [ACK] Seq=537 Ack=12361 Win=4094 Len=0 TSval=3829717468 TSecr=2690190552"
"161","11:00:40.081769","64.65.63.120","192.168.0.74","TLSv1.2","1474","Application Data, Application Data"
"162","11:00:40.081771","64.65.63.120","192.168.0.74","TCP","1474","443  >  59487 [ACK] Seq=111841 Ack=13181 Win=614 Len=1408 TSval=2678141278 TSecr=3160848454 [TCP PDU reassembled in 165]"
"163","11:00:40.081870","192.168.0.74","64.65.63.120","TCP","66","59487  >  443 [ACK] Seq=13717 Ack=113249 Win=9198 Len=0 TSval=3160848514 TSecr=2678141278"
"164","11:00:40.082927","64.65.63.120","192.168.0.74","TCP","1474","443  >  59487 [PSH, ACK] Seq=113249 Ack=13181 Win=614 Len=1408 TSval=2678141278 TSecr=3160848454 [TCP PDU reassembled in 165]"
"165","11:00:40.082929","64.65.63.120","192.168.0.74","TLSv1.2","1474","Application Data"
"166","11:00:40.082930","64.65.63.120","192.168.0.74","TCP","1474","443  >  59487 [ACK] Seq=116065 Ack=13181 Win=614 Len=1408 TSval=2678141278 TSecr=3160848454 [TCP PDU reassembled in 168]"
"167","11:00:40.082932","64.65.63.120","192.168.0.74","TCP","1474","443  >  59487 [PSH, ACK] Seq=117473 Ack=13181 Win=614 Len=1408 TSval=2678141278 TSecr=3160848454 [TCP PDU reassembled in 168]"
"168","11:00:40.082933","64.65.63.120","192.168.0.74","TLSv1.2","1474","Application Data"
"169","11:00:40.082934","64.65.63.120","192.168.0.74","TCP","1474","443  >  59487 [ACK] Seq=120289 Ack=13181 Win=614 Len=1408 TSval=2678141278 TSecr=3160848454 [TCP PDU reassembled in 172]"
"170","11:00:40.082935","64.65.63.120","192.168.0.74","TCP","1474","443  >  59487 [PSH, ACK] Seq=121697 Ack=13181 Win=614 Len=1408 TSval=2678141278 TSecr=3160848454 [TCP PDU reassembled in 172]"
"171","11:00:40.083100","192.168.0.74","64.65.63.120","TLSv1.2","602","Application Data"
"172","11:00:40.084104","64.65.63.120","192.168.0.74","TLSv1.2","1474","Application Data"
"173","11:00:40.084106","64.65.63.120","192.168.0.74","TCP","1474","443  >  59487 [ACK] Seq=124513 Ack=13181 Win=614 Len=1408 TSval=2678141281 TSecr=3160848454 [TCP PDU reassembled in 176]"
"174","11:00:40.084174","192.168.0.74","64.65.63.120","TCP","66","59487  >  443 [ACK] Seq=14253 Ack=125921 Win=9198 Len=0 TSval=3160848516 TSecr=2678141281"
"175","11:00:40.086170","64.65.63.120","192.168.0.74","TCP","1474","443  >  59487 [PSH, ACK] Seq=125921 Ack=13181 Win=614 Len=1408 TSval=2678141281 TSecr=3160848454 [TCP PDU reassembled in 176]"
"176","11:00:40.086172","64.65.63.120","192.168.0.74","TLSv1.2","1474","Application Data"
"177","11:00:40.086174","64.65.63.120","192.168.0.74","TCP","1474","443  >  59487 [ACK] Seq=128737 Ack=13181 Win=614 Len=1408 TSval=2678141281 TSecr=3160848454 [TCP PDU reassembled in 180]"
"178","11:00:40.086175","64.65.63.120","192.168.0.74","TCP","1474","443  >  59487 [PSH, ACK] Seq=130145 Ack=13181 Win=614 Len=1408 TSval=2678141281 TSecr=3160848454 [TCP PDU reassembled in 180]"
"179","11:00:40.088710","192.168.0.74","64.65.63.120","TCP","66","59487  >  443 [ACK] Seq=14253 Ack=131553 Win=9198 Len=0 TSval=3160848521 TSecr=2678141281"
"180","11:00:40.104319","64.65.63.120","192.168.0.74","TLSv1.2","464","Application Data, Application Data"
"181","11:00:40.104321","64.65.63.120","192.168.0.74","TCP","1474","443  >  59487 [ACK] Seq=131951 Ack=13717 Win=614 Len=1408 TSval=2678141299 TSecr=3160848487 [TCP PDU reassembled in 183]"
"182","11:00:40.104323","64.65.63.120","192.168.0.74","TCP","1474","443  >  59487 [PSH, ACK] Seq=133359 Ack=13717 Win=614 Len=1408 TSval=2678141299 TSecr=3160848487 [TCP PDU reassembled in 183]"
"183","11:00:40.104324","64.65.63.120","192.168.0.74","TLSv1.2","1474","Application Data"
"184","11:00:40.104326","64.65.63.120","192.168.0.74","TCP","1474","443  >  59487 [ACK] Seq=136175 Ack=13717 Win=614 Len=1408 TSval=2678141299 TSecr=3160848487 [TCP PDU reassembled in 203]"
"185","11:00:40.104327","64.65.63.120","192.168.0.74","TCP","1474","443  >  59487 [PSH, ACK] Seq=137583 Ack=13717 Win=614 Len=1408 TSval=2678141299 TSecr=3160848487 [TCP PDU reassembled in 203]"
"186","11:00:40.104439","192.168.0.74","64.65.63.120","TLSv1.2","602","Application Data"
"187","11:00:40.104581","192.168.0.74","64.65.63.120","TCP","66","[TCP Window Update] 59487  >  443 [ACK] Seq=14789 Ack=138991 Win=9198 Len=0 TSval=3160848537 TSecr=2678141299"
"188","11:00:40.107059","192.87.28.82","192.168.0.74","TLSv1.2","1474","Application Data"
"189","11:00:40.107061","192.87.28.82","192.168.0.74","TCP","1474","9001  >  59488 [ACK] Seq=13769 Ack=1 Win=1565 Len=1408 TSval=2690190581 TSecr=3829717456 [TCP PDU reassembled in 190]"
"190","11:00:40.107062","192.87.28.82","192.168.0.74","TLSv1.2","1406","Application Data"
"191","11:00:40.107064","192.87.28.82","192.168.0.74","TCP","1474","9001  >  59488 [ACK] Seq=16517 Ack=1 Win=1565 Len=1408 TSval=2690190581 TSecr=3829717456 [TCP PDU reassembled in 193]"
"192","11:00:40.107066","192.87.28.82","192.168.0.74","TCP","1474","9001  >  59488 [ACK] Seq=17925 Ack=1 Win=1565 Len=1408 TSval=2690190581 TSecr=3829717456 [TCP PDU reassembled in 193]"
"193","11:00:40.107067","192.87.28.82","192.168.0.74","TLSv1.2","934","Application Data"
"194","11:00:40.107183","192.168.0.74","192.87.28.82","TCP","66","59488  >  9001 [ACK] Seq=537 Ack=20201 Win=3972 Len=0 TSval=3829717494 TSecr=2690190581"
"195","11:00:40.107286","192.168.0.74","192.87.28.82","TCP","66","[TCP Window Update] 59488  >  9001 [ACK] Seq=537 Ack=20201 Win=4094 Len=0 TSval=3829717495 TSecr=2690190581"
"196","11:00:40.112059","192.87.28.82","192.168.0.74","TCP","1474","9001  >  59488 [ACK] Seq=20201 Ack=537 Win=1557 Len=1408 TSval=2690190585 TSecr=3829717458 [TCP PDU reassembled in 198]"
"197","11:00:40.112061","192.87.28.82","192.168.0.74","TCP","1474","9001  >  59488 [ACK] Seq=21609 Ack=537 Win=1557 Len=1408 TSval=2690190585 TSecr=3829717458 [TCP PDU reassembled in 198]"
"198","11:00:40.112062","192.87.28.82","192.168.0.74","TLSv1.2","1320","Application Data"
"199","11:00:40.112063","192.87.28.82","192.168.0.74","TCP","1474","9001  >  59488 [ACK] Seq=24271 Ack=537 Win=1557 Len=1408 TSval=2690190585 TSecr=3829717458 [TCP PDU reassembled in 273]"
"200","11:00:40.112105","192.168.0.74","192.87.28.82","TCP","66","59488  >  9001 [ACK] Seq=537 Ack=25679 Win=4009 Len=0 TSval=3829717499 TSecr=2690190585"
"201","11:00:40.112172","192.168.0.74","192.87.28.82","TCP","66","[TCP Window Update] 59488  >  9001 [ACK] Seq=537 Ack=25679 Win=4094 Len=0 TSval=3829717499 TSecr=2690190585"
"202","11:00:40.112267","192.168.0.74","192.87.28.82","TLSv1.2","602","Application Data"
"203","11:00:40.117434","64.65.63.120","192.168.0.74","TLSv1.2","1474","Application Data, Application Data"
"204","11:00:40.117436","64.65.63.120","192.168.0.74","TCP","1474","443  >  59487 [ACK] Seq=140399 Ack=13717 Win=614 Len=1408 TSval=2678141314 TSecr=3160848508 [TCP PDU reassembled in 207]"
"205","11:00:40.117438","64.65.63.120","192.168.0.74","TCP","1474","443  >  59487 [PSH, ACK] Seq=141807 Ack=13717 Win=614 Len=1408 TSval=2678141314 TSecr=3160848508 [TCP PDU reassembled in 207]"
"206","11:00:40.117514","192.168.0.74","64.65.63.120","TCP","66","59487  >  443 [ACK] Seq=14789 Ack=143215 Win=9198 Len=0 TSval=3160848550 TSecr=2678141314"
"207","11:00:40.119172","64.65.63.120","192.168.0.74","TLSv1.2","1474","Application Data"
"208","11:00:40.119174","64.65.63.120","192.168.0.74","TCP","1474","443  >  59487 [ACK] Seq=144623 Ack=13717 Win=614 Len=1408 TSval=2678141314 TSecr=3160848508 [TCP PDU reassembled in 210]"
"209","11:00:40.119176","64.65.63.120","192.168.0.74","TCP","1474","443  >  59487 [PSH, ACK] Seq=146031 Ack=13717 Win=614 Len=1408 TSval=2678141314 TSecr=3160848508 [TCP PDU reassembled in 210]"
"210","11:00:40.119177","64.65.63.120","192.168.0.74","TLSv1.2","1474","Application Data"
"211","11:00:40.119179","64.65.63.120","192.168.0.74","TCP","1474","443  >  59487 [ACK] Seq=148847 Ack=13717 Win=614 Len=1408 TSval=2678141314 TSecr=3160848508 [TCP PDU reassembled in 213]"
"212","11:00:40.119180","64.65.63.120","192.168.0.74","TCP","1474","443  >  59487 [PSH, ACK] Seq=150255 Ack=13717 Win=614 Len=1408 TSval=2678141314 TSecr=3160848508 [TCP PDU reassembled in 213]"
"213","11:00:40.119181","64.65.63.120","192.168.0.74","TLSv1.2","1474","Application Data"
"214","11:00:40.119182","64.65.63.120","192.168.0.74","TCP","1474","443  >  59487 [ACK] Seq=153071 Ack=13717 Win=614 Len=1408 TSval=2678141314 TSecr=3160848508 [TCP PDU reassembled in 216]"
"215","11:00:40.119184","64.65.63.120","192.168.0.74","TCP","1474","443  >  59487 [PSH, ACK] Seq=154479 Ack=13717 Win=614 Len=1408 TSval=2678141314 TSecr=3160848508 [TCP PDU reassembled in 216]"
"216","11:00:40.119185","64.65.63.120","192.168.0.74","TLSv1.2","1474","Application Data, Application Data"
"217","11:00:40.119617","192.168.0.74","64.65.63.120","TLSv1.2","602","Application Data"
"218","11:00:40.120935","64.65.63.120","192.168.0.74","TCP","1474","443  >  59487 [ACK] Seq=157295 Ack=13717 Win=614 Len=1408 TSval=2678141314 TSecr=3160848508 [TCP PDU reassembled in 220]"
"219","11:00:40.120937","64.65.63.120","192.168.0.74","TCP","1474","443  >  59487 [PSH, ACK] Seq=158703 Ack=13717 Win=614 Len=1408 TSval=2678141314 TSecr=3160848508 [TCP PDU reassembled in 220]"
"220","11:00:40.120938","64.65.63.120","192.168.0.74","TLSv1.2","1474","Application Data"
"221","11:00:40.120939","64.65.63.120","192.168.0.74","TCP","1474","443  >  59487 [ACK] Seq=161519 Ack=13717 Win=614 Len=1408 TSval=2678141314 TSecr=3160848508 [TCP PDU reassembled in 223]"
"222","11:00:40.120941","64.65.63.120","192.168.0.74","TCP","1474","443  >  59487 [PSH, ACK] Seq=162927 Ack=13717 Win=614 Len=1408 TSval=2678141314 TSecr=3160848508 [TCP PDU reassembled in 223]"
"223","11:00:40.120942","64.65.63.120","192.168.0.74","TLSv1.2","1474","Application Data"
"224","11:00:40.120943","64.65.63.120","192.168.0.74","TCP","1474","443  >  59487 [ACK] Seq=165743 Ack=14253 Win=614 Len=1408 TSval=2678141315 TSecr=3160848515 [TCP PDU reassembled in 226]"
"225","11:00:40.120945","64.65.63.120","192.168.0.74","TCP","1474","443  >  59487 [PSH, ACK] Seq=167151 Ack=14253 Win=614 Len=1408 TSval=2678141315 TSecr=3160848515 [TCP PDU reassembled in 226]"
"226","11:00:40.120947","64.65.63.120","192.168.0.74","TLSv1.2","1474","Application Data"
"227","11:00:40.120948","64.65.63.120","192.168.0.74","TCP","1474","443  >  59487 [ACK] Seq=169967 Ack=14253 Win=614 Len=1408 TSval=2678141316 TSecr=3160848515 [TCP PDU reassembled in 229]"
"228","11:00:40.120949","64.65.63.120","192.168.0.74","TCP","1474","443  >  59487 [PSH, ACK] Seq=171375 Ack=14253 Win=614 Len=1408 TSval=2678141316 TSecr=3160848515 [TCP PDU reassembled in 229]"
"229","11:00:40.120951","64.65.63.120","192.168.0.74","TLSv1.2","1474","Application Data, Application Data"
"230","11:00:40.121713","192.168.0.74","64.65.63.120","TLSv1.2","602","Application Data"
"231","11:00:40.123483","64.65.63.120","192.168.0.74","TCP","1474","443  >  59487 [ACK] Seq=174191 Ack=14253 Win=614 Len=1408 TSval=2678141317 TSecr=3160848515 [TCP PDU reassembled in 232]"
"232","11:00:40.123485","64.65.63.120","192.168.0.74","TLSv1.2","1474","Application Data"
"233","11:00:40.123487","64.65.63.120","192.168.0.74","TCP","1474","443  >  59487 [ACK] Seq=177007 Ack=14253 Win=614 Len=1408 TSval=2678141317 TSecr=3160848515 [TCP PDU reassembled in 235]"
"234","11:00:40.123488","64.65.63.120","192.168.0.74","TCP","1474","443  >  59487 [ACK] Seq=178415 Ack=14253 Win=614 Len=1408 TSval=2678141317 TSecr=3160848515 [TCP PDU reassembled in 235]"
"235","11:00:40.123489","64.65.63.120","192.168.0.74","TLSv1.2","1474","Application Data"
"236","11:00:40.123491","64.65.63.120","192.168.0.74","TCP","1474","443  >  59487 [ACK] Seq=181231 Ack=14253 Win=614 Len=1408 TSval=2678141317 TSecr=3160848515 [TCP PDU reassembled in 238]"
"237","11:00:40.123492","64.65.63.120","192.168.0.74","TCP","1474","443  >  59487 [ACK] Seq=182639 Ack=14253 Win=614 Len=1408 TSval=2678141317 TSecr=3160848515 [TCP PDU reassembled in 238]"
"238","11:00:40.123493","64.65.63.120","192.168.0.74","TLSv1.2","1474","Application Data"
"239","11:00:40.123494","64.65.63.120","192.168.0.74","TCP","1474","443  >  59487 [ACK] Seq=185455 Ack=14253 Win=614 Len=1408 TSval=2678141318 TSecr=3160848515 [TCP PDU reassembled in 241]"
"240","11:00:40.123495","64.65.63.120","192.168.0.74","TCP","1474","443  >  59487 [ACK] Seq=186863 Ack=14253 Win=614 Len=1408 TSval=2678141318 TSecr=3160848515 [TCP PDU reassembled in 241]"
"241","11:00:40.123497","64.65.63.120","192.168.0.74","TLSv1.2","1474","Application Data"
"242","11:00:40.123498","64.65.63.120","192.168.0.74","TLSv1.2","1474","Application Data"
"243","11:00:40.123499","64.65.63.120","192.168.0.74","TCP","1474","443  >  59487 [ACK] Seq=191087 Ack=14253 Win=614 Len=1408 TSval=2678141318 TSecr=3160848515 [TCP PDU reassembled in 244]"
"244","11:00:40.123500","64.65.63.120","192.168.0.74","TLSv1.2","1474","Application Data"
"245","11:00:40.123502","64.65.63.120","192.168.0.74","TCP","1474","443  >  59487 [ACK] Seq=193903 Ack=14253 Win=614 Len=1408 TSval=2678141318 TSecr=3160848515 [TCP PDU reassembled in 247]"
"246","11:00:40.123503","64.65.63.120","192.168.0.74","TCP","1474","443  >  59487 [ACK] Seq=195311 Ack=14253 Win=614 Len=1408 TSval=2678141318 TSecr=3160848515 [TCP PDU reassembled in 247]"
"247","11:00:40.123504","64.65.63.120","192.168.0.74","TLSv1.2","1474","Application Data"
"248","11:00:40.123505","64.65.63.120","192.168.0.74","TCP","1474","443  >  59487 [ACK] Seq=198127 Ack=14253 Win=614 Len=1408 TSval=2678141318 TSecr=3160848515 [TCP PDU reassembled in 250]"
"249","11:00:40.123506","64.65.63.120","192.168.0.74","TCP","1474","443  >  59487 [ACK] Seq=199535 Ack=14253 Win=614 Len=1408 TSval=2678141318 TSecr=3160848515 [TCP PDU reassembled in 250]"
"250","11:00:40.123507","64.65.63.120","192.168.0.74","TLSv1.2","1474","Application Data, Application Data"
"251","11:00:40.123509","64.65.63.120","192.168.0.74","TCP","1474","443  >  59487 [ACK] Seq=202351 Ack=14253 Win=614 Len=1408 TSval=2678141318 TSecr=3160848515 [TCP PDU reassembled in 253]"
"252","11:00:40.123510","64.65.63.120","192.168.0.74","TCP","1474","443  >  59487 [ACK] Seq=203759 Ack=14253 Win=614 Len=1408 TSval=2678141318 TSecr=3160848515 [TCP PDU reassembled in 253]"
"253","11:00:40.123511","64.65.63.120","192.168.0.74","TLSv1.2","1474","Application Data"
"254","11:00:40.123512","64.65.63.120","192.168.0.74","TCP","1474","443  >  59487 [ACK] Seq=206575 Ack=14253 Win=614 Len=1408 TSval=2678141318 TSecr=3160848515 [TCP PDU reassembled in 255]"
"255","11:00:40.123513","64.65.63.120","192.168.0.74","TLSv1.2","1474","Application Data"
"256","11:00:40.123515","64.65.63.120","192.168.0.74","TCP","1474","443  >  59487 [PSH, ACK] Seq=209391 Ack=14253 Win=614 Len=1408 TSval=2678141318 TSecr=3160848515 [TCP PDU reassembled in 258]"
"257","11:00:40.123516","64.65.63.120","192.168.0.74","TCP","1474","443  >  59487 [ACK] Seq=210799 Ack=14253 Win=614 Len=1408 TSval=2678141319 TSecr=3160848515 [TCP PDU reassembled in 258]"
"258","11:00:40.123517","64.65.63.120","192.168.0.74","TLSv1.2","1474","Application Data"
"259","11:00:40.123518","64.65.63.120","192.168.0.74","TCP","1474","443  >  59487 [PSH, ACK] Seq=213615 Ack=14253 Win=614 Len=1408 TSval=2678141319 TSecr=3160848515 [TCP PDU reassembled in 261]"
"260","11:00:40.123519","64.65.63.120","192.168.0.74","TCP","1474","443  >  59487 [ACK] Seq=215023 Ack=14253 Win=614 Len=1408 TSval=2678141319 TSecr=3160848515 [TCP PDU reassembled in 261]"
"261","11:00:40.123520","64.65.63.120","192.168.0.74","TLSv1.2","1474","Application Data"
"262","11:00:40.123521","64.65.63.120","192.168.0.74","TCP","1474","443  >  59487 [PSH, ACK] Seq=217839 Ack=14253 Win=614 Len=1408 TSval=2678141319 TSecr=3160848515 [TCP PDU reassembled in 264]"
"263","11:00:40.123522","64.65.63.120","192.168.0.74","TCP","1474","443  >  59487 [ACK] Seq=219247 Ack=14253 Win=614 Len=1408 TSval=2678141319 TSecr=3160848515 [TCP PDU reassembled in 264]"
"264","11:00:40.123524","64.65.63.120","192.168.0.74","TLSv1.2","1474","Application Data"
"265","11:00:40.123525","64.65.63.120","192.168.0.74","TCP","1474","443  >  59487 [PSH, ACK] Seq=222063 Ack=14253 Win=614 Len=1408 TSval=2678141319 TSecr=3160848515 [TCP PDU reassembled in 267]"
