"No.","Time","Source","Destination","Protocol","Length","Info"
"1","11:42:53.819592","192.168.0.192","230.0.0.1","UDP","92","58107  >  6666 Len=50"
"2","11:42:54.020461","192.168.0.192","230.0.0.1","UDP","92","62979  >  6666 Len=50"
"3","11:42:54.327666","149.154.167.41","192.168.0.74","SSL","171","Continuation Data"
"4","11:42:54.327858","192.168.0.74","149.154.167.41","TCP","66","59400  >  443 [ACK] Seq=1 Ack=106 Win=65530 Len=0 TSval=1845367637 TSecr=325080451"
"5","11:42:54.456878","192.168.0.74","5.28.195.2","TCP","78","62945  >  5222 [SYN] Seq=0 Win=65535 Len=0 MSS=1460 WS=16 TSval=1772625561 TSecr=0 SACK_PERM"
"6","11:42:54.456934","192.168.0.74","5.28.195.2","TCP","78","62944  >  80 [SYN] Seq=0 Win=65535 Len=0 MSS=1460 WS=16 TSval=2749170556 TSecr=0 SACK_PERM"
"7","11:42:54.843705","192.168.0.192","230.0.0.1","UDP","92","58107  >  6666 Len=50"
"8","11:42:55.052574","192.168.0.192","230.0.0.1","UDP","92","62979  >  6666 Len=50"
"9","11:42:55.351607","149.154.167.41","192.168.0.74","SSL","171","Continuation Data"
"10","11:42:55.351705","192.168.0.74","149.154.167.41","TCP","66","59400  >  443 [ACK] Seq=1 Ack=211 Win=65530 Len=0 TSval=1845368661 TSecr=325081456"
"11","11:42:55.426329","192.168.0.74","5.28.195.2","TCP","78","62946  >  443 [SYN, ECE, CWR] Seq=0 Win=65535 Len=0 MSS=1460 WS=16 TSval=2421793408 TSecr=0 SACK_PERM"
"12","11:42:55.458114","192.168.0.74","5.28.195.2","TCP","78","[TCP Retransmission] 62945  >  5222 [SYN] Seq=0 Win=65535 Len=0 MSS=1460 WS=16 TSval=1772626562 TSecr=0 SACK_PERM"
"13","11:42:55.458166","192.168.0.74","5.28.195.2","TCP","78","[TCP Retransmission] 62944  >  80 [SYN] Seq=0 Win=65535 Len=0 MSS=1460 WS=16 TSval=2749171557 TSecr=0 SACK_PERM"
"14","11:42:55.463357","5.28.195.2","192.168.0.74","TCP","74","443  >  62946 [SYN, ACK, ECE] Seq=0 Ack=1 Win=65535 Len=0 MSS=1240 SACK_PERM TSval=3097583960 TSecr=2421793408 WS=1024"
"15","11:42:55.463497","192.168.0.74","5.28.195.2","TCP","66","62946  >  443 [ACK] Seq=1 Ack=1 Win=1048560 Len=0 TSval=2421793445 TSecr=3097583960"
"16","11:42:55.463695","192.168.0.74","5.28.195.2","TLSv1","583","Client Hello"
"17","11:42:55.504073","5.28.195.2","192.168.0.74","TCP","66","443  >  62946 [ACK] Seq=1 Ack=518 Win=67584 Len=0 TSval=3097584060 TSecr=2421793445"
"18","11:42:55.504074","5.28.195.2","192.168.0.74","TCP","66","443  >  62946 [FIN, ACK] Seq=1 Ack=518 Win=67584 Len=0 TSval=3097584060 TSecr=2421793445"
"19","11:42:55.504240","192.168.0.74","5.28.195.2","TCP","66","62946  >  443 [ACK] Seq=518 Ack=2 Win=1048560 Len=0 TSval=2421793486 TSecr=3097584060"
"20","11:42:55.504441","192.168.0.74","5.28.195.2","TCP","66","62946  >  443 [FIN, ACK] Seq=518 Ack=2 Win=1048560 Len=0 TSval=2421793486 TSecr=3097584060"
"21","11:42:55.544605","5.28.195.2","192.168.0.74","TCP","56","443  >  62946 [RST] Seq=2 Win=0 Len=0"
"22","11:42:55.641722","192.168.0.74","5.28.195.2","TCP","78","62947  >  443 [SYN, ECE, CWR] Seq=0 Win=65535 Len=0 MSS=1460 WS=16 TSval=2270485154 TSecr=0 SACK_PERM"
"23","11:42:55.680165","5.28.195.2","192.168.0.74","TCP","74","443  >  62947 [SYN, ACK, ECE] Seq=0 Ack=1 Win=65535 Len=0 MSS=1240 SACK_PERM TSval=1730387750 TSecr=2270485154 WS=1024"
"24","11:42:55.680421","192.168.0.74","5.28.195.2","TCP","66","62947  >  443 [ACK] Seq=1 Ack=1 Win=1048560 Len=0 TSval=2270485193 TSecr=1730387750"
"25","11:42:55.680760","192.168.0.74","5.28.195.2","TLSv1","583","Client Hello"
"26","11:42:55.721841","5.28.195.2","192.168.0.74","TCP","66","443  >  62947 [ACK] Seq=1 Ack=518 Win=67584 Len=0 TSval=1730387834 TSecr=2270485193"
"27","11:42:55.723563","5.28.195.2","192.168.0.74","TCP","66","443  >  62947 [FIN, ACK] Seq=1 Ack=518 Win=67584 Len=0 TSval=1730387835 TSecr=2270485193"
"28","11:42:55.723725","192.168.0.74","5.28.195.2","TCP","66","62947  >  443 [ACK] Seq=518 Ack=2 Win=1048560 Len=0 TSval=2270485236 TSecr=1730387835"
"29","11:42:55.724042","192.168.0.74","5.28.195.2","TCP","66","62947  >  443 [FIN, ACK] Seq=518 Ack=2 Win=1048560 Len=0 TSval=2270485236 TSecr=1730387835"
"30","11:42:55.758019","192.168.0.192","230.0.0.1","UDP","92","58107  >  6666 Len=50"
"31","11:42:55.773104","5.28.195.2","192.168.0.74","TCP","56","443  >  62947 [RST] Seq=2 Win=0 Len=0"
"32","11:42:56.069219","192.168.0.192","230.0.0.1","UDP","92","62979  >  6666 Len=50"
"33","11:42:56.252683","192.168.0.74","192.87.28.82","TLSv1.2","1116","Application Data"
"34","11:42:56.339511","192.87.28.82","192.168.0.74","TCP","66","9001  >  59488 [ACK] Seq=1 Ack=1051 Win=2347 Len=0 TSval=2692726805 TSecr=3832253739"
"35","11:42:56.458409","192.168.0.74","5.28.195.2","TCP","78","[TCP Retransmission] 62945  >  5222 [SYN] Seq=0 Win=65535 Len=0 MSS=1460 WS=16 TSval=1772627563 TSecr=0 SACK_PERM"
"36","11:42:56.458449","192.168.0.74","5.28.195.2","TCP","78","[TCP Retransmission] 62944  >  80 [SYN] Seq=0 Win=65535 Len=0 MSS=1460 WS=16 TSval=2749172558 TSecr=0 SACK_PERM"
"37","11:42:56.541545","192.87.28.82","192.168.0.74","TLSv1.2","602","Application Data"
"38","11:42:56.541787","192.168.0.74","192.87.28.82","TCP","66","59488  >  9001 [ACK] Seq=1051 Ack=537 Win=6814 Len=0 TSval=3832254028 TSecr=2692727008"
"39","11:42:56.567428","192.87.28.82","192.168.0.74","TCP","1474","9001  >  59488 [ACK] Seq=537 Ack=1051 Win=2347 Len=1408 TSval=2692727032 TSecr=3832253739 [TCP PDU reassembled in 41]"
"40","11:42:56.567432","192.87.28.82","192.168.0.74","TCP","1474","9001  >  59488 [ACK] Seq=1945 Ack=1051 Win=2347 Len=1408 TSval=2692727032 TSecr=3832253739 [TCP PDU reassembled in 41]"
"41","11:42:56.567435","192.87.28.82","192.168.0.74","TLSv1.2","1320","Application Data"
"42","11:42:56.567438","192.87.28.82","192.168.0.74","TLSv1.2","1474","Application Data"
"43","11:42:56.567440","192.87.28.82","192.168.0.74","TCP","1474","9001  >  59488 [ACK] Seq=6015 Ack=1051 Win=2347 Len=1408 TSval=2692727035 TSecr=3832253739 [TCP PDU reassembled in 44]"
"44","11:42:56.567442","192.87.28.82","192.168.0.74","TLSv1.2","956","Application Data"
"45","11:42:56.567693","192.168.0.74","192.87.28.82","TCP","66","59488  >  9001 [ACK] Seq=1051 Ack=1945 Win=6800 Len=0 TSval=3832254054 TSecr=2692727032"
"46","11:42:56.567775","192.168.0.74","192.87.28.82","TCP","66","59488  >  9001 [ACK] Seq=1051 Ack=8313 Win=6701 Len=0 TSval=3832254054 TSecr=2692727035"
"47","11:42:56.568035","192.168.0.74","192.87.28.82","TCP","66","[TCP Window Update] 59488  >  9001 [ACK] Seq=1051 Ack=8313 Win=6822 Len=0 TSval=3832254055 TSecr=2692727035"
"48","11:42:56.573100","192.87.28.82","192.168.0.74","TCP","1474","9001  >  59488 [ACK] Seq=8313 Ack=1051 Win=2347 Len=1408 TSval=2692727042 TSecr=3832253739 [TCP PDU reassembled in 50]"
"49","11:42:56.573103","192.87.28.82","192.168.0.74","TCP","1474","9001  >  59488 [ACK] Seq=9721 Ack=1051 Win=2347 Len=1408 TSval=2692727042 TSecr=3832253739 [TCP PDU reassembled in 50]"
"50","11:42:56.573105","192.87.28.82","192.168.0.74","TLSv1.2","870","Application Data"
"51","11:42:56.573225","192.168.0.74","192.87.28.82","TCP","66","59488  >  9001 [ACK] Seq=1051 Ack=11933 Win=6766 Len=0 TSval=3832254060 TSecr=2692727042"
"52","11:42:56.573431","192.168.0.74","192.87.28.82","TCP","66","[TCP Window Update] 59488  >  9001 [ACK] Seq=1051 Ack=11933 Win=6822 Len=0 TSval=3832254060 TSecr=2692727042"
"53","11:42:56.606539","192.87.28.82","192.168.0.74","TLSv1.2","1116","Application Data"
"54","11:42:56.606637","192.168.0.74","192.87.28.82","TCP","66","59488  >  9001 [ACK] Seq=1051 Ack=12983 Win=6806 Len=0 TSval=3832254093 TSecr=2692727075"
"55","11:42:56.614637","192.168.0.74","192.87.28.82","TLSv1.2","1116","Application Data"
"56","11:42:56.691762","192.87.28.82","192.168.0.74","TCP","66","9001  >  59488 [ACK] Seq=12983 Ack=2101 Win=2347 Len=0 TSval=2692727160 TSecr=3832254101"
"57","11:42:56.691884","192.168.0.74","192.87.28.82","TLSv1.2","602","Application Data"
"58","11:42:56.708541","192.87.28.82","192.168.0.74","TCP","1474","9001  >  59488 [ACK] Seq=12983 Ack=2101 Win=2347 Len=1408 TSval=2692727177 TSecr=3832254101 [TCP PDU reassembled in 60]"
"59","11:42:56.708543","192.87.28.82","192.168.0.74","TCP","1474","9001  >  59488 [ACK] Seq=14391 Ack=2101 Win=2347 Len=1408 TSval=2692727177 TSecr=3832254101 [TCP PDU reassembled in 60]"
"60","11:42:56.708545","192.87.28.82","192.168.0.74","TLSv1.2","870","Application Data"
"61","11:42:56.708638","192.168.0.74","192.87.28.82","TCP","66","59488  >  9001 [ACK] Seq=2637 Ack=16603 Win=6766 Len=0 TSval=3832254195 TSecr=2692727177"
"62","11:42:56.708746","192.168.0.74","192.87.28.82","TCP","66","[TCP Window Update] 59488  >  9001 [ACK] Seq=2637 Ack=16603 Win=6822 Len=0 TSval=3832254195 TSecr=2692727177"
"63","11:42:56.741978","192.87.28.82","192.168.0.74","TLSv1.2","602","Application Data"
"64","11:42:56.742118","192.168.0.74","192.87.28.82","TLSv1.2","602","Application Data"
"65","11:42:56.748319","192.168.0.74","64.65.63.120","TLSv1.2","1116","Application Data"
"66","11:42:56.782267","192.168.0.192","230.0.0.1","UDP","92","58107  >  6666 Len=50"
"67","11:42:56.788074","64.65.63.120","192.168.0.74","TCP","66","443  >  59487 [ACK] Seq=1 Ack=1051 Win=3587 Len=0 TSval=2680677976 TSecr=3163385280"
"68","11:42:56.788275","192.168.0.74","64.65.63.120","TLSv1.2","602","Application Data"
"69","11:42:56.814107","192.87.28.82","192.168.0.74","TCP","66","9001  >  59488 [ACK] Seq=17139 Ack=3173 Win=2347 Len=0 TSval=2692727284 TSecr=3832254229"
"70","11:42:56.825822","64.65.63.120","192.168.0.74","TCP","66","443  >  59487 [ACK] Seq=1 Ack=1587 Win=3583 Len=0 TSval=2680678014 TSecr=3163385320"
"71","11:42:56.922660","192.87.28.82","192.168.0.74","TCP","1474","9001  >  59488 [ACK] Seq=17139 Ack=3173 Win=2347 Len=1408 TSval=2692727391 TSecr=3832254229 [TCP PDU reassembled in 73]"
"72","11:42:56.922663","192.87.28.82","192.168.0.74","TCP","1474","9001  >  59488 [ACK] Seq=18547 Ack=3173 Win=2347 Len=1408 TSval=2692727391 TSecr=3832254229 [TCP PDU reassembled in 73]"
"73","11:42:56.922665","192.87.28.82","192.168.0.74","TLSv1.2","870","Application Data"
"74","11:42:56.922833","192.168.0.74","192.87.28.82","TCP","66","59488  >  9001 [ACK] Seq=3173 Ack=20759 Win=6766 Len=0 TSval=3832254409 TSecr=2692727391"
"75","11:42:56.923028","192.168.0.74","192.87.28.82","TCP","66","[TCP Window Update] 59488  >  9001 [ACK] Seq=3173 Ack=20759 Win=6822 Len=0 TSval=3832254409 TSecr=2692727391"
"76","11:42:56.927701","192.168.0.74","64.65.63.120","TLSv1.2","602","Application Data"
"77","11:42:56.944789","192.87.28.82","192.168.0.74","TCP","1474","9001  >  59488 [ACK] Seq=20759 Ack=3173 Win=2347 Len=1408 TSval=2692727413 TSecr=3832254229 [TCP PDU reassembled in 79]"
"78","11:42:56.944796","192.87.28.82","192.168.0.74","TCP","1474","9001  >  59488 [ACK] Seq=22167 Ack=3173 Win=2347 Len=1408 TSval=2692727413 TSecr=3832254229 [TCP PDU reassembled in 79]"
"79","11:42:56.944798","192.87.28.82","192.168.0.74","TLSv1.2","870","Application Data"
"80","11:42:56.944943","192.168.0.74","192.87.28.82","TCP","66","59488  >  9001 [ACK] Seq=3173 Ack=24379 Win=6766 Len=0 TSval=3832254431 TSecr=2692727413"
"81","11:42:56.945089","192.168.0.74","192.87.28.82","TCP","66","[TCP Window Update] 59488  >  9001 [ACK] Seq=3173 Ack=24379 Win=6822 Len=0 TSval=3832254432 TSecr=2692727413"
"82","11:42:56.950223","192.87.28.82","192.168.0.74","TCP","1474","9001  >  59488 [ACK] Seq=24379 Ack=3173 Win=2347 Len=1408 TSval=2692727420 TSecr=3832254229 [TCP PDU reassembled in 84]"
"83","11:42:56.950231","192.87.28.82","192.168.0.74","TCP","1474","9001  >  59488 [ACK] Seq=25787 Ack=3173 Win=2347 Len=1408 TSval=2692727420 TSecr=3832254229 [TCP PDU reassembled in 84]"
"84","11:42:56.950233","192.87.28.82","192.168.0.74","TLSv1.2","1320","Application Data"
"85","11:42:56.950410","192.168.0.74","192.87.28.82","TCP","66","59488  >  9001 [ACK] Seq=3173 Ack=28449 Win=6759 Len=0 TSval=3832254437 TSecr=2692727420"
"86","11:42:56.950528","192.168.0.74","192.87.28.82","TCP","66","[TCP Window Update] 59488  >  9001 [ACK] Seq=3173 Ack=28449 Win=6822 Len=0 TSval=3832254437 TSecr=2692727420"
"87","11:42:56.967018","64.65.63.120","192.168.0.74","TCP","66","443  >  59487 [ACK] Seq=1 Ack=2123 Win=3579 Len=0 TSval=2680678156 TSecr=3163385459"
"88","11:42:56.969346","192.87.28.82","192.168.0.74","TLSv1.2","1474","Application Data"
"89","11:42:56.969350","192.87.28.82","192.168.0.74","TCP","1474","9001  >  59488 [ACK] Seq=29857 Ack=3173 Win=2347 Len=1408 TSval=2692727438 TSecr=3832254409 [TCP PDU reassembled in 90]"
"90","11:42:56.969353","192.87.28.82","192.168.0.74","TLSv1.2","1406","Application Data"
"91","11:42:56.969509","192.168.0.74","192.87.28.82","TCP","66","59488  >  9001 [ACK] Seq=3173 Ack=32605 Win=6758 Len=0 TSval=3832254456 TSecr=2692727438"
"92","11:42:56.969722","192.168.0.74","192.87.28.82","TCP","66","[TCP Window Update] 59488  >  9001 [ACK] Seq=3173 Ack=32605 Win=6822 Len=0 TSval=3832254456 TSecr=2692727438"
"93","11:42:56.971063","192.87.28.82","192.168.0.74","TLSv1.2","1474","Application Data"
"94","11:42:56.971065","192.87.28.82","192.168.0.74","TCP","1474","9001  >  59488 [ACK] Seq=34013 Ack=3173 Win=2347 Len=1408 TSval=2692727440 TSecr=3832254409 [TCP PDU reassembled in 95]"
"95","11:42:56.971066","192.87.28.82","192.168.0.74","TLSv1.2","956","Application Data"
"96","11:42:56.971099","192.168.0.74","192.87.28.82","TCP","66","59488  >  9001 [ACK] Seq=3173 Ack=36311 Win=6765 Len=0 TSval=3832254458 TSecr=2692727440"
"97","11:42:56.971169","192.168.0.74","192.87.28.82","TCP","66","[TCP Window Update] 59488  >  9001 [ACK] Seq=3173 Ack=36311 Win=6822 Len=0 TSval=3832254458 TSecr=2692727440"
"98","11:42:56.971281","192.168.0.74","192.87.28.82","TLSv1.2","602","Application Data"
"99","11:42:56.985826","192.168.0.192","230.0.0.1","UDP","92","62979  >  6666 Len=50"
"100","11:42:56.993686","192.87.28.82","192.168.0.74","TLSv1.2","1474","Application Data"
"101","11:42:56.993689","192.87.28.82","192.168.0.74","TCP","1474","9001  >  59488 [ACK] Seq=37719 Ack=3173 Win=2347 Len=1408 TSval=2692727462 TSecr=3832254437 [TCP PDU reassembled in 103]"
"102","11:42:56.993691","192.87.28.82","192.168.0.74","TCP","1474","9001  >  59488 [ACK] Seq=39127 Ack=3173 Win=2347 Len=1408 TSval=2692727462 TSecr=3832254437 [TCP PDU reassembled in 103]"
"103","11:42:56.993693","192.87.28.82","192.168.0.74","TLSv1.2","962","Application Data"
"104","11:42:56.993897","192.168.0.74","192.87.28.82","TCP","66","59488  >  9001 [ACK] Seq=3709 Ack=41431 Win=6742 Len=0 TSval=3832254480 TSecr=2692727462"
"105","11:42:56.994191","192.168.0.74","192.87.28.82","TCP","66","[TCP Window Update] 59488  >  9001 [ACK] Seq=3709 Ack=41431 Win=6822 Len=0 TSval=3832254481 TSecr=2692727462"
"106","11:42:57.007028","192.87.28.82","192.168.0.74","TLSv1.2","1474","Application Data, Application Data"
"107","11:42:57.007031","192.87.28.82","192.168.0.74","TCP","1474","9001  >  59488 [ACK] Seq=42839 Ack=3173 Win=2347 Len=1408 TSval=2692727470 TSecr=3832254437 [TCP PDU reassembled in 109]"
"108","11:42:57.007034","192.87.28.82","192.168.0.74","TCP","1474","9001  >  59488 [ACK] Seq=44247 Ack=3173 Win=2347 Len=1408 TSval=2692727470 TSecr=3832254437 [TCP PDU reassembled in 109]"
"109","11:42:57.007036","192.87.28.82","192.168.0.74","TLSv1.2","598","Application Data"
"110","11:42:57.007245","192.168.0.74","192.87.28.82","TCP","66","59488  >  9001 [ACK] Seq=3709 Ack=46187 Win=6748 Len=0 TSval=3832254494 TSecr=2692727470"
"111","11:42:57.007496","192.168.0.74","192.87.28.82","TCP","66","[TCP Window Update] 59488  >  9001 [ACK] Seq=3709 Ack=46187 Win=6822 Len=0 TSval=3832254494 TSecr=2692727470"
"112","11:42:57.018458","192.87.28.82","192.168.0.74","TCP","1474","9001  >  59488 [ACK] Seq=46187 Ack=3709 Win=2347 Len=1408 TSval=2692727483 TSecr=3832254458 [TCP PDU reassembled in 114]"
"113","11:42:57.018462","192.87.28.82","192.168.0.74","TCP","1474","9001  >  59488 [ACK] Seq=47595 Ack=3709 Win=2347 Len=1408 TSval=2692727483 TSecr=3832254458 [TCP PDU reassembled in 114]"
"114","11:42:57.018464","192.87.28.82","192.168.0.74","TLSv1.2","1320","Application Data"
"115","11:42:57.018466","192.87.28.82","192.168.0.74","TLSv1.2","1474","Application Data"
"116","11:42:57.018468","192.87.28.82","192.168.0.74","TCP","1474","9001  >  59488 [ACK] Seq=51665 Ack=3709 Win=2347 Len=1408 TSval=2692727485 TSecr=3832254458 [TCP PDU reassembled in 117]"
"117","11:42:57.018470","192.87.28.82","192.168.0.74","TLSv1.2","1406","Application Data"
"118","11:42:57.018713","192.168.0.74","192.87.28.82","TCP","66","59488  >  9001 [ACK] Seq=3709 Ack=54413 Win=6694 Len=0 TSval=3832254505 TSecr=2692727485"
"119","11:42:57.019048","192.168.0.74","192.87.28.82","TCP","66","[TCP Window Update] 59488  >  9001 [ACK] Seq=3709 Ack=54413 Win=6822 Len=0 TSval=3832254506 TSecr=2692727485"
"120","11:42:57.019396","192.168.0.74","192.87.28.82","TLSv1.2","602","Application Data"
"121","11:42:57.035484","192.87.28.82","192.168.0.74","TLSv1.2","1474","Application Data"
"122","11:42:57.035488","192.87.28.82","192.168.0.74","TCP","1474","9001  >  59488 [ACK] Seq=55821 Ack=3709 Win=2347 Len=1408 TSval=2692727500 TSecr=3832254481 [TCP PDU reassembled in 123]"
"123","11:42:57.035490","192.87.28.82","192.168.0.74","TLSv1.2","1406","Application Data"
"124","11:42:57.035728","192.168.0.74","192.87.28.82","TCP","66","59488  >  9001 [ACK] Seq=4245 Ack=58569 Win=6758 Len=0 TSval=3832254522 TSecr=2692727500"
"125","11:42:57.036055","192.168.0.74","192.87.28.82","TCP","66","[TCP Window Update] 59488  >  9001 [ACK] Seq=4245 Ack=58569 Win=6822 Len=0 TSval=3832254523 TSecr=2692727500"
"126","11:42:57.037988","192.87.28.82","192.168.0.74","TLSv1.2","1474","Application Data"
"127","11:42:57.037992","192.87.28.82","192.168.0.74","TCP","1474","9001  >  59488 [ACK] Seq=59977 Ack=3709 Win=2347 Len=1408 TSval=2692727506 TSecr=3832254481 [TCP PDU reassembled in 128]"
"128","11:42:57.037994","192.87.28.82","192.168.0.74","TLSv1.2","956","Application Data"
"129","11:42:57.038177","192.168.0.74","192.87.28.82","TCP","66","59488  >  9001 [ACK] Seq=4245 Ack=62275 Win=6765 Len=0 TSval=3832254525 TSecr=2692727506"
"130","11:42:57.038352","192.168.0.74","192.87.28.82","TCP","66","[TCP Window Update] 59488  >  9001 [ACK] Seq=4245 Ack=62275 Win=6822 Len=0 TSval=3832254525 TSecr=2692727506"
"131","11:42:57.053422","192.87.28.82","192.168.0.74","TCP","1474","9001  >  59488 [ACK] Seq=62275 Ack=3709 Win=2347 Len=1408 TSval=2692727519 TSecr=3832254494 [TCP PDU reassembled in 133]"
"132","11:42:57.053429","192.87.28.82","192.168.0.74","TCP","1474","9001  >  59488 [ACK] Seq=63683 Ack=3709 Win=2347 Len=1408 TSval=2692727519 TSecr=3832254494 [TCP PDU reassembled in 133]"
"133","11:42:57.053432","192.87.28.82","192.168.0.74","TLSv1.2","870","Application Data"
"134","11:42:57.053781","192.168.0.74","192.87.28.82","TCP","66","59488  >  9001 [ACK] Seq=4245 Ack=65895 Win=6822 Len=0 TSval=3832254540 TSecr=2692727519"
"135","11:42:57.055443","192.87.28.82","192.168.0.74","TCP","1474","9001  >  59488 [ACK] Seq=65895 Ack=3709 Win=2347 Len=1408 TSval=2692727523 TSecr=3832254506 [TCP PDU reassembled in 137]"
"136","11:42:57.055445","192.87.28.82","192.168.0.74","TCP","1474","9001  >  59488 [ACK] Seq=67303 Ack=3709 Win=2347 Len=1408 TSval=2692727523 TSecr=3832254506 [TCP PDU reassembled in 137]"
"137","11:42:57.055447","192.87.28.82","192.168.0.74","TLSv1.2","1320","Application Data"
"138","11:42:57.055548","192.168.0.74","192.87.28.82","TLSv1.2","602","Application Data"
"139","11:42:57.071020","64.65.63.120","192.168.0.74","TLSv1.2","1116","Application Data"
"140","11:42:57.071140","192.168.0.74","64.65.63.120","TCP","66","59487  >  443 [ACK] Seq=2123 Ack=1051 Win=9182 Len=0 TSval=3163385603 TSecr=2680678259"
"141","11:42:57.086310","64.65.63.120","192.168.0.74","TCP","1474","443  >  59487 [ACK] Seq=1051 Ack=2123 Win=3579 Len=1408 TSval=2680678273 TSecr=3163385459 [TCP PDU reassembled in 143]"
"142","11:42:57.086314","64.65.63.120","192.168.0.74","TCP","1474","443  >  59487 [PSH, ACK] Seq=2459 Ack=2123 Win=3579 Len=1408 TSval=2680678273 TSecr=3163385459 [TCP PDU reassembled in 143]"
"143","11:42:57.086321","64.65.63.120","192.168.0.74","TLSv1.2","1474","Application Data"
"144","11:42:57.086323","64.65.63.120","192.168.0.74","TCP","1474","443  >  59487 [PSH, ACK] Seq=5275 Ack=2123 Win=3579 Len=1408 TSval=2680678273 TSecr=3163385459 [TCP PDU reassembled in 145]"
"145","11:42:57.086325","64.65.63.120","192.168.0.74","TLSv1.2","1474","Application Data"
"146","11:42:57.086588","192.168.0.74","64.65.63.120","TCP","66","59487  >  443 [ACK] Seq=2123 Ack=2459 Win=9176 Len=0 TSval=3163385618 TSecr=2680678273"
"147","11:42:57.086650","192.168.0.74","64.65.63.120","TCP","66","59487  >  443 [ACK] Seq=2123 Ack=8091 Win=9088 Len=0 TSval=3163385618 TSecr=2680678274"
"148","11:42:57.086797","192.168.0.74","64.65.63.120","TCP","66","[TCP Window Update] 59487  >  443 [ACK] Seq=2123 Ack=8091 Win=9198 Len=0 TSval=3163385618 TSecr=2680678274"
"149","11:42:57.089712","64.65.63.120","192.168.0.74","TLSv1.2","1474","Application Data"
"150","11:42:57.089713","64.65.63.120","192.168.0.74","TCP","1474","443  >  59487 [PSH, ACK] Seq=9499 Ack=2123 Win=3579 Len=1408 TSval=2680678279 TSecr=3163385459 [TCP PDU reassembled in 155]"
"151","11:42:57.089715","192.87.28.82","192.168.0.74","TLSv1.2","1202","Application Data, Application Data"
"152","11:42:57.089753","192.168.0.74","192.87.28.82","TLSv1.2","602","Application Data"
"153","11:42:57.089776","192.168.0.74","64.65.63.120","TCP","66","59487  >  443 [ACK] Seq=2123 Ack=10907 Win=9154 Len=0 TSval=3163385621 TSecr=2680678279"
"154","11:42:57.089896","192.168.0.74","64.65.63.120","TCP","66","[TCP Window Update] 59487  >  443 [ACK] Seq=2123 Ack=10907 Win=9198 Len=0 TSval=3163385621 TSecr=2680678279"
"155","11:42:57.107930","64.65.63.120","192.168.0.74","TLSv1.2","1092","Application Data"
"156","11:42:57.108008","192.168.0.74","64.65.63.120","TCP","66","59487  >  443 [ACK] Seq=2123 Ack=11933 Win=9182 Len=0 TSval=3163385639 TSecr=2680678298"
"157","11:42:57.109776","192.168.0.74","64.65.63.120","TLSv1.2","602","Application Data"
"158","11:42:57.115438","64.65.63.120","192.168.0.74","TCP","1474","443  >  59487 [ACK] Seq=11933 Ack=2123 Win=3579 Len=1408 TSval=2680678305 TSecr=3163385603 [TCP PDU reassembled in 162]"
"159","11:42:57.115440","64.65.63.120","192.168.0.74","TCP","1474","443  >  59487 [PSH, ACK] Seq=13341 Ack=2123 Win=3579 Len=1408 TSval=2680678305 TSecr=3163385603 [TCP PDU reassembled in 162]"
"160","11:42:57.115524","192.168.0.74","64.65.63.120","TCP","66","59487  >  443 [ACK] Seq=2659 Ack=14749 Win=9154 Len=0 TSval=3163385647 TSecr=2680678305"
"161","11:42:57.115591","192.168.0.74","64.65.63.120","TCP","66","[TCP Window Update] 59487  >  443 [ACK] Seq=2659 Ack=14749 Win=9198 Len=0 TSval=3163385647 TSecr=2680678305"
"162","11:42:57.119333","64.65.63.120","192.168.0.74","TLSv1.2","1474","Application Data"
"163","11:42:57.119395","192.168.0.74","64.65.63.120","TCP","66","59487  >  443 [ACK] Seq=2659 Ack=16157 Win=9176 Len=0 TSval=3163385651 TSecr=2680678309"
"164","11:42:57.123143","64.65.63.120","192.168.0.74","TCP","1474","443  >  59487 [ACK] Seq=16157 Ack=2123 Win=3579 Len=1408 TSval=2680678312 TSecr=3163385618 [TCP PDU reassembled in 166]"
"165","11:42:57.123145","64.65.63.120","192.168.0.74","TCP","1474","443  >  59487 [PSH, ACK] Seq=17565 Ack=2123 Win=3579 Len=1408 TSval=2680678312 TSecr=3163385618 [TCP PDU reassembled in 166]"
"166","11:42:57.123147","64.65.63.120","192.168.0.74","TLSv1.2","1474","Application Data"
"167","11:42:57.123149","64.65.63.120","192.168.0.74","TCP","1474","443  >  59487 [PSH, ACK] Seq=20381 Ack=2123 Win=3579 Len=1408 TSval=2680678312 TSecr=3163385618 [TCP PDU reassembled in 169]"
"168","11:42:57.123151","64.65.63.120","192.168.0.74","TCP","1474","443  >  59487 [ACK] Seq=21789 Ack=2123 Win=3579 Len=1408 TSval=2680678312 TSecr=3163385618 [TCP PDU reassembled in 169]"
"169","11:42:57.123153","64.65.63.120","192.168.0.74","TLSv1.2","1474","Application Data, Application Data"
"170","11:42:57.123154","64.65.63.120","192.168.0.74","TCP","1474","443  >  59487 [ACK] Seq=24605 Ack=2123 Win=3579 Len=1408 TSval=2680678312 TSecr=3163385618 [TCP PDU reassembled in 174]"
"171","11:42:57.123156","64.65.63.120","192.168.0.74","TCP","1474","443  >  59487 [PSH, ACK] Seq=26013 Ack=2123 Win=3579 Len=1408 TSval=2680678312 TSecr=3163385618 [TCP PDU reassembled in 174]"
"172","11:42:57.123209","192.168.0.74","64.65.63.120","TLSv1.2","602","Application Data"
"173","11:42:57.123319","192.168.0.74","64.65.63.120","TCP","66","[TCP Window Update] 59487  >  443 [ACK] Seq=3195 Ack=27421 Win=9198 Len=0 TSval=3163385655 TSecr=2680678312"
"174","11:42:57.127129","64.65.63.120","192.168.0.74","TLSv1.2","1474","Application Data, Application Data"
"175","11:42:57.127131","64.65.63.120","192.168.0.74","TCP","1474","443  >  59487 [PSH, ACK] Seq=28829 Ack=2123 Win=3579 Len=1408 TSval=2680678317 TSecr=3163385621 [TCP PDU reassembled in 176]"
"176","11:42:57.127132","64.65.63.120","192.168.0.74","TLSv1.2","1474","Application Data"
"177","11:42:57.127217","192.168.0.74","64.65.63.120","TCP","66","59487  >  443 [ACK] Seq=3195 Ack=31645 Win=9132 Len=0 TSval=3163385659 TSecr=2680678317"
"178","11:42:57.127308","192.168.0.74","64.65.63.120","TCP","66","[TCP Window Update] 59487  >  443 [ACK] Seq=3195 Ack=31645 Win=9198 Len=0 TSval=3163385659 TSecr=2680678317"
"179","11:42:57.142690","64.65.63.120","192.168.0.74","TCP","1474","443  >  59487 [ACK] Seq=31645 Ack=2123 Win=3579 Len=1408 TSval=2680678332 TSecr=3163385639 [TCP PDU reassembled in 183]"
"180","11:42:57.142817","192.168.0.74","64.65.63.120","TLSv1.2","602","Application Data"
"181","11:42:57.147001","64.65.63.120","192.168.0.74","TCP","66","443  >  59487 [ACK] Seq=33053 Ack=2659 Win=3575 Len=0 TSval=2680678336 TSecr=3163385641"
"182","11:42:57.150800","64.65.63.120","192.168.0.74","TCP","1474","443  >  59487 [ACK] Seq=33053 Ack=2659 Win=3575 Len=1408 TSval=2680678340 TSecr=3163385647 [TCP PDU reassembled in 183]"
"183","11:42:57.150804","64.65.63.120","192.168.0.74","TLSv1.2","1474","Application Data, Application Data"
"184","11:42:57.150997","192.168.0.74","64.65.63.120","TCP","66","59487  >  443 [ACK] Seq=3731 Ack=35869 Win=9154 Len=0 TSval=3163385682 TSecr=2680678340"
"185","11:42:57.151115","192.168.0.74","64.65.63.120","TCP","66","[TCP Window Update] 59487  >  443 [ACK] Seq=3731 Ack=35869 Win=9198 Len=0 TSval=3163385683 TSecr=2680678340"
"186","11:42:57.155189","64.65.63.120","192.168.0.74","TLSv1.2","1474","Application Data"
"187","11:42:57.155247","192.168.0.74","64.65.63.120","TCP","66","59487  >  443 [ACK] Seq=3731 Ack=37277 Win=9176 Len=0 TSval=3163385687 TSecr=2680678345"
"188","11:42:57.160388","192.87.28.82","192.168.0.74","TCP","1474","9001  >  59488 [ACK] Seq=71101 Ack=5317 Win=2347 Len=1408 TSval=2692727627 TSecr=3832254576 [TCP PDU reassembled in 190]"
"189","11:42:57.160390","192.87.28.82","192.168.0.74","TCP","1474","9001  >  59488 [ACK] Seq=72509 Ack=5317 Win=2347 Len=1408 TSval=2692727627 TSecr=3832254576 [TCP PDU reassembled in 190]"
"190","11:42:57.160391","192.87.28.82","192.168.0.74","TLSv1.2","870","Application Data"
"191","11:42:57.160392","64.65.63.120","192.168.0.74","TCP","1474","443  >  59487 [ACK] Seq=37277 Ack=3195 Win=3571 Len=1408 TSval=2680678349 TSecr=3163385655 [TCP PDU reassembled in 193]"
"192","11:42:57.160394","64.65.63.120","192.168.0.74","TCP","1474","443  >  59487 [PSH, ACK] Seq=38685 Ack=3195 Win=3571 Len=1408 TSval=2680678349 TSecr=3163385655 [TCP PDU reassembled in 193]"
"193","11:42:57.160395","64.65.63.120","192.168.0.74","TLSv1.2","1474","Application Data"
"194","11:42:57.160396","64.65.63.120","192.168.0.74","TCP","1474","443  >  59487 [PSH, ACK] Seq=41501 Ack=3195 Win=3571 Len=1408 TSval=2680678349 TSecr=3163385655 [TCP PDU reassembled in 196]"
"195","11:42:57.160397","64.65.63.120","192.168.0.74","TCP","1474","443  >  59487 [ACK] Seq=42909 Ack=3195 Win=3571 Len=1408 TSval=2680678349 TSecr=3163385659 [TCP PDU reassembled in 196]"
"196","11:42:57.160399","64.65.63.120","192.168.0.74","TLSv1.2","1474","Application Data"
"197","11:42:57.160400","64.65.63.120","192.168.0.74","TCP","1474","443  >  59487 [ACK] Seq=45725 Ack=3195 Win=3571 Len=1408 TSval=2680678350 TSecr=3163385659 [TCP PDU reassembled in 198]"
"198","11:42:57.160401","64.65.63.120","192.168.0.74","TLSv1.2","1474","Application Data"
"199","11:42:57.160403","64.65.63.120","192.168.0.74","TCP","1474","443  >  59487 [ACK] Seq=48541 Ack=3195 Win=3571 Len=1408 TSval=2680678350 TSecr=3163385659 [TCP PDU reassembled in 201]"
"200","11:42:57.160404","64.65.63.120","192.168.0.74","TCP","1474","443  >  59487 [PSH, ACK] Seq=49949 Ack=3195 Win=3571 Len=1408 TSval=2680678350 TSecr=3163385659 [TCP PDU reassembled in 201]"
"201","11:42:57.160405","64.65.63.120","192.168.0.74","TLSv1.2","1474","Application Data"
"202","11:42:57.160406","64.65.63.120","192.168.0.74","TLSv1.2","1474","Application Data"
"203","11:42:57.160408","64.65.63.120","192.168.0.74","TCP","1474","443  >  59487 [ACK] Seq=54173 Ack=3195 Win=3571 Len=1408 TSval=2680678350 TSecr=3163385659 [TCP PDU reassembled in 209]"
"204","11:42:57.160568","192.168.0.74","192.87.28.82","TCP","66","59488  >  9001 [ACK] Seq=5317 Ack=74721 Win=6766 Len=0 TSval=3832254647 TSecr=2692727627"
"205","11:42:57.160611","192.168.0.74","64.65.63.120","TCP","66","59487  >  443 [ACK] Seq=3731 Ack=52765 Win=8956 Len=0 TSval=3163385692 TSecr=2680678350"
"206","11:42:57.160621","192.168.0.74","64.65.63.120","TCP","66","59487  >  443 [ACK] Seq=3731 Ack=55581 Win=8912 Len=0 TSval=3163385692 TSecr=2680678350"
"207","11:42:57.160670","192.168.0.74","192.87.28.82","TCP","66","[TCP Window Update] 59488  >  9001 [ACK] Seq=5317 Ack=74721 Win=6822 Len=0 TSval=3832254647 TSecr=2692727627"
"208","11:42:57.160974","192.168.0.74","64.65.63.120","TLSv1.2","602","Application Data"
"209","11:42:57.180197","64.65.63.120","192.168.0.74","TLSv1.2","1474","Application Data"
"210","11:42:57.180199","192.87.28.82","192.168.0.74","TCP","1474","9001  >  59488 [ACK] Seq=74721 Ack=5317 Win=2347 Len=1408 TSval=2692727648 TSecr=3832254576 [TCP PDU reassembled in 212]"
"211","11:42:57.180200","192.87.28.82","192.168.0.74","TCP","1474","9001  >  59488 [ACK] Seq=76129 Ack=5317 Win=2347 Len=1408 TSval=2692727648 TSecr=3832254576 [TCP PDU reassembled in 212]"
"212","11:42:57.180202","192.87.28.82","192.168.0.74","TLSv1.2","1320","Application Data"
"213","11:42:57.180373","192.168.0.74","64.65.63.120","TCP","66","59487  >  443 [ACK] Seq=4267 Ack=56989 Win=9176 Len=0 TSval=3163385712 TSecr=2680678369"
"214","11:42:57.180412","192.168.0.74","192.87.28.82","TCP","66","59488  >  9001 [ACK] Seq=5317 Ack=78791 Win=6822 Len=0 TSval=3832254667 TSecr=2692727648"
"215","11:42:57.186339","192.87.28.82","192.168.0.74","TLSv1.2","1474","Application Data"
"216","11:42:57.186342","192.87.28.82","192.168.0.74","TCP","1474","9001  >  59488 [ACK] Seq=80199 Ack=5317 Win=2347 Len=1408 TSval=2692727654 TSecr=3832254576 [TCP PDU reassembled in 217]"
"217","11:42:57.186344","192.87.28.82","192.168.0.74","TLSv1.2","1406","Application Data"
"218","11:42:57.186546","192.168.0.74","192.87.28.82","TCP","66","59488  >  9001 [ACK] Seq=5317 Ack=82947 Win=6822 Len=0 TSval=3832254673 TSecr=2692727654"
"219","11:42:57.188108","64.65.63.120","192.168.0.74","TLSv1.2","1474","Application Data"
"220","11:42:57.188110","64.65.63.120","192.168.0.74","TCP","1474","443  >  59487 [PSH, ACK] Seq=58397 Ack=3731 Win=3567 Len=1408 TSval=2680678377 TSecr=3163385682 [TCP PDU reassembled in 229]"
"221","11:42:57.188205","192.168.0.74","64.65.63.120","TCP","66","59487  >  443 [ACK] Seq=4267 Ack=59805 Win=9154 Len=0 TSval=3163385720 TSecr=2680678377"
"222","11:42:57.188307","192.168.0.74","64.65.63.120","TCP","66","[TCP Window Update] 59487  >  443 [ACK] Seq=4267 Ack=59805 Win=9198 Len=0 TSval=3163385720 TSecr=2680678377"
"223","11:42:57.190879","64.65.63.120","192.168.0.74","TCP","1474","443  >  59487 [ACK] Seq=59805 Ack=3731 Win=3567 Len=1408 TSval=2680678381 TSecr=3163385687 [TCP PDU reassembled in 229]"
"224","11:42:57.191775","192.87.28.82","192.168.0.74","TLSv1.2","1474","Application Data"
"225","11:42:57.191778","192.87.28.82","192.168.0.74","TCP","1474","9001  >  59488 [ACK] Seq=84355 Ack=5317 Win=2347 Len=1408 TSval=2692727662 TSecr=3832254576 [TCP PDU reassembled in 226]"
"226","11:42:57.191779","192.87.28.82","192.168.0.74","TLSv1.2","1406","Application Data"
"227","11:42:57.191921","192.168.0.74","192.87.28.82","TCP","66","59488  >  9001 [ACK] Seq=5317 Ack=87103 Win=6822 Len=0 TSval=3832254678 TSecr=2692727662"
"228","11:42:57.192045","192.168.0.74","192.87.28.82","TLSv1.2","602","Application Data"
"229","11:42:57.197031","64.65.63.120","192.168.0.74","TLSv1.2","1474","Application Data"
"230","11:42:57.197033","64.65.63.120","192.168.0.74","TCP","1474","443  >  59487 [PSH, ACK] Seq=62621 Ack=3731 Win=3567 Len=1408 TSval=2680678385 TSecr=3163385692 [TCP PDU reassembled in 232]"
"231","11:42:57.197039","64.65.63.120","192.168.0.74","TCP","1474","443  >  59487 [ACK] Seq=64029 Ack=3731 Win=3567 Len=1408 TSval=2680678385 TSecr=3163385692 [TCP PDU reassembled in 232]"
"232","11:42:57.197040","64.65.63.120","192.168.0.74","TLSv1.2","1474","Application Data"
"233","11:42:57.197042","64.65.63.120","192.168.0.74","TCP","1474","443  >  59487 [ACK] Seq=66845 Ack=3731 Win=3567 Len=1408 TSval=2680678385 TSecr=3163385692 [TCP PDU reassembled in 235]"
"234","11:42:57.197044","64.65.63.120","192.168.0.74","TCP","1474","443  >  59487 [PSH, ACK] Seq=68253 Ack=3731 Win=3567 Len=1408 TSval=2680678385 TSecr=3163385692 [TCP PDU reassembled in 235]"
"235","11:42:57.197046","64.65.63.120","192.168.0.74","TLSv1.2","1474","Application Data"
"236","11:42:57.197048","64.65.63.120","192.168.0.74","TLSv1.2","1474","Application Data"
"237","11:42:57.197050","64.65.63.120","192.168.0.74","TCP","1474","443  >  59487 [ACK] Seq=72477 Ack=3731 Win=3567 Len=1408 TSval=2680678385 TSecr=3163385692 [TCP PDU reassembled in 238]"
"238","11:42:57.197055","64.65.63.120","192.168.0.74","TLSv1.2","792","Application Data"
"239","11:42:57.197249","192.168.0.74","64.65.63.120","TCP","66","59487  >  443 [ACK] Seq=4267 Ack=74611 Win=9198 Len=0 TSval=3163385729 TSecr=2680678381"
"240","11:42:57.202034","192.87.28.82","192.168.0.74","TLSv1.2","1474","Application Data"
"241","11:42:57.202036","192.87.28.82","192.168.0.74","TCP","1474","9001  >  59488 [ACK] Seq=88511 Ack=5317 Win=2347 Len=1408 TSval=2692727671 TSecr=3832254647 [TCP PDU reassembled in 244]"
"242","11:42:57.202180","192.168.0.74","192.87.28.82","TCP","66","59488  >  9001 [ACK] Seq=5853 Ack=89919 Win=6822 Len=0 TSval=3832254689 TSecr=2692727671"
"243","11:42:57.202353","192.87.28.82","192.168.0.74","TCP","1474","9001  >  59488 [ACK] Seq=89919 Ack=5317 Win=2347 Len=1408 TSval=2692727671 TSecr=3832254647 [TCP PDU reassembled in 244]"
"244","11:42:57.202355","192.87.28.82","192.168.0.74","TLSv1.2","512","Application Data"
"245","11:42:57.202437","192.168.0.74","192.87.28.82","TCP","66","59488  >  9001 [ACK] Seq=5853 Ack=91773 Win=6822 Len=0 TSval=3832254689 TSecr=2692727671"
"246","11:42:57.209939","192.87.28.82","192.168.0.74","TLSv1.2","1474","Application Data"
"247","11:42:57.209942","192.87.28.82","192.168.0.74","TCP","1474","9001  >  59488 [ACK] Seq=93181 Ack=5317 Win=2347 Len=1408 TSval=2692727678 TSecr=3832254647 [TCP PDU reassembled in 249]"
"248","11:42:57.209943","192.87.28.82","192.168.0.74","TCP","1474","9001  >  59488 [ACK] Seq=94589 Ack=5317 Win=2347 Len=1408 TSval=2692727678 TSecr=3832254647 [TCP PDU reassembled in 249]"
"249","11:42:57.209945","192.87.28.82","192.168.0.74","TLSv1.2","512","Application Data"
"250","11:42:57.210179","192.168.0.74","192.87.28.82","TCP","66","59488  >  9001 [ACK] Seq=5853 Ack=96443 Win=6822 Len=0 TSval=3832254697 TSecr=2692727678"
"251","11:42:57.241588","64.65.63.120","192.168.0.74","TCP","66","443  >  59487 [ACK] Seq=74611 Ack=4267 Win=3563 Len=0 TSval=2680678432 TSecr=3163385692"
"252","11:42:57.241762","192.168.0.74","64.65.63.120","TLSv1.2","602","Application Data"
"253","11:42:57.243493","192.87.28.82","192.168.0.74","TLSv1.2","666","Application Data"
"254","11:42:57.243494","64.65.63.120","192.168.0.74","TCP","1474","443  >  59487 [ACK] Seq=74611 Ack=4267 Win=3563 Len=1408 TSval=2680678435 TSecr=3163385692 [TCP PDU reassembled in 255]"
"255","11:42:57.243496","64.65.63.120","192.168.0.74","TLSv1.2","1250","Application Data"
"256","11:42:57.243599","192.168.0.74","192.87.28.82","TCP","66","59488  >  9001 [ACK] Seq=5853 Ack=97043 Win=6813 Len=0 TSval=3832254730 TSecr=2692727712"
"257","11:42:57.243830","192.168.0.74","64.65.63.120","TCP","66","59487  >  443 [ACK] Seq=4803 Ack=77203 Win=9198 Len=0 TSval=3163385775 TSecr=2680678435"
"258","11:42:57.276829","64.65.63.120","192.168.0.74","TCP","66","443  >  59487 [ACK] Seq=77203 Ack=4803 Win=3559 Len=0 TSval=2680678467 TSecr=3163385773"
"259","11:42:57.277023","192.168.0.74","64.65.63.120","TLSv1.2","602","Application Data"
"260","11:42:57.311893","64.65.63.120","192.168.0.74","TCP","66","443  >  59487 [ACK] Seq=77203 Ack=5339 Win=3555 Len=0 TSval=2680678502 TSecr=3163385808"
"261","11:42:57.347621","192.87.28.82","192.168.0.74","TCP","1474","9001  >  59488 [ACK] Seq=97043 Ack=5853 Win=2347 Len=1408 TSval=2692727816 TSecr=3832254730 [TCP PDU reassembled in 262]"
"262","11:42:57.347625","192.87.28.82","192.168.0.74","TLSv1.2","736","Application Data"
"263","11:42:57.348091","192.168.0.74","192.87.28.82","TCP","66","59488  >  9001 [ACK] Seq=5853 Ack=99121 Win=6822 Len=0 TSval=3832254834 TSecr=2692727816"
"264","11:42:57.354663","64.65.63.120","192.168.0.74","TLSv1.2","602","Application Data"
"265","11:42:57.355033","192.168.0.74","64.65.63.120","TCP","66","59487  >  443 [ACK] Seq=5339 Ack=77739 Win=9198 Len=0 TSval=3163385886 TSecr=2680678544"
"266","11:42:57.357457","192.168.0.74","64.65.63.120","TCP","1474","59487  >  443 [ACK] Seq=5339 Ack=77739 Win=9198 Len=1408 TSval=3163385889 TSecr=2680678544 [TCP PDU reassembled in 267]"
"267","11:42:57.357503","192.168.0.74","64.65.63.120","TLSv1.2","736","Application Data"
"268","11:42:57.395114","64.65.63.120","192.168.0.74","TCP","66","443  >  59487 [ACK] Seq=77739 Ack=7417 Win=3539 Len=0 TSval=2680678585 TSecr=3163385889"
"269","11:42:57.401427","64.65.63.120","192.168.0.74","TCP","1474","443  >  59487 [ACK] Seq=77739 Ack=7417 Win=3539 Len=1408 TSval=2680678591 TSecr=3163385889 [TCP PDU reassembled in 271]"
"270","11:42:57.401431","64.65.63.120","192.168.0.74","TCP","1474","443  >  59487 [PSH, ACK] Seq=79147 Ack=7417 Win=3539 Len=1408 TSval=2680678591 TSecr=3163385889 [TCP PDU reassembled in 271]"
"271","11:42:57.401434","64.65.63.120","192.168.0.74","TLSv1.2","870","Application Data"
"272","11:42:57.401870","192.168.0.74","64.65.63.120","TCP","66","59487  >  443 [ACK] Seq=7417 Ack=81359 Win=9198 Len=0 TSval=3163385933 TSecr=2680678591"
"273","11:42:57.405044","64.65.63.120","192.168.0.74","TCP","1474","443  >  59487 [ACK] Seq=81359 Ack=7417 Win=3539 Len=1408 TSval=2680678595 TSecr=3163385889 [TCP PDU reassembled in 276]"
"274","11:42:57.405047","64.65.63.120","192.168.0.74","TCP","1474","443  >  59487 [PSH, ACK] Seq=82767 Ack=7417 Win=3539 Len=1408 TSval=2680678595 TSecr=3163385889 [TCP PDU reassembled in 276]"
"275","11:42:57.405195","192.168.0.74","64.65.63.120","TCP","66","59487  >  443 [ACK] Seq=7417 Ack=84175 Win=9198 Len=0 TSval=3163385937 TSecr=2680678595"
"276","11:42:57.408507","64.65.63.120","192.168.0.74","TLSv1.2","1474","Application Data"
"277","11:42:57.408514","64.65.63.120","192.168.0.74","TCP","1474","443  >  59487 [PSH, ACK] Seq=85583 Ack=7417 Win=3539 Len=1408 TSval=2680678598 TSecr=3163385889 [TCP PDU reassembled in 280]"
"278","11:42:57.408516","64.65.63.120","192.168.0.74","TCP","1474","443  >  59487 [ACK] Seq=86991 Ack=7417 Win=3539 Len=1408 TSval=2680678598 TSecr=3163385889 [TCP PDU reassembled in 280]"
"279","11:42:57.408756","192.168.0.74","64.65.63.120","TCP","66","59487  >  443 [ACK] Seq=7417 Ack=88399 Win=9198 Len=0 TSval=3163385940 TSecr=2680678598"
