"No.","Time","Source","Destination","Protocol","Length","Info"
"1","11:41:51.969650","192.168.0.192","230.0.0.1","UDP","92","62979  >  6666 Len=50"
"2","11:41:51.978989","192.168.0.74","64.65.63.120","TLSv1.2","1116","Application Data"
"3","11:41:51.981470","192.168.0.74","64.65.63.120","TCP","1474","59487  >  443 [ACK] Seq=1051 Ack=1 Win=9198 Len=1408 TSval=3163320510 TSecr=2680611308 [TCP PDU reassembled in 5]"
"4","11:41:51.981475","192.168.0.74","64.65.63.120","TCP","1474","59487  >  443 [ACK] Seq=2459 Ack=1 Win=9198 Len=1408 TSval=3163320510 TSecr=2680611308 [TCP PDU reassembled in 5]"
"5","11:41:51.981504","192.168.0.74","64.65.63.120","TLSv1.2","870","Application Data"
"6","11:41:52.025817","64.65.63.120","192.168.0.74","TCP","66","443  >  59487 [ACK] Seq=1 Ack=3867 Win=3736 Len=0 TSval=2680613214 TSecr=3163320508"
"7","11:41:52.070545","64.65.63.120","192.168.0.74","TCP","66","443  >  59487 [ACK] Seq=1 Ack=4671 Win=3758 Len=0 TSval=2680613259 TSecr=3163320510"
"8","11:41:52.109116","149.154.167.41","192.168.0.74","SSL","171","Continuation Data"
"9","11:41:52.109326","192.168.0.74","149.154.167.41","TCP","66","59400  >  443 [ACK] Seq=1 Ack=106 Win=65530 Len=0 TSval=1845305416 TSecr=325018396"
"10","11:41:52.788526","192.168.0.192","230.0.0.1","UDP","92","58107  >  6666 Len=50"
"11","11:41:52.979431","192.168.0.74","64.65.63.120","TLSv1.2","602","Application Data"
"12","11:41:53.020395","64.65.63.120","192.168.0.74","TCP","66","443  >  59487 [ACK] Seq=1 Ack=5207 Win=3780 Len=0 TSval=2680614211 TSecr=3163321508"
"13","11:41:53.020503","192.168.0.74","64.65.63.120","TLSv1.2","1116","Application Data"
"14","11:41:53.055675","64.65.63.120","192.168.0.74","TCP","66","443  >  59487 [ACK] Seq=1 Ack=6257 Win=3802 Len=0 TSval=2680614246 TSecr=3163321549"
"15","11:41:53.439223","192.168.0.74","5.28.195.2","TCP","78","62861  >  443 [SYN, ECE, CWR] Seq=0 Win=65535 Len=0 MSS=1460 WS=16 TSval=454753099 TSecr=0 SACK_PERM"
"16","11:41:53.439278","192.168.0.74","5.28.195.2","TCP","78","62862  >  80 [SYN, ECE, CWR] Seq=0 Win=65535 Len=0 MSS=1460 WS=16 TSval=3151837732 TSecr=0 SACK_PERM"
"17","11:41:53.439686","192.168.0.74","5.28.195.2","TCP","78","62863  >  5222 [SYN, ECE, CWR] Seq=0 Win=65535 Len=0 MSS=1460 WS=16 TSval=2142759740 TSecr=0 SACK_PERM"
"18","11:41:53.481928","5.28.195.2","192.168.0.74","TCP","74","443  >  62861 [SYN, ACK, ECE] Seq=0 Ack=1 Win=65535 Len=0 MSS=1240 SACK_PERM TSval=3606691850 TSecr=454753099 WS=1024"
"19","11:41:53.482097","192.168.0.74","5.28.195.2","TCP","66","62861  >  443 [ACK] Seq=1 Ack=1 Win=1048560 Len=0 TSval=454753142 TSecr=3606691850"
"20","11:41:53.482396","192.168.0.74","5.28.195.2","TLSv1","583","Client Hello"
"21","11:41:53.522830","5.28.195.2","192.168.0.74","TCP","66","443  >  62861 [ACK] Seq=1 Ack=518 Win=67584 Len=0 TSval=3606691902 TSecr=454753142"
"22","11:41:53.522836","5.28.195.2","192.168.0.74","TCP","66","443  >  62861 [FIN, ACK] Seq=1 Ack=518 Win=67584 Len=0 TSval=3606691904 TSecr=454753142"
"23","11:41:53.523085","192.168.0.74","5.28.195.2","TCP","66","62861  >  443 [ACK] Seq=518 Ack=2 Win=1048560 Len=0 TSval=454753183 TSecr=3606691904"
"24","11:41:53.523335","192.168.0.74","5.28.195.2","TCP","66","62861  >  443 [FIN, ACK] Seq=518 Ack=2 Win=1048560 Len=0 TSval=454753183 TSecr=3606691904"
"25","11:41:53.561196","5.28.195.2","192.168.0.74","TCP","56","443  >  62861 [RST] Seq=2 Win=0 Len=0"
"26","11:41:53.811233","192.168.0.192","230.0.0.1","UDP","92","58107  >  6666 Len=50"
"27","11:41:54.013214","192.168.0.192","230.0.0.1","UDP","92","62979  >  6666 Len=50"
"28","11:41:54.013216","192.87.28.82","192.168.0.74","TLSv1.2","1116","Application Data"
"29","11:41:54.013327","192.168.0.74","192.87.28.82","TCP","66","59488  >  9001 [ACK] Seq=1 Ack=1051 Win=6806 Len=0 TSval=3832191497 TSecr=2692664308"
"30","11:41:54.064270","192.168.0.74","64.65.63.120","TLSv1.2","602","Application Data"
"31","11:41:54.064305","192.168.0.74","192.87.28.82","TLSv1.2","602","Application Data"
"32","11:41:54.099489","64.65.63.120","192.168.0.74","TCP","66","443  >  59487 [ACK] Seq=1 Ack=6793 Win=3824 Len=0 TSval=2680615290 TSecr=3163322593"
"33","11:41:54.099656","192.168.0.74","64.65.63.120","TLSv1.2","1116","Application Data"
"34","11:41:54.145015","192.87.28.82","192.168.0.74","TCP","66","9001  >  59488 [ACK] Seq=1051 Ack=537 Win=2347 Len=0 TSval=2692664611 TSecr=3832191548"
"35","11:41:54.145217","192.168.0.74","192.87.28.82","TLSv1.2","1116","Application Data"
"36","11:41:54.149197","64.65.63.120","192.168.0.74","TCP","66","443  >  59487 [ACK] Seq=1 Ack=7843 Win=3846 Len=0 TSval=2680615339 TSecr=3163322629"
"37","11:41:54.226799","192.87.28.82","192.168.0.74","TCP","66","9001  >  59488 [ACK] Seq=1051 Ack=1587 Win=2347 Len=0 TSval=2692664689 TSecr=3832191629"
"38","11:41:54.440245","192.168.0.74","5.28.195.2","TCP","78","[TCP Retransmission] 62863  >  5222 [SYN] Seq=0 Win=65535 Len=0 MSS=1460 WS=16 TSval=2142760740 TSecr=0 SACK_PERM"
"39","11:41:54.440321","192.168.0.74","5.28.195.2","TCP","78","[TCP Retransmission] 62862  >  80 [SYN] Seq=0 Win=65535 Len=0 MSS=1460 WS=16 TSval=3151838733 TSecr=0 SACK_PERM"
"40","11:41:54.734163","192.168.0.192","230.0.0.1","UDP","92","58107  >  6666 Len=50"
"41","11:41:55.041589","192.168.0.192","230.0.0.1","UDP","92","62979  >  6666 Len=50"
"42","11:41:55.070377","192.168.0.74","64.65.63.120","TLSv1.2","602","Application Data"
"43","11:41:55.071820","192.168.0.74","64.65.63.120","TCP","1474","59487  >  443 [ACK] Seq=8379 Ack=1 Win=9198 Len=1408 TSval=3163323601 TSecr=2680615339 [TCP PDU reassembled in 45]"
"44","11:41:55.071825","192.168.0.74","64.65.63.120","TCP","1474","59487  >  443 [ACK] Seq=9787 Ack=1 Win=9198 Len=1408 TSval=3163323601 TSecr=2680615339 [TCP PDU reassembled in 45]"
"45","11:41:55.071858","192.168.0.74","64.65.63.120","TLSv1.2","1320","Application Data"
"46","11:41:55.073873","192.168.0.74","64.65.63.120","TLSv1.2","1474","Application Data"
"47","11:41:55.073880","192.168.0.74","64.65.63.120","TCP","1474","59487  >  443 [ACK] Seq=13857 Ack=1 Win=9198 Len=1408 TSval=3163323603 TSecr=2680615339 [TCP PDU reassembled in 48]"
"48","11:41:55.073910","192.168.0.74","64.65.63.120","TLSv1.2","442","Application Data"
"49","11:41:55.118453","64.65.63.120","192.168.0.74","TCP","66","443  >  59487 [ACK] Seq=1 Ack=8379 Win=3868 Len=0 TSval=2680616308 TSecr=3163323599"
"50","11:41:55.118456","64.65.63.120","192.168.0.74","TCP","66","443  >  59487 [ACK] Seq=1 Ack=11195 Win=3896 Len=0 TSval=2680616308 TSecr=3163323601"
"51","11:41:55.118457","64.65.63.120","192.168.0.74","TCP","66","443  >  59487 [ACK] Seq=1 Ack=12449 Win=3916 Len=0 TSval=2680616310 TSecr=3163323601"
"52","11:41:55.118458","64.65.63.120","192.168.0.74","TCP","66","443  >  59487 [ACK] Seq=1 Ack=15265 Win=3896 Len=0 TSval=2680616310 TSecr=3163323603"
"53","11:41:55.118460","64.65.63.120","192.168.0.74","TCP","66","443  >  59487 [ACK] Seq=1 Ack=15641 Win=3894 Len=0 TSval=2680616310 TSecr=3163323603"
"54","11:41:55.194311","64.65.63.120","192.168.0.74","TLSv1.2","602","Application Data"
"55","11:41:55.194576","192.168.0.74","64.65.63.120","TCP","66","59487  >  443 [ACK] Seq=15641 Ack=537 Win=9190 Len=0 TSval=3163323724 TSecr=2680616381"
"56","11:41:55.441111","192.168.0.74","5.28.195.2","TCP","78","[TCP Retransmission] 62863  >  5222 [SYN] Seq=0 Win=65535 Len=0 MSS=1460 WS=16 TSval=2142761741 TSecr=0 SACK_PERM"
"57","11:41:55.441188","192.168.0.74","5.28.195.2","TCP","78","[TCP Retransmission] 62862  >  80 [SYN] Seq=0 Win=65535 Len=0 MSS=1460 WS=16 TSval=3151839734 TSecr=0 SACK_PERM"
"58","11:41:55.662932","2a02:ab88:b:4100:6163:ab1b:4f48:fc2c","2603:1063:7::c9","TLSv1.2","136","Application Data"
"59","11:41:55.721156","2603:1063:7::c9","2a02:ab88:b:4100:6163:ab1b:4f48:fc2c","TLSv1.2","125","Application Data"
"60","11:41:55.721337","2a02:ab88:b:4100:6163:ab1b:4f48:fc2c","2603:1063:7::c9","TCP","86","58879  >  443 [ACK] Seq=51 Ack=40 Win=2048 Len=0 TSval=135520420 TSecr=1794274153"
"61","11:41:55.750859","192.168.0.192","230.0.0.1","UDP","92","58107  >  6666 Len=50"
"62","11:41:55.963094","192.168.0.192","230.0.0.1","UDP","92","62979  >  6666 Len=50"
"63","11:41:56.088268","192.168.0.74","64.65.63.120","TLSv1.2","602","Application Data"
"64","11:41:56.090587","192.168.0.74","64.65.63.120","TCP","1474","59487  >  443 [ACK] Seq=16177 Ack=537 Win=9198 Len=1408 TSval=3163324620 TSecr=2680616381 [TCP PDU reassembled in 66]"
"65","11:41:56.090595","192.168.0.74","64.65.63.120","TCP","1474","59487  >  443 [ACK] Seq=17585 Ack=537 Win=9198 Len=1408 TSval=3163324620 TSecr=2680616381 [TCP PDU reassembled in 66]"
"66","11:41:56.090637","192.168.0.74","64.65.63.120","TLSv1.2","870","Application Data"
"67","11:41:56.134249","64.65.63.120","192.168.0.74","TCP","66","443  >  59487 [ACK] Seq=537 Ack=16177 Win=3916 Len=0 TSval=2680617324 TSecr=3163324617"
"68","11:41:56.134253","64.65.63.120","192.168.0.74","TCP","66","443  >  59487 [ACK] Seq=537 Ack=18993 Win=3896 Len=0 TSval=2680617324 TSecr=3163324620"
"69","11:41:56.134256","64.65.63.120","192.168.0.74","TCP","66","443  >  59487 [ACK] Seq=537 Ack=19797 Win=3890 Len=0 TSval=2680617324 TSecr=3163324620"
"70","11:41:56.442056","192.168.0.74","5.28.195.2","TCP","78","[TCP Retransmission] 62863  >  5222 [SYN] Seq=0 Win=65535 Len=0 MSS=1460 WS=16 TSval=2142762742 TSecr=0 SACK_PERM"
"71","11:41:56.442126","192.168.0.74","5.28.195.2","TCP","78","[TCP Retransmission] 62862  >  80 [SYN] Seq=0 Win=65535 Len=0 MSS=1460 WS=16 TSval=3151840735 TSecr=0 SACK_PERM"
"72","11:41:56.449236","64.65.63.120","192.168.0.74","TLSv1.2","602","Application Data"
"73","11:41:56.449451","192.168.0.74","64.65.63.120","TCP","66","59487  >  443 [ACK] Seq=19797 Ack=1073 Win=9190 Len=0 TSval=3163324978 TSecr=2680617616"
"74","11:41:56.775938","192.168.0.192","230.0.0.1","UDP","92","58107  >  6666 Len=50"
"75","11:41:56.984847","192.168.0.192","230.0.0.1","UDP","92","62979  >  6666 Len=50"
"76","11:41:57.442546","192.168.0.74","5.28.195.2","TCP","78","[TCP Retransmission] 62863  >  5222 [SYN] Seq=0 Win=65535 Len=0 MSS=1460 WS=16 TSval=2142763743 TSecr=0 SACK_PERM"
"77","11:41:57.442640","192.168.0.74","5.28.195.2","TCP","78","[TCP Retransmission] 62862  >  80 [SYN] Seq=0 Win=65535 Len=0 MSS=1460 WS=16 TSval=3151841736 TSecr=0 SACK_PERM"
"78","11:41:57.806116","192.168.0.192","230.0.0.1","UDP","92","58107  >  6666 Len=50"
"79","11:41:58.010179","192.168.0.192","230.0.0.1","UDP","92","62979  >  6666 Len=50"
"80","11:41:58.109365","149.154.167.41","192.168.0.74","SSL","171","Continuation Data"
"81","11:41:58.109471","192.168.0.74","149.154.167.41","TCP","66","59400  >  443 [ACK] Seq=1 Ack=211 Win=65530 Len=0 TSval=1845311417 TSecr=325024213"
"82","11:41:58.151717","149.154.167.41","192.168.0.74","SSL","171","Continuation Data"
"83","11:41:58.151864","192.168.0.74","149.154.167.41","TCP","66","59400  >  443 [ACK] Seq=1 Ack=316 Win=65530 Len=0 TSval=1845311459 TSecr=325024438"
"84","11:41:58.621613","149.154.167.41","192.168.0.74","SSL","171","Continuation Data"
"85","11:41:58.621858","192.168.0.74","149.154.167.41","TCP","66","59400  >  443 [ACK] Seq=1 Ack=421 Win=65530 Len=0 TSval=1845311929 TSecr=325024727"
"86","11:41:58.632984","192.168.0.74","5.28.195.2","TCP","78","62864  >  443 [SYN, ECE, CWR] Seq=0 Win=65535 Len=0 MSS=1460 WS=16 TSval=1631552043 TSecr=0 SACK_PERM"
"87","11:41:58.672876","5.28.195.2","192.168.0.74","TCP","74","443  >  62864 [SYN, ACK, ECE] Seq=0 Ack=1 Win=65535 Len=0 MSS=1240 SACK_PERM TSval=2332382023 TSecr=1631552043 WS=1024"
"88","11:41:58.673141","192.168.0.74","5.28.195.2","TCP","66","62864  >  443 [ACK] Seq=1 Ack=1 Win=1048560 Len=0 TSval=1631552083 TSecr=2332382023"
"89","11:41:58.673424","192.168.0.74","5.28.195.2","TLSv1","583","Client Hello"
"90","11:41:58.717286","5.28.195.2","192.168.0.74","TCP","66","443  >  62864 [ACK] Seq=1 Ack=518 Win=67584 Len=0 TSval=2332382069 TSecr=1631552084"
"91","11:41:58.717290","5.28.195.2","192.168.0.74","TCP","66","443  >  62864 [FIN, ACK] Seq=1 Ack=518 Win=67584 Len=0 TSval=2332382069 TSecr=1631552084"
"92","11:41:58.717523","192.168.0.74","5.28.195.2","TCP","66","62864  >  443 [ACK] Seq=518 Ack=2 Win=1048560 Len=0 TSval=1631552128 TSecr=2332382069"
"93","11:41:58.717813","192.168.0.74","5.28.195.2","TCP","66","62864  >  443 [FIN, ACK] Seq=518 Ack=2 Win=1048560 Len=0 TSval=1631552128 TSecr=2332382069"
"94","11:41:58.718792","192.168.0.74","5.28.195.2","TCP","78","62865  >  443 [SYN, ECE, CWR] Seq=0 Win=65535 Len=0 MSS=1460 WS=16 TSval=3341641687 TSecr=0 SACK_PERM"
"95","11:41:58.771013","5.28.195.2","192.168.0.74","TCP","74","443  >  62865 [SYN, ACK, ECE] Seq=0 Ack=1 Win=65535 Len=0 MSS=1240 SACK_PERM TSval=3097527320 TSecr=3341641687 WS=1024"
"96","11:41:58.771016","5.28.195.2","192.168.0.74","TCP","56","443  >  62864 [RST] Seq=2 Win=0 Len=0"
"97","11:41:58.771310","192.168.0.74","5.28.195.2","TCP","66","62865  >  443 [ACK] Seq=1 Ack=1 Win=1048560 Len=0 TSval=3341641739 TSecr=3097527320"
"98","11:41:58.771644","192.168.0.74","5.28.195.2","TLSv1","583","Client Hello"
"99","11:41:58.812310","5.28.195.2","192.168.0.74","TCP","66","443  >  62865 [ACK] Seq=1 Ack=518 Win=67584 Len=0 TSval=3097527368 TSecr=3341641740"
"100","11:41:58.812353","5.28.195.2","192.168.0.74","TCP","66","443  >  62865 [FIN, ACK] Seq=1 Ack=518 Win=67584 Len=0 TSval=3097527369 TSecr=3341641740"
"101","11:41:58.812545","192.168.0.74","5.28.195.2","TCP","66","62865  >  443 [ACK] Seq=518 Ack=2 Win=1048560 Len=0 TSval=3341641781 TSecr=3097527369"
"102","11:41:58.812819","192.168.0.74","5.28.195.2","TCP","66","62865  >  443 [FIN, ACK] Seq=518 Ack=2 Win=1048560 Len=0 TSval=3341641781 TSecr=3097527369"
"103","11:41:58.823013","192.168.0.192","230.0.0.1","UDP","92","58107  >  6666 Len=50"
"104","11:41:58.854413","5.28.195.2","192.168.0.74","TCP","56","443  >  62865 [RST] Seq=2 Win=0 Len=0"
"105","11:41:59.034470","192.168.0.192","230.0.0.1","UDP","92","62979  >  6666 Len=50"
"106","11:41:59.441810","192.168.0.74","5.28.195.2","TCP","78","62866  >  80 [SYN, ECE, CWR] Seq=0 Win=65535 Len=0 MSS=1460 WS=16 TSval=888135481 TSecr=0 SACK_PERM"
"107","11:41:59.441818","192.168.0.74","5.28.195.2","TCP","78","62867  >  5222 [SYN, ECE, CWR] Seq=0 Win=65535 Len=0 MSS=1460 WS=16 TSval=2172668314 TSecr=0 SACK_PERM"
"108","11:41:59.442501","192.168.0.74","5.28.195.2","TCP","78","62868  >  443 [SYN, ECE, CWR] Seq=0 Win=65535 Len=0 MSS=1460 WS=16 TSval=1116756993 TSecr=0 SACK_PERM"
"109","11:41:59.460766","CompalBroadb_aa:60:7e","ee:99:94:f5:59:fd","ARP","56","192.168.0.1 is at ac:22:05:aa:60:7e"
"110","11:41:59.492049","5.28.195.2","192.168.0.74","TCP","74","443  >  62868 [SYN, ACK, ECE] Seq=0 Ack=1 Win=65535 Len=0 MSS=1240 SACK_PERM TSval=3346322815 TSecr=1116756993 WS=1024"
"111","11:41:59.492228","192.168.0.74","5.28.195.2","TCP","66","62868  >  443 [ACK] Seq=1 Ack=1 Win=1048560 Len=0 TSval=1116757042 TSecr=3346322815"
"112","11:41:59.492556","192.168.0.74","5.28.195.2","TLSv1","583","Client Hello"
"113","11:41:59.536112","5.28.195.2","192.168.0.74","TCP","66","443  >  62868 [ACK] Seq=1 Ack=518 Win=67584 Len=0 TSval=3346322903 TSecr=1116757043"
"114","11:41:59.536115","5.28.195.2","192.168.0.74","TCP","66","443  >  62868 [FIN, ACK] Seq=1 Ack=518 Win=67584 Len=0 TSval=3346322903 TSecr=1116757043"
"115","11:41:59.536364","192.168.0.74","5.28.195.2","TCP","66","62868  >  443 [ACK] Seq=518 Ack=2 Win=1048560 Len=0 TSval=1116757087 TSecr=3346322903"
"116","11:41:59.536944","192.168.0.74","5.28.195.2","TCP","66","62868  >  443 [FIN, ACK] Seq=518 Ack=2 Win=1048560 Len=0 TSval=1116757087 TSecr=3346322903"
"117","11:41:59.580263","5.28.195.2","192.168.0.74","TCP","56","443  >  62868 [RST] Seq=2 Win=0 Len=0"
"118","11:41:59.746317","192.168.0.192","230.0.0.1","UDP","92","58107  >  6666 Len=50"
"119","11:41:59.955760","192.168.0.192","230.0.0.1","UDP","92","62979  >  6666 Len=50"
"120","11:42:00.095110","192.168.0.74","64.65.63.120","TLSv1.2","602","Application Data"
"121","11:42:00.104248","31.192.108.181","192.168.0.74","TLSv1.2","105","Application Data"
"122","11:42:00.104250","31.192.108.181","192.168.0.74","TLSv1.2","90","Application Data"
"123","11:42:00.104544","192.168.0.74","31.192.108.181","TCP","66","60156  >  443 [ACK] Seq=1 Ack=65 Win=2048 Len=0 TSval=3788018218 TSecr=2535573554"
"124","11:42:00.104694","192.168.0.74","31.192.108.181","TLSv1.2","105","Application Data"
"125","11:42:00.104935","192.168.0.74","31.192.108.181","TLSv1.2","90","Application Data"
"126","11:42:00.105207","192.168.0.74","31.192.108.181","TCP","66","60156  >  443 [FIN, ACK] Seq=64 Ack=65 Win=2048 Len=0 TSval=3788018219 TSecr=2535573554"
"127","11:42:00.110513","31.192.108.181","192.168.0.74","TCP","90","[TCP Spurious Retransmission] 443  >  60156 [FIN, PSH, ACK] Seq=40 Ack=1 Win=51 Len=24 TSval=2535573659 TSecr=3787988114"
"128","11:42:00.110692","192.168.0.74","31.192.108.181","TCP","78","[TCP Retransmission] 60156  >  443 [FIN, ACK] Seq=64 Ack=65 Win=2048 Len=0 TSval=3788018224 TSecr=2535573554 SLE=40 SRE=64"
"129","11:42:00.143071","64.65.63.120","192.168.0.74","TCP","66","443  >  59487 [ACK] Seq=1073 Ack=20333 Win=3916 Len=0 TSval=2680621330 TSecr=3163328624"
"130","11:42:00.143236","192.168.0.74","64.65.63.120","TLSv1.2","1116","Application Data"
"131","11:42:00.158370","31.192.108.181","192.168.0.74","TCP","56","443  >  60156 [RST] Seq=65 Win=0 Len=0"
"132","11:42:00.183065","64.65.63.120","192.168.0.74","TCP","66","443  >  59487 [ACK] Seq=1073 Ack=21383 Win=3916 Len=0 TSval=2680621372 TSecr=3163328672"
"133","11:42:00.442589","192.168.0.74","5.28.195.2","TCP","78","[TCP Retransmission] 62867  >  5222 [SYN] Seq=0 Win=65535 Len=0 MSS=1460 WS=16 TSval=2172669315 TSecr=0 SACK_PERM"
"134","11:42:00.442676","192.168.0.74","5.28.195.2","TCP","78","[TCP Retransmission] 62866  >  80 [SYN] Seq=0 Win=65535 Len=0 MSS=1460 WS=16 TSval=888136482 TSecr=0 SACK_PERM"
"135","11:42:00.541920","192.87.28.82","192.168.0.74","TLSv1.2","602","Application Data"
"136","11:42:00.542143","192.168.0.74","192.87.28.82","TCP","66","59488  >  9001 [ACK] Seq=1587 Ack=1587 Win=6814 Len=0 TSval=3832198026 TSecr=2692671009"
"137","11:42:00.771866","192.168.0.192","230.0.0.1","UDP","92","58107  >  6666 Len=50"
"138","11:42:00.993007","192.168.0.192","230.0.0.1","UDP","92","62979  >  6666 Len=50"
"139","11:42:01.079045","192.87.28.82","192.168.0.74","TLSv1.2","602","Application Data"
"140","11:42:01.079239","192.168.0.74","192.87.28.82","TCP","66","59488  >  9001 [ACK] Seq=1587 Ack=2123 Win=6814 Len=0 TSval=3832198563 TSecr=2692671342"
"141","11:42:01.444191","192.168.0.74","5.28.195.2","TCP","78","[TCP Retransmission] 62867  >  5222 [SYN] Seq=0 Win=65535 Len=0 MSS=1460 WS=16 TSval=2172670316 TSecr=0 SACK_PERM"
"142","11:42:01.444283","192.168.0.74","5.28.195.2","TCP","78","[TCP Retransmission] 62866  >  80 [SYN] Seq=0 Win=65535 Len=0 MSS=1460 WS=16 TSval=888137483 TSecr=0 SACK_PERM"
"143","11:42:01.795078","192.168.0.192","230.0.0.1","UDP","92","58107  >  6666 Len=50"
"144","11:42:02.003676","192.168.0.192","230.0.0.1","UDP","92","62979  >  6666 Len=50"
"145","11:42:02.101060","192.168.0.74","192.87.28.82","TLSv1.2","602","Application Data"
"146","11:42:02.187125","192.87.28.82","192.168.0.74","TCP","66","9001  >  59488 [ACK] Seq=2123 Ack=2123 Win=2347 Len=0 TSval=2692672654 TSecr=3832199585"
"147","11:42:02.187258","192.168.0.74","192.87.28.82","TLSv1.2","1116","Application Data"
"148","11:42:02.265454","192.87.28.82","192.168.0.74","TCP","66","9001  >  59488 [ACK] Seq=2123 Ack=3173 Win=2347 Len=0 TSval=2692672733 TSecr=3832199672"
"149","11:42:02.427768","64.65.63.120","192.168.0.74","TLSv1.2","602","Application Data"
"150","11:42:02.427893","192.168.0.74","64.65.63.120","TCP","66","59487  >  443 [ACK] Seq=21383 Ack=1609 Win=9190 Len=0 TSval=3163330957 TSecr=2680623616"
"151","11:42:02.444705","192.168.0.74","5.28.195.2","TCP","78","[TCP Retransmission] 62867  >  5222 [SYN] Seq=0 Win=65535 Len=0 MSS=1460 WS=16 TSval=2172671317 TSecr=0 SACK_PERM"
"152","11:42:02.444740","192.168.0.74","5.28.195.2","TCP","78","[TCP Retransmission] 62866  >  80 [SYN] Seq=0 Win=65535 Len=0 MSS=1460 WS=16 TSval=888138484 TSecr=0 SACK_PERM"
"153","11:42:02.820015","192.168.0.192","230.0.0.1","UDP","92","58107  >  6666 Len=50"
"154","11:42:02.911340","192.168.0.74","64.65.63.120","TLSv1.2","1116","Application Data"
"155","11:42:02.954669","64.65.63.120","192.168.0.74","TCP","66","443  >  59487 [ACK] Seq=1609 Ack=22433 Win=3916 Len=0 TSval=2680624143 TSecr=3163331441"
"156","11:42:03.021492","192.168.0.192","230.0.0.1","UDP","92","62979  >  6666 Len=50"
"157","11:42:03.333344","192.87.28.82","192.168.0.74","TLSv1.2","602","Application Data"
"158","11:42:03.333346","64.65.63.120","192.168.0.74","TLSv1.2","602","Application Data"
"159","11:42:03.333348","64.65.63.120","192.168.0.74","TCP","1474","443  >  59487 [ACK] Seq=2145 Ack=22433 Win=3916 Len=1408 TSval=2680624402 TSecr=3163331441 [TCP PDU reassembled in 161]"
"160","11:42:03.333349","64.65.63.120","192.168.0.74","TCP","1474","443  >  59487 [PSH, ACK] Seq=3553 Ack=22433 Win=3916 Len=1408 TSval=2680624402 TSecr=3163331441 [TCP PDU reassembled in 161]"
"161","11:42:03.333350","64.65.63.120","192.168.0.74","TLSv1.2","1474","Application Data"
"162","11:42:03.333351","64.65.63.120","192.168.0.74","TCP","1474","443  >  59487 [PSH, ACK] Seq=6369 Ack=22433 Win=3916 Len=1408 TSval=2680624418 TSecr=3163331441 [TCP PDU reassembled in 164]"
"163","11:42:03.333352","64.65.63.120","192.168.0.74","TCP","1474","443  >  59487 [ACK] Seq=7777 Ack=22433 Win=3916 Len=1408 TSval=2680624418 TSecr=3163331441 [TCP PDU reassembled in 164]"
"164","11:42:03.333353","64.65.63.120","192.168.0.74","TLSv1.2","1474","Application Data"
"165","11:42:03.333487","192.168.0.74","192.87.28.82","TCP","66","59488  >  9001 [ACK] Seq=3173 Ack=2659 Win=6814 Len=0 TSval=3832200818 TSecr=2692673639"
"166","11:42:03.333536","192.168.0.74","64.65.63.120","TCP","66","59487  >  443 [ACK] Seq=22433 Ack=2145 Win=9190 Len=0 TSval=3163331863 TSecr=2680624372"
"167","11:42:03.333549","192.168.0.74","64.65.63.120","TCP","66","59487  >  443 [ACK] Seq=22433 Ack=10593 Win=9058 Len=0 TSval=3163331863 TSecr=2680624462"
"168","11:42:03.334022","192.168.0.74","64.65.63.120","TCP","66","[TCP Window Update] 59487  >  443 [ACK] Seq=22433 Ack=10593 Win=9198 Len=0 TSval=3163331863 TSecr=2680624462"
"169","11:42:03.334256","192.168.0.74","64.65.63.120","TLSv1.2","602","Application Data"
"170","11:42:03.376294","64.65.63.120","192.168.0.74","TCP","1474","443  >  59487 [ACK] Seq=10593 Ack=22433 Win=3916 Len=1408 TSval=2680624565 TSecr=3163331863 [TCP PDU reassembled in 172]"
"171","11:42:03.376296","64.65.63.120","192.168.0.74","TCP","1474","443  >  59487 [ACK] Seq=12001 Ack=22433 Win=3916 Len=1408 TSval=2680624565 TSecr=3163331863 [TCP PDU reassembled in 172]"
"172","11:42:03.376298","64.65.63.120","192.168.0.74","TLSv1.2","1474","Application Data"
"173","11:42:03.376299","64.65.63.120","192.168.0.74","TLSv1.2","1474","Application Data"
"174","11:42:03.376301","64.65.63.120","192.168.0.74","TCP","1474","443  >  59487 [PSH, ACK] Seq=16225 Ack=22433 Win=3916 Len=1408 TSval=2680624565 TSecr=3163331863 [TCP PDU reassembled in 175]"
"175","11:42:03.376302","64.65.63.120","192.168.0.74","TLSv1.2","108","Application Data"
"176","11:42:03.376400","192.168.0.74","64.65.63.120","TLSv1.2","602","Application Data"
"177","11:42:03.376445","192.168.0.74","64.65.63.120","TCP","66","59487  >  443 [ACK] Seq=23505 Ack=17675 Win=9088 Len=0 TSval=3163331906 TSecr=2680624565"
"178","11:42:03.376648","192.168.0.74","64.65.63.120","TCP","66","[TCP Window Update] 59487  >  443 [ACK] Seq=23505 Ack=17675 Win=9198 Len=0 TSval=3163331906 TSecr=2680624565"
"179","11:42:03.378099","64.65.63.120","192.168.0.74","TCP","66","443  >  59487 [ACK] Seq=17633 Ack=22969 Win=3916 Len=0 TSval=2680624565 TSecr=3163331864"
"180","11:42:03.378183","192.168.0.74","64.65.63.120","TCP","66","[TCP Dup ACK 177#1] 59487  >  443 [ACK] Seq=23505 Ack=17675 Win=9198 Len=0 TSval=3163331908 TSecr=2680624565"
"181","11:42:03.445299","192.168.0.74","5.28.195.2","TCP","78","[TCP Retransmission] 62867  >  5222 [SYN] Seq=0 Win=65535 Len=0 MSS=1460 WS=16 TSval=2172672318 TSecr=0 SACK_PERM"
"182","11:42:03.445339","192.168.0.74","5.28.195.2","TCP","78","[TCP Retransmission] 62866  >  80 [SYN] Seq=0 Win=65535 Len=0 MSS=1460 WS=16 TSval=888139485 TSecr=0 SACK_PERM"
"183","11:42:03.470341","64.65.63.120","192.168.0.74","TCP","66","443  >  59487 [ACK] Seq=17675 Ack=23505 Win=3916 Len=0 TSval=2680624661 TSecr=3163331906"
"184","11:42:03.668282","192.168.0.74","64.65.63.120","TLSv1.2","602","Application Data"
"185","11:42:03.688222","192.168.0.74","64.65.63.120","TLSv1.2","1474","Application Data"
"186","11:42:03.688253","192.168.0.74","64.65.63.120","TLSv1.2","244","Application Data"
"187","11:42:03.711107","64.65.63.120","192.168.0.74","TCP","66","443  >  59487 [ACK] Seq=17675 Ack=24041 Win=3916 Len=0 TSval=2680624901 TSecr=3163332198"
"188","11:42:03.723014","64.65.63.120","192.168.0.74","TCP","66","443  >  59487 [ACK] Seq=17675 Ack=25627 Win=3904 Len=0 TSval=2680624913 TSecr=3163332218"
"189","11:42:03.723116","192.168.0.74","64.65.63.120","TLSv1.2","1116","Application Data"
"190","11:42:03.738264","192.168.0.192","230.0.0.1","UDP","92","58107  >  6666 Len=50"
"191","11:42:03.753125","64.65.63.120","192.168.0.74","TLSv1.2","602","Application Data"
"192","11:42:03.753209","192.168.0.74","64.65.63.120","TLSv1.2","1116","Application Data"
"193","11:42:03.754046","192.168.0.74","64.65.63.120","TCP","1474","59487  >  443 [ACK] Seq=27727 Ack=18211 Win=9198 Len=1408 TSval=3163332283 TSecr=2680624943 [TCP PDU reassembled in 194]"
"194","11:42:03.754067","192.168.0.74","64.65.63.120","TLSv1.2","736","Application Data"
"195","11:42:03.789230","64.65.63.120","192.168.0.74","TCP","66","443  >  59487 [ACK] Seq=18211 Ack=29805 Win=3872 Len=0 TSval=2680624979 TSecr=3163332253"
"196","11:42:03.843740","192.87.28.82","192.168.0.74","TLSv1.2","602","Application Data"
"197","11:42:03.843859","192.168.0.74","192.87.28.82","TCP","66","59488  >  9001 [ACK] Seq=3173 Ack=3195 Win=6814 Len=0 TSval=3832201328 TSecr=2692674308"
"198","11:42:03.869685","149.154.167.41","192.168.0.74","SSL","171","Continuation Data"
"199","11:42:03.869804","192.168.0.74","149.154.167.41","TCP","66","59400  >  443 [ACK] Seq=1 Ack=526 Win=65530 Len=0 TSval=1845317177 TSecr=325030157"
"200","11:42:03.882203","64.65.63.120","192.168.0.74","TCP","1474","443  >  59487 [ACK] Seq=18211 Ack=29805 Win=3872 Len=1408 TSval=2680625070 TSecr=3163332253 [TCP PDU reassembled in 202]"
"201","11:42:03.882205","64.65.63.120","192.168.0.74","TCP","1474","443  >  59487 [PSH, ACK] Seq=19619 Ack=29805 Win=3872 Len=1408 TSval=2680625070 TSecr=3163332253 [TCP PDU reassembled in 202]"
"202","11:42:03.882206","64.65.63.120","192.168.0.74","TLSv1.2","1320","Application Data"
"203","11:42:03.882207","64.65.63.120","192.168.0.74","TCP","1474","443  >  59487 [ACK] Seq=22281 Ack=29805 Win=3872 Len=1408 TSval=2680625070 TSecr=3163332253 [TCP PDU reassembled in 207]"
"204","11:42:03.882208","64.65.63.120","192.168.0.74","TCP","1474","443  >  59487 [PSH, ACK] Seq=23689 Ack=29805 Win=3872 Len=1408 TSval=2680625070 TSecr=3163332253 [TCP PDU reassembled in 207]"
"205","11:42:03.882326","192.168.0.74","64.65.63.120","TCP","66","59487  >  443 [ACK] Seq=29805 Ack=25097 Win=9091 Len=0 TSval=3163332412 TSecr=2680625070"
"206","11:42:03.882466","192.168.0.74","64.65.63.120","TCP","66","[TCP Window Update] 59487  >  443 [ACK] Seq=29805 Ack=25097 Win=9198 Len=0 TSval=3163332412 TSecr=2680625070"
"207","11:42:03.889050","64.65.63.120","192.168.0.74","TLSv1.2","1474","Application Data"
"208","11:42:03.889052","64.65.63.120","192.168.0.74","TCP","1474","443  >  59487 [PSH, ACK] Seq=26505 Ack=29805 Win=3872 Len=1408 TSval=2680625079 TSecr=3163332253 [TCP PDU reassembled in 212]"
"209","11:42:03.889054","64.65.63.120","192.168.0.74","TCP","1474","443  >  59487 [ACK] Seq=27913 Ack=29805 Win=3872 Len=1408 TSval=2680625079 TSecr=3163332253 [TCP PDU reassembled in 212]"
"210","11:42:03.889155","192.168.0.74","64.65.63.120","TCP","66","59487  >  443 [ACK] Seq=29805 Ack=29321 Win=9132 Len=0 TSval=3163332419 TSecr=2680625079"
"211","11:42:03.889310","192.168.0.74","64.65.63.120","TCP","66","[TCP Window Update] 59487  >  443 [ACK] Seq=29805 Ack=29321 Win=9198 Len=0 TSval=3163332419 TSecr=2680625079"
"212","11:42:03.919242","64.65.63.120","192.168.0.74","TLSv1.2","1474","Application Data"
"213","11:42:03.919246","64.65.63.120","192.168.0.74","TCP","1474","443  >  59487 [PSH, ACK] Seq=30729 Ack=29805 Win=3872 Len=1408 TSval=2680625107 TSecr=3163332412 [TCP PDU reassembled in 215]"
"214","11:42:03.919247","64.65.63.120","192.168.0.74","TCP","1474","443  >  59487 [ACK] Seq=32137 Ack=29805 Win=3872 Len=1408 TSval=2680625107 TSecr=3163332412 [TCP PDU reassembled in 215]"
"215","11:42:03.919249","64.65.63.120","192.168.0.74","TLSv1.2","1474","Application Data"
"216","11:42:03.919250","64.65.63.120","192.168.0.74","TCP","1474","443  >  59487 [ACK] Seq=34953 Ack=29805 Win=3872 Len=1408 TSval=2680625107 TSecr=3163332412 [TCP PDU reassembled in 222]"
"217","11:42:03.919353","192.168.0.74","64.65.63.120","TCP","66","59487  >  443 [ACK] Seq=29805 Ack=36361 Win=9088 Len=0 TSval=3163332449 TSecr=2680625107"
"218","11:42:03.919498","192.168.0.74","64.65.63.120","TCP","66","[TCP Window Update] 59487  >  443 [ACK] Seq=29805 Ack=36361 Win=9198 Len=0 TSval=3163332449 TSecr=2680625107"
"219","11:42:03.919628","192.168.0.74","64.65.63.120","TLSv1.2","602","Application Data"
"220","11:42:03.924347","64.65.63.120","192.168.0.74","TCP","1474","443  >  59487 [ACK] Seq=36361 Ack=29805 Win=3872 Len=1408 TSval=2680625115 TSecr=3163332419 [TCP PDU reassembled in 222]"
"221","11:42:03.924441","192.168.0.74","64.65.63.120","TCP","66","59487  >  443 [ACK] Seq=30341 Ack=37769 Win=9176 Len=0 TSval=3163332454 TSecr=2680625115"
"222","11:42:03.926740","64.65.63.120","192.168.0.74","TLSv1.2","1474","Application Data"
"223","11:42:03.926742","64.65.63.120","192.168.0.74","TLSv1.2","1474","Application Data, Application Data"
"224","11:42:03.926812","192.168.0.74","64.65.63.120","TCP","66","59487  >  443 [ACK] Seq=30341 Ack=40585 Win=9154 Len=0 TSval=3163332456 TSecr=2680625115"
"225","11:42:03.926937","192.168.0.74","64.65.63.120","TCP","66","[TCP Window Update] 59487  >  443 [ACK] Seq=30341 Ack=40585 Win=9198 Len=0 TSval=3163332456 TSecr=2680625115"
"226","11:42:03.955278","64.65.63.120","192.168.0.74","TCP","1474","443  >  59487 [ACK] Seq=40585 Ack=29805 Win=3872 Len=1408 TSval=2680625144 TSecr=3163332449 [TCP PDU reassembled in 228]"
"227","11:42:03.955280","64.65.63.120","192.168.0.74","TCP","1474","443  >  59487 [PSH, ACK] Seq=41993 Ack=29805 Win=3872 Len=1408 TSval=2680625144 TSecr=3163332449 [TCP PDU reassembled in 228]"
"228","11:42:03.955282","64.65.63.120","192.168.0.74","TLSv1.2","1474","Application Data"
"229","11:42:03.955283","64.65.63.120","192.168.0.74","TCP","1474","443  >  59487 [PSH, ACK] Seq=44809 Ack=29805 Win=3872 Len=1408 TSval=2680625144 TSecr=3163332449 [TCP PDU reassembled in 232]"
"230","11:42:03.955385","192.168.0.74","64.65.63.120","TCP","66","59487  >  443 [ACK] Seq=30341 Ack=46217 Win=9110 Len=0 TSval=3163332485 TSecr=2680625144"
"231","11:42:03.955521","192.168.0.74","64.65.63.120","TCP","66","[TCP Window Update] 59487  >  443 [ACK] Seq=30341 Ack=46217 Win=9198 Len=0 TSval=3163332485 TSecr=2680625144"
"232","11:42:03.957229","64.65.63.120","192.168.0.74","TLSv1.2","1474","Application Data"
"233","11:42:03.957254","192.168.0.74","64.65.63.120","TCP","66","59487  >  443 [ACK] Seq=30341 Ack=47625 Win=9176 Len=0 TSval=3163332487 TSecr=2680625148"
"234","11:42:03.957398","192.168.0.74","64.65.63.120","TLSv1.2","602","Application Data"
"235","11:42:03.961702","64.65.63.120","192.168.0.74","TCP","1474","443  >  59487 [ACK] Seq=47625 Ack=30341 Win=3868 Len=1408 TSval=2680625152 TSecr=3163332454 [TCP PDU reassembled in 238]"
"236","11:42:03.961759","192.168.0.74","64.65.63.120","TCP","66","59487  >  443 [ACK] Seq=30877 Ack=49033 Win=9176 Len=0 TSval=3163332491 TSecr=2680625152"
"237","11:42:03.965840","64.65.63.120","192.168.0.74","TCP","1474","443  >  59487 [ACK] Seq=49033 Ack=30341 Win=3868 Len=1408 TSval=2680625156 TSecr=3163332456 [TCP PDU reassembled in 238]"
"238","11:42:03.965843","64.65.63.120","192.168.0.74","TLSv1.2","1474","Application Data, Application Data"
"239","11:42:03.965939","192.168.0.74","64.65.63.120","TCP","66","59487  >  443 [ACK] Seq=30877 Ack=51849 Win=9154 Len=0 TSval=3163332495 TSecr=2680625156"
"240","11:42:03.966076","192.168.0.74","64.65.63.120","TCP","66","[TCP Window Update] 59487  >  443 [ACK] Seq=30877 Ack=51849 Win=9198 Len=0 TSval=3163332496 TSecr=2680625156"
"241","11:42:03.990888","64.65.63.120","192.168.0.74","TCP","1474","443  >  59487 [ACK] Seq=51849 Ack=30341 Win=3868 Len=1408 TSval=2680625179 TSecr=3163332485 [TCP PDU reassembled in 243]"
"242","11:42:03.990891","64.65.63.120","192.168.0.74","TCP","1474","443  >  59487 [PSH, ACK] Seq=53257 Ack=30341 Win=3868 Len=1408 TSval=2680625179 TSecr=3163332485 [TCP PDU reassembled in 243]"
"243","11:42:03.990892","64.65.63.120","192.168.0.74","TLSv1.2","1474","Application Data"
"244","11:42:03.990894","64.65.63.120","192.168.0.74","TCP","1474","443  >  59487 [PSH, ACK] Seq=56073 Ack=30341 Win=3868 Len=1408 TSval=2680625179 TSecr=3163332485 [TCP PDU reassembled in 247]"
"245","11:42:03.990994","192.168.0.74","64.65.63.120","TCP","66","59487  >  443 [ACK] Seq=30877 Ack=57481 Win=9110 Len=0 TSval=3163332520 TSecr=2680625179"
"246","11:42:03.991140","192.168.0.74","64.65.63.120","TCP","66","[TCP Window Update] 59487  >  443 [ACK] Seq=30877 Ack=57481 Win=9198 Len=0 TSval=3163332521 TSecr=2680625179"
"247","11:42:03.992763","64.65.63.120","192.168.0.74","TLSv1.2","1474","Application Data, Application Data"
"248","11:42:03.993321","64.65.63.120","192.168.0.74","TLSv1.2","1474","Application Data"
"249","11:42:03.993440","192.168.0.74","64.65.63.120","TCP","66","59487  >  443 [ACK] Seq=30877 Ack=60297 Win=9198 Len=0 TSval=3163332523 TSecr=2680625182"
"250","11:42:03.997752","64.65.63.120","192.168.0.74","TCP","1474","443  >  59487 [ACK] Seq=60297 Ack=30877 Win=3864 Len=1408 TSval=2680625188 TSecr=3163332487 [TCP PDU reassembled in 252]"
"251","11:42:03.997863","192.168.0.74","64.65.63.120","TCP","66","59487  >  443 [ACK] Seq=30877 Ack=61705 Win=9176 Len=0 TSval=3163332527 TSecr=2680625188"
"252","11:42:04.001699","64.65.63.120","192.168.0.74","TLSv1.2","1474","Application Data"
"253","11:42:04.001701","64.65.63.120","192.168.0.74","TCP","1474","443  >  59487 [PSH, ACK] Seq=63113 Ack=30877 Win=3864 Len=1408 TSval=2680625192 TSecr=3163332495 [TCP PDU reassembled in 257]"
"254","11:42:04.001875","192.168.0.74","64.65.63.120","TCP","66","59487  >  443 [ACK] Seq=30877 Ack=64521 Win=9198 Len=0 TSval=3163332531 TSecr=2680625192"
"255","11:42:04.002001","192.168.0.74","64.65.63.120","TLSv1.2","602","Application Data"
"256","11:42:04.027101","64.65.63.120","192.168.0.74","TCP","1474","443  >  59487 [ACK] Seq=64521 Ack=30877 Win=3864 Len=1408 TSval=2680625216 TSecr=3163332521 [TCP PDU reassembled in 257]"
"257","11:42:04.027104","64.65.63.120","192.168.0.74","TLSv1.2","1474","Application Data"
"258","11:42:04.027106","64.65.63.120","192.168.0.74","TCP","1474","443  >  59487 [ACK] Seq=67337 Ack=30877 Win=3864 Len=1408 TSval=2680625216 TSecr=3163332521 [TCP PDU reassembled in 261]"
"259","11:42:04.027108","64.65.63.120","192.168.0.74","TCP","1474","443  >  59487 [PSH, ACK] Seq=68745 Ack=30877 Win=3864 Len=1408 TSval=2680625216 TSecr=3163332521 [TCP PDU reassembled in 261]"
"260","11:42:04.027305","192.168.0.74","64.65.63.120","TCP","66","59487  >  443 [ACK] Seq=31413 Ack=70153 Win=9198 Len=0 TSval=3163332557 TSecr=2680625216"
"261","11:42:04.029950","64.65.63.120","192.168.0.74","TLSv1.2","1474","Application Data, Application Data"
"262","11:42:04.029951","64.65.63.120","192.168.0.74","TLSv1.2","1474","Application Data"
"263","11:42:04.030098","192.168.0.74","64.65.63.120","TCP","66","59487  >  443 [ACK] Seq=31413 Ack=72969 Win=9198 Len=0 TSval=3163332560 TSecr=2680625220"
"264","11:42:04.033681","64.65.63.120","192.168.0.74","TLSv1.2","1474","Application Data"
"265","11:42:04.038267","64.65.63.120","192.168.0.74","TCP","1474","443  >  59487 [ACK] Seq=74377 Ack=30877 Win=3864 Len=1408 TSval=2680625228 TSecr=3163332531 [TCP PDU reassembled in 266]"
"266","11:42:04.038271","64.65.63.120","192.168.0.74","TLSv1.2","544","Application Data"
"267","11:42:04.038433","192.168.0.74","64.65.63.120","TCP","66","59487  >  443 [ACK] Seq=31413 Ack=76263 Win=9198 Len=0 TSval=3163332568 TSecr=2680625224"
"268","11:42:04.045453","192.168.0.192","230.0.0.1","UDP","92","62979  >  6666 Len=50"
"269","11:42:04.061559","64.65.63.120","192.168.0.74","TLSv1.2","1474","Application Data"
"270","11:42:04.061561","64.65.63.120","192.168.0.74","TCP","1474","443  >  59487 [PSH, ACK] Seq=77671 Ack=31413 Win=3860 Len=1408 TSval=2680625251 TSecr=3163332531 [TCP PDU reassembled in 276]"
"271","11:42:04.061667","192.168.0.74","64.65.63.120","TLSv1.2","602","Application Data"
"272","11:42:04.061796","192.168.0.74","64.65.63.120","TCP","66","[TCP Window Update] 59487  >  443 [ACK] Seq=31949 Ack=79079 Win=9198 Len=0 TSval=3163332591 TSecr=2680625251"
"273","11:42:04.063506","192.168.0.74","192.87.28.82","TLSv1.2","602","Application Data"
"274","11:42:04.064265","2a00:ab00:533:6::100","2a02:ab88:b:4100:6163:ab1b:4f48:fc2c","TCP","86","443  >  57688 [ACK] Seq=1 Ack=1 Win=505 Len=0 TSval=3076058413 TSecr=3388418348"
"275","11:42:04.064392","2a02:ab88:b:4100:6163:ab1b:4f48:fc2c","2a00:ab00:533:6::100","TCP","86","[TCP ACKed unseen segment] 57688  >  443 [ACK] Seq=1 Ack=2 Win=2048 Len=0 TSval=3388433445 TSecr=3076043370"
"276","11:42:04.076511","64.65.63.120","192.168.0.74","TLSv1.2","1406","Application Data"
"277","11:42:04.076678","192.168.0.74","64.65.63.120","TCP","66","59487  >  443 [ACK] Seq=31949 Ack=80419 Win=9198 Len=0 TSval=3163332606 TSecr=2680625266"
"278","11:42:04.080149","192.168.0.74","64.65.63.120","TLSv1.2","1474","Application Data"
"279","11:42:04.080198","192.168.0.74","64.65.63.120","TLSv1.2","1272","Application Data"
"280","11:42:04.105504","192.168.0.74","64.65.63.120","TCP","1474","59487  >  443 [ACK] Seq=34563 Ack=80419 Win=9198 Len=1408 TSval=3163332635 TSecr=2680625266 [TCP PDU reassembled in 282]"
"281","11:42:04.105508","192.168.0.74","64.65.63.120","TCP","1474","59487  >  443 [ACK] Seq=35971 Ack=80419 Win=9198 Len=1408 TSval=3163332635 TSecr=2680625266 [TCP PDU reassembled in 282]"
"282","11:42:04.105536","192.168.0.74","64.65.63.120","TLSv1.2","356","Application Data"
"283","11:42:04.106894","192.168.0.74","64.65.63.120","TCP","1474","59487  >  443 [ACK] Seq=37669 Ack=80419 Win=9198 Len=1408 TSval=3163332636 TSecr=2680625266 [TCP PDU reassembled in 284]"
"284","11:42:04.106910","192.168.0.74","64.65.63.120","TLSv1.2","222","Application Data"
"285","11:42:04.116569","64.65.63.120","192.168.0.74","TCP","66","443  >  59487 [ACK] Seq=80419 Ack=34563 Win=3836 Len=0 TSval=2680625307 TSecr=3163332591"
"286","11:42:04.124308","64.65.63.120","192.168.0.74","TLSv1.2","602","Application Data"
"287","11:42:04.124434","192.168.0.74","64.65.63.120","TCP","66","59487  >  443 [ACK] Seq=39233 Ack=80955 Win=9198 Len=0 TSval=3163332654 TSecr=2680625314"
"288","11:42:04.142154","64.65.63.120","192.168.0.74","TCP","66","443  >  59487 [ACK] Seq=80955 Ack=37669 Win=3812 Len=0 TSval=2680625332 TSecr=3163332635"
"289","11:42:04.142156","192.87.28.82","192.168.0.74","TCP","66","9001  >  59488 [ACK] Seq=3195 Ack=3709 Win=2347 Len=0 TSval=2692674611 TSecr=3832201548"
"290","11:42:04.142257","192.168.0.74","192.87.28.82","TLSv1.2","602","Application Data"
"291","11:42:04.147094","64.65.63.120","192.168.0.74","TCP","66","443  >  59487 [ACK] Seq=80955 Ack=39233 Win=3800 Len=0 TSval=2680625337 TSecr=3163332636"
"292","11:42:04.159457","64.65.63.120","192.168.0.74","TLSv1.2","1116","Application Data"
