"No.","Time","Source","Destination","Protocol","Length","Info"
"1","11:41:20.437132","192.168.0.74","5.28.195.2","TCP","78","62780  >  5222 [SYN] Seq=0 Win=65535 Len=0 MSS=1460 WS=16 TSval=2561782647 TSecr=0 SACK_PERM"
"2","11:41:20.437208","192.168.0.74","5.28.195.2","TCP","78","62778  >  80 [SYN] Seq=0 Win=65535 Len=0 MSS=1460 WS=16 TSval=591988837 TSecr=0 SACK_PERM"
"3","11:41:20.673742","192.168.0.74","192.87.28.82","TLSv1.2","602","Application Data"
"4","11:41:20.729873","192.168.0.192","230.0.0.1","UDP","92","58107  >  6666 Len=50"
"5","11:41:20.759335","192.87.28.82","192.168.0.74","TCP","66","9001  >  59488 [ACK] Seq=1 Ack=537 Win=2347 Len=0 TSval=2692631226 TSecr=3832158156"
"6","11:41:20.934706","192.168.0.192","230.0.0.1","UDP","92","62979  >  6666 Len=50"
"7","11:41:21.347739","149.154.167.41","192.168.0.74","SSL","638","Continuation Data"
"8","11:41:21.347856","192.168.0.74","149.154.167.41","TCP","66","59400  >  443 [ACK] Seq=1 Ack=573 Win=65501 Len=0 TSval=1845274654 TSecr=324987432"
"9","11:41:21.365845","192.168.0.74","149.154.167.43","SSL","411","Continuation Data"
"10","11:41:21.372133","192.168.0.74","149.154.167.43","TCP","78","62784  >  443 [SYN, ECE, CWR] Seq=0 Win=65535 Len=0 MSS=1460 WS=16 TSval=617205992 TSecr=0 SACK_PERM"
"11","11:41:21.406844","149.154.167.43","192.168.0.74","TCP","70","443  >  59404 [PSH, ACK] Seq=1 Ack=346 Win=9480 Len=4 TSval=1884831588 TSecr=109157048 [TCP PDU reassembled in 16]"
"12","11:41:21.406963","192.168.0.74","149.154.167.43","SSL","468","Continuation Data"
"13","11:41:21.412966","149.154.167.43","192.168.0.74","TCP","74","443  >  62784 [SYN, ACK, ECE] Seq=0 Ack=1 Win=65535 Len=0 MSS=1240 SACK_PERM TSval=238472177 TSecr=617205992 WS=32"
"14","11:41:21.413095","192.168.0.74","149.154.167.43","TCP","66","62784  >  443 [ACK] Seq=1 Ack=1 Win=1048560 Len=0 TSval=617206033 TSecr=238472177"
"15","11:41:21.413499","192.168.0.74","149.154.167.43","SSL","571","Continuation Data"
"16","11:41:21.422298","149.154.167.43","192.168.0.74","SSL","1294","Continuation Data"
"17","11:41:21.422300","149.154.167.43","192.168.0.74","SSL","1294","Continuation Data"
"18","11:41:21.422301","149.154.167.43","192.168.0.74","SSL","1294","Continuation Data"
"19","11:41:21.422302","149.154.167.43","192.168.0.74","SSL","1294","Continuation Data"
"20","11:41:21.422303","149.154.167.43","192.168.0.74","SSL","1294","Continuation Data"
"21","11:41:21.422304","149.154.167.43","192.168.0.74","SSL","1294","Continuation Data"
"22","11:41:21.422305","149.154.167.43","192.168.0.74","SSL","975","Continuation Data"
"23","11:41:21.422306","149.154.167.43","192.168.0.74","SSL","171","Continuation Data"
"24","11:41:21.422417","192.168.0.74","149.154.167.43","TCP","66","59404  >  443 [ACK] Seq=748 Ack=1233 Win=65460 Len=0 TSval=109157104 TSecr=1884831601"
"25","11:41:21.422453","192.168.0.74","149.154.167.43","TCP","66","59404  >  443 [ACK] Seq=748 Ack=8387 Win=65013 Len=0 TSval=109157104 TSecr=1884831604"
"26","11:41:21.422822","192.168.0.74","149.154.167.43","TCP","66","[TCP Window Update] 59404  >  443 [ACK] Seq=748 Ack=8387 Win=65535 Len=0 TSval=109157105 TSecr=1884831604"
"27","11:41:21.437778","192.168.0.74","5.28.195.2","TCP","78","[TCP Retransmission] 62780  >  5222 [SYN] Seq=0 Win=65535 Len=0 MSS=1460 WS=16 TSval=2561783648 TSecr=0 SACK_PERM"
"28","11:41:21.437821","192.168.0.74","5.28.195.2","TCP","78","[TCP Retransmission] 62778  >  80 [SYN] Seq=0 Win=65535 Len=0 MSS=1460 WS=16 TSval=591989838 TSecr=0 SACK_PERM"
"29","11:41:21.447836","149.154.167.43","192.168.0.74","TCP","70","443  >  59404 [PSH, ACK] Seq=8387 Ack=748 Win=9515 Len=4 TSval=1884831634 TSecr=109157089 [TCP PDU reassembled in 31]"
"30","11:41:21.447966","192.168.0.74","149.154.167.43","SSL","902","Continuation Data"
"31","11:41:21.456543","149.154.167.43","192.168.0.74","SSL","171","Continuation Data"
"32","11:41:21.456544","149.154.167.43","192.168.0.74","TCP","70","443  >  62784 [PSH, ACK] Seq=1 Ack=506 Win=66624 Len=4 TSval=238472220 TSecr=617206033 [TCP PDU reassembled in 33]"
"33","11:41:21.456544","149.154.167.43","192.168.0.74","SSL","283","Continuation Data"
"34","11:41:21.456601","192.168.0.74","149.154.167.43","TCP","66","59404  >  443 [ACK] Seq=1584 Ack=8496 Win=65530 Len=0 TSval=109157138 TSecr=1884831641"
"35","11:41:21.456632","192.168.0.74","149.154.167.43","SSL","532","Continuation Data"
"36","11:41:21.461946","149.154.167.43","192.168.0.74","SSL","276","Continuation Data"
"37","11:41:21.461947","149.154.167.43","192.168.0.74","SSL","171","Continuation Data"
"38","11:41:21.462054","192.168.0.74","149.154.167.43","TCP","66","62784  >  443 [ACK] Seq=972 Ack=432 Win=1048368 Len=0 TSval=617206082 TSecr=238472226"
"39","11:41:21.462092","192.168.0.74","149.154.167.43","TCP","66","62784  >  443 [ACK] Seq=972 Ack=537 Win=1048272 Len=0 TSval=617206082 TSecr=238472228"
"40","11:41:21.483324","149.154.167.43","192.168.0.74","SSL","78","Continuation Data"
"41","11:41:21.483456","192.168.0.74","149.154.167.43","TCP","66","59404  >  443 [ACK] Seq=1584 Ack=8508 Win=65535 Len=0 TSval=109157165 TSecr=1884831669"
"42","11:41:21.498369","149.154.167.43","192.168.0.74","SSL","171","Continuation Data"
"43","11:41:21.498371","149.154.167.43","192.168.0.74","SSL","1294","Continuation Data"
"44","11:41:21.498372","149.154.167.43","192.168.0.74","SSL","1294","Continuation Data"
"45","11:41:21.498469","192.168.0.74","149.154.167.43","TCP","66","59404  >  443 [ACK] Seq=1584 Ack=11069 Win=65376 Len=0 TSval=109157180 TSecr=1884831684"
"46","11:41:21.498715","192.168.0.74","149.154.167.43","TCP","66","[TCP Window Update] 59404  >  443 [ACK] Seq=1584 Ack=11069 Win=65535 Len=0 TSval=109157181 TSecr=1884831684"
"47","11:41:21.513472","149.154.167.43","192.168.0.74","SSL","235","Continuation Data"
"48","11:41:21.513572","192.168.0.74","149.154.167.43","TCP","66","62784  >  443 [ACK] Seq=972 Ack=706 Win=1048416 Len=0 TSval=617206133 TSecr=238472280"
"49","11:41:21.517752","149.154.167.43","192.168.0.74","SSL","1294","Continuation Data"
"50","11:41:21.517753","149.154.167.43","192.168.0.74","SSL","171","Continuation Data"
"51","11:41:21.517779","192.168.0.74","149.154.167.43","TCP","66","59404  >  443 [ACK] Seq=1584 Ack=12297 Win=65460 Len=0 TSval=109157200 TSecr=1884831704"
"52","11:41:21.517801","192.168.0.74","149.154.167.43","TCP","66","62784  >  443 [ACK] Seq=972 Ack=811 Win=1048480 Len=0 TSval=617206138 TSecr=238472286"
"53","11:41:21.523233","149.154.167.43","192.168.0.74","SSL","171","Continuation Data"
"54","11:41:21.523260","192.168.0.74","149.154.167.43","TCP","66","62784  >  443 [ACK] Seq=972 Ack=916 Win=1048480 Len=0 TSval=617206143 TSecr=238472290"
"55","11:41:21.532218","149.154.167.43","192.168.0.74","SSL","1294","Continuation Data"
"56","11:41:21.532220","149.154.167.43","192.168.0.74","SSL","1294","Continuation Data"
"57","11:41:21.532221","149.154.167.43","192.168.0.74","SSL","1294","Continuation Data"
"58","11:41:21.532342","192.168.0.74","149.154.167.43","TCP","66","59404  >  443 [ACK] Seq=1584 Ack=15981 Win=65306 Len=0 TSval=109157214 TSecr=1884831718"
"59","11:41:21.532420","192.168.0.74","149.154.167.43","TCP","66","[TCP Window Update] 59404  >  443 [ACK] Seq=1584 Ack=15981 Win=65535 Len=0 TSval=109157214 TSecr=1884831718"
"60","11:41:21.552187","149.154.167.43","192.168.0.74","SSL","1096","Continuation Data"
"61","11:41:21.552286","192.168.0.74","149.154.167.43","TCP","66","59404  >  443 [ACK] Seq=1584 Ack=17011 Win=65472 Len=0 TSval=109157234 TSecr=1884831738"
"62","11:41:21.760894","192.168.0.192","230.0.0.1","UDP","92","58107  >  6666 Len=50"
"63","11:41:21.914655","192.168.0.74","192.87.28.82","TLSv1.2","602","Application Data"
"64","11:41:21.958584","192.168.0.192","230.0.0.1","UDP","92","62979  >  6666 Len=50"
"65","11:41:21.986801","192.168.0.74","64.65.63.120","TLSv1.2","602","Application Data"
"66","11:41:22.005855","192.87.28.82","192.168.0.74","TCP","66","9001  >  59488 [ACK] Seq=1 Ack=1073 Win=2347 Len=0 TSval=2692632467 TSecr=3832159397"
"67","11:41:22.006027","192.168.0.74","192.87.28.82","TLSv1.2","602","Application Data"
"68","11:41:22.022999","64.65.63.120","192.168.0.74","TLSv1.2","602","Application Data"
"69","11:41:22.023086","192.168.0.74","64.65.63.120","TCP","66","59487  >  443 [ACK] Seq=537 Ack=537 Win=9190 Len=0 TSval=3163290551 TSecr=2680583212"
"70","11:41:22.024007","192.168.0.74","192.87.28.82","TCP","1474","59488  >  9001 [ACK] Seq=1609 Ack=1 Win=6822 Len=1408 TSval=3832159507 TSecr=2692632467 [TCP PDU reassembled in 71]"
"71","11:41:22.024021","192.168.0.74","192.87.28.82","TLSv1.2","736","Application Data"
"72","11:41:22.025317","64.65.63.120","192.168.0.74","TCP","66","443  >  59487 [ACK] Seq=537 Ack=537 Win=3120 Len=0 TSval=2680583215 TSecr=3163290515"
"73","11:41:22.047468","192.87.28.82","192.168.0.74","TLSv1.2","602","Application Data"
"74","11:41:22.047606","192.168.0.74","192.87.28.82","TCP","66","59488  >  9001 [ACK] Seq=3687 Ack=537 Win=6814 Len=0 TSval=3832159530 TSecr=2692632511"
"75","11:41:22.064623","192.87.28.82","192.168.0.74","TCP","66","9001  >  59488 [ACK] Seq=537 Ack=3687 Win=2315 Len=0 TSval=2692632527 TSecr=3832159507"
"76","11:41:22.064741","192.168.0.74","192.87.28.82","TLSv1.2","602","Application Data"
"77","11:41:22.066563","64.65.63.120","192.168.0.74","TLSv1.2","602","Application Data"
"78","11:41:22.066650","192.168.0.74","64.65.63.120","TCP","66","59487  >  443 [ACK] Seq=537 Ack=1073 Win=9190 Len=0 TSval=3163290594 TSecr=2680583253"
"79","11:41:22.067011","192.168.0.74","64.65.63.120","TLSv1.2","602","Application Data"
"80","11:41:22.095672","64.65.63.120","192.168.0.74","TCP","1474","443  >  59487 [ACK] Seq=1073 Ack=537 Win=3120 Len=1408 TSval=2680583284 TSecr=3163290551 [TCP PDU reassembled in 84]"
"81","11:41:22.095675","64.65.63.120","192.168.0.74","TCP","1474","443  >  59487 [PSH, ACK] Seq=2481 Ack=537 Win=3120 Len=1408 TSval=2680583284 TSecr=3163290551 [TCP PDU reassembled in 84]"
"82","11:41:22.095797","192.168.0.74","64.65.63.120","TCP","66","59487  >  443 [ACK] Seq=1073 Ack=3889 Win=9154 Len=0 TSval=3163290624 TSecr=2680583284"
"83","11:41:22.095979","192.168.0.74","64.65.63.120","TCP","66","[TCP Window Update] 59487  >  443 [ACK] Seq=1073 Ack=3889 Win=9198 Len=0 TSval=3163290624 TSecr=2680583284"
"84","11:41:22.103616","64.65.63.120","192.168.0.74","TLSv1.2","870","Application Data"
"85","11:41:22.103749","192.168.0.74","64.65.63.120","TCP","66","59487  >  443 [ACK] Seq=1073 Ack=4693 Win=9186 Len=0 TSval=3163290632 TSecr=2680583293"
"86","11:41:22.123608","192.87.28.82","192.168.0.74","TLSv1.2","602","Application Data"
"87","11:41:22.123767","192.168.0.74","192.87.28.82","TCP","66","59488  >  9001 [ACK] Seq=4223 Ack=1073 Win=6814 Len=0 TSval=3832159607 TSecr=2692632588"
"88","11:41:22.124548","192.168.0.74","192.87.28.82","TLSv1.2","602","Application Data"
"89","11:41:22.138048","64.65.63.120","192.168.0.74","TLSv1.2","1138","Application Data, Application Data"
"90","11:41:22.138143","192.168.0.74","64.65.63.120","TCP","66","59487  >  443 [ACK] Seq=1073 Ack=5765 Win=9182 Len=0 TSval=3163290666 TSecr=2680583329"
"91","11:41:22.138872","192.168.0.74","64.65.63.120","TLSv1.2","602","Application Data"
"92","11:41:22.160402","192.87.28.82","192.168.0.74","TCP","66","9001  >  59488 [ACK] Seq=1073 Ack=4759 Win=2347 Len=0 TSval=2692632630 TSecr=3832159607"
"93","11:41:22.160613","192.168.0.74","192.87.28.82","TLSv1.2","1138","Application Data, Application Data"
"94","11:41:22.189679","192.87.28.82","192.168.0.74","TLSv1.2","602","Application Data"
"95","11:41:22.189850","192.168.0.74","192.87.28.82","TCP","66","59488  >  9001 [ACK] Seq=5831 Ack=1609 Win=6814 Len=0 TSval=3832159673 TSecr=2692632659"
"96","11:41:22.191728","2a02:ab88:b:4100:6163:ab1b:4f48:fc2c","2a00:1450:4025:c01::6d","TCP","98","62786  >  993 [SYN, ECE, CWR] Seq=0 Win=65535 Len=0 MSS=1440 WS=64 TSval=2518589086 TSecr=0 SACK_PERM"
"97","11:41:22.221119","64.65.63.120","192.168.0.74","TCP","66","443  >  59487 [ACK] Seq=5765 Ack=1609 Win=3112 Len=0 TSval=2680583407 TSecr=3163290667"
"98","11:41:22.221121","64.65.63.120","192.168.0.74","TLSv1.2","602","Application Data"
"99","11:41:22.221291","192.168.0.74","64.65.63.120","TCP","66","59487  >  443 [ACK] Seq=1609 Ack=6301 Win=9190 Len=0 TSval=3163290749 TSecr=2680583412"
"100","11:41:22.222163","192.168.0.74","64.65.63.120","TLSv1.2","602","Application Data"
"101","11:41:22.232779","192.87.28.82","192.168.0.74","TCP","66","9001  >  59488 [ACK] Seq=1609 Ack=5831 Win=2347 Len=0 TSval=2692632703 TSecr=3832159643"
"102","11:41:22.232872","192.168.0.74","192.87.28.82","TLSv1.2","602","Application Data"
"103","11:41:22.240518","2a00:1450:4025:c01::6d","2a02:ab88:b:4100:6163:ab1b:4f48:fc2c","TCP","94","993  >  62786 [SYN, ACK] Seq=0 Ack=1 Win=65535 Len=0 MSS=1420 SACK_PERM TSval=3339983938 TSecr=2518589086 WS=256"
"104","11:41:22.240659","2a02:ab88:b:4100:6163:ab1b:4f48:fc2c","2a00:1450:4025:c01::6d","TCP","86","62786  >  993 [ACK] Seq=1 Ack=1 Win=2816 Len=0 TSval=2518589135 TSecr=3339983938"
"105","11:41:22.241724","2a02:ab88:b:4100:6163:ab1b:4f48:fc2c","2a00:1450:4025:c01::6d","TLSv1.2","292","Client Hello (SNI=imap.gmail.com)"
"106","11:41:22.255619","64.65.63.120","192.168.0.74","TLSv1.2","1138","Application Data, Application Data"
"107","11:41:22.255838","192.168.0.74","64.65.63.120","TCP","66","59487  >  443 [ACK] Seq=2145 Ack=7373 Win=9182 Len=0 TSval=3163290784 TSecr=2680583446"
"108","11:41:22.260567","64.65.63.120","192.168.0.74","TCP","66","443  >  59487 [ACK] Seq=7373 Ack=2145 Win=3108 Len=0 TSval=2680583450 TSecr=3163290750"
"109","11:41:22.264758","64.65.63.120","192.168.0.74","TCP","1474","443  >  59487 [ACK] Seq=7373 Ack=2145 Win=3108 Len=1408 TSval=2680583455 TSecr=3163290750 [TCP PDU reassembled in 111]"
"110","11:41:22.264760","64.65.63.120","192.168.0.74","TCP","1474","443  >  59487 [PSH, ACK] Seq=8781 Ack=2145 Win=3108 Len=1408 TSval=2680583455 TSecr=3163290750 [TCP PDU reassembled in 111]"
"111","11:41:22.264761","64.65.63.120","192.168.0.74","TLSv1.2","1474","Application Data"
"112","11:41:22.264761","64.65.63.120","192.168.0.74","TCP","1474","443  >  59487 [PSH, ACK] Seq=11597 Ack=2145 Win=3108 Len=1408 TSval=2680583455 TSecr=3163290750 [TCP PDU reassembled in 115]"
"113","11:41:22.264832","192.168.0.74","64.65.63.120","TCP","66","59487  >  443 [ACK] Seq=2145 Ack=13005 Win=9110 Len=0 TSval=3163290793 TSecr=2680583455"
"114","11:41:22.264913","192.168.0.74","64.65.63.120","TCP","66","[TCP Window Update] 59487  >  443 [ACK] Seq=2145 Ack=13005 Win=9198 Len=0 TSval=3163290793 TSecr=2680583455"
"115","11:41:22.265937","64.65.63.120","192.168.0.74","TLSv1.2","1474","Application Data"
"116","11:41:22.265939","64.65.63.120","192.168.0.74","TCP","1474","443  >  59487 [PSH, ACK] Seq=14413 Ack=2145 Win=3108 Len=1408 TSval=2680583456 TSecr=3163290750 [TCP PDU reassembled in 122]"
"117","11:41:22.265940","64.65.63.120","192.168.0.74","TCP","1474","443  >  59487 [ACK] Seq=15821 Ack=2145 Win=3108 Len=1408 TSval=2680583456 TSecr=3163290750 [TCP PDU reassembled in 122]"
"118","11:41:22.265969","192.168.0.74","64.65.63.120","TCP","66","59487  >  443 [ACK] Seq=2145 Ack=17229 Win=9132 Len=0 TSval=3163290794 TSecr=2680583456"
"119","11:41:22.266045","192.168.0.74","64.65.63.120","TCP","66","[TCP Window Update] 59487  >  443 [ACK] Seq=2145 Ack=17229 Win=9198 Len=0 TSval=3163290794 TSecr=2680583456"
"120","11:41:22.287798","2a00:1450:4025:c01::6d","2a02:ab88:b:4100:6163:ab1b:4f48:fc2c","TCP","86","993  >  62786 [ACK] Seq=1 Ack=207 Win=269824 Len=0 TSval=3339983989 TSecr=2518589137"
"121","11:41:22.290638","2a00:1450:4025:c01::6d","2a02:ab88:b:4100:6163:ab1b:4f48:fc2c","TLSv1.2","1294","Server Hello"
"122","11:41:22.290639","64.65.63.120","192.168.0.74","TLSv1.2","578","Application Data, Application Data"
"123","11:41:22.290640","2a00:1450:4025:c01::6d","2a02:ab88:b:4100:6163:ab1b:4f48:fc2c","TCP","1294","993  >  62786 [PSH, ACK] Seq=1209 Ack=207 Win=269824 Len=1208 TSval=3339983989 TSecr=2518589137 [TCP PDU reassembled in 142]"
"124","11:41:22.290746","2a02:ab88:b:4100:6163:ab1b:4f48:fc2c","2a00:1450:4025:c01::6d","TCP","86","62786  >  993 [ACK] Seq=207 Ack=2417 Win=2816 Len=0 TSval=2518589186 TSecr=3339983989"
"125","11:41:22.290802","192.168.0.74","64.65.63.120","TCP","66","59487  >  443 [ACK] Seq=2145 Ack=17741 Win=9190 Len=0 TSval=3163290819 TSecr=2680583481"
"126","11:41:22.310158","192.87.28.82","192.168.0.74","TCP","66","9001  >  59488 [ACK] Seq=1609 Ack=6367 Win=2347 Len=0 TSval=2692632779 TSecr=3832159716"
"127","11:41:22.310264","192.168.0.74","192.87.28.82","TLSv1.2","1138","Application Data, Application Data"
"128","11:41:22.313260","64.65.63.120","192.168.0.74","TCP","1474","443  >  59487 [ACK] Seq=17741 Ack=2145 Win=3108 Len=1408 TSval=2680583503 TSecr=3163290794 [TCP PDU reassembled in 130]"
"129","11:41:22.313262","64.65.63.120","192.168.0.74","TCP","1474","443  >  59487 [PSH, ACK] Seq=19149 Ack=2145 Win=3108 Len=1408 TSval=2680583503 TSecr=3163290794 [TCP PDU reassembled in 130]"
"130","11:41:22.313263","64.65.63.120","192.168.0.74","TLSv1.2","1474","Application Data"
"131","11:41:22.313264","64.65.63.120","192.168.0.74","TCP","1474","443  >  59487 [PSH, ACK] Seq=21965 Ack=2145 Win=3108 Len=1408 TSval=2680583503 TSecr=3163290794 [TCP PDU reassembled in 135]"
"132","11:41:22.313369","192.168.0.74","64.65.63.120","TCP","66","59487  >  443 [ACK] Seq=2145 Ack=23373 Win=9110 Len=0 TSval=3163290841 TSecr=2680583503"
"133","11:41:22.313505","192.168.0.74","64.65.63.120","TCP","66","[TCP Window Update] 59487  >  443 [ACK] Seq=2145 Ack=23373 Win=9198 Len=0 TSval=3163290841 TSecr=2680583503"
"134","11:41:22.313609","192.168.0.74","64.65.63.120","TLSv1.2","1116","Application Data"
"135","11:41:22.314975","64.65.63.120","192.168.0.74","TLSv1.2","1474","Application Data"
"136","11:41:22.315026","192.168.0.74","64.65.63.120","TCP","66","59487  >  443 [ACK] Seq=3195 Ack=24781 Win=9176 Len=0 TSval=3163290843 TSecr=2680583505"
"137","11:41:22.324740","64.65.63.120","192.168.0.74","TLSv1.2","802","Application Data"
"138","11:41:22.324741","192.87.28.82","192.168.0.74","TLSv1.2","602","Application Data"
"139","11:41:22.324838","192.168.0.74","192.87.28.82","TCP","66","59488  >  9001 [ACK] Seq=7439 Ack=2145 Win=6814 Len=0 TSval=3832159808 TSecr=2692632794"
"140","11:41:22.324873","192.168.0.74","64.65.63.120","TCP","66","59487  >  443 [ACK] Seq=3195 Ack=25517 Win=9187 Len=0 TSval=3163290853 TSecr=2680583515"
"141","11:41:22.331619","2a00:1450:4025:c01::6d","2a02:ab88:b:4100:6163:ab1b:4f48:fc2c","TCP","1294","993  >  62786 [ACK] Seq=2417 Ack=207 Win=269824 Len=1208 TSval=3339984033 TSecr=2518589186 [TCP PDU reassembled in 142]"
"142","11:41:22.331621","2a00:1450:4025:c01::6d","2a02:ab88:b:4100:6163:ab1b:4f48:fc2c","TLSv1.2","532","Certificate, Server Key Exchange, Server Hello Done"
"143","11:41:22.331739","2a02:ab88:b:4100:6163:ab1b:4f48:fc2c","2a00:1450:4025:c01::6d","TCP","86","62786  >  993 [ACK] Seq=207 Ack=4071 Win=4224 Len=0 TSval=2518589227 TSecr=3339984033"
"144","11:41:22.341821","2a02:ab88:b:4100:6163:ab1b:4f48:fc2c","2a00:1450:4025:c01::6d","TLSv1.2","161","Client Key Exchange"
"145","11:41:22.385993","64.65.63.120","192.168.0.74","TLSv1.2","602","Application Data"
"146","11:41:22.385995","192.87.28.82","192.168.0.74","TCP","66","9001  >  59488 [ACK] Seq=2145 Ack=7439 Win=2347 Len=0 TSval=2692632853 TSecr=3832159793"
"147","11:41:22.385996","2a00:1450:4025:c01::6d","2a02:ab88:b:4100:6163:ab1b:4f48:fc2c","TCP","86","993  >  62786 [ACK] Seq=4071 Ack=282 Win=269824 Len=0 TSval=3339984089 TSecr=2518589237"
"148","11:41:22.386121","192.168.0.74","192.87.28.82","TLSv1.2","602","Application Data"
"149","11:41:22.386173","192.168.0.74","64.65.63.120","TCP","66","59487  >  443 [ACK] Seq=3195 Ack=26053 Win=9190 Len=0 TSval=3163290914 TSecr=2680583566"
"150","11:41:22.386217","2a02:ab88:b:4100:6163:ab1b:4f48:fc2c","2a00:1450:4025:c01::6d","TLSv1.2","137","Change Cipher Spec, Encrypted Handshake Message"
"151","11:41:22.387150","192.168.0.74","192.87.28.82","TCP","1474","59488  >  9001 [ACK] Seq=7975 Ack=2145 Win=6822 Len=1408 TSval=3832159870 TSecr=2692632853 [TCP PDU reassembled in 152]"
"152","11:41:22.387170","192.168.0.74","192.87.28.82","TLSv1.2","736","Application Data"
"153","11:41:22.421739","192.87.28.82","192.168.0.74","TCP","66","9001  >  59488 [ACK] Seq=2145 Ack=9383 Win=2317 Len=0 TSval=2692632891 TSecr=3832159869"
"154","11:41:22.429222","2a00:1450:4025:c01::6d","2a02:ab88:b:4100:6163:ab1b:4f48:fc2c","TCP","86","993  >  62786 [ACK] Seq=4071 Ack=333 Win=269824 Len=0 TSval=3339984132 TSecr=2518589281"
"155","11:41:22.429223","2a00:1450:4025:c01::6d","2a02:ab88:b:4100:6163:ab1b:4f48:fc2c","TLSv1.2","137","Change Cipher Spec, Encrypted Handshake Message"
"156","11:41:22.429224","2a00:1450:4025:c01::6d","2a02:ab88:b:4100:6163:ab1b:4f48:fc2c","TLSv1.2","228","Application Data"
"157","11:41:22.429315","2a02:ab88:b:4100:6163:ab1b:4f48:fc2c","2a00:1450:4025:c01::6d","TCP","86","62786  >  993 [ACK] Seq=333 Ack=4264 Win=4224 Len=0 TSval=2518589324 TSecr=3339984133"
"158","11:41:22.430029","2a02:ab88:b:4100:6163:ab1b:4f48:fc2c","2a00:1450:4025:c01::6d","TLSv1.2","134","Application Data"
"159","11:41:22.458139","64.65.63.120","192.168.0.74","TCP","1474","443  >  59487 [ACK] Seq=26053 Ack=3195 Win=3100 Len=1408 TSval=2680583648 TSecr=3163290914 [TCP PDU reassembled in 161]"
"160","11:41:22.458141","64.65.63.120","192.168.0.74","TCP","1474","443  >  59487 [PSH, ACK] Seq=27461 Ack=3195 Win=3100 Len=1408 TSval=2680583648 TSecr=3163290914 [TCP PDU reassembled in 161]"
"161","11:41:22.458143","64.65.63.120","192.168.0.74","TLSv1.2","870","Application Data"
"162","11:41:22.458251","192.168.0.74","64.65.63.120","TCP","66","59487  >  443 [ACK] Seq=3195 Ack=29673 Win=9142 Len=0 TSval=3163290986 TSecr=2680583648"
"163","11:41:22.459432","192.168.0.74","64.65.63.120","TLSv1.2","602","Application Data"
"164","11:41:22.459489","192.168.0.74","64.65.63.120","TCP","66","[TCP Window Update] 59487  >  443 [ACK] Seq=3731 Ack=29673 Win=9198 Len=0 TSval=3163290987 TSecr=2680583648"
"165","11:41:22.461083","192.87.28.82","192.168.0.74","TCP","66","9001  >  59488 [ACK] Seq=2145 Ack=10053 Win=2347 Len=0 TSval=2692632931 TSecr=3832159870"
"166","11:41:22.461168","192.168.0.74","192.87.28.82","TLSv1.2","602","Application Data"
"167","11:41:22.469903","2a00:1450:4025:c01::6d","2a02:ab88:b:4100:6163:ab1b:4f48:fc2c","TLSv1.2","348","Application Data"
"168","11:41:22.469986","2a02:ab88:b:4100:6163:ab1b:4f48:fc2c","2a00:1450:4025:c01::6d","TCP","86","62786  >  993 [ACK] Seq=381 Ack=4526 Win=4224 Len=0 TSval=2518589365 TSecr=3339984173"
"169","11:41:22.470077","2a02:ab88:b:4100:6163:ab1b:4f48:fc2c","2a00:1450:4025:c01::6d","TCP","86","[TCP Window Update] 62786  >  993 [ACK] Seq=381 Ack=4526 Win=131072 Len=0 TSval=2518589365 TSecr=3339984173"
"170","11:41:22.470771","2a02:ab88:b:4100:6163:ab1b:4f48:fc2c","2a00:1450:4025:c01::6d","TLSv1.2","248","Application Data"
"171","11:41:22.493010","192.168.0.74","192.87.28.82","TLSv1.2","1474","Application Data"
"172","11:41:22.493012","192.168.0.74","192.87.28.82","TCP","1474","59488  >  9001 [ACK] Seq=11997 Ack=2145 Win=6822 Len=1408 TSval=3832159976 TSecr=2692632931 [TCP PDU reassembled in 173]"
"173","11:41:22.493032","192.168.0.74","192.87.28.82","TLSv1.2","1406","Application Data"
"174","11:41:22.493294","64.65.63.120","192.168.0.74","TLSv1.2","602","Application Data"
"175","11:41:22.493365","192.168.0.74","64.65.63.120","TCP","66","59487  >  443 [ACK] Seq=3731 Ack=30209 Win=9190 Len=0 TSval=3163291021 TSecr=2680583684"
"176","11:41:22.511957","2a00:1450:4025:c01::6d","2a02:ab88:b:4100:6163:ab1b:4f48:fc2c","TLSv1.2","382","Application Data"
"177","11:41:22.512080","2a02:ab88:b:4100:6163:ab1b:4f48:fc2c","2a00:1450:4025:c01::6d","TCP","86","62786  >  993 [ACK] Seq=543 Ack=4822 Win=130816 Len=0 TSval=2518589407 TSecr=3339984214"
"178","11:41:22.513404","2a02:ab88:b:4100:6163:ab1b:4f48:fc2c","2a00:1450:4025:c01::6d","TLSv1.2","130","Application Data"
"179","11:41:22.514099","2a02:ab88:b:4100:6163:ab1b:4f48:fc2c","2a00:1450:4025:c01::6d","TCP","86","62786  >  993 [FIN, ACK] Seq=587 Ack=4822 Win=131072 Len=0 TSval=2518589409 TSecr=3339984214"
"180","11:41:22.515600","2a02:ab88:b:4100:6163:ab1b:4f48:fc2c","2a00:1450:4025:c01::6d","TCP","98","62797  >  993 [SYN, ECE, CWR] Seq=0 Win=65535 Len=0 MSS=1440 WS=64 TSval=3198103747 TSecr=0 SACK_PERM"
"181","11:41:22.528059","192.87.28.82","192.168.0.74","TCP","66","9001  >  59488 [ACK] Seq=2145 Ack=11997 Win=2325 Len=0 TSval=2692632997 TSecr=3832159944"
"182","11:41:22.528060","192.87.28.82","192.168.0.74","TCP","66","9001  >  59488 [ACK] Seq=2145 Ack=14745 Win=2283 Len=0 TSval=2692632997 TSecr=3832159976"
"183","11:41:22.528183","192.168.0.74","192.87.28.82","TLSv1.2","1138","Application Data, Application Data"
"184","11:41:22.529738","64.65.63.120","192.168.0.74","TCP","66","443  >  59487 [ACK] Seq=30209 Ack=3731 Win=3096 Len=0 TSval=2680583721 TSecr=3163290987"
"185","11:41:22.552570","2a00:1450:4025:c01::6d","2a02:ab88:b:4100:6163:ab1b:4f48:fc2c","TLSv1.2","260","Application Data"
"186","11:41:22.552572","192.87.28.82","192.168.0.74","TLSv1.2","602","Application Data"
"187","11:41:22.552724","2a02:ab88:b:4100:6163:ab1b:4f48:fc2c","2a00:1450:4025:c01::6d","TCP","74","62786  >  993 [RST] Seq=587 Win=0 Len=0"
"188","11:41:22.552788","192.168.0.74","192.87.28.82","TCP","66","59488  >  9001 [ACK] Seq=15817 Ack=2681 Win=6814 Len=0 TSval=3832160036 TSecr=2692633022"
"189","11:41:22.553957","2a00:1450:4025:c01::6d","2a02:ab88:b:4100:6163:ab1b:4f48:fc2c","TCP","86","993  >  62786 [FIN, ACK] Seq=4996 Ack=587 Win=269824 Len=0 TSval=3339984256 TSecr=2518589408"
"190","11:41:22.558817","2a00:1450:4025:c01::6d","2a02:ab88:b:4100:6163:ab1b:4f48:fc2c","TCP","86","993  >  62786 [ACK] Seq=4997 Ack=588 Win=269824 Len=0 TSval=3339984260 TSecr=2518589409"
"191","11:41:22.564910","2a00:1450:4025:c01::6d","2a02:ab88:b:4100:6163:ab1b:4f48:fc2c","TCP","94","993  >  62797 [SYN, ACK] Seq=0 Ack=1 Win=65535 Len=0 MSS=1420 SACK_PERM TSval=886588030 TSecr=3198103747 WS=256"
"192","11:41:22.564911","64.65.63.120","192.168.0.74","TCP","1474","443  >  59487 [ACK] Seq=30209 Ack=3731 Win=3096 Len=1408 TSval=2680583756 TSecr=3163290987 [TCP PDU reassembled in 194]"
"193","11:41:22.564913","64.65.63.120","192.168.0.74","TCP","1474","443  >  59487 [PSH, ACK] Seq=31617 Ack=3731 Win=3096 Len=1408 TSval=2680583756 TSecr=3163290987 [TCP PDU reassembled in 194]"
"194","11:41:22.564914","64.65.63.120","192.168.0.74","TLSv1.2","356","Application Data"
"195","11:41:22.565083","2a02:ab88:b:4100:6163:ab1b:4f48:fc2c","2a00:1450:4025:c01::6d","TCP","86","62797  >  993 [ACK] Seq=1 Ack=1 Win=132352 Len=0 TSval=3198103797 TSecr=886588030"
"196","11:41:22.565213","192.168.0.74","64.65.63.120","TCP","66","59487  >  443 [ACK] Seq=3731 Ack=33315 Win=9198 Len=0 TSval=3163291093 TSecr=2680583756"
"197","11:41:22.565732","2a02:ab88:b:4100:6163:ab1b:4f48:fc2c","2a00:1450:4025:c01::6d","TLSv1.2","292","Client Hello (SNI=imap.gmail.com)"
"198","11:41:22.566087","192.168.0.74","192.87.28.82","TLSv1.2","1474","Application Data, Application Data"
"199","11:41:22.566088","192.168.0.74","192.87.28.82","TCP","1474","59488  >  9001 [ACK] Seq=17225 Ack=2681 Win=6822 Len=1408 TSval=3832160049 TSecr=2692633022 [TCP PDU reassembled in 200]"
"200","11:41:22.566099","192.168.0.74","192.87.28.82","TLSv1.2","400","Application Data"
"201","11:41:22.567565","192.168.0.74","192.87.28.82","TCP","1474","59488  >  9001 [ACK] Seq=18967 Ack=2681 Win=6822 Len=1408 TSval=3832160050 TSecr=2692633022 [TCP PDU reassembled in 203]"
"202","11:41:22.567566","192.168.0.74","192.87.28.82","TCP","1474","59488  >  9001 [ACK] Seq=20375 Ack=2681 Win=6822 Len=1408 TSval=3832160050 TSecr=2692633022 [TCP PDU reassembled in 203]"
"203","11:41:22.567574","192.168.0.74","192.87.28.82","TLSv1.2","1320","Application Data"
"204","11:41:22.567587","192.168.0.74","192.87.28.82","TCP","1474","59488  >  9001 [ACK] Seq=23037 Ack=2681 Win=6822 Len=1408 TSval=3832160050 TSecr=2692633022 [TCP PDU reassembled in 206]"
"205","11:41:22.567588","192.168.0.74","192.87.28.82","TCP","1474","59488  >  9001 [ACK] Seq=24445 Ack=2681 Win=6822 Len=1408 TSval=3832160050 TSecr=2692633022 [TCP PDU reassembled in 206]"
"206","11:41:22.567590","192.168.0.74","192.87.28.82","TLSv1.2","1320","Application Data"
"207","11:41:22.567599","192.168.0.74","192.87.28.82","TCP","1474","59488  >  9001 [ACK] Seq=27107 Ack=2681 Win=6822 Len=1408 TSval=3832160050 TSecr=2692633022 [TCP PDU reassembled in 208]"
"208","11:41:22.567603","192.168.0.74","192.87.28.82","TLSv1.2","864","Application Data"
"209","11:41:22.599056","64.65.63.120","192.168.0.74","TLSv1.2","602","Application Data"
"210","11:41:22.599274","192.168.0.74","64.65.63.120","TCP","66","59487  >  443 [ACK] Seq=3731 Ack=33851 Win=9198 Len=0 TSval=3163291127 TSecr=2680583789"
"211","11:41:22.600222","192.168.0.74","192.87.28.82","TCP","1474","59488  >  9001 [ACK] Seq=29313 Ack=2681 Win=6822 Len=1408 TSval=3832160083 TSecr=2692633022 [TCP PDU reassembled in 212]"
"212","11:41:22.600234","192.168.0.74","192.87.28.82","TLSv1.2","736","Application Data"
"213","11:41:22.605622","192.87.28.82","192.168.0.74","TCP","66","9001  >  59488 [ACK] Seq=2681 Ack=15817 Win=2347 Len=0 TSval=2692633072 TSecr=3832160011"
"214","11:41:22.605624","192.87.28.82","192.168.0.74","TCP","66","9001  >  59488 [ACK] Seq=2681 Ack=18633 Win=2303 Len=0 TSval=2692633072 TSecr=3832160049"
"215","11:41:22.605626","192.87.28.82","192.168.0.74","TCP","66","9001  >  59488 [ACK] Seq=2681 Ack=20375 Win=2325 Len=0 TSval=2692633073 TSecr=3832160049"
"216","11:41:22.605626","192.87.28.82","192.168.0.74","TCP","66","9001  >  59488 [ACK] Seq=2681 Ack=23037 Win=2305 Len=0 TSval=2692633073 TSecr=3832160050"
"217","11:41:22.607781","192.87.28.82","192.168.0.74","TCP","66","9001  >  59488 [ACK] Seq=2681 Ack=25853 Win=2325 Len=0 TSval=2692633074 TSecr=3832160050"
"218","11:41:22.607782","192.87.28.82","192.168.0.74","TCP","66","9001  >  59488 [ACK] Seq=2681 Ack=28515 Win=2325 Len=0 TSval=2692633075 TSecr=3832160050"
"219","11:41:22.612976","2a00:1450:4025:c01::6d","2a02:ab88:b:4100:6163:ab1b:4f48:fc2c","TCP","86","993  >  62797 [ACK] Seq=1 Ack=207 Win=269824 Len=0 TSval=886588078 TSecr=3198103798"
"220","11:41:22.612978","2a00:1450:4025:c01::6d","2a02:ab88:b:4100:6163:ab1b:4f48:fc2c","TLSv1.2","1294","Server Hello"
"221","11:41:22.613116","2a02:ab88:b:4100:6163:ab1b:4f48:fc2c","2a00:1450:4025:c01::6d","TCP","86","62797  >  993 [ACK] Seq=207 Ack=1209 Win=131200 Len=0 TSval=3198103845 TSecr=886588079"
"222","11:41:22.614541","2a00:1450:4025:c01::6d","2a02:ab88:b:4100:6163:ab1b:4f48:fc2c","TCP","1294","993  >  62797 [PSH, ACK] Seq=1209 Ack=207 Win=269824 Len=1208 TSval=886588079 TSecr=3198103798 [TCP PDU reassembled in 225]"
"223","11:41:22.614655","2a02:ab88:b:4100:6163:ab1b:4f48:fc2c","2a00:1450:4025:c01::6d","TCP","86","62797  >  993 [ACK] Seq=207 Ack=2417 Win=130048 Len=0 TSval=3198103846 TSecr=886588079"
"224","11:41:22.614833","2a00:1450:4025:c01::6d","2a02:ab88:b:4100:6163:ab1b:4f48:fc2c","TCP","1294","993  >  62797 [ACK] Seq=2417 Ack=207 Win=269824 Len=1208 TSval=886588079 TSecr=3198103798 [TCP PDU reassembled in 225]"
"225","11:41:22.614834","2a00:1450:4025:c01::6d","2a02:ab88:b:4100:6163:ab1b:4f48:fc2c","TLSv1.2","531","Certificate, Server Key Exchange, Server Hello Done"
"226","11:41:22.614872","2a02:ab88:b:4100:6163:ab1b:4f48:fc2c","2a00:1450:4025:c01::6d","TCP","86","62797  >  993 [ACK] Seq=207 Ack=4070 Win=129472 Len=0 TSval=3198103847 TSecr=886588079"
"227","11:41:22.621947","2a02:ab88:b:4100:6163:ab1b:4f48:fc2c","2a00:1450:4025:c01::6d","TLSv1.2","161","Client Key Exchange"
"228","11:41:22.632454","192.87.28.82","192.168.0.74","TCP","66","9001  >  59488 [ACK] Seq=2681 Ack=30721 Win=2325 Len=0 TSval=2692633102 TSecr=3832160050"
"229","11:41:22.635660","64.65.63.120","192.168.0.74","TLSv1.2","1138","Application Data, Application Data"
"230","11:41:22.635948","192.168.0.74","64.65.63.120","TCP","66","59487  >  443 [ACK] Seq=3731 Ack=34923 Win=9198 Len=0 TSval=3163291164 TSecr=2680583825"
"231","11:41:22.636715","192.168.0.74","64.65.63.120","TLSv1.2","1116","Application Data"
"232","11:41:22.638783","192.168.0.74","192.87.28.82","TCP","1474","59488  >  9001 [ACK] Seq=31391 Ack=2681 Win=6822 Len=1408 TSval=3832160122 TSecr=2692633102 [TCP PDU reassembled in 233]"
"233","11:41:22.638797","192.168.0.74","192.87.28.82","TLSv1.2","736","Application Data"
"234","11:41:22.644282","64.65.63.120","192.168.0.74","TCP","1474","443  >  59487 [ACK] Seq=34923 Ack=3731 Win=3096 Len=1408 TSval=2680583832 TSecr=3163291127 [TCP PDU reassembled in 236]"
"235","11:41:22.644286","64.65.63.120","192.168.0.74","TCP","1474","443  >  59487 [PSH, ACK] Seq=36331 Ack=3731 Win=3096 Len=1408 TSval=2680583832 TSecr=3163291127 [TCP PDU reassembled in 236]"
"236","11:41:22.644288","64.65.63.120","192.168.0.74","TLSv1.2","1474","Application Data"
"237","11:41:22.644290","64.65.63.120","192.168.0.74","TCP","1474","443  >  59487 [PSH, ACK] Seq=39147 Ack=3731 Win=3096 Len=1408 TSval=2680583832 TSecr=3163291127 [TCP PDU reassembled in 239]"
"238","11:41:22.644292","64.65.63.120","192.168.0.74","TCP","1474","443  >  59487 [ACK] Seq=40555 Ack=3731 Win=3096 Len=1408 TSval=2680583832 TSecr=3163291127 [TCP PDU reassembled in 239]"
"239","11:41:22.644293","64.65.63.120","192.168.0.74","TLSv1.2","1474","Application Data"
"240","11:41:22.644295","64.65.63.120","192.168.0.74","TLSv1.2","1474","Application Data"
"241","11:41:22.644297","64.65.63.120","192.168.0.74","TCP","1474","443  >  59487 [PSH, ACK] Seq=44779 Ack=3731 Win=3096 Len=1408 TSval=2680583833 TSecr=3163291127 [TCP PDU reassembled in 248]"
"242","11:41:22.644299","64.65.63.120","192.168.0.74","TCP","1474","443  >  59487 [ACK] Seq=46187 Ack=3731 Win=3096 Len=1408 TSval=2680583833 TSecr=3163291127 [TCP PDU reassembled in 248]"
"243","11:41:22.644301","192.87.28.82","192.168.0.74","TLSv1.2","1116","Application Data"
"244","11:41:22.644508","192.168.0.74","192.87.28.82","TCP","66","59488  >  9001 [ACK] Seq=33469 Ack=3731 Win=6806 Len=0 TSval=3832160127 TSecr=2692633112"
"245","11:41:22.644690","192.168.0.74","64.65.63.120","TCP","66","59487  >  443 [ACK] Seq=4781 Ack=47595 Win=9198 Len=0 TSval=3163291173 TSecr=2680583833"
"246","11:41:22.648553","192.168.0.74","192.87.28.82","TLSv1.2","1474","Application Data"
"247","11:41:22.648576","192.168.0.74","192.87.28.82","TLSv1.2","1272","Application Data"
"248","11:41:22.650121","64.65.63.120","192.168.0.74","TLSv1.2","1474","Application Data, Application Data"
"249","11:41:22.650125","64.65.63.120","192.168.0.74","TCP","1474","443  >  59487 [PSH, ACK] Seq=49003 Ack=3731 Win=3096 Len=1408 TSval=2680583839 TSecr=3163291127 [TCP PDU reassembled in 251]"
"250","11:41:22.650261","192.168.0.74","64.65.63.120","TLSv1.2","602","Application Data"
"251","11:41:22.660495","64.65.63.120","192.168.0.74","TLSv1.2","1474","Application Data"
"252","11:41:22.660499","64.65.63.120","192.168.0.74","TCP","1474","443  >  59487 [PSH, ACK] Seq=51819 Ack=3731 Win=3096 Len=1408 TSval=2680583849 TSecr=3163291127 [TCP PDU reassembled in 254]"
"253","11:41:22.660501","64.65.63.120","192.168.0.74","TCP","1474","443  >  59487 [ACK] Seq=53227 Ack=3731 Win=3096 Len=1408 TSval=2680583849 TSecr=3163291127 [TCP PDU reassembled in 254]"
"254","11:41:22.660503","64.65.63.120","192.168.0.74","TLSv1.2","1474","Application Data"
"255","11:41:22.660505","64.65.63.120","192.168.0.74","TCP","1474","443  >  59487 [PSH, ACK] Seq=56043 Ack=3731 Win=3096 Len=1408 TSval=2680583849 TSecr=3163291127 [TCP PDU reassembled in 262]"
"256","11:41:22.660692","192.168.0.74","64.65.63.120","TCP","66","59487  >  443 [ACK] Seq=5317 Ack=57451 Win=9198 Len=0 TSval=3163291189 TSecr=2680583849"
"257","11:41:22.662179","192.168.0.74","192.87.28.82","TLSv1.2","1474","Application Data, Application Data"
"258","11:41:22.662189","192.168.0.74","192.87.28.82","TLSv1.2","266","Application Data"
"259","11:41:22.668803","64.65.63.120","192.168.0.74","TCP","1474","443  >  59487 [ACK] Seq=57451 Ack=3731 Win=3096 Len=1408 TSval=2680583859 TSecr=3163291127 [TCP PDU reassembled in 262]"
"260","11:41:22.668806","2a00:1450:4025:c01::6d","2a02:ab88:b:4100:6163:ab1b:4f48:fc2c","TCP","86","993  >  62797 [ACK] Seq=4070 Ack=282 Win=269824 Len=0 TSval=886588135 TSecr=3198103854"
"261","11:41:22.668916","2a02:ab88:b:4100:6163:ab1b:4f48:fc2c","2a00:1450:4025:c01::6d","TLSv1.2","137","Change Cipher Spec, Encrypted Handshake Message"
"262","11:41:22.670907","64.65.63.120","192.168.0.74","TLSv1.2","1474","Application Data"
"263","11:41:22.670909","64.65.63.120","192.168.0.74","TLSv1.2","106","Application Data"
"264","11:41:22.671024","192.168.0.74","64.65.63.120","TCP","66","59487  >  443 [ACK] Seq=5317 Ack=60307 Win=9198 Len=0 TSval=3163291199 TSecr=2680583859"
"265","11:41:22.672613","192.87.28.82","192.168.0.74","TLSv1.2","602","Application Data"
"266","11:41:22.672671","192.168.0.74","192.87.28.82","TLSv1.2","1116","Application Data"
"267","11:41:22.674700","192.168.0.74","192.87.28.82","TLSv1.2","1474","Application Data"
"268","11:41:22.674722","192.168.0.74","192.87.28.82","TLSv1.2","758","Application Data"
"269","11:41:22.686006","64.65.63.120","192.168.0.74","TCP","1474","443  >  59487 [ACK] Seq=60307 Ack=4781 Win=3088 Len=1408 TSval=2680583869 TSecr=3163291165 [TCP PDU reassembled in 270]"
"270","11:41:22.686011","64.65.63.120","192.168.0.74","TLSv1.2","1474","Application Data"
"271","11:41:22.687277","64.65.63.120","192.168.0.74","TCP","1474","443  >  59487 [PSH, ACK] Seq=63123 Ack=4781 Win=3088 Len=1408 TSval=2680583875 TSecr=3163291165 [TCP PDU reassembled in 276]"
"272","11:41:22.687281","64.65.63.120","192.168.0.74","TCP","1474","443  >  59487 [ACK] Seq=64531 Ack=4781 Win=3088 Len=1408 TSval=2680583875 TSecr=3163291165 [TCP PDU reassembled in 276]"
"273","11:41:22.687283","192.87.28.82","192.168.0.74","TCP","66","9001  >  59488 [ACK] Seq=4267 Ack=36083 Win=2306 Len=0 TSval=2692633152 TSecr=3832160131"
"274","11:41:22.687539","192.168.0.74","64.65.63.120","TLSv1.2","602","Application Data"
"275","11:41:22.687668","192.168.0.74","64.65.63.120","TCP","66","[TCP Window Update] 59487  >  443 [ACK] Seq=5853 Ack=65939 Win=9198 Len=0 TSval=3163291216 TSecr=2680583875"
"276","11:41:22.699318","64.65.63.120","192.168.0.74","TLSv1.2","1474","Application Data, Application Data"
"277","11:41:22.699397","192.168.0.74","64.65.63.120","TCP","66","59487  >  443 [ACK] Seq=5853 Ack=67347 Win=9176 Len=0 TSval=3163291227 TSecr=2680583889"
"278","11:41:22.700693","192.87.28.82","192.168.0.74","TCP","66","9001  >  59488 [ACK] Seq=4267 Ack=37691 Win=2344 Len=0 TSval=2692633171 TSecr=3832160145"
"279","11:41:22.705728","2a00:1450:4025:c01::6d","2a02:ab88:b:4100:6163:ab1b:4f48:fc2c","TCP","86","993  >  62797 [ACK] Seq=4070 Ack=333 Win=269824 Len=0 TSval=886588173 TSecr=3198103901"
"280","11:41:22.705729","2a00:1450:4025:c01::6d","2a02:ab88:b:4100:6163:ab1b:4f48:fc2c","TLSv1.2","137","Change Cipher Spec, Encrypted Handshake Message"
"281","11:41:22.705730","2a00:1450:4025:c01::6d","2a02:ab88:b:4100:6163:ab1b:4f48:fc2c","TLSv1.2","228","Application Data"
"282","11:41:22.705781","2a02:ab88:b:4100:6163:ab1b:4f48:fc2c","2a00:1450:4025:c01::6d","TCP","86","62797  >  993 [ACK] Seq=333 Ack=4263 Win=130880 Len=0 TSval=3198103938 TSecr=886588173"
"283","11:41:22.706544","2a02:ab88:b:4100:6163:ab1b:4f48:fc2c","2a00:1450:4025:c01::6d","TLSv1.2","134","Application Data"
"284","11:41:22.707399","64.65.63.120","192.168.0.74","TLSv1.2","846","Application Data, Application Data"
"285","11:41:22.707444","192.168.0.74","64.65.63.120","TCP","66","59487  >  443 [ACK] Seq=5853 Ack=68127 Win=9186 Len=0 TSval=3163291235 TSecr=2680583898"
"286","11:41:22.714656","192.168.0.74","192.87.28.82","TLSv1.2","1474","Application Data"
"287","11:41:22.714684","192.168.0.74","192.87.28.82","TLSv1.2","244","Application Data"
