"No.","Time","Source","Destination","Protocol","Length","Info"
"1","11:43:29.465633","192.168.0.74","5.28.195.2","TCP","78","62991  >  443 [SYN, ECE, CWR] Seq=0 Win=65535 Len=0 MSS=1460 WS=16 TSval=3810209669 TSecr=0 SACK_PERM"
"2","11:43:29.465703","192.168.0.74","5.28.195.2","TCP","78","62992  >  80 [SYN, ECE, CWR] Seq=0 Win=65535 Len=0 MSS=1460 WS=16 TSval=497350198 TSecr=0 SACK_PERM"
"3","11:43:29.466047","192.168.0.74","5.28.195.2","TCP","78","62993  >  5222 [SYN, ECE, CWR] Seq=0 Win=65535 Len=0 MSS=1460 WS=16 TSval=1782446235 TSecr=0 SACK_PERM"
"4","11:43:29.466993","CompalBroadb_aa:60:7e","ee:99:94:f5:59:fd","ARP","56","192.168.0.1 is at ac:22:05:aa:60:7e"
"5","11:43:29.502184","5.28.195.2","192.168.0.74","TCP","74","443  >  62991 [SYN, ACK, ECE] Seq=0 Ack=1 Win=65535 Len=0 MSS=1240 SACK_PERM TSval=1730421606 TSecr=3810209669 WS=1024"
"6","11:43:29.502430","192.168.0.74","5.28.195.2","TCP","66","62991  >  443 [ACK] Seq=1 Ack=1 Win=1048560 Len=0 TSval=3810209706 TSecr=1730421606"
"7","11:43:29.502728","192.168.0.74","5.28.195.2","TLSv1","583","Client Hello"
"8","11:43:29.543515","5.28.195.2","192.168.0.74","TCP","66","443  >  62991 [ACK] Seq=1 Ack=518 Win=67584 Len=0 TSval=1730421655 TSecr=3810209706"
"9","11:43:29.543517","5.28.195.2","192.168.0.74","TCP","66","443  >  62991 [FIN, ACK] Seq=1 Ack=518 Win=67584 Len=0 TSval=1730421655 TSecr=3810209706"
"10","11:43:29.543744","192.168.0.74","5.28.195.2","TCP","66","62991  >  443 [ACK] Seq=518 Ack=2 Win=1048560 Len=0 TSval=3810209747 TSecr=1730421655"
"11","11:43:29.543965","192.168.0.74","5.28.195.2","TCP","66","62991  >  443 [FIN, ACK] Seq=518 Ack=2 Win=1048560 Len=0 TSval=3810209748 TSecr=1730421655"
"12","11:43:29.583953","5.28.195.2","192.168.0.74","TCP","56","443  >  62991 [RST] Seq=2 Win=0 Len=0"
"13","11:43:29.641471","149.154.167.41","192.168.0.74","SSL","171","Continuation Data"
"14","11:43:29.641720","192.168.0.74","149.154.167.41","TCP","66","59400  >  443 [ACK] Seq=1 Ack=106 Win=65530 Len=0 TSval=1845402952 TSecr=325115928"
"15","11:43:29.755240","192.168.0.192","230.0.0.1","UDP","92","58107  >  6666 Len=50"
"16","11:43:29.841677","192.168.0.74","64.65.63.120","TLSv1.2","602","Application Data"
"17","11:43:29.886259","64.65.63.120","192.168.0.74","TCP","66","443  >  59487 [ACK] Seq=1 Ack=537 Win=3703 Len=0 TSval=2680711074 TSecr=3163418374"
"18","11:43:29.886400","192.168.0.74","64.65.63.120","TLSv1.2","602","Application Data"
"19","11:43:29.925190","64.65.63.120","192.168.0.74","TCP","66","443  >  59487 [ACK] Seq=1 Ack=1073 Win=3703 Len=0 TSval=2680711114 TSecr=3163418419"
"20","11:43:29.940382","64.65.63.120","192.168.0.74","TLSv1.2","602","Application Data"
"21","11:43:29.940559","192.168.0.74","64.65.63.120","TCP","66","59487  >  443 [ACK] Seq=1073 Ack=537 Win=9190 Len=0 TSval=3163418473 TSecr=2680711127"
"22","11:43:29.979423","64.65.63.120","192.168.0.74","TLSv1.2","602","Application Data"
"23","11:43:29.979526","192.168.0.74","64.65.63.120","TCP","66","59487  >  443 [ACK] Seq=1073 Ack=1073 Win=9190 Len=0 TSval=3163418512 TSecr=2680711167"
"24","11:43:29.979730","192.168.0.74","64.65.63.120","TLSv1.2","602","Application Data"
"25","11:43:30.055644","64.65.63.120","192.168.0.74","TCP","66","443  >  59487 [ACK] Seq=1073 Ack=1609 Win=3703 Len=0 TSval=2680711246 TSecr=3163418512"
"26","11:43:30.062271","192.168.0.192","230.0.0.1","UDP","92","62979  >  6666 Len=50"
"27","11:43:30.466042","192.168.0.74","5.28.195.2","TCP","78","[TCP Retransmission] 62993  >  5222 [SYN] Seq=0 Win=65535 Len=0 MSS=1460 WS=16 TSval=1782447235 TSecr=0 SACK_PERM"
"28","11:43:30.466082","192.168.0.74","5.28.195.2","TCP","78","[TCP Retransmission] 62992  >  80 [SYN] Seq=0 Win=65535 Len=0 MSS=1460 WS=16 TSval=497351199 TSecr=0 SACK_PERM"
"29","11:43:30.784270","192.168.0.192","230.0.0.1","UDP","92","58107  >  6666 Len=50"
"30","11:43:30.923650","192.168.0.74","64.65.63.120","TLSv1.2","602","Application Data"
"31","11:43:30.925054","192.168.0.74","192.87.28.82","TLSv1.2","602","Application Data"
"32","11:43:30.970765","64.65.63.120","192.168.0.74","TCP","66","443  >  59487 [ACK] Seq=1073 Ack=2145 Win=3703 Len=0 TSval=2680712161 TSecr=3163419456"
"33","11:43:30.971029","192.168.0.74","64.65.63.120","TLSv1.2","602","Application Data"
"34","11:43:30.984083","192.168.0.192","230.0.0.1","UDP","92","62979  >  6666 Len=50"
"35","11:43:31.006461","64.65.63.120","192.168.0.74","TCP","66","443  >  59487 [ACK] Seq=1073 Ack=2681 Win=3703 Len=0 TSval=2680712196 TSecr=3163419504"
"36","11:43:31.014371","192.87.28.82","192.168.0.74","TCP","66","9001  >  59488 [ACK] Seq=1 Ack=537 Win=2347 Len=0 TSval=2692761477 TSecr=3832288413"
"37","11:43:31.217590","2a02:ab88:b:4100:6163:ab1b:4f48:fc2c","2603:1063:12::2ec","TLSv1.2","144","Application Data"
"38","11:43:31.233504","64.65.63.120","192.168.0.74","TLSv1.2","602","Application Data"
"39","11:43:31.233604","192.168.0.74","64.65.63.120","TCP","66","59487  >  443 [ACK] Seq=2681 Ack=1609 Win=9190 Len=0 TSval=3163419766 TSecr=2680712422"
"40","11:43:31.252176","2603:1063:12::2ec","2a02:ab88:b:4100:6163:ab1b:4f48:fc2c","TLSv1.2","133","Application Data"
"41","11:43:31.252286","2a02:ab88:b:4100:6163:ab1b:4f48:fc2c","2603:1063:12::2ec","TCP","86","58880  >  443 [ACK] Seq=59 Ack=48 Win=2048 Len=0 TSval=2988313049 TSecr=477102481"
"42","11:43:31.387051","192.168.0.74","192.87.28.82","TLSv1.2","1116","Application Data"
"43","11:43:31.467008","192.168.0.74","5.28.195.2","TCP","78","[TCP Retransmission] 62993  >  5222 [SYN] Seq=0 Win=65535 Len=0 MSS=1460 WS=16 TSval=1782448236 TSecr=0 SACK_PERM"
"44","11:43:31.467070","192.168.0.74","5.28.195.2","TCP","78","[TCP Retransmission] 62992  >  80 [SYN] Seq=0 Win=65535 Len=0 MSS=1460 WS=16 TSval=497352200 TSecr=0 SACK_PERM"
"45","11:43:31.468529","192.87.28.82","192.168.0.74","TCP","66","9001  >  59488 [ACK] Seq=1 Ack=1587 Win=2347 Len=0 TSval=2692761933 TSecr=3832288875"
"46","11:43:31.664677","192.87.28.82","192.168.0.74","TLSv1.2","602","Application Data"
"47","11:43:31.664867","192.168.0.74","192.87.28.82","TCP","66","59488  >  9001 [ACK] Seq=1587 Ack=537 Win=6814 Len=0 TSval=3832289153 TSecr=2692762130"
"48","11:43:31.716682","192.87.28.82","192.168.0.74","TCP","1474","9001  >  59488 [ACK] Seq=537 Ack=1587 Win=2347 Len=1408 TSval=2692762182 TSecr=3832289153 [TCP PDU reassembled in 50]"
"49","11:43:31.716685","192.87.28.82","192.168.0.74","TCP","1474","9001  >  59488 [ACK] Seq=1945 Ack=1587 Win=2347 Len=1408 TSval=2692762182 TSecr=3832289153 [TCP PDU reassembled in 50]"
"50","11:43:31.716686","192.87.28.82","192.168.0.74","TLSv1.2","870","Application Data"
"51","11:43:31.716847","192.168.0.74","192.87.28.82","TCP","66","59488  >  9001 [ACK] Seq=1587 Ack=1945 Win=6800 Len=0 TSval=3832289205 TSecr=2692762182"
"52","11:43:31.716900","192.168.0.74","192.87.28.82","TCP","66","59488  >  9001 [ACK] Seq=1587 Ack=4157 Win=6766 Len=0 TSval=3832289205 TSecr=2692762182"
"53","11:43:31.717070","192.168.0.74","192.87.28.82","TCP","66","[TCP Window Update] 59488  >  9001 [ACK] Seq=1587 Ack=4157 Win=6822 Len=0 TSval=3832289205 TSecr=2692762182"
"54","11:43:31.717356","192.168.0.74","192.87.28.82","TLSv1.2","602","Application Data"
"55","11:43:31.721857","192.87.28.82","192.168.0.74","TCP","1474","9001  >  59488 [ACK] Seq=4157 Ack=1587 Win=2347 Len=1408 TSval=2692762189 TSecr=3832289153 [TCP PDU reassembled in 57]"
"56","11:43:31.721860","192.87.28.82","192.168.0.74","TCP","1474","9001  >  59488 [ACK] Seq=5565 Ack=1587 Win=2347 Len=1408 TSval=2692762189 TSecr=3832289153 [TCP PDU reassembled in 57]"
"57","11:43:31.721862","192.87.28.82","192.168.0.74","TLSv1.2","1320","Application Data"
"58","11:43:31.721863","192.87.28.82","192.168.0.74","TLSv1.2","1474","Application Data"
"59","11:43:31.721865","192.87.28.82","192.168.0.74","TCP","1474","9001  >  59488 [ACK] Seq=9635 Ack=1587 Win=2347 Len=1408 TSval=2692762189 TSecr=3832289153 [TCP PDU reassembled in 60]"
"60","11:43:31.721867","192.87.28.82","192.168.0.74","TLSv1.2","956","Application Data"
"61","11:43:31.721868","192.87.28.82","192.168.0.74","TCP","1474","9001  >  59488 [ACK] Seq=11933 Ack=1587 Win=2347 Len=1408 TSval=2692762191 TSecr=3832289153 [TCP PDU reassembled in 63]"
"62","11:43:31.721870","192.87.28.82","192.168.0.74","TCP","1474","9001  >  59488 [ACK] Seq=13341 Ack=1587 Win=2347 Len=1408 TSval=2692762191 TSecr=3832289153 [TCP PDU reassembled in 63]"
"63","11:43:31.721871","192.87.28.82","192.168.0.74","TLSv1.2","356","Application Data"
"64","11:43:31.722036","192.168.0.74","192.87.28.82","TCP","66","59488  >  9001 [ACK] Seq=2123 Ack=15039 Win=6652 Len=0 TSval=3832289210 TSecr=2692762191"
"65","11:43:31.722630","192.168.0.74","192.87.28.82","TCP","66","[TCP Window Update] 59488  >  9001 [ACK] Seq=2123 Ack=15039 Win=6822 Len=0 TSval=3832289210 TSecr=2692762191"
"66","11:43:31.755009","192.87.28.82","192.168.0.74","TCP","66","9001  >  59488 [ACK] Seq=15039 Ack=2123 Win=2347 Len=0 TSval=2692762223 TSecr=3832289205"
"67","11:43:31.755011","192.87.28.82","192.168.0.74","TCP","66","[TCP Dup ACK 66#1] 9001  >  59488 [ACK] Seq=15039 Ack=2123 Win=2347 Len=0 TSval=2692762223 TSecr=3832289205"
"68","11:43:31.803164","192.168.0.192","230.0.0.1","UDP","92","58107  >  6666 Len=50"
"69","11:43:31.886285","192.87.28.82","192.168.0.74","TCP","1474","9001  >  59488 [ACK] Seq=15039 Ack=2123 Win=2347 Len=1408 TSval=2692762348 TSecr=3832289210 [TCP PDU reassembled in 70]"
"70","11:43:31.886288","192.87.28.82","192.168.0.74","TLSv1.2","736","Application Data"
"71","11:43:31.886430","192.168.0.74","192.87.28.82","TCP","66","59488  >  9001 [ACK] Seq=2123 Ack=17117 Win=6790 Len=0 TSval=3832289374 TSecr=2692762348"
"72","11:43:31.949050","192.87.28.82","192.168.0.74","TLSv1.2","602","Application Data"
"73","11:43:31.949139","192.168.0.74","192.87.28.82","TCP","66","59488  >  9001 [ACK] Seq=2123 Ack=17653 Win=6814 Len=0 TSval=3832289437 TSecr=2692762417"
"74","11:43:31.969740","192.168.0.74","192.87.28.82","TLSv1.2","1116","Application Data"
"75","11:43:32.008016","192.168.0.192","230.0.0.1","UDP","92","62979  >  6666 Len=50"
"76","11:43:32.041762","64.65.63.120","192.168.0.74","TLSv1.2","602","Application Data"
"77","11:43:32.041867","192.168.0.74","64.65.63.120","TCP","66","59487  >  443 [ACK] Seq=2681 Ack=2145 Win=9190 Len=0 TSval=3163420575 TSecr=2680713229"
"78","11:43:32.043704","192.87.28.82","192.168.0.74","TCP","66","9001  >  59488 [ACK] Seq=17653 Ack=3173 Win=2347 Len=0 TSval=2692762512 TSecr=3832289458"
"79","11:43:32.064941","192.168.0.74","192.87.28.82","TLSv1.2","602","Application Data"
"80","11:43:32.074385","192.168.0.74","64.65.63.120","TLSv1.2","602","Application Data"
"81","11:43:32.108854","192.168.0.74","192.87.28.82","TLSv1.2","1474","Application Data"
"82","11:43:32.108872","192.168.0.74","192.87.28.82","TLSv1.2","244","Application Data"
"83","11:43:32.112012","64.65.63.120","192.168.0.74","TCP","66","443  >  59487 [ACK] Seq=2145 Ack=3217 Win=3703 Len=0 TSval=2680713301 TSecr=3163420607"
"84","11:43:32.139397","192.87.28.82","192.168.0.74","TCP","66","9001  >  59488 [ACK] Seq=17653 Ack=3709 Win=2347 Len=0 TSval=2692762607 TSecr=3832289553"
"85","11:43:32.143278","192.87.28.82","192.168.0.74","TCP","66","9001  >  59488 [ACK] Seq=17653 Ack=5295 Win=2323 Len=0 TSval=2692762612 TSecr=3832289597"
"86","11:43:32.143391","192.168.0.74","192.87.28.82","TLSv1.2","1116","Application Data"
"87","11:43:32.171807","64.65.63.120","192.168.0.74","TCP","1474","443  >  59487 [ACK] Seq=2145 Ack=3217 Win=3703 Len=1408 TSval=2680713361 TSecr=3163420607 [TCP PDU reassembled in 89]"
"88","11:43:32.171810","64.65.63.120","192.168.0.74","TCP","1474","443  >  59487 [PSH, ACK] Seq=3553 Ack=3217 Win=3703 Len=1408 TSval=2680713361 TSecr=3163420607 [TCP PDU reassembled in 89]"
"89","11:43:32.171811","64.65.63.120","192.168.0.74","TLSv1.2","870","Application Data"
"90","11:43:32.171921","192.168.0.74","64.65.63.120","TCP","66","59487  >  443 [ACK] Seq=3217 Ack=5765 Win=9142 Len=0 TSval=3163420705 TSecr=2680713361"
"91","11:43:32.172047","192.168.0.74","64.65.63.120","TCP","66","[TCP Window Update] 59487  >  443 [ACK] Seq=3217 Ack=5765 Win=9198 Len=0 TSval=3163420705 TSecr=2680713361"
"92","11:43:32.174829","64.65.63.120","192.168.0.74","TCP","1474","443  >  59487 [ACK] Seq=5765 Ack=3217 Win=3703 Len=1408 TSval=2680713365 TSecr=3163420607 [TCP PDU reassembled in 96]"
"93","11:43:32.174831","64.65.63.120","192.168.0.74","TCP","1474","443  >  59487 [PSH, ACK] Seq=7173 Ack=3217 Win=3703 Len=1408 TSval=2680713365 TSecr=3163420607 [TCP PDU reassembled in 96]"
"94","11:43:32.174904","192.168.0.74","64.65.63.120","TCP","66","59487  >  443 [ACK] Seq=3217 Ack=8581 Win=9154 Len=0 TSval=3163420708 TSecr=2680713365"
"95","11:43:32.174994","192.168.0.74","64.65.63.120","TCP","66","[TCP Window Update] 59487  >  443 [ACK] Seq=3217 Ack=8581 Win=9198 Len=0 TSval=3163420708 TSecr=2680713365"
"96","11:43:32.180466","64.65.63.120","192.168.0.74","TLSv1.2","1474","Application Data, Application Data"
"97","11:43:32.180469","64.65.63.120","192.168.0.74","TCP","1474","443  >  59487 [PSH, ACK] Seq=9989 Ack=3217 Win=3703 Len=1408 TSval=2680713370 TSecr=3163420607 [TCP PDU reassembled in 101]"
"98","11:43:32.180470","64.65.63.120","192.168.0.74","TCP","1474","443  >  59487 [ACK] Seq=11397 Ack=3217 Win=3703 Len=1408 TSval=2680713370 TSecr=3163420607 [TCP PDU reassembled in 101]"
"99","11:43:32.180569","192.168.0.74","64.65.63.120","TCP","66","59487  >  443 [ACK] Seq=3217 Ack=12805 Win=9132 Len=0 TSval=3163420713 TSecr=2680713370"
"100","11:43:32.180702","192.168.0.74","64.65.63.120","TCP","66","[TCP Window Update] 59487  >  443 [ACK] Seq=3217 Ack=12805 Win=9198 Len=0 TSval=3163420714 TSecr=2680713370"
"101","11:43:32.183254","64.65.63.120","192.168.0.74","TLSv1.2","1474","Application Data, Application Data"
"102","11:43:32.183256","64.65.63.120","192.168.0.74","TCP","1474","443  >  59487 [PSH, ACK] Seq=14213 Ack=3217 Win=3703 Len=1408 TSval=2680713373 TSecr=3163420607 [TCP PDU reassembled in 106]"
"103","11:43:32.183344","192.168.0.74","64.65.63.120","TCP","66","59487  >  443 [ACK] Seq=3217 Ack=15621 Win=9154 Len=0 TSval=3163420716 TSecr=2680713373"
"104","11:43:32.183453","192.168.0.74","64.65.63.120","TCP","66","[TCP Window Update] 59487  >  443 [ACK] Seq=3217 Ack=15621 Win=9198 Len=0 TSval=3163420716 TSecr=2680713373"
"105","11:43:32.208963","64.65.63.120","192.168.0.74","TCP","1474","443  >  59487 [ACK] Seq=15621 Ack=3217 Win=3703 Len=1408 TSval=2680713396 TSecr=3163420705 [TCP PDU reassembled in 106]"
"106","11:43:32.208965","64.65.63.120","192.168.0.74","TLSv1.2","1474","Application Data"
"107","11:43:32.208966","64.65.63.120","192.168.0.74","TCP","1474","443  >  59487 [ACK] Seq=18437 Ack=3217 Win=3703 Len=1408 TSval=2680713396 TSecr=3163420705 [TCP PDU reassembled in 109]"
"108","11:43:32.209487","64.65.63.120","192.168.0.74","TCP","1474","443  >  59487 [PSH, ACK] Seq=19845 Ack=3217 Win=3703 Len=1408 TSval=2680713396 TSecr=3163420705 [TCP PDU reassembled in 109]"
"109","11:43:32.209488","64.65.63.120","192.168.0.74","TLSv1.2","1474","Application Data"
"110","11:43:32.209489","64.65.63.120","192.168.0.74","TCP","1474","443  >  59487 [PSH, ACK] Seq=22661 Ack=3217 Win=3703 Len=1408 TSval=2680713396 TSecr=3163420705 [TCP PDU reassembled in 115]"
"111","11:43:32.209584","192.168.0.74","64.65.63.120","TCP","66","59487  >  443 [ACK] Seq=3217 Ack=24069 Win=9066 Len=0 TSval=3163420742 TSecr=2680713396"
"112","11:43:32.209699","192.168.0.74","64.65.63.120","TCP","66","[TCP Window Update] 59487  >  443 [ACK] Seq=3217 Ack=24069 Win=9198 Len=0 TSval=3163420743 TSecr=2680713396"
"113","11:43:32.209816","192.168.0.74","64.65.63.120","TLSv1.2","602","Application Data"
"114","11:43:32.213907","64.65.63.120","192.168.0.74","TCP","1474","443  >  59487 [ACK] Seq=24069 Ack=3217 Win=3703 Len=1408 TSval=2680713402 TSecr=3163420708 [TCP PDU reassembled in 115]"
"115","11:43:32.213909","64.65.63.120","192.168.0.74","TLSv1.2","1474","Application Data"
"116","11:43:32.213911","64.65.63.120","192.168.0.74","TCP","1474","443  >  59487 [ACK] Seq=26885 Ack=3217 Win=3703 Len=1408 TSval=2680713402 TSecr=3163420708 [TCP PDU reassembled in 117]"
"117","11:43:32.213912","64.65.63.120","192.168.0.74","TLSv1.2","1474","Application Data, Application Data"
"118","11:43:32.213913","192.87.28.82","192.168.0.74","TCP","66","9001  >  59488 [ACK] Seq=17653 Ack=6345 Win=2347 Len=0 TSval=2692762685 TSecr=3832289631"
"119","11:43:32.214001","192.168.0.74","64.65.63.120","TCP","66","59487  >  443 [ACK] Seq=3753 Ack=29701 Win=9110 Len=0 TSval=3163420747 TSecr=2680713402"
"120","11:43:32.214131","192.168.0.74","64.65.63.120","TCP","66","[TCP Window Update] 59487  >  443 [ACK] Seq=3753 Ack=29701 Win=9198 Len=0 TSval=3163420747 TSecr=2680713402"
"121","11:43:32.214991","64.65.63.120","192.168.0.74","TCP","1474","443  >  59487 [ACK] Seq=29701 Ack=3217 Win=3703 Len=1408 TSval=2680713406 TSecr=3163420713 [TCP PDU reassembled in 123]"
"122","11:43:32.214992","64.65.63.120","192.168.0.74","TCP","1474","443  >  59487 [PSH, ACK] Seq=31109 Ack=3217 Win=3703 Len=1408 TSval=2680713406 TSecr=3163420713 [TCP PDU reassembled in 123]"
"123","11:43:32.214994","64.65.63.120","192.168.0.74","TLSv1.2","1474","Application Data"
"124","11:43:32.215024","192.168.0.74","64.65.63.120","TCP","66","59487  >  443 [ACK] Seq=3753 Ack=33925 Win=9132 Len=0 TSval=3163420748 TSecr=2680713406"
"125","11:43:32.215129","192.168.0.74","64.65.63.120","TCP","66","[TCP Window Update] 59487  >  443 [ACK] Seq=3753 Ack=33925 Win=9198 Len=0 TSval=3163420748 TSecr=2680713406"
"126","11:43:32.215798","64.65.63.120","192.168.0.74","TLSv1.2","1474","Application Data"
"127","11:43:32.215800","64.65.63.120","192.168.0.74","TCP","1474","443  >  59487 [ACK] Seq=35333 Ack=3217 Win=3703 Len=1408 TSval=2680713406 TSecr=3163420713 [TCP PDU reassembled in 131]"
"128","11:43:32.215801","64.65.63.120","192.168.0.74","TCP","1474","443  >  59487 [PSH, ACK] Seq=36741 Ack=3217 Win=3703 Len=1408 TSval=2680713406 TSecr=3163420713 [TCP PDU reassembled in 131]"
"129","11:43:32.215829","192.168.0.74","64.65.63.120","TCP","66","59487  >  443 [ACK] Seq=3753 Ack=38149 Win=9132 Len=0 TSval=3163420749 TSecr=2680713406"
"130","11:43:32.215885","192.168.0.74","64.65.63.120","TCP","66","[TCP Window Update] 59487  >  443 [ACK] Seq=3753 Ack=38149 Win=9198 Len=0 TSval=3163420749 TSecr=2680713406"
"131","11:43:32.220088","64.65.63.120","192.168.0.74","TLSv1.2","1474","Application Data"
"132","11:43:32.220090","64.65.63.120","192.168.0.74","TCP","1474","443  >  59487 [PSH, ACK] Seq=39557 Ack=3217 Win=3703 Len=1408 TSval=2680713411 TSecr=3163420716 [TCP PDU reassembled in 133]"
"133","11:43:32.220091","64.65.63.120","192.168.0.74","TLSv1.2","1474","Application Data"
"134","11:43:32.220117","192.168.0.74","64.65.63.120","TLSv1.2","602","Application Data"
"135","11:43:32.220181","192.168.0.74","64.65.63.120","TCP","66","[TCP Window Update] 59487  >  443 [ACK] Seq=4289 Ack=42373 Win=9198 Len=0 TSval=3163420753 TSecr=2680713411"
"136","11:43:32.246656","64.65.63.120","192.168.0.74","TCP","1474","443  >  59487 [ACK] Seq=42373 Ack=3217 Win=3703 Len=1408 TSval=2680713435 TSecr=3163420742 [TCP PDU reassembled in 138]"
"137","11:43:32.246658","64.65.63.120","192.168.0.74","TCP","1474","443  >  59487 [PSH, ACK] Seq=43781 Ack=3217 Win=3703 Len=1408 TSval=2680713435 TSecr=3163420742 [TCP PDU reassembled in 138]"
"138","11:43:32.246659","64.65.63.120","192.168.0.74","TLSv1.2","1474","Application Data"
"139","11:43:32.246661","64.65.63.120","192.168.0.74","TCP","1474","443  >  59487 [PSH, ACK] Seq=46597 Ack=3217 Win=3703 Len=1408 TSval=2680713435 TSecr=3163420742 [TCP PDU reassembled in 141]"
"140","11:43:32.246662","64.65.63.120","192.168.0.74","TCP","1474","443  >  59487 [ACK] Seq=48005 Ack=3217 Win=3703 Len=1408 TSval=2680713435 TSecr=3163420743 [TCP PDU reassembled in 141]"
"141","11:43:32.246664","64.65.63.120","192.168.0.74","TLSv1.2","1474","Application Data, Application Data"
"142","11:43:32.246665","64.65.63.120","192.168.0.74","TCP","1474","443  >  59487 [ACK] Seq=50821 Ack=3217 Win=3703 Len=1408 TSval=2680713435 TSecr=3163420743 [TCP PDU reassembled in 146]"
"143","11:43:32.246666","64.65.63.120","192.168.0.74","TCP","1474","443  >  59487 [PSH, ACK] Seq=52229 Ack=3217 Win=3703 Len=1408 TSval=2680713435 TSecr=3163420743 [TCP PDU reassembled in 146]"
"144","11:43:32.246783","192.168.0.74","64.65.63.120","TCP","66","59487  >  443 [ACK] Seq=4289 Ack=53637 Win=9022 Len=0 TSval=3163420780 TSecr=2680713435"
"145","11:43:32.246919","192.168.0.74","64.65.63.120","TCP","66","[TCP Window Update] 59487  >  443 [ACK] Seq=4289 Ack=53637 Win=9198 Len=0 TSval=3163420780 TSecr=2680713435"
"146","11:43:32.251759","64.65.63.120","192.168.0.74","TLSv1.2","1474","Application Data, Application Data"
"147","11:43:32.251762","64.65.63.120","192.168.0.74","TCP","1474","443  >  59487 [PSH, ACK] Seq=55045 Ack=3753 Win=3703 Len=1408 TSval=2680713440 TSecr=3163420747 [TCP PDU reassembled in 149]"
"148","11:43:32.251765","64.65.63.120","192.168.0.74","TCP","1474","443  >  59487 [ACK] Seq=56453 Ack=3753 Win=3703 Len=1408 TSval=2680713440 TSecr=3163420747 [TCP PDU reassembled in 149]"
"149","11:43:32.251768","64.65.63.120","192.168.0.74","TLSv1.2","1474","Application Data"
"150","11:43:32.251770","64.65.63.120","192.168.0.74","TCP","66","443  >  59487 [ACK] Seq=53637 Ack=3753 Win=3703 Len=0 TSval=2680713440 TSecr=3163420743"
"151","11:43:32.251861","192.168.0.74","64.65.63.120","TLSv1.2","602","Application Data"
"152","11:43:32.251908","192.168.0.74","64.65.63.120","TCP","66","[TCP Dup ACK 151#1] 59487  >  443 [ACK] Seq=4825 Ack=59269 Win=9110 Len=0 TSval=3163420785 TSecr=2680713440"
"153","11:43:32.251939","192.168.0.74","64.65.63.120","TCP","66","[TCP Window Update] 59487  >  443 [ACK] Seq=4825 Ack=59269 Win=9198 Len=0 TSval=3163420785 TSecr=2680713440"
"154","11:43:32.253901","64.65.63.120","192.168.0.74","TCP","1474","443  >  59487 [ACK] Seq=59269 Ack=3753 Win=3703 Len=1408 TSval=2680713444 TSecr=3163420748 [TCP PDU reassembled in 155]"
"155","11:43:32.253905","64.65.63.120","192.168.0.74","TLSv1.2","1106","Application Data"
"156","11:43:32.253971","192.168.0.74","64.65.63.120","TCP","66","59487  >  443 [ACK] Seq=4825 Ack=61717 Win=9160 Len=0 TSval=3163420787 TSecr=2680713444"
"157","11:43:32.290566","64.65.63.120","192.168.0.74","TCP","66","443  >  59487 [ACK] Seq=61717 Ack=4825 Win=3703 Len=0 TSval=2680713480 TSecr=3163420753"
"158","11:43:32.290663","192.168.0.74","64.65.63.120","TLSv1.2","602","Application Data"
"159","11:43:32.302391","192.168.0.74","192.87.28.82","TCP","1474","59488  >  9001 [ACK] Seq=6345 Ack=17653 Win=6822 Len=1408 TSval=3832289790 TSecr=2692762685 [TCP PDU reassembled in 160]"
"160","11:43:32.302415","192.168.0.74","192.87.28.82","TLSv1.2","736","Application Data"
"161","11:43:32.303789","192.168.0.74","192.87.28.82","TCP","1474","59488  >  9001 [ACK] Seq=8423 Ack=17653 Win=6822 Len=1408 TSval=3832289792 TSecr=2692762685 [TCP PDU reassembled in 162]"
"162","11:43:32.303802","192.168.0.74","192.87.28.82","TLSv1.2","222","Application Data"
"163","11:43:32.321375","192.87.28.82","192.168.0.74","TLSv1.2","602","Application Data"
"164","11:43:32.321491","192.168.0.74","192.87.28.82","TCP","66","59488  >  9001 [ACK] Seq=9987 Ack=18189 Win=6814 Len=0 TSval=3832289809 TSecr=2692762790"
"165","11:43:32.334126","192.87.28.82","192.168.0.74","TCP","66","9001  >  59488 [ACK] Seq=18189 Ack=8423 Win=2315 Len=0 TSval=2692762803 TSecr=3832289790"
"166","11:43:32.338075","192.87.28.82","192.168.0.74","TCP","66","9001  >  59488 [ACK] Seq=18189 Ack=9987 Win=2322 Len=0 TSval=2692762807 TSecr=3832289792"
"167","11:43:32.366682","64.65.63.120","192.168.0.74","TCP","66","443  >  59487 [ACK] Seq=61717 Ack=5361 Win=3703 Len=0 TSval=2680713557 TSecr=3163420823"
"168","11:43:32.468491","192.168.0.74","5.28.195.2","TCP","78","[TCP Retransmission] 62993  >  5222 [SYN] Seq=0 Win=65535 Len=0 MSS=1460 WS=16 TSval=1782449237 TSecr=0 SACK_PERM"
"169","11:43:32.468535","192.168.0.74","5.28.195.2","TCP","78","[TCP Retransmission] 62992  >  80 [SYN] Seq=0 Win=65535 Len=0 MSS=1460 WS=16 TSval=497353201 TSecr=0 SACK_PERM"
"170","11:43:32.544737","192.87.28.82","192.168.0.74","TLSv1.2","602","Application Data"
"171","11:43:32.544870","192.168.0.74","192.87.28.82","TCP","66","59488  >  9001 [ACK] Seq=9987 Ack=18725 Win=6814 Len=0 TSval=3832290033 TSecr=2692763014"
"172","11:43:32.573979","192.87.28.82","192.168.0.74","TCP","1474","9001  >  59488 [ACK] Seq=18725 Ack=9987 Win=2347 Len=1408 TSval=2692763042 TSecr=3832289809 [TCP PDU reassembled in 174]"
"173","11:43:32.573981","192.87.28.82","192.168.0.74","TCP","1474","9001  >  59488 [ACK] Seq=20133 Ack=9987 Win=2347 Len=1408 TSval=2692763042 TSecr=3832289809 [TCP PDU reassembled in 174]"
"174","11:43:32.573982","192.87.28.82","192.168.0.74","TLSv1.2","1320","Application Data"
"175","11:43:32.574077","192.168.0.74","192.87.28.82","TCP","66","59488  >  9001 [ACK] Seq=9987 Ack=22795 Win=6759 Len=0 TSval=3832290062 TSecr=2692763042"
"176","11:43:32.574192","192.168.0.74","192.87.28.82","TCP","66","[TCP Window Update] 59488  >  9001 [ACK] Seq=9987 Ack=22795 Win=6822 Len=0 TSval=3832290062 TSecr=2692763042"
"177","11:43:32.574306","192.168.0.74","192.87.28.82","TLSv1.2","602","Application Data"
"178","11:43:32.576644","192.168.0.74","64.65.63.120","TLSv1.2","602","Application Data"
"179","11:43:32.583216","192.87.28.82","192.168.0.74","TLSv1.2","1474","Application Data"
"180","11:43:32.583279","192.168.0.74","192.87.28.82","TLSv1.2","602","Application Data"
"181","11:43:32.612994","64.65.63.120","192.168.0.74","TCP","66","443  >  59487 [ACK] Seq=61717 Ack=5897 Win=3703 Len=0 TSval=2680713803 TSecr=3163421109"
"182","11:43:32.616990","192.87.28.82","192.168.0.74","TLSv1.2","1336","Application Data"
"183","11:43:32.617133","192.168.0.74","192.87.28.82","TCP","66","59488  >  9001 [ACK] Seq=11059 Ack=25473 Win=6803 Len=0 TSval=3832290105 TSecr=2692763085"
"184","11:43:32.618761","192.168.0.74","64.65.63.120","TLSv1.2","602","Application Data"
"185","11:43:32.649830","192.87.28.82","192.168.0.74","TLSv1.2","602","Application Data"
"186","11:43:32.649925","192.168.0.74","192.87.28.82","TCP","66","59488  >  9001 [ACK] Seq=11059 Ack=26009 Win=6814 Len=0 TSval=3832290138 TSecr=2692763118"
"187","11:43:32.655454","64.65.63.120","192.168.0.74","TCP","66","443  >  59487 [ACK] Seq=61717 Ack=6433 Win=3703 Len=0 TSval=2680713845 TSecr=3163421152"
"188","11:43:32.689921","192.87.28.82","192.168.0.74","TLSv1.2","602","Application Data"
"189","11:43:32.690018","192.168.0.74","192.87.28.82","TCP","66","59488  >  9001 [ACK] Seq=11059 Ack=26545 Win=6814 Len=0 TSval=3832290178 TSecr=2692763159"
"190","11:43:32.691599","192.168.0.74","192.87.28.82","TLSv1.2","602","Application Data"
"191","11:43:32.765716","192.87.28.82","192.168.0.74","TCP","66","9001  >  59488 [ACK] Seq=26545 Ack=11595 Win=2347 Len=0 TSval=2692763235 TSecr=3832290179"
"192","11:43:32.827252","192.168.0.192","230.0.0.1","UDP","92","58107  >  6666 Len=50"
"193","11:43:32.900863","192.87.28.82","192.168.0.74","TLSv1.2","1116","Application Data"
"194","11:43:32.900959","192.168.0.74","192.87.28.82","TCP","66","59488  >  9001 [ACK] Seq=11595 Ack=27595 Win=6806 Len=0 TSval=3832290389 TSecr=2692763362"
"195","11:43:32.902970","192.168.0.74","64.65.63.120","TLSv1.2","602","Application Data"
"196","11:43:32.906687","64.65.63.120","192.168.0.74","TLSv1.2","602","Application Data"
"197","11:43:32.906752","192.168.0.74","64.65.63.120","TCP","66","59487  >  443 [ACK] Seq=6969 Ack=62253 Win=9190 Len=0 TSval=3163421440 TSecr=2680714097"
"198","11:43:32.907604","192.168.0.74","64.65.63.120","TCP","1474","59487  >  443 [ACK] Seq=6969 Ack=62253 Win=9198 Len=1408 TSval=3163421440 TSecr=2680714097 [TCP PDU reassembled in 199]"
"199","11:43:32.907619","192.168.0.74","64.65.63.120","TLSv1.2","736","Application Data"
"200","11:43:32.938911","64.65.63.120","192.168.0.74","TCP","66","443  >  59487 [ACK] Seq=62253 Ack=6969 Win=3703 Len=0 TSval=2680714129 TSecr=3163421436"
"201","11:43:32.944092","64.65.63.120","192.168.0.74","TLSv1.2","602","Application Data"
"202","11:43:32.944093","64.65.63.120","192.168.0.74","TCP","66","443  >  59487 [ACK] Seq=62789 Ack=9047 Win=3687 Len=0 TSval=2680714135 TSecr=3163421440"
"203","11:43:32.944269","192.168.0.74","64.65.63.120","TCP","66","59487  >  443 [ACK] Seq=9047 Ack=62789 Win=9198 Len=0 TSval=3163421477 TSecr=2680714134"
"204","11:43:32.945018","192.168.0.74","64.65.63.120","TCP","1474","59487  >  443 [ACK] Seq=9047 Ack=62789 Win=9198 Len=1408 TSval=3163421478 TSecr=2680714134 [TCP PDU reassembled in 205]"
"205","11:43:32.945030","192.168.0.74","64.65.63.120","TLSv1.2","736","Application Data"
"206","11:43:32.980626","64.65.63.120","192.168.0.74","TCP","66","443  >  59487 [ACK] Seq=62789 Ack=11125 Win=3671 Len=0 TSval=2680714171 TSecr=3163421478"
"207","11:43:33.032124","192.168.0.192","230.0.0.1","UDP","92","62979  >  6666 Len=50"
"208","11:43:33.056370","192.87.28.82","192.168.0.74","TLSv1.2","602","Application Data"
"209","11:43:33.056499","192.168.0.74","192.87.28.82","TCP","66","59488  >  9001 [ACK] Seq=11595 Ack=28131 Win=6814 Len=0 TSval=3832290544 TSecr=2692763524"
"210","11:43:33.057343","192.168.0.74","192.87.28.82","TCP","1474","59488  >  9001 [ACK] Seq=11595 Ack=28131 Win=6822 Len=1408 TSval=3832290545 TSecr=2692763524 [TCP PDU reassembled in 211]"
"211","11:43:33.057363","192.168.0.74","192.87.28.82","TLSv1.2","736","Application Data"
"212","11:43:33.096692","192.87.28.82","192.168.0.74","TCP","66","9001  >  59488 [ACK] Seq=28131 Ack=13673 Win=2315 Len=0 TSval=2692763560 TSecr=3832290545"
"213","11:43:33.236463","64.65.63.120","192.168.0.74","TCP","1474","443  >  59487 [ACK] Seq=62789 Ack=11125 Win=3671 Len=1408 TSval=2680714416 TSecr=3163421478 [TCP PDU reassembled in 215]"
"214","11:43:33.236467","64.65.63.120","192.168.0.74","TCP","1474","443  >  59487 [PSH, ACK] Seq=64197 Ack=11125 Win=3671 Len=1408 TSval=2680714416 TSecr=3163421478 [TCP PDU reassembled in 215]"
"215","11:43:33.236471","64.65.63.120","192.168.0.74","TLSv1.2","1320","Application Data"
"216","11:43:33.236905","192.168.0.74","64.65.63.120","TCP","66","59487  >  443 [ACK] Seq=11125 Ack=66859 Win=9198 Len=0 TSval=3163421770 TSecr=2680714416"
"217","11:43:33.237381","192.168.0.74","64.65.63.120","TLSv1.2","602","Application Data"
"218","11:43:33.240206","192.168.0.74","64.65.63.120","TCP","1474","59487  >  443 [ACK] Seq=11661 Ack=66859 Win=9198 Len=1408 TSval=3163421773 TSecr=2680714416 [TCP PDU reassembled in 219]"
"219","11:43:33.240252","192.168.0.74","64.65.63.120","TLSv1.2","736","Application Data"
"220","11:43:33.272253","64.65.63.120","192.168.0.74","TLSv1.2","152","Application Data"
"221","11:43:33.272621","192.168.0.74","64.65.63.120","TCP","66","59487  >  443 [ACK] Seq=13739 Ack=66945 Win=9198 Len=0 TSval=3163421805 TSecr=2680714462"
"222","11:43:33.276331","64.65.63.120","192.168.0.74","TCP","66","443  >  59487 [ACK] Seq=66945 Ack=13739 Win=3651 Len=0 TSval=2680714466 TSecr=3163421770"
"223","11:43:33.276447","192.168.0.74","64.65.63.120","TLSv1.2","602","Application Data"
"224","11:43:33.277033","192.168.0.74","64.65.63.120","TCP","1474","59487  >  443 [ACK] Seq=14275 Ack=66945 Win=9198 Len=1408 TSval=3163421810 TSecr=2680714466 [TCP PDU reassembled in 225]"
"225","11:43:33.277053","192.168.0.74","64.65.63.120","TLSv1.2","736","Application Data"
"226","11:43:33.337987","192.87.28.82","192.168.0.74","TCP","1474","9001  >  59488 [ACK] Seq=28131 Ack=13673 Win=2347 Len=1408 TSval=2692763805 TSecr=3832290545 [TCP PDU reassembled in 228]"
"227","11:43:33.337992","192.87.28.82","192.168.0.74","TCP","1474","9001  >  59488 [ACK] Seq=29539 Ack=13673 Win=2347 Len=1408 TSval=2692763805 TSecr=3832290545 [TCP PDU reassembled in 228]"
"228","11:43:33.337996","192.87.28.82","192.168.0.74","TLSv1.2","870","Application Data"
"229","11:43:33.338251","192.168.0.74","192.87.28.82","TCP","66","59488  >  9001 [ACK] Seq=13673 Ack=31751 Win=6766 Len=0 TSval=3832290826 TSecr=2692763805"
"230","11:43:33.338511","192.168.0.74","192.87.28.82","TCP","66","[TCP Window Update] 59488  >  9001 [ACK] Seq=13673 Ack=31751 Win=6822 Len=0 TSval=3832290826 TSecr=2692763805"
"231","11:43:33.342438","192.168.0.74","192.87.28.82","TLSv1.2","602","Application Data"
"232","11:43:33.344053","192.168.0.74","192.87.28.82","TCP","1474","59488  >  9001 [ACK] Seq=14209 Ack=31751 Win=6822 Len=1408 TSval=3832290832 TSecr=2692763805 [TCP PDU reassembled in 233]"
"233","11:43:33.344086","192.168.0.74","192.87.28.82","TLSv1.2","736","Application Data"
"234","11:43:33.352502","64.65.63.120","192.168.0.74","TCP","66","443  >  59487 [ACK] Seq=66945 Ack=16353 Win=3631 Len=0 TSval=2680714543 TSecr=3163421809"
"235","11:43:33.380852","192.87.28.82","192.168.0.74","TCP","66","9001  >  59488 [ACK] Seq=31751 Ack=15617 Win=2325 Len=0 TSval=2692763849 TSecr=3832290830"
"236","11:43:33.419315","192.87.28.82","192.168.0.74","TCP","66","9001  >  59488 [ACK] Seq=31751 Ack=16287 Win=2347 Len=0 TSval=2692763889 TSecr=3832290832"
"237","11:43:33.461113","192.87.28.82","192.168.0.74","TLSv1.2","602","Application Data"
"238","11:43:33.461587","192.168.0.74","192.87.28.82","TCP","66","59488  >  9001 [ACK] Seq=16287 Ack=32287 Win=6822 Len=0 TSval=3832290949 TSecr=2692763923"
"239","11:43:33.464248","192.168.0.74","192.87.28.82","TCP","1474","59488  >  9001 [ACK] Seq=16287 Ack=32287 Win=6822 Len=1408 TSval=3832290952 TSecr=2692763923 [TCP PDU reassembled in 240]"
"240","11:43:33.464293","192.168.0.74","192.87.28.82","TLSv1.2","736","Application Data"
"241","11:43:33.469293","192.168.0.74","5.28.195.2","TCP","78","[TCP Retransmission] 62993  >  5222 [SYN] Seq=0 Win=65535 Len=0 MSS=1460 WS=16 TSval=1782450238 TSecr=0 SACK_PERM"
"242","11:43:33.469326","192.168.0.74","5.28.195.2","TCP","78","[TCP Retransmission] 62992  >  80 [SYN] Seq=0 Win=65535 Len=0 MSS=1460 WS=16 TSval=497354202 TSecr=0 SACK_PERM"
"243","11:43:33.500491","192.87.28.82","192.168.0.74","TCP","66","9001  >  59488 [ACK] Seq=32287 Ack=18365 Win=2315 Len=0 TSval=2692763968 TSecr=3832290952"
"244","11:43:33.619699","192.87.28.82","192.168.0.74","TLSv1.2","602","Application Data"
"245","11:43:33.619913","192.168.0.74","192.87.28.82","TCP","66","59488  >  9001 [ACK] Seq=18365 Ack=32823 Win=6814 Len=0 TSval=3832291108 TSecr=2692764088"
"246","11:43:33.640299","64.65.63.120","192.168.0.74","TCP","1474","443  >  59487 [ACK] Seq=66945 Ack=16353 Win=3631 Len=1408 TSval=2680714830 TSecr=3163421809 [TCP PDU reassembled in 248]"
"247","11:43:33.640303","64.65.63.120","192.168.0.74","TCP","1474","443  >  59487 [PSH, ACK] Seq=68353 Ack=16353 Win=3631 Len=1408 TSval=2680714830 TSecr=3163421809 [TCP PDU reassembled in 248]"
"248","11:43:33.640305","64.65.63.120","192.168.0.74","TLSv1.2","870","Application Data"
"249","11:43:33.640672","192.168.0.74","64.65.63.120","TCP","66","59487  >  443 [ACK] Seq=16353 Ack=70565 Win=9198 Len=0 TSval=3163422173 TSecr=2680714830"
"250","11:43:33.643156","192.168.0.74","64.65.63.120","TLSv1.2","602","Application Data"
"251","11:43:33.646296","192.168.0.74","64.65.63.120","TLSv1.2","1474","Application Data"
"252","11:43:33.646320","192.168.0.74","64.65.63.120","TLSv1.2","244","Application Data"
"253","11:43:33.658329","64.65.63.120","192.168.0.74","TCP","1474","443  >  59487 [ACK] Seq=70565 Ack=16353 Win=3631 Len=1408 TSval=2680714848 TSecr=3163421809 [TCP PDU reassembled in 256]"
"254","11:43:33.658336","64.65.63.120","192.168.0.74","TCP","1474","443  >  59487 [PSH, ACK] Seq=71973 Ack=16353 Win=3631 Len=1408 TSval=2680714848 TSecr=3163421809 [TCP PDU reassembled in 256]"
"255","11:43:33.658597","192.168.0.74","64.65.63.120","TCP","66","59487  >  443 [ACK] Seq=18475 Ack=73381 Win=9198 Len=0 TSval=3163422191 TSecr=2680714848"
"256","11:43:33.675655","64.65.63.120","192.168.0.74","TLSv1.2","870","Application Data"
"257","11:43:33.675889","192.168.0.74","64.65.63.120","TCP","66","59487  >  443 [ACK] Seq=18475 Ack=74185 Win=9198 Len=0 TSval=3163422209 TSecr=2680714865"
"258","11:43:33.679530","64.65.63.120","192.168.0.74","TCP","66","443  >  59487 [ACK] Seq=74185 Ack=16889 Win=3627 Len=0 TSval=2680714870 TSecr=3163422176"
"259","11:43:33.679990","192.168.0.74","64.65.63.120","TLSv1.2","1474","Application Data"
"260","11:43:33.680022","192.168.0.74","64.65.63.120","TLSv1.2","758","Application Data"
"261","11:43:33.684160","64.65.63.120","192.168.0.74","TCP","66","443  >  59487 [ACK] Seq=74185 Ack=18475 Win=3615 Len=0 TSval=2680714874 TSecr=3163422179"
"262","11:43:33.715993","64.65.63.120","192.168.0.74","TCP","66","443  >  59487 [ACK] Seq=74185 Ack=20575 Win=3599 Len=0 TSval=2680714905 TSecr=3163422213"
"263","11:43:33.731813","64.65.63.120","192.168.0.74","TLSv1.2","602","Application Data"
"264","11:43:33.731817","192.87.28.82","192.168.0.74","TLSv1.2","602","Application Data"
"265","11:43:33.732255","192.168.0.74","192.87.28.82","TCP","66","59488  >  9001 [ACK] Seq=18365 Ack=33359 Win=6822 Len=0 TSval=3832291220 TSecr=2692764200"
"266","11:43:33.732446","192.168.0.74","64.65.63.120","TCP","66","59487  >  443 [ACK] Seq=20575 Ack=74721 Win=9198 Len=0 TSval=3163422265 TSecr=2680714921"
"267","11:43:33.733484","192.168.0.74","64.65.63.120","TLSv1.2","602","Application Data"
"268","11:43:33.802094","fe80::ae22:5ff:feaa:607e","2a02:ab88:b:4100:6163:ab1b:4f48:fc2c","ICMPv6","86","Neighbor Solicitation for 2a02:ab88:b:4100:6163:ab1b:4f48:fc2c from ac:22:05:aa:60:7e"
"269","11:43:33.802302","fe80::49c:fb07:3c9a:aa62","fe80::ae22:5ff:feaa:607e","ICMPv6","78","Neighbor Advertisement 2a02:ab88:b:4100:6163:ab1b:4f48:fc2c (sol)"
"270","11:43:33.808515","192.87.28.82","192.168.0.74","TLSv1.2","602","Application Data"
"271","11:43:33.808931","192.168.0.74","192.87.28.82","TCP","66","59488  >  9001 [ACK] Seq=18365 Ack=33895 Win=6822 Len=0 TSval=3832291297 TSecr=2692764277"
"272","11:43:33.813722","64.65.63.120","192.168.0.74","TCP","66","443  >  59487 [ACK] Seq=74721 Ack=21111 Win=3595 Len=0 TSval=2680715004 TSecr=3163422266"
"273","11:43:33.851352","192.168.0.192","230.0.0.1","UDP","92","58107  >  6666 Len=50"
"274","11:43:33.883586","192.87.28.82","192.168.0.74","TCP","1474","9001  >  59488 [ACK] Seq=33895 Ack=18365 Win=2347 Len=1408 TSval=2692764352 TSecr=3832291297 [TCP PDU reassembled in 276]"
"275","11:43:33.883590","192.87.28.82","192.168.0.74","TCP","1474","9001  >  59488 [ACK] Seq=35303 Ack=18365 Win=2347 Len=1408 TSval=2692764352 TSecr=3832291297 [TCP PDU reassembled in 276]"
"276","11:43:33.883593","192.87.28.82","192.168.0.74","TLSv1.2","870","Application Data"
"277","11:43:33.884157","192.168.0.74","192.87.28.82","TCP","66","59488  >  9001 [ACK] Seq=18365 Ack=37515 Win=6822 Len=0 TSval=3832291372 TSecr=2692764352"
"278","11:43:33.887759","192.168.0.74","192.87.28.82","TLSv1.2","602","Application Data"
"279","11:43:33.889638","192.168.0.74","192.87.28.82","TCP","1474","59488  >  9001 [ACK] Seq=18901 Ack=37515 Win=6822 Len=1408 TSval=3832291378 TSecr=2692764352 [TCP PDU reassembled in 280]"
"280","11:43:33.889658","192.168.0.74","192.87.28.82","TLSv1.2","736","Application Data"
"281","11:43:33.923938","192.87.28.82","192.168.0.74","TCP","66","9001  >  59488 [ACK] Seq=37515 Ack=20309 Win=2317 Len=0 TSval=2692764393 TSecr=3832291376"
"282","11:43:33.963321","192.87.28.82","192.168.0.74","TCP","66","9001  >  59488 [ACK] Seq=37515 Ack=20979 Win=2347 Len=0 TSval=2692764433 TSecr=3832291378"
"283","11:43:33.974169","64.65.63.120","192.168.0.74","TLSv1.2","602","Application Data"
"284","11:43:33.974591","192.168.0.74","64.65.63.120","TCP","66","59487  >  443 [ACK] Seq=21111 Ack=75257 Win=9198 Len=0 TSval=3163422507 TSecr=2680715164"
"285","11:43:34.056245","192.168.0.192","230.0.0.1","UDP","92","62979  >  6666 Len=50"
"286","11:43:34.159134","192.87.28.82","192.168.0.74","TLSv1.2","602","Application Data"
"287","11:43:34.159570","192.168.0.74","192.87.28.82","TCP","66","59488  >  9001 [ACK] Seq=20979 Ack=38051 Win=6822 Len=0 TSval=3832291647 TSecr=2692764628"
