"No.","Time","Source","Destination","Protocol","Length","Info"
"1","11:33:11.170644","192.168.0.227","5.28.195.2","TCP","78","60333  >  5222 [SYN] Seq=0 Win=65535 Len=0 MSS=1460 WS=16 TSval=3933158834 TSecr=0 SACK_PERM"
"2","11:33:11.170722","192.168.0.227","5.28.195.2","TCP","78","60332  >  80 [SYN] Seq=0 Win=65535 Len=0 MSS=1460 WS=16 TSval=1823013587 TSecr=0 SACK_PERM"
"3","11:33:11.723060","192.168.0.227","64.65.63.120","TLSv1.2","602","Application Data"
"4","11:33:11.760107","64.65.63.120","192.168.0.227","TCP","66","443  >  55087 [ACK] Seq=1 Ack=537 Win=460 Len=0 TSval=2577707386 TSecr=1559889041"
"5","11:33:13.166595","192.168.0.227","5.28.195.2","TCP","78","60335  >  443 [SYN, ECE, CWR] Seq=0 Win=65535 Len=0 MSS=1460 WS=16 TSval=1072753680 TSecr=0 SACK_PERM"
"6","11:33:13.166889","192.168.0.227","5.28.195.2","TCP","78","60336  >  80 [SYN, ECE, CWR] Seq=0 Win=65535 Len=0 MSS=1460 WS=16 TSval=572336386 TSecr=0 SACK_PERM"
"7","11:33:13.167026","192.168.0.227","5.28.195.2","TCP","78","60337  >  5222 [SYN, ECE, CWR] Seq=0 Win=65535 Len=0 MSS=1460 WS=16 TSval=1440647972 TSecr=0 SACK_PERM"
"8","11:33:13.204713","5.28.195.2","192.168.0.227","TCP","74","443  >  60335 [SYN, ACK, ECE] Seq=0 Ack=1 Win=65535 Len=0 MSS=1240 SACK_PERM TSval=2971030052 TSecr=1072753680 WS=1024"
"9","11:33:13.204859","192.168.0.227","5.28.195.2","TCP","66","60335  >  443 [ACK] Seq=1 Ack=1 Win=1048560 Len=0 TSval=1072753718 TSecr=2971030052"
"10","11:33:13.205067","192.168.0.227","5.28.195.2","TLSv1","583","Client Hello"
"11","11:33:13.248634","5.28.195.2","192.168.0.227","TCP","66","443  >  60335 [ACK] Seq=1 Ack=518 Win=67584 Len=0 TSval=2971030094 TSecr=1072753718"
"12","11:33:13.248636","5.28.195.2","192.168.0.227","TCP","66","443  >  60335 [FIN, ACK] Seq=1 Ack=518 Win=67584 Len=0 TSval=2971030094 TSecr=1072753718"
"13","11:33:13.248762","192.168.0.227","5.28.195.2","TCP","66","60335  >  443 [ACK] Seq=518 Ack=2 Win=1048560 Len=0 TSval=1072753762 TSecr=2971030094"
"14","11:33:13.248950","192.168.0.227","5.28.195.2","TCP","66","60335  >  443 [FIN, ACK] Seq=518 Ack=2 Win=1048560 Len=0 TSval=1072753762 TSecr=2971030094"
"15","11:33:13.288875","5.28.195.2","192.168.0.227","TCP","56","443  >  60335 [RST] Seq=2 Win=0 Len=0"
"16","11:33:14.167092","192.168.0.227","5.28.195.2","TCP","78","[TCP Retransmission] 60337  >  5222 [SYN] Seq=0 Win=65535 Len=0 MSS=1460 WS=16 TSval=1440648972 TSecr=0 SACK_PERM"
"17","11:33:14.167174","192.168.0.227","5.28.195.2","TCP","78","[TCP Retransmission] 60336  >  80 [SYN] Seq=0 Win=65535 Len=0 MSS=1460 WS=16 TSval=572337386 TSecr=0 SACK_PERM"
"18","11:33:15.097337","192.87.28.82","192.168.0.227","TLSv1.2","602","Application Data"
"19","11:33:15.097616","192.168.0.227","192.87.28.82","TCP","66","55094  >  9001 [ACK] Seq=1 Ack=537 Win=7012 Len=0 TSval=4101920214 TSecr=2014569134"
"20","11:33:15.168293","192.168.0.227","5.28.195.2","TCP","78","[TCP Retransmission] 60337  >  5222 [SYN] Seq=0 Win=65535 Len=0 MSS=1460 WS=16 TSval=1440649973 TSecr=0 SACK_PERM"
"21","11:33:15.168353","192.168.0.227","5.28.195.2","TCP","78","[TCP Retransmission] 60336  >  80 [SYN] Seq=0 Win=65535 Len=0 MSS=1460 WS=16 TSval=572338387 TSecr=0 SACK_PERM"
"22","11:33:15.196931","16:a5:8a:ab:88:c1","Broadcast","ARP","42","Who has 192.168.0.87? Tell 192.168.0.220"
"23","11:33:15.473511","192.168.0.227","192.87.28.82","TCP","54","[TCP Keep-Alive] 55094  >  9001 [ACK] Seq=0 Ack=537 Win=7020 Len=0"
"24","11:33:15.520810","192.87.28.82","192.168.0.227","TCP","66","[TCP Keep-Alive ACK] 9001  >  55094 [ACK] Seq=537 Ack=1 Win=1043 Len=0 TSval=2014569672 TSecr=4101920214"
"25","11:33:16.168752","192.168.0.227","5.28.195.2","TCP","78","[TCP Retransmission] 60337  >  5222 [SYN] Seq=0 Win=65535 Len=0 MSS=1460 WS=16 TSval=1440650974 TSecr=0 SACK_PERM"
"26","11:33:16.168830","192.168.0.227","5.28.195.2","TCP","78","[TCP Retransmission] 60336  >  80 [SYN] Seq=0 Win=65535 Len=0 MSS=1460 WS=16 TSval=572339388 TSecr=0 SACK_PERM"
"27","11:33:16.220577","16:a5:8a:ab:88:c1","Broadcast","ARP","42","Who has 192.168.0.87? Tell 192.168.0.220"
"28","11:33:16.222323","192.168.0.227","5.28.195.2","TCP","78","60338  >  443 [SYN, ECE, CWR] Seq=0 Win=65535 Len=0 MSS=1460 WS=16 TSval=3160736924 TSecr=0 SACK_PERM"
"29","11:33:16.261773","5.28.195.2","192.168.0.227","TCP","74","443  >  60338 [SYN, ACK, ECE] Seq=0 Ack=1 Win=65535 Len=0 MSS=1240 SACK_PERM TSval=2564698233 TSecr=3160736924 WS=1024"
"30","11:33:16.262022","192.168.0.227","5.28.195.2","TCP","66","60338  >  443 [ACK] Seq=1 Ack=1 Win=1048560 Len=0 TSval=3160736964 TSecr=2564698233"
"31","11:33:16.262228","192.168.0.227","5.28.195.2","TLSv1","583","Client Hello"
"32","11:33:16.293080","2a01:b740:1361:101::c","2a02:ab88:b:4100:4977:d98a:d5e5:5d47","TLSv1.2","125","Application Data"
"33","11:33:16.293085","2a01:b740:1361:101::c","2a02:ab88:b:4100:4977:d98a:d5e5:5d47","TLSv1.2","110","Application Data"
"34","11:33:16.293700","2a02:ab88:b:4100:4977:d98a:d5e5:5d47","2a01:b740:1361:101::c","TCP","86","51362  >  443 [ACK] Seq=1 Ack=65 Win=2048 Len=0 TSval=3743526395 TSecr=2095450665"
"35","11:33:16.293963","2a02:ab88:b:4100:4977:d98a:d5e5:5d47","2a01:b740:1361:101::c","TLSv1.2","125","Application Data"
"36","11:33:16.294575","2a02:ab88:b:4100:4977:d98a:d5e5:5d47","2a01:b740:1361:101::c","TLSv1.2","110","Application Data"
"37","11:33:16.295268","2a02:ab88:b:4100:4977:d98a:d5e5:5d47","2a01:b740:1361:101::c","TCP","86","51362  >  443 [FIN, ACK] Seq=64 Ack=65 Win=2048 Len=0 TSval=3743526397 TSecr=2095450665"
"38","11:33:16.306747","5.28.195.2","192.168.0.227","TCP","66","443  >  60338 [ACK] Seq=1 Ack=518 Win=67584 Len=0 TSval=2564698276 TSecr=3160736965"
"39","11:33:16.306750","5.28.195.2","192.168.0.227","TCP","66","443  >  60338 [FIN, ACK] Seq=1 Ack=518 Win=67584 Len=0 TSval=2564698276 TSecr=3160736965"
"40","11:33:16.307033","192.168.0.227","5.28.195.2","TCP","66","60338  >  443 [ACK] Seq=518 Ack=2 Win=1048560 Len=0 TSval=3160737009 TSecr=2564698276"
"41","11:33:16.307329","192.168.0.227","5.28.195.2","TCP","66","60338  >  443 [FIN, ACK] Seq=518 Ack=2 Win=1048560 Len=0 TSval=3160737010 TSecr=2564698276"
"42","11:33:16.345182","5.28.195.2","192.168.0.227","TCP","56","443  >  60338 [RST] Seq=2 Win=0 Len=0"
"43","11:33:16.937614","2a01:b740:1361:101::c","2a02:ab88:b:4100:4977:d98a:d5e5:5d47","TCP","86","443  >  51362 [ACK] Seq=65 Ack=40 Win=31 Len=0 TSval=2095451003 TSecr=3743526395"
"44","11:33:16.937619","2a01:b740:1361:101::c","2a02:ab88:b:4100:4977:d98a:d5e5:5d47","TCP","86","443  >  51362 [ACK] Seq=65 Ack=64 Win=31 Len=0 TSval=2095451003 TSecr=3743526396"
"45","11:33:16.937621","2a01:b740:1361:101::c","2a02:ab88:b:4100:4977:d98a:d5e5:5d47","TCP","86","443  >  51362 [ACK] Seq=65 Ack=65 Win=31 Len=0 TSval=2095451003 TSecr=3743526397"
"46","11:33:17.011626","149.154.167.41","192.168.0.227","SSL","171","Continuation Data"
"47","11:33:17.011897","192.168.0.227","149.154.167.41","TCP","66","59561  >  443 [ACK] Seq=1 Ack=106 Win=65530 Len=0 TSval=2751908719 TSecr=659424168"
"48","11:33:17.168955","192.168.0.227","5.28.195.2","TCP","78","[TCP Retransmission] 60337  >  5222 [SYN] Seq=0 Win=65535 Len=0 MSS=1460 WS=16 TSval=1440651974 TSecr=0 SACK_PERM"
"49","11:33:17.169038","192.168.0.227","5.28.195.2","TCP","78","[TCP Retransmission] 60336  >  80 [SYN] Seq=0 Win=65535 Len=0 MSS=1460 WS=16 TSval=572340388 TSecr=0 SACK_PERM"
"50","11:33:17.244771","16:a5:8a:ab:88:c1","Broadcast","ARP","42","Who has 192.168.0.87? Tell 192.168.0.220"
"51","11:33:17.264938","192.168.0.227","149.154.167.41","TCP","54","[TCP Keep-Alive] 59561  >  443 [ACK] Seq=0 Ack=106 Win=65535 Len=0"
"52","11:33:17.303544","149.154.167.41","192.168.0.227","TCP","66","[TCP Keep-Alive ACK] 443  >  59561 [ACK] Seq=106 Ack=1 Win=3991 Len=0 TSval=659424459 TSecr=2751908719"
"53","11:33:18.169689","16:a5:8a:ab:88:c1","Broadcast","ARP","42","Who has 192.168.0.87? Tell 192.168.0.220"
"54","11:33:18.557956","192.168.0.227","64.65.63.120","TLSv1.2","602","Application Data"
"55","11:33:18.597559","64.65.63.120","192.168.0.227","TCP","66","443  >  55087 [ACK] Seq=1 Ack=1073 Win=456 Len=0 TSval=2577714224 TSecr=1559895876"
"56","11:33:19.149181","192.168.0.227","5.28.195.2","TCP","78","60339  >  443 [SYN, ECE, CWR] Seq=0 Win=65535 Len=0 MSS=1460 WS=16 TSval=931262275 TSecr=0 SACK_PERM"
"57","11:33:19.168101","192.168.0.227","5.28.195.2","TCP","78","60340  >  443 [SYN, ECE, CWR] Seq=0 Win=65535 Len=0 MSS=1460 WS=16 TSval=2140826762 TSecr=0 SACK_PERM"
"58","11:33:19.168136","192.168.0.227","5.28.195.2","TCP","78","60342  >  80 [SYN, ECE, CWR] Seq=0 Win=65535 Len=0 MSS=1460 WS=16 TSval=4247345871 TSecr=0 SACK_PERM"
"59","11:33:19.168137","192.168.0.227","5.28.195.2","TCP","78","60341  >  5222 [SYN, ECE, CWR] Seq=0 Win=65535 Len=0 MSS=1460 WS=16 TSval=729366256 TSecr=0 SACK_PERM"
"60","11:33:19.185886","5.28.195.2","192.168.0.227","TCP","74","443  >  60339 [SYN, ACK, ECE] Seq=0 Ack=1 Win=65535 Len=0 MSS=1240 SACK_PERM TSval=1879370160 TSecr=931262275 WS=1024"
"61","11:33:19.186165","192.168.0.227","5.28.195.2","TCP","66","60339  >  443 [ACK] Seq=1 Ack=1 Win=1048560 Len=0 TSval=931262312 TSecr=1879370160"
"62","11:33:19.186494","192.168.0.227","5.28.195.2","TLSv1","583","Client Hello"
"63","11:33:19.190232","16:a5:8a:ab:88:c1","Broadcast","ARP","42","Who has 192.168.0.87? Tell 192.168.0.220"
"64","11:33:19.207397","5.28.195.2","192.168.0.227","TCP","74","443  >  60340 [SYN, ACK, ECE] Seq=0 Ack=1 Win=65535 Len=0 MSS=1240 SACK_PERM TSval=2120140414 TSecr=2140826762 WS=1024"
"65","11:33:19.207545","192.168.0.227","5.28.195.2","TCP","66","60340  >  443 [ACK] Seq=1 Ack=1 Win=1048560 Len=0 TSval=2140826802 TSecr=2120140414"
"66","11:33:19.207766","192.168.0.227","5.28.195.2","TLSv1","583","Client Hello"
"67","11:33:19.226069","5.28.195.2","192.168.0.227","TCP","66","443  >  60339 [ACK] Seq=1 Ack=518 Win=67584 Len=0 TSval=1879370200 TSecr=931262313"
"68","11:33:19.226071","5.28.195.2","192.168.0.227","TCP","66","443  >  60339 [FIN, ACK] Seq=1 Ack=518 Win=67584 Len=0 TSval=1879370200 TSecr=931262313"
"69","11:33:19.226265","192.168.0.227","5.28.195.2","TCP","66","60339  >  443 [ACK] Seq=518 Ack=2 Win=1048560 Len=0 TSval=931262353 TSecr=1879370200"
"70","11:33:19.226513","192.168.0.227","5.28.195.2","TCP","66","60339  >  443 [FIN, ACK] Seq=518 Ack=2 Win=1048560 Len=0 TSval=931262353 TSecr=1879370200"
"71","11:33:19.250237","5.28.195.2","192.168.0.227","TCP","66","443  >  60340 [ACK] Seq=1 Ack=518 Win=67584 Len=0 TSval=2120140520 TSecr=2140826802"
"72","11:33:19.250240","5.28.195.2","192.168.0.227","TCP","66","443  >  60340 [FIN, ACK] Seq=1 Ack=518 Win=67584 Len=0 TSval=2120140520 TSecr=2140826802"
"73","11:33:19.250402","192.168.0.227","5.28.195.2","TCP","66","60340  >  443 [ACK] Seq=518 Ack=2 Win=1048560 Len=0 TSval=2140826845 TSecr=2120140520"
"74","11:33:19.250661","192.168.0.227","5.28.195.2","TCP","66","60340  >  443 [FIN, ACK] Seq=518 Ack=2 Win=1048560 Len=0 TSval=2140826845 TSecr=2120140520"
"75","11:33:19.267509","5.28.195.2","192.168.0.227","TCP","56","443  >  60339 [RST] Seq=2 Win=0 Len=0"
"76","11:33:19.293525","5.28.195.2","192.168.0.227","TCP","56","443  >  60340 [RST] Seq=2 Win=0 Len=0"
"77","11:33:19.440065","192.168.0.227","192.87.28.82","TLSv1.2","602","Application Data"
"78","11:33:19.520933","192.87.28.82","192.168.0.227","TCP","66","9001  >  55094 [ACK] Seq=537 Ack=537 Win=1043 Len=0 TSval=2014573674 TSecr=4101924557"
"79","11:33:19.525053","192.87.28.82","192.168.0.227","TLSv1.2","602","Application Data"
"80","11:33:19.525169","192.168.0.227","192.87.28.82","TCP","66","55094  >  9001 [ACK] Seq=537 Ack=1073 Win=7012 Len=0 TSval=4101924642 TSecr=2014573678"
"81","11:33:19.526137","192.168.0.227","192.87.28.82","TCP","1474","55094  >  9001 [ACK] Seq=537 Ack=1073 Win=7020 Len=1408 TSval=4101924643 TSecr=2014573678 [TCP PDU reassembled in 82]"
"82","11:33:19.526155","192.168.0.227","192.87.28.82","TLSv1.2","736","Application Data"
"83","11:33:19.578874","192.87.28.82","192.168.0.227","TCP","66","9001  >  55094 [ACK] Seq=1073 Ack=2615 Win=1011 Len=0 TSval=2014573719 TSecr=4101924643"
"84","11:33:19.616517","192.87.28.82","192.168.0.227","TCP","1474","9001  >  55094 [ACK] Seq=1073 Ack=2615 Win=1043 Len=1408 TSval=2014573766 TSecr=4101924643 [TCP PDU reassembled in 86]"
"85","11:33:19.616521","192.87.28.82","192.168.0.227","TCP","1474","9001  >  55094 [ACK] Seq=2481 Ack=2615 Win=1043 Len=1408 TSval=2014573766 TSecr=4101924643 [TCP PDU reassembled in 86]"
"86","11:33:19.616523","192.87.28.82","192.168.0.227","TLSv1.2","356","Application Data"
"87","11:33:19.616716","192.168.0.227","192.87.28.82","TCP","66","55094  >  9001 [ACK] Seq=2615 Ack=2481 Win=6998 Len=0 TSval=4101924733 TSecr=2014573766"
"88","11:33:19.616762","192.168.0.227","192.87.28.82","TCP","66","55094  >  9001 [ACK] Seq=2615 Ack=4179 Win=6972 Len=0 TSval=4101924733 TSecr=2014573766"
"89","11:33:19.616852","192.168.0.227","192.87.28.82","TCP","66","[TCP Window Update] 55094  >  9001 [ACK] Seq=2615 Ack=4179 Win=7020 Len=0 TSval=4101924733 TSecr=2014573766"
"90","11:33:19.629560","192.87.28.82","192.168.0.227","TCP","1474","9001  >  55094 [ACK] Seq=4179 Ack=2615 Win=1043 Len=1408 TSval=2014573784 TSecr=4101924643 [TCP PDU reassembled in 94]"
"91","11:33:19.629564","192.87.28.82","192.168.0.227","TCP","1474","9001  >  55094 [ACK] Seq=5587 Ack=2615 Win=1043 Len=1408 TSval=2014573784 TSecr=4101924643 [TCP PDU reassembled in 94]"
"92","11:33:19.629725","192.168.0.227","192.87.28.82","TCP","66","55094  >  9001 [ACK] Seq=2615 Ack=6995 Win=6976 Len=0 TSval=4101924746 TSecr=2014573784"
"93","11:33:19.629837","192.168.0.227","192.87.28.82","TCP","66","[TCP Window Update] 55094  >  9001 [ACK] Seq=2615 Ack=6995 Win=7020 Len=0 TSval=4101924746 TSecr=2014573784"
"94","11:33:19.663967","192.87.28.82","192.168.0.227","TLSv1.2","1406","Application Data, Application Data"
"95","11:33:19.664087","192.168.0.227","192.87.28.82","TCP","66","55094  >  9001 [ACK] Seq=2615 Ack=8335 Win=7000 Len=0 TSval=4101924781 TSecr=2014573817"
"96","11:33:19.680989","192.168.0.227","64.65.63.120","TLSv1.2","602","Application Data"
"97","11:33:19.681037","192.168.0.227","192.87.28.82","TLSv1.2","1116","Application Data"
"98","11:33:19.717785","192.87.28.82","192.168.0.227","TLSv1.2","602","Application Data"
"99","11:33:19.718025","192.168.0.227","192.87.28.82","TLSv1.2","602","Application Data"
"100","11:33:19.721086","64.65.63.120","192.168.0.227","TCP","66","443  >  55087 [ACK] Seq=1 Ack=1609 Win=456 Len=0 TSval=2577715348 TSecr=1559896999"
"101","11:33:19.726188","64.65.63.120","192.168.0.227","TLSv1.2","602","Application Data"
"102","11:33:19.726356","192.168.0.227","64.65.63.120","TCP","66","55087  >  443 [ACK] Seq=1609 Ack=537 Win=7430 Len=0 TSval=1559897045 TSecr=2577715349"
"103","11:33:19.727107","192.168.0.227","64.65.63.120","TLSv1.2","602","Application Data"
"104","11:33:19.756214","192.87.28.82","192.168.0.227","TLSv1.2","1116","Application Data"
"105","11:33:19.756478","192.168.0.227","192.87.28.82","TLSv1.2","602","Application Data"
"106","11:33:19.803861","192.87.28.82","192.168.0.227","TLSv1.2","602","Application Data"
"107","11:33:19.804077","192.168.0.227","192.87.28.82","TLSv1.2","602","Application Data"
"108","11:33:19.809979","64.65.63.120","192.168.0.227","TCP","66","443  >  55087 [ACK] Seq=537 Ack=2145 Win=464 Len=0 TSval=2577715437 TSecr=1559897046"
"109","11:33:19.816231","64.65.63.120","192.168.0.227","TLSv1.2","602","Application Data"
"110","11:33:19.816355","192.168.0.227","64.65.63.120","TCP","66","55087  >  443 [ACK] Seq=2145 Ack=1073 Win=7430 Len=0 TSval=1559897135 TSecr=2577715442"
"111","11:33:19.817263","192.168.0.227","64.65.63.120","TLSv1.2","602","Application Data"
"112","11:33:19.850030","64.65.63.120","192.168.0.227","TCP","66","443  >  55087 [ACK] Seq=1073 Ack=2681 Win=460 Len=0 TSval=2577715479 TSecr=1559897136"
"113","11:33:19.850075","192.87.28.82","192.168.0.227","TCP","1474","9001  >  55094 [ACK] Seq=10457 Ack=5273 Win=1043 Len=1408 TSval=2014574005 TSecr=4101924920 [TCP PDU reassembled in 117]"
"114","11:33:19.850077","192.87.28.82","192.168.0.227","TCP","1474","9001  >  55094 [ACK] Seq=11865 Ack=5273 Win=1043 Len=1408 TSval=2014574005 TSecr=4101924920 [TCP PDU reassembled in 117]"
"115","11:33:19.850286","192.168.0.227","192.87.28.82","TCP","66","55094  >  9001 [ACK] Seq=5273 Ack=13273 Win=6976 Len=0 TSval=4101924967 TSecr=2014574005"
"116","11:33:19.850432","192.168.0.227","192.87.28.82","TCP","66","[TCP Window Update] 55094  >  9001 [ACK] Seq=5273 Ack=13273 Win=7020 Len=0 TSval=4101924967 TSecr=2014574005"
"117","11:33:19.851271","192.87.28.82","192.168.0.227","TLSv1.2","356","Application Data"
"118","11:33:19.851309","192.168.0.227","192.87.28.82","TCP","66","55094  >  9001 [ACK] Seq=5273 Ack=13563 Win=7016 Len=0 TSval=4101924968 TSecr=2014574005"
"119","11:33:19.853885","64.65.63.120","192.168.0.227","TCP","66","[TCP Window Update] 443  >  55087 [ACK] Seq=1073 Ack=2681 Win=464 Len=0 TSval=2577715483 TSecr=1559897136"
"120","11:33:19.864271","192.87.28.82","192.168.0.227","TCP","1474","9001  >  55094 [ACK] Seq=13563 Ack=5273 Win=1043 Len=1408 TSval=2014574018 TSecr=4101924920 [TCP PDU reassembled in 124]"
"121","11:33:19.864274","192.87.28.82","192.168.0.227","TCP","1474","9001  >  55094 [ACK] Seq=14971 Ack=5273 Win=1043 Len=1408 TSval=2014574018 TSecr=4101924920 [TCP PDU reassembled in 124]"
"122","11:33:19.864414","192.168.0.227","192.87.28.82","TCP","66","55094  >  9001 [ACK] Seq=5273 Ack=16379 Win=6976 Len=0 TSval=4101924981 TSecr=2014574018"
"123","11:33:19.864506","192.168.0.227","192.87.28.82","TCP","66","[TCP Window Update] 55094  >  9001 [ACK] Seq=5273 Ack=16379 Win=7020 Len=0 TSval=4101924981 TSecr=2014574018"
"124","11:33:19.869314","192.87.28.82","192.168.0.227","TLSv1.2","1474","Application Data"
"125","11:33:19.869486","192.168.0.227","192.87.28.82","TCP","66","55094  >  9001 [ACK] Seq=5273 Ack=17787 Win=6998 Len=0 TSval=4101924986 TSecr=2014574023"
"126","11:33:19.889747","192.87.28.82","192.168.0.227","TLSv1.2","1474","Application Data"
"127","11:33:19.889750","192.87.28.82","192.168.0.227","TCP","1474","9001  >  55094 [ACK] Seq=19195 Ack=5273 Win=1043 Len=1408 TSval=2014574043 TSecr=4101924968 [TCP PDU reassembled in 132]"
"128","11:33:19.889752","192.87.28.82","192.168.0.227","TCP","1474","9001  >  55094 [ACK] Seq=20603 Ack=5273 Win=1043 Len=1408 TSval=2014574043 TSecr=4101924968 [TCP PDU reassembled in 132]"
"129","11:33:19.889900","192.168.0.227","192.87.28.82","TCP","66","55094  >  9001 [ACK] Seq=5273 Ack=22011 Win=6954 Len=0 TSval=4101925006 TSecr=2014574043"
"130","11:33:19.890066","192.168.0.227","192.87.28.82","TCP","66","[TCP Window Update] 55094  >  9001 [ACK] Seq=5273 Ack=22011 Win=7020 Len=0 TSval=4101925007 TSecr=2014574043"
"131","11:33:19.890293","192.168.0.227","192.87.28.82","TLSv1.2","602","Application Data"
"132","11:33:19.898761","192.87.28.82","192.168.0.227","TLSv1.2","1474","Application Data, Application Data"
"133","11:33:19.898880","192.168.0.227","192.87.28.82","TCP","66","55094  >  9001 [ACK] Seq=5809 Ack=23419 Win=6998 Len=0 TSval=4101925015 TSecr=2014574053"
"134","11:33:19.920237","64.65.63.120","192.168.0.227","TLSv1.2","602","Application Data"
"135","11:33:19.920351","192.168.0.227","64.65.63.120","TCP","66","55087  >  443 [ACK] Seq=2681 Ack=1609 Win=7430 Len=0 TSval=1559897239 TSecr=2577715549"
"136","11:33:19.920724","192.168.0.227","64.65.63.120","TLSv1.2","602","Application Data"
"137","11:33:19.930216","192.87.28.82","192.168.0.227","TLSv1.2","86","Application Data"
"138","11:33:19.930339","192.168.0.227","192.87.28.82","TCP","66","55094  >  9001 [ACK] Seq=5809 Ack=23439 Win=7020 Len=0 TSval=4101925047 TSecr=2014574085"
"139","11:33:19.930942","192.168.0.227","192.87.28.82","TLSv1.2","602","Application Data"
"140","11:33:19.943395","192.168.0.227","192.87.28.82","TLSv1.2","1474","Application Data"
"141","11:33:19.943423","192.168.0.227","192.87.28.82","TLSv1.2","1272","Application Data"
"142","11:33:19.957682","64.65.63.120","192.168.0.227","TCP","66","443  >  55087 [ACK] Seq=1609 Ack=3217 Win=460 Len=0 TSval=2577715586 TSecr=1559897239"
"143","11:33:19.964253","192.168.0.227","192.87.28.82","TLSv1.2","1474","Application Data"
"144","11:33:19.964255","192.168.0.227","192.87.28.82","TCP","1474","55094  >  9001 [ACK] Seq=10367 Ack=23439 Win=7020 Len=1408 TSval=4101925081 TSecr=2014574085 [TCP PDU reassembled in 146]"
"145","11:33:19.964255","192.168.0.227","192.87.28.82","TCP","1474","55094  >  9001 [ACK] Seq=11775 Ack=23439 Win=7020 Len=1408 TSval=4101925081 TSecr=2014574085 [TCP PDU reassembled in 146]"
"146","11:33:19.964274","192.168.0.227","192.87.28.82","TLSv1.2","448","Application Data"
"147","11:33:19.976279","192.87.28.82","192.168.0.227","TCP","66","9001  >  55094 [ACK] Seq=23439 Ack=7753 Win=1021 Len=0 TSval=2014574131 TSecr=4101925047"
"148","11:33:19.998405","192.87.28.82","192.168.0.227","TCP","66","9001  >  55094 [ACK] Seq=23439 Ack=10367 Win=1021 Len=0 TSval=2014574153 TSecr=4101925060"
"149","11:33:19.998407","192.87.28.82","192.168.0.227","TCP","66","9001  >  55094 [ACK] Seq=23439 Ack=13183 Win=1021 Len=0 TSval=2014574153 TSecr=4101925081"
"150","11:33:20.031075","64.65.63.120","192.168.0.227","TLSv1.2","602","Application Data"
"151","11:33:20.031199","192.168.0.227","64.65.63.120","TCP","66","55087  >  443 [ACK] Seq=3217 Ack=2145 Win=7430 Len=0 TSval=1559897350 TSecr=2577715660"
"152","11:33:20.031384","192.168.0.227","64.65.63.120","TLSv1.2","602","Application Data"
"153","11:33:20.050164","192.87.28.82","192.168.0.227","TCP","1474","9001  >  55094 [ACK] Seq=23439 Ack=13565 Win=1043 Len=1408 TSval=2014574204 TSecr=4101925081 [TCP PDU reassembled in 154]"
"154","11:33:20.050166","192.87.28.82","192.168.0.227","TLSv1.2","222","Application Data"
"155","11:33:20.050326","192.168.0.227","192.87.28.82","TLSv1.2","152","Application Data"
"156","11:33:20.063475","192.87.28.82","192.168.0.227","TCP","1474","9001  >  55094 [ACK] Seq=25003 Ack=13565 Win=1043 Len=1408 TSval=2014574218 TSecr=4101925081 [TCP PDU reassembled in 161]"
"157","11:33:20.063477","192.87.28.82","192.168.0.227","TCP","1474","9001  >  55094 [ACK] Seq=26411 Ack=13565 Win=1043 Len=1408 TSval=2014574218 TSecr=4101925081 [TCP PDU reassembled in 161]"
"158","11:33:20.063479","64.65.63.120","192.168.0.227","TCP","66","443  >  55087 [ACK] Seq=2145 Ack=3753 Win=460 Len=0 TSval=2577715694 TSecr=1559897350"
"159","11:33:20.063623","192.168.0.227","192.87.28.82","TCP","66","55094  >  9001 [ACK] Seq=13651 Ack=27819 Win=6976 Len=0 TSval=4101925180 TSecr=2014574218"
"160","11:33:20.063707","192.168.0.227","192.87.28.82","TCP","66","[TCP Window Update] 55094  >  9001 [ACK] Seq=13651 Ack=27819 Win=7020 Len=0 TSval=4101925180 TSecr=2014574218"
"161","11:33:20.067642","192.87.28.82","192.168.0.227","TLSv1.2","1474","Application Data"
"162","11:33:20.067734","192.168.0.227","192.87.28.82","TCP","66","55094  >  9001 [ACK] Seq=13651 Ack=29227 Win=6998 Len=0 TSval=4101925184 TSecr=2014574221"
"163","11:33:20.070749","192.87.28.82","192.168.0.227","TLSv1.2","1474","Application Data"
"164","11:33:20.070751","192.87.28.82","192.168.0.227","TCP","1474","9001  >  55094 [ACK] Seq=30635 Ack=13565 Win=1043 Len=1408 TSval=2014574224 TSecr=4101925081 [TCP PDU reassembled in 167]"
"165","11:33:20.070842","192.168.0.227","192.87.28.82","TCP","66","55094  >  9001 [ACK] Seq=13651 Ack=32043 Win=6976 Len=0 TSval=4101925187 TSecr=2014574224"
"166","11:33:20.070909","192.168.0.227","192.87.28.82","TCP","66","[TCP Window Update] 55094  >  9001 [ACK] Seq=13651 Ack=32043 Win=7020 Len=0 TSval=4101925187 TSecr=2014574224"
"167","11:33:20.077529","192.87.28.82","192.168.0.227","TLSv1.2","1474","Application Data"
"168","11:33:20.077530","192.87.28.82","192.168.0.227","TCP","1474","9001  >  55094 [ACK] Seq=33451 Ack=13565 Win=1043 Len=1408 TSval=2014574231 TSecr=4101925081 [TCP PDU reassembled in 170]"
"169","11:33:20.077531","192.87.28.82","192.168.0.227","TCP","1474","9001  >  55094 [ACK] Seq=34859 Ack=13565 Win=1043 Len=1408 TSval=2014574231 TSecr=4101925081 [TCP PDU reassembled in 170]"
"170","11:33:20.077533","192.87.28.82","192.168.0.227","TLSv1.2","1474","Application Data"
"171","11:33:20.077533","192.87.28.82","192.168.0.227","TCP","1474","9001  >  55094 [ACK] Seq=37675 Ack=13565 Win=1043 Len=1408 TSval=2014574231 TSecr=4101925081 [TCP PDU reassembled in 174]"
"172","11:33:20.077628","192.168.0.227","192.87.28.82","TCP","66","55094  >  9001 [ACK] Seq=13651 Ack=39083 Win=6910 Len=0 TSval=4101925194 TSecr=2014574231"
"173","11:33:20.077699","192.168.0.227","192.87.28.82","TCP","66","[TCP Window Update] 55094  >  9001 [ACK] Seq=13651 Ack=39083 Win=7020 Len=0 TSval=4101925194 TSecr=2014574231"
"174","11:33:20.095788","192.87.28.82","192.168.0.227","TLSv1.2","1474","Application Data"
"175","11:33:20.095791","192.87.28.82","192.168.0.227","TCP","1474","9001  >  55094 [ACK] Seq=40491 Ack=13651 Win=1043 Len=1408 TSval=2014574239 TSecr=4101925167 [TCP PDU reassembled in 176]"
"176","11:33:20.095793","192.87.28.82","192.168.0.227","TLSv1.2","1474","Application Data"
"177","11:33:20.095794","192.87.28.82","192.168.0.227","TCP","1474","9001  >  55094 [ACK] Seq=43307 Ack=13651 Win=1043 Len=1408 TSval=2014574244 TSecr=4101925167 [TCP PDU reassembled in 181]"
"178","11:33:20.095796","192.87.28.82","192.168.0.227","TCP","1474","9001  >  55094 [ACK] Seq=44715 Ack=13651 Win=1043 Len=1408 TSval=2014574244 TSecr=4101925167 [TCP PDU reassembled in 181]"
"179","11:33:20.095976","192.168.0.227","192.87.28.82","TLSv1.2","602","Application Data"
"180","11:33:20.096114","192.168.0.227","192.87.28.82","TCP","66","[TCP Window Update] 55094  >  9001 [ACK] Seq=14187 Ack=46123 Win=7020 Len=0 TSval=4101925213 TSecr=2014574244"
"181","11:33:20.096890","192.87.28.82","192.168.0.227","TLSv1.2","1474","Application Data, Application Data"
"182","11:33:20.096893","192.87.28.82","192.168.0.227","TCP","1474","9001  >  55094 [ACK] Seq=47531 Ack=13651 Win=1043 Len=1408 TSval=2014574249 TSecr=4101925167 [TCP PDU reassembled in 184]"
"183","11:33:20.096974","192.168.0.227","192.87.28.82","TCP","66","55094  >  9001 [ACK] Seq=14187 Ack=48939 Win=7020 Len=0 TSval=4101925214 TSecr=2014574249"
"184","11:33:20.098449","192.87.28.82","192.168.0.227","TLSv1.2","1474","Application Data"
"185","11:33:20.099224","192.87.28.82","192.168.0.227","TCP","1474","9001  >  55094 [ACK] Seq=50347 Ack=13651 Win=1043 Len=1408 TSval=2014574253 TSecr=4101925180 [TCP PDU reassembled in 188]"
"186","11:33:20.099227","192.87.28.82","192.168.0.227","TCP","1474","9001  >  55094 [ACK] Seq=51755 Ack=13651 Win=1043 Len=1408 TSval=2014574253 TSecr=4101925180 [TCP PDU reassembled in 188]"
"187","11:33:20.099297","192.168.0.227","192.87.28.82","TCP","66","55094  >  9001 [ACK] Seq=14187 Ack=53163 Win=7020 Len=0 TSval=4101925216 TSecr=2014574253"
"188","11:33:20.100647","192.87.28.82","192.168.0.227","TLSv1.2","1474","Application Data"
"189","11:33:20.100648","192.87.28.82","192.168.0.227","TCP","1474","9001  >  55094 [ACK] Seq=54571 Ack=13651 Win=1043 Len=1408 TSval=2014574254 TSecr=4101925184 [TCP PDU reassembled in 191]"
"190","11:33:20.100729","192.168.0.227","192.87.28.82","TCP","66","55094  >  9001 [ACK] Seq=14187 Ack=55979 Win=7020 Len=0 TSval=4101925217 TSecr=2014574254"
"191","11:33:20.102984","192.87.28.82","192.168.0.227","TLSv1.2","1474","Application Data"
"192","11:33:20.103912","192.87.28.82","192.168.0.227","TCP","1474","9001  >  55094 [ACK] Seq=57387 Ack=13651 Win=1043 Len=1408 TSval=2014574258 TSecr=4101925187 [TCP PDU reassembled in 195]"
"193","11:33:20.103915","192.87.28.82","192.168.0.227","TCP","1474","9001  >  55094 [ACK] Seq=58795 Ack=13651 Win=1043 Len=1408 TSval=2014574258 TSecr=4101925187 [TCP PDU reassembled in 195]"
"194","11:33:20.104019","192.168.0.227","192.87.28.82","TLSv1.2","602","Application Data"
"195","11:33:20.114430","192.87.28.82","192.168.0.227","TLSv1.2","1474","Application Data"
"196","11:33:20.114432","192.87.28.82","192.168.0.227","TCP","1474","9001  >  55094 [ACK] Seq=61611 Ack=13651 Win=1043 Len=1408 TSval=2014574268 TSecr=4101925194 [TCP PDU reassembled in 197]"
"197","11:33:20.114433","192.87.28.82","192.168.0.227","TLSv1.2","1474","Application Data"
"198","11:33:20.114435","192.87.28.82","192.168.0.227","TCP","1474","9001  >  55094 [ACK] Seq=64427 Ack=13651 Win=1043 Len=1408 TSval=2014574268 TSecr=4101925194 [TCP PDU reassembled in 201]"
"199","11:33:20.114626","192.168.0.227","192.87.28.82","TCP","66","55094  >  9001 [ACK] Seq=14723 Ack=65835 Win=7020 Len=0 TSval=4101925231 TSecr=2014574268"
"200","11:33:20.132964","192.87.28.82","192.168.0.227","TCP","1474","9001  >  55094 [ACK] Seq=65835 Ack=14187 Win=1035 Len=1408 TSval=2014574286 TSecr=4101925212 [TCP PDU reassembled in 201]"
"201","11:33:20.132966","192.87.28.82","192.168.0.227","TLSv1.2","1474","Application Data"
"202","11:33:20.132968","192.87.28.82","192.168.0.227","TCP","1474","9001  >  55094 [ACK] Seq=68651 Ack=14187 Win=1035 Len=1408 TSval=2014574286 TSecr=4101925212 [TCP PDU reassembled in 204]"
"203","11:33:20.132969","192.87.28.82","192.168.0.227","TCP","1474","9001  >  55094 [ACK] Seq=70059 Ack=14187 Win=1035 Len=1408 TSval=2014574286 TSecr=4101925212 [TCP PDU reassembled in 204]"
"204","11:33:20.132970","192.87.28.82","192.168.0.227","TLSv1.2","1474","Application Data, Application Data"
"205","11:33:20.132971","192.87.28.82","192.168.0.227","TCP","1474","9001  >  55094 [ACK] Seq=72875 Ack=14187 Win=1035 Len=1408 TSval=2014574286 TSecr=4101925214 [TCP PDU reassembled in 207]"
"206","11:33:20.132972","192.87.28.82","192.168.0.227","TCP","1474","9001  >  55094 [ACK] Seq=74283 Ack=14187 Win=1035 Len=1408 TSval=2014574286 TSecr=4101925214 [TCP PDU reassembled in 207]"
"207","11:33:20.132974","192.87.28.82","192.168.0.227","TLSv1.2","1474","Application Data"
"208","11:33:20.132974","192.87.28.82","192.168.0.227","TCP","1474","9001  >  55094 [ACK] Seq=77099 Ack=14187 Win=1035 Len=1408 TSval=2014574286 TSecr=4101925216 [TCP PDU reassembled in 209]"
"209","11:33:20.132976","192.87.28.82","192.168.0.227","TLSv1.2","1474","Application Data"
"210","11:33:20.133159","192.168.0.227","192.87.28.82","TCP","66","55094  >  9001 [ACK] Seq=14723 Ack=79915 Win=6800 Len=0 TSval=4101925250 TSecr=2014574287"
"211","11:33:20.133342","192.168.0.227","192.87.28.82","TCP","66","[TCP Window Update] 55094  >  9001 [ACK] Seq=14723 Ack=79915 Win=7020 Len=0 TSval=4101925250 TSecr=2014574287"
"212","11:33:20.135050","192.87.28.82","192.168.0.227","TCP","1474","9001  >  55094 [ACK] Seq=79915 Ack=14187 Win=1043 Len=1408 TSval=2014574290 TSecr=4101925217 [TCP PDU reassembled in 227]"
"213","11:33:20.135052","192.87.28.82","192.168.0.227","TCP","1474","9001  >  55094 [ACK] Seq=81323 Ack=14187 Win=1043 Len=1408 TSval=2014574290 TSecr=4101925217 [TCP PDU reassembled in 227]"
"214","11:33:20.135100","192.168.0.227","192.87.28.82","TLSv1.2","602","Application Data"
"215","11:33:20.135155","192.168.0.227","192.87.28.82","TCP","66","[TCP Window Update] 55094  >  9001 [ACK] Seq=15259 Ack=82731 Win=7020 Len=0 TSval=4101925252 TSecr=2014574290"
"216","11:33:20.161177","64.65.63.120","192.168.0.227","TCP","1474","443  >  55087 [ACK] Seq=2145 Ack=3753 Win=464 Len=1408 TSval=2577715788 TSecr=1559897350 [TCP PDU reassembled in 218]"
"217","11:33:20.161179","64.65.63.120","192.168.0.227","TCP","1474","443  >  55087 [PSH, ACK] Seq=3553 Ack=3753 Win=464 Len=1408 TSval=2577715788 TSecr=1559897350 [TCP PDU reassembled in 218]"
"218","11:33:20.161181","64.65.63.120","192.168.0.227","TLSv1.2","1320","Application Data"
"219","11:33:20.161182","64.65.63.120","192.168.0.227","TLSv1.2","1474","Application Data"
"220","11:33:20.161183","64.65.63.120","192.168.0.227","TCP","1474","443  >  55087 [PSH, ACK] Seq=7623 Ack=3753 Win=464 Len=1408 TSval=2577715788 TSecr=1559897350 [TCP PDU reassembled in 222]"
"221","11:33:20.161184","64.65.63.120","192.168.0.227","TCP","1474","443  >  55087 [ACK] Seq=9031 Ack=3753 Win=464 Len=1408 TSval=2577715788 TSecr=1559897350 [TCP PDU reassembled in 222]"
"222","11:33:20.161185","64.65.63.120","192.168.0.227","TLSv1.2","1474","Application Data"
"223","11:33:20.161324","192.168.0.227","64.65.63.120","TCP","66","55087  >  443 [ACK] Seq=3753 Ack=11847 Win=7287 Len=0 TSval=1559897480 TSecr=2577715788"
"224","11:33:20.161498","192.168.0.227","64.65.63.120","TCP","66","[TCP Window Update] 55087  >  443 [ACK] Seq=3753 Ack=11847 Win=7438 Len=0 TSval=1559897480 TSecr=2577715788"
"225","11:33:20.168764","192.168.0.227","5.28.195.2","TCP","78","[TCP Retransmission] 60342  >  80 [SYN] Seq=0 Win=65535 Len=0 MSS=1460 WS=16 TSval=4247346872 TSecr=0 SACK_PERM"
"226","11:33:20.168813","192.168.0.227","5.28.195.2","TCP","78","[TCP Retransmission] 60341  >  5222 [SYN] Seq=0 Win=65535 Len=0 MSS=1460 WS=16 TSval=729367257 TSecr=0 SACK_PERM"
"227","11:33:20.170412","192.87.28.82","192.168.0.227","TLSv1.2","1374","Application Data, Application Data"
"228","11:33:20.170609","192.168.0.227","192.87.28.82","TCP","66","55094  >  9001 [ACK] Seq=15259 Ack=84039 Win=7000 Len=0 TSval=4101925287 TSecr=2014574325"
"229","11:33:20.175237","192.168.0.227","192.87.28.82","TLSv1.2","1116","Application Data"
"230","11:33:20.196951","64.65.63.120","192.168.0.227","TLSv1.2","1474","Application Data"
"231","11:33:20.196955","64.65.63.120","192.168.0.227","TCP","1474","443  >  55087 [PSH, ACK] Seq=13255 Ack=3753 Win=464 Len=1408 TSval=2577715824 TSecr=1559897480 [TCP PDU reassembled in 233]"
"232","11:33:20.196956","64.65.63.120","192.168.0.227","TCP","1474","443  >  55087 [ACK] Seq=14663 Ack=3753 Win=464 Len=1408 TSval=2577715824 TSecr=1559897480 [TCP PDU reassembled in 233]"
"233","11:33:20.196958","64.65.63.120","192.168.0.227","TLSv1.2","1474","Application Data"
"234","11:33:20.196959","64.65.63.120","192.168.0.227","TCP","1474","443  >  55087 [ACK] Seq=17479 Ack=3753 Win=464 Len=1408 TSval=2577715824 TSecr=1559897480 [TCP PDU reassembled in 236]"
"235","11:33:20.196961","64.65.63.120","192.168.0.227","TCP","1474","443  >  55087 [PSH, ACK] Seq=18887 Ack=3753 Win=464 Len=1408 TSval=2577715824 TSecr=1559897480 [TCP PDU reassembled in 236]"
"236","11:33:20.196962","64.65.63.120","192.168.0.227","TLSv1.2","1110","Application Data, Application Data, Application Data"
"237","11:33:20.197109","192.168.0.227","64.65.63.120","TCP","66","55087  >  443 [ACK] Seq=3753 Ack=21339 Win=7290 Len=0 TSval=1559897516 TSecr=2577715824"
"238","11:33:20.197272","192.168.0.227","64.65.63.120","TCP","66","[TCP Window Update] 55087  >  443 [ACK] Seq=3753 Ack=21339 Win=7438 Len=0 TSval=1559897516 TSecr=2577715824"
"239","11:33:20.197455","192.168.0.227","64.65.63.120","TLSv1.2","602","Application Data"
"240","11:33:20.207343","192.87.28.82","192.168.0.227","TCP","1474","9001  >  55094 [ACK] Seq=84039 Ack=15259 Win=1043 Len=1408 TSval=2014574360 TSecr=4101925287 [TCP PDU reassembled in 242]"
"241","11:33:20.207345","192.87.28.82","192.168.0.227","TCP","1474","9001  >  55094 [ACK] Seq=85447 Ack=15259 Win=1043 Len=1408 TSval=2014574360 TSecr=4101925287 [TCP PDU reassembled in 242]"
"242","11:33:20.207346","192.87.28.82","192.168.0.227","TLSv1.2","870","Application Data"
"243","11:33:20.207523","192.168.0.227","192.87.28.82","TLSv1.2","602","Application Data"
"244","11:33:20.207648","192.168.0.227","192.87.28.82","TCP","66","[TCP Window Update] 55094  >  9001 [ACK] Seq=16845 Ack=87659 Win=7020 Len=0 TSval=4101925324 TSecr=2014574360"
"245","11:33:20.216975","192.87.28.82","192.168.0.227","TCP","1474","9001  >  55094 [ACK] Seq=87659 Ack=16309 Win=1043 Len=1408 TSval=2014574371 TSecr=4101925292 [TCP PDU reassembled in 247]"
"246","11:33:20.216978","192.87.28.82","192.168.0.227","TCP","1474","9001  >  55094 [ACK] Seq=89067 Ack=16309 Win=1043 Len=1408 TSval=2014574371 TSecr=4101925292 [TCP PDU reassembled in 247]"
"247","11:33:20.216979","192.87.28.82","192.168.0.227","TLSv1.2","1474","Application Data"
"248","11:33:20.217128","192.168.0.227","192.87.28.82","TCP","66","55094  >  9001 [ACK] Seq=16845 Ack=91883 Win=6954 Len=0 TSval=4101925334 TSecr=2014574371"
"249","11:33:20.217230","192.168.0.227","192.87.28.82","TCP","66","[TCP Window Update] 55094  >  9001 [ACK] Seq=16845 Ack=91883 Win=7020 Len=0 TSval=4101925334 TSecr=2014574371"
"250","11:33:20.224142","192.87.28.82","192.168.0.227","TLSv1.2","1474","Application Data"
"251","11:33:20.224144","192.87.28.82","192.168.0.227","TCP","1474","9001  >  55094 [ACK] Seq=93291 Ack=16309 Win=1043 Len=1408 TSval=2014574378 TSecr=4101925292 [TCP PDU reassembled in 269]"
"252","11:33:20.224357","192.168.0.227","192.87.28.82","TLSv1.2","602","Application Data"
"253","11:33:20.232017","64.65.63.120","192.168.0.227","TCP","1474","443  >  55087 [ACK] Seq=21339 Ack=3753 Win=464 Len=1408 TSval=2577715860 TSecr=1559897516 [TCP PDU reassembled in 255]"
"254","11:33:20.232020","64.65.63.120","192.168.0.227","TCP","1474","443  >  55087 [PSH, ACK] Seq=22747 Ack=3753 Win=464 Len=1408 TSval=2577715860 TSecr=1559897516 [TCP PDU reassembled in 255]"
"255","11:33:20.232059","64.65.63.120","192.168.0.227","TLSv1.2","1474","Application Data"
"256","11:33:20.232062","64.65.63.120","192.168.0.227","TCP","1474","443  >  55087 [PSH, ACK] Seq=25563 Ack=3753 Win=464 Len=1408 TSval=2577715860 TSecr=1559897516 [TCP PDU reassembled in 259]"
"257","11:33:20.232063","64.65.63.120","192.168.0.227","TCP","66","443  >  55087 [ACK] Seq=26971 Ack=4289 Win=460 Len=0 TSval=2577715860 TSecr=1559897516"
"258","11:33:20.232065","64.65.63.120","192.168.0.227","TCP","1474","443  >  55087 [ACK] Seq=26971 Ack=4289 Win=460 Len=1408 TSval=2577715861 TSecr=1559897516 [TCP PDU reassembled in 259]"
"259","11:33:20.232067","64.65.63.120","192.168.0.227","TLSv1.2","1474","Application Data"
"260","11:33:20.232068","64.65.63.120","192.168.0.227","TLSv1.2","936","Application Data"
"261","11:33:20.232230","192.168.0.227","64.65.63.120","TCP","66","55087  >  443 [ACK] Seq=4289 Ack=24155 Win=7394 Len=0 TSval=1559897551 TSecr=2577715860"
"262","11:33:20.232301","192.168.0.227","64.65.63.120","TCP","66","55087  >  443 [ACK] Seq=4289 Ack=26971 Win=7350 Len=0 TSval=1559897551 TSecr=2577715860"
"263","11:33:20.232341","192.168.0.227","64.65.63.120","TCP","66","55087  >  443 [ACK] Seq=4289 Ack=30657 Win=7293 Len=0 TSval=1559897551 TSecr=2577715861"
"264","11:33:20.232370","192.168.0.227","64.65.63.120","TCP","66","[TCP Window Update] 55087  >  443 [ACK] Seq=4289 Ack=30657 Win=7438 Len=0 TSval=1559897551 TSecr=2577715861"
"265","11:33:20.233769","64.65.63.120","192.168.0.227","TCP","1474","443  >  55087 [ACK] Seq=30657 Ack=4289 Win=464 Len=1408 TSval=2577715863 TSecr=1559897516 [TCP PDU reassembled in 284]"
"266","11:33:20.233771","64.65.63.120","192.168.0.227","TCP","1474","443  >  55087 [PSH, ACK] Seq=32065 Ack=4289 Win=464 Len=1408 TSval=2577715863 TSecr=1559897516 [TCP PDU reassembled in 284]"
"267","11:33:20.233904","192.168.0.227","64.65.63.120","TCP","66","55087  >  443 [ACK] Seq=4289 Ack=33473 Win=7394 Len=0 TSval=1559897552 TSecr=2577715863"
"268","11:33:20.233992","192.168.0.227","64.65.63.120","TCP","66","[TCP Window Update] 55087  >  443 [ACK] Seq=4289 Ack=33473 Win=7438 Len=0 TSval=1559897553 TSecr=2577715863"
"269","11:33:20.250351","192.87.28.82","192.168.0.227","TLSv1.2","1474","Application Data"
"270","11:33:20.250354","192.87.28.82","192.168.0.227","TCP","1474","9001  >  55094 [ACK] Seq=96107 Ack=16845 Win=1043 Len=1408 TSval=2014574403 TSecr=4101925324 [TCP PDU reassembled in 272]"
"271","11:33:20.250355","192.87.28.82","192.168.0.227","TCP","1474","9001  >  55094 [ACK] Seq=97515 Ack=16845 Win=1043 Len=1408 TSval=2014574403 TSecr=4101925324 [TCP PDU reassembled in 272]"
"272","11:33:20.250357","192.87.28.82","192.168.0.227","TLSv1.2","1474","Application Data"
"273","11:33:20.250358","192.87.28.82","192.168.0.227","TCP","1474","9001  >  55094 [ACK] Seq=100331 Ack=16845 Win=1043 Len=1408 TSval=2014574403 TSecr=4101925324 [TCP PDU reassembled in 277]"
