"No.","Time","Source","Destination","Protocol","Length","Info"
"1","20:33:46.939162","192.168.0.74","5.28.195.2","TCP","78","55152  >  80 [SYN] Seq=0 Win=65535 Len=0 MSS=1460 WS=16 TSval=1193222647 TSecr=0 SACK_PERM"
"2","20:33:46.939228","192.168.0.74","5.28.195.2","TCP","78","55151  >  5222 [SYN] Seq=0 Win=65535 Len=0 MSS=1460 WS=16 TSval=520054226 TSecr=0 SACK_PERM"
"3","20:33:46.953012","2a02:ab88:b:4100:6163:ab1b:4f48:fc2c","2603:1063:7::c9","TLSv1.2","136","Application Data"
"4","20:33:47.003911","2603:1063:7::c9","2a02:ab88:b:4100:6163:ab1b:4f48:fc2c","TLSv1.2","125","Application Data"
"5","20:33:47.004177","2a02:ab88:b:4100:6163:ab1b:4f48:fc2c","2603:1063:7::c9","TCP","86","53384  >  443 [ACK] Seq=51 Ack=40 Win=2048 Len=0 TSval=3553498986 TSecr=1651382672"
"6","20:33:47.329302","192.168.0.74","31.192.108.181","TLSv1.2","251","Application Data"
"7","20:33:47.329553","192.168.0.74","31.192.108.181","TLSv1.2","251","Application Data"
"8","20:33:47.385681","31.192.108.181","192.168.0.74","TCP","66","443  >  59649 [ACK] Seq=1 Ack=371 Win=51 Len=0 TSval=2481080944 TSecr=2379853037"
"9","20:33:47.397215","31.192.108.181","192.168.0.74","TLSv1.2","230","Application Data"
"10","20:33:47.397457","192.168.0.74","31.192.108.181","TCP","66","59649  >  443 [ACK] Seq=371 Ack=165 Win=2046 Len=0 TSval=2379853105 TSecr=2481080956"
"11","20:33:47.436043","31.192.108.181","192.168.0.74","TLSv1.2","254","Application Data"
"12","20:33:47.436413","192.168.0.74","31.192.108.181","TCP","66","59649  >  443 [ACK] Seq=371 Ack=353 Win=2046 Len=0 TSval=2379853144 TSecr=2481080997"
"13","20:33:47.438857","2a02:ab88:b:4100:6163:ab1b:4f48:fc2c","2a02:26f0:7700::1723:68e2","TCP","98","55153  >  443 [SYN, ECE, CWR] Seq=0 Win=65535 Len=0 MSS=1440 WS=64 TSval=317633823 TSecr=0 SACK_PERM"
"14","20:33:47.507470","2a02:26f0:7700::1723:68e2","2a02:ab88:b:4100:6163:ab1b:4f48:fc2c","TCP","94","443  >  55153 [SYN, ACK, ECE] Seq=0 Ack=1 Win=64260 Len=0 MSS=1344 SACK_PERM TSval=857543684 TSecr=317633823 WS=128"
"15","20:33:47.507663","2a02:ab88:b:4100:6163:ab1b:4f48:fc2c","2a02:26f0:7700::1723:68e2","TCP","86","55153  >  443 [ACK] Seq=1 Ack=1 Win=131904 Len=0 TSval=317633892 TSecr=857543684"
"16","20:33:47.507942","2a02:ab88:b:4100:6163:ab1b:4f48:fc2c","2a02:26f0:7700::1723:68e2","TCP","1418","55153  >  443 [ACK] Seq=1 Ack=1 Win=131904 Len=1332 TSval=317633893 TSecr=857543684 [TCP PDU reassembled in 17]"
"17","20:33:47.507952","2a02:ab88:b:4100:6163:ab1b:4f48:fc2c","2a02:26f0:7700::1723:68e2","TLSv1.3","522","Client Hello (SNI=spo.nel.measure.office.net)"
"18","20:33:47.580638","2a02:26f0:7700::1723:68e2","2a02:ab88:b:4100:6163:ab1b:4f48:fc2c","TCP","86","443  >  55153 [ACK] Seq=1 Ack=1333 Win=67072 Len=0 TSval=857543757 TSecr=317633893"
"19","20:33:47.580639","2a02:26f0:7700::1723:68e2","2a02:ab88:b:4100:6163:ab1b:4f48:fc2c","TCP","86","443  >  55153 [ACK] Seq=1 Ack=1769 Win=69632 Len=0 TSval=857543757 TSecr=317633893"
"20","20:33:47.583653","2a02:26f0:7700::1723:68e2","2a02:ab88:b:4100:6163:ab1b:4f48:fc2c","TLSv1.3","1494","Server Hello, Change Cipher Spec, Application Data"
"21","20:33:47.583654","2a02:26f0:7700::1723:68e2","2a02:ab88:b:4100:6163:ab1b:4f48:fc2c","TCP","1494","443  >  55153 [PSH, ACK] Seq=1409 Ack=1769 Win=69632 Len=1408 TSval=857543758 TSecr=317633893 [TCP PDU reassembled in 25]"
"22","20:33:47.583655","2a02:26f0:7700::1723:68e2","2a02:ab88:b:4100:6163:ab1b:4f48:fc2c","TCP","1366","443  >  55153 [PSH, ACK] Seq=2817 Ack=1769 Win=69632 Len=1280 TSval=857543758 TSecr=317633893 [TCP PDU reassembled in 25]"
"23","20:33:47.583732","2a02:ab88:b:4100:6163:ab1b:4f48:fc2c","2a02:26f0:7700::1723:68e2","TCP","86","55153  >  443 [ACK] Seq=1769 Ack=4097 Win=127808 Len=0 TSval=317633969 TSecr=857543758"
"24","20:33:47.583804","2a02:ab88:b:4100:6163:ab1b:4f48:fc2c","2a02:26f0:7700::1723:68e2","TCP","86","[TCP Window Update] 55153  >  443 [ACK] Seq=1769 Ack=4097 Win=131072 Len=0 TSval=317633969 TSecr=857543758"
"25","20:33:47.599576","2a02:26f0:7700::1723:68e2","2a02:ab88:b:4100:6163:ab1b:4f48:fc2c","TLSv1.3","1156","Application Data, Application Data, Application Data"
"26","20:33:47.599680","2a02:ab88:b:4100:6163:ab1b:4f48:fc2c","2a02:26f0:7700::1723:68e2","TCP","86","55153  >  443 [ACK] Seq=1769 Ack=5167 Win=130048 Len=0 TSval=317633984 TSecr=857543777"
"27","20:33:47.607025","2a02:ab88:b:4100:6163:ab1b:4f48:fc2c","2a02:26f0:7700::1723:68e2","TLSv1.3","166","Change Cipher Spec, Application Data"
"28","20:33:47.607222","2a02:ab88:b:4100:6163:ab1b:4f48:fc2c","2a02:26f0:7700::1723:68e2","TLSv1.3","178","Application Data"
"29","20:33:47.607369","2a02:ab88:b:4100:6163:ab1b:4f48:fc2c","2a02:26f0:7700::1723:68e2","TLSv1.3","495","Application Data"
"30","20:33:47.673431","2a02:26f0:7700::1723:68e2","2a02:ab88:b:4100:6163:ab1b:4f48:fc2c","TLSv1.3","389","Application Data"
"31","20:33:47.673433","2a02:26f0:7700::1723:68e2","2a02:ab88:b:4100:6163:ab1b:4f48:fc2c","TLSv1.3","389","Application Data"
"32","20:33:47.673544","2a02:ab88:b:4100:6163:ab1b:4f48:fc2c","2a02:26f0:7700::1723:68e2","TCP","86","55153  >  443 [ACK] Seq=2350 Ack=5470 Win=130816 Len=0 TSval=317634058 TSecr=857543852"
"33","20:33:47.673581","2a02:ab88:b:4100:6163:ab1b:4f48:fc2c","2a02:26f0:7700::1723:68e2","TCP","86","55153  >  443 [ACK] Seq=2350 Ack=5773 Win=130560 Len=0 TSval=317634058 TSecr=857543852"
"34","20:33:47.674872","2a02:26f0:7700::1723:68e2","2a02:ab88:b:4100:6163:ab1b:4f48:fc2c","TLSv1.3","147","Application Data"
"35","20:33:47.674873","2a02:26f0:7700::1723:68e2","2a02:ab88:b:4100:6163:ab1b:4f48:fc2c","TLSv1.3","117","Application Data"
"36","20:33:47.674874","2a02:26f0:7700::1723:68e2","2a02:ab88:b:4100:6163:ab1b:4f48:fc2c","TLSv1.3","288","Application Data"
"37","20:33:47.674875","2a02:26f0:7700::1723:68e2","2a02:ab88:b:4100:6163:ab1b:4f48:fc2c","TLSv1.3","124","Application Data"
"38","20:33:47.674902","2a02:ab88:b:4100:6163:ab1b:4f48:fc2c","2a02:26f0:7700::1723:68e2","TCP","86","55153  >  443 [ACK] Seq=2350 Ack=6105 Win=130752 Len=0 TSval=317634060 TSecr=857543854"
"39","20:33:47.675371","2a02:ab88:b:4100:6163:ab1b:4f48:fc2c","2a02:26f0:7700::1723:68e2","TLSv1.3","117","Application Data"
"40","20:33:47.675395","2a02:ab88:b:4100:6163:ab1b:4f48:fc2c","2a02:26f0:7700::1723:68e2","TLSv1.3","121","Application Data"
"41","20:33:47.675544","2a02:ab88:b:4100:6163:ab1b:4f48:fc2c","2a02:26f0:7700::1723:68e2","TLSv1.3","259","Application Data"
"42","20:33:47.675626","2a02:ab88:b:4100:6163:ab1b:4f48:fc2c","2a02:26f0:7700::1723:68e2","TCP","1418","55153  >  443 [ACK] Seq=2589 Ack=6105 Win=131072 Len=1332 TSval=317634060 TSecr=857543854 [TCP PDU reassembled in 43]"
"43","20:33:47.675635","2a02:ab88:b:4100:6163:ab1b:4f48:fc2c","2a02:26f0:7700::1723:68e2","TLSv1.3","652","Application Data"
"44","20:33:47.742598","2a02:26f0:7700::1723:68e2","2a02:ab88:b:4100:6163:ab1b:4f48:fc2c","TCP","86","443  >  55153 [ACK] Seq=6105 Ack=4487 Win=72192 Len=0 TSval=857543921 TSecr=317634060"
"45","20:33:47.940480","192.168.0.74","5.28.195.2","TCP","78","[TCP Retransmission] 55152  >  80 [SYN] Seq=0 Win=65535 Len=0 MSS=1460 WS=16 TSval=1193223648 TSecr=0 SACK_PERM"
"46","20:33:47.940534","192.168.0.74","5.28.195.2","TCP","78","[TCP Retransmission] 55151  >  5222 [SYN] Seq=0 Win=65535 Len=0 MSS=1460 WS=16 TSval=520055227 TSecr=0 SACK_PERM"
"47","20:33:47.973470","192.87.28.82","192.168.0.74","TLSv1.2","602","Application Data"
"48","20:33:47.973606","192.168.0.74","192.87.28.82","TCP","66","53922  >  9001 [ACK] Seq=1 Ack=537 Win=9872 Len=0 TSval=2984630792 TSecr=3379975097"
"49","20:33:47.974069","192.168.0.74","192.87.28.82","TLSv1.2","602","Application Data"
"50","20:33:48.054645","192.87.28.82","192.168.0.74","TCP","66","9001  >  53922 [ACK] Seq=537 Ack=537 Win=1043 Len=0 TSval=3379975179 TSecr=2984630793"
"51","20:33:48.054795","192.168.0.74","192.87.28.82","TLSv1.2","1116","Application Data"
"52","20:33:48.106702","192.87.28.82","192.168.0.74","TLSv1.2","1116","Application Data"
"53","20:33:48.106855","192.168.0.74","192.87.28.82","TCP","66","53922  >  9001 [ACK] Seq=1587 Ack=1587 Win=9864 Len=0 TSval=2984630926 TSecr=3379975229"
"54","20:33:48.571716","2a02:26f0:7700::1723:68e2","2a02:ab88:b:4100:6163:ab1b:4f48:fc2c","TLSv1.3","342","Application Data"
"55","20:33:48.571719","2a02:26f0:7700::1723:68e2","2a02:ab88:b:4100:6163:ab1b:4f48:fc2c","TLSv1.3","117","Application Data"
"56","20:33:48.571934","2a02:ab88:b:4100:6163:ab1b:4f48:fc2c","2a02:26f0:7700::1723:68e2","TCP","86","55153  >  443 [ACK] Seq=4487 Ack=6392 Win=130816 Len=0 TSval=317634957 TSecr=857544639"
"57","20:33:48.572645","2a02:ab88:b:4100:6163:ab1b:4f48:fc2c","2a02:26f0:7700::1723:68e2","TLSv1.3","121","Application Data"
"58","20:33:48.599719","2a02:26f0:7700::1723:68e2","2a02:ab88:b:4100:6163:ab1b:4f48:fc2c","TCP","117","[TCP Spurious Retransmission] 443  >  55153 [PSH, ACK] Seq=6361 Ack=4487 Win=74496 Len=31 TSval=857544779 TSecr=317634060"
"59","20:33:48.599853","2a02:ab88:b:4100:6163:ab1b:4f48:fc2c","2a02:26f0:7700::1723:68e2","TCP","98","[TCP Dup ACK 56#1] 55153  >  443 [ACK] Seq=4522 Ack=6392 Win=131072 Len=0 TSval=317634985 TSecr=857544779 SLE=6361 SRE=6392"
"60","20:33:48.675539","2a02:26f0:7700::1723:68e2","2a02:ab88:b:4100:6163:ab1b:4f48:fc2c","TCP","86","443  >  55153 [ACK] Seq=6392 Ack=4522 Win=74496 Len=0 TSval=857544855 TSecr=317634958"
"61","20:33:48.735625","192.168.0.74","192.87.28.82","TLSv1.2","1116","Application Data"
"62","20:33:48.762235","fe80::49c:fb07:3c9a:aa62","fe80::1817:fddd:60ce:b28f","UDP","66","3722  >  3722 Len=4"
"63","20:33:48.811688","192.87.28.82","192.168.0.74","TCP","66","9001  >  53922 [ACK] Seq=1587 Ack=2637 Win=1043 Len=0 TSval=3379975935 TSecr=2984631554"
"64","20:33:48.833357","149.154.167.41","192.168.0.74","SSL","171","Continuation Data"
"65","20:33:48.833455","192.168.0.74","149.154.167.41","TCP","66","55046  >  443 [ACK] Seq=1 Ack=106 Win=65530 Len=0 TSval=433352144 TSecr=3357388432"
"66","20:33:48.925358","192.87.28.82","192.168.0.74","TLSv1.2","602","Application Data"
"67","20:33:48.925509","192.168.0.74","192.87.28.82","TCP","66","53922  >  9001 [ACK] Seq=2637 Ack=2123 Win=9872 Len=0 TSval=2984631744 TSecr=3379976051"
"68","20:33:48.940815","192.168.0.74","5.28.195.2","TCP","78","[TCP Retransmission] 55152  >  80 [SYN] Seq=0 Win=65535 Len=0 MSS=1460 WS=16 TSval=1193224649 TSecr=0 SACK_PERM"
"69","20:33:48.940873","192.168.0.74","5.28.195.2","TCP","78","[TCP Retransmission] 55151  >  5222 [SYN] Seq=0 Win=65535 Len=0 MSS=1460 WS=16 TSval=520056228 TSecr=0 SACK_PERM"
"70","20:33:49.004454","192.168.0.74","192.87.28.82","TLSv1.2","602","Application Data"
"71","20:33:49.078508","192.87.28.82","192.168.0.74","TCP","66","9001  >  53922 [ACK] Seq=2123 Ack=3173 Win=1043 Len=0 TSval=3379976205 TSecr=2984631823"
"72","20:33:49.078617","192.168.0.74","192.87.28.82","TLSv1.2","602","Application Data"
"73","20:33:49.118683","192.87.28.82","192.168.0.74","TCP","1474","9001  >  53922 [ACK] Seq=2123 Ack=3709 Win=1043 Len=1408 TSval=3379976245 TSecr=2984631897 [TCP PDU reassembled in 75]"
"74","20:33:49.118685","192.87.28.82","192.168.0.74","TCP","1474","9001  >  53922 [ACK] Seq=3531 Ack=3709 Win=1043 Len=1408 TSval=3379976245 TSecr=2984631897 [TCP PDU reassembled in 75]"
"75","20:33:49.118686","192.87.28.82","192.168.0.74","TLSv1.2","1320","Application Data"
"76","20:33:49.118687","192.87.28.82","192.168.0.74","TCP","1474","9001  >  53922 [ACK] Seq=6193 Ack=3709 Win=1043 Len=1408 TSval=3379976245 TSecr=2984631897 [TCP PDU reassembled in 78]"
"77","20:33:49.118688","192.87.28.82","192.168.0.74","TCP","1474","9001  >  53922 [ACK] Seq=7601 Ack=3709 Win=1043 Len=1408 TSval=3379976245 TSecr=2984631897 [TCP PDU reassembled in 78]"
"78","20:33:49.118689","192.87.28.82","192.168.0.74","TLSv1.2","934","Application Data"
"79","20:33:49.118798","192.168.0.74","192.87.28.82","TLSv1.2","602","Application Data"
"80","20:33:49.118954","192.168.0.74","192.87.28.82","TCP","66","[TCP Window Update] 53922  >  9001 [ACK] Seq=4245 Ack=9877 Win=9880 Len=0 TSval=2984631938 TSecr=3379976245"
"81","20:33:49.120775","192.87.28.82","192.168.0.74","TCP","1474","9001  >  53922 [ACK] Seq=9877 Ack=3709 Win=1043 Len=1408 TSval=3379976248 TSecr=2984631897 [TCP PDU reassembled in 82]"
"82","20:33:49.120777","192.87.28.82","192.168.0.74","TLSv1.2","1250","Application Data"
"83","20:33:49.120870","192.168.0.74","192.87.28.82","TLSv1.2","602","Application Data"
"84","20:33:49.127032","192.87.28.82","192.168.0.74","TCP","1474","9001  >  53922 [ACK] Seq=12469 Ack=3709 Win=1043 Len=1408 TSval=3379976254 TSecr=2984631897 [TCP PDU reassembled in 86]"
"85","20:33:49.127034","192.87.28.82","192.168.0.74","TCP","1474","9001  >  53922 [ACK] Seq=13877 Ack=3709 Win=1043 Len=1408 TSval=3379976254 TSecr=2984631897 [TCP PDU reassembled in 86]"
"86","20:33:49.127036","192.87.28.82","192.168.0.74","TLSv1.2","870","Application Data"
"87","20:33:49.127139","192.168.0.74","192.87.28.82","TCP","66","53922  >  9001 [ACK] Seq=4781 Ack=16089 Win=9824 Len=0 TSval=2984631946 TSecr=3379976254"
"88","20:33:49.128453","192.168.0.74","192.87.28.82","TCP","66","[TCP Window Update] 53922  >  9001 [ACK] Seq=4781 Ack=16089 Win=9880 Len=0 TSval=2984631947 TSecr=3379976254"
"89","20:33:49.154260","192.87.28.82","192.168.0.74","TCP","1474","9001  >  53922 [ACK] Seq=16089 Ack=4245 Win=1035 Len=1408 TSval=3379976280 TSecr=2984631938 [TCP PDU reassembled in 91]"
"90","20:33:49.154262","192.87.28.82","192.168.0.74","TCP","1474","9001  >  53922 [ACK] Seq=17497 Ack=4245 Win=1035 Len=1408 TSval=3379976280 TSecr=2984631938 [TCP PDU reassembled in 91]"
"91","20:33:49.154263","192.87.28.82","192.168.0.74","TLSv1.2","1474","Application Data, Application Data"
"92","20:33:49.154264","192.87.28.82","192.168.0.74","TCP","1474","9001  >  53922 [ACK] Seq=20313 Ack=4245 Win=1035 Len=1408 TSval=3379976280 TSecr=2984631938 [TCP PDU reassembled in 96]"
"93","20:33:49.154266","192.87.28.82","192.168.0.74","TCP","1474","9001  >  53922 [ACK] Seq=21721 Ack=4245 Win=1035 Len=1408 TSval=3379976280 TSecr=2984631938 [TCP PDU reassembled in 96]"
"94","20:33:49.154371","192.168.0.74","192.87.28.82","TCP","66","53922  >  9001 [ACK] Seq=4781 Ack=23129 Win=9770 Len=0 TSval=2984631973 TSecr=3379976280"
"95","20:33:49.154503","192.168.0.74","192.87.28.82","TCP","66","[TCP Window Update] 53922  >  9001 [ACK] Seq=4781 Ack=23129 Win=9880 Len=0 TSval=2984631973 TSecr=3379976280"
"96","20:33:49.155481","192.87.28.82","192.168.0.74","TLSv1.2","1474","Application Data"
"97","20:33:49.155482","192.87.28.82","192.168.0.74","TCP","1474","9001  >  53922 [ACK] Seq=24537 Ack=4245 Win=1035 Len=1408 TSval=3379976280 TSecr=2984631938 [TCP PDU reassembled in 99]"
"98","20:33:49.155483","192.87.28.82","192.168.0.74","TCP","1474","9001  >  53922 [ACK] Seq=25945 Ack=4245 Win=1035 Len=1408 TSval=3379976280 TSecr=2984631938 [TCP PDU reassembled in 99]"
"99","20:33:49.155484","192.87.28.82","192.168.0.74","TLSv1.2","1474","Application Data"
"100","20:33:49.155484","192.87.28.82","192.168.0.74","TLSv1.2","1474","Application Data"
"101","20:33:49.155485","192.87.28.82","192.168.0.74","TCP","1474","9001  >  53922 [ACK] Seq=30169 Ack=4781 Win=1027 Len=1408 TSval=3379976280 TSecr=2984631940 [TCP PDU reassembled in 107]"
"102","20:33:49.155531","192.168.0.74","192.87.28.82","TCP","66","53922  >  9001 [ACK] Seq=4781 Ack=27353 Win=9814 Len=0 TSval=2984631974 TSecr=3379976280"
"103","20:33:49.155557","192.168.0.74","192.87.28.82","TCP","66","53922  >  9001 [ACK] Seq=4781 Ack=31577 Win=9748 Len=0 TSval=2984631974 TSecr=3379976280"
"104","20:33:49.155610","192.168.0.74","192.87.28.82","TCP","66","[TCP Window Update] 53922  >  9001 [ACK] Seq=4781 Ack=31577 Win=9880 Len=0 TSval=2984631975 TSecr=3379976280"
"105","20:33:49.155690","192.168.0.74","192.87.28.82","TLSv1.2","602","Application Data"
"106","20:33:49.160132","192.87.28.82","192.168.0.74","TCP","1474","9001  >  53922 [ACK] Seq=31577 Ack=4781 Win=1043 Len=1408 TSval=3379976286 TSecr=2984631946 [TCP PDU reassembled in 107]"
"107","20:33:49.160134","192.87.28.82","192.168.0.74","TLSv1.2","1474","Application Data"
"108","20:33:49.160135","192.87.28.82","192.168.0.74","TCP","1474","9001  >  53922 [ACK] Seq=34393 Ack=4781 Win=1043 Len=1408 TSval=3379976286 TSecr=2984631946 [TCP PDU reassembled in 109]"
"109","20:33:49.160136","192.87.28.82","192.168.0.74","TLSv1.2","1474","Application Data"
"110","20:33:49.160137","192.87.28.82","192.168.0.74","TCP","1474","9001  >  53922 [ACK] Seq=37209 Ack=4781 Win=1043 Len=1408 TSval=3379976286 TSecr=2984631946 [TCP PDU reassembled in 116]"
"111","20:33:49.160237","192.168.0.74","192.87.28.82","TCP","66","53922  >  9001 [ACK] Seq=5317 Ack=38617 Win=9770 Len=0 TSval=2984631979 TSecr=3379976286"
"112","20:33:49.160376","192.168.0.74","192.87.28.82","TCP","66","[TCP Window Update] 53922  >  9001 [ACK] Seq=5317 Ack=38617 Win=9880 Len=0 TSval=2984631979 TSecr=3379976286"
"113","20:33:49.162742","192.87.28.82","192.168.0.74","TCP","1474","9001  >  53922 [ACK] Seq=38617 Ack=4781 Win=1043 Len=1408 TSval=3379976291 TSecr=2984631947 [TCP PDU reassembled in 116]"
"114","20:33:49.162832","192.168.0.74","192.87.28.82","TCP","66","53922  >  9001 [ACK] Seq=5317 Ack=40025 Win=9858 Len=0 TSval=2984631982 TSecr=3379976291"
"115","20:33:49.178472","fe80::1817:fddd:60ce:b28f","fe80::49c:fb07:3c9a:aa62","ICMPv6","114","Destination Unreachable (Port unreachable)"
"116","20:33:49.186442","192.87.28.82","192.168.0.74","TLSv1.2","1474","Application Data"
"117","20:33:49.186443","192.87.28.82","192.168.0.74","TCP","1474","9001  >  53922 [ACK] Seq=41433 Ack=4781 Win=1043 Len=1408 TSval=3379976313 TSecr=2984631973 [TCP PDU reassembled in 118]"
"118","20:33:49.186444","192.87.28.82","192.168.0.74","TLSv1.2","240","Application Data"
"119","20:33:49.186538","192.168.0.74","192.87.28.82","TCP","66","53922  >  9001 [ACK] Seq=5317 Ack=43015 Win=9834 Len=0 TSval=2984632005 TSecr=3379976313"
"120","20:33:49.186685","192.168.0.74","192.87.28.82","TCP","66","[TCP Window Update] 53922  >  9001 [ACK] Seq=5317 Ack=43015 Win=9880 Len=0 TSval=2984632006 TSecr=3379976313"
"121","20:33:49.195729","192.87.28.82","192.168.0.74","TCP","1474","9001  >  53922 [ACK] Seq=43015 Ack=5317 Win=1043 Len=1408 TSval=3379976322 TSecr=2984631975 [TCP PDU reassembled in 123]"
"122","20:33:49.195731","192.87.28.82","192.168.0.74","TCP","1474","9001  >  53922 [ACK] Seq=44423 Ack=5317 Win=1043 Len=1408 TSval=3379976322 TSecr=2984631975 [TCP PDU reassembled in 123]"
"123","20:33:49.195732","192.87.28.82","192.168.0.74","TLSv1.2","870","Application Data"
"124","20:33:49.195847","192.168.0.74","192.87.28.82","TLSv1.2","602","Application Data"
"125","20:33:49.195960","192.168.0.74","192.87.28.82","TCP","66","[TCP Window Update] 53922  >  9001 [ACK] Seq=5853 Ack=46635 Win=9880 Len=0 TSval=2984632015 TSecr=3379976322"
"126","20:33:49.209517","64.65.63.120","192.168.0.74","TLSv1.2","602","Application Data"
"127","20:33:49.209632","192.168.0.74","64.65.63.120","TCP","66","53923  >  443 [ACK] Seq=1 Ack=537 Win=6528 Len=0 TSval=38892172 TSecr=2626130401"
"128","20:33:49.243905","192.87.28.82","192.168.0.74","TLSv1.2","602","Application Data"
"129","20:33:49.244010","192.168.0.74","192.87.28.82","TCP","66","53922  >  9001 [ACK] Seq=5853 Ack=47171 Win=9872 Len=0 TSval=2984632063 TSecr=3379976355"
"130","20:33:49.317394","192.87.28.82","192.168.0.74","TLSv1.2","1116","Application Data"
"131","20:33:49.317520","192.168.0.74","192.87.28.82","TCP","66","53922  >  9001 [ACK] Seq=5853 Ack=48221 Win=9864 Len=0 TSval=2984632136 TSecr=3379976444"
"132","20:33:49.334869","87.228.47.204","192.168.0.74","TCP","66","443  >  59571 [ACK] Seq=1 Ack=1 Win=507 Len=0 TSval=75438465 TSecr=2112388187"
"133","20:33:49.335004","192.168.0.74","87.228.47.204","TCP","66","[TCP ACKed unseen segment] 59571  >  443 [ACK] Seq=1 Ack=2 Win=2048 Len=0 TSval=2112403255 TSecr=75423458"
"134","20:33:49.403411","192.168.0.74","192.87.28.82","TLSv1.2","602","Application Data"
"135","20:33:49.447517","192.168.0.74","192.87.28.82","TLSv1.2","1474","Application Data, Application Data"
"136","20:33:49.447538","192.168.0.74","192.87.28.82","TLSv1.2","266","Application Data"
"137","20:33:49.453390","192.168.0.74","192.87.28.82","TLSv1.2","1474","Application Data, Application Data"
"138","20:33:49.453410","192.168.0.74","192.87.28.82","TLSv1.2","266","Application Data"
"139","20:33:49.477723","192.87.28.82","192.168.0.74","TCP","66","9001  >  53922 [ACK] Seq=48221 Ack=6389 Win=1043 Len=0 TSval=3379976605 TSecr=2984632222"
"140","20:33:49.480652","192.87.28.82","192.168.0.74","TCP","66","9001  >  53922 [ACK] Seq=48221 Ack=7997 Win=1018 Len=0 TSval=3379976607 TSecr=2984632266"
"141","20:33:49.481525","192.168.0.74","192.87.28.82","TLSv1.2","1474","Application Data, Application Data"
"142","20:33:49.481546","192.168.0.74","192.87.28.82","TLSv1.2","266","Application Data"
"143","20:33:49.483359","192.168.0.74","192.87.28.82","TCP","1474","53922  >  9001 [ACK] Seq=11213 Ack=48221 Win=9880 Len=1408 TSval=2984632302 TSecr=3379976607 [TCP PDU reassembled in 145]"
"144","20:33:49.483360","192.168.0.74","192.87.28.82","TCP","1474","53922  >  9001 [ACK] Seq=12621 Ack=48221 Win=9880 Len=1408 TSval=2984632302 TSecr=3379976607 [TCP PDU reassembled in 145]"
"145","20:33:49.483373","192.168.0.74","192.87.28.82","TLSv1.2","356","Application Data"
"146","20:33:49.484791","192.87.28.82","192.168.0.74","TCP","66","9001  >  53922 [ACK] Seq=48221 Ack=9605 Win=1018 Len=0 TSval=3379976613 TSecr=2984632272"
"147","20:33:49.490904","192.168.0.74","192.87.28.82","TLSv1.2","1474","Application Data, Application Data"
"148","20:33:49.490924","192.168.0.74","192.87.28.82","TLSv1.2","266","Application Data"
"149","20:33:49.492353","192.168.0.74","64.65.63.120","TLSv1.2","602","Application Data"
"150","20:33:49.518218","192.87.28.82","192.168.0.74","TCP","66","9001  >  53922 [ACK] Seq=48221 Ack=11213 Win=1018 Len=0 TSval=3379976645 TSecr=2984632300"
"151","20:33:49.518219","192.87.28.82","192.168.0.74","TCP","66","9001  >  53922 [ACK] Seq=48221 Ack=14029 Win=974 Len=0 TSval=3379976646 TSecr=2984632302"
"152","20:33:49.524266","192.87.28.82","192.168.0.74","TCP","66","9001  >  53922 [ACK] Seq=48221 Ack=15727 Win=1021 Len=0 TSval=3379976651 TSecr=2984632302"
"153","20:33:49.538598","64.65.63.120","192.168.0.74","TCP","66","443  >  53923 [ACK] Seq=537 Ack=537 Win=1942 Len=0 TSval=2626130729 TSecr=38892455"
"154","20:33:49.563836","192.87.28.82","192.168.0.74","TLSv1.2","602","Application Data"
"155","20:33:49.563941","192.168.0.74","192.87.28.82","TCP","66","53922  >  9001 [ACK] Seq=15927 Ack=48757 Win=9872 Len=0 TSval=2984632383 TSecr=3379976689"
"156","20:33:49.643069","192.87.28.82","192.168.0.74","TCP","1474","9001  >  53922 [ACK] Seq=48757 Ack=15927 Win=1043 Len=1408 TSval=3379976769 TSecr=2984632383 [TCP PDU reassembled in 158]"
"157","20:33:49.643071","192.87.28.82","192.168.0.74","TCP","1474","9001  >  53922 [ACK] Seq=50165 Ack=15927 Win=1043 Len=1408 TSval=3379976769 TSecr=2984632383 [TCP PDU reassembled in 158]"
"158","20:33:49.643073","192.87.28.82","192.168.0.74","TLSv1.2","870","Application Data"
"159","20:33:49.643181","192.168.0.74","192.87.28.82","TCP","66","53922  >  9001 [ACK] Seq=15927 Ack=52377 Win=9824 Len=0 TSval=2984632462 TSecr=3379976769"
"160","20:33:49.643336","192.168.0.74","192.87.28.82","TCP","66","[TCP Window Update] 53922  >  9001 [ACK] Seq=15927 Ack=52377 Win=9880 Len=0 TSval=2984632462 TSecr=3379976769"
"161","20:33:49.667071","192.87.28.82","192.168.0.74","TCP","1474","9001  >  53922 [ACK] Seq=52377 Ack=15927 Win=1043 Len=1408 TSval=3379976793 TSecr=2984632383 [TCP PDU reassembled in 163]"
"162","20:33:49.667073","192.87.28.82","192.168.0.74","TCP","1474","9001  >  53922 [ACK] Seq=53785 Ack=15927 Win=1043 Len=1408 TSval=3379976793 TSecr=2984632383 [TCP PDU reassembled in 163]"
"163","20:33:49.667074","192.87.28.82","192.168.0.74","TLSv1.2","1320","Application Data"
"164","20:33:49.667075","192.87.28.82","192.168.0.74","TCP","1474","9001  >  53922 [ACK] Seq=56447 Ack=15927 Win=1043 Len=1408 TSval=3379976793 TSecr=2984632383 [TCP PDU reassembled in 165]"
"165","20:33:49.667076","192.87.28.82","192.168.0.74","TLSv1.2","800","Application Data"
"166","20:33:49.667173","192.168.0.74","192.87.28.82","TCP","66","53922  >  9001 [ACK] Seq=15927 Ack=58589 Win=9783 Len=0 TSval=2984632486 TSecr=3379976793"
"167","20:33:49.667307","192.168.0.74","192.87.28.82","TCP","66","[TCP Window Update] 53922  >  9001 [ACK] Seq=15927 Ack=58589 Win=9880 Len=0 TSval=2984632486 TSecr=3379976793"
"168","20:33:49.667404","192.168.0.74","192.87.28.82","TLSv1.2","602","Application Data"
"169","20:33:49.681443","192.87.28.82","192.168.0.74","TCP","1474","9001  >  53922 [ACK] Seq=58589 Ack=15927 Win=1043 Len=1408 TSval=3379976808 TSecr=2984632462 [TCP PDU reassembled in 174]"
"170","20:33:49.681533","192.168.0.74","192.87.28.82","TCP","66","53922  >  9001 [ACK] Seq=16463 Ack=59997 Win=9858 Len=0 TSval=2984632500 TSecr=3379976808"
"171","20:33:49.687375","192.168.0.74","192.87.28.82","TCP","1474","53922  >  9001 [ACK] Seq=16463 Ack=59997 Win=9880 Len=1408 TSval=2984632506 TSecr=3379976808 [TCP PDU reassembled in 173]"
"172","20:33:49.687377","192.168.0.74","192.87.28.82","TCP","1474","53922  >  9001 [ACK] Seq=17871 Ack=59997 Win=9880 Len=1408 TSval=2984632506 TSecr=3379976808 [TCP PDU reassembled in 173]"
"173","20:33:49.687393","192.168.0.74","192.87.28.82","TLSv1.2","1320","Application Data"
"174","20:33:49.707446","192.87.28.82","192.168.0.74","TLSv1.2","1474","Application Data"
"175","20:33:49.707448","192.87.28.82","192.168.0.74","TCP","1474","9001  >  53922 [ACK] Seq=61405 Ack=16463 Win=1043 Len=1408 TSval=3379976833 TSecr=2984632486 [TCP PDU reassembled in 177]"
"176","20:33:49.707450","192.87.28.82","192.168.0.74","TCP","1474","9001  >  53922 [ACK] Seq=62813 Ack=16463 Win=1043 Len=1408 TSval=3379976833 TSecr=2984632486 [TCP PDU reassembled in 177]"
"177","20:33:49.707451","192.87.28.82","192.168.0.74","TLSv1.2","582","Application Data"
"178","20:33:49.707452","192.87.28.82","192.168.0.74","TCP","1474","9001  >  53922 [ACK] Seq=64737 Ack=16463 Win=1043 Len=1408 TSval=3379976833 TSecr=2984632486 [TCP PDU reassembled in 180]"
"179","20:33:49.707453","192.87.28.82","192.168.0.74","TCP","1474","9001  >  53922 [ACK] Seq=66145 Ack=16463 Win=1043 Len=1408 TSval=3379976833 TSecr=2984632486 [TCP PDU reassembled in 180]"
"180","20:33:49.707454","192.87.28.82","192.168.0.74","TLSv1.2","1320","Application Data"
"181","20:33:49.707455","192.87.28.82","192.168.0.74","TCP","1474","9001  >  53922 [ACK] Seq=68807 Ack=16463 Win=1043 Len=1408 TSval=3379976833 TSecr=2984632486 [TCP PDU reassembled in 183]"
"182","20:33:49.707456","192.87.28.82","192.168.0.74","TCP","1474","9001  >  53922 [ACK] Seq=70215 Ack=16463 Win=1043 Len=1408 TSval=3379976833 TSecr=2984632486 [TCP PDU reassembled in 183]"
"183","20:33:49.707457","192.87.28.82","192.168.0.74","TLSv1.2","998","Application Data"
"184","20:33:49.707577","192.168.0.74","192.87.28.82","TLSv1.2","1180","Application Data"
"185","20:33:49.710723","192.87.28.82","192.168.0.74","TCP","1474","9001  >  53922 [ACK] Seq=72555 Ack=16463 Win=1043 Len=1408 TSval=3379976837 TSecr=2984632486 [TCP PDU reassembled in 187]"
"186","20:33:49.710725","192.87.28.82","192.168.0.74","TCP","1474","9001  >  53922 [ACK] Seq=73963 Ack=16463 Win=1043 Len=1408 TSval=3379976837 TSecr=2984632486 [TCP PDU reassembled in 187]"
"187","20:33:49.710726","192.87.28.82","192.168.0.74","TLSv1.2","1320","Application Data"
"188","20:33:49.712723","192.168.0.74","64.65.63.120","TLSv1.2","602","Application Data"
"189","20:33:49.712838","192.168.0.74","192.87.28.82","TCP","66","53922  >  9001 [ACK] Seq=21647 Ack=76625 Win=9880 Len=0 TSval=2984632532 TSecr=3379976837"
"190","20:33:49.719168","192.87.28.82","192.168.0.74","TLSv1.2","1474","Application Data"
"191","20:33:49.719170","192.87.28.82","192.168.0.74","TCP","1474","9001  >  53922 [ACK] Seq=78033 Ack=16463 Win=1043 Len=1408 TSval=3379976845 TSecr=2984632500 [TCP PDU reassembled in 192]"
"192","20:33:49.719172","192.87.28.82","192.168.0.74","TLSv1.2","1406","Application Data"
"193","20:33:49.719173","192.87.28.82","192.168.0.74","TCP","1474","9001  >  53922 [ACK] Seq=80781 Ack=16463 Win=1043 Len=1408 TSval=3379976845 TSecr=2984632500 [TCP PDU reassembled in 195]"
"194","20:33:49.719174","192.87.28.82","192.168.0.74","TCP","1474","9001  >  53922 [ACK] Seq=82189 Ack=16463 Win=1043 Len=1408 TSval=3379976845 TSecr=2984632500 [TCP PDU reassembled in 195]"
"195","20:33:49.719175","192.87.28.82","192.168.0.74","TLSv1.2","1320","Application Data"
"196","20:33:49.719177","192.87.28.82","192.168.0.74","TCP","1474","9001  >  53922 [ACK] Seq=84851 Ack=16463 Win=1043 Len=1408 TSval=3379976845 TSecr=2984632500 [TCP PDU reassembled in 197]"
"197","20:33:49.719178","192.87.28.82","192.168.0.74","TLSv1.2","350","Application Data"
"198","20:33:49.719350","192.168.0.74","192.87.28.82","TLSv1.2","602","Application Data"
"199","20:33:49.722350","192.87.28.82","192.168.0.74","TCP","66","9001  >  53922 [ACK] Seq=86543 Ack=19279 Win=999 Len=0 TSval=3379976849 TSecr=2984632506"
"200","20:33:49.734309","192.87.28.82","192.168.0.74","TCP","1474","9001  >  53922 [ACK] Seq=86543 Ack=20533 Win=1043 Len=1408 TSval=3379976860 TSecr=2984632506 [TCP PDU reassembled in 202]"
"201","20:33:49.734311","192.87.28.82","192.168.0.74","TCP","1474","9001  >  53922 [ACK] Seq=87951 Ack=20533 Win=1043 Len=1408 TSval=3379976860 TSecr=2984632506 [TCP PDU reassembled in 202]"
"202","20:33:49.734313","192.87.28.82","192.168.0.74","TLSv1.2","870","Application Data"
"203","20:33:49.734314","192.87.28.82","192.168.0.74","TCP","1474","9001  >  53922 [ACK] Seq=90163 Ack=20533 Win=1043 Len=1408 TSval=3379976862 TSecr=2984632506 [TCP PDU reassembled in 207]"
"204","20:33:49.734451","192.168.0.74","192.87.28.82","TCP","66","53922  >  9001 [ACK] Seq=22183 Ack=91571 Win=9802 Len=0 TSval=2984632553 TSecr=3379976862"
"205","20:33:49.734589","192.168.0.74","192.87.28.82","TCP","66","[TCP Window Update] 53922  >  9001 [ACK] Seq=22183 Ack=91571 Win=9880 Len=0 TSval=2984632554 TSecr=3379976862"
"206","20:33:49.736346","192.87.28.82","192.168.0.74","TCP","1474","9001  >  53922 [ACK] Seq=91571 Ack=20533 Win=1043 Len=1408 TSval=3379976862 TSecr=2984632506 [TCP PDU reassembled in 207]"
"207","20:33:49.736348","192.87.28.82","192.168.0.74","TLSv1.2","870","Application Data"
"208","20:33:49.736432","192.168.0.74","192.87.28.82","TCP","66","53922  >  9001 [ACK] Seq=22183 Ack=93783 Win=9880 Len=0 TSval=2984632555 TSecr=3379976862"
"209","20:33:49.737912","192.87.28.82","192.168.0.74","TCP","1474","9001  >  53922 [ACK] Seq=93783 Ack=20533 Win=1043 Len=1408 TSval=3379976866 TSecr=2984632506 [TCP PDU reassembled in 211]"
"210","20:33:49.738811","192.87.28.82","192.168.0.74","TCP","1474","9001  >  53922 [ACK] Seq=95191 Ack=20533 Win=1043 Len=1408 TSval=3379976866 TSecr=2984632506 [TCP PDU reassembled in 211]"
"211","20:33:49.738813","192.87.28.82","192.168.0.74","TLSv1.2","1320","Application Data"
"212","20:33:49.738894","192.168.0.74","192.87.28.82","TLSv1.2","602","Application Data"
"213","20:33:49.743241","192.87.28.82","192.168.0.74","TLSv1.2","1474","Application Data"
"214","20:33:49.743242","192.87.28.82","192.168.0.74","TCP","1474","9001  >  53922 [ACK] Seq=99261 Ack=21647 Win=1043 Len=1408 TSval=3379976869 TSecr=2984632526 [TCP PDU reassembled in 215]"
"215","20:33:49.743244","192.87.28.82","192.168.0.74","TLSv1.2","1470","Application Data"
"216","20:33:49.743293","192.168.0.74","192.87.28.82","TCP","66","53922  >  9001 [ACK] Seq=22719 Ack=102073 Win=9815 Len=0 TSval=2984632562 TSecr=3379976869"
"217","20:33:49.743370","192.168.0.74","192.87.28.82","TCP","66","[TCP Window Update] 53922  >  9001 [ACK] Seq=22719 Ack=102073 Win=9880 Len=0 TSval=2984632562 TSecr=3379976869"
"218","20:33:49.748405","192.87.28.82","192.168.0.74","TCP","1474","9001  >  53922 [ACK] Seq=102073 Ack=21647 Win=1043 Len=1408 TSval=3379976874 TSecr=2984632532 [TCP PDU reassembled in 220]"
"219","20:33:49.748407","192.87.28.82","192.168.0.74","TCP","1474","9001  >  53922 [ACK] Seq=103481 Ack=21647 Win=1043 Len=1408 TSval=3379976874 TSecr=2984632532 [TCP PDU reassembled in 220]"
"220","20:33:49.748408","192.87.28.82","192.168.0.74","TLSv1.2","870","Application Data"
"221","20:33:49.748559","192.168.0.74","192.87.28.82","TCP","66","53922  >  9001 [ACK] Seq=22719 Ack=105693 Win=9880 Len=0 TSval=2984632567 TSecr=3379976874"
"222","20:33:49.757251","192.87.28.82","192.168.0.74","TLSv1.2","1474","Application Data, Application Data"
"223","20:33:49.757253","192.87.28.82","192.168.0.74","TCP","1474","9001  >  53922 [ACK] Seq=107101 Ack=22183 Win=1035 Len=1408 TSval=3379976881 TSecr=2984632538 [TCP PDU reassembled in 225]"
"224","20:33:49.757255","192.87.28.82","192.168.0.74","TCP","1474","9001  >  53922 [ACK] Seq=108509 Ack=22183 Win=1035 Len=1408 TSval=3379976881 TSecr=2984632538 [TCP PDU reassembled in 225]"
"225","20:33:49.757256","192.87.28.82","192.168.0.74","TLSv1.2","534","Application Data"
"226","20:33:49.757361","192.168.0.74","192.87.28.82","TCP","66","53922  >  9001 [ACK] Seq=22719 Ack=110385 Win=9807 Len=0 TSval=2984632576 TSecr=3379976881"
"227","20:33:49.757489","192.168.0.74","192.87.28.82","TCP","66","[TCP Window Update] 53922  >  9001 [ACK] Seq=22719 Ack=110385 Win=9880 Len=0 TSval=2984632576 TSecr=3379976881"
"228","20:33:49.760961","64.65.63.120","192.168.0.74","TCP","66","443  >  53923 [ACK] Seq=537 Ack=1073 Win=1938 Len=0 TSval=2626130952 TSecr=38892676"
"229","20:33:49.761020","192.168.0.74","64.65.63.120","TLSv1.2","602","Application Data"
"230","20:33:49.766249","64.65.63.120","192.168.0.74","TLSv1.2","602","Application Data"
"231","20:33:49.766317","192.168.0.74","64.65.63.120","TCP","66","53923  >  443 [ACK] Seq=1609 Ack=1073 Win=6528 Len=0 TSval=38892729 TSecr=2626130958"
"232","20:33:49.770410","192.87.28.82","192.168.0.74","TCP","1474","9001  >  53922 [ACK] Seq=110385 Ack=22183 Win=1043 Len=1408 TSval=3379976895 TSecr=2984632554 [TCP PDU reassembled in 234]"
"233","20:33:49.770413","192.87.28.82","192.168.0.74","TCP","1474","9001  >  53922 [ACK] Seq=111793 Ack=22183 Win=1043 Len=1408 TSval=3379976895 TSecr=2984632554 [TCP PDU reassembled in 234]"
"234","20:33:49.770415","192.87.28.82","192.168.0.74","TLSv1.2","870","Application Data"
"235","20:33:49.770519","192.168.0.74","192.87.28.82","TLSv1.2","602","Application Data"
"236","20:33:49.770616","192.168.0.74","192.87.28.82","TCP","66","[TCP Window Update] 53922  >  9001 [ACK] Seq=23255 Ack=114005 Win=9880 Len=0 TSval=2984632590 TSecr=3379976895"
"237","20:33:49.772256","192.87.28.82","192.168.0.74","TCP","1474","9001  >  53922 [ACK] Seq=114005 Ack=22183 Win=1043 Len=1408 TSval=3379976898 TSecr=2984632555 [TCP PDU reassembled in 239]"
"238","20:33:49.772258","192.87.28.82","192.168.0.74","TCP","1474","9001  >  53922 [ACK] Seq=115413 Ack=22183 Win=1043 Len=1408 TSval=3379976898 TSecr=2984632555 [TCP PDU reassembled in 239]"
"239","20:33:49.772260","192.87.28.82","192.168.0.74","TLSv1.2","1320","Application Data"
"240","20:33:49.772332","192.168.0.74","192.87.28.82","TCP","66","53922  >  9001 [ACK] Seq=23255 Ack=118075 Win=9880 Len=0 TSval=2984632591 TSecr=3379976898"
"241","20:33:49.774939","192.87.28.82","192.168.0.74","TLSv1.2","1474","Application Data"
"242","20:33:49.774940","192.87.28.82","192.168.0.74","TCP","1474","9001  >  53922 [ACK] Seq=119483 Ack=22183 Win=1043 Len=1408 TSval=3379976900 TSecr=2984632555 [TCP PDU reassembled in 243]"
"243","20:33:49.774941","192.87.28.82","192.168.0.74","TLSv1.2","442","Application Data"
"244","20:33:49.775028","192.168.0.74","192.87.28.82","TCP","66","53922  >  9001 [ACK] Seq=23255 Ack=121267 Win=9880 Len=0 TSval=2984632594 TSecr=3379976900"
"245","20:33:49.805466","192.87.28.82","192.168.0.74","TLSv1.2","1116","Application Data"
"246","20:33:49.805566","192.168.0.74","192.87.28.82","TCP","66","53922  >  9001 [ACK] Seq=23255 Ack=122317 Win=9864 Len=0 TSval=2984632624 TSecr=3379976932"
"247","20:33:49.815132","192.87.28.82","192.168.0.74","TCP","1474","9001  >  53922 [ACK] Seq=122317 Ack=23255 Win=1043 Len=1408 TSval=3379976940 TSecr=2984632594 [TCP PDU reassembled in 249]"
"248","20:33:49.815134","192.87.28.82","192.168.0.74","TCP","1474","9001  >  53922 [ACK] Seq=123725 Ack=23255 Win=1043 Len=1408 TSval=3379976940 TSecr=2984632594 [TCP PDU reassembled in 249]"
"249","20:33:49.815136","192.87.28.82","192.168.0.74","TLSv1.2","1320","Application Data"
"250","20:33:49.815137","192.87.28.82","192.168.0.74","TCP","1474","9001  >  53922 [ACK] Seq=126387 Ack=23255 Win=1043 Len=1408 TSval=3379976940 TSecr=2984632594 [TCP PDU reassembled in 252]"
"251","20:33:49.815139","192.87.28.82","192.168.0.74","TCP","1474","9001  >  53922 [ACK] Seq=127795 Ack=23255 Win=1043 Len=1408 TSval=3379976940 TSecr=2984632594 [TCP PDU reassembled in 252]"
"252","20:33:49.815140","192.87.28.82","192.168.0.74","TLSv1.2","1320","Application Data"
"253","20:33:49.815244","192.168.0.74","192.87.28.82","TCP","66","53922  >  9001 [ACK] Seq=23255 Ack=130457 Win=9753 Len=0 TSval=2984632634 TSecr=3379976940"
"254","20:33:49.815361","192.168.0.74","192.87.28.82","TCP","66","[TCP Window Update] 53922  >  9001 [ACK] Seq=23255 Ack=130457 Win=9880 Len=0 TSval=2984632634 TSecr=3379976940"
"255","20:33:49.815462","192.168.0.74","192.87.28.82","TLSv1.2","602","Application Data"
"256","20:33:49.843038","64.65.63.120","192.168.0.74","TCP","66","443  >  53923 [ACK] Seq=1073 Ack=1609 Win=1934 Len=0 TSval=2626131037 TSecr=38892724"
"257","20:33:49.843159","192.168.0.74","64.65.63.120","TLSv1.2","602","Application Data"
"258","20:33:49.852565","192.87.28.82","192.168.0.74","TLSv1.2","730","Application Data"
"259","20:33:49.852746","192.168.0.74","192.87.28.82","TLSv1.2","602","Application Data"
"260","20:33:49.862915","192.87.28.82","192.168.0.74","TCP","1474","9001  >  53922 [ACK] Seq=131121 Ack=23791 Win=1043 Len=1408 TSval=3379976985 TSecr=2984632634 [TCP PDU reassembled in 262]"
"261","20:33:49.862917","192.87.28.82","192.168.0.74","TCP","1474","9001  >  53922 [ACK] Seq=132529 Ack=23791 Win=1043 Len=1408 TSval=3379976985 TSecr=2984632634 [TCP PDU reassembled in 262]"
"262","20:33:49.862919","192.87.28.82","192.168.0.74","TLSv1.2","870","Application Data"
"263","20:33:49.863022","192.168.0.74","192.87.28.82","TCP","66","53922  >  9001 [ACK] Seq=24327 Ack=134741 Win=9824 Len=0 TSval=2984632682 TSecr=3379976985"
"264","20:33:49.863127","192.168.0.74","192.87.28.82","TCP","66","[TCP Window Update] 53922  >  9001 [ACK] Seq=24327 Ack=134741 Win=9880 Len=0 TSval=2984632682 TSecr=3379976985"
"265","20:33:49.873674","192.87.28.82","192.168.0.74","TCP","1474","9001  >  53922 [ACK] Seq=134741 Ack=23791 Win=1043 Len=1408 TSval=3379977000 TSecr=2984632634 [TCP PDU reassembled in 266]"
"266","20:33:49.873677","192.87.28.82","192.168.0.74","TLSv1.2","736","Application Data"
"267","20:33:49.873839","192.168.0.74","192.87.28.82","TCP","66","53922  >  9001 [ACK] Seq=24327 Ack=136819 Win=9880 Len=0 TSval=2984632693 TSecr=3379977000"
"268","20:33:49.878095","192.87.28.82","192.168.0.74","TCP","1474","9001  >  53922 [ACK] Seq=136819 Ack=23791 Win=1043 Len=1408 TSval=3379977005 TSecr=2984632634 [TCP PDU reassembled in 270]"
"269","20:33:49.878097","192.87.28.82","192.168.0.74","TCP","1474","9001  >  53922 [ACK] Seq=138227 Ack=23791 Win=1043 Len=1408 TSval=3379977005 TSecr=2984632634 [TCP PDU reassembled in 270]"
"270","20:33:49.878099","192.87.28.82","192.168.0.74","TLSv1.2","870","Application Data"
"271","20:33:49.878235","192.168.0.74","192.87.28.82","TCP","66","53922  >  9001 [ACK] Seq=24327 Ack=140439 Win=9880 Len=0 TSval=2984632697 TSecr=3379977005"
"272","20:33:49.885448","64.65.63.120","192.168.0.74","TCP","66","443  >  53923 [ACK] Seq=1073 Ack=2145 Win=1930 Len=0 TSval=2626131078 TSecr=38892806"
"273","20:33:49.911503","192.87.28.82","192.168.0.74","TLSv1.2","1116","Application Data"
"274","20:33:49.911505","64.65.63.120","192.168.0.74","TLSv1.2","602","Application Data"
