"No.","Time","Source","Destination","Protocol","Length","Info"
"1","20:36:28.972404","192.168.0.74","5.28.195.2","TCP","78","55365  >  5222 [SYN] Seq=0 Win=65535 Len=0 MSS=1460 WS=16 TSval=493338246 TSecr=0 SACK_PERM"
"2","20:36:28.972481","192.168.0.74","5.28.195.2","TCP","78","55364  >  80 [SYN] Seq=0 Win=65535 Len=0 MSS=1460 WS=16 TSval=1421455877 TSecr=0 SACK_PERM"
"3","20:36:29.107526","64.65.63.120","192.168.0.74","TLSv1.2","602","Application Data"
"4","20:36:29.107794","192.168.0.74","64.65.63.120","TCP","66","53923  >  443 [ACK] Seq=1 Ack=537 Win=6528 Len=0 TSval=39052077 TSecr=2626290292"
"5","20:36:29.742599","87.228.47.204","192.168.0.74","TCP","66","443  >  59571 [ACK] Seq=1 Ack=1 Win=507 Len=0 TSval=75598722 TSecr=2112548272"
"6","20:36:29.742758","192.168.0.74","87.228.47.204","TCP","66","[TCP ACKed unseen segment] 59571  >  443 [ACK] Seq=1 Ack=2 Win=2048 Len=0 TSval=2112563669 TSecr=75583545"
"7","20:36:29.839210","fe80::ae22:5ff:feaa:607e","fe80::49c:fb07:3c9a:aa62","ICMPv6","86","Neighbor Solicitation for fe80::49c:fb07:3c9a:aa62 from ac:22:05:aa:60:7e"
"8","20:36:29.839424","fe80::49c:fb07:3c9a:aa62","fe80::ae22:5ff:feaa:607e","ICMPv6","78","Neighbor Advertisement fe80::49c:fb07:3c9a:aa62 (sol)"
"9","20:36:29.872753","192.87.28.82","192.168.0.74","TLSv1.2","602","Application Data"
"10","20:36:29.873013","192.168.0.74","192.87.28.82","TCP","66","53922  >  9001 [ACK] Seq=1 Ack=537 Win=9872 Len=0 TSval=2984792698 TSecr=3380136996"
"11","20:36:29.883023","fe80::49c:fb07:3c9a:aa62","fe80::1817:fddd:60ce:b28f","ICMPv6","86","Neighbor Solicitation for fe80::1817:fddd:60ce:b28f from ee:99:94:f5:59:fd"
"12","20:36:29.973636","192.168.0.74","5.28.195.2","TCP","78","[TCP Retransmission] 55365  >  5222 [SYN] Seq=0 Win=65535 Len=0 MSS=1460 WS=16 TSval=493339247 TSecr=0 SACK_PERM"
"13","20:36:29.973712","192.168.0.74","5.28.195.2","TCP","78","[TCP Retransmission] 55364  >  80 [SYN] Seq=0 Win=65535 Len=0 MSS=1460 WS=16 TSval=1421456878 TSecr=0 SACK_PERM"
"14","20:36:29.990935","fe80::1817:fddd:60ce:b28f","fe80::49c:fb07:3c9a:aa62","ICMPv6","86","Neighbor Solicitation for fe80::49c:fb07:3c9a:aa62 from fe:cf:4c:2c:ee:ed"
"15","20:36:29.991125","fe80::49c:fb07:3c9a:aa62","fe80::1817:fddd:60ce:b28f","ICMPv6","78","Neighbor Advertisement fe80::49c:fb07:3c9a:aa62 (sol)"
"16","20:36:29.993079","fe80::1817:fddd:60ce:b28f","fe80::49c:fb07:3c9a:aa62","ICMPv6","78","Neighbor Advertisement fe80::1817:fddd:60ce:b28f (sol)"
"17","20:36:30.974832","192.168.0.74","5.28.195.2","TCP","78","[TCP Retransmission] 55365  >  5222 [SYN] Seq=0 Win=65535 Len=0 MSS=1460 WS=16 TSval=493340248 TSecr=0 SACK_PERM"
"18","20:36:30.974883","192.168.0.74","5.28.195.2","TCP","78","[TCP Retransmission] 55364  >  80 [SYN] Seq=0 Win=65535 Len=0 MSS=1460 WS=16 TSval=1421457879 TSecr=0 SACK_PERM"
"19","20:36:31.337120","192.168.0.74","192.87.28.82","TLSv1.2","1116","Application Data"
"20","20:36:31.424558","192.87.28.82","192.168.0.74","TCP","66","9001  >  53922 [ACK] Seq=537 Ack=1051 Win=1043 Len=0 TSval=3380138549 TSecr=2984794163"
"21","20:36:31.526069","192.87.28.82","192.168.0.74","TLSv1.2","602","Application Data"
"22","20:36:31.526292","192.168.0.74","192.87.28.82","TCP","66","53922  >  9001 [ACK] Seq=1051 Ack=1073 Win=9872 Len=0 TSval=2984794352 TSecr=3380138651"
"23","20:36:31.567614","192.168.0.74","192.87.28.82","TLSv1.2","602","Application Data"
"24","20:36:31.593129","192.87.28.82","192.168.0.74","TLSv1.2","1116","Application Data"
"25","20:36:31.593281","192.168.0.74","192.87.28.82","TCP","66","53922  >  9001 [ACK] Seq=1587 Ack=2123 Win=9864 Len=0 TSval=2984794419 TSecr=3380138717"
"26","20:36:31.649567","192.87.28.82","192.168.0.74","TCP","66","9001  >  53922 [ACK] Seq=2123 Ack=1587 Win=1043 Len=0 TSval=3380138769 TSecr=2984794393"
"27","20:36:31.739466","192.87.28.82","192.168.0.74","TCP","1474","9001  >  53922 [ACK] Seq=2123 Ack=1587 Win=1043 Len=1408 TSval=3380138864 TSecr=2984794393 [TCP PDU reassembled in 29]"
"28","20:36:31.739470","192.87.28.82","192.168.0.74","TCP","1474","9001  >  53922 [ACK] Seq=3531 Ack=1587 Win=1043 Len=1408 TSval=3380138864 TSecr=2984794393 [TCP PDU reassembled in 29]"
"29","20:36:31.739473","192.87.28.82","192.168.0.74","TLSv1.2","870","Application Data"
"30","20:36:31.739697","192.168.0.74","192.87.28.82","TCP","66","53922  >  9001 [ACK] Seq=1587 Ack=5743 Win=9824 Len=0 TSval=2984794565 TSecr=3380138864"
"31","20:36:31.739965","192.168.0.74","192.87.28.82","TCP","66","[TCP Window Update] 53922  >  9001 [ACK] Seq=1587 Ack=5743 Win=9880 Len=0 TSval=2984794566 TSecr=3380138864"
"32","20:36:31.774867","192.87.28.82","192.168.0.74","TCP","1474","9001  >  53922 [ACK] Seq=5743 Ack=1587 Win=1043 Len=1408 TSval=3380138899 TSecr=2984794565 [TCP PDU reassembled in 34]"
"33","20:36:31.774874","192.87.28.82","192.168.0.74","TCP","1474","9001  >  53922 [ACK] Seq=7151 Ack=1587 Win=1043 Len=1408 TSval=3380138899 TSecr=2984794565 [TCP PDU reassembled in 34]"
"34","20:36:31.774877","192.87.28.82","192.168.0.74","TLSv1.2","870","Application Data"
"35","20:36:31.775121","192.168.0.74","192.87.28.82","TCP","66","53922  >  9001 [ACK] Seq=1587 Ack=9363 Win=9824 Len=0 TSval=2984794601 TSecr=3380138899"
"36","20:36:31.775407","192.168.0.74","192.87.28.82","TCP","66","[TCP Window Update] 53922  >  9001 [ACK] Seq=1587 Ack=9363 Win=9880 Len=0 TSval=2984794601 TSecr=3380138899"
"37","20:36:31.780274","64.65.63.120","192.168.0.74","TCP","1474","443  >  53923 [ACK] Seq=537 Ack=1 Win=1428 Len=1408 TSval=2626292963 TSecr=39052077 [TCP PDU reassembled in 40]"
"38","20:36:31.780462","192.168.0.74","64.65.63.120","TCP","66","53923  >  443 [ACK] Seq=1 Ack=1945 Win=6514 Len=0 TSval=39054750 TSecr=2626292963"
"39","20:36:31.784859","64.65.63.120","192.168.0.74","TCP","1474","443  >  53923 [PSH, ACK] Seq=1945 Ack=1 Win=1428 Len=1408 TSval=2626292963 TSecr=39052077 [TCP PDU reassembled in 40]"
"40","20:36:31.784864","64.65.63.120","192.168.0.74","TLSv1.2","870","Application Data"
"41","20:36:31.784985","192.168.0.74","64.65.63.120","TCP","66","53923  >  443 [ACK] Seq=1 Ack=4157 Win=6502 Len=0 TSval=39054755 TSecr=2626292963"
"42","20:36:31.799447","64.65.63.120","192.168.0.74","TCP","1474","443  >  53923 [ACK] Seq=4157 Ack=1 Win=1428 Len=1408 TSval=2626292982 TSecr=39052077 [TCP PDU reassembled in 47]"
"43","20:36:31.799450","64.65.63.120","192.168.0.74","TCP","1474","443  >  53923 [PSH, ACK] Seq=5565 Ack=1 Win=1428 Len=1408 TSval=2626292982 TSecr=39052077 [TCP PDU reassembled in 47]"
"44","20:36:31.799667","192.168.0.74","64.65.63.120","TCP","66","53923  >  443 [ACK] Seq=1 Ack=5565 Win=6514 Len=0 TSval=39054769 TSecr=2626292982"
"45","20:36:31.799746","192.168.0.74","64.65.63.120","TCP","66","53923  >  443 [ACK] Seq=1 Ack=6973 Win=6492 Len=0 TSval=39054769 TSecr=2626292982"
"46","20:36:31.799933","192.168.0.74","64.65.63.120","TCP","66","[TCP Window Update] 53923  >  443 [ACK] Seq=1 Ack=6973 Win=6536 Len=0 TSval=39054770 TSecr=2626292982"
"47","20:36:31.803198","64.65.63.120","192.168.0.74","TLSv1.2","1474","Application Data, Application Data"
"48","20:36:31.803200","64.65.63.120","192.168.0.74","TCP","1474","443  >  53923 [PSH, ACK] Seq=8381 Ack=1 Win=1428 Len=1408 TSval=2626292988 TSecr=39052077 [TCP PDU reassembled in 59]"
"49","20:36:31.803202","64.65.63.120","192.168.0.74","TCP","1474","443  >  53923 [ACK] Seq=9789 Ack=1 Win=1428 Len=1408 TSval=2626292988 TSecr=39052077 [TCP PDU reassembled in 59]"
"50","20:36:31.803204","192.87.28.82","192.168.0.74","TCP","1474","9001  >  53922 [ACK] Seq=9363 Ack=1587 Win=1043 Len=1408 TSval=3380138929 TSecr=2984794566 [TCP PDU reassembled in 55]"
"51","20:36:31.803205","192.87.28.82","192.168.0.74","TCP","1474","9001  >  53922 [ACK] Seq=10771 Ack=1587 Win=1043 Len=1408 TSval=3380138929 TSecr=2984794566 [TCP PDU reassembled in 55]"
"52","20:36:31.803263","192.168.0.74","192.87.28.82","TCP","66","53922  >  9001 [ACK] Seq=1587 Ack=12179 Win=9836 Len=0 TSval=2984794629 TSecr=3380138929"
"53","20:36:31.803290","192.168.0.74","64.65.63.120","TCP","66","53923  >  443 [ACK] Seq=1 Ack=11197 Win=6470 Len=0 TSval=39054773 TSecr=2626292988"
"54","20:36:31.803343","192.168.0.74","192.87.28.82","TCP","66","[TCP Window Update] 53922  >  9001 [ACK] Seq=1587 Ack=12179 Win=9880 Len=0 TSval=2984794629 TSecr=3380138929"
"55","20:36:31.803393","192.87.28.82","192.168.0.74","TLSv1.2","1320","Application Data"
"56","20:36:31.803422","192.168.0.74","192.87.28.82","TCP","66","53922  >  9001 [ACK] Seq=1587 Ack=13433 Win=9861 Len=0 TSval=2984794629 TSecr=3380138929"
"57","20:36:31.803490","192.168.0.74","64.65.63.120","TCP","66","[TCP Window Update] 53923  >  443 [ACK] Seq=1 Ack=11197 Win=6536 Len=0 TSval=39054773 TSecr=2626292988"
"58","20:36:31.803866","192.168.0.74","192.87.28.82","TLSv1.2","602","Application Data"
"59","20:36:31.816312","64.65.63.120","192.168.0.74","TLSv1.2","1474","Application Data, Application Data"
"60","20:36:31.816319","64.65.63.120","192.168.0.74","TCP","1474","443  >  53923 [PSH, ACK] Seq=12605 Ack=1 Win=1428 Len=1408 TSval=2626293003 TSecr=39052077 [TCP PDU reassembled in 65]"
"61","20:36:31.816503","192.168.0.74","64.65.63.120","TCP","66","53923  >  443 [ACK] Seq=1 Ack=14013 Win=6492 Len=0 TSval=39054786 TSecr=2626293003"
"62","20:36:31.816746","192.168.0.74","64.65.63.120","TCP","66","[TCP Window Update] 53923  >  443 [ACK] Seq=1 Ack=14013 Win=6536 Len=0 TSval=39054786 TSecr=2626293003"
"63","20:36:31.816980","192.168.0.74","64.65.63.120","TLSv1.2","602","Application Data"
"64","20:36:31.830697","64.65.63.120","192.168.0.74","TCP","1474","443  >  53923 [ACK] Seq=14013 Ack=1 Win=1428 Len=1408 TSval=2626293017 TSecr=39054750 [TCP PDU reassembled in 65]"
"65","20:36:31.830702","64.65.63.120","192.168.0.74","TLSv1.2","1474","Application Data, Application Data"
"66","20:36:31.830925","192.168.0.74","64.65.63.120","TCP","66","53923  >  443 [ACK] Seq=537 Ack=16829 Win=6492 Len=0 TSval=39054801 TSecr=2626293017"
"67","20:36:31.831191","192.168.0.74","64.65.63.120","TCP","66","[TCP Window Update] 53923  >  443 [ACK] Seq=537 Ack=16829 Win=6536 Len=0 TSval=39054801 TSecr=2626293017"
"68","20:36:31.834893","64.65.63.120","192.168.0.74","TCP","1474","443  >  53923 [ACK] Seq=16829 Ack=1 Win=1428 Len=1408 TSval=2626293021 TSecr=39054755 [TCP PDU reassembled in 72]"
"69","20:36:31.834896","64.65.63.120","192.168.0.74","TCP","1474","443  >  53923 [PSH, ACK] Seq=18237 Ack=1 Win=1428 Len=1408 TSval=2626293021 TSecr=39054755 [TCP PDU reassembled in 72]"
"70","20:36:31.834975","192.168.0.74","64.65.63.120","TCP","66","53923  >  443 [ACK] Seq=537 Ack=19645 Win=6492 Len=0 TSval=39054805 TSecr=2626293021"
"71","20:36:31.835072","192.168.0.74","64.65.63.120","TCP","66","[TCP Window Update] 53923  >  443 [ACK] Seq=537 Ack=19645 Win=6536 Len=0 TSval=39054805 TSecr=2626293021"
"72","20:36:31.836763","64.65.63.120","192.168.0.74","TLSv1.2","1474","Application Data"
"73","20:36:31.836766","192.87.28.82","192.168.0.74","TLSv1.2","152","Application Data"
"74","20:36:31.836861","192.168.0.74","192.87.28.82","TCP","66","53922  >  9001 [ACK] Seq=2123 Ack=13519 Win=9879 Len=0 TSval=2984794663 TSecr=3380138963"
"75","20:36:31.836912","192.168.0.74","64.65.63.120","TCP","66","53923  >  443 [ACK] Seq=537 Ack=21053 Win=6514 Len=0 TSval=39054807 TSecr=2626293023"
"76","20:36:31.847327","192.87.28.82","192.168.0.74","TCP","1474","9001  >  53922 [ACK] Seq=13519 Ack=2123 Win=1043 Len=1408 TSval=3380138973 TSecr=2984794630 [TCP PDU reassembled in 78]"
"77","20:36:31.847331","192.87.28.82","192.168.0.74","TCP","1474","9001  >  53922 [ACK] Seq=14927 Ack=2123 Win=1043 Len=1408 TSval=3380138973 TSecr=2984794630 [TCP PDU reassembled in 78]"
"78","20:36:31.847333","192.87.28.82","192.168.0.74","TLSv1.2","1320","Application Data"
"79","20:36:31.847335","64.65.63.120","192.168.0.74","TCP","1474","443  >  53923 [ACK] Seq=21053 Ack=1 Win=1428 Len=1408 TSval=2626293034 TSecr=39054769 [TCP PDU reassembled in 85]"
"80","20:36:31.847549","192.168.0.74","192.87.28.82","TCP","66","53922  >  9001 [ACK] Seq=2123 Ack=17589 Win=9817 Len=0 TSval=2984794673 TSecr=3380138973"
"81","20:36:31.847608","192.168.0.74","64.65.63.120","TCP","66","53923  >  443 [ACK] Seq=537 Ack=22461 Win=6514 Len=0 TSval=39054817 TSecr=2626293034"
"82","20:36:31.847735","192.168.0.74","192.87.28.82","TCP","66","[TCP Window Update] 53922  >  9001 [ACK] Seq=2123 Ack=17589 Win=9880 Len=0 TSval=2984794673 TSecr=3380138973"
"83","20:36:31.849505","64.65.63.120","192.168.0.74","TCP","1474","443  >  53923 [ACK] Seq=22461 Ack=1 Win=1428 Len=1408 TSval=2626293037 TSecr=39054770 [TCP PDU reassembled in 85]"
"84","20:36:31.849634","192.168.0.74","64.65.63.120","TCP","66","53923  >  443 [ACK] Seq=537 Ack=23869 Win=6514 Len=0 TSval=39054819 TSecr=2626293037"
"85","20:36:31.850500","64.65.63.120","192.168.0.74","TLSv1.2","1474","Application Data"
"86","20:36:31.850503","64.65.63.120","192.168.0.74","TCP","1474","443  >  53923 [PSH, ACK] Seq=25277 Ack=1 Win=1428 Len=1408 TSval=2626293038 TSecr=39054773 [TCP PDU reassembled in 90]"
"87","20:36:31.850583","192.168.0.74","64.65.63.120","TCP","66","53923  >  443 [ACK] Seq=537 Ack=26685 Win=6492 Len=0 TSval=39054820 TSecr=2626293038"
"88","20:36:31.850681","192.168.0.74","64.65.63.120","TCP","66","[TCP Window Update] 53923  >  443 [ACK] Seq=537 Ack=26685 Win=6536 Len=0 TSval=39054820 TSecr=2626293038"
"89","20:36:31.852300","64.65.63.120","192.168.0.74","TCP","1474","443  >  53923 [ACK] Seq=26685 Ack=1 Win=1428 Len=1408 TSval=2626293038 TSecr=39054773 [TCP PDU reassembled in 90]"
"90","20:36:31.852302","64.65.63.120","192.168.0.74","TLSv1.2","1474","Application Data"
"91","20:36:31.852334","192.168.0.74","64.65.63.120","TCP","66","53923  >  443 [ACK] Seq=537 Ack=29501 Win=6492 Len=0 TSval=39054822 TSecr=2626293038"
"92","20:36:31.852395","192.168.0.74","64.65.63.120","TCP","66","[TCP Window Update] 53923  >  443 [ACK] Seq=537 Ack=29501 Win=6536 Len=0 TSval=39054822 TSecr=2626293038"
"93","20:36:31.856288","192.87.28.82","192.168.0.74","TLSv1.2","1474","Application Data"
"94","20:36:31.856291","192.87.28.82","192.168.0.74","TCP","1474","9001  >  53922 [ACK] Seq=18997 Ack=2123 Win=1043 Len=1408 TSval=3380138978 TSecr=2984794630 [TCP PDU reassembled in 95]"
"95","20:36:31.856292","192.87.28.82","192.168.0.74","TLSv1.2","1470","Application Data"
"96","20:36:31.856437","192.168.0.74","192.87.28.82","TCP","66","53922  >  9001 [ACK] Seq=2123 Ack=21809 Win=9815 Len=0 TSval=2984794682 TSecr=3380138978"
"97","20:36:31.856564","192.168.0.74","192.87.28.82","TCP","66","[TCP Window Update] 53922  >  9001 [ACK] Seq=2123 Ack=21809 Win=9880 Len=0 TSval=2984794682 TSecr=3380138978"
"98","20:36:31.863669","64.65.63.120","192.168.0.74","TCP","1474","443  >  53923 [ACK] Seq=29501 Ack=1 Win=1428 Len=1408 TSval=2626293051 TSecr=39054786 [TCP PDU reassembled in 99]"
"99","20:36:31.863671","64.65.63.120","192.168.0.74","TLSv1.2","1474","Application Data, Application Data"
"100","20:36:31.863787","192.168.0.74","64.65.63.120","TLSv1.2","602","Application Data"
"101","20:36:31.863982","192.168.0.74","64.65.63.120","TCP","66","[TCP Window Update] 53923  >  443 [ACK] Seq=1073 Ack=32317 Win=6536 Len=0 TSval=39054834 TSecr=2626293051"
"102","20:36:31.871068","192.87.28.82","192.168.0.74","TLSv1.2","1474","Application Data"
"103","20:36:31.871071","192.87.28.82","192.168.0.74","TCP","1474","9001  >  53922 [ACK] Seq=23217 Ack=2123 Win=1043 Len=1408 TSval=3380138991 TSecr=2984794630 [TCP PDU reassembled in 104]"
"104","20:36:31.871072","192.87.28.82","192.168.0.74","TLSv1.2","1406","Application Data"
"105","20:36:31.871201","192.168.0.74","192.87.28.82","TCP","66","53922  >  9001 [ACK] Seq=2123 Ack=25965 Win=9816 Len=0 TSval=2984794697 TSecr=3380138991"
"106","20:36:31.871488","192.168.0.74","192.87.28.82","TCP","66","[TCP Window Update] 53922  >  9001 [ACK] Seq=2123 Ack=25965 Win=9880 Len=0 TSval=2984794697 TSecr=3380138991"
"107","20:36:31.872416","64.65.63.120","192.168.0.74","TCP","66","443  >  53923 [ACK] Seq=32317 Ack=537 Win=1424 Len=0 TSval=2626293056 TSecr=39054787"
"108","20:36:31.879382","64.65.63.120","192.168.0.74","TLSv1.2","1474","Application Data"
"109","20:36:31.879384","64.65.63.120","192.168.0.74","TCP","1474","443  >  53923 [PSH, ACK] Seq=33725 Ack=537 Win=1424 Len=1408 TSval=2626293065 TSecr=39054801 [TCP PDU reassembled in 113]"
"110","20:36:31.879386","64.65.63.120","192.168.0.74","TCP","1474","443  >  53923 [ACK] Seq=35133 Ack=537 Win=1424 Len=1408 TSval=2626293067 TSecr=39054801 [TCP PDU reassembled in 113]"
"111","20:36:31.879513","192.168.0.74","64.65.63.120","TCP","66","53923  >  443 [ACK] Seq=1073 Ack=36541 Win=6470 Len=0 TSval=39054849 TSecr=2626293067"
"112","20:36:31.880341","192.168.0.74","64.65.63.120","TCP","66","[TCP Window Update] 53923  >  443 [ACK] Seq=1073 Ack=36541 Win=6536 Len=0 TSval=39054850 TSecr=2626293067"
"113","20:36:31.882958","64.65.63.120","192.168.0.74","TLSv1.2","1474","Application Data"
"114","20:36:31.882961","64.65.63.120","192.168.0.74","TCP","1474","443  >  53923 [PSH, ACK] Seq=37949 Ack=537 Win=1424 Len=1408 TSval=2626293069 TSecr=39054805 [TCP PDU reassembled in 117]"
"115","20:36:31.883153","192.168.0.74","64.65.63.120","TCP","66","53923  >  443 [ACK] Seq=1073 Ack=39357 Win=6536 Len=0 TSval=39054853 TSecr=2626293069"
"116","20:36:31.888170","64.65.63.120","192.168.0.74","TCP","1474","443  >  53923 [ACK] Seq=39357 Ack=537 Win=1424 Len=1408 TSval=2626293074 TSecr=39054807 [TCP PDU reassembled in 117]"
"117","20:36:31.895591","64.65.63.120","192.168.0.74","TLSv1.2","1474","Application Data, Application Data"
"118","20:36:31.895593","64.65.63.120","192.168.0.74","TCP","1474","443  >  53923 [PSH, ACK] Seq=42173 Ack=537 Win=1424 Len=1408 TSval=2626293082 TSecr=39054820 [TCP PDU reassembled in 120]"
"119","20:36:31.895594","64.65.63.120","192.168.0.74","TCP","1474","443  >  53923 [ACK] Seq=43581 Ack=537 Win=1424 Len=1408 TSval=2626293082 TSecr=39054820 [TCP PDU reassembled in 120]"
"120","20:36:31.895595","64.65.63.120","192.168.0.74","TLSv1.2","1474","Application Data"
"121","20:36:31.895817","192.168.0.74","64.65.63.120","TCP","66","53923  >  443 [ACK] Seq=1073 Ack=46397 Win=6536 Len=0 TSval=39054865 TSecr=2626293074"
"122","20:36:31.896880","192.87.28.82","192.168.0.74","TLSv1.2","1474","Application Data"
"123","20:36:31.896882","192.87.28.82","192.168.0.74","TCP","1474","9001  >  53922 [ACK] Seq=27373 Ack=2123 Win=1043 Len=1408 TSval=3380139015 TSecr=2984794682 [TCP PDU reassembled in 125]"
"124","20:36:31.896883","192.87.28.82","192.168.0.74","TCP","1474","9001  >  53922 [ACK] Seq=28781 Ack=2123 Win=1043 Len=1408 TSval=3380139015 TSecr=2984794682 [TCP PDU reassembled in 125]"
"125","20:36:31.896884","192.87.28.82","192.168.0.74","TLSv1.2","448","Application Data"
"126","20:36:31.896884","192.87.28.82","192.168.0.74","TCP","1474","9001  >  53922 [ACK] Seq=30571 Ack=2123 Win=1043 Len=1408 TSval=3380139015 TSecr=2984794682 [TCP PDU reassembled in 127]"
"127","20:36:31.896885","192.87.28.82","192.168.0.74","TLSv1.2","286","Application Data"
"128","20:36:31.896953","192.168.0.74","192.87.28.82","TCP","66","53922  >  9001 [ACK] Seq=2123 Ack=32199 Win=9783 Len=0 TSval=2984794723 TSecr=3380139015"
"129","20:36:31.897039","192.168.0.74","192.87.28.82","TCP","66","[TCP Window Update] 53922  >  9001 [ACK] Seq=2123 Ack=32199 Win=9880 Len=0 TSval=2984794723 TSecr=3380139015"
"130","20:36:31.897165","192.168.0.74","192.87.28.82","TLSv1.2","1116","Application Data"
"131","20:36:31.904511","64.65.63.120","192.168.0.74","TLSv1.2","1474","Application Data"
"132","20:36:31.904513","64.65.63.120","192.168.0.74","TLSv1.2","1474","Application Data"
"133","20:36:31.904687","192.168.0.74","64.65.63.120","TLSv1.2","1138","Application Data, Application Data"
"134","20:36:31.910709","192.87.28.82","192.168.0.74","TCP","1474","9001  >  53922 [ACK] Seq=32199 Ack=2123 Win=1043 Len=1408 TSval=3380139030 TSecr=2984794682 [TCP PDU reassembled in 136]"
"135","20:36:31.910711","192.87.28.82","192.168.0.74","TCP","1474","9001  >  53922 [ACK] Seq=33607 Ack=2123 Win=1043 Len=1408 TSval=3380139030 TSecr=2984794682 [TCP PDU reassembled in 136]"
"136","20:36:31.910713","192.87.28.82","192.168.0.74","TLSv1.2","356","Application Data"
"137","20:36:31.910810","192.168.0.74","192.87.28.82","TCP","66","53922  >  9001 [ACK] Seq=3173 Ack=35305 Win=9832 Len=0 TSval=2984794736 TSecr=3380139030"
"138","20:36:31.910909","192.168.0.74","192.87.28.82","TCP","66","[TCP Window Update] 53922  >  9001 [ACK] Seq=3173 Ack=35305 Win=9880 Len=0 TSval=2984794737 TSecr=3380139030"
"139","20:36:31.912284","64.65.63.120","192.168.0.74","TLSv1.2","1474","Application Data"
"140","20:36:31.912285","64.65.63.120","192.168.0.74","TLSv1.2","1330","Application Data"
"141","20:36:31.912377","192.168.0.74","64.65.63.120","TCP","66","53923  >  443 [ACK] Seq=2145 Ack=51885 Win=6536 Len=0 TSval=39054882 TSecr=2626293098"
"142","20:36:31.944404","192.87.28.82","192.168.0.74","TLSv1.2","1474","Application Data"
"143","20:36:31.944407","192.87.28.82","192.168.0.74","TCP","1474","9001  >  53922 [ACK] Seq=36713 Ack=2123 Win=1043 Len=1408 TSval=3380139054 TSecr=2984794697 [TCP PDU reassembled in 145]"
"144","20:36:31.944408","192.87.28.82","192.168.0.74","TCP","1474","9001  >  53922 [ACK] Seq=38121 Ack=2123 Win=1043 Len=1408 TSval=3380139054 TSecr=2984794697 [TCP PDU reassembled in 145]"
"145","20:36:31.944410","192.87.28.82","192.168.0.74","TLSv1.2","962","Application Data"
"146","20:36:31.944543","192.168.0.74","192.87.28.82","TCP","66","53922  >  9001 [ACK] Seq=3173 Ack=40425 Win=9800 Len=0 TSval=2984794770 TSecr=3380139054"
"147","20:36:31.944701","192.168.0.74","192.87.28.82","TCP","66","[TCP Window Update] 53922  >  9001 [ACK] Seq=3173 Ack=40425 Win=9880 Len=0 TSval=2984794770 TSecr=3380139054"
"148","20:36:31.957983","192.87.28.82","192.168.0.74","TLSv1.2","1474","Application Data"
"149","20:36:31.957986","192.87.28.82","192.168.0.74","TCP","1474","9001  >  53922 [ACK] Seq=41833 Ack=3173 Win=1043 Len=1408 TSval=3380139077 TSecr=2984794723 [TCP PDU reassembled in 150]"
"150","20:36:31.957987","192.87.28.82","192.168.0.74","TLSv1.2","1470","Application Data"
"151","20:36:31.957989","64.65.63.120","192.168.0.74","TCP","66","443  >  53923 [ACK] Seq=51885 Ack=2145 Win=1447 Len=0 TSval=2626293139 TSecr=39054833"
"152","20:36:31.958105","192.168.0.74","192.87.28.82","TCP","66","53922  >  9001 [ACK] Seq=3173 Ack=44645 Win=9815 Len=0 TSval=2984794784 TSecr=3380139077"
"153","20:36:31.958237","192.168.0.74","192.87.28.82","TCP","66","[TCP Window Update] 53922  >  9001 [ACK] Seq=3173 Ack=44645 Win=9880 Len=0 TSval=2984794784 TSecr=3380139077"
"154","20:36:31.958325","192.168.0.74","192.87.28.82","TLSv1.2","602","Application Data"
"155","20:36:31.969773","192.87.28.82","192.168.0.74","TLSv1.2","1474","Application Data"
"156","20:36:31.969775","192.87.28.82","192.168.0.74","TCP","1474","9001  >  53922 [ACK] Seq=46053 Ack=3173 Win=1043 Len=1408 TSval=3380139091 TSecr=2984794723 [TCP PDU reassembled in 158]"
"157","20:36:31.969777","192.87.28.82","192.168.0.74","TCP","1474","9001  >  53922 [ACK] Seq=47461 Ack=3173 Win=1043 Len=1408 TSval=3380139091 TSecr=2984794723 [TCP PDU reassembled in 158]"
"158","20:36:31.969778","192.87.28.82","192.168.0.74","TLSv1.2","448","Application Data"
"159","20:36:31.969876","192.168.0.74","192.87.28.82","TCP","66","53922  >  9001 [ACK] Seq=3709 Ack=49251 Win=9809 Len=0 TSval=2984794796 TSecr=3380139091"
"160","20:36:31.970014","192.168.0.74","192.87.28.82","TCP","66","[TCP Window Update] 53922  >  9001 [ACK] Seq=3709 Ack=49251 Win=9880 Len=0 TSval=2984794796 TSecr=3380139091"
"161","20:36:31.975811","192.168.0.74","5.28.195.2","TCP","78","[TCP Retransmission] 55365  >  5222 [SYN] Seq=0 Win=65535 Len=0 MSS=1460 WS=16 TSval=493341249 TSecr=0 SACK_PERM"
"162","20:36:31.975848","192.168.0.74","5.28.195.2","TCP","78","[TCP Retransmission] 55364  >  80 [SYN] Seq=0 Win=65535 Len=0 MSS=1460 WS=16 TSval=1421458880 TSecr=0 SACK_PERM"
"163","20:36:31.992723","192.87.28.82","192.168.0.74","TLSv1.2","1474","Application Data"
"164","20:36:31.992725","192.87.28.82","192.168.0.74","TCP","1474","9001  >  53922 [ACK] Seq=50659 Ack=3173 Win=1043 Len=1408 TSval=3380139113 TSecr=2984794770 [TCP PDU reassembled in 166]"
"165","20:36:31.992727","192.87.28.82","192.168.0.74","TCP","1474","9001  >  53922 [ACK] Seq=52067 Ack=3173 Win=1043 Len=1408 TSval=3380139113 TSecr=2984794770 [TCP PDU reassembled in 166]"
"166","20:36:31.992728","192.87.28.82","192.168.0.74","TLSv1.2","512","Application Data"
"167","20:36:31.992729","192.87.28.82","192.168.0.74","TCP","1474","9001  >  53922 [ACK] Seq=53921 Ack=3173 Win=1043 Len=1408 TSval=3380139113 TSecr=2984794770 [TCP PDU reassembled in 168]"
"168","20:36:31.992731","192.87.28.82","192.168.0.74","TLSv1.2","286","Application Data"
"169","20:36:31.992824","192.168.0.74","192.87.28.82","TLSv1.2","1138","Application Data, Application Data"
"170","20:36:31.992943","192.168.0.74","192.87.28.82","TCP","66","[TCP Window Update] 53922  >  9001 [ACK] Seq=4781 Ack=55549 Win=9880 Len=0 TSval=2984794819 TSecr=3380139113"
"171","20:36:32.011473","192.87.28.82","192.168.0.74","TCP","1474","9001  >  53922 [ACK] Seq=55549 Ack=3709 Win=1043 Len=1408 TSval=3380139132 TSecr=2984794784 [TCP PDU reassembled in 173]"
"172","20:36:32.011476","192.87.28.82","192.168.0.74","TCP","1474","9001  >  53922 [ACK] Seq=56957 Ack=3709 Win=1043 Len=1408 TSval=3380139132 TSecr=2984794784 [TCP PDU reassembled in 173]"
"173","20:36:32.011477","192.87.28.82","192.168.0.74","TLSv1.2","870","Application Data"
"174","20:36:32.011583","192.168.0.74","192.87.28.82","TCP","66","53922  >  9001 [ACK] Seq=4781 Ack=59169 Win=9824 Len=0 TSval=2984794837 TSecr=3380139132"
"175","20:36:32.011694","192.168.0.74","192.87.28.82","TCP","66","[TCP Window Update] 53922  >  9001 [ACK] Seq=4781 Ack=59169 Win=9880 Len=0 TSval=2984794837 TSecr=3380139132"
"176","20:36:32.020402","192.87.28.82","192.168.0.74","TCP","1474","9001  >  53922 [ACK] Seq=59169 Ack=3709 Win=1043 Len=1408 TSval=3380139142 TSecr=2984794796 [TCP PDU reassembled in 178]"
"177","20:36:32.020405","192.87.28.82","192.168.0.74","TCP","1474","9001  >  53922 [ACK] Seq=60577 Ack=3709 Win=1043 Len=1408 TSval=3380139142 TSecr=2984794796 [TCP PDU reassembled in 178]"
"178","20:36:32.020406","192.87.28.82","192.168.0.74","TLSv1.2","1320","Application Data"
"179","20:36:32.020592","192.168.0.74","192.87.28.82","TLSv1.2","602","Application Data"
"180","20:36:32.027252","192.87.28.82","192.168.0.74","TLSv1.2","1474","Application Data"
"181","20:36:32.027255","192.87.28.82","192.168.0.74","TCP","1474","9001  >  53922 [ACK] Seq=64647 Ack=3709 Win=1043 Len=1408 TSval=3380139149 TSecr=2984794796 [TCP PDU reassembled in 187]"
"182","20:36:32.027411","192.168.0.74","192.87.28.82","TCP","66","53922  >  9001 [ACK] Seq=5317 Ack=66055 Win=9880 Len=0 TSval=2984794853 TSecr=3380139149"
"183","20:36:32.034022","64.65.63.120","192.168.0.74","TCP","1474","443  >  53923 [ACK] Seq=51885 Ack=2145 Win=1447 Len=1408 TSval=2626293220 TSecr=39054882 [TCP PDU reassembled in 185]"
"184","20:36:32.034024","64.65.63.120","192.168.0.74","TCP","1474","443  >  53923 [PSH, ACK] Seq=53293 Ack=2145 Win=1447 Len=1408 TSval=2626293220 TSecr=39054882 [TCP PDU reassembled in 185]"
"185","20:36:32.034025","64.65.63.120","192.168.0.74","TLSv1.2","870","Application Data"
"186","20:36:32.034195","192.168.0.74","64.65.63.120","TCP","66","53923  >  443 [ACK] Seq=2145 Ack=55505 Win=6536 Len=0 TSval=39055004 TSecr=2626293220"
"187","20:36:32.041427","192.87.28.82","192.168.0.74","TLSv1.2","1474","Application Data"
"188","20:36:32.041429","192.87.28.82","192.168.0.74","TCP","1474","9001  >  53922 [ACK] Seq=67463 Ack=4781 Win=1043 Len=1408 TSval=3380139162 TSecr=2984794818 [TCP PDU reassembled in 189]"
"189","20:36:32.041430","192.87.28.82","192.168.0.74","TLSv1.2","1246","Application Data"
"190","20:36:32.041533","192.168.0.74","192.87.28.82","TCP","66","53922  >  9001 [ACK] Seq=5317 Ack=70051 Win=9818 Len=0 TSval=2984794867 TSecr=3380139162"
"191","20:36:32.041602","192.168.0.74","192.87.28.82","TCP","66","[TCP Window Update] 53922  >  9001 [ACK] Seq=5317 Ack=70051 Win=9880 Len=0 TSval=2984794867 TSecr=3380139162"
"192","20:36:32.041814","64.65.63.120","192.168.0.74","TCP","1474","443  >  53923 [ACK] Seq=55505 Ack=2145 Win=1447 Len=1408 TSval=2626293230 TSecr=39054882 [TCP PDU reassembled in 198]"
"193","20:36:32.041816","64.65.63.120","192.168.0.74","TCP","1474","443  >  53923 [PSH, ACK] Seq=56913 Ack=2145 Win=1447 Len=1408 TSval=2626293230 TSecr=39054882 [TCP PDU reassembled in 198]"
"194","20:36:32.041891","192.168.0.74","64.65.63.120","TCP","66","53923  >  443 [ACK] Seq=2145 Ack=58321 Win=6536 Len=0 TSval=39055012 TSecr=2626293230"
"195","20:36:32.044214","192.87.28.82","192.168.0.74","TCP","1474","9001  >  53922 [ACK] Seq=70051 Ack=4781 Win=1043 Len=1408 TSval=3380139167 TSecr=2984794818 [TCP PDU reassembled in 196]"
"196","20:36:32.044215","192.87.28.82","192.168.0.74","TLSv1.2","1250","Application Data"
"197","20:36:32.044275","192.168.0.74","192.87.28.82","TCP","66","53922  >  9001 [ACK] Seq=5317 Ack=72643 Win=9880 Len=0 TSval=2984794870 TSecr=3380139167"
"198","20:36:32.050724","64.65.63.120","192.168.0.74","TLSv1.2","1474","Application Data, Application Data"
"199","20:36:32.050969","192.168.0.74","64.65.63.120","TLSv1.2","602","Application Data"
"200","20:36:32.053738","192.87.28.82","192.168.0.74","TCP","1474","9001  >  53922 [ACK] Seq=72643 Ack=4781 Win=1043 Len=1408 TSval=3380139175 TSecr=2984794837 [TCP PDU reassembled in 202]"
"201","20:36:32.053740","192.87.28.82","192.168.0.74","TCP","1474","9001  >  53922 [ACK] Seq=74051 Ack=4781 Win=1043 Len=1408 TSval=3380139175 TSecr=2984794837 [TCP PDU reassembled in 202]"
"202","20:36:32.053741","192.87.28.82","192.168.0.74","TLSv1.2","356","Application Data"
"203","20:36:32.053833","192.168.0.74","192.87.28.82","TCP","66","53922  >  9001 [ACK] Seq=5317 Ack=75749 Win=9880 Len=0 TSval=2984794880 TSecr=3380139175"
"204","20:36:32.056593","64.65.63.120","192.168.0.74","TLSv1.2","1474","Application Data"
"205","20:36:32.056595","64.65.63.120","192.168.0.74","TCP","1474","443  >  53923 [PSH, ACK] Seq=61137 Ack=2145 Win=1447 Len=1408 TSval=2626293244 TSecr=39054882 [TCP PDU reassembled in 211]"
"206","20:36:32.056597","64.65.63.120","192.168.0.74","TCP","1474","443  >  53923 [ACK] Seq=62545 Ack=2145 Win=1447 Len=1408 TSval=2626293244 TSecr=39054882 [TCP PDU reassembled in 211]"
"207","20:36:32.056710","192.168.0.74","64.65.63.120","TCP","66","53923  >  443 [ACK] Seq=2681 Ack=63953 Win=6536 Len=0 TSval=39055026 TSecr=2626293244"
"208","20:36:32.059129","192.87.28.82","192.168.0.74","TCP","1474","9001  >  53922 [ACK] Seq=75749 Ack=5317 Win=1043 Len=1408 TSval=3380139185 TSecr=2984794846 [TCP PDU reassembled in 209]"
"209","20:36:32.059131","192.87.28.82","192.168.0.74","TLSv1.2","1250","Application Data"
"210","20:36:32.059223","192.168.0.74","192.87.28.82","TLSv1.2","602","Application Data"
"211","20:36:32.068577","64.65.63.120","192.168.0.74","TLSv1.2","1474","Application Data"
"212","20:36:32.068580","64.65.63.120","192.168.0.74","TCP","1474","443  >  53923 [PSH, ACK] Seq=65361 Ack=2145 Win=1447 Len=1408 TSval=2626293254 TSecr=39054882 [TCP PDU reassembled in 217]"
"213","20:36:32.068581","64.65.63.120","192.168.0.74","TCP","1474","443  >  53923 [ACK] Seq=66769 Ack=2145 Win=1447 Len=1408 TSval=2626293254 TSecr=39054882 [TCP PDU reassembled in 217]"
"214","20:36:32.068582","192.87.28.82","192.168.0.74","TCP","1474","9001  >  53922 [ACK] Seq=78341 Ack=5317 Win=1043 Len=1408 TSval=3380139194 TSecr=2984794853 [TCP PDU reassembled in 216]"
"215","20:36:32.068583","192.87.28.82","192.168.0.74","TCP","1474","9001  >  53922 [ACK] Seq=79749 Ack=5317 Win=1043 Len=1408 TSval=3380139194 TSecr=2984794853 [TCP PDU reassembled in 216]"
"216","20:36:32.068585","192.87.28.82","192.168.0.74","TLSv1.2","356","Application Data"
"217","20:36:32.069112","64.65.63.120","192.168.0.74","TLSv1.2","1474","Application Data, Application Data"
"218","20:36:32.069113","64.65.63.120","192.168.0.74","TCP","1474","443  >  53923 [PSH, ACK] Seq=69585 Ack=2145 Win=1447 Len=1408 TSval=2626293256 TSecr=39054882 [TCP PDU reassembled in 227]"
"219","20:36:32.069304","192.168.0.74","64.65.63.120","TCP","66","53923  >  443 [ACK] Seq=2681 Ack=70993 Win=6536 Len=0 TSval=39055039 TSecr=2626293256"
"220","20:36:32.069375","192.168.0.74","192.87.28.82","TCP","66","53922  >  9001 [ACK] Seq=5853 Ack=81447 Win=9880 Len=0 TSval=2984794895 TSecr=3380139194"
"221","20:36:32.082211","192.87.28.82","192.168.0.74","TCP","1474","9001  >  53922 [ACK] Seq=81447 Ack=5317 Win=1043 Len=1408 TSval=3380139208 TSecr=2984794870 [TCP PDU reassembled in 223]"
"222","20:36:32.082213","192.87.28.82","192.168.0.74","TCP","1474","9001  >  53922 [ACK] Seq=82855 Ack=5317 Win=1043 Len=1408 TSval=3380139208 TSecr=2984794870 [TCP PDU reassembled in 223]"
"223","20:36:32.082214","192.87.28.82","192.168.0.74","TLSv1.2","1320","Application Data"
"224","20:36:32.082216","192.87.28.82","192.168.0.74","TCP","1474","9001  >  53922 [ACK] Seq=85517 Ack=5317 Win=1043 Len=1408 TSval=3380139208 TSecr=2984794870 [TCP PDU reassembled in 225]"
"225","20:36:32.082217","192.87.28.82","192.168.0.74","TLSv1.2","286","Application Data"
"226","20:36:32.082218","64.65.63.120","192.168.0.74","TCP","1474","443  >  53923 [ACK] Seq=70993 Ack=2145 Win=1447 Len=1408 TSval=2626293267 TSecr=39054882 [TCP PDU reassembled in 227]"
"227","20:36:32.082220","64.65.63.120","192.168.0.74","TLSv1.2","1474","Application Data"
"228","20:36:32.082221","64.65.63.120","192.168.0.74","TCP","1474","443  >  53923 [PSH, ACK] Seq=73809 Ack=2145 Win=1447 Len=1408 TSval=2626293269 TSecr=39055004 [TCP PDU reassembled in 229]"
"229","20:36:32.082222","64.65.63.120","192.168.0.74","TLSv1.2","1474","Application Data"
"230","20:36:32.082224","64.65.63.120","192.168.0.74","TLSv1.2","732","Application Data"
"231","20:36:32.082410","192.168.0.74","64.65.63.120","TCP","66","53923  >  443 [ACK] Seq=2681 Ack=77291 Win=6536 Len=0 TSval=39055052 TSecr=2626293269"
"232","20:36:32.082503","192.168.0.74","192.87.28.82","TCP","66","53922  >  9001 [ACK] Seq=5853 Ack=87145 Win=9880 Len=0 TSval=2984794908 TSecr=3380139208"
"233","20:36:32.093791","64.65.63.120","192.168.0.74","TCP","1474","443  >  53923 [ACK] Seq=77291 Ack=2145 Win=1447 Len=1408 TSval=2626293280 TSecr=39055012 [TCP PDU reassembled in 244]"
"234","20:36:32.093794","64.65.63.120","192.168.0.74","TCP","1474","443  >  53923 [PSH, ACK] Seq=78699 Ack=2145 Win=1447 Len=1408 TSval=2626293280 TSecr=39055012 [TCP PDU reassembled in 244]"
"235","20:36:32.093975","192.168.0.74","64.65.63.120","TLSv1.2","602","Application Data"
"236","20:36:32.097714","192.87.28.82","192.168.0.74","TCP","1474","9001  >  53922 [ACK] Seq=87145 Ack=5853 Win=1043 Len=1408 TSval=3380139223 TSecr=2984794885 [TCP PDU reassembled in 238]"
"237","20:36:32.097716","192.87.28.82","192.168.0.74","TCP","1474","9001  >  53922 [ACK] Seq=88553 Ack=5853 Win=1043 Len=1408 TSval=3380139223 TSecr=2984794885 [TCP PDU reassembled in 238]"
"238","20:36:32.097717","192.87.28.82","192.168.0.74","TLSv1.2","1320","Application Data"
"239","20:36:32.097719","192.87.28.82","192.168.0.74","TLSv1.2","1474","Application Data"
"240","20:36:32.097720","192.87.28.82","192.168.0.74","TLSv1.2","308","Application Data"
"241","20:36:32.097816","192.168.0.74","192.87.28.82","TCP","66","53922  >  9001 [ACK] Seq=5853 Ack=92865 Win=9791 Len=0 TSval=2984794923 TSecr=3380139223"
"242","20:36:32.097935","192.168.0.74","192.87.28.82","TCP","66","[TCP Window Update] 53922  >  9001 [ACK] Seq=5853 Ack=92865 Win=9880 Len=0 TSval=2984794924 TSecr=3380139223"
"243","20:36:32.098023","192.168.0.74","192.87.28.82","TLSv1.2","602","Application Data"
"244","20:36:32.099246","64.65.63.120","192.168.0.74","TLSv1.2","1474","Application Data"
"245","20:36:32.099277","192.168.0.74","64.65.63.120","TCP","66","53923  >  443 [ACK] Seq=3217 Ack=81515 Win=6514 Len=0 TSval=39055069 TSecr=2626293287"
"246","20:36:32.102096","192.87.28.82","192.168.0.74","TCP","1474","9001  >  53922 [ACK] Seq=92865 Ack=5853 Win=1043 Len=1408 TSval=3380139228 TSecr=2984794895 [TCP PDU reassembled in 248]"
"247","20:36:32.102097","192.87.28.82","192.168.0.74","TCP","1474","9001  >  53922 [ACK] Seq=94273 Ack=5853 Win=1043 Len=1408 TSval=3380139228 TSecr=2984794895 [TCP PDU reassembled in 248]"
"248","20:36:32.102099","192.87.28.82","192.168.0.74","TLSv1.2","356","Application Data"
"249","20:36:32.102169","192.168.0.74","192.87.28.82","TCP","66","53922  >  9001 [ACK] Seq=6389 Ack=95971 Win=9880 Len=0 TSval=2984794928 TSecr=3380139228"
"250","20:36:32.108726","64.65.63.120","192.168.0.74","TCP","1474","443  >  53923 [ACK] Seq=81515 Ack=2681 Win=1464 Len=1408 TSval=2626293296 TSecr=39055026 [TCP PDU reassembled in 254]"
"251","20:36:32.108729","64.65.63.120","192.168.0.74","TCP","1474","443  >  53923 [PSH, ACK] Seq=82923 Ack=2681 Win=1464 Len=1408 TSval=2626293296 TSecr=39055026 [TCP PDU reassembled in 254]"
"252","20:36:32.108731","192.87.28.82","192.168.0.74","TCP","1474","9001  >  53922 [ACK] Seq=95971 Ack=5853 Win=1043 Len=1408 TSval=3380139236 TSecr=2984794895 [TCP PDU reassembled in 253]"
"253","20:36:32.108732","192.87.28.82","192.168.0.74","TLSv1.2","1250","Application Data"
"254","20:36:32.108733","64.65.63.120","192.168.0.74","TLSv1.2","1474","Application Data, Application Data"
"255","20:36:32.108877","192.168.0.74","64.65.63.120","TCP","66","53923  >  443 [ACK] Seq=3217 Ack=85739 Win=6536 Len=0 TSval=39055079 TSecr=2626293298"
"256","20:36:32.108922","192.168.0.74","192.87.28.82","TCP","66","53922  >  9001 [ACK] Seq=6389 Ack=98563 Win=9880 Len=0 TSval=2984794935 TSecr=3380139236"
"257","20:36:32.116739","64.65.63.120","192.168.0.74","TCP","1474","443  >  53923 [ACK] Seq=85739 Ack=2681 Win=1464 Len=1408 TSval=2626293303 TSecr=39055039 [TCP PDU reassembled in 259]"
"258","20:36:32.116742","64.65.63.120","192.168.0.74","TCP","1474","443  >  53923 [PSH, ACK] Seq=87147 Ack=2681 Win=1464 Len=1408 TSval=2626293303 TSecr=39055039 [TCP PDU reassembled in 259]"
"259","20:36:32.116744","64.65.63.120","192.168.0.74","TLSv1.2","1474","Application Data"
"260","20:36:32.116745","64.65.63.120","192.168.0.74","TCP","1474","443  >  53923 [PSH, ACK] Seq=89963 Ack=2681 Win=1464 Len=1408 TSval=2626293303 TSecr=39055039 [TCP PDU reassembled in 271]"
"261","20:36:32.116747","192.87.28.82","192.168.0.74","TCP","1474","9001  >  53922 [ACK] Seq=98563 Ack=5853 Win=1043 Len=1408 TSval=3380139243 TSecr=2984794908 [TCP PDU reassembled in 263]"
"262","20:36:32.116748","192.87.28.82","192.168.0.74","TCP","1474","9001  >  53922 [ACK] Seq=99971 Ack=5853 Win=1043 Len=1408 TSval=3380139243 TSecr=2984794908 [TCP PDU reassembled in 263]"
"263","20:36:32.116749","192.87.28.82","192.168.0.74","TLSv1.2","356","Application Data"
"264","20:36:32.116939","192.168.0.74","64.65.63.120","TCP","66","53923  >  443 [ACK] Seq=3217 Ack=91371 Win=6536 Len=0 TSval=39055087 TSecr=2626293303"
"265","20:36:32.116985","192.168.0.74","192.87.28.82","TCP","66","53922  >  9001 [ACK] Seq=6389 Ack=101669 Win=9880 Len=0 TSval=2984794943 TSecr=3380139243"
"266","20:36:32.124848","192.87.28.82","192.168.0.74","TCP","1474","9001  >  53922 [ACK] Seq=101669 Ack=5853 Win=1043 Len=1408 TSval=3380139250 TSecr=2984794908 [TCP PDU reassembled in 268]"
"267","20:36:32.124851","192.87.28.82","192.168.0.74","TCP","1474","9001  >  53922 [ACK] Seq=103077 Ack=5853 Win=1043 Len=1408 TSval=3380139250 TSecr=2984794908 [TCP PDU reassembled in 268]"
"268","20:36:32.124853","192.87.28.82","192.168.0.74","TLSv1.2","356","Application Data"
"269","20:36:32.124973","192.168.0.74","192.87.28.82","TCP","66","53922  >  9001 [ACK] Seq=6389 Ack=104775 Win=9880 Len=0 TSval=2984794951 TSecr=3380139250"
"270","20:36:32.132106","64.65.63.120","192.168.0.74","TCP","1474","443  >  53923 [ACK] Seq=91371 Ack=2681 Win=1464 Len=1408 TSval=2626293318 TSecr=39055052 [TCP PDU reassembled in 271]"
