"No.","Time","Source","Destination","Protocol","Length","Info"
"1","20:33:09.473350","192.168.0.74","31.192.108.181","TLSv1.2","571","Application Data"
"2","20:33:09.570959","31.192.108.181","192.168.0.74","TCP","66","443  >  59649 [ACK] Seq=1 Ack=506 Win=51 Len=0 TSval=2481043131 TSecr=2379815180"
"3","20:33:09.680982","64.65.63.120","192.168.0.74","TLSv1.2","602","Application Data"
"4","20:33:09.681103","192.168.0.74","64.65.63.120","TCP","66","53923  >  443 [ACK] Seq=1 Ack=537 Win=6528 Len=0 TSval=38852642 TSecr=2626090876"
"5","20:33:09.691158","31.192.108.181","192.168.0.74","TLSv1.2","243","Application Data"
"6","20:33:09.691408","192.168.0.74","31.192.108.181","TCP","66","59649  >  443 [ACK] Seq=506 Ack=178 Win=2046 Len=0 TSval=2379815398 TSecr=2481043251"
"7","20:33:09.752794","31.192.108.181","192.168.0.74","TLSv1.2","243","Application Data"
"8","20:33:09.753194","192.168.0.74","31.192.108.181","TCP","66","59649  >  443 [ACK] Seq=506 Ack=355 Win=2046 Len=0 TSval=2379815459 TSecr=2481043314"
"9","20:33:09.791804","31.192.108.181","192.168.0.74","TLSv1.2","209","Application Data"
"10","20:33:09.792210","192.168.0.74","31.192.108.181","TCP","66","59649  >  443 [ACK] Seq=506 Ack=498 Win=2046 Len=0 TSval=2379815498 TSecr=2481043343"
"11","20:33:09.795742","192.168.0.74","152.66.36.17","TCP","78","59650  >  443 [SYN] Seq=0 Win=65535 Len=0 MSS=1460 WS=64 TSval=2051651074 TSecr=0 SACK_PERM"
"12","20:33:09.813554","152.66.36.17","192.168.0.74","TCP","74","443  >  59650 [SYN, ACK] Seq=0 Ack=1 Win=65160 Len=0 MSS=1420 SACK_PERM TSval=3908645150 TSecr=2051651074 WS=128"
"13","20:33:09.814476","192.168.0.74","152.66.36.17","TCP","66","59650  >  443 [ACK] Seq=1 Ack=1 Win=132352 Len=0 TSval=2051651092 TSecr=3908645150"
"14","20:33:09.814501","192.168.0.74","152.66.36.17","TCP","1474","59650  >  443 [ACK] Seq=1 Ack=1 Win=132352 Len=1408 TSval=2051651093 TSecr=3908645150 [TCP PDU reassembled in 15]"
"15","20:33:09.814506","192.168.0.74","152.66.36.17","TLSv1.3","195","Client Hello (SNI=edu.vik.bme.hu)"
"16","20:33:09.824911","fe80::49c:fb07:3c9a:aa62","fe80::1817:fddd:60ce:b28f","ICMPv6","86","Neighbor Solicitation for fe80::1817:fddd:60ce:b28f from ee:99:94:f5:59:fd"
"17","20:33:09.836676","152.66.36.17","192.168.0.74","TCP","66","443  >  59650 [ACK] Seq=1 Ack=1538 Win=63744 Len=0 TSval=3908645173 TSecr=2051651093"
"18","20:33:09.855300","152.66.36.17","192.168.0.74","TLSv1.3","1474","Server Hello, Change Cipher Spec, Application Data"
"19","20:33:09.855304","152.66.36.17","192.168.0.74","TCP","1474","443  >  59650 [PSH, ACK] Seq=1409 Ack=1538 Win=64128 Len=1408 TSval=3908645192 TSecr=2051651093 [TCP PDU reassembled in 20]"
"20","20:33:09.855307","152.66.36.17","192.168.0.74","TLSv1.3","908","Application Data, Application Data, Application Data"
"21","20:33:09.856522","192.168.0.74","152.66.36.17","TCP","66","59650  >  443 [ACK] Seq=1538 Ack=3659 Win=128704 Len=0 TSval=2051651134 TSecr=3908645192"
"22","20:33:09.864406","192.168.0.74","152.66.36.17","TLSv1.3","146","Change Cipher Spec, Application Data"
"23","20:33:09.865928","192.168.0.74","152.66.36.17","TLSv1.3","1455","Application Data"
"24","20:33:09.866068","192.168.0.74","152.66.36.17","TLSv1.3","154","Application Data"
"25","20:33:09.877360","152.66.36.17","192.168.0.74","TLSv1.3","145","Application Data"
"26","20:33:09.877363","152.66.36.17","192.168.0.74","TLSv1.3","145","Application Data"
"27","20:33:09.877669","192.168.0.74","152.66.36.17","TCP","66","59650  >  443 [ACK] Seq=3095 Ack=3817 Win=130944 Len=0 TSval=2051651156 TSecr=3908645217"
"28","20:33:09.881312","152.66.36.17","192.168.0.74","TCP","66","443  >  59650 [ACK] Seq=3817 Ack=3095 Win=64128 Len=0 TSval=3908645221 TSecr=2051651144"
"29","20:33:09.910048","152.66.36.17","192.168.0.74","TLSv1.3","792","Application Data"
"30","20:33:09.910828","192.168.0.74","152.66.36.17","TCP","66","59650  >  443 [ACK] Seq=3095 Ack=4543 Win=130368 Len=0 TSval=2051651188 TSecr=3908645249"
"31","20:33:09.911580","87.228.47.204","192.168.0.74","TCP","66","443  >  59571 [ACK] Seq=1 Ack=1 Win=507 Len=0 TSval=75399042 TSecr=2112348312"
"32","20:33:09.912368","192.168.0.74","87.228.47.204","TCP","66","[TCP ACKed unseen segment] 59571  >  443 [ACK] Seq=1 Ack=2 Win=2048 Len=0 TSval=2112363831 TSecr=75383584"
"33","20:33:09.925877","192.168.0.74","5.28.195.2","TCP","78","55062  >  443 [SYN] Seq=0 Win=65535 Len=0 MSS=1460 WS=16 TSval=3116179046 TSecr=0 SACK_PERM"
"34","20:33:09.926434","192.168.0.74","5.28.195.2","TCP","78","55063  >  80 [SYN] Seq=0 Win=65535 Len=0 MSS=1460 WS=16 TSval=3555839660 TSecr=0 SACK_PERM"
"35","20:33:09.926478","192.168.0.74","5.28.195.2","TCP","78","55064  >  5222 [SYN] Seq=0 Win=65535 Len=0 MSS=1460 WS=16 TSval=3195316539 TSecr=0 SACK_PERM"
"36","20:33:09.958936","fe80::1817:fddd:60ce:b28f","fe80::49c:fb07:3c9a:aa62","ICMPv6","78","Neighbor Advertisement fe80::1817:fddd:60ce:b28f (sol)"
"37","20:33:09.964345","5.28.195.2","192.168.0.74","TCP","74","443  >  55062 [SYN, ACK] Seq=0 Ack=1 Win=65535 Len=0 MSS=1240 SACK_PERM TSval=2277853326 TSecr=3116179046 WS=1024"
"38","20:33:09.964527","192.168.0.74","5.28.195.2","TCP","66","55062  >  443 [ACK] Seq=1 Ack=1 Win=1048560 Len=0 TSval=3116179085 TSecr=2277853326"
"39","20:33:09.964725","192.168.0.74","5.28.195.2","TLSv1","583","Client Hello"
"40","20:33:10.009441","5.28.195.2","192.168.0.74","TCP","66","443  >  55062 [ACK] Seq=1 Ack=518 Win=67584 Len=0 TSval=2277853367 TSecr=3116179085"
"41","20:33:10.208959","5.28.195.2","192.168.0.74","TCP","66","443  >  55062 [FIN, ACK] Seq=1 Ack=518 Win=67584 Len=0 TSval=2277853571 TSecr=3116179085"
"42","20:33:10.209060","192.168.0.74","5.28.195.2","TCP","66","55062  >  443 [ACK] Seq=518 Ack=2 Win=1048560 Len=0 TSval=3116179329 TSecr=2277853571"
"43","20:33:10.209234","192.168.0.74","5.28.195.2","TCP","66","55062  >  443 [FIN, ACK] Seq=518 Ack=2 Win=1048560 Len=0 TSval=3116179329 TSecr=2277853571"
"44","20:33:10.257410","5.28.195.2","192.168.0.74","TCP","56","443  >  55062 [RST] Seq=2 Win=0 Len=0"
"45","20:33:10.765595","192.168.0.74","5.28.195.2","TCP","78","55065  >  443 [SYN] Seq=0 Win=65535 Len=0 MSS=1460 WS=16 TSval=2537999150 TSecr=0 SACK_PERM"
"46","20:33:10.808008","5.28.195.2","192.168.0.74","TCP","74","443  >  55065 [SYN, ACK] Seq=0 Ack=1 Win=65535 Len=0 MSS=1240 SACK_PERM TSval=3042103979 TSecr=2537999150 WS=1024"
"47","20:33:10.808316","192.168.0.74","5.28.195.2","TCP","66","55065  >  443 [ACK] Seq=1 Ack=1 Win=1048560 Len=0 TSval=2537999192 TSecr=3042103979"
"48","20:33:10.808653","192.168.0.74","5.28.195.2","TLSv1","583","Client Hello"
"49","20:33:10.849683","5.28.195.2","192.168.0.74","TCP","66","443  >  55065 [ACK] Seq=1 Ack=518 Win=67584 Len=0 TSval=3042104072 TSecr=2537999193"
"50","20:33:10.849687","5.28.195.2","192.168.0.74","TCP","66","443  >  55065 [FIN, ACK] Seq=1 Ack=518 Win=67584 Len=0 TSval=3042104072 TSecr=2537999193"
"51","20:33:10.849980","192.168.0.74","5.28.195.2","TCP","66","55065  >  443 [ACK] Seq=518 Ack=2 Win=1048560 Len=0 TSval=2537999234 TSecr=3042104072"
"52","20:33:10.850276","192.168.0.74","5.28.195.2","TCP","66","55065  >  443 [FIN, ACK] Seq=518 Ack=2 Win=1048560 Len=0 TSval=2537999235 TSecr=3042104072"
"53","20:33:10.889052","5.28.195.2","192.168.0.74","TCP","56","443  >  55065 [RST] Seq=2 Win=0 Len=0"
"54","20:33:10.926379","192.168.0.74","5.28.195.2","TCP","78","[TCP Retransmission] 55064  >  5222 [SYN] Seq=0 Win=65535 Len=0 MSS=1460 WS=16 TSval=3195317540 TSecr=0 SACK_PERM"
"55","20:33:10.926448","192.168.0.74","5.28.195.2","TCP","78","[TCP Retransmission] 55063  >  80 [SYN] Seq=0 Win=65535 Len=0 MSS=1460 WS=16 TSval=3555840661 TSecr=0 SACK_PERM"
"56","20:33:11.529813","192.168.0.74","192.87.28.82","TCP","1474","53922  >  9001 [ACK] Seq=1 Ack=1 Win=9880 Len=1408 TSval=2984594347 TSecr=3379933104 [TCP PDU reassembled in 57]"
"57","20:33:11.529835","192.168.0.74","192.87.28.82","TLSv1.2","1250","Application Data"
"58","20:33:11.579159","192.87.28.82","192.168.0.74","TCP","66","9001  >  53922 [ACK] Seq=1 Ack=2593 Win=1025 Len=0 TSval=3379938703 TSecr=2984594347"
"59","20:33:11.643889","192.168.0.74","192.87.28.82","TLSv1.2","602","Application Data"
"60","20:33:11.643928","192.168.0.74","64.65.63.120","TCP","1474","53923  >  443 [ACK] Seq=1 Ack=537 Win=6536 Len=1408 TSval=38854605 TSecr=2626090876 [TCP PDU reassembled in 62]"
"61","20:33:11.643929","192.168.0.74","64.65.63.120","TCP","1474","53923  >  443 [ACK] Seq=1409 Ack=537 Win=6536 Len=1408 TSval=38854605 TSecr=2626090876 [TCP PDU reassembled in 62]"
"62","20:33:11.643932","192.168.0.74","64.65.63.120","TLSv1.2","356","Application Data"
"63","20:33:11.684569","192.87.28.82","192.168.0.74","TLSv1.2","602","Application Data"
"64","20:33:11.684659","192.168.0.74","192.87.28.82","TCP","66","53922  >  9001 [ACK] Seq=3129 Ack=537 Win=9872 Len=0 TSval=2984594502 TSecr=3379938809"
"65","20:33:11.685332","192.168.0.74","192.87.28.82","TLSv1.2","602","Application Data"
"66","20:33:11.699563","64.65.63.120","192.168.0.74","TCP","66","443  >  53923 [ACK] Seq=537 Ack=2817 Win=1853 Len=0 TSval=2626092886 TSecr=38854605"
"67","20:33:11.699564","64.65.63.120","192.168.0.74","TCP","66","443  >  53923 [ACK] Seq=537 Ack=3107 Win=1875 Len=0 TSval=2626092886 TSecr=38854605"
"68","20:33:11.702262","64.65.63.120","192.168.0.74","TLSv1.2","602","Application Data"
"69","20:33:11.702357","192.168.0.74","64.65.63.120","TCP","66","53923  >  443 [ACK] Seq=3107 Ack=1073 Win=6528 Len=0 TSval=38854664 TSecr=2626092888"
"70","20:33:11.702810","192.168.0.74","64.65.63.120","TLSv1.2","602","Application Data"
"71","20:33:11.749202","192.87.28.82","192.168.0.74","TLSv1.2","602","Application Data"
"72","20:33:11.749391","192.168.0.74","192.87.28.82","TCP","66","53922  >  9001 [ACK] Seq=3665 Ack=1073 Win=9872 Len=0 TSval=2984594567 TSecr=3379938873"
"73","20:33:11.749985","192.168.0.74","192.87.28.82","TLSv1.2","602","Application Data"
"74","20:33:11.777661","64.65.63.120","192.168.0.74","TLSv1.2","602","Application Data"
"75","20:33:11.777874","192.168.0.74","64.65.63.120","TCP","66","53923  >  443 [ACK] Seq=3643 Ack=1609 Win=6528 Len=0 TSval=38854739 TSecr=2626092965"
"76","20:33:11.778525","192.168.0.74","64.65.63.120","TLSv1.2","602","Application Data"
"77","20:33:11.789322","192.87.28.82","192.168.0.74","TCP","66","9001  >  53922 [ACK] Seq=1073 Ack=4201 Win=1043 Len=0 TSval=3379938913 TSecr=2984594567"
"78","20:33:11.845382","192.87.28.82","192.168.0.74","TLSv1.2","602","Application Data"
"79","20:33:11.845541","192.168.0.74","192.87.28.82","TCP","66","53922  >  9001 [ACK] Seq=4201 Ack=1609 Win=9872 Len=0 TSval=2984594663 TSecr=3379938971"
"80","20:33:11.846896","192.168.0.74","192.87.28.82","TLSv1.2","602","Application Data"
"81","20:33:11.876448","64.65.63.120","192.168.0.74","TLSv1.2","602","Application Data"
"82","20:33:11.876608","192.168.0.74","64.65.63.120","TCP","66","53923  >  443 [ACK] Seq=4179 Ack=2145 Win=6528 Len=0 TSval=38854838 TSecr=2626093066"
"83","20:33:11.877851","192.168.0.74","64.65.63.120","TLSv1.2","602","Application Data"
"84","20:33:11.883381","64.65.63.120","192.168.0.74","TCP","66","443  >  53923 [ACK] Seq=1609 Ack=4179 Win=1906 Len=0 TSval=2626093055 TSecr=38854740"
"85","20:33:11.923197","192.87.28.82","192.168.0.74","TCP","66","9001  >  53922 [ACK] Seq=1609 Ack=4737 Win=1043 Len=0 TSval=3379939050 TSecr=2984594664"
"86","20:33:11.923200","64.65.63.120","192.168.0.74","TCP","66","443  >  53923 [ACK] Seq=2145 Ack=4715 Win=1914 Len=0 TSval=2626093115 TSecr=38854839"
"87","20:33:11.927694","192.168.0.74","5.28.195.2","TCP","78","[TCP Retransmission] 55064  >  5222 [SYN] Seq=0 Win=65535 Len=0 MSS=1460 WS=16 TSval=3195318541 TSecr=0 SACK_PERM"
"88","20:33:11.927744","192.168.0.74","5.28.195.2","TCP","78","[TCP Retransmission] 55063  >  80 [SYN] Seq=0 Win=65535 Len=0 MSS=1460 WS=16 TSval=3555841662 TSecr=0 SACK_PERM"
"89","20:33:11.942953","192.87.28.82","192.168.0.74","TLSv1.2","602","Application Data"
"90","20:33:11.943110","192.168.0.74","192.87.28.82","TCP","66","53922  >  9001 [ACK] Seq=4737 Ack=2145 Win=9872 Len=0 TSval=2984594760 TSecr=3379939070"
"91","20:33:11.943397","192.168.0.74","192.87.28.82","TLSv1.2","602","Application Data"
"92","20:33:11.974444","64.65.63.120","192.168.0.74","TLSv1.2","602","Application Data"
"93","20:33:11.974577","192.168.0.74","64.65.63.120","TCP","66","53923  >  443 [ACK] Seq=4715 Ack=2681 Win=6528 Len=0 TSval=38854936 TSecr=2626093165"
"94","20:33:11.974813","192.168.0.74","64.65.63.120","TLSv1.2","602","Application Data"
"95","20:33:12.019571","192.87.28.82","192.168.0.74","TCP","66","9001  >  53922 [ACK] Seq=2145 Ack=5273 Win=1043 Len=0 TSval=3379939146 TSecr=2984594761"
"96","20:33:12.024058","64.65.63.120","192.168.0.74","TCP","66","443  >  53923 [ACK] Seq=2681 Ack=5251 Win=1923 Len=0 TSval=2626093214 TSecr=38854936"
"97","20:33:12.036059","192.87.28.82","192.168.0.74","TLSv1.2","602","Application Data"
"98","20:33:12.036289","192.168.0.74","192.87.28.82","TCP","66","53922  >  9001 [ACK] Seq=5273 Ack=2681 Win=9872 Len=0 TSval=2984594854 TSecr=3379939162"
"99","20:33:12.037573","192.168.0.74","192.87.28.82","TCP","1474","53922  >  9001 [ACK] Seq=5273 Ack=2681 Win=9880 Len=1408 TSval=2984594855 TSecr=3379939162 [TCP PDU reassembled in 100]"
"100","20:33:12.037595","192.168.0.74","192.87.28.82","TLSv1.2","736","Application Data"
"101","20:33:12.044686","149.154.167.41","192.168.0.74","SSL","171","Continuation Data"
"102","20:33:12.044843","192.168.0.74","149.154.167.41","TCP","66","55046  >  443 [ACK] Seq=1 Ack=106 Win=65530 Len=0 TSval=433315354 TSecr=3357351643"
"103","20:33:12.072492","192.87.28.82","192.168.0.74","TCP","66","9001  >  53922 [ACK] Seq=2681 Ack=7351 Win=1011 Len=0 TSval=3379939200 TSecr=2984594855"
"104","20:33:12.256155","192.87.28.82","192.168.0.74","TCP","1474","9001  >  53922 [ACK] Seq=2681 Ack=7351 Win=1043 Len=1408 TSval=3379939382 TSecr=2984594855 [TCP PDU reassembled in 106]"
"105","20:33:12.256160","192.87.28.82","192.168.0.74","TCP","1474","9001  >  53922 [ACK] Seq=4089 Ack=7351 Win=1043 Len=1408 TSval=3379939382 TSecr=2984594855 [TCP PDU reassembled in 106]"
"106","20:33:12.256162","192.87.28.82","192.168.0.74","TLSv1.2","870","Application Data"
"107","20:33:12.256165","192.87.28.82","192.168.0.74","TCP","1474","9001  >  53922 [ACK] Seq=6301 Ack=7351 Win=1043 Len=1408 TSval=3379939384 TSecr=2984594855 [TCP PDU reassembled in 111]"
"108","20:33:12.256375","192.168.0.74","192.87.28.82","TCP","66","53922  >  9001 [ACK] Seq=7351 Ack=7709 Win=9802 Len=0 TSval=2984595074 TSecr=3379939384"
"109","20:33:12.256589","192.168.0.74","192.87.28.82","TCP","66","[TCP Window Update] 53922  >  9001 [ACK] Seq=7351 Ack=7709 Win=9880 Len=0 TSval=2984595074 TSecr=3379939384"
"110","20:33:12.258244","192.87.28.82","192.168.0.74","TCP","1474","9001  >  53922 [ACK] Seq=7709 Ack=7351 Win=1043 Len=1408 TSval=3379939384 TSecr=2984594855 [TCP PDU reassembled in 111]"
"111","20:33:12.258247","192.87.28.82","192.168.0.74","TLSv1.2","1320","Application Data"
"112","20:33:12.258395","192.168.0.74","192.87.28.82","TCP","66","53922  >  9001 [ACK] Seq=7351 Ack=10371 Win=9839 Len=0 TSval=2984595076 TSecr=3379939384"
"113","20:33:12.269694","192.87.28.82","192.168.0.74","TLSv1.2","1474","Application Data"
"114","20:33:12.269699","192.87.28.82","192.168.0.74","TLSv1.2","308","Application Data"
"115","20:33:12.269873","192.168.0.74","192.87.28.82","TCP","66","53922  >  9001 [ACK] Seq=7351 Ack=12021 Win=9855 Len=0 TSval=2984595087 TSecr=3379939396"
"116","20:33:12.272887","192.168.0.74","192.87.28.82","TLSv1.2","602","Application Data"
"117","20:33:12.346439","192.87.28.82","192.168.0.74","TCP","66","9001  >  53922 [ACK] Seq=12021 Ack=7887 Win=1043 Len=0 TSval=3379939474 TSecr=2984595090"
"118","20:33:12.346619","192.168.0.74","192.87.28.82","TLSv1.2","602","Application Data"
"119","20:33:12.369812","192.168.0.74","40.79.150.121","TCP","54","54991  >  443 [ACK] Seq=1 Ack=1 Win=2048 Len=0"
"120","20:33:12.410452","192.87.28.82","192.168.0.74","TLSv1.2","602","Application Data"
"121","20:33:12.410608","192.168.0.74","192.87.28.82","TCP","66","53922  >  9001 [ACK] Seq=8423 Ack=12557 Win=9872 Len=0 TSval=2984595228 TSecr=3379939532"
"122","20:33:12.411117","192.168.0.74","192.87.28.82","TLSv1.2","602","Application Data"
"123","20:33:12.413423","40.79.150.121","192.168.0.74","TCP","66","[TCP ACKed unseen segment] 443  >  54991 [ACK] Seq=1 Ack=2 Win=16384 Len=0 TSval=55735767 TSecr=4182944103"
"124","20:33:12.466497","192.87.28.82","192.168.0.74","TLSv1.2","602","Application Data"
"125","20:33:12.466722","192.168.0.74","192.87.28.82","TCP","66","53922  >  9001 [ACK] Seq=8959 Ack=13093 Win=9872 Len=0 TSval=2984595284 TSecr=3379939592"
"126","20:33:12.506995","192.87.28.82","192.168.0.74","TCP","1474","9001  >  53922 [ACK] Seq=13093 Ack=8959 Win=1043 Len=1408 TSval=3379939634 TSecr=2984595284 [TCP PDU reassembled in 127]"
"127","20:33:12.506998","192.87.28.82","192.168.0.74","TLSv1.2","222","Application Data"
"128","20:33:12.507117","192.168.0.74","192.87.28.82","TCP","66","53922  >  9001 [ACK] Seq=8959 Ack=14657 Win=9856 Len=0 TSval=2984595324 TSecr=3379939634"
"129","20:33:12.511293","192.168.0.74","192.87.28.82","TLSv1.2","602","Application Data"
"130","20:33:12.584616","192.87.28.82","192.168.0.74","TCP","66","9001  >  53922 [ACK] Seq=14657 Ack=9495 Win=1043 Len=0 TSval=3379939712 TSecr=2984595329"
"131","20:33:12.689112","192.87.28.82","192.168.0.74","TLSv1.2","602","Application Data"
"132","20:33:12.689242","192.168.0.74","192.87.28.82","TCP","66","53922  >  9001 [ACK] Seq=9495 Ack=15193 Win=9872 Len=0 TSval=2984595507 TSecr=3379939816"
"133","20:33:12.695793","192.168.0.74","5.28.195.2","TCP","78","55068  >  443 [SYN] Seq=0 Win=65535 Len=0 MSS=1460 WS=16 TSval=4035527855 TSecr=0 SACK_PERM"
"134","20:33:12.732434","5.28.195.2","192.168.0.74","TCP","74","443  >  55068 [SYN, ACK] Seq=0 Ack=1 Win=65535 Len=0 MSS=1240 SACK_PERM TSval=2935753749 TSecr=4035527855 WS=1024"
"135","20:33:12.732664","192.168.0.74","5.28.195.2","TCP","66","55068  >  443 [ACK] Seq=1 Ack=1 Win=1048560 Len=0 TSval=4035527892 TSecr=2935753749"
"136","20:33:12.732983","192.168.0.74","5.28.195.2","TLSv1","583","Client Hello"
"137","20:33:12.740173","192.168.0.74","192.87.28.82","TLSv1.2","602","Application Data"
"138","20:33:12.773809","5.28.195.2","192.168.0.74","TCP","66","443  >  55068 [ACK] Seq=1 Ack=518 Win=67584 Len=0 TSval=2935753818 TSecr=4035527892"
"139","20:33:12.773812","5.28.195.2","192.168.0.74","TCP","66","443  >  55068 [FIN, ACK] Seq=1 Ack=518 Win=67584 Len=0 TSval=2935753818 TSecr=4035527892"
"140","20:33:12.774009","192.168.0.74","5.28.195.2","TCP","66","55068  >  443 [ACK] Seq=518 Ack=2 Win=1048560 Len=0 TSval=4035527933 TSecr=2935753818"
"141","20:33:12.774298","192.168.0.74","5.28.195.2","TCP","66","55068  >  443 [FIN, ACK] Seq=518 Ack=2 Win=1048560 Len=0 TSval=4035527934 TSecr=2935753818"
"142","20:33:12.817543","5.28.195.2","192.168.0.74","TCP","56","443  >  55068 [RST] Seq=2 Win=0 Len=0"
"143","20:33:12.821642","192.87.28.82","192.168.0.74","TCP","66","9001  >  53922 [ACK] Seq=15193 Ack=10031 Win=1043 Len=0 TSval=3379939942 TSecr=2984595558"
"144","20:33:12.833090","192.87.28.82","192.168.0.74","TLSv1.2","602","Application Data"
"145","20:33:12.833309","192.168.0.74","192.87.28.82","TCP","66","53922  >  9001 [ACK] Seq=10031 Ack=15729 Win=9872 Len=0 TSval=2984595651 TSecr=3379939954"
"146","20:33:12.834671","192.168.0.74","192.87.28.82","TCP","1474","53922  >  9001 [ACK] Seq=10031 Ack=15729 Win=9880 Len=1408 TSval=2984595652 TSecr=3379939954 [TCP PDU reassembled in 147]"
"147","20:33:12.834699","192.168.0.74","192.87.28.82","TLSv1.2","736","Application Data"
"148","20:33:12.870912","192.87.28.82","192.168.0.74","TCP","66","9001  >  53922 [ACK] Seq=15729 Ack=12109 Win=1011 Len=0 TSval=3379939998 TSecr=2984595652"
"149","20:33:12.916045","192.87.28.82","192.168.0.74","TCP","1474","9001  >  53922 [ACK] Seq=15729 Ack=12109 Win=1043 Len=1408 TSval=3379940042 TSecr=2984595652 [TCP PDU reassembled in 151]"
"150","20:33:12.916049","192.87.28.82","192.168.0.74","TCP","1474","9001  >  53922 [ACK] Seq=17137 Ack=12109 Win=1043 Len=1408 TSval=3379940042 TSecr=2984595652 [TCP PDU reassembled in 151]"
"151","20:33:12.916052","192.87.28.82","192.168.0.74","TLSv1.2","870","Application Data"
"152","20:33:12.916220","192.168.0.74","192.87.28.82","TCP","66","53922  >  9001 [ACK] Seq=12109 Ack=19349 Win=9824 Len=0 TSval=2984595734 TSecr=3379940042"
"153","20:33:12.916346","192.168.0.74","192.87.28.82","TCP","66","[TCP Window Update] 53922  >  9001 [ACK] Seq=12109 Ack=19349 Win=9880 Len=0 TSval=2984595734 TSecr=3379940042"
"154","20:33:12.926067","192.87.28.82","192.168.0.74","TCP","1474","9001  >  53922 [ACK] Seq=19349 Ack=12109 Win=1043 Len=1408 TSval=3379940052 TSecr=2984595652 [TCP PDU reassembled in 156]"
"155","20:33:12.926070","192.87.28.82","192.168.0.74","TCP","1474","9001  >  53922 [ACK] Seq=20757 Ack=12109 Win=1043 Len=1408 TSval=3379940052 TSecr=2984595652 [TCP PDU reassembled in 156]"
"156","20:33:12.926072","192.87.28.82","192.168.0.74","TLSv1.2","870","Application Data"
"157","20:33:12.926194","192.168.0.74","192.87.28.82","TCP","66","53922  >  9001 [ACK] Seq=12109 Ack=22969 Win=9824 Len=0 TSval=2984595744 TSecr=3379940052"
"158","20:33:12.926317","192.168.0.74","192.87.28.82","TCP","66","[TCP Window Update] 53922  >  9001 [ACK] Seq=12109 Ack=22969 Win=9880 Len=0 TSval=2984595744 TSecr=3379940052"
"159","20:33:12.926466","192.168.0.74","192.87.28.82","TLSv1.2","602","Application Data"
"160","20:33:12.928493","192.168.0.74","5.28.195.2","TCP","78","[TCP Retransmission] 55064  >  5222 [SYN, ECE, CWR] Seq=0 Win=65535 Len=0 MSS=1460 WS=16 TSval=3195319542 TSecr=0 SACK_PERM"
"161","20:33:12.928522","192.168.0.74","5.28.195.2","TCP","78","[TCP Retransmission] 55063  >  80 [SYN, ECE, CWR] Seq=0 Win=65535 Len=0 MSS=1460 WS=16 TSval=3555842663 TSecr=0 SACK_PERM"
"162","20:33:12.933827","192.87.28.82","192.168.0.74","TCP","1474","9001  >  53922 [ACK] Seq=22969 Ack=12109 Win=1043 Len=1408 TSval=3379940060 TSecr=2984595652 [TCP PDU reassembled in 163]"
"163","20:33:12.933831","192.87.28.82","192.168.0.74","TLSv1.2","222","Application Data"
"164","20:33:12.933975","192.168.0.74","192.87.28.82","TCP","66","53922  >  9001 [ACK] Seq=12645 Ack=24533 Win=9856 Len=0 TSval=2984595751 TSecr=3379940060"
"165","20:33:13.002220","192.87.28.82","192.168.0.74","TCP","66","9001  >  53922 [ACK] Seq=24533 Ack=12645 Win=1043 Len=0 TSval=3379940130 TSecr=2984595744"
"166","20:33:13.002414","192.168.0.74","192.87.28.82","TLSv1.2","1138","Application Data, Application Data"
"167","20:33:13.085914","192.87.28.82","192.168.0.74","TCP","66","9001  >  53922 [ACK] Seq=24533 Ack=13717 Win=1043 Len=0 TSval=3379940204 TSecr=2984595820"
"168","20:33:13.100934","192.87.28.82","192.168.0.74","TLSv1.2","602","Application Data"
"169","20:33:13.101281","192.168.0.74","192.87.28.82","TCP","66","53922  >  9001 [ACK] Seq=13717 Ack=25069 Win=9880 Len=0 TSval=2984595919 TSecr=3379940226"
"170","20:33:13.101993","192.168.0.74","192.87.28.82","TLSv1.2","602","Application Data"
"171","20:33:13.177392","192.87.28.82","192.168.0.74","TCP","66","9001  >  53922 [ACK] Seq=25069 Ack=14253 Win=1043 Len=0 TSval=3379940304 TSecr=2984595919"
"172","20:33:13.646425","192.87.28.82","192.168.0.74","TCP","1474","9001  >  53922 [ACK] Seq=25069 Ack=14253 Win=1043 Len=1408 TSval=3379940613 TSecr=2984595919 [TCP PDU reassembled in 174]"
"173","20:33:13.646428","192.87.28.82","192.168.0.74","TCP","1474","9001  >  53922 [ACK] Seq=26477 Ack=14253 Win=1043 Len=1408 TSval=3379940613 TSecr=2984595919 [TCP PDU reassembled in 174]"
"174","20:33:13.646431","192.87.28.82","192.168.0.74","TLSv1.2","870","Application Data"
"175","20:33:13.646433","192.87.28.82","192.168.0.74","TCP","1474","9001  >  53922 [ACK] Seq=28689 Ack=14253 Win=1043 Len=1408 TSval=3379940615 TSecr=2984595919 [TCP PDU reassembled in 177]"
"176","20:33:13.646435","192.87.28.82","192.168.0.74","TCP","1474","9001  >  53922 [ACK] Seq=30097 Ack=14253 Win=1043 Len=1408 TSval=3379940615 TSecr=2984595919 [TCP PDU reassembled in 177]"
"177","20:33:13.646437","192.87.28.82","192.168.0.74","TLSv1.2","870","Application Data"
"178","20:33:13.646439","192.87.28.82","192.168.0.74","TCP","1474","9001  >  53922 [ACK] Seq=32309 Ack=14253 Win=1043 Len=1408 TSval=3379940617 TSecr=2984595919 [TCP PDU reassembled in 180]"
"179","20:33:13.646441","192.87.28.82","192.168.0.74","TCP","1474","9001  >  53922 [ACK] Seq=33717 Ack=14253 Win=1043 Len=1408 TSval=3379940617 TSecr=2984595919 [TCP PDU reassembled in 180]"
"180","20:33:13.646443","192.87.28.82","192.168.0.74","TLSv1.2","1320","Application Data"
"181","20:33:13.646445","192.87.28.82","192.168.0.74","TLSv1.2","1474","Application Data"
"182","20:33:13.646447","64.65.63.120","192.168.0.74","TLSv1.2","1116","Application Data"
"183","20:33:13.646449","64.65.63.120","192.168.0.74","TCP","1474","443  >  53923 [ACK] Seq=3731 Ack=5251 Win=1923 Len=1408 TSval=2626094749 TSecr=38854936 [TCP PDU reassembled in 185]"
"184","20:33:13.646451","64.65.63.120","192.168.0.74","TCP","1474","443  >  53923 [PSH, ACK] Seq=5139 Ack=5251 Win=1923 Len=1408 TSval=2626094749 TSecr=38854936 [TCP PDU reassembled in 185]"
"185","20:33:13.646453","64.65.63.120","192.168.0.74","TLSv1.2","1474","Application Data"
"186","20:33:13.646454","64.65.63.120","192.168.0.74","TCP","1474","443  >  53923 [PSH, ACK] Seq=7955 Ack=5251 Win=1923 Len=1408 TSval=2626094773 TSecr=38854936 [TCP PDU reassembled in 188]"
"187","20:33:13.646456","64.65.63.120","192.168.0.74","TCP","1474","443  >  53923 [ACK] Seq=9363 Ack=5251 Win=1923 Len=1408 TSval=2626094773 TSecr=38854936 [TCP PDU reassembled in 188]"
"188","20:33:13.646459","64.65.63.120","192.168.0.74","TLSv1.2","1474","Application Data, Application Data"
"189","20:33:13.646461","64.65.63.120","192.168.0.74","TCP","1474","443  >  53923 [PSH, ACK] Seq=12179 Ack=5251 Win=1923 Len=1408 TSval=2626094795 TSecr=38854936 [TCP PDU reassembled in 191]"
"190","20:33:13.646462","64.65.63.120","192.168.0.74","TCP","1474","443  >  53923 [ACK] Seq=13587 Ack=5251 Win=1923 Len=1408 TSval=2626094795 TSecr=38854936 [TCP PDU reassembled in 191]"
"191","20:33:13.646464","64.65.63.120","192.168.0.74","TLSv1.2","1474","Application Data, Application Data"
"192","20:33:13.646702","192.168.0.74","64.65.63.120","TCP","66","53923  >  443 [ACK] Seq=5251 Ack=5139 Win=6498 Len=0 TSval=38856608 TSecr=2626094749"
"193","20:33:13.646765","192.168.0.74","192.87.28.82","TCP","66","53922  >  9001 [ACK] Seq=14253 Ack=37787 Win=9880 Len=0 TSval=2984596464 TSecr=3379940619"
"194","20:33:13.646768","192.168.0.74","64.65.63.120","TCP","66","53923  >  443 [ACK] Seq=5251 Ack=16403 Win=6322 Len=0 TSval=38856608 TSecr=2626094799"
"195","20:33:13.646942","192.168.0.74","192.87.28.82","TLSv1.2","602","Application Data"
"196","20:33:13.647043","192.168.0.74","64.65.63.120","TCP","66","[TCP Window Update] 53923  >  443 [ACK] Seq=5251 Ack=16403 Win=6536 Len=0 TSval=38856608 TSecr=2626094799"
"197","20:33:13.682049","192.87.28.82","192.168.0.74","TCP","1474","9001  >  53922 [ACK] Seq=37787 Ack=14253 Win=1043 Len=1408 TSval=3379940806 TSecr=2984596464 [TCP PDU reassembled in 198]"
"198","20:33:13.682053","192.87.28.82","192.168.0.74","TLSv1.2","1474","Application Data"
"199","20:33:13.682060","192.87.28.82","192.168.0.74","TLSv1.2","1474","Application Data"
"200","20:33:13.682063","192.87.28.82","192.168.0.74","TCP","1474","9001  >  53922 [ACK] Seq=42011 Ack=14253 Win=1043 Len=1408 TSval=3379940806 TSecr=2984596464 [TCP PDU reassembled in 201]"
"201","20:33:13.682065","192.87.28.82","192.168.0.74","TLSv1.2","1474","Application Data"
"202","20:33:13.682068","192.87.28.82","192.168.0.74","TCP","1474","9001  >  53922 [ACK] Seq=44827 Ack=14253 Win=1043 Len=1408 TSval=3379940806 TSecr=2984596464 [TCP PDU reassembled in 204]"
"203","20:33:13.682071","192.87.28.82","192.168.0.74","TCP","1474","9001  >  53922 [ACK] Seq=46235 Ack=14253 Win=1043 Len=1408 TSval=3379940806 TSecr=2984596464 [TCP PDU reassembled in 204]"
"204","20:33:13.682075","192.87.28.82","192.168.0.74","TLSv1.2","1474","Application Data, Application Data"
"205","20:33:13.682077","192.87.28.82","192.168.0.74","TCP","1474","9001  >  53922 [ACK] Seq=49051 Ack=14253 Win=1043 Len=1408 TSval=3379940806 TSecr=2984596464 [TCP PDU reassembled in 207]"
"206","20:33:13.682079","192.87.28.82","192.168.0.74","TCP","1474","9001  >  53922 [ACK] Seq=50459 Ack=14253 Win=1043 Len=1408 TSval=3379940806 TSecr=2984596464 [TCP PDU reassembled in 207]"
"207","20:33:13.682082","192.87.28.82","192.168.0.74","TLSv1.2","1474","Application Data"
"208","20:33:13.682085","192.87.28.82","192.168.0.74","TCP","1474","9001  >  53922 [ACK] Seq=53275 Ack=14253 Win=1043 Len=1408 TSval=3379940806 TSecr=2984596464 [TCP PDU reassembled in 230]"
"209","20:33:13.682446","192.168.0.74","192.87.28.82","TCP","66","53922  >  9001 [ACK] Seq=14789 Ack=54683 Win=9880 Len=0 TSval=2984596500 TSecr=3379940806"
"210","20:33:13.701062","64.65.63.120","192.168.0.74","TLSv1.2","1474","Application Data"
"211","20:33:13.701065","64.65.63.120","192.168.0.74","TCP","1474","443  >  53923 [PSH, ACK] Seq=17811 Ack=5251 Win=1923 Len=1408 TSval=2626094885 TSecr=38856608 [TCP PDU reassembled in 213]"
"212","20:33:13.701066","64.65.63.120","192.168.0.74","TCP","1474","443  >  53923 [ACK] Seq=19219 Ack=5251 Win=1923 Len=1408 TSval=2626094885 TSecr=38856608 [TCP PDU reassembled in 213]"
"213","20:33:13.701068","64.65.63.120","192.168.0.74","TLSv1.2","1474","Application Data, Application Data"
"214","20:33:13.701069","64.65.63.120","192.168.0.74","TCP","1474","443  >  53923 [ACK] Seq=22035 Ack=5251 Win=1923 Len=1408 TSval=2626094885 TSecr=38856608 [TCP PDU reassembled in 216]"
"215","20:33:13.701071","64.65.63.120","192.168.0.74","TCP","1474","443  >  53923 [PSH, ACK] Seq=23443 Ack=5251 Win=1923 Len=1408 TSval=2626094885 TSecr=38856608 [TCP PDU reassembled in 216]"
"216","20:33:13.701072","64.65.63.120","192.168.0.74","TLSv1.2","1474","Application Data"
"217","20:33:13.701074","64.65.63.120","192.168.0.74","TCP","1474","443  >  53923 [PSH, ACK] Seq=26259 Ack=5251 Win=1923 Len=1408 TSval=2626094885 TSecr=38856608 [TCP PDU reassembled in 218]"
"218","20:33:13.701075","64.65.63.120","192.168.0.74","TLSv1.2","1474","Application Data"
"219","20:33:13.701076","64.65.63.120","192.168.0.74","TLSv1.2","1178","Application Data"
"220","20:33:13.701190","192.168.0.74","64.65.63.120","TCP","66","53923  >  443 [ACK] Seq=5251 Ack=30187 Win=6321 Len=0 TSval=38856663 TSecr=2626094885"
"221","20:33:13.701550","192.168.0.74","64.65.63.120","TCP","66","[TCP Window Update] 53923  >  443 [ACK] Seq=5251 Ack=30187 Win=6536 Len=0 TSval=38856663 TSecr=2626094885"
"222","20:33:13.701679","192.168.0.74","64.65.63.120","TLSv1.2","602","Application Data"
"223","20:33:13.702462","64.65.63.120","192.168.0.74","TCP","1474","443  >  53923 [ACK] Seq=30187 Ack=5251 Win=1923 Len=1408 TSval=2626094888 TSecr=38856608 [TCP PDU reassembled in 227]"
"224","20:33:13.702464","64.65.63.120","192.168.0.74","TCP","1474","443  >  53923 [PSH, ACK] Seq=31595 Ack=5251 Win=1923 Len=1408 TSval=2626094888 TSecr=38856608 [TCP PDU reassembled in 227]"
"225","20:33:13.702543","192.168.0.74","64.65.63.120","TCP","66","53923  >  443 [ACK] Seq=5787 Ack=33003 Win=6492 Len=0 TSval=38856664 TSecr=2626094888"
"226","20:33:13.702648","192.168.0.74","64.65.63.120","TCP","66","[TCP Window Update] 53923  >  443 [ACK] Seq=5787 Ack=33003 Win=6536 Len=0 TSval=38856664 TSecr=2626094888"
"227","20:33:13.716494","64.65.63.120","192.168.0.74","TLSv1.2","1474","Application Data"
"228","20:33:13.716496","64.65.63.120","192.168.0.74","TCP","1474","443  >  53923 [PSH, ACK] Seq=34411 Ack=5251 Win=1923 Len=1408 TSval=2626094900 TSecr=38856608 [TCP PDU reassembled in 251]"
"229","20:33:13.716497","192.87.28.82","192.168.0.74","TCP","1474","9001  >  53922 [ACK] Seq=54683 Ack=14789 Win=1043 Len=1408 TSval=3379940841 TSecr=2984596464 [TCP PDU reassembled in 230]"
"230","20:33:13.716499","192.87.28.82","192.168.0.74","TLSv1.2","1474","Application Data"
"231","20:33:13.716500","192.87.28.82","192.168.0.74","TCP","1474","9001  >  53922 [ACK] Seq=57499 Ack=14789 Win=1043 Len=1408 TSval=3379940841 TSecr=2984596464 [TCP PDU reassembled in 232]"
"232","20:33:13.716501","192.87.28.82","192.168.0.74","TLSv1.2","1474","Application Data"
"233","20:33:13.716502","192.87.28.82","192.168.0.74","TCP","1474","9001  >  53922 [ACK] Seq=60315 Ack=14789 Win=1043 Len=1408 TSval=3379940841 TSecr=2984596464 [TCP PDU reassembled in 235]"
"234","20:33:13.716504","192.87.28.82","192.168.0.74","TCP","1474","9001  >  53922 [ACK] Seq=61723 Ack=14789 Win=1043 Len=1408 TSval=3379940841 TSecr=2984596464 [TCP PDU reassembled in 235]"
"235","20:33:13.716505","192.87.28.82","192.168.0.74","TLSv1.2","1474","Application Data"
"236","20:33:13.716506","192.87.28.82","192.168.0.74","TCP","1474","9001  >  53922 [ACK] Seq=64539 Ack=14789 Win=1043 Len=1408 TSval=3379940841 TSecr=2984596464 [TCP PDU reassembled in 238]"
"237","20:33:13.716508","192.87.28.82","192.168.0.74","TCP","1474","9001  >  53922 [ACK] Seq=65947 Ack=14789 Win=1043 Len=1408 TSval=3379940841 TSecr=2984596464 [TCP PDU reassembled in 238]"
"238","20:33:13.716509","192.87.28.82","192.168.0.74","TLSv1.2","1474","Application Data"
"239","20:33:13.716510","192.87.28.82","192.168.0.74","TCP","1474","9001  >  53922 [ACK] Seq=68763 Ack=14789 Win=1043 Len=1408 TSval=3379940841 TSecr=2984596464 [TCP PDU reassembled in 241]"
"240","20:33:13.716511","192.87.28.82","192.168.0.74","TCP","1474","9001  >  53922 [ACK] Seq=70171 Ack=14789 Win=1043 Len=1408 TSval=3379940841 TSecr=2984596464 [TCP PDU reassembled in 241]"
"241","20:33:13.716513","192.87.28.82","192.168.0.74","TLSv1.2","1474","Application Data, Application Data"
"242","20:33:13.716514","192.87.28.82","192.168.0.74","TCP","1474","9001  >  53922 [ACK] Seq=72987 Ack=14789 Win=1043 Len=1408 TSval=3379940841 TSecr=2984596464 [TCP PDU reassembled in 262]"
"243","20:33:13.716633","192.168.0.74","192.87.28.82","TLSv1.2","602","Application Data"
"244","20:33:13.716672","192.168.0.74","64.65.63.120","TCP","66","53923  >  443 [ACK] Seq=5787 Ack=35819 Win=6492 Len=0 TSval=38856678 TSecr=2626094900"
"245","20:33:13.716879","192.168.0.74","64.65.63.120","TCP","66","[TCP Window Update] 53923  >  443 [ACK] Seq=5787 Ack=35819 Win=6536 Len=0 TSval=38856678 TSecr=2626094900"
"246","20:33:13.716907","192.168.0.74","192.87.28.82","TLSv1.2","602","Application Data"
"247","20:33:13.726369","192.168.0.74","192.87.28.82","TLSv1.2","1474","Application Data, Application Data"
"248","20:33:13.726391","192.168.0.74","192.87.28.82","TLSv1.2","266","Application Data"
"249","20:33:13.734339","192.168.0.74","192.87.28.82","TLSv1.2","1474","Application Data"
"250","20:33:13.734363","192.168.0.74","192.87.28.82","TLSv1.2","758","Application Data"
"251","20:33:13.734565","64.65.63.120","192.168.0.74","TLSv1.2","1474","Application Data"
"252","20:33:13.734566","64.65.63.120","192.168.0.74","TCP","1474","443  >  53923 [PSH, ACK] Seq=37227 Ack=5251 Win=1923 Len=1408 TSval=2626094919 TSecr=38856608 [TCP PDU reassembled in 257]"
"253","20:33:13.734614","192.168.0.74","64.65.63.120","TCP","66","53923  >  443 [ACK] Seq=5787 Ack=38635 Win=6492 Len=0 TSval=38856696 TSecr=2626094919"
"254","20:33:13.734662","192.168.0.74","64.65.63.120","TCP","66","[TCP Window Update] 53923  >  443 [ACK] Seq=5787 Ack=38635 Win=6536 Len=0 TSval=38856696 TSecr=2626094919"
"255","20:33:13.738971","192.168.0.74","192.87.28.82","TLSv1.2","1474","Application Data"
"256","20:33:13.738992","192.168.0.74","192.87.28.82","TLSv1.2","244","Application Data"
"257","20:33:13.740852","64.65.63.120","192.168.0.74","TLSv1.2","1474","Application Data"
"258","20:33:13.740854","64.65.63.120","192.168.0.74","TCP","1474","443  >  53923 [PSH, ACK] Seq=40043 Ack=5251 Win=1923 Len=1408 TSval=2626094925 TSecr=38856608 [TCP PDU reassembled in 261]"
"259","20:33:13.740951","192.168.0.74","64.65.63.120","TLSv1.2","602","Application Data"
"260","20:33:13.741050","192.168.0.74","64.65.63.120","TCP","66","[TCP Window Update] 53923  >  443 [ACK] Seq=6323 Ack=41451 Win=6536 Len=0 TSval=38856702 TSecr=2626094925"
"261","20:33:13.751078","64.65.63.120","192.168.0.74","TLSv1.2","712","Application Data"
"262","20:33:13.751080","192.87.28.82","192.168.0.74","TLSv1.2","1474","Application Data"
"263","20:33:13.751181","192.168.0.74","192.87.28.82","TLSv1.2","602","Application Data"
"264","20:33:13.751214","192.168.0.74","64.65.63.120","TCP","66","53923  >  443 [ACK] Seq=6323 Ack=42097 Win=6526 Len=0 TSval=38856713 TSecr=2626094936"
"265","20:33:13.763094","192.87.28.82","192.168.0.74","TCP","1474","9001  >  53922 [ACK] Seq=75803 Ack=15325 Win=1035 Len=1408 TSval=3379940877 TSecr=2984596534 [TCP PDU reassembled in 267]"
"266","20:33:13.763096","192.87.28.82","192.168.0.74","TCP","1474","9001  >  53922 [ACK] Seq=77211 Ack=15325 Win=1035 Len=1408 TSval=3379940877 TSecr=2984596534 [TCP PDU reassembled in 267]"
"267","20:33:13.763097","192.87.28.82","192.168.0.74","TLSv1.2","1474","Application Data, Application Data"
"268","20:33:13.763098","192.87.28.82","192.168.0.74","TCP","1474","9001  >  53922 [ACK] Seq=80027 Ack=15325 Win=1035 Len=1408 TSval=3379940877 TSecr=2984596534 [TCP PDU reassembled in 270]"
"269","20:33:13.763100","192.87.28.82","192.168.0.74","TCP","1474","9001  >  53922 [ACK] Seq=81435 Ack=15325 Win=1035 Len=1408 TSval=3379940877 TSecr=2984596534 [TCP PDU reassembled in 270]"
"270","20:33:13.763101","192.87.28.82","192.168.0.74","TLSv1.2","1474","Application Data, Application Data"
"271","20:33:13.763102","192.87.28.82","192.168.0.74","TCP","1474","9001  >  53922 [ACK] Seq=84251 Ack=15325 Win=1035 Len=1408 TSval=3379940877 TSecr=2984596534 [TCP PDU reassembled in 273]"
"272","20:33:13.763103","192.87.28.82","192.168.0.74","TCP","1474","9001  >  53922 [ACK] Seq=85659 Ack=15325 Win=1035 Len=1408 TSval=3379940877 TSecr=2984596534 [TCP PDU reassembled in 273]"
"273","20:33:13.763104","192.87.28.82","192.168.0.74","TLSv1.2","1474","Application Data"
"274","20:33:13.763105","192.87.28.82","192.168.0.74","TCP","1474","9001  >  53922 [ACK] Seq=88475 Ack=15325 Win=1035 Len=1408 TSval=3379940877 TSecr=2984596534 [TCP PDU reassembled in 276]"
"275","20:33:13.763108","192.87.28.82","192.168.0.74","TCP","1474","9001  >  53922 [ACK] Seq=89883 Ack=15325 Win=1035 Len=1408 TSval=3379940877 TSecr=2984596534 [TCP PDU reassembled in 276]"
"276","20:33:13.763109","192.87.28.82","192.168.0.74","TLSv1.2","1474","Application Data"
"277","20:33:13.763111","192.87.28.82","192.168.0.74","TCP","1474","9001  >  53922 [ACK] Seq=92699 Ack=15861 Win=1027 Len=1408 TSval=3379940877 TSecr=2984596534 [TCP PDU reassembled in 278]"
"278","20:33:13.763112","192.87.28.82","192.168.0.74","TLSv1.2","1474","Application Data"
"279","20:33:13.763113","192.87.28.82","192.168.0.74","TLSv1.2","1474","Application Data, Application Data"
"280","20:33:13.763114","192.87.28.82","192.168.0.74","TCP","1474","9001  >  53922 [ACK] Seq=96923 Ack=15861 Win=1027 Len=1408 TSval=3379940877 TSecr=2984596534 [TCP PDU reassembled in 281]"
"281","20:33:13.763116","192.87.28.82","192.168.0.74","TLSv1.2","1474","Application Data"
"282","20:33:13.763117","64.65.63.120","192.168.0.74","TCP","66","443  >  53923 [ACK] Seq=42097 Ack=5787 Win=1931 Len=0 TSval=2626094941 TSecr=38856663"
"283","20:33:13.763422","192.168.0.74","192.87.28.82","TLSv1.2","602","Application Data"
"284","20:33:13.764764","64.65.63.120","192.168.0.74","TCP","1474","443  >  53923 [ACK] Seq=42097 Ack=5787 Win=1931 Len=1408 TSval=2626094948 TSecr=38856663 [TCP PDU reassembled in 286]"
"285","20:33:13.764766","64.65.63.120","192.168.0.74","TCP","1474","443  >  53923 [PSH, ACK] Seq=43505 Ack=5787 Win=1931 Len=1408 TSval=2626094948 TSecr=38856663 [TCP PDU reassembled in 286]"
"286","20:33:13.764767","64.65.63.120","192.168.0.74","TLSv1.2","1474","Application Data"
