"No.","Time","Source","Destination","Protocol","Length","Info"
"1","11:16:23.957051","2a00:1450:4025:c01::6c","2a02:ab88:b:4100:6163:ab1b:4f48:fc2c","TCP","86","993  >  60802 [ACK] Seq=1 Ack=1 Win=1054 Len=0 TSval=317753230 TSecr=4011474621"
"2","11:16:23.957053","2a00:1450:4025:c01::6c","2a02:ab88:b:4100:6163:ab1b:4f48:fc2c","TLSv1.2","1294","Server Hello"
"3","11:16:23.957055","2a00:1450:4025:c01::6c","2a02:ab88:b:4100:6163:ab1b:4f48:fc2c","TCP","1294","993  >  60802 [PSH, ACK] Seq=1209 Ack=1 Win=1054 Len=1208 TSval=317753230 TSecr=4011474621 [TCP PDU reassembled in 5]"
"4","11:16:23.957057","2a00:1450:4025:c01::6c","2a02:ab88:b:4100:6163:ab1b:4f48:fc2c","TCP","1294","993  >  60802 [ACK] Seq=2417 Ack=1 Win=1054 Len=1208 TSval=317753230 TSecr=4011474621 [TCP PDU reassembled in 5]"
"5","11:16:23.957058","2a00:1450:4025:c01::6c","2a02:ab88:b:4100:6163:ab1b:4f48:fc2c","TLSv1.2","531","Certificate, Server Key Exchange, Server Hello Done"
"6","11:16:23.957184","2a02:ab88:b:4100:6163:ab1b:4f48:fc2c","2a00:1450:4025:c01::6c","TCP","86","60802  >  993 [ACK] Seq=1 Ack=4070 Win=2005 Len=0 TSval=4011474664 TSecr=317753230"
"7","11:16:23.966174","2a02:ab88:b:4100:6163:ab1b:4f48:fc2c","2a00:1450:4025:c01::6c","TLSv1.2","161","Client Key Exchange"
"8","11:16:24.011784","2a00:1450:4025:c01::6c","2a02:ab88:b:4100:6163:ab1b:4f48:fc2c","TCP","86","993  >  60802 [ACK] Seq=4070 Ack=76 Win=1054 Len=0 TSval=317753287 TSecr=4011474673"
"9","11:16:24.011905","2a02:ab88:b:4100:6163:ab1b:4f48:fc2c","2a00:1450:4025:c01::6c","TLSv1.2","137","Change Cipher Spec, Encrypted Handshake Message"
"10","11:16:24.021477","192.168.0.74","5.28.195.2","TCP","78","60799  >  5222 [SYN] Seq=0 Win=65535 Len=0 MSS=1460 WS=16 TSval=902735761 TSecr=0 SACK_PERM"
"11","11:16:24.021515","192.168.0.74","5.28.195.2","TCP","78","60798  >  80 [SYN] Seq=0 Win=65535 Len=0 MSS=1460 WS=16 TSval=2033825671 TSecr=0 SACK_PERM"
"12","11:16:24.052168","2a00:1450:4025:c01::6c","2a02:ab88:b:4100:6163:ab1b:4f48:fc2c","TCP","86","993  >  60802 [ACK] Seq=4070 Ack=127 Win=1054 Len=0 TSval=317753328 TSecr=4011474719"
"13","11:16:24.052170","2a00:1450:4025:c01::6c","2a02:ab88:b:4100:6163:ab1b:4f48:fc2c","TLSv1.2","137","Change Cipher Spec, Encrypted Handshake Message"
"14","11:16:24.052172","2a00:1450:4025:c01::6c","2a02:ab88:b:4100:6163:ab1b:4f48:fc2c","TLSv1.2","226","Application Data"
"15","11:16:24.052317","2a02:ab88:b:4100:6163:ab1b:4f48:fc2c","2a00:1450:4025:c01::6c","TCP","86","60802  >  993 [ACK] Seq=127 Ack=4261 Win=2046 Len=0 TSval=4011474759 TSecr=317753329"
"16","11:16:24.053308","2a02:ab88:b:4100:6163:ab1b:4f48:fc2c","2a00:1450:4025:c01::6c","TLSv1.2","134","Application Data"
"17","11:16:24.095644","2a00:1450:4025:c01::6c","2a02:ab88:b:4100:6163:ab1b:4f48:fc2c","TLSv1.2","346","Application Data"
"18","11:16:24.095762","2a02:ab88:b:4100:6163:ab1b:4f48:fc2c","2a00:1450:4025:c01::6c","TCP","86","60802  >  993 [ACK] Seq=175 Ack=4521 Win=2044 Len=0 TSval=4011474803 TSecr=317753372"
"19","11:16:24.096755","2a02:ab88:b:4100:6163:ab1b:4f48:fc2c","2a00:1450:4025:c01::6c","TLSv1.2","130","Application Data"
"20","11:16:24.097393","2a02:ab88:b:4100:6163:ab1b:4f48:fc2c","2a00:1450:4025:c01::6c","TCP","86","60802  >  993 [FIN, ACK] Seq=219 Ack=4521 Win=2048 Len=0 TSval=4011474804 TSecr=317753372"
"21","11:16:24.098809","2a02:ab88:b:4100:6163:ab1b:4f48:fc2c","2a00:1450:4025:c01::6c","TCP","98","60803  >  993 [SYN, ECE, CWR] Seq=0 Win=65535 Len=0 MSS=1440 WS=64 TSval=2152399546 TSecr=0 SACK_PERM"
"22","11:16:24.150855","2a00:1450:4025:c01::6c","2a02:ab88:b:4100:6163:ab1b:4f48:fc2c","TLSv1.2","256","Application Data"
"23","11:16:24.151107","2a02:ab88:b:4100:6163:ab1b:4f48:fc2c","2a00:1450:4025:c01::6c","TCP","74","60802  >  993 [RST] Seq=219 Win=0 Len=0"
"24","11:16:24.154348","2a00:1450:4025:c01::6c","2a02:ab88:b:4100:6163:ab1b:4f48:fc2c","TCP","86","993  >  60802 [FIN, ACK] Seq=4691 Ack=219 Win=1054 Len=0 TSval=317753427 TSecr=4011474804"
"25","11:16:24.157916","2a00:1450:4025:c01::6c","2a02:ab88:b:4100:6163:ab1b:4f48:fc2c","TCP","86","993  >  60802 [ACK] Seq=4692 Ack=220 Win=1054 Len=0 TSval=317753431 TSecr=4011474804"
"26","11:16:24.157919","2a00:1450:4025:c01::6c","2a02:ab88:b:4100:6163:ab1b:4f48:fc2c","TCP","94","993  >  60803 [SYN, ACK] Seq=0 Ack=1 Win=65535 Len=0 MSS=1420 SACK_PERM TSval=886958495 TSecr=2152399546 WS=256"
"27","11:16:24.158135","2a02:ab88:b:4100:6163:ab1b:4f48:fc2c","2a00:1450:4025:c01::6c","TCP","86","60803  >  993 [ACK] Seq=1 Ack=1 Win=132352 Len=0 TSval=2152399605 TSecr=886958495"
"28","11:16:24.159487","2a02:ab88:b:4100:6163:ab1b:4f48:fc2c","2a00:1450:4025:c01::6c","TLSv1.2","292","Client Hello (SNI=imap.gmail.com)"
"29","11:16:24.203406","2a00:1450:4025:c01::6c","2a02:ab88:b:4100:6163:ab1b:4f48:fc2c","TCP","86","993  >  60803 [ACK] Seq=1 Ack=207 Win=269824 Len=0 TSval=886958541 TSecr=2152399607"
"30","11:16:24.203410","2a00:1450:4025:c01::6c","2a02:ab88:b:4100:6163:ab1b:4f48:fc2c","TLSv1.2","1294","Server Hello"
"31","11:16:24.203413","2a00:1450:4025:c01::6c","2a02:ab88:b:4100:6163:ab1b:4f48:fc2c","TCP","1294","993  >  60803 [PSH, ACK] Seq=1209 Ack=207 Win=269824 Len=1208 TSval=886958541 TSecr=2152399607 [TCP PDU reassembled in 34]"
"32","11:16:24.203650","2a02:ab88:b:4100:6163:ab1b:4f48:fc2c","2a00:1450:4025:c01::6c","TCP","86","60803  >  993 [ACK] Seq=207 Ack=2417 Win=129984 Len=0 TSval=2152399651 TSecr=886958541"
"33","11:16:24.205329","2a00:1450:4025:c01::6c","2a02:ab88:b:4100:6163:ab1b:4f48:fc2c","TCP","1294","993  >  60803 [ACK] Seq=2417 Ack=207 Win=269824 Len=1208 TSval=886958541 TSecr=2152399607 [TCP PDU reassembled in 34]"
"34","11:16:24.205331","2a00:1450:4025:c01::6c","2a02:ab88:b:4100:6163:ab1b:4f48:fc2c","TLSv1.2","532","Certificate, Server Key Exchange, Server Hello Done"
"35","11:16:24.205386","2a02:ab88:b:4100:6163:ab1b:4f48:fc2c","2a00:1450:4025:c01::6c","TCP","86","60803  >  993 [ACK] Seq=207 Ack=4071 Win=129472 Len=0 TSval=2152399653 TSecr=886958541"
"36","11:16:24.217516","2a02:ab88:b:4100:6163:ab1b:4f48:fc2c","2a00:1450:4025:c01::6c","TLSv1.2","161","Client Key Exchange"
"37","11:16:24.239614","192.168.0.192","230.0.0.1","UDP","92","58107  >  6666 Len=50"
"38","11:16:24.267098","2a00:1450:4025:c01::6c","2a02:ab88:b:4100:6163:ab1b:4f48:fc2c","TCP","86","993  >  60803 [ACK] Seq=4071 Ack=282 Win=269824 Len=0 TSval=886958605 TSecr=2152399665"
"39","11:16:24.267349","2a02:ab88:b:4100:6163:ab1b:4f48:fc2c","2a00:1450:4025:c01::6c","TLSv1.2","137","Change Cipher Spec, Encrypted Handshake Message"
"40","11:16:24.305206","2a00:1450:4025:c01::6c","2a02:ab88:b:4100:6163:ab1b:4f48:fc2c","TCP","86","993  >  60803 [ACK] Seq=4071 Ack=333 Win=269824 Len=0 TSval=886958645 TSecr=2152399714"
"41","11:16:24.305209","2a00:1450:4025:c01::6c","2a02:ab88:b:4100:6163:ab1b:4f48:fc2c","TLSv1.2","137","Change Cipher Spec, Encrypted Handshake Message"
"42","11:16:24.305211","2a00:1450:4025:c01::6c","2a02:ab88:b:4100:6163:ab1b:4f48:fc2c","TLSv1.2","228","Application Data"
"43","11:16:24.305446","2a02:ab88:b:4100:6163:ab1b:4f48:fc2c","2a00:1450:4025:c01::6c","TCP","86","60803  >  993 [ACK] Seq=333 Ack=4264 Win=130880 Len=0 TSval=2152399752 TSecr=886958645"
"44","11:16:24.307323","2a02:ab88:b:4100:6163:ab1b:4f48:fc2c","2a00:1450:4025:c01::6c","TLSv1.2","134","Application Data"
"45","11:16:24.348668","2a00:1450:4025:c01::6c","2a02:ab88:b:4100:6163:ab1b:4f48:fc2c","TLSv1.2","348","Application Data"
"46","11:16:24.348892","2a02:ab88:b:4100:6163:ab1b:4f48:fc2c","2a00:1450:4025:c01::6c","TCP","86","60803  >  993 [ACK] Seq=381 Ack=4526 Win=130816 Len=0 TSval=2152399796 TSecr=886958688"
"47","11:16:24.350329","2a02:ab88:b:4100:6163:ab1b:4f48:fc2c","2a00:1450:4025:c01::6c","TLSv1.2","130","Application Data"
"48","11:16:24.351213","2a02:ab88:b:4100:6163:ab1b:4f48:fc2c","2a00:1450:4025:c01::6c","TCP","86","60803  >  993 [FIN, ACK] Seq=425 Ack=4526 Win=131072 Len=0 TSval=2152399798 TSecr=886958688"
"49","11:16:24.353605","2a02:ab88:b:4100:6163:ab1b:4f48:fc2c","2a00:1450:4025:c01::6c","TCP","98","60804  >  993 [SYN, ECE, CWR] Seq=0 Win=65535 Len=0 MSS=1440 WS=64 TSval=2955685987 TSecr=0 SACK_PERM"
"50","11:16:24.394223","2a00:1450:4025:c01::6c","2a02:ab88:b:4100:6163:ab1b:4f48:fc2c","TLSv1.2","260","Application Data"
"51","11:16:24.394516","2a02:ab88:b:4100:6163:ab1b:4f48:fc2c","2a00:1450:4025:c01::6c","TCP","74","60803  >  993 [RST] Seq=426 Win=0 Len=0"
"52","11:16:24.396419","2a00:1450:4025:c01::6c","2a02:ab88:b:4100:6163:ab1b:4f48:fc2c","TCP","94","993  >  60804 [SYN, ACK] Seq=0 Ack=1 Win=65535 Len=0 MSS=1420 SACK_PERM TSval=587193822 TSecr=2955685987 WS=256"
"53","11:16:24.396421","2a00:1450:4025:c01::6c","2a02:ab88:b:4100:6163:ab1b:4f48:fc2c","TCP","86","993  >  60803 [FIN, ACK] Seq=4700 Ack=426 Win=269824 Len=0 TSval=886958733 TSecr=2152399797"
"54","11:16:24.396625","2a02:ab88:b:4100:6163:ab1b:4f48:fc2c","2a00:1450:4025:c01::6c","TCP","86","60804  >  993 [ACK] Seq=1 Ack=1 Win=132352 Len=0 TSval=2955686031 TSecr=587193822"
"55","11:16:24.397922","2a02:ab88:b:4100:6163:ab1b:4f48:fc2c","2a00:1450:4025:c01::6c","TLSv1.2","292","Client Hello (SNI=imap.gmail.com)"
"56","11:16:24.449101","192.168.0.192","230.0.0.1","UDP","92","62979  >  6666 Len=50"
"57","11:16:24.449104","2a00:1450:4025:c01::6c","2a02:ab88:b:4100:6163:ab1b:4f48:fc2c","TCP","86","993  >  60804 [ACK] Seq=1 Ack=207 Win=269824 Len=0 TSval=587193871 TSecr=2955686032"
"58","11:16:24.449106","2a00:1450:4025:c01::6c","2a02:ab88:b:4100:6163:ab1b:4f48:fc2c","TLSv1.2","1294","Server Hello"
"59","11:16:24.449109","2a00:1450:4025:c01::6c","2a02:ab88:b:4100:6163:ab1b:4f48:fc2c","TCP","1294","993  >  60804 [PSH, ACK] Seq=1209 Ack=207 Win=269824 Len=1208 TSval=587193872 TSecr=2955686032 [TCP PDU reassembled in 61]"
"60","11:16:24.449110","2a00:1450:4025:c01::6c","2a02:ab88:b:4100:6163:ab1b:4f48:fc2c","TCP","1294","993  >  60804 [ACK] Seq=2417 Ack=207 Win=269824 Len=1208 TSval=587193872 TSecr=2955686032 [TCP PDU reassembled in 61]"
"61","11:16:24.449112","2a00:1450:4025:c01::6c","2a02:ab88:b:4100:6163:ab1b:4f48:fc2c","TLSv1.2","531","Certificate, Server Key Exchange, Server Hello Done"
"62","11:16:24.449367","2a02:ab88:b:4100:6163:ab1b:4f48:fc2c","2a00:1450:4025:c01::6c","TCP","86","60804  >  993 [ACK] Seq=207 Ack=4070 Win=128320 Len=0 TSval=2955686083 TSecr=587193872"
"63","11:16:24.462667","2a02:ab88:b:4100:6163:ab1b:4f48:fc2c","2a00:1450:4025:c01::6c","TLSv1.2","161","Client Key Exchange"
"64","11:16:24.505142","2a00:1450:4025:c01::6c","2a02:ab88:b:4100:6163:ab1b:4f48:fc2c","TCP","86","993  >  60804 [ACK] Seq=4070 Ack=282 Win=269824 Len=0 TSval=587193934 TSecr=2955686097"
"65","11:16:24.505389","2a02:ab88:b:4100:6163:ab1b:4f48:fc2c","2a00:1450:4025:c01::6c","TLSv1.2","137","Change Cipher Spec, Encrypted Handshake Message"
"66","11:16:24.544989","2a00:1450:4025:c01::6c","2a02:ab88:b:4100:6163:ab1b:4f48:fc2c","TCP","86","993  >  60804 [ACK] Seq=4070 Ack=333 Win=269824 Len=0 TSval=587193973 TSecr=2955686139"
"67","11:16:24.544991","2a00:1450:4025:c01::6c","2a02:ab88:b:4100:6163:ab1b:4f48:fc2c","TLSv1.2","137","Change Cipher Spec, Encrypted Handshake Message"
"68","11:16:24.544993","2a00:1450:4025:c01::6c","2a02:ab88:b:4100:6163:ab1b:4f48:fc2c","TLSv1.2","226","Application Data"
"69","11:16:24.545214","2a02:ab88:b:4100:6163:ab1b:4f48:fc2c","2a00:1450:4025:c01::6c","TCP","86","60804  >  993 [ACK] Seq=333 Ack=4261 Win=130944 Len=0 TSval=2955686179 TSecr=587193974"
"70","11:16:24.546511","2a02:ab88:b:4100:6163:ab1b:4f48:fc2c","2a00:1450:4025:c01::6c","TLSv1.2","134","Application Data"
"71","11:16:24.588882","2a00:1450:4025:c01::6c","2a02:ab88:b:4100:6163:ab1b:4f48:fc2c","TLSv1.2","346","Application Data"
"72","11:16:24.589096","2a02:ab88:b:4100:6163:ab1b:4f48:fc2c","2a00:1450:4025:c01::6c","TCP","86","60804  >  993 [ACK] Seq=381 Ack=4521 Win=130816 Len=0 TSval=2955686223 TSecr=587194017"
"73","11:16:24.590563","2a02:ab88:b:4100:6163:ab1b:4f48:fc2c","2a00:1450:4025:c01::6c","TLSv1.2","549","Application Data"
"74","11:16:24.638147","2a00:1450:4025:c01::6c","2a02:ab88:b:4100:6163:ab1b:4f48:fc2c","TCP","86","993  >  60804 [ACK] Seq=4521 Ack=844 Win=269568 Len=0 TSval=587194067 TSecr=2955686225"
"75","11:16:25.023385","192.168.0.74","5.28.195.2","TCP","78","[TCP Retransmission] 60799  >  5222 [SYN] Seq=0 Win=65535 Len=0 MSS=1460 WS=16 TSval=902736762 TSecr=0 SACK_PERM"
"76","11:16:25.023430","192.168.0.74","5.28.195.2","TCP","78","[TCP Retransmission] 60798  >  80 [SYN] Seq=0 Win=65535 Len=0 MSS=1460 WS=16 TSval=2033826672 TSecr=0 SACK_PERM"
"77","11:16:25.033646","2a00:1450:4025:c01::6c","2a02:ab88:b:4100:6163:ab1b:4f48:fc2c","TLSv1.2","215","Application Data"
"78","11:16:25.033743","2a02:ab88:b:4100:6163:ab1b:4f48:fc2c","2a00:1450:4025:c01::6c","TCP","86","60804  >  993 [ACK] Seq=844 Ack=4650 Win=130944 Len=0 TSval=2955686668 TSecr=587194395"
"79","11:16:25.034118","2a02:ab88:b:4100:6163:ab1b:4f48:fc2c","2a00:1450:4025:c01::6c","TLSv1.2","121","Application Data"
"80","11:16:25.079043","2a00:1450:4025:c01::6c","2a02:ab88:b:4100:6163:ab1b:4f48:fc2c","TCP","86","993  >  60804 [ACK] Seq=4650 Ack=879 Win=269568 Len=0 TSval=587194507 TSecr=2955686668"
"81","11:16:25.079045","2a00:1450:4025:c01::6c","2a02:ab88:b:4100:6163:ab1b:4f48:fc2c","TLSv1.2","179","Application Data"
"82","11:16:25.079165","2a02:ab88:b:4100:6163:ab1b:4f48:fc2c","2a00:1450:4025:c01::6c","TCP","86","60804  >  993 [ACK] Seq=879 Ack=4743 Win=131008 Len=0 TSval=2955686713 TSecr=587194507"
"83","11:16:25.080102","2a02:ab88:b:4100:6163:ab1b:4f48:fc2c","2a00:1450:4025:c01::6c","TLSv1.2","130","Application Data"
"84","11:16:25.080797","2a02:ab88:b:4100:6163:ab1b:4f48:fc2c","2a00:1450:4025:c01::6c","TCP","86","60804  >  993 [FIN, ACK] Seq=923 Ack=4743 Win=131072 Len=0 TSval=2955686715 TSecr=587194507"
"85","11:16:25.082423","2a02:ab88:b:4100:6163:ab1b:4f48:fc2c","2a00:1450:4025:c01::6c","TCP","98","60805  >  993 [SYN, ECE, CWR] Seq=0 Win=65535 Len=0 MSS=1440 WS=64 TSval=3767883882 TSecr=0 SACK_PERM"
"86","11:16:25.123443","2a00:1450:4025:c01::6c","2a02:ab88:b:4100:6163:ab1b:4f48:fc2c","TLSv1.2","256","Application Data"
"87","11:16:25.123583","2a02:ab88:b:4100:6163:ab1b:4f48:fc2c","2a00:1450:4025:c01::6c","TCP","74","60804  >  993 [RST] Seq=923 Win=0 Len=0"
"88","11:16:25.124862","2a00:1450:4025:c01::6c","2a02:ab88:b:4100:6163:ab1b:4f48:fc2c","TCP","86","993  >  60804 [FIN, ACK] Seq=4913 Ack=923 Win=269568 Len=0 TSval=587194552 TSecr=2955686714"
"89","11:16:25.127677","2a00:1450:4025:c01::6c","2a02:ab88:b:4100:6163:ab1b:4f48:fc2c","TCP","94","993  >  60805 [SYN, ACK] Seq=0 Ack=1 Win=65535 Len=0 MSS=1420 SACK_PERM TSval=3334776773 TSecr=3767883882 WS=256"
"90","11:16:25.127679","2a00:1450:4025:c01::6c","2a02:ab88:b:4100:6163:ab1b:4f48:fc2c","TCP","86","993  >  60804 [ACK] Seq=4914 Ack=924 Win=269568 Len=0 TSval=587194555 TSecr=2955686715"
"91","11:16:25.127831","2a02:ab88:b:4100:6163:ab1b:4f48:fc2c","2a00:1450:4025:c01::6c","TCP","86","60805  >  993 [ACK] Seq=1 Ack=1 Win=132352 Len=0 TSval=3767883928 TSecr=3334776773"
"92","11:16:25.131411","2a02:ab88:b:4100:6163:ab1b:4f48:fc2c","2a00:1450:4025:c01::6c","TLSv1.2","292","Client Hello (SNI=imap.gmail.com)"
"93","11:16:25.149412","fe80::1817:fddd:60ce:b28f","fe80::49c:fb07:3c9a:aa62","TCP","74","64548  >  58855 [ACK] Seq=1 Ack=1 Win=2048 Len=0"
"94","11:16:25.149524","fe80::49c:fb07:3c9a:aa62","fe80::1817:fddd:60ce:b28f","TCP","86","[TCP ACKed unseen segment] 58855  >  64548 [ACK] Seq=1 Ack=2 Win=2048 Len=0 TSval=406620903 TSecr=3882142133"
"95","11:16:25.173423","2a00:1450:4025:c01::6c","2a02:ab88:b:4100:6163:ab1b:4f48:fc2c","TCP","86","993  >  60805 [ACK] Seq=1 Ack=207 Win=269824 Len=0 TSval=3334776817 TSecr=3767883932"
"96","11:16:25.173426","2a00:1450:4025:c01::6c","2a02:ab88:b:4100:6163:ab1b:4f48:fc2c","TLSv1.2","1294","Server Hello"
"97","11:16:25.173427","2a00:1450:4025:c01::6c","2a02:ab88:b:4100:6163:ab1b:4f48:fc2c","TCP","1294","993  >  60805 [PSH, ACK] Seq=1209 Ack=207 Win=269824 Len=1208 TSval=3334776818 TSecr=3767883932 [TCP PDU reassembled in 100]"
"98","11:16:25.173570","2a02:ab88:b:4100:6163:ab1b:4f48:fc2c","2a00:1450:4025:c01::6c","TCP","86","60805  >  993 [ACK] Seq=207 Ack=2417 Win=129984 Len=0 TSval=3767883974 TSecr=3334776818"
"99","11:16:25.177234","2a00:1450:4025:c01::6c","2a02:ab88:b:4100:6163:ab1b:4f48:fc2c","TCP","1294","993  >  60805 [ACK] Seq=2417 Ack=207 Win=269824 Len=1208 TSval=3334776818 TSecr=3767883932 [TCP PDU reassembled in 100]"
"100","11:16:25.177237","2a00:1450:4025:c01::6c","2a02:ab88:b:4100:6163:ab1b:4f48:fc2c","TLSv1.2","530","Certificate, Server Key Exchange, Server Hello Done"
"101","11:16:25.177344","2a02:ab88:b:4100:6163:ab1b:4f48:fc2c","2a00:1450:4025:c01::6c","TCP","86","60805  >  993 [ACK] Seq=207 Ack=4069 Win=129472 Len=0 TSval=3767883977 TSecr=3334776818"
"102","11:16:25.187927","2a02:ab88:b:4100:6163:ab1b:4f48:fc2c","2a00:1450:4025:c01::6c","TLSv1.2","161","Client Key Exchange"
"103","11:16:25.233982","2a00:1450:4025:c01::6c","2a02:ab88:b:4100:6163:ab1b:4f48:fc2c","TCP","86","993  >  60805 [ACK] Seq=4069 Ack=282 Win=269824 Len=0 TSval=3334776879 TSecr=3767883988"
"104","11:16:25.234086","2a02:ab88:b:4100:6163:ab1b:4f48:fc2c","2a00:1450:4025:c01::6c","TLSv1.2","137","Change Cipher Spec, Encrypted Handshake Message"
"105","11:16:25.247745","2a03:2880:f36f:121:face:b00c:0:7260","2a02:ab88:b:4100:6163:ab1b:4f48:fc2c","SSL","125","Continuation Data"
"106","11:16:25.248040","2a02:ab88:b:4100:6163:ab1b:4f48:fc2c","2a03:2880:f36f:121:face:b00c:0:7260","TCP","86","57474  >  443 [ACK] Seq=1 Ack=40 Win=2048 Len=0 TSval=940885364 TSecr=2056895975"
"107","11:16:25.248607","2a02:ab88:b:4100:6163:ab1b:4f48:fc2c","2a03:2880:f36f:121:face:b00c:0:7260","SSL","115","Continuation Data"
"108","11:16:25.263605","192.168.0.192","230.0.0.1","UDP","92","58107  >  6666 Len=50"
"109","11:16:25.271648","2a00:1450:4025:c01::6c","2a02:ab88:b:4100:6163:ab1b:4f48:fc2c","TCP","86","993  >  60805 [ACK] Seq=4069 Ack=333 Win=269824 Len=0 TSval=3334776918 TSecr=3767884034"
"110","11:16:25.271649","2a00:1450:4025:c01::6c","2a02:ab88:b:4100:6163:ab1b:4f48:fc2c","TLSv1.2","137","Change Cipher Spec, Encrypted Handshake Message"
"111","11:16:25.271651","2a00:1450:4025:c01::6c","2a02:ab88:b:4100:6163:ab1b:4f48:fc2c","TLSv1.2","228","Application Data"
"112","11:16:25.271767","2a02:ab88:b:4100:6163:ab1b:4f48:fc2c","2a00:1450:4025:c01::6c","TCP","86","60805  >  993 [ACK] Seq=333 Ack=4262 Win=130880 Len=0 TSval=3767884072 TSecr=3334776918"
"113","11:16:25.272614","2a02:ab88:b:4100:6163:ab1b:4f48:fc2c","2a00:1450:4025:c01::6c","TLSv1.2","134","Application Data"
"114","11:16:25.285514","2a03:2880:f36f:121:face:b00c:0:7260","2a02:ab88:b:4100:6163:ab1b:4f48:fc2c","TCP","86","443  >  57474 [ACK] Seq=40 Ack=30 Win=286 Len=0 TSval=2056896015 TSecr=940885365"
"115","11:16:25.313680","2a00:1450:4025:c01::6c","2a02:ab88:b:4100:6163:ab1b:4f48:fc2c","TLSv1.2","348","Application Data"
"116","11:16:25.313812","2a02:ab88:b:4100:6163:ab1b:4f48:fc2c","2a00:1450:4025:c01::6c","TCP","86","60805  >  993 [ACK] Seq=381 Ack=4524 Win=130816 Len=0 TSval=3767884114 TSecr=3334776960"
"117","11:16:25.314885","2a02:ab88:b:4100:6163:ab1b:4f48:fc2c","2a00:1450:4025:c01::6c","TLSv1.2","130","Application Data"
"118","11:16:25.315819","2a02:ab88:b:4100:6163:ab1b:4f48:fc2c","2a00:1450:4025:c01::6c","TCP","86","60805  >  993 [FIN, ACK] Seq=425 Ack=4524 Win=131072 Len=0 TSval=3767884116 TSecr=3334776960"
"119","11:16:25.317340","2a02:ab88:b:4100:6163:ab1b:4f48:fc2c","2a00:1450:4025:c01::6c","TCP","98","60806  >  993 [SYN, ECE, CWR] Seq=0 Win=65535 Len=0 MSS=1440 WS=64 TSval=2207132826 TSecr=0 SACK_PERM"
"120","11:16:25.350819","2a00:1450:4025:c01::6c","2a02:ab88:b:4100:6163:ab1b:4f48:fc2c","TLSv1.2","260","Application Data"
"121","11:16:25.350957","2a02:ab88:b:4100:6163:ab1b:4f48:fc2c","2a00:1450:4025:c01::6c","TCP","74","60805  >  993 [RST] Seq=425 Win=0 Len=0"
"122","11:16:25.352360","2a00:1450:4025:c01::6c","2a02:ab88:b:4100:6163:ab1b:4f48:fc2c","TCP","86","993  >  60805 [FIN, ACK] Seq=4698 Ack=425 Win=269824 Len=0 TSval=3334776997 TSecr=3767884115"
"123","11:16:25.360025","2a00:1450:4025:c01::6c","2a02:ab88:b:4100:6163:ab1b:4f48:fc2c","TCP","86","993  >  60805 [ACK] Seq=4699 Ack=426 Win=269824 Len=0 TSval=3334777005 TSecr=3767884116"
"124","11:16:25.366342","2a00:1450:4025:c01::6c","2a02:ab88:b:4100:6163:ab1b:4f48:fc2c","TCP","94","993  >  60806 [SYN, ACK] Seq=0 Ack=1 Win=65535 Len=0 MSS=1420 SACK_PERM TSval=3695629871 TSecr=2207132826 WS=256"
"125","11:16:25.366510","2a02:ab88:b:4100:6163:ab1b:4f48:fc2c","2a00:1450:4025:c01::6c","TCP","86","60806  >  993 [ACK] Seq=1 Ack=1 Win=132352 Len=0 TSval=2207132876 TSecr=3695629871"
"126","11:16:25.367498","2a02:ab88:b:4100:6163:ab1b:4f48:fc2c","2a00:1450:4025:c01::6c","TLSv1.2","292","Client Hello (SNI=imap.gmail.com)"
"127","11:16:25.408250","2a00:1450:4025:c01::6c","2a02:ab88:b:4100:6163:ab1b:4f48:fc2c","TCP","86","993  >  60806 [ACK] Seq=1 Ack=207 Win=269824 Len=0 TSval=3695629913 TSecr=2207132877"
"128","11:16:25.411062","2a00:1450:4025:c01::6c","2a02:ab88:b:4100:6163:ab1b:4f48:fc2c","TLSv1.2","1294","Server Hello"
"129","11:16:25.411066","2a00:1450:4025:c01::6c","2a02:ab88:b:4100:6163:ab1b:4f48:fc2c","TCP","1294","993  >  60806 [PSH, ACK] Seq=1209 Ack=207 Win=269824 Len=1208 TSval=3695629913 TSecr=2207132877 [TCP PDU reassembled in 131]"
"130","11:16:25.411070","2a00:1450:4025:c01::6c","2a02:ab88:b:4100:6163:ab1b:4f48:fc2c","TCP","1294","993  >  60806 [ACK] Seq=2417 Ack=207 Win=269824 Len=1208 TSval=3695629913 TSecr=2207132877 [TCP PDU reassembled in 131]"
"131","11:16:25.411073","2a00:1450:4025:c01::6c","2a02:ab88:b:4100:6163:ab1b:4f48:fc2c","TLSv1.2","531","Certificate, Server Key Exchange, Server Hello Done"
"132","11:16:25.411221","2a02:ab88:b:4100:6163:ab1b:4f48:fc2c","2a00:1450:4025:c01::6c","TCP","86","60806  >  993 [ACK] Seq=207 Ack=4070 Win=128320 Len=0 TSval=2207132920 TSecr=3695629913"
"133","11:16:25.421580","2a02:ab88:b:4100:6163:ab1b:4f48:fc2c","2a00:1450:4025:c01::6c","TLSv1.2","161","Client Key Exchange"
"134","11:16:25.468643","192.168.0.192","230.0.0.1","UDP","92","62979  >  6666 Len=50"
"135","11:16:25.468645","2a00:1450:4025:c01::6c","2a02:ab88:b:4100:6163:ab1b:4f48:fc2c","TCP","86","993  >  60806 [ACK] Seq=4070 Ack=282 Win=269824 Len=0 TSval=3695629972 TSecr=2207132931"
"136","11:16:25.468800","2a02:ab88:b:4100:6163:ab1b:4f48:fc2c","2a00:1450:4025:c01::6c","TLSv1.2","137","Change Cipher Spec, Encrypted Handshake Message"
"137","11:16:25.508589","2a00:1450:4025:c01::6c","2a02:ab88:b:4100:6163:ab1b:4f48:fc2c","TCP","86","993  >  60806 [ACK] Seq=4070 Ack=333 Win=269824 Len=0 TSval=3695630015 TSecr=2207132978"
"138","11:16:25.508591","2a00:1450:4025:c01::6c","2a02:ab88:b:4100:6163:ab1b:4f48:fc2c","TLSv1.2","137","Change Cipher Spec, Encrypted Handshake Message"
"139","11:16:25.508592","2a00:1450:4025:c01::6c","2a02:ab88:b:4100:6163:ab1b:4f48:fc2c","TLSv1.2","228","Application Data"
"140","11:16:25.508698","2a02:ab88:b:4100:6163:ab1b:4f48:fc2c","2a00:1450:4025:c01::6c","TCP","86","60806  >  993 [ACK] Seq=333 Ack=4263 Win=130880 Len=0 TSval=2207133018 TSecr=3695630015"
"141","11:16:25.509429","2a02:ab88:b:4100:6163:ab1b:4f48:fc2c","2a00:1450:4025:c01::6c","TLSv1.2","134","Application Data"
"142","11:16:25.555364","2a00:1450:4025:c01::6c","2a02:ab88:b:4100:6163:ab1b:4f48:fc2c","TLSv1.2","348","Application Data"
"143","11:16:25.555491","2a02:ab88:b:4100:6163:ab1b:4f48:fc2c","2a00:1450:4025:c01::6c","TCP","86","60806  >  993 [ACK] Seq=381 Ack=4525 Win=130816 Len=0 TSval=2207133065 TSecr=3695630059"
"144","11:16:25.557377","2a02:ab88:b:4100:6163:ab1b:4f48:fc2c","2a00:1450:4025:c01::6c","TCP","86","60806  >  993 [FIN, ACK] Seq=381 Ack=4525 Win=131072 Len=0 TSval=2207133066 TSecr=3695630059"
"145","11:16:25.602710","2a00:1450:4025:c01::6c","2a02:ab88:b:4100:6163:ab1b:4f48:fc2c","TCP","86","993  >  60806 [FIN, ACK] Seq=4525 Ack=382 Win=269824 Len=0 TSval=3695630106 TSecr=2207133066"
"146","11:16:25.602866","2a02:ab88:b:4100:6163:ab1b:4f48:fc2c","2a00:1450:4025:c01::6c","TCP","86","60806  >  993 [ACK] Seq=382 Ack=4526 Win=131072 Len=0 TSval=2207133112 TSecr=3695630106"
"147","11:16:26.023472","192.168.0.74","5.28.195.2","TCP","78","[TCP Retransmission] 60799  >  5222 [SYN] Seq=0 Win=65535 Len=0 MSS=1460 WS=16 TSval=902737763 TSecr=0 SACK_PERM"
"148","11:16:26.023521","192.168.0.74","5.28.195.2","TCP","78","[TCP Retransmission] 60798  >  80 [SYN] Seq=0 Win=65535 Len=0 MSS=1460 WS=16 TSval=2033827673 TSecr=0 SACK_PERM"
"149","11:16:26.175664","192.168.0.74","192.87.28.82","TLSv1.2","602","Application Data"
"150","11:16:26.251565","192.87.28.82","192.168.0.74","TCP","66","9001  >  59488 [ACK] Seq=1 Ack=537 Win=1565 Len=0 TSval=2691136723 TSecr=3830663601"
"151","11:16:26.267854","192.87.28.82","192.168.0.74","TLSv1.2","602","Application Data"
"152","11:16:26.267944","192.168.0.74","192.87.28.82","TCP","66","59488  >  9001 [ACK] Seq=537 Ack=537 Win=4086 Len=0 TSval=3830663693 TSecr=2691136736"
"153","11:16:26.268761","192.168.0.74","192.87.28.82","TCP","1474","59488  >  9001 [ACK] Seq=537 Ack=537 Win=4094 Len=1408 TSval=3830663694 TSecr=2691136736 [TCP PDU reassembled in 154]"
"154","11:16:26.268775","192.168.0.74","192.87.28.82","TLSv1.2","736","Application Data"
"155","11:16:26.287733","192.168.0.192","230.0.0.1","UDP","92","58107  >  6666 Len=50"
"156","11:16:26.307739","fe80::49c:fb07:3c9a:aa62","fe80::1817:fddd:60ce:b28f","ICMPv6","86","Neighbor Solicitation for fe80::1817:fddd:60ce:b28f from ee:99:94:f5:59:fd"
"157","11:16:26.308605","192.87.28.82","192.168.0.74","TCP","66","9001  >  59488 [ACK] Seq=537 Ack=2615 Win=1533 Len=0 TSval=2691136779 TSecr=3830663694"
"158","11:16:26.363380","192.87.28.82","192.168.0.74","TCP","1474","9001  >  59488 [ACK] Seq=537 Ack=2615 Win=1565 Len=1408 TSval=2691136825 TSecr=3830663694 [TCP PDU reassembled in 160]"
"159","11:16:26.363383","192.87.28.82","192.168.0.74","TCP","1474","9001  >  59488 [ACK] Seq=1945 Ack=2615 Win=1565 Len=1408 TSval=2691136825 TSecr=3830663694 [TCP PDU reassembled in 160]"
"160","11:16:26.363385","192.87.28.82","192.168.0.74","TLSv1.2","870","Application Data"
"161","11:16:26.363518","192.168.0.74","192.87.28.82","TCP","66","59488  >  9001 [ACK] Seq=2615 Ack=1945 Win=4072 Len=0 TSval=3830663789 TSecr=2691136825"
"162","11:16:26.363565","192.168.0.74","192.87.28.82","TCP","66","59488  >  9001 [ACK] Seq=2615 Ack=4157 Win=4038 Len=0 TSval=3830663789 TSecr=2691136825"
"163","11:16:26.363623","192.168.0.74","192.87.28.82","TCP","66","[TCP Window Update] 59488  >  9001 [ACK] Seq=2615 Ack=4157 Win=4094 Len=0 TSval=3830663789 TSecr=2691136825"
"164","11:16:26.406160","192.87.28.82","192.168.0.74","TLSv1.2","602","Application Data"
"165","11:16:26.406299","192.168.0.74","192.87.28.82","TCP","66","59488  >  9001 [ACK] Seq=2615 Ack=4693 Win=4086 Len=0 TSval=3830663831 TSecr=2691136878"
"166","11:16:26.411683","192.168.0.74","192.87.28.82","TLSv1.2","602","Application Data"
"167","11:16:26.488758","192.87.28.82","192.168.0.74","TCP","66","9001  >  59488 [ACK] Seq=4693 Ack=3151 Win=1565 Len=0 TSval=2691136961 TSecr=3830663837"
"168","11:16:26.488894","192.168.0.74","192.87.28.82","TLSv1.2","602","Application Data"
"169","11:16:26.492704","192.168.0.192","230.0.0.1","UDP","92","62979  >  6666 Len=50"
"170","11:16:26.495744","fe80::1817:fddd:60ce:b28f","fe80::49c:fb07:3c9a:aa62","ICMPv6","78","Neighbor Advertisement fe80::1817:fddd:60ce:b28f (sol)"
"171","11:16:26.533769","fe80::1817:fddd:60ce:b28f","fe80::49c:fb07:3c9a:aa62","ICMPv6","86","Neighbor Solicitation for fe80::49c:fb07:3c9a:aa62 from fe:cf:4c:2c:ee:ed"
"172","11:16:26.533961","fe80::49c:fb07:3c9a:aa62","fe80::1817:fddd:60ce:b28f","ICMPv6","78","Neighbor Advertisement fe80::49c:fb07:3c9a:aa62 (sol)"
"173","11:16:26.559969","192.87.28.82","192.168.0.74","TCP","66","9001  >  59488 [ACK] Seq=4693 Ack=3687 Win=1565 Len=0 TSval=2691137034 TSecr=3830663914"
"174","11:16:26.628654","192.87.28.82","192.168.0.74","TLSv1.2","602","Application Data"
"175","11:16:26.628802","192.168.0.74","192.87.28.82","TCP","66","59488  >  9001 [ACK] Seq=3687 Ack=5229 Win=4086 Len=0 TSval=3830664054 TSecr=2691137101"
"176","11:16:26.629418","192.168.0.74","192.87.28.82","TLSv1.2","602","Application Data"
"177","11:16:26.707306","192.87.28.82","192.168.0.74","TCP","66","9001  >  59488 [ACK] Seq=5229 Ack=4223 Win=1565 Len=0 TSval=2691137181 TSecr=3830664055"
"178","11:16:26.723236","192.168.0.74","64.65.63.120","TLSv1.2","602","Application Data"
"179","11:16:26.723295","192.168.0.74","192.87.28.82","TLSv1.2","602","Application Data"
"180","11:16:26.758829","192.87.28.82","192.168.0.74","TLSv1.2","602","Application Data"
"181","11:16:26.759053","192.168.0.74","192.87.28.82","TCP","66","59488  >  9001 [ACK] Seq=4759 Ack=5765 Win=4086 Len=0 TSval=3830664184 TSecr=2691137232"
"182","11:16:26.760061","192.168.0.74","192.87.28.82","TLSv1.2","602","Application Data"
"183","11:16:26.765910","64.65.63.120","192.168.0.74","TCP","66","443  >  59487 [ACK] Seq=1 Ack=537 Win=468 Len=0 TSval=2679087957 TSecr=3161795193"
"184","11:16:26.768349","64.65.63.120","192.168.0.74","TLSv1.2","602","Application Data"
"185","11:16:26.768450","192.168.0.74","64.65.63.120","TCP","66","59487  >  443 [ACK] Seq=537 Ack=537 Win=9190 Len=0 TSval=3161795239 TSecr=2679087960"
"186","11:16:26.768829","192.168.0.74","64.65.63.120","TLSv1.2","602","Application Data"
"187","11:16:26.826171","192.87.28.82","192.168.0.74","TLSv1.2","602","Application Data"
"188","11:16:26.826317","192.168.0.74","192.87.28.82","TCP","66","59488  >  9001 [ACK] Seq=5295 Ack=6301 Win=4086 Len=0 TSval=3830664251 TSecr=2691137298"
"189","11:16:26.827339","192.168.0.74","192.87.28.82","TLSv1.2","602","Application Data"
"190","11:16:26.852802","64.65.63.120","192.168.0.74","TCP","66","443  >  59487 [ACK] Seq=537 Ack=1073 Win=476 Len=0 TSval=2679088045 TSecr=3161795239"
"191","11:16:26.856122","192.87.28.82","192.168.0.74","TCP","1474","9001  >  59488 [ACK] Seq=6301 Ack=5295 Win=1565 Len=1408 TSval=2691137329 TSecr=3830664185 [TCP PDU reassembled in 192]"
"192","11:16:26.856125","192.87.28.82","192.168.0.74","TLSv1.2","222","Application Data"
"193","11:16:26.856250","192.168.0.74","192.87.28.82","TCP","66","59488  >  9001 [ACK] Seq=5831 Ack=7865 Win=4070 Len=0 TSval=3830664281 TSecr=2691137329"
"194","11:16:26.860017","64.65.63.120","192.168.0.74","TLSv1.2","602","Application Data"
"195","11:16:26.860135","192.168.0.74","64.65.63.120","TCP","66","59487  >  443 [ACK] Seq=1073 Ack=1073 Win=9190 Len=0 TSval=3161795330 TSecr=2679088053"
"196","11:16:26.860947","192.168.0.74","64.65.63.120","TLSv1.2","602","Application Data"
"197","11:16:26.895708","64.65.63.120","192.168.0.74","TCP","66","443  >  59487 [ACK] Seq=1073 Ack=1609 Win=472 Len=0 TSval=2679088090 TSecr=3161795331"
"198","11:16:26.895744","192.87.28.82","192.168.0.74","TCP","66","9001  >  59488 [ACK] Seq=7865 Ack=5831 Win=1565 Len=0 TSval=2691137370 TSecr=3830664253"
"199","11:16:26.899714","64.65.63.120","192.168.0.74","TCP","66","[TCP Window Update] 443  >  59487 [ACK] Seq=1073 Ack=1609 Win=476 Len=0 TSval=2679088094 TSecr=3161795331"
"200","11:16:26.908073","192.168.0.74","192.87.28.82","TLSv1.2","602","Application Data"
"201","11:16:26.919235","192.87.28.82","192.168.0.74","TLSv1.2","602","Application Data"
"202","11:16:26.919351","192.168.0.74","192.87.28.82","TCP","66","59488  >  9001 [ACK] Seq=6367 Ack=8401 Win=4086 Len=0 TSval=3830664345 TSecr=2691137391"
"203","11:16:26.984307","192.87.28.82","192.168.0.74","TCP","66","9001  >  59488 [ACK] Seq=8401 Ack=6367 Win=1565 Len=0 TSval=2691137457 TSecr=3830664333"
"204","11:16:26.984517","192.168.0.74","192.87.28.82","TLSv1.2","602","Application Data"
"205","11:16:26.988431","64.65.63.120","192.168.0.74","TLSv1.2","602","Application Data"
"206","11:16:26.988533","192.168.0.74","64.65.63.120","TCP","66","59487  >  443 [ACK] Seq=1609 Ack=1609 Win=9190 Len=0 TSval=3161795459 TSecr=2679088182"
"207","11:16:26.989490","192.168.0.74","64.65.63.120","TLSv1.2","602","Application Data"
"208","11:16:27.024876","192.168.0.74","5.28.195.2","TCP","78","[TCP Retransmission] 60799  >  5222 [SYN] Seq=0 Win=65535 Len=0 MSS=1460 WS=16 TSval=902738764 TSecr=0 SACK_PERM"
"209","11:16:27.024939","192.168.0.74","5.28.195.2","TCP","78","[TCP Retransmission] 60798  >  80 [SYN] Seq=0 Win=65535 Len=0 MSS=1460 WS=16 TSval=2033828674 TSecr=0 SACK_PERM"
"210","11:16:27.026199","64.65.63.120","192.168.0.74","TCP","66","443  >  59487 [ACK] Seq=1609 Ack=2145 Win=472 Len=0 TSval=2679088219 TSecr=3161795460"
"211","11:16:27.055923","192.87.28.82","192.168.0.74","TCP","66","9001  >  59488 [ACK] Seq=8401 Ack=6903 Win=1565 Len=0 TSval=2691137530 TSecr=3830664410"
"212","11:16:27.078924","192.87.28.82","192.168.0.74","TLSv1.2","602","Application Data"
"213","11:16:27.079099","192.168.0.74","192.87.28.82","TCP","66","59488  >  9001 [ACK] Seq=6903 Ack=8937 Win=4086 Len=0 TSval=3830664504 TSecr=2691137552"
"214","11:16:27.079511","192.168.0.74","192.87.28.82","TLSv1.2","602","Application Data"
"215","11:16:27.105863","64.65.63.120","192.168.0.74","TLSv1.2","602","Application Data"
"216","11:16:27.106067","192.168.0.74","64.65.63.120","TCP","66","59487  >  443 [ACK] Seq=2145 Ack=2145 Win=9190 Len=0 TSval=3161795576 TSecr=2679088300"
"217","11:16:27.106435","192.168.0.74","64.65.63.120","TLSv1.2","602","Application Data"
"218","11:16:27.143452","64.65.63.120","192.168.0.74","TCP","66","443  >  59487 [ACK] Seq=2145 Ack=2681 Win=472 Len=0 TSval=2679088336 TSecr=3161795577"
"219","11:16:27.154965","192.87.28.82","192.168.0.74","TCP","66","9001  >  59488 [ACK] Seq=8937 Ack=7439 Win=1565 Len=0 TSval=2691137629 TSecr=3830664505"
"220","11:16:27.173440","192.87.28.82","192.168.0.74","TCP","1474","9001  >  59488 [ACK] Seq=8937 Ack=7439 Win=1565 Len=1408 TSval=2691137647 TSecr=3830664505 [TCP PDU reassembled in 222]"
"221","11:16:27.173443","192.87.28.82","192.168.0.74","TCP","1474","9001  >  59488 [ACK] Seq=10345 Ack=7439 Win=1565 Len=1408 TSval=2691137647 TSecr=3830664505 [TCP PDU reassembled in 222]"
"222","11:16:27.173444","192.87.28.82","192.168.0.74","TLSv1.2","1320","Application Data"
"223","11:16:27.173575","192.168.0.74","192.87.28.82","TCP","66","59488  >  9001 [ACK] Seq=7439 Ack=13007 Win=4031 Len=0 TSval=3830664599 TSecr=2691137647"
"224","11:16:27.173695","192.168.0.74","192.87.28.82","TCP","66","[TCP Window Update] 59488  >  9001 [ACK] Seq=7439 Ack=13007 Win=4094 Len=0 TSval=3830664599 TSecr=2691137647"
"225","11:16:27.187845","192.87.28.82","192.168.0.74","TLSv1.2","1474","Application Data"
"226","11:16:27.187847","192.87.28.82","192.168.0.74","TCP","1474","9001  >  59488 [ACK] Seq=14415 Ack=7439 Win=1565 Len=1408 TSval=2691137660 TSecr=3830664505 [TCP PDU reassembled in 227]"
"227","11:16:27.187849","192.87.28.82","192.168.0.74","TLSv1.2","956","Application Data"
"228","11:16:27.187959","192.168.0.74","192.87.28.82","TCP","66","59488  >  9001 [ACK] Seq=7439 Ack=16713 Win=4037 Len=0 TSval=3830664613 TSecr=2691137660"
"229","11:16:27.188260","192.168.0.74","192.87.28.82","TCP","66","[TCP Window Update] 59488  >  9001 [ACK] Seq=7439 Ack=16713 Win=4094 Len=0 TSval=3830664613 TSecr=2691137660"
"230","11:16:27.198724","192.87.28.82","192.168.0.74","TCP","1474","9001  >  59488 [ACK] Seq=16713 Ack=7439 Win=1565 Len=1408 TSval=2691137671 TSecr=3830664505 [TCP PDU reassembled in 231]"
"231","11:16:27.198725","192.87.28.82","192.168.0.74","TLSv1.2","222","Application Data"
"232","11:16:27.198826","192.168.0.74","192.87.28.82","TCP","66","59488  >  9001 [ACK] Seq=7439 Ack=18277 Win=4070 Len=0 TSval=3830664624 TSecr=2691137671"
"233","11:16:27.240662","192.168.0.74","192.87.28.82","TLSv1.2","602","Application Data"
"234","11:16:27.242181","192.168.0.74","64.65.63.120","TLSv1.2","602","Application Data"
"235","11:16:27.244990","192.168.0.74","192.87.28.82","TLSv1.2","1474","Application Data, Application Data"
"236","11:16:27.245009","192.168.0.74","192.87.28.82","TLSv1.2","266","Application Data"
"237","11:16:27.253482","192.168.0.74","192.87.28.82","TLSv1.2","1474","Application Data, Application Data"
"238","11:16:27.253484","192.168.0.74","192.87.28.82","TCP","1474","59488  >  9001 [ACK] Seq=10991 Ack=18277 Win=4094 Len=1408 TSval=3830664679 TSecr=2691137671 [TCP PDU reassembled in 240]"
"239","11:16:27.253485","192.168.0.74","192.87.28.82","TCP","1474","59488  >  9001 [ACK] Seq=12399 Ack=18277 Win=4094 Len=1408 TSval=3830664679 TSecr=2691137671 [TCP PDU reassembled in 240]"
"240","11:16:27.253503","192.168.0.74","192.87.28.82","TLSv1.2","984","Application Data"
"241","11:16:27.253518","192.168.0.74","192.87.28.82","TCP","1474","59488  >  9001 [ACK] Seq=14725 Ack=18277 Win=4094 Len=1408 TSval=3830664679 TSecr=2691137671 [TCP PDU reassembled in 242]"
"242","11:16:27.253521","192.168.0.74","192.87.28.82","TLSv1.2","286","Application Data"
"243","11:16:27.278462","192.87.28.82","192.168.0.74","TCP","66","9001  >  59488 [ACK] Seq=18277 Ack=9383 Win=1535 Len=0 TSval=2691137751 TSecr=3830664666"
"244","11:16:27.281040","64.65.63.120","192.168.0.74","TCP","66","443  >  59487 [ACK] Seq=2145 Ack=3217 Win=468 Len=0 TSval=2679088475 TSecr=3161795712"
"245","11:16:27.281107","192.168.0.74","64.65.63.120","TLSv1.2","1116","Application Data"
"246","11:16:27.286697","192.87.28.82","192.168.0.74","TCP","66","9001  >  59488 [ACK] Seq=18277 Ack=10991 Win=1543 Len=0 TSval=2691137760 TSecr=3830664670"
"247","11:16:27.288041","192.87.28.82","192.168.0.74","TCP","66","9001  >  59488 [ACK] Seq=18277 Ack=13807 Win=1543 Len=0 TSval=2691137761 TSecr=3830664679"
"248","11:16:27.288043","192.87.28.82","192.168.0.74","TCP","66","9001  >  59488 [ACK] Seq=18277 Ack=16133 Win=1507 Len=0 TSval=2691137761 TSecr=3830664679"
"249","11:16:27.294275","192.87.28.82","192.168.0.74","TCP","1474","9001  >  59488 [ACK] Seq=18277 Ack=16353 Win=1565 Len=1408 TSval=2691137768 TSecr=3830664679 [TCP PDU reassembled in 251]"
"250","11:16:27.294278","192.87.28.82","192.168.0.74","TCP","1474","9001  >  59488 [ACK] Seq=19685 Ack=16353 Win=1565 Len=1408 TSval=2691137768 TSecr=3830664679 [TCP PDU reassembled in 251]"
"251","11:16:27.294280","192.87.28.82","192.168.0.74","TLSv1.2","1320","Application Data"
"252","11:16:27.294281","192.87.28.82","192.168.0.74","TCP","1474","9001  >  59488 [ACK] Seq=22347 Ack=16353 Win=1565 Len=1408 TSval=2691137768 TSecr=3830664679 [TCP PDU reassembled in 254]"
"253","11:16:27.294283","192.87.28.82","192.168.0.74","TCP","1474","9001  >  59488 [ACK] Seq=23755 Ack=16353 Win=1565 Len=1408 TSval=2691137768 TSecr=3830664679 [TCP PDU reassembled in 254]"
"254","11:16:27.294285","192.87.28.82","192.168.0.74","TLSv1.2","1320","Application Data"
"255","11:16:27.294286","192.87.28.82","192.168.0.74","TCP","1474","9001  >  59488 [ACK] Seq=26417 Ack=16353 Win=1565 Len=1408 TSval=2691137768 TSecr=3830664679 [TCP PDU reassembled in 260]"
"256","11:16:27.294287","192.87.28.82","192.168.0.74","TCP","1474","9001  >  59488 [ACK] Seq=27825 Ack=16353 Win=1565 Len=1408 TSval=2691137768 TSecr=3830664679 [TCP PDU reassembled in 260]"
"257","11:16:27.294427","192.168.0.74","192.87.28.82","TCP","66","59488  >  9001 [ACK] Seq=16353 Ack=29233 Win=3923 Len=0 TSval=3830664720 TSecr=2691137768"
"258","11:16:27.294545","192.168.0.74","192.87.28.82","TCP","66","[TCP Window Update] 59488  >  9001 [ACK] Seq=16353 Ack=29233 Win=4094 Len=0 TSval=3830664720 TSecr=2691137768"
"259","11:16:27.294671","192.168.0.74","192.87.28.82","TLSv1.2","602","Application Data"
"260","11:16:27.295382","192.87.28.82","192.168.0.74","TLSv1.2","998","Application Data"
"261","11:16:27.295410","192.168.0.74","192.87.28.82","TCP","66","59488  >  9001 [ACK] Seq=16889 Ack=30165 Win=4080 Len=0 TSval=3830664721 TSecr=2691137768"
"262","11:16:27.304092","192.168.0.74","192.87.28.82","TLSv1.2","1474","Application Data"
"263","11:16:27.304094","192.168.0.74","192.87.28.82","TCP","1474","59488  >  9001 [ACK] Seq=18297 Ack=30165 Win=4094 Len=1408 TSval=3830664729 TSecr=2691137768 [TCP PDU reassembled in 265]"
