"No.","Time","Source","Destination","Protocol","Length","Info"
"1","11:18:28.254991","192.168.0.192","230.0.0.1","UDP","92","58107  >  6666 Len=50"
"2","11:18:28.561960","192.168.0.192","230.0.0.1","UDP","92","62979  >  6666 Len=50"
"3","11:18:28.617084","192.168.0.74","192.87.28.82","TLSv1.2","602","Application Data"
"4","11:18:28.701893","192.87.28.82","192.168.0.74","TCP","66","9001  >  59488 [ACK] Seq=1 Ack=537 Win=2347 Len=0 TSval=2691259171 TSecr=3830786047"
"5","11:18:29.052982","192.168.0.74","5.28.195.2","TCP","78","60989  >  80 [SYN, ECE, CWR] Seq=0 Win=65535 Len=0 MSS=1460 WS=16 TSval=3362090725 TSecr=0 SACK_PERM"
"6","11:18:29.053043","192.168.0.74","5.28.195.2","TCP","78","60990  >  5222 [SYN, ECE, CWR] Seq=0 Win=65535 Len=0 MSS=1460 WS=16 TSval=2687779331 TSecr=0 SACK_PERM"
"7","11:18:29.053085","192.168.0.74","5.28.195.2","TCP","78","60991  >  443 [SYN, ECE, CWR] Seq=0 Win=65535 Len=0 MSS=1460 WS=16 TSval=641463956 TSecr=0 SACK_PERM"
"8","11:18:29.103505","5.28.195.2","192.168.0.74","TCP","74","443  >  60991 [SYN, ACK, ECE] Seq=0 Ack=1 Win=65535 Len=0 MSS=1240 SACK_PERM TSval=1905537304 TSecr=641463956 WS=1024"
"9","11:18:29.103756","192.168.0.74","5.28.195.2","TCP","66","60991  >  443 [ACK] Seq=1 Ack=1 Win=1048560 Len=0 TSval=641464007 TSecr=1905537304"
"10","11:18:29.104028","192.168.0.74","5.28.195.2","TLSv1","583","Client Hello"
"11","11:18:29.271592","192.168.0.192","230.0.0.1","UDP","92","58107  >  6666 Len=50"
"12","11:18:29.307089","192.168.0.74","5.28.195.2","TCP","583","[TCP Retransmission] 60991  >  443 [PSH, ACK] Seq=1 Ack=1 Win=1048560 Len=517 TSval=641464210 TSecr=1905537304"
"13","11:18:29.345091","5.28.195.2","192.168.0.74","TCP","66","443  >  60991 [ACK] Seq=1 Ack=518 Win=67584 Len=0 TSval=1905537551 TSecr=641464210"
"14","11:18:29.354420","5.28.195.2","192.168.0.74","TCP","66","443  >  60991 [FIN, ACK] Seq=1 Ack=518 Win=67584 Len=0 TSval=1905537560 TSecr=641464210"
"15","11:18:29.354561","192.168.0.74","5.28.195.2","TCP","66","60991  >  443 [ACK] Seq=518 Ack=2 Win=1048560 Len=0 TSval=641464257 TSecr=1905537560"
"16","11:18:29.354827","192.168.0.74","5.28.195.2","TCP","66","60991  >  443 [FIN, ACK] Seq=518 Ack=2 Win=1048560 Len=0 TSval=641464258 TSecr=1905537560"
"17","11:18:29.403448","5.28.195.2","192.168.0.74","TCP","56","443  >  60991 [RST] Seq=2 Win=0 Len=0"
"18","11:18:29.578788","192.168.0.192","230.0.0.1","UDP","92","62979  >  6666 Len=50"
"19","11:18:29.909685","192.168.0.74","192.87.28.82","TLSv1.2","602","Application Data"
"20","11:18:30.008246","192.87.28.82","192.168.0.74","TCP","66","9001  >  59488 [ACK] Seq=1 Ack=1073 Win=2347 Len=0 TSval=2691260480 TSecr=3830787340"
"21","11:18:30.020991","64.65.63.120","192.168.0.74","TLSv1.2","602","Application Data"
"22","11:18:30.021198","192.168.0.74","64.65.63.120","TCP","66","59487  >  443 [ACK] Seq=1 Ack=537 Win=9190 Len=0 TSval=3161918496 TSecr=2679211211"
"23","11:18:30.054117","192.168.0.74","5.28.195.2","TCP","78","[TCP Retransmission] 60990  >  5222 [SYN] Seq=0 Win=65535 Len=0 MSS=1460 WS=16 TSval=2687780332 TSecr=0 SACK_PERM"
"24","11:18:30.054170","192.168.0.74","5.28.195.2","TCP","78","[TCP Retransmission] 60989  >  80 [SYN] Seq=0 Win=65535 Len=0 MSS=1460 WS=16 TSval=3362091726 TSecr=0 SACK_PERM"
"25","11:18:30.302672","192.168.0.192","230.0.0.1","UDP","92","58107  >  6666 Len=50"
"26","11:18:30.507606","192.168.0.192","230.0.0.1","UDP","92","62979  >  6666 Len=50"
"27","11:18:30.930765","192.168.0.74","192.87.28.82","TLSv1.2","602","Application Data"
"28","11:18:31.015284","192.87.28.82","192.168.0.74","TCP","66","9001  >  59488 [ACK] Seq=1 Ack=1609 Win=2347 Len=0 TSval=2691261486 TSecr=3830788361"
"29","11:18:31.029840","64.65.63.120","192.168.0.74","TLSv1.2","602","Application Data"
"30","11:18:31.029955","192.168.0.74","64.65.63.120","TCP","66","59487  >  443 [ACK] Seq=1 Ack=1073 Win=9190 Len=0 TSval=3161919505 TSecr=2679212222"
"31","11:18:31.054002","192.168.0.74","5.28.195.2","TCP","78","[TCP Retransmission] 60990  >  5222 [SYN] Seq=0 Win=65535 Len=0 MSS=1460 WS=16 TSval=2687781332 TSecr=0 SACK_PERM"
"32","11:18:31.054045","192.168.0.74","5.28.195.2","TCP","78","[TCP Retransmission] 60989  >  80 [SYN] Seq=0 Win=65535 Len=0 MSS=1460 WS=16 TSval=3362092726 TSecr=0 SACK_PERM"
"33","11:18:31.326553","192.168.0.192","230.0.0.1","UDP","92","58107  >  6666 Len=50"
"34","11:18:31.531728","192.168.0.192","230.0.0.1","UDP","92","62979  >  6666 Len=50"
"35","11:18:31.865645","192.168.0.74","5.28.195.2","TCP","78","60992  >  443 [SYN, ECE, CWR] Seq=0 Win=65535 Len=0 MSS=1460 WS=16 TSval=748713218 TSecr=0 SACK_PERM"
"36","11:18:31.910552","5.28.195.2","192.168.0.74","TCP","74","443  >  60992 [SYN, ACK, ECE] Seq=0 Ack=1 Win=65535 Len=0 MSS=1240 SACK_PERM TSval=3096120408 TSecr=748713218 WS=1024"
"37","11:18:31.910680","192.168.0.74","5.28.195.2","TCP","66","60992  >  443 [ACK] Seq=1 Ack=1 Win=1048560 Len=0 TSval=748713263 TSecr=3096120408"
"38","11:18:31.913945","192.168.0.74","5.28.195.2","TLSv1","583","Client Hello"
"39","11:18:31.953877","5.28.195.2","192.168.0.74","TCP","66","443  >  60992 [ACK] Seq=1 Ack=518 Win=67584 Len=0 TSval=3096120512 TSecr=748713266"
"40","11:18:31.953879","5.28.195.2","192.168.0.74","TCP","66","443  >  60992 [FIN, ACK] Seq=1 Ack=518 Win=67584 Len=0 TSval=3096120513 TSecr=748713266"
"41","11:18:31.953986","192.168.0.74","5.28.195.2","TCP","66","60992  >  443 [ACK] Seq=518 Ack=2 Win=1048560 Len=0 TSval=748713306 TSecr=3096120513"
"42","11:18:31.954125","192.168.0.74","5.28.195.2","TCP","66","60992  >  443 [FIN, ACK] Seq=518 Ack=2 Win=1048560 Len=0 TSval=748713306 TSecr=3096120513"
"43","11:18:31.994709","5.28.195.2","192.168.0.74","TCP","56","443  >  60992 [RST] Seq=2 Win=0 Len=0"
"44","11:18:32.054532","192.168.0.74","5.28.195.2","TCP","78","[TCP Retransmission] 60990  >  5222 [SYN] Seq=0 Win=65535 Len=0 MSS=1460 WS=16 TSval=2687782333 TSecr=0 SACK_PERM"
"45","11:18:32.054582","192.168.0.74","5.28.195.2","TCP","78","[TCP Retransmission] 60989  >  80 [SYN] Seq=0 Win=65535 Len=0 MSS=1460 WS=16 TSval=3362093727 TSecr=0 SACK_PERM"
"46","11:18:32.160287","192.168.0.74","192.87.28.82","TLSv1.2","602","Application Data"
"47","11:18:32.237579","192.87.28.82","192.168.0.74","TCP","66","9001  >  59488 [ACK] Seq=1 Ack=2145 Win=2347 Len=0 TSval=2691262709 TSecr=3830789590"
"48","11:18:32.343674","192.168.0.192","230.0.0.1","UDP","92","58107  >  6666 Len=50"
"49","11:18:32.402799","192.87.28.82","192.168.0.74","TLSv1.2","1116","Application Data"
"50","11:18:32.402997","192.168.0.74","192.87.28.82","TCP","66","59488  >  9001 [ACK] Seq=2145 Ack=1051 Win=4386 Len=0 TSval=3830789833 TSecr=2691262872"
"51","11:18:32.448911","192.168.0.74","192.87.28.82","TLSv1.2","602","Application Data"
"52","11:18:32.528681","192.87.28.82","192.168.0.74","TCP","66","9001  >  59488 [ACK] Seq=1051 Ack=2681 Win=2347 Len=0 TSval=2691262999 TSecr=3830789879"
"53","11:18:32.548382","192.168.0.192","230.0.0.1","UDP","92","62979  >  6666 Len=50"
"54","11:18:32.730360","192.87.28.82","192.168.0.74","TCP","1474","9001  >  59488 [ACK] Seq=1051 Ack=2681 Win=2347 Len=1408 TSval=2691263194 TSecr=3830789879 [TCP PDU reassembled in 56]"
"55","11:18:32.730363","192.87.28.82","192.168.0.74","TCP","1474","9001  >  59488 [ACK] Seq=2459 Ack=2681 Win=2347 Len=1408 TSval=2691263194 TSecr=3830789879 [TCP PDU reassembled in 56]"
"56","11:18:32.730366","192.87.28.82","192.168.0.74","TLSv1.2","870","Application Data"
"57","11:18:32.730369","192.87.28.82","192.168.0.74","TCP","1474","9001  >  59488 [ACK] Seq=4671 Ack=2681 Win=2347 Len=1408 TSval=2691263197 TSecr=3830789879 [TCP PDU reassembled in 59]"
"58","11:18:32.730372","192.87.28.82","192.168.0.74","TCP","1474","9001  >  59488 [ACK] Seq=6079 Ack=2681 Win=2347 Len=1408 TSval=2691263197 TSecr=3830789879 [TCP PDU reassembled in 59]"
"59","11:18:32.730374","192.87.28.82","192.168.0.74","TLSv1.2","1320","Application Data"
"60","11:18:32.730645","192.168.0.74","192.87.28.82","TCP","66","59488  >  9001 [ACK] Seq=2681 Ack=2459 Win=4380 Len=0 TSval=3830790161 TSecr=2691263194"
"61","11:18:32.730736","192.168.0.74","192.87.28.82","TCP","66","59488  >  9001 [ACK] Seq=2681 Ack=8741 Win=4282 Len=0 TSval=3830790161 TSecr=2691263197"
"62","11:18:32.731002","192.168.0.74","192.87.28.82","TCP","66","[TCP Window Update] 59488  >  9001 [ACK] Seq=2681 Ack=8741 Win=4402 Len=0 TSval=3830790161 TSecr=2691263197"
"63","11:18:32.762148","192.87.28.82","192.168.0.74","TLSv1.2","1202","Application Data, Application Data"
"64","11:18:32.762242","192.168.0.74","192.87.28.82","TCP","66","59488  >  9001 [ACK] Seq=2681 Ack=9877 Win=4385 Len=0 TSval=3830790192 TSecr=2691263235"
"65","11:18:32.762492","192.168.0.74","192.87.28.82","TLSv1.2","602","Application Data"
"66","11:18:32.839100","192.87.28.82","192.168.0.74","TCP","66","9001  >  59488 [ACK] Seq=9877 Ack=3217 Win=2347 Len=0 TSval=2691263312 TSecr=3830790193"
"67","11:18:32.839195","192.168.0.74","192.87.28.82","TLSv1.2","602","Application Data"
"68","11:18:32.840818","192.87.28.82","192.168.0.74","TCP","1474","9001  >  59488 [ACK] Seq=9877 Ack=3217 Win=2347 Len=1408 TSval=2691263314 TSecr=3830790193 [TCP PDU reassembled in 70]"
"69","11:18:32.840819","192.87.28.82","192.168.0.74","TCP","1474","9001  >  59488 [ACK] Seq=11285 Ack=3217 Win=2347 Len=1408 TSval=2691263314 TSecr=3830790193 [TCP PDU reassembled in 70]"
"70","11:18:32.840821","192.87.28.82","192.168.0.74","TLSv1.2","870","Application Data"
"71","11:18:32.840886","192.168.0.74","192.87.28.82","TCP","66","59488  >  9001 [ACK] Seq=3753 Ack=13497 Win=4346 Len=0 TSval=3830790271 TSecr=2691263314"
"72","11:18:32.841011","192.168.0.74","192.87.28.82","TCP","66","[TCP Window Update] 59488  >  9001 [ACK] Seq=3753 Ack=13497 Win=4402 Len=0 TSval=3830790271 TSecr=2691263314"
"73","11:18:32.851650","192.87.28.82","192.168.0.74","TCP","1474","9001  >  59488 [ACK] Seq=13497 Ack=3217 Win=2347 Len=1408 TSval=2691263324 TSecr=3830790193 [TCP PDU reassembled in 75]"
"74","11:18:32.851651","192.87.28.82","192.168.0.74","TCP","1474","9001  >  59488 [ACK] Seq=14905 Ack=3217 Win=2347 Len=1408 TSval=2691263324 TSecr=3830790193 [TCP PDU reassembled in 75]"
"75","11:18:32.851653","192.87.28.82","192.168.0.74","TLSv1.2","870","Application Data"
"76","11:18:32.851708","192.168.0.74","192.87.28.82","TCP","66","59488  >  9001 [ACK] Seq=3753 Ack=17117 Win=4346 Len=0 TSval=3830790282 TSecr=2691263324"
"77","11:18:32.851787","192.168.0.74","192.87.28.82","TCP","66","[TCP Window Update] 59488  >  9001 [ACK] Seq=3753 Ack=17117 Win=4402 Len=0 TSval=3830790282 TSecr=2691263324"
"78","11:18:32.861563","192.87.28.82","192.168.0.74","TCP","1474","9001  >  59488 [ACK] Seq=17117 Ack=3217 Win=2347 Len=1408 TSval=2691263335 TSecr=3830790193 [TCP PDU reassembled in 80]"
"79","11:18:32.861566","192.87.28.82","192.168.0.74","TCP","1474","9001  >  59488 [ACK] Seq=18525 Ack=3217 Win=2347 Len=1408 TSval=2691263335 TSecr=3830790193 [TCP PDU reassembled in 80]"
"80","11:18:32.861573","192.87.28.82","192.168.0.74","TLSv1.2","1320","Application Data"
"81","11:18:32.861763","192.168.0.74","192.87.28.82","TCP","66","59488  >  9001 [ACK] Seq=3753 Ack=21187 Win=4339 Len=0 TSval=3830790292 TSecr=2691263335"
"82","11:18:32.861854","192.168.0.74","192.87.28.82","TCP","66","[TCP Window Update] 59488  >  9001 [ACK] Seq=3753 Ack=21187 Win=4402 Len=0 TSval=3830790292 TSecr=2691263335"
"83","11:18:32.870990","192.168.0.74","192.168.0.255","NBNS","110","Refresh NB NK-MACBOOK-AIR<00>"
"84","11:18:32.873202","192.87.28.82","192.168.0.74","TLSv1.2","1474","Application Data"
"85","11:18:32.873204","192.87.28.82","192.168.0.74","TCP","1474","9001  >  59488 [ACK] Seq=22595 Ack=3217 Win=2347 Len=1408 TSval=2691263346 TSecr=3830790193 [TCP PDU reassembled in 86]"
"86","11:18:32.873206","192.87.28.82","192.168.0.74","TLSv1.2","956","Application Data"
"87","11:18:32.873277","192.168.0.74","192.87.28.82","TCP","66","59488  >  9001 [ACK] Seq=3753 Ack=24893 Win=4345 Len=0 TSval=3830790303 TSecr=2691263346"
"88","11:18:32.873391","192.168.0.74","192.87.28.82","TCP","66","[TCP Window Update] 59488  >  9001 [ACK] Seq=3753 Ack=24893 Win=4402 Len=0 TSval=3830790303 TSecr=2691263346"
"89","11:18:32.874161","192.87.28.82","192.168.0.74","TCP","1474","9001  >  59488 [ACK] Seq=24893 Ack=3753 Win=2347 Len=1408 TSval=2691263348 TSecr=3830790269 [TCP PDU reassembled in 91]"
"90","11:18:32.874187","192.168.0.74","192.87.28.82","TCP","66","59488  >  9001 [ACK] Seq=3753 Ack=26301 Win=4380 Len=0 TSval=3830790304 TSecr=2691263348"
"91","11:18:32.875532","192.87.28.82","192.168.0.74","TLSv1.2","1250","Application Data"
"92","11:18:32.875552","192.168.0.74","192.87.28.82","TCP","66","59488  >  9001 [ACK] Seq=3753 Ack=27485 Win=4384 Len=0 TSval=3830790306 TSecr=2691263348"
"93","11:18:32.875681","192.168.0.74","192.87.28.82","TLSv1.2","602","Application Data"
"94","11:18:32.876112","192.87.28.82","192.168.0.74","TCP","1474","9001  >  59488 [ACK] Seq=27485 Ack=3753 Win=2347 Len=1408 TSval=2691263350 TSecr=3830790269 [TCP PDU reassembled in 98]"
"95","11:18:32.876139","192.168.0.74","192.87.28.82","TCP","66","59488  >  9001 [ACK] Seq=4289 Ack=28893 Win=4380 Len=0 TSval=3830790306 TSecr=2691263350"
"96","11:18:32.877947","192.87.28.82","192.168.0.74","TCP","1474","9001  >  59488 [ACK] Seq=28893 Ack=3753 Win=2347 Len=1408 TSval=2691263350 TSecr=3830790271 [TCP PDU reassembled in 98]"
"97","11:18:32.877968","192.168.0.74","192.87.28.82","TCP","66","59488  >  9001 [ACK] Seq=4289 Ack=30301 Win=4380 Len=0 TSval=3830790308 TSecr=2691263350"
"98","11:18:32.890432","192.87.28.82","192.168.0.74","TLSv1.2","1474","Application Data"
"99","11:18:32.890434","192.87.28.82","192.168.0.74","TCP","1474","9001  >  59488 [ACK] Seq=31709 Ack=3753 Win=2347 Len=1408 TSval=2691263363 TSecr=3830790282 [TCP PDU reassembled in 100]"
"100","11:18:32.890435","192.87.28.82","192.168.0.74","TLSv1.2","646","Application Data"
"101","11:18:32.890559","192.168.0.74","192.87.28.82","TCP","66","59488  >  9001 [ACK] Seq=4289 Ack=33697 Win=4349 Len=0 TSval=3830790321 TSecr=2691263363"
"102","11:18:32.890654","192.168.0.74","192.87.28.82","TCP","66","[TCP Window Update] 59488  >  9001 [ACK] Seq=4289 Ack=33697 Win=4402 Len=0 TSval=3830790321 TSecr=2691263363"
"103","11:18:32.928317","192.87.28.82","192.168.0.74","TLSv1.2","1116","Application Data"
"104","11:18:32.928445","192.168.0.74","192.87.28.82","TLSv1.2","602","Application Data"
"105","11:18:32.949291","64.65.63.120","192.168.0.74","TCP","1474","443  >  59487 [ACK] Seq=1073 Ack=1 Win=2456 Len=1408 TSval=2679214140 TSecr=3161919505 [TCP PDU reassembled in 111]"
"106","11:18:32.949450","192.168.0.74","64.65.63.120","TCP","66","59487  >  443 [ACK] Seq=1 Ack=2481 Win=9176 Len=0 TSval=3161921424 TSecr=2679214140"
"107","11:18:32.953032","64.65.63.120","192.168.0.74","TCP","1474","443  >  59487 [PSH, ACK] Seq=2481 Ack=1 Win=2456 Len=1408 TSval=2679214140 TSecr=3161919505 [TCP PDU reassembled in 111]"
"108","11:18:32.953034","192.87.28.82","192.168.0.74","TCP","1474","9001  >  59488 [ACK] Seq=34747 Ack=4289 Win=2347 Len=1408 TSval=2691263425 TSecr=3830790321 [TCP PDU reassembled in 110]"
"109","11:18:32.953036","192.87.28.82","192.168.0.74","TCP","1474","9001  >  59488 [ACK] Seq=36155 Ack=4289 Win=2347 Len=1408 TSval=2691263425 TSecr=3830790321 [TCP PDU reassembled in 110]"
"110","11:18:32.953038","192.87.28.82","192.168.0.74","TLSv1.2","1320","Application Data"
"111","11:18:32.953042","64.65.63.120","192.168.0.74","TLSv1.2","870","Application Data"
"112","11:18:32.953044","192.87.28.82","192.168.0.74","TCP","1474","9001  >  59488 [ACK] Seq=38817 Ack=4289 Win=2347 Len=1408 TSval=2691263425 TSecr=3830790321 [TCP PDU reassembled in 114]"
"113","11:18:32.953045","192.87.28.82","192.168.0.74","TCP","1474","9001  >  59488 [ACK] Seq=40225 Ack=4289 Win=2347 Len=1408 TSval=2691263425 TSecr=3830790321 [TCP PDU reassembled in 114]"
"114","11:18:32.953047","192.87.28.82","192.168.0.74","TLSv1.2","1320","Application Data"
"115","11:18:32.953049","192.87.28.82","192.168.0.74","TCP","1474","9001  >  59488 [ACK] Seq=42887 Ack=4289 Win=2347 Len=1408 TSval=2691263425 TSecr=3830790321 [TCP PDU reassembled in 117]"
"116","11:18:32.953050","192.87.28.82","192.168.0.74","TCP","1474","9001  >  59488 [ACK] Seq=44295 Ack=4289 Win=2347 Len=1408 TSval=2691263425 TSecr=3830790321 [TCP PDU reassembled in 117]"
"117","11:18:32.953052","192.87.28.82","192.168.0.74","TLSv1.2","1320","Application Data"
"118","11:18:32.953122","192.168.0.74","192.87.28.82","TCP","66","59488  >  9001 [ACK] Seq=4825 Ack=46957 Win=4212 Len=0 TSval=3830790383 TSecr=2691263425"
"119","11:18:32.953144","192.168.0.74","64.65.63.120","TCP","66","59487  >  443 [ACK] Seq=1 Ack=4693 Win=9164 Len=0 TSval=3161921428 TSecr=2679214140"
"120","11:18:32.953225","192.168.0.74","192.87.28.82","TCP","66","[TCP Window Update] 59488  >  9001 [ACK] Seq=4825 Ack=46957 Win=4402 Len=0 TSval=3830790383 TSecr=2691263425"
"121","11:18:32.972866","192.87.28.82","192.168.0.74","TLSv1.2","1474","Application Data"
"122","11:18:32.972868","192.87.28.82","192.168.0.74","TCP","1474","9001  >  59488 [ACK] Seq=48365 Ack=4825 Win=2347 Len=1408 TSval=2691263436 TSecr=3830790358 [TCP PDU reassembled in 124]"
"123","11:18:32.972870","192.87.28.82","192.168.0.74","TCP","1474","9001  >  59488 [ACK] Seq=49773 Ack=4825 Win=2347 Len=1408 TSval=2691263436 TSecr=3830790358 [TCP PDU reassembled in 124]"
"124","11:18:32.972871","192.87.28.82","192.168.0.74","TLSv1.2","1154","Application Data"
"125","11:18:32.972872","192.87.28.82","192.168.0.74","TCP","1474","9001  >  59488 [ACK] Seq=52269 Ack=4825 Win=2347 Len=1408 TSval=2691263436 TSecr=3830790358 [TCP PDU reassembled in 126]"
"126","11:18:32.972873","192.87.28.82","192.168.0.74","TLSv1.2","1314","Application Data"
"127","11:18:32.973001","192.168.0.74","192.87.28.82","TLSv1.2","602","Application Data"
"128","11:18:32.973138","192.168.0.74","192.87.28.82","TCP","66","[TCP Window Update] 59488  >  9001 [ACK] Seq=5361 Ack=54925 Win=4402 Len=0 TSval=3830790403 TSecr=2691263436"
"129","11:18:32.974717","192.87.28.82","192.168.0.74","TCP","1474","9001  >  59488 [ACK] Seq=54925 Ack=4825 Win=2347 Len=1408 TSval=2691263449 TSecr=3830790358 [TCP PDU reassembled in 131]"
"130","11:18:32.974719","192.87.28.82","192.168.0.74","TCP","1474","9001  >  59488 [ACK] Seq=56333 Ack=4825 Win=2347 Len=1408 TSval=2691263449 TSecr=3830790358 [TCP PDU reassembled in 131]"
"131","11:18:32.974720","192.87.28.82","192.168.0.74","TLSv1.2","1320","Application Data"
"132","11:18:32.974817","192.168.0.74","192.87.28.82","TCP","66","59488  >  9001 [ACK] Seq=5361 Ack=58995 Win=4339 Len=0 TSval=3830790405 TSecr=2691263449"
"133","11:18:32.974876","192.168.0.74","192.87.28.82","TCP","66","[TCP Window Update] 59488  >  9001 [ACK] Seq=5361 Ack=58995 Win=4402 Len=0 TSval=3830790405 TSecr=2691263449"
"134","11:18:32.987700","192.168.0.74","149.154.167.41","SSL","331","Continuation Data"
"135","11:18:32.998195","64.65.63.120","192.168.0.74","TLSv1.2","1116","Application Data"
"136","11:18:32.998330","192.168.0.74","64.65.63.120","TCP","66","59487  >  443 [ACK] Seq=1 Ack=5743 Win=9182 Len=0 TSval=3161921473 TSecr=2679214187"
"137","11:18:33.005604","192.87.28.82","192.168.0.74","TLSv1.2","666","Application Data"
"138","11:18:33.005710","192.168.0.74","192.87.28.82","TLSv1.2","602","Application Data"
"139","11:18:33.032324","149.154.167.41","192.168.0.74","TCP","70","443  >  59400 [PSH, ACK] Seq=1 Ack=266 Win=2048 Len=4 TSval=323619321 TSecr=1843906241 [TCP PDU reassembled in 142]"
"140","11:18:33.032421","192.168.0.74","149.154.167.41","TCP","66","59400  >  443 [ACK] Seq=266 Ack=5 Win=65535 Len=0 TSval=1843906285 TSecr=323619321"
"141","11:18:33.035469","64.65.63.120","192.168.0.74","TLSv1.2","602","Application Data"
"142","11:18:33.035470","149.154.167.41","192.168.0.74","SSL","219","Continuation Data"
"143","11:18:33.035513","192.168.0.74","149.154.167.41","TCP","66","59400  >  443 [ACK] Seq=266 Ack=158 Win=65527 Len=0 TSval=1843906289 TSecr=323619327"
"144","11:18:33.035541","192.168.0.74","64.65.63.120","TCP","66","59487  >  443 [ACK] Seq=1 Ack=6279 Win=9190 Len=0 TSval=3161921511 TSecr=2679214230"
"145","11:18:33.055559","192.168.0.74","5.28.195.2","TCP","78","[TCP Retransmission] 60990  >  5222 [SYN] Seq=0 Win=65535 Len=0 MSS=1460 WS=16 TSval=2687783334 TSecr=0 SACK_PERM"
"146","11:18:33.055596","192.168.0.74","5.28.195.2","TCP","78","[TCP Retransmission] 60989  >  80 [SYN] Seq=0 Win=65535 Len=0 MSS=1460 WS=16 TSval=3362094728 TSecr=0 SACK_PERM"
"147","11:18:33.069060","192.168.0.74","149.154.167.41","SSL","299","Continuation Data"
"148","11:18:33.077119","192.87.28.82","192.168.0.74","TCP","66","9001  >  59488 [ACK] Seq=59595 Ack=5897 Win=2347 Len=0 TSval=2691263551 TSecr=3830790436"
"149","11:18:33.077247","192.168.0.74","192.87.28.82","TLSv1.2","602","Application Data"
"150","11:18:33.107890","149.154.167.41","192.168.0.74","TCP","70","443  >  59400 [PSH, ACK] Seq=158 Ack=499 Win=2048 Len=4 TSval=323619402 TSecr=1843906322 [TCP PDU reassembled in 152]"
"151","11:18:33.108017","192.168.0.74","149.154.167.41","TCP","66","59400  >  443 [ACK] Seq=499 Ack=162 Win=65535 Len=0 TSval=1843906361 TSecr=323619402"
"152","11:18:33.114827","149.154.167.41","192.168.0.74","SSL","219","Continuation Data"
"153","11:18:33.114887","192.168.0.74","149.154.167.41","TCP","66","59400  >  443 [ACK] Seq=499 Ack=315 Win=65527 Len=0 TSval=1843906368 TSecr=323619408"
"154","11:18:33.149837","64.65.63.120","192.168.0.74","TLSv1.2","602","Application Data"
"155","11:18:33.149839","192.87.28.82","192.168.0.74","TCP","66","9001  >  59488 [ACK] Seq=59595 Ack=6433 Win=2347 Len=0 TSval=2691263624 TSecr=3830790507"
"156","11:18:33.149950","192.168.0.74","64.65.63.120","TCP","66","59487  >  443 [ACK] Seq=1 Ack=6815 Win=9190 Len=0 TSval=3161921625 TSecr=2679214344"
"157","11:18:33.181938","192.87.28.82","192.168.0.74","TCP","1474","9001  >  59488 [ACK] Seq=59595 Ack=6433 Win=2347 Len=1408 TSval=2691263655 TSecr=3830790507 [TCP PDU reassembled in 159]"
"158","11:18:33.181941","192.87.28.82","192.168.0.74","TCP","1474","9001  >  59488 [ACK] Seq=61003 Ack=6433 Win=2347 Len=1408 TSval=2691263655 TSecr=3830790507 [TCP PDU reassembled in 159]"
"159","11:18:33.181942","192.87.28.82","192.168.0.74","TLSv1.2","870","Application Data"
"160","11:18:33.182080","192.168.0.74","192.87.28.82","TCP","66","59488  >  9001 [ACK] Seq=6433 Ack=63215 Win=4346 Len=0 TSval=3830790612 TSecr=2691263655"
"161","11:18:33.182209","192.168.0.74","192.87.28.82","TCP","66","[TCP Window Update] 59488  >  9001 [ACK] Seq=6433 Ack=63215 Win=4402 Len=0 TSval=3830790612 TSecr=2691263655"
"162","11:18:33.197146","192.87.28.82","192.168.0.74","TCP","1474","9001  >  59488 [ACK] Seq=63215 Ack=6433 Win=2347 Len=1408 TSval=2691263670 TSecr=3830790507 [TCP PDU reassembled in 163]"
"163","11:18:33.197148","192.87.28.82","192.168.0.74","TLSv1.2","736","Application Data"
"164","11:18:33.197333","192.168.0.74","192.87.28.82","TCP","66","59488  >  9001 [ACK] Seq=6433 Ack=65293 Win=4402 Len=0 TSval=3830790627 TSecr=2691263670"
"165","11:18:33.227957","192.168.0.74","192.87.28.82","TLSv1.2","1116","Application Data"
"166","11:18:33.265078","192.168.0.192","230.0.0.1","UDP","92","58107  >  6666 Len=50"
"167","11:18:33.309726","192.87.28.82","192.168.0.74","TCP","66","9001  >  59488 [ACK] Seq=65293 Ack=7483 Win=2347 Len=0 TSval=2691263775 TSecr=3830790658"
"168","11:18:33.351274","64.65.63.120","192.168.0.74","TCP","1474","443  >  59487 [ACK] Seq=6815 Ack=1 Win=2456 Len=1408 TSval=2679214545 TSecr=3161921625 [TCP PDU reassembled in 169]"
"169","11:18:33.351276","64.65.63.120","192.168.0.74","TLSv1.2","222","Application Data"
"170","11:18:33.351375","192.168.0.74","64.65.63.120","TCP","66","59487  >  443 [ACK] Seq=1 Ack=8379 Win=9174 Len=0 TSval=3161921826 TSecr=2679214545"
"171","11:18:33.351590","192.168.0.74","64.65.63.120","TLSv1.2","602","Application Data"
"172","11:18:33.353179","192.168.0.74","192.87.28.82","TLSv1.2","602","Application Data"
"173","11:18:33.376075","192.168.0.74","5.28.195.2","TCP","78","60993  >  443 [SYN, ECE, CWR] Seq=0 Win=65535 Len=0 MSS=1460 WS=16 TSval=1541274366 TSecr=0 SACK_PERM"
"174","11:18:33.392421","64.65.63.120","192.168.0.74","TCP","66","443  >  59487 [ACK] Seq=8379 Ack=537 Win=2452 Len=0 TSval=2679214584 TSecr=3161921827"
"175","11:18:33.402025","192.168.0.74","192.87.28.82","TCP","1474","59488  >  9001 [ACK] Seq=8019 Ack=65293 Win=4402 Len=1408 TSval=3830790832 TSecr=2691263775 [TCP PDU reassembled in 176]"
"176","11:18:33.402049","192.168.0.74","192.87.28.82","TLSv1.2","736","Application Data"
"177","11:18:33.404031","192.168.0.74","192.87.28.82","TCP","1474","59488  >  9001 [ACK] Seq=10097 Ack=65293 Win=4402 Len=1408 TSval=3830790834 TSecr=2691263775 [TCP PDU reassembled in 179]"
"178","11:18:33.404033","192.168.0.74","192.87.28.82","TCP","1474","59488  >  9001 [ACK] Seq=11505 Ack=65293 Win=4402 Len=1408 TSval=3830790834 TSecr=2691263775 [TCP PDU reassembled in 179]"
"179","11:18:33.404050","192.168.0.74","192.87.28.82","TLSv1.2","870","Application Data"
"180","11:18:33.422129","5.28.195.2","192.168.0.74","TCP","74","443  >  60993 [SYN, ACK, ECE] Seq=0 Ack=1 Win=65535 Len=0 MSS=1240 SACK_PERM TSval=3344916787 TSecr=1541274366 WS=1024"
"181","11:18:33.422284","192.168.0.74","5.28.195.2","TCP","66","60993  >  443 [ACK] Seq=1 Ack=1 Win=1048560 Len=0 TSval=1541274412 TSecr=3344916787"
"182","11:18:33.422499","192.168.0.74","5.28.195.2","TLSv1","583","Client Hello"
"183","11:18:33.430901","192.87.28.82","192.168.0.74","TCP","66","9001  >  59488 [ACK] Seq=65293 Ack=8019 Win=2347 Len=0 TSval=2691263901 TSecr=3830790783"
"184","11:18:33.437591","192.87.28.82","192.168.0.74","TCP","66","9001  >  59488 [ACK] Seq=65293 Ack=10097 Win=2315 Len=0 TSval=2691263908 TSecr=3830790832"
"185","11:18:33.442192","192.87.28.82","192.168.0.74","TCP","66","9001  >  59488 [ACK] Seq=65293 Ack=12913 Win=2325 Len=0 TSval=2691263913 TSecr=3830790834"
"186","11:18:33.466169","5.28.195.2","192.168.0.74","TCP","66","443  >  60993 [ACK] Seq=1 Ack=518 Win=67584 Len=0 TSval=3344916838 TSecr=1541274413"
"187","11:18:33.466172","5.28.195.2","192.168.0.74","TCP","66","443  >  60993 [FIN, ACK] Seq=1 Ack=518 Win=67584 Len=0 TSval=3344916838 TSecr=1541274413"
"188","11:18:33.466327","192.168.0.74","5.28.195.2","TCP","66","60993  >  443 [ACK] Seq=518 Ack=2 Win=1048560 Len=0 TSval=1541274456 TSecr=3344916838"
"189","11:18:33.466516","192.168.0.74","5.28.195.2","TCP","66","60993  >  443 [FIN, ACK] Seq=518 Ack=2 Win=1048560 Len=0 TSval=1541274457 TSecr=3344916838"
"190","11:18:33.488573","192.87.28.82","192.168.0.74","TCP","66","9001  >  59488 [ACK] Seq=65293 Ack=13717 Win=2347 Len=0 TSval=2691263954 TSecr=3830790834"
"191","11:18:33.502713","5.28.195.2","192.168.0.74","TCP","56","443  >  60993 [RST] Seq=2 Win=0 Len=0"
"192","11:18:33.547548","64.65.63.120","192.168.0.74","TLSv1.2","602","Application Data"
"193","11:18:33.547694","192.168.0.74","64.65.63.120","TCP","66","59487  >  443 [ACK] Seq=537 Ack=8915 Win=9190 Len=0 TSval=3161922023 TSecr=2679214742"
"194","11:18:33.548729","192.168.0.74","192.87.28.82","TCP","1474","59488  >  9001 [ACK] Seq=13717 Ack=65293 Win=4402 Len=1408 TSval=3830790979 TSecr=2691263954 [TCP PDU reassembled in 195]"
"195","11:18:33.548749","192.168.0.74","192.87.28.82","TLSv1.2","736","Application Data"
"196","11:18:33.572444","192.168.0.192","230.0.0.1","UDP","92","62979  >  6666 Len=50"
"197","11:18:33.586036","192.87.28.82","192.168.0.74","TCP","66","9001  >  59488 [ACK] Seq=65293 Ack=15795 Win=2315 Len=0 TSval=2691264057 TSecr=3830790979"
"198","11:18:33.673613","64.65.63.120","192.168.0.74","TCP","1474","443  >  59487 [ACK] Seq=8915 Ack=537 Win=2452 Len=1408 TSval=2679214867 TSecr=3161922023 [TCP PDU reassembled in 200]"
"199","11:18:33.673615","64.65.63.120","192.168.0.74","TCP","1474","443  >  59487 [PSH, ACK] Seq=10323 Ack=537 Win=2452 Len=1408 TSval=2679214867 TSecr=3161922023 [TCP PDU reassembled in 200]"
"200","11:18:33.673616","64.65.63.120","192.168.0.74","TLSv1.2","870","Application Data"
"201","11:18:33.673731","192.168.0.74","64.65.63.120","TCP","66","59487  >  443 [ACK] Seq=537 Ack=12535 Win=9142 Len=0 TSval=3161922149 TSecr=2679214867"
"202","11:18:33.673865","192.168.0.74","64.65.63.120","TCP","66","[TCP Window Update] 59487  >  443 [ACK] Seq=537 Ack=12535 Win=9198 Len=0 TSval=3161922149 TSecr=2679214867"
"203","11:18:33.710512","64.65.63.120","192.168.0.74","TCP","1474","443  >  59487 [ACK] Seq=12535 Ack=537 Win=2452 Len=1408 TSval=2679214903 TSecr=3161922149 [TCP PDU reassembled in 205]"
"204","11:18:33.710514","64.65.63.120","192.168.0.74","TCP","1474","443  >  59487 [PSH, ACK] Seq=13943 Ack=537 Win=2452 Len=1408 TSval=2679214903 TSecr=3161922149 [TCP PDU reassembled in 205]"
"205","11:18:33.710516","64.65.63.120","192.168.0.74","TLSv1.2","1320","Application Data"
"206","11:18:33.710517","64.65.63.120","192.168.0.74","TLSv1.2","1474","Application Data"
"207","11:18:33.710518","64.65.63.120","192.168.0.74","TCP","1474","443  >  59487 [PSH, ACK] Seq=18013 Ack=537 Win=2452 Len=1408 TSval=2679214903 TSecr=3161922149 [TCP PDU reassembled in 209]"
"208","11:18:33.710519","64.65.63.120","192.168.0.74","TCP","1474","443  >  59487 [ACK] Seq=19421 Ack=537 Win=2452 Len=1408 TSval=2679214903 TSecr=3161922149 [TCP PDU reassembled in 209]"
"209","11:18:33.710521","64.65.63.120","192.168.0.74","TLSv1.2","1474","Application Data"
"210","11:18:33.710521","64.65.63.120","192.168.0.74","TCP","1474","443  >  59487 [PSH, ACK] Seq=22237 Ack=537 Win=2452 Len=1408 TSval=2679214903 TSecr=3161922149 [TCP PDU reassembled in 212]"
"211","11:18:33.710523","64.65.63.120","192.168.0.74","TCP","1474","443  >  59487 [ACK] Seq=23645 Ack=537 Win=2452 Len=1408 TSval=2679214903 TSecr=3161922149 [TCP PDU reassembled in 212]"
"212","11:18:33.710524","64.65.63.120","192.168.0.74","TLSv1.2","1474","Application Data"
"213","11:18:33.710638","192.168.0.74","64.65.63.120","TCP","66","59487  >  443 [ACK] Seq=537 Ack=26461 Win=8981 Len=0 TSval=3161922186 TSecr=2679214903"
"214","11:18:33.710803","192.168.0.74","64.65.63.120","TCP","66","[TCP Window Update] 59487  >  443 [ACK] Seq=537 Ack=26461 Win=9198 Len=0 TSval=3161922186 TSecr=2679214903"
"215","11:18:33.710996","192.168.0.74","64.65.63.120","TLSv1.2","602","Application Data"
"216","11:18:33.712611","192.168.0.74","192.87.28.82","TLSv1.2","602","Application Data"
"217","11:18:33.752474","64.65.63.120","192.168.0.74","TCP","1474","443  >  59487 [ACK] Seq=26461 Ack=537 Win=2452 Len=1408 TSval=2679214945 TSecr=3161922186 [TCP PDU reassembled in 219]"
"218","11:18:33.752476","64.65.63.120","192.168.0.74","TCP","1474","443  >  59487 [PSH, ACK] Seq=27869 Ack=537 Win=2452 Len=1408 TSval=2679214945 TSecr=3161922186 [TCP PDU reassembled in 219]"
"219","11:18:33.752477","64.65.63.120","192.168.0.74","TLSv1.2","1474","Application Data, Application Data"
"220","11:18:33.752478","64.65.63.120","192.168.0.74","TCP","1474","443  >  59487 [PSH, ACK] Seq=30685 Ack=537 Win=2452 Len=1408 TSval=2679214945 TSecr=3161922186 [TCP PDU reassembled in 222]"
"221","11:18:33.752479","64.65.63.120","192.168.0.74","TCP","1474","443  >  59487 [ACK] Seq=32093 Ack=1073 Win=2448 Len=1408 TSval=2679214945 TSecr=3161922186 [TCP PDU reassembled in 222]"
"222","11:18:33.752480","64.65.63.120","192.168.0.74","TLSv1.2","1474","Application Data"
"223","11:18:33.752481","64.65.63.120","192.168.0.74","TCP","1474","443  >  59487 [ACK] Seq=34909 Ack=1073 Win=2448 Len=1408 TSval=2679214945 TSecr=3161922186 [TCP PDU reassembled in 225]"
"224","11:18:33.752483","64.65.63.120","192.168.0.74","TCP","1474","443  >  59487 [PSH, ACK] Seq=36317 Ack=1073 Win=2448 Len=1408 TSval=2679214945 TSecr=3161922186 [TCP PDU reassembled in 225]"
"225","11:18:33.752484","64.65.63.120","192.168.0.74","TLSv1.2","1474","Application Data"
"226","11:18:33.752485","64.65.63.120","192.168.0.74","TLSv1.2","1444","Application Data, Application Data"
"227","11:18:33.752486","64.65.63.120","192.168.0.74","TCP","1474","443  >  59487 [ACK] Seq=40511 Ack=1073 Win=2448 Len=1408 TSval=2679214946 TSecr=3161922186 [TCP PDU reassembled in 234]"
"228","11:18:33.752487","64.65.63.120","192.168.0.74","TCP","66","443  >  59487 [ACK] Seq=32093 Ack=1073 Win=2448 Len=0 TSval=2679214945 TSecr=3161922186"
"229","11:18:33.752602","192.168.0.74","64.65.63.120","TCP","66","59487  >  443 [ACK] Seq=1073 Ack=32093 Win=9110 Len=0 TSval=3161922228 TSecr=2679214945"
"230","11:18:33.752648","192.168.0.74","64.65.63.120","TCP","66","59487  >  443 [ACK] Seq=1073 Ack=41919 Win=8957 Len=0 TSval=3161922228 TSecr=2679214946"
"231","11:18:33.752792","192.168.0.74","64.65.63.120","TCP","66","[TCP Window Update] 59487  >  443 [ACK] Seq=1073 Ack=41919 Win=9198 Len=0 TSval=3161922228 TSecr=2679214946"
"232","11:18:33.788184","192.87.28.82","192.168.0.74","TCP","66","9001  >  59488 [ACK] Seq=65293 Ack=16331 Win=2347 Len=0 TSval=2691264261 TSecr=3830791143"
"233","11:18:33.788305","192.168.0.74","192.87.28.82","TLSv1.2","1116","Application Data"
"234","11:18:33.789863","64.65.63.120","192.168.0.74","TLSv1.2","222","Application Data"
"235","11:18:33.789908","192.168.0.74","64.65.63.120","TCP","66","59487  >  443 [ACK] Seq=1073 Ack=42075 Win=9196 Len=0 TSval=3161922265 TSecr=2679214984"
"236","11:18:33.790148","192.168.0.74","64.65.63.120","TLSv1.2","602","Application Data"
"237","11:18:33.824199","64.65.63.120","192.168.0.74","TLSv1.2","602","Application Data"
"238","11:18:33.824288","192.168.0.74","64.65.63.120","TCP","66","59487  >  443 [ACK] Seq=1609 Ack=42611 Win=9190 Len=0 TSval=3161922299 TSecr=2679215018"
"239","11:18:33.844286","64.65.63.120","192.168.0.74","TLSv1.2","1474","Application Data"
"240","11:18:33.844288","64.65.63.120","192.168.0.74","TCP","1474","443  >  59487 [PSH, ACK] Seq=44019 Ack=1609 Win=2444 Len=1408 TSval=2679215038 TSecr=3161922265 [TCP PDU reassembled in 243]"
"241","11:18:33.844398","192.168.0.74","64.65.63.120","TCP","66","59487  >  443 [ACK] Seq=1609 Ack=45427 Win=9154 Len=0 TSval=3161922319 TSecr=2679215038"
"242","11:18:33.844541","192.168.0.74","64.65.63.120","TCP","66","[TCP Window Update] 59487  >  443 [ACK] Seq=1609 Ack=45427 Win=9198 Len=0 TSval=3161922320 TSecr=2679215038"
"243","11:18:33.846761","64.65.63.120","192.168.0.74","TLSv1.2","1474","Application Data"
"244","11:18:33.846763","64.65.63.120","192.168.0.74","TCP","1474","443  >  59487 [PSH, ACK] Seq=46835 Ack=1609 Win=2444 Len=1408 TSval=2679215041 TSecr=3161922265 [TCP PDU reassembled in 247]"
"245","11:18:33.846764","64.65.63.120","192.168.0.74","TCP","1474","443  >  59487 [ACK] Seq=48243 Ack=1609 Win=2444 Len=1408 TSval=2679215041 TSecr=3161922265 [TCP PDU reassembled in 247]"
"246","11:18:33.847459","192.168.0.74","64.65.63.120","TCP","66","59487  >  443 [ACK] Seq=1609 Ack=49651 Win=9198 Len=0 TSval=3161922323 TSecr=2679215041"
"247","11:18:33.850953","64.65.63.120","192.168.0.74","TLSv1.2","1474","Application Data, Application Data"
"248","11:18:33.850955","64.65.63.120","192.168.0.74","TCP","1474","443  >  59487 [PSH, ACK] Seq=51059 Ack=1609 Win=2444 Len=1408 TSval=2679215045 TSecr=3161922265 [TCP PDU reassembled in 251]"
"249","11:18:33.850957","64.65.63.120","192.168.0.74","TCP","1474","443  >  59487 [ACK] Seq=52467 Ack=1609 Win=2444 Len=1408 TSval=2679215045 TSecr=3161922265 [TCP PDU reassembled in 251]"
"250","11:18:33.851228","192.168.0.74","64.65.63.120","TCP","66","59487  >  443 [ACK] Seq=1609 Ack=53875 Win=9198 Len=0 TSval=3161922326 TSecr=2679215045"
"251","11:18:33.853844","64.65.63.120","192.168.0.74","TLSv1.2","1474","Application Data, Application Data"
"252","11:18:33.853847","64.65.63.120","192.168.0.74","TCP","1474","443  >  59487 [PSH, ACK] Seq=55283 Ack=1609 Win=2444 Len=1408 TSval=2679215048 TSecr=3161922265 [TCP PDU reassembled in 255]"
"253","11:18:33.853848","64.65.63.120","192.168.0.74","TCP","1474","443  >  59487 [ACK] Seq=56691 Ack=1609 Win=2444 Len=1408 TSval=2679215048 TSecr=3161922265 [TCP PDU reassembled in 255]"
"254","11:18:33.854099","192.168.0.74","64.65.63.120","TCP","66","59487  >  443 [ACK] Seq=1609 Ack=58099 Win=9198 Len=0 TSval=3161922329 TSecr=2679215048"
"255","11:18:33.857215","64.65.63.120","192.168.0.74","TLSv1.2","1474","Application Data"
"256","11:18:33.857217","64.65.63.120","192.168.0.74","TLSv1.2","308","Application Data"
"257","11:18:33.857369","192.168.0.74","64.65.63.120","TCP","66","59487  >  443 [ACK] Seq=1609 Ack=59749 Win=9198 Len=0 TSval=3161922332 TSecr=2679215052"
"258","11:18:33.857478","192.168.0.74","64.65.63.120","TLSv1.2","602","Application Data"
"259","11:18:33.858849","192.87.28.82","192.168.0.74","TCP","66","9001  >  59488 [ACK] Seq=65293 Ack=17381 Win=2347 Len=0 TSval=2691264332 TSecr=3830791218"
"260","11:18:33.858851","64.65.63.120","192.168.0.74","TCP","1474","443  >  59487 [ACK] Seq=59749 Ack=1609 Win=2444 Len=1408 TSval=2679215054 TSecr=3161922299 [TCP PDU reassembled in 264]"
"261","11:18:33.858851","64.65.63.120","192.168.0.74","TCP","1474","443  >  59487 [PSH, ACK] Seq=61157 Ack=1609 Win=2444 Len=1408 TSval=2679215054 TSecr=3161922299 [TCP PDU reassembled in 264]"
"262","11:18:33.858940","192.168.0.74","192.87.28.82","TLSv1.2","1138","Application Data, Application Data"
"263","11:18:33.859012","192.168.0.74","64.65.63.120","TCP","66","59487  >  443 [ACK] Seq=2145 Ack=62565 Win=9198 Len=0 TSval=3161922334 TSecr=2679215054"
"264","11:18:33.859653","64.65.63.120","192.168.0.74","TLSv1.2","1474","Application Data"
"265","11:18:33.883648","192.87.28.82","192.168.0.74","TLSv1.2","602","Application Data"
"266","11:18:33.883799","192.168.0.74","192.87.28.82","TCP","66","59488  >  9001 [ACK] Seq=18453 Ack=65829 Win=4402 Len=0 TSval=3830791314 TSecr=2691264356"
"267","11:18:33.897888","64.65.63.120","192.168.0.74","TLSv1.2","1474","Application Data"
"268","11:18:33.897890","64.65.63.120","192.168.0.74","TCP","1474","443  >  59487 [PSH, ACK] Seq=65381 Ack=1609 Win=2444 Len=1408 TSval=2679215090 TSecr=3161922329 [TCP PDU reassembled in 270]"
"269","11:18:33.897891","64.65.63.120","192.168.0.74","TCP","1474","443  >  59487 [ACK] Seq=66789 Ack=1609 Win=2444 Len=1408 TSval=2679215090 TSecr=3161922329 [TCP PDU reassembled in 270]"
"270","11:18:33.897892","64.65.63.120","192.168.0.74","TLSv1.2","1474","Application Data"
"271","11:18:33.897893","64.65.63.120","192.168.0.74","TCP","1474","443  >  59487 [PSH, ACK] Seq=69605 Ack=2145 Win=2440 Len=1408 TSval=2679215090 TSecr=3161922333 [TCP PDU reassembled in 273]"
"272","11:18:33.897894","64.65.63.120","192.168.0.74","TCP","1474","443  >  59487 [ACK] Seq=71013 Ack=2145 Win=2440 Len=1408 TSval=2679215090 TSecr=3161922333 [TCP PDU reassembled in 273]"
"273","11:18:33.897895","64.65.63.120","192.168.0.74","TLSv1.2","1474","Application Data"
"274","11:18:33.897896","64.65.63.120","192.168.0.74","TLSv1.2","1002","Application Data"
"275","11:18:33.897897","64.65.63.120","192.168.0.74","TCP","1474","443  >  59487 [ACK] Seq=74765 Ack=2145 Win=2440 Len=1408 TSval=2679215093 TSecr=3161922333 [TCP PDU reassembled in 277]"
"276","11:18:33.897899","64.65.63.120","192.168.0.74","TCP","1474","443  >  59487 [PSH, ACK] Seq=76173 Ack=2145 Win=2440 Len=1408 TSval=2679215093 TSecr=3161922333 [TCP PDU reassembled in 277]"
"277","11:18:33.897899","64.65.63.120","192.168.0.74","TLSv1.2","1474","Application Data"
"278","11:18:33.898086","192.168.0.74","64.65.63.120","TCP","66","59487  >  443 [ACK] Seq=2145 Ack=78989 Win=9198 Len=0 TSval=3161922373 TSecr=2679215054"
"279","11:18:33.898250","192.168.0.74","64.65.63.120","TLSv1.2","602","Application Data"
"280","11:18:33.902671","64.65.63.120","192.168.0.74","TLSv1.2","1474","Application Data"
"281","11:18:33.907427","64.65.63.120","192.168.0.74","TLSv1.2","1474","Application Data"
"282","11:18:33.907429","64.65.63.120","192.168.0.74","TCP","1474","443  >  59487 [PSH, ACK] Seq=81805 Ack=2145 Win=2440 Len=1408 TSval=2679215100 TSecr=3161922334 [TCP PDU reassembled in 284]"
