"No.","Time","Source","Destination","Protocol","Length","Info"
"1","11:29:45.549893","2603:1063:12::2ec","2a02:ab88:b:4100:6163:ab1b:4f48:fc2c","TLSv1.2","133","Application Data"
"2","11:29:45.550025","2a02:ab88:b:4100:6163:ab1b:4f48:fc2c","2603:1063:12::2ec","TCP","86","58880  >  443 [ACK] Seq=1 Ack=48 Win=2048 Len=0 TSval=2987487315 TSecr=476276791"
"3","11:29:45.733400","192.168.0.192","230.0.0.1","UDP","92","62979  >  6666 Len=50"
"4","11:29:45.810990","2a02:ab88:b:4100:6163:ab1b:4f48:fc2c","2a09:bac0:1008:1000:0:300:7b:4b","UDP","104","50977  >  443 Len=42"
"5","11:29:46.558959","192.168.0.192","230.0.0.1","UDP","92","58107  >  6666 Len=50"
"6","11:29:46.764523","192.168.0.192","230.0.0.1","UDP","92","62979  >  6666 Len=50"
"7","11:29:46.965417","64.65.63.120","192.168.0.74","TLSv1.2","602","Application Data"
"8","11:29:46.965521","192.168.0.74","64.65.63.120","TCP","66","59487  >  443 [ACK] Seq=1 Ack=537 Win=9190 Len=0 TSval=3162595466 TSecr=2679887995"
"9","11:29:47.242691","192.168.0.74","5.28.195.2","TCP","78","61815  >  80 [SYN, ECE, CWR] Seq=0 Win=65535 Len=0 MSS=1460 WS=16 TSval=1140750752 TSecr=0 SACK_PERM"
"10","11:29:47.242881","192.168.0.74","5.28.195.2","TCP","78","61814  >  443 [SYN, ECE, CWR] Seq=0 Win=65535 Len=0 MSS=1460 WS=16 TSval=288083680 TSecr=0 SACK_PERM"
"11","11:29:47.243774","192.168.0.74","5.28.195.2","TCP","78","61816  >  5222 [SYN, ECE, CWR] Seq=0 Win=65535 Len=0 MSS=1460 WS=16 TSval=3499359921 TSecr=0 SACK_PERM"
"12","11:29:47.291713","5.28.195.2","192.168.0.74","TCP","74","443  >  61814 [SYN, ACK, ECE] Seq=0 Ack=1 Win=65535 Len=0 MSS=1240 SACK_PERM TSval=3345590655 TSecr=288083680 WS=1024"
"13","11:29:47.291876","192.168.0.74","5.28.195.2","TCP","66","61814  >  443 [ACK] Seq=1 Ack=1 Win=1048560 Len=0 TSval=288083730 TSecr=3345590655"
"14","11:29:47.292138","192.168.0.74","5.28.195.2","TLSv1","583","Client Hello"
"15","11:29:47.332025","5.28.195.2","192.168.0.74","TCP","66","443  >  61814 [ACK] Seq=1 Ack=518 Win=67584 Len=0 TSval=3345590703 TSecr=288083730"
"16","11:29:47.332027","5.28.195.2","192.168.0.74","TCP","66","443  >  61814 [FIN, ACK] Seq=1 Ack=518 Win=67584 Len=0 TSval=3345590704 TSecr=288083730"
"17","11:29:47.332142","192.168.0.74","5.28.195.2","TCP","66","61814  >  443 [ACK] Seq=518 Ack=2 Win=1048560 Len=0 TSval=288083770 TSecr=3345590704"
"18","11:29:47.332276","192.168.0.74","5.28.195.2","TCP","66","61814  >  443 [FIN, ACK] Seq=518 Ack=2 Win=1048560 Len=0 TSval=288083770 TSecr=3345590704"
"19","11:29:47.373107","5.28.195.2","192.168.0.74","TCP","56","443  >  61814 [RST] Seq=2 Win=0 Len=0"
"20","11:29:47.524811","fe80::ae22:5ff:feaa:607e","fe80::49c:fb07:3c9a:aa62","ICMPv6","86","Neighbor Solicitation for fe80::49c:fb07:3c9a:aa62 from ac:22:05:aa:60:7e"
"21","11:29:47.524906","fe80::49c:fb07:3c9a:aa62","fe80::ae22:5ff:feaa:607e","ICMPv6","78","Neighbor Advertisement fe80::49c:fb07:3c9a:aa62 (sol)"
"22","11:29:47.576717","192.168.0.192","230.0.0.1","UDP","92","58107  >  6666 Len=50"
"23","11:29:47.671077","192.168.0.74","64.65.63.120","TLSv1.2","602","Application Data"
"24","11:29:47.710845","64.65.63.120","192.168.0.74","TCP","66","443  >  59487 [ACK] Seq=537 Ack=537 Win=1810 Len=0 TSval=2679888900 TSecr=3162596172"
"25","11:29:47.710958","192.168.0.74","64.65.63.120","TLSv1.2","1138","Application Data, Application Data"
"26","11:29:47.750727","64.65.63.120","192.168.0.74","TCP","66","443  >  59487 [ACK] Seq=537 Ack=1609 Win=1836 Len=0 TSval=2679888938 TSecr=3162596212"
"27","11:29:47.775892","64.65.63.120","192.168.0.74","TCP","1474","443  >  59487 [ACK] Seq=537 Ack=1609 Win=1836 Len=1408 TSval=2679888963 TSecr=3162596212 [TCP PDU reassembled in 28]"
"28","11:29:47.775895","64.65.63.120","192.168.0.74","TLSv1.2","222","Application Data"
"29","11:29:47.775995","192.168.0.74","64.65.63.120","TCP","66","59487  >  443 [ACK] Seq=1609 Ack=1945 Win=9176 Len=0 TSval=3162596277 TSecr=2679888963"
"30","11:29:47.776030","192.168.0.74","64.65.63.120","TCP","66","59487  >  443 [ACK] Seq=1609 Ack=2101 Win=9174 Len=0 TSval=3162596277 TSecr=2679888963"
"31","11:29:47.781531","192.168.0.192","230.0.0.1","UDP","92","62979  >  6666 Len=50"
"32","11:29:47.795687","192.168.0.74","192.87.28.82","TLSv1.2","602","Application Data"
"33","11:29:47.812624","192.168.0.74","64.65.63.120","TLSv1.2","602","Application Data"
"34","11:29:47.813449","64.65.63.120","192.168.0.74","TLSv1.2","602","Application Data"
"35","11:29:47.813531","192.168.0.74","64.65.63.120","TCP","66","59487  >  443 [ACK] Seq=2145 Ack=2637 Win=9190 Len=0 TSval=3162596314 TSecr=2679889005"
"36","11:29:47.813880","192.168.0.74","192.87.28.82","TLSv1.2","1474","Application Data, Application Data"
"37","11:29:47.813891","192.168.0.74","192.87.28.82","TLSv1.2","266","Application Data"
"38","11:29:47.851744","192.87.28.82","192.168.0.74","TCP","66","9001  >  59488 [ACK] Seq=1 Ack=1945 Win=2325 Len=0 TSval=2691938321 TSecr=3831465252"
"39","11:29:47.890609","192.87.28.82","192.168.0.74","TCP","66","9001  >  59488 [ACK] Seq=1 Ack=2145 Win=2347 Len=0 TSval=2691938361 TSecr=3831465270"
"40","11:29:47.902330","64.65.63.120","192.168.0.74","TCP","66","443  >  59487 [ACK] Seq=2637 Ack=2145 Win=1852 Len=0 TSval=2679889095 TSecr=3162596314"
"41","11:29:47.914690","CompalBroadb_aa:60:7e","ee:99:94:f5:59:fd","ARP","56","Who has 192.168.0.74? Tell 192.168.0.1"
"42","11:29:47.914746","ee:99:94:f5:59:fd","CompalBroadb_aa:60:7e","ARP","42","192.168.0.74 is at ee:99:94:f5:59:fd"
"43","11:29:47.929266","192.87.28.82","192.168.0.74","TLSv1.2","602","Application Data"
"44","11:29:47.929373","192.168.0.74","192.87.28.82","TCP","66","59488  >  9001 [ACK] Seq=2145 Ack=537 Win=5736 Len=0 TSval=3831465385 TSecr=2691938398"
"45","11:29:47.931427","192.168.0.74","192.87.28.82","TLSv1.2","602","Application Data"
"46","11:29:47.940660","64.65.63.120","192.168.0.74","TLSv1.2","1116","Application Data"
"47","11:29:47.940761","192.168.0.74","64.65.63.120","TCP","66","59487  >  443 [ACK] Seq=2145 Ack=3687 Win=9182 Len=0 TSval=3162596442 TSecr=2679889133"
"48","11:29:47.966294","192.87.28.82","192.168.0.74","TLSv1.2","602","Application Data"
"49","11:29:47.966395","192.168.0.74","192.87.28.82","TCP","66","59488  >  9001 [ACK] Seq=2681 Ack=1073 Win=5736 Len=0 TSval=3831465422 TSecr=2691938434"
"50","11:29:47.967189","192.168.0.74","64.65.63.120","TLSv1.2","602","Application Data"
"51","11:29:47.975123","192.168.0.74","192.87.28.82","TCP","1474","59488  >  9001 [ACK] Seq=2681 Ack=1073 Win=5744 Len=1408 TSval=3831465431 TSecr=2691938434 [TCP PDU reassembled in 52]"
"52","11:29:47.975155","192.168.0.74","192.87.28.82","TLSv1.2","222","Application Data"
"53","11:29:48.001630","64.65.63.120","192.168.0.74","TCP","66","443  >  59487 [ACK] Seq=3687 Ack=2681 Win=1852 Len=0 TSval=2679889193 TSecr=3162596468"
"54","11:29:48.003150","192.87.28.82","192.168.0.74","TCP","66","9001  >  59488 [ACK] Seq=1073 Ack=2681 Win=2347 Len=0 TSval=2691938475 TSecr=3831465387"
"55","11:29:48.005944","192.168.0.74","64.65.63.120","TLSv1.2","602","Application Data"
"56","11:29:48.007512","192.87.28.82","192.168.0.74","TCP","66","9001  >  59488 [ACK] Seq=1073 Ack=4245 Win=2323 Len=0 TSval=2691938479 TSecr=3831465431"
"57","11:29:48.030166","64.65.63.120","192.168.0.74","TLSv1.2","602","Application Data"
"58","11:29:48.030271","192.168.0.74","64.65.63.120","TLSv1.2","602","Application Data"
"59","11:29:48.060921","192.87.28.82","192.168.0.74","TCP","1474","9001  >  59488 [ACK] Seq=1073 Ack=4245 Win=2347 Len=1408 TSval=2691938531 TSecr=3831465431 [TCP PDU reassembled in 60]"
"60","11:29:48.060923","192.87.28.82","192.168.0.74","TLSv1.2","222","Application Data"
"61","11:29:48.061052","192.168.0.74","192.87.28.82","TCP","66","59488  >  9001 [ACK] Seq=4245 Ack=2637 Win=5720 Len=0 TSval=3831465517 TSecr=2691938531"
"62","11:29:48.062112","192.168.0.74","192.87.28.82","TLSv1.2","602","Application Data"
"63","11:29:48.063555","64.65.63.120","192.168.0.74","TCP","66","443  >  59487 [ACK] Seq=4223 Ack=3753 Win=1852 Len=0 TSval=2679889256 TSecr=3162596507"
"64","11:29:48.063654","192.168.0.74","64.65.63.120","TLSv1.2","602","Application Data"
"65","11:29:48.108421","64.65.63.120","192.168.0.74","TLSv1.2","602","Application Data"
"66","11:29:48.108534","192.168.0.74","64.65.63.120","TCP","66","59487  >  443 [ACK] Seq=4289 Ack=4759 Win=9190 Len=0 TSval=3162596609 TSecr=2679889300"
"67","11:29:48.116171","192.87.28.82","192.168.0.74","TCP","1474","9001  >  59488 [ACK] Seq=2637 Ack=4781 Win=2347 Len=1408 TSval=2691938587 TSecr=3831465518 [TCP PDU reassembled in 68]"
"68","11:29:48.116174","192.87.28.82","192.168.0.74","TLSv1.2","222","Application Data"
"69","11:29:48.116308","192.168.0.74","192.87.28.82","TCP","66","59488  >  9001 [ACK] Seq=4781 Ack=4201 Win=5720 Len=0 TSval=3831465572 TSecr=2691938587"
"70","11:29:48.132641","192.168.0.74","64.65.63.120","TLSv1.2","602","Application Data"
"71","11:29:48.132711","192.168.0.74","192.87.28.82","TLSv1.2","602","Application Data"
"72","11:29:48.142659","64.65.63.120","192.168.0.74","TLSv1.2","602","Application Data"
"73","11:29:48.142782","192.168.0.74","64.65.63.120","TCP","66","59487  >  443 [ACK] Seq=4825 Ack=5295 Win=9190 Len=0 TSval=3162596644 TSecr=2679889334"
"74","11:29:48.146081","192.168.0.74","192.87.28.82","TLSv1.2","1474","Application Data"
"75","11:29:48.146113","192.168.0.74","192.87.28.82","TLSv1.2","244","Application Data"
"76","11:29:48.148264","192.168.0.74","64.65.63.120","TCP","1474","59487  >  443 [ACK] Seq=4825 Ack=5295 Win=9198 Len=1408 TSval=3162596649 TSecr=2679889334 [TCP PDU reassembled in 77]"
"77","11:29:48.148293","192.168.0.74","64.65.63.120","TLSv1.2","736","Application Data"
"78","11:29:48.178939","192.87.28.82","192.168.0.74","TCP","66","9001  >  59488 [ACK] Seq=4201 Ack=6725 Win=2325 Len=0 TSval=2691938650 TSecr=3831465589"
"79","11:29:48.178941","64.65.63.120","192.168.0.74","TLSv1.2","602","Application Data"
"80","11:29:48.179072","192.168.0.74","64.65.63.120","TCP","66","59487  >  443 [ACK] Seq=6903 Ack=5831 Win=9190 Len=0 TSval=3162596680 TSecr=2679889372"
"81","11:29:48.184650","64.65.63.120","192.168.0.74","TCP","66","443  >  59487 [ACK] Seq=5831 Ack=6903 Win=1885 Len=0 TSval=2679889377 TSecr=3162596649"
"82","11:29:48.184685","192.168.0.74","64.65.63.120","TLSv1.2","1116","Application Data"
"83","11:29:48.186494","192.87.28.82","192.168.0.74","TLSv1.2","602","Application Data"
"84","11:29:48.186524","192.168.0.74","192.87.28.82","TCP","66","59488  >  9001 [ACK] Seq=6903 Ack=4737 Win=5736 Len=0 TSval=3831465642 TSecr=2691938658"
"85","11:29:48.194230","192.168.0.74","192.87.28.82","TLSv1.2","602","Application Data"
"86","11:29:48.215543","192.87.28.82","192.168.0.74","TCP","1474","9001  >  59488 [ACK] Seq=4737 Ack=6903 Win=2347 Len=1408 TSval=2691938685 TSecr=3831465602 [TCP PDU reassembled in 88]"
"87","11:29:48.215547","192.87.28.82","192.168.0.74","TCP","1474","9001  >  59488 [ACK] Seq=6145 Ack=6903 Win=2347 Len=1408 TSval=2691938685 TSecr=3831465602 [TCP PDU reassembled in 88]"
"88","11:29:48.215550","192.87.28.82","192.168.0.74","TLSv1.2","1320","Application Data"
"89","11:29:48.215552","192.87.28.82","192.168.0.74","TCP","1474","9001  >  59488 [ACK] Seq=8807 Ack=6903 Win=2347 Len=1408 TSval=2691938685 TSecr=3831465602 [TCP PDU reassembled in 91]"
"90","11:29:48.215554","192.87.28.82","192.168.0.74","TCP","1474","9001  >  59488 [ACK] Seq=10215 Ack=6903 Win=2347 Len=1408 TSval=2691938685 TSecr=3831465602 [TCP PDU reassembled in 91]"
"91","11:29:48.215556","192.87.28.82","192.168.0.74","TLSv1.2","1320","Application Data"
"92","11:29:48.215559","192.87.28.82","192.168.0.74","TCP","1474","9001  >  59488 [ACK] Seq=12877 Ack=6903 Win=2347 Len=1408 TSval=2691938685 TSecr=3831465602 [TCP PDU reassembled in 94]"
"93","11:29:48.215561","192.87.28.82","192.168.0.74","TCP","1474","9001  >  59488 [ACK] Seq=14285 Ack=6903 Win=2347 Len=1408 TSval=2691938685 TSecr=3831465602 [TCP PDU reassembled in 94]"
"94","11:29:48.215563","192.87.28.82","192.168.0.74","TLSv1.2","998","Application Data"
"95","11:29:48.215733","192.168.0.74","192.87.28.82","TLSv1.2","602","Application Data"
"96","11:29:48.216001","192.168.0.74","192.87.28.82","TCP","66","[TCP Window Update] 59488  >  9001 [ACK] Seq=7975 Ack=16625 Win=5744 Len=0 TSval=3831465672 TSecr=2691938685"
"97","11:29:48.217237","192.87.28.82","192.168.0.74","TCP","1474","9001  >  59488 [ACK] Seq=16625 Ack=6903 Win=2347 Len=1408 TSval=2691938688 TSecr=3831465602 [TCP PDU reassembled in 99]"
"98","11:29:48.217239","192.87.28.82","192.168.0.74","TCP","1474","9001  >  59488 [ACK] Seq=18033 Ack=6903 Win=2347 Len=1408 TSval=2691938688 TSecr=3831465602 [TCP PDU reassembled in 99]"
"99","11:29:48.217240","192.87.28.82","192.168.0.74","TLSv1.2","1320","Application Data"
"100","11:29:48.217275","192.168.0.74","192.87.28.82","TLSv1.2","602","Application Data"
"101","11:29:48.217411","192.168.0.74","192.87.28.82","TCP","66","[TCP Window Update] 59488  >  9001 [ACK] Seq=8511 Ack=20695 Win=5744 Len=0 TSval=3831465673 TSecr=2691938688"
"102","11:29:48.222598","192.87.28.82","192.168.0.74","TLSv1.2","1474","Application Data"
"103","11:29:48.222711","192.168.0.74","192.87.28.82","TCP","66","59488  >  9001 [ACK] Seq=8511 Ack=22103 Win=5722 Len=0 TSval=3831465679 TSecr=2691938694"
"104","11:29:48.234915","64.65.63.120","192.168.0.74","TCP","1474","443  >  59487 [ACK] Seq=5831 Ack=7953 Win=1899 Len=1408 TSval=2679889427 TSecr=3162596686 [TCP PDU reassembled in 106]"
"105","11:29:48.234917","64.65.63.120","192.168.0.74","TCP","1474","443  >  59487 [PSH, ACK] Seq=7239 Ack=7953 Win=1899 Len=1408 TSval=2679889427 TSecr=3162596686 [TCP PDU reassembled in 106]"
"106","11:29:48.234919","64.65.63.120","192.168.0.74","TLSv1.2","870","Application Data"
"107","11:29:48.235043","192.168.0.74","64.65.63.120","TCP","66","59487  >  443 [ACK] Seq=7953 Ack=9451 Win=9142 Len=0 TSval=3162596736 TSecr=2679889427"
"108","11:29:48.235251","192.168.0.74","64.65.63.120","TCP","66","[TCP Window Update] 59487  >  443 [ACK] Seq=7953 Ack=9451 Win=9198 Len=0 TSval=3162596736 TSecr=2679889427"
"109","11:29:48.235412","192.168.0.74","64.65.63.120","TLSv1.2","602","Application Data"
"110","11:29:48.237396","192.168.0.74","192.87.28.82","TCP","1474","59488  >  9001 [ACK] Seq=8511 Ack=22103 Win=5744 Len=1408 TSval=3831465693 TSecr=2691938694 [TCP PDU reassembled in 111]"
"111","11:29:48.237412","192.168.0.74","192.87.28.82","TLSv1.2","736","Application Data"
"112","11:29:48.238841","192.168.0.74","64.65.63.120","TCP","1474","59487  >  443 [ACK] Seq=8489 Ack=9451 Win=9198 Len=1408 TSval=3162596740 TSecr=2679889427 [TCP PDU reassembled in 114]"
"113","11:29:48.238845","192.168.0.74","64.65.63.120","TCP","1474","59487  >  443 [ACK] Seq=9897 Ack=9451 Win=9198 Len=1408 TSval=3162596740 TSecr=2679889427 [TCP PDU reassembled in 114]"
"114","11:29:48.238862","192.168.0.74","64.65.63.120","TLSv1.2","356","Application Data"
"115","11:29:48.238893","192.168.0.74","192.87.28.82","TCP","1474","59488  >  9001 [ACK] Seq=10589 Ack=22103 Win=5744 Len=1408 TSval=3831465695 TSecr=2691938694 [TCP PDU reassembled in 117]"
"116","11:29:48.238894","192.168.0.74","192.87.28.82","TCP","1474","59488  >  9001 [ACK] Seq=11997 Ack=22103 Win=5744 Len=1408 TSval=3831465695 TSecr=2691938694 [TCP PDU reassembled in 117]"
"117","11:29:48.238900","192.168.0.74","192.87.28.82","TLSv1.2","1320","Application Data"
"118","11:29:48.238971","192.168.0.74","192.87.28.82","TCP","1474","59488  >  9001 [ACK] Seq=14659 Ack=22103 Win=5744 Len=1408 TSval=3831465695 TSecr=2691938694 [TCP PDU reassembled in 120]"
"119","11:29:48.238972","192.168.0.74","192.87.28.82","TCP","1474","59488  >  9001 [ACK] Seq=16067 Ack=22103 Win=5744 Len=1408 TSval=3831465695 TSecr=2691938694 [TCP PDU reassembled in 120]"
"120","11:29:48.238978","192.168.0.74","192.87.28.82","TLSv1.2","1320","Application Data"
"121","11:29:48.238997","192.168.0.74","192.87.28.82","TCP","1474","59488  >  9001 [ACK] Seq=18729 Ack=22103 Win=5744 Len=1408 TSval=3831465695 TSecr=2691938694 [TCP PDU reassembled in 123]"
"122","11:29:48.238998","192.168.0.74","192.87.28.82","TCP","1474","59488  >  9001 [ACK] Seq=20137 Ack=22103 Win=5744 Len=1408 TSval=3831465695 TSecr=2691938694 [TCP PDU reassembled in 123]"
"123","11:29:48.239002","192.168.0.74","192.87.28.82","TLSv1.2","998","Application Data"
"124","11:29:48.241072","192.87.28.82","192.168.0.74","TLSv1.2","1474","Application Data"
"125","11:29:48.241138","192.168.0.74","192.87.28.82","TCP","66","59488  >  9001 [ACK] Seq=22477 Ack=23511 Win=5722 Len=0 TSval=3831465697 TSecr=2691938713"
"126","11:29:48.243137","192.168.0.74","5.28.195.2","TCP","78","[TCP Retransmission] 61816  >  5222 [SYN] Seq=0 Win=65535 Len=0 MSS=1460 WS=16 TSval=3499360921 TSecr=0 SACK_PERM"
"127","11:29:48.243169","192.168.0.74","5.28.195.2","TCP","78","[TCP Retransmission] 61815  >  80 [SYN] Seq=0 Win=65535 Len=0 MSS=1460 WS=16 TSval=1140751753 TSecr=0 SACK_PERM"
"128","11:29:48.251921","192.168.0.74","192.87.28.82","TLSv1.2","1474","Application Data"
"129","11:29:48.251949","192.168.0.74","192.87.28.82","TLSv1.2","1272","Application Data"
"130","11:29:48.254204","192.87.28.82","192.168.0.74","TLSv1.2","464","Application Data"
"131","11:29:48.254206","192.87.28.82","192.168.0.74","TCP","1474","9001  >  59488 [ACK] Seq=23909 Ack=8511 Win=2347 Len=1408 TSval=2691938725 TSecr=3831465679 [TCP PDU reassembled in 147]"
"132","11:29:48.254207","192.87.28.82","192.168.0.74","TCP","1474","9001  >  59488 [ACK] Seq=25317 Ack=8511 Win=2347 Len=1408 TSval=2691938725 TSecr=3831465679 [TCP PDU reassembled in 147]"
"133","11:29:48.254280","192.168.0.74","192.87.28.82","TCP","66","59488  >  9001 [ACK] Seq=25091 Ack=23909 Win=5738 Len=0 TSval=3831465710 TSecr=2691938724"
"134","11:29:48.254305","192.168.0.74","192.87.28.82","TCP","66","59488  >  9001 [ACK] Seq=25091 Ack=26725 Win=5694 Len=0 TSval=3831465710 TSecr=2691938725"
"135","11:29:48.254490","192.168.0.74","64.65.63.120","TLSv1.2","1474","Application Data"
"136","11:29:48.254492","192.168.0.74","64.65.63.120","TCP","1474","59487  >  443 [ACK] Seq=13003 Ack=9451 Win=9198 Len=1408 TSval=3162596755 TSecr=2679889427 [TCP PDU reassembled in 138]"
"137","11:29:48.254497","192.168.0.74","64.65.63.120","TCP","1474","59487  >  443 [ACK] Seq=14411 Ack=9451 Win=9198 Len=1408 TSval=3162596755 TSecr=2679889427 [TCP PDU reassembled in 138]"
"138","11:29:48.254506","192.168.0.74","64.65.63.120","TLSv1.2","962","Application Data"
"139","11:29:48.254533","192.168.0.74","64.65.63.120","TCP","1474","59487  >  443 [ACK] Seq=16715 Ack=9451 Win=9198 Len=1408 TSval=3162596755 TSecr=2679889427 [TCP PDU reassembled in 140]"
"140","11:29:48.254536","192.168.0.74","64.65.63.120","TLSv1.2","800","Application Data"
"141","11:29:48.254571","192.168.0.74","192.87.28.82","TCP","1474","59488  >  9001 [ACK] Seq=25091 Ack=26725 Win=5694 Len=1408 TSval=3831465710 TSecr=2691938725 [TCP PDU reassembled in 143]"
"142","11:29:48.254572","192.168.0.74","192.87.28.82","TCP","1474","59488  >  9001 [ACK] Seq=26499 Ack=26725 Win=5694 Len=1408 TSval=3831465710 TSecr=2691938725 [TCP PDU reassembled in 143]"
"143","11:29:48.254575","192.168.0.74","192.87.28.82","TLSv1.2","1320","Application Data"
"144","11:29:48.254590","192.168.0.74","192.87.28.82","TCP","1474","59488  >  9001 [ACK] Seq=29161 Ack=26725 Win=5694 Len=1408 TSval=3831465711 TSecr=2691938725 [TCP PDU reassembled in 145]"
"145","11:29:48.254593","192.168.0.74","192.87.28.82","TLSv1.2","1314","Application Data"
"146","11:29:48.254730","192.168.0.74","192.87.28.82","TCP","66","[TCP Window Update] 59488  >  9001 [ACK] Seq=31817 Ack=26725 Win=5744 Len=0 TSval=3831465711 TSecr=2691938725"
"147","11:29:48.255870","192.87.28.82","192.168.0.74","TLSv1.2","1320","Application Data"
"148","11:29:48.255871","192.87.28.82","192.168.0.74","TCP","1474","9001  >  59488 [ACK] Seq=27979 Ack=8511 Win=2347 Len=1408 TSval=2691938725 TSecr=3831465679 [TCP PDU reassembled in 150]"
"149","11:29:48.255872","192.87.28.82","192.168.0.74","TCP","1474","9001  >  59488 [ACK] Seq=29387 Ack=8511 Win=2347 Len=1408 TSval=2691938725 TSecr=3831465679 [TCP PDU reassembled in 150]"
"150","11:29:48.255874","192.87.28.82","192.168.0.74","TLSv1.2","1320","Application Data"
"151","11:29:48.255875","192.87.28.82","192.168.0.74","TCP","1474","9001  >  59488 [ACK] Seq=32049 Ack=8511 Win=2347 Len=1408 TSval=2691938725 TSecr=3831465679 [TCP PDU reassembled in 153]"
"152","11:29:48.255876","192.87.28.82","192.168.0.74","TCP","1474","9001  >  59488 [ACK] Seq=33457 Ack=8511 Win=2347 Len=1408 TSval=2691938725 TSecr=3831465679 [TCP PDU reassembled in 153]"
"153","11:29:48.255877","192.87.28.82","192.168.0.74","TLSv1.2","1320","Application Data"
"154","11:29:48.255878","192.87.28.82","192.168.0.74","TCP","1474","9001  >  59488 [ACK] Seq=36119 Ack=8511 Win=2347 Len=1408 TSval=2691938725 TSecr=3831465679 [TCP PDU reassembled in 156]"
"155","11:29:48.255879","192.87.28.82","192.168.0.74","TCP","1474","9001  >  59488 [ACK] Seq=37527 Ack=8511 Win=2347 Len=1408 TSval=2691938725 TSecr=3831465679 [TCP PDU reassembled in 156]"
"156","11:29:48.255880","192.87.28.82","192.168.0.74","TLSv1.2","1320","Application Data"
"157","11:29:48.255882","64.65.63.120","192.168.0.74","TCP","1474","443  >  59487 [ACK] Seq=9451 Ack=7953 Win=1899 Len=1408 TSval=2679889447 TSecr=3162596686 [TCP PDU reassembled in 167]"
"158","11:29:48.255883","192.87.28.82","192.168.0.74","TLSv1.2","1474","Application Data"
"159","11:29:48.255884","192.87.28.82","192.168.0.74","TCP","1474","9001  >  59488 [ACK] Seq=41597 Ack=8511 Win=2347 Len=1408 TSval=2691938726 TSecr=3831465679 [TCP PDU reassembled in 160]"
"160","11:29:48.255885","192.87.28.82","192.168.0.74","TLSv1.2","1342","Application Data"
"161","11:29:48.255886","192.87.28.82","192.168.0.74","TCP","1474","9001  >  59488 [ACK] Seq=44281 Ack=8511 Win=2347 Len=1408 TSval=2691938726 TSecr=3831465679 [TCP PDU reassembled in 176]"
"162","11:29:48.255887","192.87.28.82","192.168.0.74","TCP","1474","9001  >  59488 [ACK] Seq=45689 Ack=8511 Win=2347 Len=1408 TSval=2691938726 TSecr=3831465679 [TCP PDU reassembled in 176]"
"163","11:29:48.255930","192.168.0.74","192.87.28.82","TCP","66","59488  >  9001 [ACK] Seq=31817 Ack=43005 Win=5490 Len=0 TSval=3831465712 TSecr=2691938726"
"164","11:29:48.255950","192.168.0.74","192.87.28.82","TCP","66","59488  >  9001 [ACK] Seq=31817 Ack=47097 Win=5427 Len=0 TSval=3831465712 TSecr=2691938726"
"165","11:29:48.255964","192.168.0.74","64.65.63.120","TCP","66","59487  >  443 [ACK] Seq=18857 Ack=10859 Win=9176 Len=0 TSval=3162596757 TSecr=2679889447"
"166","11:29:48.256170","192.168.0.74","192.87.28.82","TLSv1.2","602","Application Data"
"167","11:29:48.271549","64.65.63.120","192.168.0.74","TLSv1.2","1272","Application Data, Application Data"
"168","11:29:48.271645","192.168.0.74","64.65.63.120","TLSv1.2","602","Application Data"
"169","11:29:48.273130","192.87.28.82","192.168.0.74","TCP","976","9001  >  59488 [ACK] Seq=47097 Ack=10589 Win=2315 Len=910 TSval=2691938744 TSecr=3831465693 [TCP PDU reassembled in 176]"
"170","11:29:48.273132","192.87.28.82","192.168.0.74","TCP","66","9001  >  59488 [ACK] Seq=48007 Ack=13405 Win=2325 Len=0 TSval=2691938745 TSecr=3831465695"
"171","11:29:48.273134","192.87.28.82","192.168.0.74","TCP","66","9001  >  59488 [ACK] Seq=48007 Ack=16067 Win=2325 Len=0 TSval=2691938745 TSecr=3831465695"
"172","11:29:48.273221","192.168.0.74","192.87.28.82","TCP","66","59488  >  9001 [ACK] Seq=32353 Ack=48007 Win=5730 Len=0 TSval=3831465729 TSecr=2691938744"
"173","11:29:48.274891","64.65.63.120","192.168.0.74","TCP","66","443  >  59487 [ACK] Seq=12065 Ack=9897 Win=1899 Len=0 TSval=2679889468 TSecr=3162596736"
"174","11:29:48.274893","192.87.28.82","192.168.0.74","TCP","66","9001  >  59488 [ACK] Seq=48007 Ack=18729 Win=2305 Len=0 TSval=2691938747 TSecr=3831465695"
"175","11:29:48.274894","192.87.28.82","192.168.0.74","TCP","66","9001  >  59488 [ACK] Seq=48007 Ack=21545 Win=2325 Len=0 TSval=2691938748 TSecr=3831465695"
"176","11:29:48.276959","192.87.28.82","192.168.0.74","TLSv1.2","1474","Application Data"
"177","11:29:48.276962","192.87.28.82","192.168.0.74","TCP","1474","9001  >  59488 [ACK] Seq=49415 Ack=22477 Win=2311 Len=1408 TSval=2691938748 TSecr=3831465695 [TCP PDU reassembled in 185]"
"178","11:29:48.277070","192.168.0.74","192.87.28.82","TCP","66","59488  >  9001 [ACK] Seq=32353 Ack=50823 Win=5700 Len=0 TSval=3831465733 TSecr=2691938748"
"179","11:29:48.277448","192.168.0.74","192.87.28.82","TCP","66","[TCP Window Update] 59488  >  9001 [ACK] Seq=32353 Ack=50823 Win=5744 Len=0 TSval=3831465733 TSecr=2691938748"
"180","11:29:48.278513","64.65.63.120","192.168.0.74","TCP","66","443  >  59487 [ACK] Seq=12065 Ack=11595 Win=1899 Len=0 TSval=2679889471 TSecr=3162596740"
"181","11:29:48.293464","192.168.0.74","64.65.63.120","TLSv1.2","1474","Application Data"
"182","11:29:48.293499","192.168.0.74","64.65.63.120","TLSv1.2","758","Application Data"
"183","11:29:48.294661","192.87.28.82","192.168.0.74","TCP","66","9001  >  59488 [ACK] Seq=50823 Ack=25091 Win=2306 Len=0 TSval=2691938765 TSecr=3831465708"
"184","11:29:48.294663","192.87.28.82","192.168.0.74","TCP","1474","9001  >  59488 [ACK] Seq=50823 Ack=25091 Win=2306 Len=1408 TSval=2691938765 TSecr=3831465708 [TCP PDU reassembled in 185]"
"185","11:29:48.294664","192.87.28.82","192.168.0.74","TLSv1.2","1474","Application Data"
"186","11:29:48.294666","192.87.28.82","192.168.0.74","TCP","1474","9001  >  59488 [ACK] Seq=53639 Ack=25091 Win=2306 Len=1408 TSval=2691938765 TSecr=3831465708 [TCP PDU reassembled in 188]"
"187","11:29:48.294667","192.87.28.82","192.168.0.74","TCP","1474","9001  >  59488 [ACK] Seq=55047 Ack=25091 Win=2306 Len=1408 TSval=2691938765 TSecr=3831465708 [TCP PDU reassembled in 188]"
"188","11:29:48.294668","192.87.28.82","192.168.0.74","TLSv1.2","488","Application Data"
"189","11:29:48.294669","192.87.28.82","192.168.0.74","TCP","66","9001  >  59488 [ACK] Seq=56877 Ack=30569 Win=2305 Len=0 TSval=2691938767 TSecr=3831465710"
"190","11:29:48.294670","192.87.28.82","192.168.0.74","TLSv1.2","1474","Application Data, Application Data"
"191","11:29:48.294672","192.87.28.82","192.168.0.74","TLSv1.2","1474","Application Data"
"192","11:29:48.294794","192.168.0.74","192.87.28.82","TCP","66","59488  >  9001 [ACK] Seq=32353 Ack=56455 Win=5656 Len=0 TSval=3831465751 TSecr=2691938765"
"193","11:29:48.295059","192.168.0.74","192.87.28.82","TCP","66","59488  >  9001 [ACK] Seq=32353 Ack=59693 Win=5744 Len=0 TSval=3831465751 TSecr=2691938766"
"194","11:29:48.296740","192.87.28.82","192.168.0.74","TCP","1474","9001  >  59488 [ACK] Seq=59693 Ack=31817 Win=2286 Len=1408 TSval=2691938767 TSecr=3831465711 [TCP PDU reassembled in 195]"
"195","11:29:48.296742","192.87.28.82","192.168.0.74","TLSv1.2","1196","Application Data"
"196","11:29:48.296744","64.65.63.120","192.168.0.74","TCP","66","443  >  59487 [ACK] Seq=12065 Ack=16715 Win=1876 Len=0 TSval=2679889489 TSecr=3162596755"
"197","11:29:48.296744","64.65.63.120","192.168.0.74","TCP","66","443  >  59487 [ACK] Seq=12065 Ack=18857 Win=1891 Len=0 TSval=2679889489 TSecr=3162596755"
"198","11:29:48.296966","192.168.0.74","192.87.28.82","TLSv1.2","602","Application Data"
"199","11:29:48.298396","192.87.28.82","192.168.0.74","TCP","1474","9001  >  59488 [ACK] Seq=62231 Ack=32353 Win=2347 Len=1408 TSval=2691938770 TSecr=3831465712 [TCP PDU reassembled in 200]"
"200","11:29:48.298398","192.87.28.82","192.168.0.74","TLSv1.2","222","Application Data"
"201","11:29:48.298508","192.168.0.74","192.87.28.82","TCP","66","59488  >  9001 [ACK] Seq=32889 Ack=63795 Win=5720 Len=0 TSval=3831465754 TSecr=2691938770"
"202","11:29:48.307133","64.65.63.120","192.168.0.74","TLSv1.2","602","Application Data"
"203","11:29:48.307251","192.168.0.74","64.65.63.120","TCP","66","59487  >  443 [ACK] Seq=21493 Ack=12601 Win=9190 Len=0 TSval=3162596808 TSecr=2679889499"
"204","11:29:48.330318","64.65.63.120","192.168.0.74","TCP","66","443  >  59487 [ACK] Seq=12601 Ack=21493 Win=1891 Len=0 TSval=2679889522 TSecr=3162596794"
"205","11:29:48.330320","192.87.28.82","192.168.0.74","TLSv1.2","602","Application Data"
"206","11:29:48.330437","192.168.0.74","192.87.28.82","TLSv1.2","602","Application Data"
"207","11:29:48.330481","192.168.0.74","64.65.63.120","TLSv1.2","1116","Application Data"
"208","11:29:48.345922","64.65.63.120","192.168.0.74","TLSv1.2","1116","Application Data"
"209","11:29:48.346022","192.168.0.74","64.65.63.120","TCP","66","59487  >  443 [ACK] Seq=22543 Ack=13651 Win=9182 Len=0 TSval=3162596847 TSecr=2679889537"
"210","11:29:48.368318","64.65.63.120","192.168.0.74","TCP","1474","443  >  59487 [ACK] Seq=13651 Ack=22543 Win=1899 Len=1408 TSval=2679889560 TSecr=3162596831 [TCP PDU reassembled in 212]"
"211","11:29:48.368416","192.168.0.74","64.65.63.120","TCP","66","59487  >  443 [ACK] Seq=22543 Ack=15059 Win=9176 Len=0 TSval=3162596869 TSecr=2679889560"
"212","11:29:48.375887","64.65.63.120","192.168.0.74","TLSv1.2","1474","Application Data, Application Data"
"213","11:29:48.375960","192.168.0.74","64.65.63.120","TCP","66","59487  >  443 [ACK] Seq=22543 Ack=16467 Win=9176 Len=0 TSval=3162596877 TSecr=2679889567"
"214","11:29:48.377456","192.168.0.74","64.65.63.120","TCP","1474","59487  >  443 [ACK] Seq=22543 Ack=16467 Win=9198 Len=1408 TSval=3162596878 TSecr=2679889567 [TCP PDU reassembled in 215]"
"215","11:29:48.377479","192.168.0.74","64.65.63.120","TLSv1.2","736","Application Data"
"216","11:29:48.379295","64.65.63.120","192.168.0.74","TLSv1.2","400","Application Data"
"217","11:29:48.379376","192.168.0.74","64.65.63.120","TCP","66","59487  >  443 [ACK] Seq=24621 Ack=16801 Win=9193 Len=0 TSval=3162596880 TSecr=2679889573"
"218","11:29:48.402282","192.87.28.82","192.168.0.74","TCP","66","9001  >  59488 [ACK] Seq=64331 Ack=33425 Win=2347 Len=0 TSval=2691938874 TSecr=3831465786"
"219","11:29:48.412654","192.87.28.82","192.168.0.74","TLSv1.2","1116","Application Data"
"220","11:29:48.412883","192.168.0.74","192.87.28.82","TCP","66","59488  >  9001 [ACK] Seq=33425 Ack=65381 Win=5744 Len=0 TSval=3831465869 TSecr=2691938883"
"221","11:29:48.414760","64.65.63.120","192.168.0.74","TLSv1.2","1474","Application Data"
"222","11:29:48.414761","64.65.63.120","192.168.0.74","TCP","1474","443  >  59487 [PSH, ACK] Seq=18209 Ack=22543 Win=1899 Len=1408 TSval=2679889607 TSecr=3162596877 [TCP PDU reassembled in 224]"
"223","11:29:48.414943","192.168.0.74","64.65.63.120","TCP","66","59487  >  443 [ACK] Seq=24621 Ack=19617 Win=9198 Len=0 TSval=3162596916 TSecr=2679889607"
"224","11:29:48.415599","64.65.63.120","192.168.0.74","TLSv1.2","1406","Application Data"
"225","11:29:48.415661","192.168.0.74","64.65.63.120","TCP","66","59487  >  443 [ACK] Seq=24621 Ack=20957 Win=9178 Len=0 TSval=3162596917 TSecr=2679889608"
"226","11:29:48.427640","64.65.63.120","192.168.0.74","TLSv1.2","1474","Application Data, Application Data"
"227","11:29:48.427731","192.168.0.74","64.65.63.120","TCP","66","59487  >  443 [ACK] Seq=24621 Ack=22365 Win=9176 Len=0 TSval=3162596929 TSecr=2679889619"
"228","11:29:48.428965","192.168.0.74","64.65.63.120","TCP","1474","59487  >  443 [ACK] Seq=24621 Ack=22365 Win=9198 Len=1408 TSval=3162596930 TSecr=2679889619 [TCP PDU reassembled in 229]"
"229","11:29:48.428983","192.168.0.74","64.65.63.120","TLSv1.2","736","Application Data"
"230","11:29:48.446440","64.65.63.120","192.168.0.74","TLSv1.2","1474","Application Data, Application Data"
"231","11:29:48.446443","64.65.63.120","192.168.0.74","TCP","1474","443  >  59487 [PSH, ACK] Seq=23773 Ack=24621 Win=1899 Len=1408 TSval=2679889637 TSecr=3162596878 [TCP PDU reassembled in 233]"
"232","11:29:48.446445","64.65.63.120","192.168.0.74","TCP","1474","443  >  59487 [ACK] Seq=25181 Ack=24621 Win=1899 Len=1408 TSval=2679889637 TSecr=3162596878 [TCP PDU reassembled in 233]"
"233","11:29:48.446446","64.65.63.120","192.168.0.74","TLSv1.2","1474","Application Data"
"234","11:29:48.446697","192.168.0.74","64.65.63.120","TCP","66","59487  >  443 [ACK] Seq=26699 Ack=27997 Win=9198 Len=0 TSval=3162596948 TSecr=2679889637"
"235","11:29:48.450361","192.168.0.74","64.65.63.120","TLSv1.2","1474","Application Data"
"236","11:29:48.450366","192.168.0.74","64.65.63.120","TCP","1474","59487  >  443 [ACK] Seq=28107 Ack=27997 Win=9198 Len=1408 TSval=3162596951 TSecr=2679889637 [TCP PDU reassembled in 237]"
"237","11:29:48.450400","192.168.0.74","64.65.63.120","TLSv1.2","378","Application Data"
"238","11:29:48.451191","192.87.28.82","192.168.0.74","TCP","1474","9001  >  59488 [ACK] Seq=65381 Ack=33425 Win=2347 Len=1408 TSval=2691938923 TSecr=3831465869 [TCP PDU reassembled in 240]"
"239","11:29:48.452482","192.87.28.82","192.168.0.74","TCP","1474","9001  >  59488 [ACK] Seq=66789 Ack=33425 Win=2347 Len=1408 TSval=2691938923 TSecr=3831465869 [TCP PDU reassembled in 240]"
"240","11:29:48.452484","192.87.28.82","192.168.0.74","TLSv1.2","1320","Application Data"
"241","11:29:48.452486","64.65.63.120","192.168.0.74","TLSv1.2","868","Application Data"
"242","11:29:48.452488","192.87.28.82","192.168.0.74","TLSv1.2","1474","Application Data"
"243","11:29:48.452489","192.87.28.82","192.168.0.74","TCP","1474","9001  >  59488 [ACK] Seq=70859 Ack=33425 Win=2347 Len=1408 TSval=2691938923 TSecr=3831465869 [TCP PDU reassembled in 244]"
"244","11:29:48.452491","192.87.28.82","192.168.0.74","TLSv1.2","956","Application Data"
"245","11:29:48.452764","192.168.0.74","192.87.28.82","TCP","66","59488  >  9001 [ACK] Seq=33425 Ack=73157 Win=5744 Len=0 TSval=3831465909 TSecr=2691938923"
"246","11:29:48.452898","192.168.0.74","64.65.63.120","TCP","66","59487  >  443 [ACK] Seq=29827 Ack=28799 Win=9198 Len=0 TSval=3162596954 TSecr=2679889644"
"247","11:29:48.452949","192.168.0.74","192.87.28.82","TLSv1.2","602","Application Data"
"248","11:29:48.454179","192.87.28.82","192.168.0.74","TCP","1474","9001  >  59488 [ACK] Seq=73157 Ack=33425 Win=2347 Len=1408 TSval=2691938926 TSecr=3831465869 [TCP PDU reassembled in 250]"
"249","11:29:48.454180","192.87.28.82","192.168.0.74","TCP","1474","9001  >  59488 [ACK] Seq=74565 Ack=33425 Win=2347 Len=1408 TSval=2691938926 TSecr=3831465869 [TCP PDU reassembled in 250]"
"250","11:29:48.454182","192.87.28.82","192.168.0.74","TLSv1.2","1320","Application Data"
"251","11:29:48.454329","192.168.0.74","192.87.28.82","TCP","66","59488  >  9001 [ACK] Seq=33961 Ack=77227 Win=5744 Len=0 TSval=3831465910 TSecr=2691938926"
"252","11:29:48.465151","192.87.28.82","192.168.0.74","TLSv1.2","1474","Application Data"
"253","11:29:48.465154","192.87.28.82","192.168.0.74","TLSv1.2","822","Application Data"
"254","11:29:48.465413","192.168.0.74","192.87.28.82","TCP","66","59488  >  9001 [ACK] Seq=33961 Ack=79391 Win=5744 Len=0 TSval=3831465921 TSecr=2691938936"
"255","11:29:48.482263","64.65.63.120","192.168.0.74","TCP","66","443  >  59487 [ACK] Seq=28799 Ack=26699 Win=1891 Len=0 TSval=2679889661 TSecr=3162596930"
"256","11:29:48.482265","192.87.28.82","192.168.0.74","TCP","1474","9001  >  59488 [ACK] Seq=79391 Ack=33425 Win=2347 Len=1408 TSval=2691938941 TSecr=3831465869 [TCP PDU reassembled in 258]"
"257","11:29:48.482266","192.87.28.82","192.168.0.74","TCP","1474","9001  >  59488 [ACK] Seq=80799 Ack=33425 Win=2347 Len=1408 TSval=2691938941 TSecr=3831465869 [TCP PDU reassembled in 258]"
"258","11:29:48.482268","192.87.28.82","192.168.0.74","TLSv1.2","870","Application Data"
"259","11:29:48.482269","192.87.28.82","192.168.0.74","TCP","1474","9001  >  59488 [ACK] Seq=83011 Ack=33425 Win=2347 Len=1408 TSval=2691938944 TSecr=3831465869 [TCP PDU reassembled in 261]"
"260","11:29:48.482271","192.87.28.82","192.168.0.74","TCP","1474","9001  >  59488 [ACK] Seq=84419 Ack=33425 Win=2347 Len=1408 TSval=2691938944 TSecr=3831465869 [TCP PDU reassembled in 261]"
"261","11:29:48.482272","192.87.28.82","192.168.0.74","TLSv1.2","1320","Application Data"
"262","11:29:48.482273","192.87.28.82","192.168.0.74","TCP","1474","9001  >  59488 [ACK] Seq=87081 Ack=33425 Win=2347 Len=1408 TSval=2691938944 TSecr=3831465869 [TCP PDU reassembled in 264]"
"263","11:29:48.482274","192.87.28.82","192.168.0.74","TCP","1474","9001  >  59488 [ACK] Seq=88489 Ack=33425 Win=2347 Len=1408 TSval=2691938944 TSecr=3831465869 [TCP PDU reassembled in 264]"
"264","11:29:48.482275","192.87.28.82","192.168.0.74","TLSv1.2","1320","Application Data"
"265","11:29:48.482276","192.87.28.82","192.168.0.74","TLSv1.2","1474","Application Data"
"266","11:29:48.482278","192.87.28.82","192.168.0.74","TCP","1474","9001  >  59488 [ACK] Seq=92559 Ack=33425 Win=2347 Len=1408 TSval=2691938952 TSecr=3831465869 [TCP PDU reassembled in 268]"
"267","11:29:48.482279","192.87.28.82","192.168.0.74","TCP","1474","9001  >  59488 [ACK] Seq=93967 Ack=33425 Win=2347 Len=1408 TSval=2691938952 TSecr=3831465869 [TCP PDU reassembled in 268]"
"268","11:29:48.482280","192.87.28.82","192.168.0.74","TLSv1.2","1090","Application Data"
"269","11:29:48.482281","192.87.28.82","192.168.0.74","TCP","1474","9001  >  59488 [ACK] Seq=96399 Ack=33425 Win=2347 Len=1408 TSval=2691938952 TSecr=3831465869 [TCP PDU reassembled in 271]"
"270","11:29:48.482282","192.87.28.82","192.168.0.74","TCP","1474","9001  >  59488 [ACK] Seq=97807 Ack=33425 Win=2347 Len=1408 TSval=2691938952 TSecr=3831465869 [TCP PDU reassembled in 271]"
"271","11:29:48.482283","192.87.28.82","192.168.0.74","TLSv1.2","420","Application Data"
"272","11:29:48.482781","192.168.0.74","192.87.28.82","TLSv1.2","602","Application Data"
"273","11:29:48.484102","64.65.63.120","192.168.0.74","TCP","1474","443  >  59487 [ACK] Seq=28799 Ack=26699 Win=1899 Len=1408 TSval=2679889677 TSecr=3162596948 [TCP PDU reassembled in 277]"
"274","11:29:48.484104","64.65.63.120","192.168.0.74","TCP","1474","443  >  59487 [PSH, ACK] Seq=30207 Ack=26699 Win=1899 Len=1408 TSval=2679889677 TSecr=3162596948 [TCP PDU reassembled in 277]"
"275","11:29:48.484185","192.168.0.74","64.65.63.120","TCP","66","59487  >  443 [ACK] Seq=29827 Ack=31615 Win=9154 Len=0 TSval=3162596985 TSecr=2679889677"
"276","11:29:48.484286","192.168.0.74","64.65.63.120","TCP","66","[TCP Window Update] 59487  >  443 [ACK] Seq=29827 Ack=31615 Win=9198 Len=0 TSval=3162596985 TSecr=2679889677"
"277","11:29:48.486138","64.65.63.120","192.168.0.74","TLSv1.2","1474","Application Data, Application Data"
"278","11:29:48.486232","192.168.0.74","64.65.63.120","TCP","66","59487  >  443 [ACK] Seq=29827 Ack=33023 Win=9176 Len=0 TSval=3162596987 TSecr=2679889679"
"279","11:29:48.489884","64.65.63.120","192.168.0.74","TLSv1.2","534","Application Data"
"280","11:29:48.489985","192.168.0.74","64.65.63.120","TCP","66","59487  >  443 [ACK] Seq=29827 Ack=33491 Win=9191 Len=0 TSval=3162596991 TSecr=2679889682"
"281","11:29:48.495385","192.87.28.82","192.168.0.74","TCP","1474","9001  >  59488 [ACK] Seq=99569 Ack=33961 Win=2347 Len=1408 TSval=2691938965 TSecr=3831465909 [TCP PDU reassembled in 283]"
"282","11:29:48.495388","192.87.28.82","192.168.0.74","TCP","1474","9001  >  59488 [ACK] Seq=100977 Ack=33961 Win=2347 Len=1408 TSval=2691938965 TSecr=3831465909 [TCP PDU reassembled in 283]"
"283","11:29:48.495390","192.87.28.82","192.168.0.74","TLSv1.2","1320","Application Data"
"284","11:29:48.495391","192.87.28.82","192.168.0.74","TCP","1474","9001  >  59488 [ACK] Seq=103639 Ack=33961 Win=2347 Len=1408 TSval=2691938965 TSecr=3831465909 [TCP PDU reassembled in 286]"
"285","11:29:48.495393","192.87.28.82","192.168.0.74","TCP","1474","9001  >  59488 [ACK] Seq=105047 Ack=33961 Win=2347 Len=1408 TSval=2691938965 TSecr=3831465909 [TCP PDU reassembled in 286]"
"286","11:29:48.495394","192.87.28.82","192.168.0.74","TLSv1.2","1320","Application Data"
"287","11:29:48.495556","192.168.0.74","192.87.28.82","TLSv1.2","602","Application Data"
"288","11:29:48.495814","192.168.0.74","192.87.28.82","TCP","66","[TCP Window Update] 59488  >  9001 [ACK] Seq=35033 Ack=107709 Win=5744 Len=0 TSval=3831465952 TSecr=2691938965"
"289","11:29:48.498845","192.168.0.192","230.0.0.1","UDP","92","58107  >  6666 Len=50"
