"No.","Time","Source","Destination","Protocol","Length","Info"
"1","17:22:54.006278","149.154.167.41","192.168.0.74","SSL","171","Continuation Data"
"2","17:22:54.006412","192.168.0.74","149.154.167.41","TCP","66","51643  >  443 [ACK] Seq=1 Ack=106 Win=65530 Len=0 TSval=2408216766 TSecr=1826440709"
"3","17:22:54.048178","192.168.0.74","5.28.195.2","TCP","78","52714  >  443 [SYN, ECE, CWR] Seq=0 Win=65535 Len=0 MSS=1460 WS=16 TSval=3517483143 TSecr=0 SACK_PERM"
"4","17:22:54.048206","192.168.0.74","5.28.195.2","TCP","78","52715  >  80 [SYN, ECE, CWR] Seq=0 Win=65535 Len=0 MSS=1460 WS=16 TSval=4208792794 TSecr=0 SACK_PERM"
"5","17:22:54.048702","192.168.0.74","5.28.195.2","TCP","78","52716  >  5222 [SYN, ECE, CWR] Seq=0 Win=65535 Len=0 MSS=1460 WS=16 TSval=1257791789 TSecr=0 SACK_PERM"
"6","17:22:54.087136","5.28.195.2","192.168.0.74","TCP","74","443  >  52714 [SYN, ACK, ECE] Seq=0 Ack=1 Win=65535 Len=0 MSS=1240 SACK_PERM TSval=2266437383 TSecr=3517483143 WS=1024"
"7","17:22:54.087256","192.168.0.74","5.28.195.2","TCP","66","52714  >  443 [ACK] Seq=1 Ack=1 Win=1048560 Len=0 TSval=3517483182 TSecr=2266437383"
"8","17:22:54.087404","192.168.0.74","5.28.195.2","TLSv1","583","Client Hello"
"9","17:22:54.128369","5.28.195.2","192.168.0.74","TCP","66","443  >  52714 [ACK] Seq=1 Ack=518 Win=67584 Len=0 TSval=2266437489 TSecr=3517483183"
"10","17:22:54.180484","5.28.195.2","192.168.0.74","TCP","66","443  >  52714 [FIN, ACK] Seq=1 Ack=518 Win=67584 Len=0 TSval=2266437541 TSecr=3517483183"
"11","17:22:54.180593","192.168.0.74","5.28.195.2","TCP","66","52714  >  443 [ACK] Seq=518 Ack=2 Win=1048560 Len=0 TSval=3517483276 TSecr=2266437541"
"12","17:22:54.180759","192.168.0.74","5.28.195.2","TCP","66","52714  >  443 [FIN, ACK] Seq=518 Ack=2 Win=1048560 Len=0 TSval=3517483276 TSecr=2266437541"
"13","17:22:54.230514","5.28.195.2","192.168.0.74","TCP","56","443  >  52714 [RST] Seq=2 Win=0 Len=0"
"14","17:22:54.437256","192.168.0.74","192.87.28.82","TLSv1.2","602","Application Data"
"15","17:22:54.448909","2a00:ab00:533:6::100","2a02:ab88:b:4100:6163:ab1b:4f48:fc2c","TLSv1.2","110","Application Data"
"16","17:22:54.449416","2a02:ab88:b:4100:6163:ab1b:4f48:fc2c","2a00:ab00:533:6::100","TCP","86","56755  >  443 [ACK] Seq=1 Ack=25 Win=2048 Len=0 TSval=2790278526 TSecr=3010108807"
"17","17:22:54.449420","2a02:ab88:b:4100:6163:ab1b:4f48:fc2c","2a00:ab00:533:6::100","TLSv1.2","110","Application Data"
"18","17:22:54.449421","2a02:ab88:b:4100:6163:ab1b:4f48:fc2c","2a00:ab00:533:6::100","TLSv1.2","112","Application Data"
"19","17:22:54.499235","2a00:ab00:533:6::100","2a02:ab88:b:4100:6163:ab1b:4f48:fc2c","TCP","86","443  >  56755 [ACK] Seq=25 Ack=25 Win=506 Len=0 TSval=3010108857 TSecr=2790278526"
"20","17:22:54.503068","2a00:ab00:533:6::100","2a02:ab88:b:4100:6163:ab1b:4f48:fc2c","TCP","86","443  >  56755 [ACK] Seq=25 Ack=51 Win=506 Len=0 TSval=3010108861 TSecr=2790278527"
"21","17:22:54.526373","192.87.28.82","192.168.0.74","TCP","66","9001  >  52516 [ACK] Seq=1 Ack=537 Win=5280 Len=0 TSval=1712598356 TSecr=163961974"
"22","17:22:55.049314","192.168.0.74","5.28.195.2","TCP","78","[TCP Retransmission] 52716  >  5222 [SYN] Seq=0 Win=65535 Len=0 MSS=1460 WS=16 TSval=1257792789 TSecr=0 SACK_PERM"
"23","17:22:55.049347","192.168.0.74","5.28.195.2","TCP","78","[TCP Retransmission] 52715  >  80 [SYN] Seq=0 Win=65535 Len=0 MSS=1460 WS=16 TSval=4208793795 TSecr=0 SACK_PERM"
"24","17:22:55.951567","64.65.63.120","192.168.0.74","TLSv1.2","602","Application Data"
"25","17:22:55.951570","149.154.167.41","192.168.0.74","SSL","171","Continuation Data"
"26","17:22:55.951802","192.168.0.74","149.154.167.41","TCP","66","51643  >  443 [ACK] Seq=1 Ack=211 Win=65530 Len=0 TSval=2408218711 TSecr=1826442670"
"27","17:22:55.951876","192.168.0.74","64.65.63.120","TCP","66","52517  >  443 [ACK] Seq=1 Ack=537 Win=18782 Len=0 TSval=4083332148 TSecr=2614676954"
"28","17:22:55.998628","192.168.0.74","192.87.28.82","TLSv1.2","602","Application Data"
"29","17:22:56.050478","192.168.0.74","5.28.195.2","TCP","78","[TCP Retransmission] 52716  >  5222 [SYN] Seq=0 Win=65535 Len=0 MSS=1460 WS=16 TSval=1257793791 TSecr=0 SACK_PERM"
"30","17:22:56.050551","192.168.0.74","5.28.195.2","TCP","78","[TCP Retransmission] 52715  >  80 [SYN] Seq=0 Win=65535 Len=0 MSS=1460 WS=16 TSval=4208794797 TSecr=0 SACK_PERM"
"31","17:22:56.076164","192.87.28.82","192.168.0.74","TCP","66","9001  >  52516 [ACK] Seq=1 Ack=1073 Win=5280 Len=0 TSval=1712599909 TSecr=163963536"
"32","17:22:56.084484","192.87.28.82","192.168.0.74","TLSv1.2","602","Application Data"
"33","17:22:56.084676","192.168.0.74","192.87.28.82","TCP","66","52516  >  9001 [ACK] Seq=1073 Ack=537 Win=9058 Len=0 TSval=163963622 TSecr=1712599916"
"34","17:22:56.566439","2a00:ab00:533:6::100","2a02:ab88:b:4100:6163:ab1b:4f48:fc2c","TCP","86","443  >  56752 [ACK] Seq=1 Ack=1 Win=487 Len=0 TSval=3010110766 TSecr=359044581"
"35","17:22:56.566726","2a02:ab88:b:4100:6163:ab1b:4f48:fc2c","2a00:ab00:533:6::100","TCP","86","[TCP ACKed unseen segment] 56752  >  443 [ACK] Seq=1 Ack=2 Win=2048 Len=0 TSval=359059942 TSecr=3009988391"
"36","17:22:57.051878","192.168.0.74","5.28.195.2","TCP","78","[TCP Retransmission] 52716  >  5222 [SYN] Seq=0 Win=65535 Len=0 MSS=1460 WS=16 TSval=1257794792 TSecr=0 SACK_PERM"
"37","17:22:57.051943","192.168.0.74","5.28.195.2","TCP","78","[TCP Retransmission] 52715  >  80 [SYN] Seq=0 Win=65535 Len=0 MSS=1460 WS=16 TSval=4208795798 TSecr=0 SACK_PERM"
"38","17:22:57.132807","149.154.167.41","192.168.0.74","SSL","171","Continuation Data"
"39","17:22:57.133008","192.168.0.74","149.154.167.41","TCP","66","51643  >  443 [ACK] Seq=1 Ack=316 Win=65530 Len=0 TSval=2408219892 TSecr=1826443945"
"40","17:22:58.040704","192.168.0.74","31.192.108.181","TLSv1.2","414","Application Data"
"41","17:22:58.052442","192.168.0.74","5.28.195.2","TCP","78","[TCP Retransmission] 52716  >  5222 [SYN] Seq=0 Win=65535 Len=0 MSS=1460 WS=16 TSval=1257795793 TSecr=0 SACK_PERM"
"42","17:22:58.052502","192.168.0.74","5.28.195.2","TCP","78","[TCP Retransmission] 52715  >  80 [SYN] Seq=0 Win=65535 Len=0 MSS=1460 WS=16 TSval=4208796799 TSecr=0 SACK_PERM"
"43","17:22:58.104596","31.192.108.181","192.168.0.74","TCP","66","443  >  59494 [ACK] Seq=1 Ack=349 Win=51 Len=0 TSval=2469631660 TSecr=843642473"
"44","17:22:58.104599","31.192.108.181","192.168.0.74","TLSv1.2","321","Application Data"
"45","17:22:58.104601","31.192.108.181","192.168.0.74","TLSv1.2","345","Application Data"
"46","17:22:58.105105","192.168.0.74","31.192.108.181","TCP","66","59494  >  443 [ACK] Seq=349 Ack=535 Win=2040 Len=0 TSval=843642537 TSecr=2469631660"
"47","17:22:58.111741","2a02:ab88:b:4100:6163:ab1b:4f48:fc2c","2603:1063:27:2::14","TCP","98","52717  >  443 [SYN, ECE, CWR] Seq=0 Win=65535 Len=0 MSS=1440 WS=64 TSval=2118830194 TSecr=0 SACK_PERM"
"48","17:22:58.133717","2603:1063:27:2::14","2a02:ab88:b:4100:6163:ab1b:4f48:fc2c","TCP","86","443  >  52717 [SYN, ACK, ECE] Seq=0 Ack=1 Win=65535 Len=0 MSS=1400 WS=256 SACK_PERM"
"49","17:22:58.134002","2a02:ab88:b:4100:6163:ab1b:4f48:fc2c","2603:1063:27:2::14","TCP","74","52717  >  443 [ACK] Seq=1 Ack=1 Win=262144 Len=0"
"50","17:22:58.134932","2a02:ab88:b:4100:6163:ab1b:4f48:fc2c","2603:1063:27:2::14","TCP","1474","52717  >  443 [ACK] Seq=1 Ack=1 Win=262144 Len=1400 [TCP PDU reassembled in 51]"
"51","17:22:58.134976","2a02:ab88:b:4100:6163:ab1b:4f48:fc2c","2603:1063:27:2::14","TLSv1.3","499","Client Hello (SNI=teams.microsoft.com)"
"52","17:22:58.155234","2603:1063:27:2::14","2a02:ab88:b:4100:6163:ab1b:4f48:fc2c","TCP","74","443  >  52717 [ACK] Seq=1 Ack=1401 Win=4193280 Len=0"
"53","17:22:58.158639","2603:1063:27:2::14","2a02:ab88:b:4100:6163:ab1b:4f48:fc2c","TCP","74","443  >  52717 [ACK] Seq=1 Ack=1826 Win=4194560 Len=0"
"54","17:22:58.158641","2603:1063:27:2::14","2a02:ab88:b:4100:6163:ab1b:4f48:fc2c","TLSv1.3","173","Hello Retry Request, Change Cipher Spec"
"55","17:22:58.158816","2a02:ab88:b:4100:6163:ab1b:4f48:fc2c","2603:1063:27:2::14","TCP","74","52717  >  443 [ACK] Seq=1826 Ack=100 Win=262080 Len=0"
"56","17:22:58.161249","2a02:ab88:b:4100:6163:ab1b:4f48:fc2c","2603:1063:27:2::14","TLSv1.3","745","Change Cipher Spec, Client Hello (SNI=teams.microsoft.com)"
"57","17:22:58.181372","2603:1063:27:2::14","2a02:ab88:b:4100:6163:ab1b:4f48:fc2c","TCP","74","443  >  52717 [ACK] Seq=100 Ack=2497 Win=4193792 Len=0"
"58","17:22:58.187796","2603:1063:27:2::14","2a02:ab88:b:4100:6163:ab1b:4f48:fc2c","TLSv1.3","1494","Server Hello"
"59","17:22:58.187799","2603:1063:27:2::14","2a02:ab88:b:4100:6163:ab1b:4f48:fc2c","TCP","1494","443  >  52717 [ACK] Seq=1520 Ack=2497 Win=4193792 Len=1420 [TCP PDU reassembled in 63]"
"60","17:22:58.187801","2603:1063:27:2::14","2a02:ab88:b:4100:6163:ab1b:4f48:fc2c","TCP","1494","443  >  52717 [ACK] Seq=2940 Ack=2497 Win=4193792 Len=1420 [TCP PDU reassembled in 63]"
"61","17:22:58.187803","2603:1063:27:2::14","2a02:ab88:b:4100:6163:ab1b:4f48:fc2c","TCP","1494","443  >  52717 [ACK] Seq=4360 Ack=2497 Win=4193792 Len=1420 [TCP PDU reassembled in 63]"
"62","17:22:58.187806","2603:1063:27:2::14","2a02:ab88:b:4100:6163:ab1b:4f48:fc2c","TCP","1494","443  >  52717 [ACK] Seq=5780 Ack=2497 Win=4193792 Len=1420 [TCP PDU reassembled in 63]"
"63","17:22:58.187808","2603:1063:27:2::14","2a02:ab88:b:4100:6163:ab1b:4f48:fc2c","TLSv1.3","1165","Application Data"
"64","17:22:58.187991","2a02:ab88:b:4100:6163:ab1b:4f48:fc2c","2603:1063:27:2::14","TCP","74","52717  >  443 [ACK] Seq=2497 Ack=8291 Win=254016 Len=0"
"65","17:22:58.188144","2a02:ab88:b:4100:6163:ab1b:4f48:fc2c","2603:1063:27:2::14","TCP","74","[TCP Window Update] 52717  >  443 [ACK] Seq=2497 Ack=8291 Win=262144 Len=0"
"66","17:22:58.195656","2a02:ab88:b:4100:6163:ab1b:4f48:fc2c","2603:1063:27:2::14","TLSv1.3","148","Application Data"
"67","17:22:58.195997","2a02:ab88:b:4100:6163:ab1b:4f48:fc2c","2603:1063:27:2::14","TLSv1.3","166","Application Data"
"68","17:22:58.196543","2a02:ab88:b:4100:6163:ab1b:4f48:fc2c","2603:1063:27:2::14","TCP","1474","52717  >  443 [ACK] Seq=2663 Ack=8291 Win=262144 Len=1400 [TCP PDU reassembled in 70]"
"69","17:22:58.196545","2a02:ab88:b:4100:6163:ab1b:4f48:fc2c","2603:1063:27:2::14","TCP","1474","52717  >  443 [ACK] Seq=4063 Ack=8291 Win=262144 Len=1400 [TCP PDU reassembled in 70]"
"70","17:22:58.196575","2a02:ab88:b:4100:6163:ab1b:4f48:fc2c","2603:1063:27:2::14","TLSv1.3","93","Application Data"
"71","17:22:58.196624","2a02:ab88:b:4100:6163:ab1b:4f48:fc2c","2603:1063:27:2::14","TLSv1.3","174","Application Data"
"72","17:22:58.210047","2603:1063:27:2::14","2a02:ab88:b:4100:6163:ab1b:4f48:fc2c","TCP","74","443  >  52717 [ACK] Seq=8291 Ack=2571 Win=4193792 Len=0"
"73","17:22:58.210051","2603:1063:27:2::14","2a02:ab88:b:4100:6163:ab1b:4f48:fc2c","TLSv1.3","533","Application Data"
"74","17:22:58.210053","2603:1063:27:2::14","2a02:ab88:b:4100:6163:ab1b:4f48:fc2c","TLSv1.3","136","Application Data"
"75","17:22:58.210341","2a02:ab88:b:4100:6163:ab1b:4f48:fc2c","2603:1063:27:2::14","TCP","74","52717  >  443 [ACK] Seq=5582 Ack=8812 Win=261632 Len=0"
"76","17:22:58.210681","2a02:ab88:b:4100:6163:ab1b:4f48:fc2c","2603:1063:27:2::14","TLSv1.3","105","Application Data"
"77","17:22:58.214519","2603:1063:27:2::14","2a02:ab88:b:4100:6163:ab1b:4f48:fc2c","TCP","74","443  >  52717 [ACK] Seq=8812 Ack=5582 Win=4194560 Len=0"
"78","17:22:58.225391","2603:1063:27:2::14","2a02:ab88:b:4100:6163:ab1b:4f48:fc2c","TLSv1.3","105","Application Data"
"79","17:22:58.225536","2a02:ab88:b:4100:6163:ab1b:4f48:fc2c","2603:1063:27:2::14","TCP","74","52717  >  443 [ACK] Seq=5613 Ack=8843 Win=262144 Len=0"
"80","17:22:58.229315","2603:1063:27:2::14","2a02:ab88:b:4100:6163:ab1b:4f48:fc2c","TCP","74","443  >  52717 [ACK] Seq=8843 Ack=5613 Win=4194560 Len=0"
"81","17:22:58.305660","2603:1063:27:2::14","2a02:ab88:b:4100:6163:ab1b:4f48:fc2c","TLSv1.3","450","Application Data"
"82","17:22:58.305871","2a02:ab88:b:4100:6163:ab1b:4f48:fc2c","2603:1063:27:2::14","TCP","74","52717  >  443 [ACK] Seq=5613 Ack=9219 Win=261824 Len=0"
"83","17:22:58.819469","149.154.167.41","192.168.0.74","SSL","171","Continuation Data"
"84","17:22:58.819894","192.168.0.74","149.154.167.41","TCP","66","51643  >  443 [ACK] Seq=1 Ack=421 Win=65535 Len=0 TSval=2408221579 TSecr=1826445441"
"85","17:22:59.274000","192.168.0.74","5.28.195.2","TCP","78","52718  >  443 [SYN, ECE, CWR] Seq=0 Win=65535 Len=0 MSS=1460 WS=16 TSval=2882621910 TSecr=0 SACK_PERM"
"86","17:22:59.295839","192.168.0.74","5.28.195.2","TCP","78","52719  >  443 [SYN, ECE, CWR] Seq=0 Win=65535 Len=0 MSS=1460 WS=16 TSval=237862391 TSecr=0 SACK_PERM"
"87","17:22:59.320065","5.28.195.2","192.168.0.74","TCP","74","443  >  52718 [SYN, ACK, ECE] Seq=0 Ack=1 Win=65535 Len=0 MSS=1240 SACK_PERM TSval=3031587864 TSecr=2882621910 WS=1024"
"88","17:22:59.320228","192.168.0.74","5.28.195.2","TCP","66","52718  >  443 [ACK] Seq=1 Ack=1 Win=1048560 Len=0 TSval=2882621957 TSecr=3031587864"
"89","17:22:59.321049","192.168.0.74","5.28.195.2","TLSv1","583","Client Hello"
"90","17:22:59.333073","5.28.195.2","192.168.0.74","TCP","74","443  >  52719 [SYN, ACK, ECE] Seq=0 Ack=1 Win=65535 Len=0 MSS=1240 SACK_PERM TSval=2924340376 TSecr=237862391 WS=1024"
"91","17:22:59.333241","192.168.0.74","5.28.195.2","TCP","66","52719  >  443 [ACK] Seq=1 Ack=1 Win=1048560 Len=0 TSval=237862429 TSecr=2924340376"
"92","17:22:59.333460","192.168.0.74","5.28.195.2","TLSv1","583","Client Hello"
"93","17:22:59.362626","5.28.195.2","192.168.0.74","TCP","66","443  >  52718 [ACK] Seq=1 Ack=518 Win=67584 Len=0 TSval=3031587927 TSecr=2882621957"
"94","17:22:59.362629","5.28.195.2","192.168.0.74","TCP","66","443  >  52718 [FIN, ACK] Seq=1 Ack=518 Win=67584 Len=0 TSval=3031587927 TSecr=2882621957"
"95","17:22:59.362851","192.168.0.74","5.28.195.2","TCP","66","52718  >  443 [ACK] Seq=518 Ack=2 Win=1048560 Len=0 TSval=2882621999 TSecr=3031587927"
"96","17:22:59.363096","192.168.0.74","5.28.195.2","TCP","66","52718  >  443 [FIN, ACK] Seq=518 Ack=2 Win=1048560 Len=0 TSval=2882621999 TSecr=3031587927"
"97","17:22:59.373787","5.28.195.2","192.168.0.74","TCP","66","443  >  52719 [ACK] Seq=1 Ack=518 Win=67584 Len=0 TSval=2924340417 TSecr=237862429"
"98","17:22:59.373790","5.28.195.2","192.168.0.74","TCP","66","443  >  52719 [FIN, ACK] Seq=1 Ack=518 Win=67584 Len=0 TSval=2924340417 TSecr=237862429"
"99","17:22:59.374014","192.168.0.74","5.28.195.2","TCP","66","52719  >  443 [ACK] Seq=518 Ack=2 Win=1048560 Len=0 TSval=237862469 TSecr=2924340417"
"100","17:22:59.374231","192.168.0.74","5.28.195.2","TCP","66","52719  >  443 [FIN, ACK] Seq=518 Ack=2 Win=1048560 Len=0 TSval=237862470 TSecr=2924340417"
"101","17:22:59.408137","5.28.195.2","192.168.0.74","TCP","56","443  >  52718 [RST] Seq=2 Win=0 Len=0"
"102","17:22:59.424982","5.28.195.2","192.168.0.74","TCP","56","443  >  52719 [RST] Seq=2 Win=0 Len=0"
"103","17:22:59.452196","fe80::ae22:5ff:feaa:607e","2a02:ab88:b:4100:6163:ab1b:4f48:fc2c","ICMPv6","86","Neighbor Solicitation for 2a02:ab88:b:4100:6163:ab1b:4f48:fc2c from ac:22:05:aa:60:7e"
"104","17:22:59.452382","fe80::49c:fb07:3c9a:aa62","fe80::ae22:5ff:feaa:607e","ICMPv6","78","Neighbor Advertisement 2a02:ab88:b:4100:6163:ab1b:4f48:fc2c (sol)"
"105","17:22:59.503672","fe80::49c:fb07:3c9a:aa62","fe80::ae22:5ff:feaa:607e","ICMPv6","86","Neighbor Solicitation for fe80::ae22:5ff:feaa:607e from ee:99:94:f5:59:fd"
"106","17:22:59.521166","fe80::ae22:5ff:feaa:607e","fe80::49c:fb07:3c9a:aa62","ICMPv6","78","Neighbor Advertisement fe80::ae22:5ff:feaa:607e (rtr, sol)"
"107","17:23:00.051737","192.168.0.74","5.28.195.2","TCP","78","52721  >  80 [SYN, ECE, CWR] Seq=0 Win=65535 Len=0 MSS=1460 WS=16 TSval=1367981860 TSecr=0 SACK_PERM"
"108","17:23:00.051746","192.168.0.74","5.28.195.2","TCP","78","52720  >  443 [SYN, ECE, CWR] Seq=0 Win=65535 Len=0 MSS=1460 WS=16 TSval=3061604490 TSecr=0 SACK_PERM"
"109","17:23:00.052210","192.168.0.74","5.28.195.2","TCP","78","52722  >  5222 [SYN, ECE, CWR] Seq=0 Win=65535 Len=0 MSS=1460 WS=16 TSval=3265314935 TSecr=0 SACK_PERM"
"110","17:23:00.102439","5.28.195.2","192.168.0.74","TCP","74","443  >  52720 [SYN, ACK, ECE] Seq=0 Ack=1 Win=65535 Len=0 MSS=1240 SACK_PERM TSval=3280383423 TSecr=3061604490 WS=1024"
"111","17:23:00.102725","192.168.0.74","5.28.195.2","TCP","66","52720  >  443 [ACK] Seq=1 Ack=1 Win=1048560 Len=0 TSval=3061604541 TSecr=3280383423"
"112","17:23:00.103070","192.168.0.74","5.28.195.2","TLSv1","583","Client Hello"
"113","17:23:00.144264","5.28.195.2","192.168.0.74","TCP","66","443  >  52720 [ACK] Seq=1 Ack=518 Win=67584 Len=0 TSval=3280383523 TSecr=3061604541"
"114","17:23:00.150586","5.28.195.2","192.168.0.74","TCP","66","443  >  52720 [FIN, ACK] Seq=1 Ack=518 Win=67584 Len=0 TSval=3280383529 TSecr=3061604541"
"115","17:23:00.150766","192.168.0.74","5.28.195.2","TCP","66","52720  >  443 [ACK] Seq=518 Ack=2 Win=1048560 Len=0 TSval=3061604589 TSecr=3280383529"
"116","17:23:00.151062","192.168.0.74","5.28.195.2","TCP","66","52720  >  443 [FIN, ACK] Seq=518 Ack=2 Win=1048560 Len=0 TSval=3061604589 TSecr=3280383529"
"117","17:23:00.198678","5.28.195.2","192.168.0.74","TCP","56","443  >  52720 [RST] Seq=2 Win=0 Len=0"
"118","17:23:01.052404","192.168.0.74","5.28.195.2","TCP","78","[TCP Retransmission] 52722  >  5222 [SYN] Seq=0 Win=65535 Len=0 MSS=1460 WS=16 TSval=3265315936 TSecr=0 SACK_PERM"
"119","17:23:01.052497","192.168.0.74","5.28.195.2","TCP","78","[TCP Retransmission] 52721  >  80 [SYN] Seq=0 Win=65535 Len=0 MSS=1460 WS=16 TSval=1367982861 TSecr=0 SACK_PERM"
"120","17:23:01.059532","192.168.0.74","64.65.63.120","TLSv1.2","602","Application Data"
"121","17:23:01.062600","149.154.167.41","192.168.0.74","SSL","171","Continuation Data"
"122","17:23:01.062931","192.168.0.74","149.154.167.41","TCP","66","51643  >  443 [ACK] Seq=1 Ack=526 Win=65535 Len=0 TSval=2408223822 TSecr=1826447757"
"123","17:23:01.104453","64.65.63.120","192.168.0.74","TCP","66","443  >  52517 [ACK] Seq=537 Ack=537 Win=3235 Len=0 TSval=2614682299 TSecr=4083337256"
"124","17:23:01.687327","2a00:ab00:533:6::100","2a02:ab88:b:4100:6163:ab1b:4f48:fc2c","TCP","86","443  >  56753 [ACK] Seq=1 Ack=1 Win=1784 Len=0 TSval=3010115886 TSecr=743884938"
"125","17:23:01.687665","2a02:ab88:b:4100:6163:ab1b:4f48:fc2c","2a00:ab00:533:6::100","TCP","86","[TCP ACKed unseen segment] 56753  >  443 [ACK] Seq=1 Ack=2 Win=2048 Len=0 TSval=743900460 TSecr=3010008287"
"126","17:23:02.053251","192.168.0.74","5.28.195.2","TCP","78","[TCP Retransmission] 52722  >  5222 [SYN] Seq=0 Win=65535 Len=0 MSS=1460 WS=16 TSval=3265316937 TSecr=0 SACK_PERM"
"127","17:23:02.053346","192.168.0.74","5.28.195.2","TCP","78","[TCP Retransmission] 52721  >  80 [SYN] Seq=0 Win=65535 Len=0 MSS=1460 WS=16 TSval=1367983862 TSecr=0 SACK_PERM"
"128","17:23:02.139849","64.65.63.120","192.168.0.74","TLSv1.2","602","Application Data"
"129","17:23:02.139969","192.168.0.74","64.65.63.120","TCP","66","52517  >  443 [ACK] Seq=537 Ack=1073 Win=18782 Len=0 TSval=4083338336 TSecr=2614683336"
"130","17:23:03.054827","192.168.0.74","5.28.195.2","TCP","78","[TCP Retransmission] 52722  >  5222 [SYN] Seq=0 Win=65535 Len=0 MSS=1460 WS=16 TSval=3265317938 TSecr=0 SACK_PERM"
"131","17:23:03.054916","192.168.0.74","5.28.195.2","TCP","78","[TCP Retransmission] 52721  >  80 [SYN] Seq=0 Win=65535 Len=0 MSS=1460 WS=16 TSval=1367984863 TSecr=0 SACK_PERM"
"132","17:23:03.881651","192.168.0.74","64.65.63.120","TLSv1.2","602","Application Data"
"133","17:23:03.928814","64.65.63.120","192.168.0.74","TCP","66","443  >  52517 [ACK] Seq=1073 Ack=1073 Win=3235 Len=0 TSval=2614685125 TSecr=4083340078"
"134","17:23:04.016505","64.65.63.120","192.168.0.74","TLSv1.2","602","Application Data"
"135","17:23:04.016666","192.168.0.74","64.65.63.120","TCP","66","52517  >  443 [ACK] Seq=1073 Ack=1609 Win=18782 Len=0 TSval=4083340213 TSecr=2614685211"
"136","17:23:04.017740","192.168.0.74","64.65.63.120","TCP","1474","52517  >  443 [ACK] Seq=1073 Ack=1609 Win=18790 Len=1408 TSval=4083340214 TSecr=2614685211 [TCP PDU reassembled in 137]"
"137","17:23:04.017757","192.168.0.74","64.65.63.120","TLSv1.2","736","Application Data"
"138","17:23:04.055130","192.168.0.74","5.28.195.2","TCP","78","[TCP Retransmission] 52722  >  5222 [SYN] Seq=0 Win=65535 Len=0 MSS=1460 WS=16 TSval=3265318939 TSecr=0 SACK_PERM"
"139","17:23:04.055212","192.168.0.74","5.28.195.2","TCP","78","[TCP Retransmission] 52721  >  80 [SYN] Seq=0 Win=65535 Len=0 MSS=1460 WS=16 TSval=1367985864 TSecr=0 SACK_PERM"
"140","17:23:04.065337","64.65.63.120","192.168.0.74","TCP","66","443  >  52517 [ACK] Seq=1609 Ack=2481 Win=3224 Len=0 TSval=2614685257 TSecr=4083340214"
"141","17:23:04.065339","64.65.63.120","192.168.0.74","TCP","66","443  >  52517 [ACK] Seq=1609 Ack=3151 Win=3219 Len=0 TSval=2614685257 TSecr=4083340214"
"142","17:23:04.142877","64.65.63.120","192.168.0.74","TCP","1474","443  >  52517 [ACK] Seq=1609 Ack=3151 Win=3219 Len=1408 TSval=2614685334 TSecr=4083340214 [TCP PDU reassembled in 144]"
"143","17:23:04.142881","64.65.63.120","192.168.0.74","TCP","1474","443  >  52517 [PSH, ACK] Seq=3017 Ack=3151 Win=3219 Len=1408 TSval=2614685334 TSecr=4083340214 [TCP PDU reassembled in 144]"
"144","17:23:04.142883","64.65.63.120","192.168.0.74","TLSv1.2","870","Application Data"
"145","17:23:04.143109","192.168.0.74","64.65.63.120","TCP","66","52517  >  443 [ACK] Seq=3151 Ack=3017 Win=18768 Len=0 TSval=4083340340 TSecr=2614685334"
"146","17:23:04.143179","192.168.0.74","64.65.63.120","TCP","66","52517  >  443 [ACK] Seq=3151 Ack=5229 Win=18734 Len=0 TSval=4083340340 TSecr=2614685334"
"147","17:23:04.143417","192.168.0.74","64.65.63.120","TCP","66","[TCP Window Update] 52517  >  443 [ACK] Seq=3151 Ack=5229 Win=18790 Len=0 TSval=4083340340 TSecr=2614685334"
"148","17:23:04.160646","64.65.63.120","192.168.0.74","TCP","1474","443  >  52517 [ACK] Seq=5229 Ack=3151 Win=3219 Len=1408 TSval=2614685358 TSecr=4083340214 [TCP PDU reassembled in 152]"
"149","17:23:04.160652","64.65.63.120","192.168.0.74","TCP","1474","443  >  52517 [PSH, ACK] Seq=6637 Ack=3151 Win=3219 Len=1408 TSval=2614685358 TSecr=4083340214 [TCP PDU reassembled in 152]"
"150","17:23:04.160844","192.168.0.74","64.65.63.120","TCP","66","52517  >  443 [ACK] Seq=3151 Ack=8045 Win=18746 Len=0 TSval=4083340357 TSecr=2614685358"
"151","17:23:04.161088","192.168.0.74","64.65.63.120","TCP","66","[TCP Window Update] 52517  >  443 [ACK] Seq=3151 Ack=8045 Win=18790 Len=0 TSval=4083340358 TSecr=2614685358"
"152","17:23:04.179243","64.65.63.120","192.168.0.74","TLSv1.2","356","Application Data"
"153","17:23:04.179430","192.168.0.74","64.65.63.120","TCP","66","52517  >  443 [ACK] Seq=3151 Ack=8335 Win=18786 Len=0 TSval=4083340376 TSecr=2614685377"
"154","17:23:04.182423","192.168.0.74","64.65.63.120","TLSv1.2","602","Application Data"
"155","17:23:04.218543","64.65.63.120","192.168.0.74","TCP","66","443  >  52517 [ACK] Seq=8335 Ack=3687 Win=3215 Len=0 TSval=2614685416 TSecr=4083340379"
"156","17:23:04.218781","192.168.0.74","64.65.63.120","TLSv1.2","602","Application Data"
"157","17:23:04.253239","64.65.63.120","192.168.0.74","TCP","66","443  >  52517 [ACK] Seq=8335 Ack=4223 Win=3211 Len=0 TSval=2614685451 TSecr=4083340415"
"158","17:23:04.294848","64.65.63.120","192.168.0.74","TLSv1.2","1116","Application Data"
"159","17:23:04.295086","192.168.0.74","64.65.63.120","TCP","66","52517  >  443 [ACK] Seq=4223 Ack=9385 Win=18774 Len=0 TSval=4083340492 TSecr=2614685491"
"160","17:23:04.296214","192.168.0.74","64.65.63.120","TLSv1.2","602","Application Data"
"161","17:23:04.361838","64.65.63.120","192.168.0.74","TLSv1.2","602","Application Data"
"162","17:23:04.362029","192.168.0.74","64.65.63.120","TCP","66","52517  >  443 [ACK] Seq=4759 Ack=9921 Win=18782 Len=0 TSval=4083340559 TSecr=2614685558"
"163","17:23:04.465909","64.65.63.120","192.168.0.74","TCP","1474","443  >  52517 [ACK] Seq=9921 Ack=4759 Win=3207 Len=1408 TSval=2614685663 TSecr=4083340559 [TCP PDU reassembled in 165]"
"164","17:23:04.465913","64.65.63.120","192.168.0.74","TCP","1474","443  >  52517 [PSH, ACK] Seq=11329 Ack=4759 Win=3207 Len=1408 TSval=2614685663 TSecr=4083340559 [TCP PDU reassembled in 165]"
"165","17:23:04.465915","64.65.63.120","192.168.0.74","TLSv1.2","1320","Application Data"
"166","17:23:04.465918","64.65.63.120","192.168.0.74","TCP","1474","443  >  52517 [ACK] Seq=13991 Ack=4759 Win=3207 Len=1408 TSval=2614685663 TSecr=4083340559 [TCP PDU reassembled in 170]"
"167","17:23:04.465920","64.65.63.120","192.168.0.74","TCP","1474","443  >  52517 [PSH, ACK] Seq=15399 Ack=4759 Win=3207 Len=1408 TSval=2614685663 TSecr=4083340559 [TCP PDU reassembled in 170]"
"168","17:23:04.466109","192.168.0.74","64.65.63.120","TCP","66","52517  >  443 [ACK] Seq=4759 Ack=16807 Win=18683 Len=0 TSval=4083340663 TSecr=2614685663"
"169","17:23:04.466337","192.168.0.74","64.65.63.120","TCP","66","[TCP Window Update] 52517  >  443 [ACK] Seq=4759 Ack=16807 Win=18790 Len=0 TSval=4083340663 TSecr=2614685663"
"170","17:23:04.485493","64.65.63.120","192.168.0.74","TLSv1.2","1474","Application Data"
"171","17:23:04.485495","64.65.63.120","192.168.0.74","TCP","1474","443  >  52517 [PSH, ACK] Seq=18215 Ack=4759 Win=3207 Len=1408 TSval=2614685683 TSecr=4083340559 [TCP PDU reassembled in 176]"
"172","17:23:04.485498","64.65.63.120","192.168.0.74","TCP","1474","443  >  52517 [ACK] Seq=19623 Ack=4759 Win=3207 Len=1408 TSval=2614685683 TSecr=4083340559 [TCP PDU reassembled in 176]"
"173","17:23:04.485646","192.168.0.74","64.65.63.120","TCP","66","52517  >  443 [ACK] Seq=4759 Ack=21031 Win=18724 Len=0 TSval=4083340682 TSecr=2614685683"
"174","17:23:04.485831","192.168.0.74","64.65.63.120","TCP","66","[TCP Window Update] 52517  >  443 [ACK] Seq=4759 Ack=21031 Win=18790 Len=0 TSval=4083340682 TSecr=2614685683"
"175","17:23:04.486010","192.168.0.74","64.65.63.120","TLSv1.2","602","Application Data"
"176","17:23:04.504193","64.65.63.120","192.168.0.74","TLSv1.2","1474","Application Data, Application Data"
"177","17:23:04.504362","192.168.0.74","64.65.63.120","TCP","66","52517  >  443 [ACK] Seq=5295 Ack=22439 Win=18768 Len=0 TSval=4083340701 TSecr=2614685701"
"178","17:23:04.512064","64.65.63.120","192.168.0.74","TLSv1.2","1022","Application Data"
"179","17:23:04.512170","192.168.0.74","64.65.63.120","TCP","66","52517  >  443 [ACK] Seq=5295 Ack=23395 Win=18776 Len=0 TSval=4083340709 TSecr=2614685710"
"180","17:23:04.522581","fe80::ae22:5ff:feaa:607e","fe80::49c:fb07:3c9a:aa62","ICMPv6","86","Neighbor Solicitation for fe80::49c:fb07:3c9a:aa62 from ac:22:05:aa:60:7e"
"181","17:23:04.522682","fe80::49c:fb07:3c9a:aa62","fe80::ae22:5ff:feaa:607e","ICMPv6","78","Neighbor Advertisement fe80::49c:fb07:3c9a:aa62 (sol)"
"182","17:23:04.573853","64.65.63.120","192.168.0.74","TCP","66","443  >  52517 [ACK] Seq=23395 Ack=5295 Win=3203 Len=0 TSval=2614685772 TSecr=4083340683"
"183","17:23:04.573958","192.168.0.74","64.65.63.120","TLSv1.2","602","Application Data"
"184","17:23:04.608588","64.65.63.120","192.168.0.74","TCP","66","443  >  52517 [ACK] Seq=23395 Ack=5831 Win=3199 Len=0 TSval=2614685806 TSecr=4083340771"
"185","17:23:04.670308","192.168.0.74","149.154.167.41","SSL","155","Continuation Data"
"186","17:23:04.710921","149.154.167.41","192.168.0.74","SSL","171","Continuation Data"
"187","17:23:04.711025","192.168.0.74","149.154.167.41","TCP","66","51643  >  443 [ACK] Seq=90 Ack=631 Win=65530 Len=0 TSval=2408227471 TSecr=1826451524"
"188","17:23:04.712219","192.168.0.74","149.154.167.41","SSL","443","Continuation Data"
"189","17:23:04.717368","64.65.63.120","192.168.0.74","TLSv1.2","602","Application Data"
"190","17:23:04.717461","192.168.0.74","64.65.63.120","TCP","66","52517  >  443 [ACK] Seq=5831 Ack=23931 Win=18782 Len=0 TSval=4083340914 TSecr=2614685915"
"191","17:23:04.718507","192.168.0.74","64.65.63.120","TCP","1474","52517  >  443 [ACK] Seq=5831 Ack=23931 Win=18790 Len=1408 TSval=4083340915 TSecr=2614685915 [TCP PDU reassembled in 192]"
"192","17:23:04.718528","192.168.0.74","64.65.63.120","TLSv1.2","736","Application Data"
"193","17:23:04.738973","192.168.0.74","192.87.28.82","TLSv1.2","602","Application Data"
"194","17:23:04.757800","149.154.167.41","192.168.0.74","TCP","70","443  >  51643 [PSH, ACK] Seq=631 Ack=467 Win=2048 Len=4 TSval=1826451570 TSecr=2408227472 [TCP PDU reassembled in 198]"
"195","17:23:04.757801","64.65.63.120","192.168.0.74","TCP","66","443  >  52517 [ACK] Seq=23931 Ack=7909 Win=3183 Len=0 TSval=2614685955 TSecr=4083340915"
"196","17:23:04.757916","192.168.0.74","149.154.167.41","TCP","66","51643  >  443 [ACK] Seq=467 Ack=635 Win=65535 Len=0 TSval=2408227517 TSecr=1826451570"
"197","17:23:04.757957","192.168.0.74","64.65.63.120","TLSv1.2","1138","Application Data, Application Data"
"198","17:23:04.760861","149.154.167.41","192.168.0.74","SSL","420","Continuation Data"
"199","17:23:04.760895","192.168.0.74","149.154.167.41","TCP","66","51643  >  443 [ACK] Seq=467 Ack=989 Win=65514 Len=0 TSval=2408227521 TSecr=1826451575"
"200","17:23:04.793682","64.65.63.120","192.168.0.74","TCP","66","443  >  52517 [ACK] Seq=23931 Ack=8981 Win=3175 Len=0 TSval=2614685991 TSecr=4083340955"
"201","17:23:04.815364","192.87.28.82","192.168.0.74","TCP","66","9001  >  52516 [ACK] Seq=537 Ack=1609 Win=5280 Len=0 TSval=1712608650 TSecr=163972277"
"202","17:23:04.853886","64.65.63.120","192.168.0.74","TLSv1.2","602","Application Data"
"203","17:23:04.854017","192.168.0.74","64.65.63.120","TCP","66","52517  >  443 [ACK] Seq=8981 Ack=24467 Win=18782 Len=0 TSval=4083341051 TSecr=2614686051"
"204","17:23:04.887295","64.65.63.120","192.168.0.74","TCP","1474","443  >  52517 [ACK] Seq=24467 Ack=8981 Win=3175 Len=1408 TSval=2614686084 TSecr=4083340955 [TCP PDU reassembled in 208]"
"205","17:23:04.887298","64.65.63.120","192.168.0.74","TCP","1474","443  >  52517 [PSH, ACK] Seq=25875 Ack=8981 Win=3175 Len=1408 TSval=2614686084 TSecr=4083340955 [TCP PDU reassembled in 208]"
"206","17:23:04.887450","192.168.0.74","64.65.63.120","TCP","66","52517  >  443 [ACK] Seq=8981 Ack=27283 Win=18746 Len=0 TSval=4083341084 TSecr=2614686084"
"207","17:23:04.887564","192.168.0.74","64.65.63.120","TCP","66","[TCP Window Update] 52517  >  443 [ACK] Seq=8981 Ack=27283 Win=18790 Len=0 TSval=4083341084 TSecr=2614686084"
"208","17:23:04.889292","64.65.63.120","192.168.0.74","TLSv1.2","870","Application Data"
"209","17:23:04.889324","192.168.0.74","64.65.63.120","TCP","66","52517  >  443 [ACK] Seq=8981 Ack=28087 Win=18778 Len=0 TSval=4083341086 TSecr=2614686087"
"210","17:23:04.902805","64.65.63.120","192.168.0.74","TLSv1.2","1474","Application Data"
"211","17:23:04.902807","64.65.63.120","192.168.0.74","TCP","1474","443  >  52517 [PSH, ACK] Seq=29495 Ack=8981 Win=3175 Len=1408 TSval=2614686100 TSecr=4083341051 [TCP PDU reassembled in 214]"
"212","17:23:04.902933","192.168.0.74","64.65.63.120","TCP","66","52517  >  443 [ACK] Seq=8981 Ack=30903 Win=18746 Len=0 TSval=4083341099 TSecr=2614686100"
"213","17:23:04.903063","192.168.0.74","64.65.63.120","TCP","66","[TCP Window Update] 52517  >  443 [ACK] Seq=8981 Ack=30903 Win=18790 Len=0 TSval=4083341100 TSecr=2614686100"
"214","17:23:04.906018","64.65.63.120","192.168.0.74","TLSv1.2","1474","Application Data"
"215","17:23:04.906020","64.65.63.120","192.168.0.74","TCP","1474","443  >  52517 [PSH, ACK] Seq=32311 Ack=8981 Win=3175 Len=1408 TSval=2614686104 TSecr=4083341051 [TCP PDU reassembled in 218]"
"216","17:23:04.906169","192.168.0.74","64.65.63.120","TCP","66","52517  >  443 [ACK] Seq=8981 Ack=33719 Win=18790 Len=0 TSval=4083341103 TSecr=2614686104"
"217","17:23:04.906994","192.168.0.74","64.65.63.120","TLSv1.2","602","Application Data"
"218","17:23:04.922274","64.65.63.120","192.168.0.74","TLSv1.2","1474","Application Data"
"219","17:23:04.922446","192.168.0.74","64.65.63.120","TLSv1.2","1474","Application Data"
"220","17:23:04.922459","192.168.0.74","64.65.63.120","TLSv1.2","244","Application Data"
"221","17:23:04.926379","64.65.63.120","192.168.0.74","TLSv1.2","824","Application Data"
"222","17:23:04.926519","192.168.0.74","64.65.63.120","TCP","66","52517  >  443 [ACK] Seq=11103 Ack=35885 Win=18790 Len=0 TSval=4083341123 TSecr=2614686125"
"223","17:23:04.941518","64.65.63.120","192.168.0.74","TCP","66","443  >  52517 [ACK] Seq=35885 Ack=9517 Win=3171 Len=0 TSval=2614686139 TSecr=4083341104"
"224","17:23:04.959918","64.65.63.120","192.168.0.74","TCP","66","443  >  52517 [ACK] Seq=35885 Ack=11103 Win=3159 Len=0 TSval=2614686156 TSecr=4083341119"
"225","17:23:05.041413","192.168.0.74","64.65.63.120","TLSv1.2","602","Application Data"
"226","17:23:05.051751","64.65.63.120","192.168.0.74","TLSv1.2","602","Application Data"
"227","17:23:05.051855","192.168.0.74","64.65.63.120","TLSv1.2","602","Application Data"
"228","17:23:05.077372","64.65.63.120","192.168.0.74","TCP","66","443  >  52517 [ACK] Seq=36421 Ack=11639 Win=3155 Len=0 TSval=2614686275 TSecr=4083341238"
"229","17:23:05.088017","64.65.63.120","192.168.0.74","TCP","66","443  >  52517 [ACK] Seq=36421 Ack=12175 Win=3151 Len=0 TSval=2614686286 TSecr=4083341248"
"230","17:23:05.100354","64.65.63.120","192.168.0.74","TLSv1.2","602","Application Data"
"231","17:23:05.100568","192.168.0.74","64.65.63.120","TCP","66","52517  >  443 [ACK] Seq=12175 Ack=36957 Win=18790 Len=0 TSval=4083341297 TSecr=2614686298"
"232","17:23:05.101030","192.168.0.74","64.65.63.120","TLSv1.2","602","Application Data"
"233","17:23:05.137557","64.65.63.120","192.168.0.74","TLSv1.2","602","Application Data"
"234","17:23:05.137760","192.168.0.74","64.65.63.120","TCP","66","52517  >  443 [ACK] Seq=12711 Ack=37493 Win=18782 Len=0 TSval=4083341334 TSecr=2614686335"
"235","17:23:05.170089","64.65.63.120","192.168.0.74","TCP","1474","443  >  52517 [ACK] Seq=37493 Ack=12711 Win=3147 Len=1408 TSval=2614686368 TSecr=4083341298 [TCP PDU reassembled in 238]"
"236","17:23:05.170093","64.65.63.120","192.168.0.74","TCP","1474","443  >  52517 [PSH, ACK] Seq=38901 Ack=12711 Win=3147 Len=1408 TSval=2614686368 TSecr=4083341298 [TCP PDU reassembled in 238]"
"237","17:23:05.170399","192.168.0.74","64.65.63.120","TCP","66","52517  >  443 [ACK] Seq=12711 Ack=40309 Win=18790 Len=0 TSval=4083341367 TSecr=2614686368"
"238","17:23:05.173285","64.65.63.120","192.168.0.74","TLSv1.2","870","Application Data"
"239","17:23:05.173493","192.168.0.74","64.65.63.120","TCP","66","52517  >  443 [ACK] Seq=12711 Ack=41113 Win=18790 Len=0 TSval=4083341370 TSecr=2614686371"
"240","17:23:05.187020","64.65.63.120","192.168.0.74","TCP","1474","443  >  52517 [ACK] Seq=41113 Ack=12711 Win=3147 Len=1408 TSval=2614686384 TSecr=4083341334 [TCP PDU reassembled in 243]"
"241","17:23:05.187023","64.65.63.120","192.168.0.74","TCP","1474","443  >  52517 [PSH, ACK] Seq=42521 Ack=12711 Win=3147 Len=1408 TSval=2614686384 TSecr=4083341334 [TCP PDU reassembled in 243]"
"242","17:23:05.187286","192.168.0.74","64.65.63.120","TCP","66","52517  >  443 [ACK] Seq=12711 Ack=43929 Win=18790 Len=0 TSval=4083341384 TSecr=2614686384"
"243","17:23:05.211190","64.65.63.120","192.168.0.74","TLSv1.2","1406","Application Data, Application Data"
"244","17:23:05.211509","192.168.0.74","64.65.63.120","TCP","66","52517  >  443 [ACK] Seq=12711 Ack=45269 Win=18790 Len=0 TSval=4083341408 TSecr=2614686408"
"245","17:23:05.213133","64.65.63.120","192.168.0.74","TCP","1474","443  >  52517 [ACK] Seq=45269 Ack=12711 Win=3147 Len=1408 TSval=2614686411 TSecr=4083341370 [TCP PDU reassembled in 248]"
"246","17:23:05.213136","64.65.63.120","192.168.0.74","TCP","1474","443  >  52517 [PSH, ACK] Seq=46677 Ack=12711 Win=3147 Len=1408 TSval=2614686411 TSecr=4083341370 [TCP PDU reassembled in 248]"
"247","17:23:05.213285","192.168.0.74","64.65.63.120","TCP","66","52517  >  443 [ACK] Seq=12711 Ack=48085 Win=18790 Len=0 TSval=4083341410 TSecr=2614686411"
"248","17:23:05.247128","64.65.63.120","192.168.0.74","TLSv1.2","870","Application Data"
"249","17:23:05.247369","192.168.0.74","64.65.63.120","TCP","66","52517  >  443 [ACK] Seq=12711 Ack=48889 Win=18790 Len=0 TSval=4083341444 TSecr=2614686445"
"250","17:23:05.247564","192.168.0.74","64.65.63.120","TLSv1.2","602","Application Data"
"251","17:23:05.327844","64.65.63.120","192.168.0.74","TCP","66","443  >  52517 [ACK] Seq=48889 Ack=13247 Win=3143 Len=0 TSval=2614686526 TSecr=4083341444"
"252","17:23:05.989783","192.87.28.82","192.168.0.74","TCP","1474","9001  >  52516 [ACK] Seq=537 Ack=1609 Win=5280 Len=1408 TSval=1712609616 TSecr=163972277 [TCP PDU reassembled in 254]"
"253","17:23:05.989786","192.87.28.82","192.168.0.74","TCP","1474","9001  >  52516 [ACK] Seq=1945 Ack=1609 Win=5280 Len=1408 TSval=1712609616 TSecr=163972277 [TCP PDU reassembled in 254]"
"254","17:23:05.989788","192.87.28.82","192.168.0.74","TLSv1.2","870","Application Data"
"255","17:23:05.989790","192.87.28.82","192.168.0.74","TCP","1474","9001  >  52516 [ACK] Seq=4157 Ack=1609 Win=5280 Len=1408 TSval=1712609627 TSecr=163972277 [TCP PDU reassembled in 257]"
"256","17:23:05.989792","192.87.28.82","192.168.0.74","TCP","1474","9001  >  52516 [ACK] Seq=5565 Ack=1609 Win=5280 Len=1408 TSval=1712609627 TSecr=163972277 [TCP PDU reassembled in 257]"
"257","17:23:05.989794","192.87.28.82","192.168.0.74","TLSv1.2","1320","Application Data"
"258","17:23:05.989796","192.87.28.82","192.168.0.74","TLSv1.2","1474","Application Data"
"259","17:23:05.989799","192.87.28.82","192.168.0.74","TLSv1.2","822","Application Data"
"260","17:23:05.990023","192.168.0.74","192.87.28.82","TCP","66","52516  >  9001 [ACK] Seq=1609 Ack=5565 Win=8988 Len=0 TSval=163973528 TSecr=1712609627"
"261","17:23:05.990071","192.168.0.74","192.87.28.82","TCP","66","52516  >  9001 [ACK] Seq=1609 Ack=10391 Win=8913 Len=0 TSval=163973528 TSecr=1712609645"
"262","17:23:05.990313","192.168.0.74","192.87.28.82","TCP","66","[TCP Window Update] 52516  >  9001 [ACK] Seq=1609 Ack=10391 Win=9066 Len=0 TSval=163973528 TSecr=1712609645"
"263","17:23:06.051618","192.168.0.74","5.28.195.2","TCP","78","52726  >  80 [SYN, ECE, CWR] Seq=0 Win=65535 Len=0 MSS=1460 WS=16 TSval=2300774005 TSecr=0 SACK_PERM"
"264","17:23:06.051622","192.168.0.74","5.28.195.2","TCP","78","52725  >  443 [SYN, ECE, CWR] Seq=0 Win=65535 Len=0 MSS=1460 WS=16 TSval=3551293875 TSecr=0 SACK_PERM"
"265","17:23:06.051719","192.168.0.74","5.28.195.2","TCP","78","52727  >  5222 [SYN, ECE, CWR] Seq=0 Win=65535 Len=0 MSS=1460 WS=16 TSval=174329569 TSecr=0 SACK_PERM"
"266","17:23:06.091367","5.28.195.2","192.168.0.74","TCP","74","443  >  52725 [SYN, ACK, ECE] Seq=0 Ack=1 Win=65535 Len=0 MSS=1240 SACK_PERM TSval=3280389439 TSecr=3551293875 WS=1024"
"267","17:23:06.091520","192.168.0.74","5.28.195.2","TCP","66","52725  >  443 [ACK] Seq=1 Ack=1 Win=1048560 Len=0 TSval=3551293915 TSecr=3280389439"
"268","17:23:06.091697","192.168.0.74","5.28.195.2","TLSv1","583","Client Hello"
"269","17:23:06.114705","192.168.0.74","64.65.63.120","TLSv1.2","602","Application Data"
"270","17:23:06.131326","5.28.195.2","192.168.0.74","TCP","66","443  >  52725 [ACK] Seq=1 Ack=518 Win=67584 Len=0 TSval=3280389510 TSecr=3551293915"
"271","17:23:06.150409","64.65.63.120","192.168.0.74","TCP","66","443  >  52517 [ACK] Seq=48889 Ack=13783 Win=3139 Len=0 TSval=2614687348 TSecr=4083342311"
"272","17:23:06.166451","5.28.195.2","192.168.0.74","TCP","66","443  >  52725 [FIN, ACK] Seq=1 Ack=518 Win=67584 Len=0 TSval=3280389540 TSecr=3551293915"
"273","17:23:06.166565","192.168.0.74","5.28.195.2","TCP","66","52725  >  443 [ACK] Seq=518 Ack=2 Win=1048560 Len=0 TSval=3551293990 TSecr=3280389540"
"274","17:23:06.166701","192.168.0.74","5.28.195.2","TCP","66","52725  >  443 [FIN, ACK] Seq=518 Ack=2 Win=1048560 Len=0 TSval=3551293990 TSecr=3280389540"
"275","17:23:06.210252","5.28.195.2","192.168.0.74","TCP","56","443  >  52725 [RST] Seq=2 Win=0 Len=0"
"276","17:23:06.237818","192.168.0.74","149.154.167.41","SSL","251","Continuation Data"
"277","17:23:06.250519","192.87.28.82","192.168.0.74","TLSv1.2","602","Application Data"
"278","17:23:06.250651","192.168.0.74","192.87.28.82","TCP","66","52516  >  9001 [ACK] Seq=1609 Ack=10927 Win=9058 Len=0 TSval=163973788 TSecr=1712610085"
