"No.","Time","Source","Destination","Protocol","Length","Info"
"1","17:21:56.033298","192.168.0.74","5.28.195.2","TCP","78","52643  >  80 [SYN] Seq=0 Win=65535 Len=0 MSS=1460 WS=16 TSval=2998482121 TSecr=0 SACK_PERM"
"2","17:21:56.033320","192.168.0.74","5.28.195.2","TCP","78","52642  >  5222 [SYN] Seq=0 Win=65535 Len=0 MSS=1460 WS=16 TSval=3914890512 TSecr=0 SACK_PERM"
"3","17:21:57.034428","192.168.0.74","5.28.195.2","TCP","78","[TCP Retransmission] 52643  >  80 [SYN] Seq=0 Win=65535 Len=0 MSS=1460 WS=16 TSval=2998483122 TSecr=0 SACK_PERM"
"4","17:21:57.034498","192.168.0.74","5.28.195.2","TCP","78","[TCP Retransmission] 52642  >  5222 [SYN] Seq=0 Win=65535 Len=0 MSS=1460 WS=16 TSval=3914891513 TSecr=0 SACK_PERM"
"5","17:21:57.356734","192.168.0.74","192.87.28.82","TLSv1.2","602","Application Data"
"6","17:21:57.441296","192.87.28.82","192.168.0.74","TCP","66","9001  >  52516 [ACK] Seq=1 Ack=537 Win=3520 Len=0 TSval=1712541276 TSecr=163904892"
"7","17:21:57.463517","192.87.28.82","192.168.0.74","TLSv1.2","602","Application Data"
"8","17:21:57.463627","192.168.0.74","192.87.28.82","TCP","66","52516  >  9001 [ACK] Seq=537 Ack=537 Win=9058 Len=0 TSval=163904999 TSecr=1712541294"
"9","17:21:58.035622","192.168.0.74","5.28.195.2","TCP","78","[TCP Retransmission] 52643  >  80 [SYN] Seq=0 Win=65535 Len=0 MSS=1460 WS=16 TSval=2998484123 TSecr=0 SACK_PERM"
"10","17:21:58.035718","192.168.0.74","5.28.195.2","TCP","78","[TCP Retransmission] 52642  >  5222 [SYN] Seq=0 Win=65535 Len=0 MSS=1460 WS=16 TSval=3914892514 TSecr=0 SACK_PERM"
"11","17:21:58.059843","192.168.0.74","31.192.108.181","TCP","78","59494  >  443 [SYN, ECE, CWR] Seq=0 Win=65535 Len=0 MSS=1460 WS=64 TSval=843582490 TSecr=0 SACK_PERM TFO=R"
"12","17:21:58.108937","31.192.108.181","192.168.0.74","TCP","74","443  >  59494 [SYN, ACK, ECE] Seq=0 Ack=1 Win=43440 Len=0 MSS=1420 SACK_PERM TSval=2469571669 TSecr=843582490 WS=1024"
"13","17:21:58.109566","192.168.0.74","31.192.108.181","TCP","1474","59494  >  443 [ACK] Seq=1 Ack=1 Win=132352 Len=1408 TSval=843582540 TSecr=2469571669 [TCP PDU reassembled in 14]"
"14","17:21:58.109628","192.168.0.74","31.192.108.181","TLSv1.3","196","Client Hello (SNI=xbox-dns.ru)"
"15","17:21:58.165359","31.192.108.181","192.168.0.74","TCP","66","443  >  59494 [ACK] Seq=1 Ack=1539 Win=49152 Len=0 TSval=2469571722 TSecr=843582540"
"16","17:21:58.166609","31.192.108.181","192.168.0.74","TLSv1.3","1474","Server Hello, Change Cipher Spec, Application Data"
"17","17:21:58.166613","31.192.108.181","192.168.0.74","TLSv1.3","1072","Application Data, Application Data, Application Data"
"18","17:21:58.167903","192.168.0.74","31.192.108.181","TCP","66","59494  >  443 [ACK] Seq=1539 Ack=2415 Win=129984 Len=0 TSval=843582597 TSecr=2469571722"
"19","17:21:58.180621","192.168.0.74","31.192.108.181","TLSv1.3","130","Change Cipher Spec, Application Data"
"20","17:21:58.182912","192.168.0.74","31.192.108.181","TLSv1.3","553","Application Data"
"21","17:21:58.230902","31.192.108.181","192.168.0.74","TLSv1.3","321","Application Data"
"22","17:21:58.230904","31.192.108.181","192.168.0.74","TLSv1.3","385","Application Data, Application Data"
"23","17:21:58.230906","31.192.108.181","192.168.0.74","TLSv1.3","244","Application Data"
"24","17:21:58.230907","31.192.108.181","192.168.0.74","TLSv1.3","281","Application Data"
"25","17:21:58.231633","192.168.0.74","31.192.108.181","TCP","66","59494  >  443 [ACK] Seq=2090 Ack=3382 Win=130176 Len=0 TSval=843582662 TSecr=2469571791"
"26","17:21:58.231935","192.168.0.74","31.192.108.181","TLSv1.3","97","Application Data"
"27","17:21:58.233966","2a02:ab88:b:4100:6163:ab1b:4f48:fc2c","2a01:b740:a02:3000::1f2","NTP","110","NTP Version 4, client"
"28","17:21:58.258294","192.168.0.74","31.192.108.181","TLSv1.3","412","Application Data"
"29","17:21:58.259036","2a02:ab88:b:4100:6163:ab1b:4f48:fc2c","2a03:2880:f265:c7:face:b00c:0:167","TCP","98","56765  >  443 [SYN, ECE, CWR] Seq=0 Win=65535 Len=0 MSS=1440 WS=64 TSval=2959229168 TSecr=0 SACK_PERM"
"30","17:21:58.278419","2a01:b740:a02:3000::1f2","2a02:ab88:b:4100:6163:ab1b:4f48:fc2c","NTP","110","NTP Version 4, server"
"31","17:21:58.280830","2a02:ab88:b:4100:6163:ab1b:4f48:fc2c","2a01:b740:a08:3000::21","NTP","110","NTP Version 4, client"
"32","17:21:58.288485","2a03:2880:f265:c7:face:b00c:0:167","2a02:ab88:b:4100:6163:ab1b:4f48:fc2c","TCP","94","443  >  56765 [SYN, ACK] Seq=0 Ack=1 Win=65535 Len=0 MSS=1392 SACK_PERM TSval=456789999 TSecr=2959229168 WS=256"
"33","17:21:58.289887","2a02:ab88:b:4100:6163:ab1b:4f48:fc2c","2a03:2880:f265:c7:face:b00c:0:167","TCP","86","56765  >  443 [ACK] Seq=1 Ack=1 Win=131136 Len=0 TSval=2959229197 TSecr=456789999"
"34","17:21:58.289917","2a02:ab88:b:4100:6163:ab1b:4f48:fc2c","2a03:2880:f265:c7:face:b00c:0:167","TCP","1466","56765  >  443 [ACK] Seq=1 Ack=1 Win=131136 Len=1380 TSval=2959229199 TSecr=456789999 [TCP PDU reassembled in 35]"
"35","17:21:58.289924","2a02:ab88:b:4100:6163:ab1b:4f48:fc2c","2a03:2880:f265:c7:face:b00c:0:167","TLSv1.3","247","Client Hello (SNI=graph.whatsapp.net)"
"36","17:21:58.305887","31.192.108.181","192.168.0.74","TLSv1.3","228","Application Data"
"37","17:21:58.305889","31.192.108.181","192.168.0.74","TLSv1.3","216","Application Data"
"38","17:21:58.305890","31.192.108.181","192.168.0.74","TCP","66","443  >  59494 [ACK] Seq=3382 Ack=2467 Win=52224 Len=0 TSval=2469571866 TSecr=843582663"
"39","17:21:58.306092","192.168.0.74","31.192.108.181","TCP","66","59494  >  443 [ACK] Seq=2467 Ack=3694 Win=130816 Len=0 TSval=843582737 TSecr=2469571866"
"40","17:21:58.327480","2a01:b740:a08:3000::21","2a02:ab88:b:4100:6163:ab1b:4f48:fc2c","NTP","110","NTP Version 4, server"
"41","17:21:58.329794","2a02:ab88:b:4100:6163:ab1b:4f48:fc2c","2a01:b740:a08:3000::21","NTP","110","NTP Version 4, client"
"42","17:21:58.330638","2a03:2880:f265:c7:face:b00c:0:167","2a02:ab88:b:4100:6163:ab1b:4f48:fc2c","TCP","86","443  >  56765 [ACK] Seq=1 Ack=1542 Win=68864 Len=0 TSval=456790040 TSecr=2959229199"
"43","17:21:58.330639","2a03:2880:f265:c7:face:b00c:0:167","2a02:ab88:b:4100:6163:ab1b:4f48:fc2c","TLSv1.3","1466","Server Hello, Change Cipher Spec"
"44","17:21:58.330640","2a03:2880:f265:c7:face:b00c:0:167","2a02:ab88:b:4100:6163:ab1b:4f48:fc2c","TLSv1.3","1466","Application Data"
"45","17:21:58.331114","2a02:ab88:b:4100:6163:ab1b:4f48:fc2c","2a03:2880:f265:c7:face:b00c:0:167","TCP","86","56765  >  443 [ACK] Seq=1542 Ack=2761 Win=128384 Len=0 TSval=2959229239 TSecr=456790041"
"46","17:21:58.332619","2a03:2880:f265:c7:face:b00c:0:167","2a02:ab88:b:4100:6163:ab1b:4f48:fc2c","TLSv1.3","829","Application Data"
"47","17:21:58.332952","2a02:ab88:b:4100:6163:ab1b:4f48:fc2c","2a03:2880:f265:c7:face:b00c:0:167","TCP","86","56765  >  443 [ACK] Seq=1542 Ack=3504 Win=130368 Len=0 TSval=2959229241 TSecr=456790041"
"48","17:21:58.345959","2a02:ab88:b:4100:6163:ab1b:4f48:fc2c","2a03:2880:f265:c7:face:b00c:0:167","TLSv1.3","150","Change Cipher Spec, Application Data"
"49","17:21:58.346811","2a02:ab88:b:4100:6163:ab1b:4f48:fc2c","2a03:2880:f265:c7:face:b00c:0:167","TLSv1.3","481","Application Data"
"50","17:21:58.346972","2a02:ab88:b:4100:6163:ab1b:4f48:fc2c","2a03:2880:f265:c7:face:b00c:0:167","TLSv1.3","350","Application Data"
"51","17:21:58.378352","2a01:b740:a08:3000::21","2a02:ab88:b:4100:6163:ab1b:4f48:fc2c","NTP","110","NTP Version 4, server"
"52","17:21:58.378354","2a03:2880:f265:c7:face:b00c:0:167","2a02:ab88:b:4100:6163:ab1b:4f48:fc2c","TLSv1.3","265","Application Data"
"53","17:21:58.378355","2a03:2880:f265:c7:face:b00c:0:167","2a02:ab88:b:4100:6163:ab1b:4f48:fc2c","TLSv1.3","160","Application Data"
"54","17:21:58.378605","2a02:ab88:b:4100:6163:ab1b:4f48:fc2c","2a03:2880:f265:c7:face:b00c:0:167","TCP","86","56765  >  443 [ACK] Seq=2265 Ack=3757 Win=130880 Len=0 TSval=2959229287 TSecr=456790091"
"55","17:21:58.378673","2a02:ab88:b:4100:6163:ab1b:4f48:fc2c","2a03:2880:f265:c7:face:b00c:0:167","TLSv1.3","117","Application Data"
"56","17:21:58.381627","2a03:2880:f265:c7:face:b00c:0:167","2a02:ab88:b:4100:6163:ab1b:4f48:fc2c","TLSv1.3","130","Application Data"
"57","17:21:58.381784","2a02:ab88:b:4100:6163:ab1b:4f48:fc2c","2a03:2880:f265:c7:face:b00c:0:167","TCP","86","56765  >  443 [ACK] Seq=2296 Ack=3801 Win=131072 Len=0 TSval=2959229290 TSecr=456790094"
"58","17:21:58.442932","2a03:2880:f265:c7:face:b00c:0:167","2a02:ab88:b:4100:6163:ab1b:4f48:fc2c","TCP","86","443  >  56765 [ACK] Seq=3801 Ack=2296 Win=74240 Len=0 TSval=456790156 TSecr=2959229287"
"59","17:21:58.508413","2a02:ab88:b:4100:6163:ab1b:4f48:fc2c","2603:1063:7::c9","TLSv1.2","136","Application Data"
"60","17:21:58.515521","2a03:2880:f265:c7:face:b00c:0:167","2a02:ab88:b:4100:6163:ab1b:4f48:fc2c","TLSv1.3","568","Application Data"
"61","17:21:58.515766","2a02:ab88:b:4100:6163:ab1b:4f48:fc2c","2a03:2880:f265:c7:face:b00c:0:167","TCP","86","56765  >  443 [ACK] Seq=2296 Ack=4283 Win=130624 Len=0 TSval=2959229424 TSecr=456790228"
"62","17:21:58.521004","2a02:ab88:b:4100:6163:ab1b:4f48:fc2c","2a03:2880:f265:c7:face:b00c:0:167","TLSv1.3","125","Application Data"
"63","17:21:58.521232","2a02:ab88:b:4100:6163:ab1b:4f48:fc2c","2a03:2880:f265:c7:face:b00c:0:167","TLSv1.3","110","Application Data"
"64","17:21:58.521502","2a02:ab88:b:4100:6163:ab1b:4f48:fc2c","2a03:2880:f265:c7:face:b00c:0:167","TCP","86","56765  >  443 [FIN, ACK] Seq=2359 Ack=4283 Win=131072 Len=0 TSval=2959229430 TSecr=456790228"
"65","17:21:58.546432","2a03:2880:f265:c7:face:b00c:0:167","2a02:ab88:b:4100:6163:ab1b:4f48:fc2c","TCP","86","443  >  56765 [ACK] Seq=4283 Ack=2335 Win=74240 Len=0 TSval=456790259 TSecr=2959229430"
"66","17:21:58.546434","2a03:2880:f265:c7:face:b00c:0:167","2a02:ab88:b:4100:6163:ab1b:4f48:fc2c","TCP","86","443  >  56765 [ACK] Seq=4283 Ack=2359 Win=74240 Len=0 TSval=456790259 TSecr=2959229430"
"67","17:21:58.546435","2a03:2880:f265:c7:face:b00c:0:167","2a02:ab88:b:4100:6163:ab1b:4f48:fc2c","TLSv1.3","110","Application Data"
"68","17:21:58.546598","2a02:ab88:b:4100:6163:ab1b:4f48:fc2c","2a03:2880:f265:c7:face:b00c:0:167","TCP","74","56765  >  443 [RST] Seq=2359 Win=0 Len=0"
"69","17:21:58.547640","2a03:2880:f265:c7:face:b00c:0:167","2a02:ab88:b:4100:6163:ab1b:4f48:fc2c","TCP","86","443  >  56765 [FIN, ACK] Seq=4307 Ack=2359 Win=74240 Len=0 TSval=456790259 TSecr=2959229430"
"70","17:21:58.547736","2a02:ab88:b:4100:6163:ab1b:4f48:fc2c","2a03:2880:f265:c7:face:b00c:0:167","TCP","74","56765  >  443 [RST] Seq=2359 Win=0 Len=0"
"71","17:21:58.552939","2a03:2880:f265:c7:face:b00c:0:167","2a02:ab88:b:4100:6163:ab1b:4f48:fc2c","TCP","86","443  >  56765 [ACK] Seq=4308 Ack=2360 Win=74240 Len=0 TSval=456790263 TSecr=2959229430"
"72","17:21:58.553007","2a02:ab88:b:4100:6163:ab1b:4f48:fc2c","2a03:2880:f265:c7:face:b00c:0:167","TCP","74","56765  >  443 [RST] Seq=2360 Win=0 Len=0"
"73","17:21:58.559142","2603:1063:7::c9","2a02:ab88:b:4100:6163:ab1b:4f48:fc2c","TLSv1.2","125","Application Data"
"74","17:21:58.559218","2a02:ab88:b:4100:6163:ab1b:4f48:fc2c","2603:1063:7::c9","TCP","86","51661  >  443 [ACK] Seq=51 Ack=40 Win=2048 Len=0 TSval=3584710560 TSecr=2401754389"
"75","17:21:58.749121","192.42.113.102","192.168.0.74","TLSv1.2","602","Application Data"
"76","17:21:58.749565","192.168.0.74","192.42.113.102","TCP","66","52512  >  9001 [ACK] Seq=1 Ack=537 Win=11244 Len=0 TSval=3151860352 TSecr=992702249"
"77","17:21:59.502689","fe80::49c:fb07:3c9a:aa62","fe80::ae22:5ff:feaa:607e","ICMPv6","86","Neighbor Solicitation for fe80::ae22:5ff:feaa:607e from ee:99:94:f5:59:fd"
"78","17:21:59.516484","fe80::ae22:5ff:feaa:607e","fe80::49c:fb07:3c9a:aa62","ICMPv6","78","Neighbor Advertisement fe80::ae22:5ff:feaa:607e (rtr, sol)"
"79","17:21:59.705973","192.168.0.74","64.65.63.120","TLSv1.2","602","Application Data"
"80","17:21:59.745767","64.65.63.120","192.168.0.74","TCP","66","443  >  52517 [ACK] Seq=1 Ack=537 Win=2540 Len=0 TSval=2614620942 TSecr=4083275901"
"81","17:21:59.801856","192.168.0.74","78.80.158.218","TCP","62","52511  >  433 [SYN] Seq=0 Win=65535 Len=0 MSS=1460 SACK_PERM"
"82","17:22:00.031785","192.168.0.74","5.28.195.2","TCP","78","52647  >  80 [SYN, ECE, CWR] Seq=0 Win=65535 Len=0 MSS=1460 WS=16 TSval=1426251406 TSecr=0 SACK_PERM"
"83","17:22:00.031792","192.168.0.74","5.28.195.2","TCP","78","52646  >  443 [SYN, ECE, CWR] Seq=0 Win=65535 Len=0 MSS=1460 WS=16 TSval=1063683351 TSecr=0 SACK_PERM"
"84","17:22:00.031794","192.168.0.74","5.28.195.2","TCP","78","52648  >  5222 [SYN, ECE, CWR] Seq=0 Win=65535 Len=0 MSS=1460 WS=16 TSval=3274230832 TSecr=0 SACK_PERM"
"85","17:22:00.080033","5.28.195.2","192.168.0.74","TCP","74","443  >  52646 [SYN, ACK, ECE] Seq=0 Ack=1 Win=65535 Len=0 MSS=1240 SACK_PERM TSval=2924281122 TSecr=1063683351 WS=1024"
"86","17:22:00.080276","192.168.0.74","5.28.195.2","TCP","66","52646  >  443 [ACK] Seq=1 Ack=1 Win=1048560 Len=0 TSval=1063683400 TSecr=2924281122"
"87","17:22:00.080506","192.168.0.74","5.28.195.2","TLSv1","583","Client Hello"
"88","17:22:00.086937","2a00:ab00:533:6::100","2a02:ab88:b:4100:6163:ab1b:4f48:fc2c","TCP","86","443  >  56753 [ACK] Seq=1 Ack=1 Win=1784 Len=0 TSval=3010054445 TSecr=743823655"
"89","17:22:00.087262","2a02:ab88:b:4100:6163:ab1b:4f48:fc2c","2a00:ab00:533:6::100","TCP","86","[TCP ACKed unseen segment] 56753  >  443 [ACK] Seq=1 Ack=2 Win=2048 Len=0 TSval=743838858 TSecr=3010008287"
"90","17:22:00.132750","5.28.195.2","192.168.0.74","TCP","66","443  >  52646 [ACK] Seq=1 Ack=518 Win=67584 Len=0 TSval=2924281173 TSecr=1063683400"
"91","17:22:00.170425","5.28.195.2","192.168.0.74","TCP","66","443  >  52646 [FIN, ACK] Seq=1 Ack=518 Win=67584 Len=0 TSval=2924281212 TSecr=1063683400"
"92","17:22:00.170644","192.168.0.74","5.28.195.2","TCP","66","52646  >  443 [ACK] Seq=518 Ack=2 Win=1048560 Len=0 TSval=1063683490 TSecr=2924281212"
"93","17:22:00.170955","192.168.0.74","5.28.195.2","TCP","66","52646  >  443 [FIN, ACK] Seq=518 Ack=2 Win=1048560 Len=0 TSval=1063683491 TSecr=2924281212"
"94","17:22:00.220044","5.28.195.2","192.168.0.74","TCP","56","443  >  52646 [RST] Seq=2 Win=0 Len=0"
"95","17:22:00.961881","2a00:1450:400d:808::200e","2a02:ab88:b:4100:6163:ab1b:4f48:fc2c","TLSv1.2","311","Application Data"
"96","17:22:00.962558","2a02:ab88:b:4100:6163:ab1b:4f48:fc2c","2a00:1450:400d:808::200e","TCP","86","56683  >  443 [ACK] Seq=1 Ack=226 Win=2045 Len=0 TSval=1895689246 TSecr=2234482388"
"97","17:22:01.032281","192.168.0.74","5.28.195.2","TCP","78","[TCP Retransmission] 52648  >  5222 [SYN] Seq=0 Win=65535 Len=0 MSS=1460 WS=16 TSval=3274231833 TSecr=0 SACK_PERM"
"98","17:22:01.032354","192.168.0.74","5.28.195.2","TCP","78","[TCP Retransmission] 52647  >  80 [SYN] Seq=0 Win=65535 Len=0 MSS=1460 WS=16 TSval=1426252407 TSecr=0 SACK_PERM"
"99","17:22:01.666232","192.168.0.74","64.65.63.120","TLSv1.2","602","Application Data"
"100","17:22:01.711787","64.65.63.120","192.168.0.74","TCP","66","443  >  52517 [ACK] Seq=1 Ack=1073 Win=2549 Len=0 TSval=2614622909 TSecr=4083277861"
"101","17:22:02.032276","192.168.0.74","5.28.195.2","TCP","78","[TCP Retransmission] 52648  >  5222 [SYN] Seq=0 Win=65535 Len=0 MSS=1460 WS=16 TSval=3274232833 TSecr=0 SACK_PERM"
"102","17:22:02.032334","192.168.0.74","5.28.195.2","TCP","78","[TCP Retransmission] 52647  >  80 [SYN] Seq=0 Win=65535 Len=0 MSS=1460 WS=16 TSval=1426253407 TSecr=0 SACK_PERM"
"103","17:22:02.163179","64.65.63.120","192.168.0.74","TLSv1.2","602","Application Data"
"104","17:22:02.163417","192.168.0.74","64.65.63.120","TCP","66","52517  >  443 [ACK] Seq=1073 Ack=537 Win=18782 Len=0 TSval=4083278358 TSecr=2614623358"
"105","17:22:02.509829","192.168.0.74","5.28.195.2","TCP","78","52649  >  443 [SYN, ECE, CWR] Seq=0 Win=65535 Len=0 MSS=1460 WS=16 TSval=410593870 TSecr=0 SACK_PERM"
"106","17:22:02.554531","5.28.195.2","192.168.0.74","TCP","74","443  >  52649 [SYN, ACK, ECE] Seq=0 Ack=1 Win=65535 Len=0 MSS=1240 SACK_PERM TSval=3030635723 TSecr=410593870 WS=1024"
"107","17:22:02.554771","192.168.0.74","5.28.195.2","TCP","66","52649  >  443 [ACK] Seq=1 Ack=1 Win=1048560 Len=0 TSval=410593915 TSecr=3030635723"
"108","17:22:02.555044","192.168.0.74","5.28.195.2","TLSv1","583","Client Hello"
"109","17:22:02.597978","5.28.195.2","192.168.0.74","TCP","66","443  >  52649 [ACK] Seq=1 Ack=518 Win=67584 Len=0 TSval=3030635821 TSecr=410593916"
"110","17:22:02.597981","5.28.195.2","192.168.0.74","TCP","66","443  >  52649 [FIN, ACK] Seq=1 Ack=518 Win=67584 Len=0 TSval=3030635821 TSecr=410593916"
"111","17:22:02.598191","192.168.0.74","5.28.195.2","TCP","66","52649  >  443 [ACK] Seq=518 Ack=2 Win=1048560 Len=0 TSval=410593959 TSecr=3030635821"
"112","17:22:02.598434","192.168.0.74","5.28.195.2","TCP","66","52649  >  443 [FIN, ACK] Seq=518 Ack=2 Win=1048560 Len=0 TSval=410593959 TSecr=3030635821"
"113","17:22:02.625245","192.168.0.74","5.28.195.2","TCP","78","52650  >  443 [SYN, ECE, CWR] Seq=0 Win=65535 Len=0 MSS=1460 WS=16 TSval=2486631598 TSecr=0 SACK_PERM"
"114","17:22:02.639431","5.28.195.2","192.168.0.74","TCP","56","443  >  52649 [RST] Seq=2 Win=0 Len=0"
"115","17:22:02.661696","5.28.195.2","192.168.0.74","TCP","74","443  >  52650 [SYN, ACK, ECE] Seq=0 Ack=1 Win=65535 Len=0 MSS=1240 SACK_PERM TSval=3030635886 TSecr=2486631598 WS=1024"
"116","17:22:02.661939","192.168.0.74","5.28.195.2","TCP","66","52650  >  443 [ACK] Seq=1 Ack=1 Win=1048560 Len=0 TSval=2486631635 TSecr=3030635886"
"117","17:22:02.662231","192.168.0.74","5.28.195.2","TLSv1","583","Client Hello"
"118","17:22:02.703106","5.28.195.2","192.168.0.74","TCP","66","443  >  52650 [ACK] Seq=1 Ack=518 Win=67584 Len=0 TSval=3030635927 TSecr=2486631635"
"119","17:22:02.703109","5.28.195.2","192.168.0.74","TCP","66","443  >  52650 [FIN, ACK] Seq=1 Ack=518 Win=67584 Len=0 TSval=3030635927 TSecr=2486631635"
"120","17:22:02.703370","192.168.0.74","5.28.195.2","TCP","66","52650  >  443 [ACK] Seq=518 Ack=2 Win=1048560 Len=0 TSval=2486631676 TSecr=3030635927"
"121","17:22:02.703641","192.168.0.74","5.28.195.2","TCP","66","52650  >  443 [FIN, ACK] Seq=518 Ack=2 Win=1048560 Len=0 TSval=2486631676 TSecr=3030635927"
"122","17:22:02.748175","5.28.195.2","192.168.0.74","TCP","56","443  >  52650 [RST] Seq=2 Win=0 Len=0"
"123","17:22:02.864865","192.87.28.82","192.168.0.74","TLSv1.2","602","Application Data"
"124","17:22:02.865088","192.168.0.74","192.87.28.82","TCP","66","52516  >  9001 [ACK] Seq=537 Ack=1073 Win=9058 Len=0 TSval=163910401 TSecr=1712546693"
"125","17:22:03.033714","192.168.0.74","5.28.195.2","TCP","78","[TCP Retransmission] 52648  >  5222 [SYN] Seq=0 Win=65535 Len=0 MSS=1460 WS=16 TSval=3274233834 TSecr=0 SACK_PERM"
"126","17:22:03.033784","192.168.0.74","5.28.195.2","TCP","78","[TCP Retransmission] 52647  >  80 [SYN] Seq=0 Win=65535 Len=0 MSS=1460 WS=16 TSval=1426254408 TSecr=0 SACK_PERM"
"127","17:22:04.034537","192.168.0.74","5.28.195.2","TCP","78","[TCP Retransmission] 52648  >  5222 [SYN] Seq=0 Win=65535 Len=0 MSS=1460 WS=16 TSval=3274234835 TSecr=0 SACK_PERM"
"128","17:22:04.034626","192.168.0.74","5.28.195.2","TCP","78","[TCP Retransmission] 52647  >  80 [SYN] Seq=0 Win=65535 Len=0 MSS=1460 WS=16 TSval=1426255409 TSecr=0 SACK_PERM"
"129","17:22:04.476161","192.168.0.74","149.154.167.41","SSL","315","Continuation Data"
"130","17:22:04.533189","149.154.167.41","192.168.0.74","TCP","70","443  >  51643 [PSH, ACK] Seq=1 Ack=250 Win=2048 Len=4 TSval=1826391347 TSecr=2408167234 [TCP PDU reassembled in 132]"
"131","17:22:04.533442","192.168.0.74","149.154.167.41","SSL","299","Continuation Data"
"132","17:22:04.574969","149.154.167.41","192.168.0.74","SSL","70","Continuation Data"
"133","17:22:04.575131","192.168.0.74","149.154.167.41","TCP","66","51643  >  443 [ACK] Seq=483 Ack=9 Win=65535 Len=0 TSval=2408167333 TSecr=1826391388"
"134","17:22:04.665414","149.154.167.41","192.168.0.74","SSL","267","Continuation Data"
"135","17:22:04.665622","192.168.0.74","149.154.167.41","TCP","66","51643  >  443 [ACK] Seq=483 Ack=210 Win=65524 Len=0 TSval=2408167423 TSecr=1826391469"
"136","17:22:04.678074","149.154.167.41","192.168.0.74","SSL","219","Continuation Data"
"137","17:22:04.678296","192.168.0.74","149.154.167.41","TCP","66","51643  >  443 [ACK] Seq=483 Ack=363 Win=65527 Len=0 TSval=2408167436 TSecr=1826391493"
"138","17:22:05.262937","CompalBroadb_aa:60:7e","ee:99:94:f5:59:fd","ARP","56","Who has 192.168.0.74? Tell 192.168.0.1"
"139","17:22:05.263061","ee:99:94:f5:59:fd","CompalBroadb_aa:60:7e","ARP","42","192.168.0.74 is at ee:99:94:f5:59:fd"
"140","17:22:05.774912","192.87.28.82","192.168.0.74","TLSv1.2","602","Application Data"
"141","17:22:05.775177","192.168.0.74","192.87.28.82","TCP","66","52516  >  9001 [ACK] Seq=537 Ack=1609 Win=9058 Len=0 TSval=163913311 TSecr=1712549410"
"142","17:22:06.033079","192.168.0.74","5.28.195.2","TCP","78","52651  >  443 [SYN, ECE, CWR] Seq=0 Win=65535 Len=0 MSS=1460 WS=16 TSval=3863858181 TSecr=0 SACK_PERM"
"143","17:22:06.033157","192.168.0.74","5.28.195.2","TCP","78","52652  >  80 [SYN, ECE, CWR] Seq=0 Win=65535 Len=0 MSS=1460 WS=16 TSval=3994026328 TSecr=0 SACK_PERM"
"144","17:22:06.033411","192.168.0.74","5.28.195.2","TCP","78","52653  >  5222 [SYN, ECE, CWR] Seq=0 Win=65535 Len=0 MSS=1460 WS=16 TSval=3066859 TSecr=0 SACK_PERM"
"145","17:22:06.053662","192.168.0.74","64.65.63.120","TLSv1.2","602","Application Data"
"146","17:22:06.078796","5.28.195.2","192.168.0.74","TCP","74","443  >  52651 [SYN, ACK, ECE] Seq=0 Ack=1 Win=65535 Len=0 MSS=1240 SACK_PERM TSval=3031534616 TSecr=3863858181 WS=1024"
"147","17:22:06.078913","192.168.0.74","5.28.195.2","TCP","66","52651  >  443 [ACK] Seq=1 Ack=1 Win=1048560 Len=0 TSval=3863858227 TSecr=3031534616"
"148","17:22:06.079067","192.168.0.74","5.28.195.2","TLSv1","583","Client Hello"
"149","17:22:06.092956","64.65.63.120","192.168.0.74","TCP","66","443  >  52517 [ACK] Seq=537 Ack=1609 Win=2557 Len=0 TSval=2614627289 TSecr=4083282248"
"150","17:22:06.121482","5.28.195.2","192.168.0.74","TCP","66","443  >  52651 [ACK] Seq=1 Ack=518 Win=67584 Len=0 TSval=3031534685 TSecr=3863858227"
"151","17:22:06.153459","5.28.195.2","192.168.0.74","TCP","66","443  >  52651 [FIN, ACK] Seq=1 Ack=518 Win=67584 Len=0 TSval=3031534720 TSecr=3863858227"
"152","17:22:06.153603","192.168.0.74","5.28.195.2","TCP","66","52651  >  443 [ACK] Seq=518 Ack=2 Win=1048560 Len=0 TSval=3863858301 TSecr=3031534720"
"153","17:22:06.153807","192.168.0.74","5.28.195.2","TCP","66","52651  >  443 [FIN, ACK] Seq=518 Ack=2 Win=1048560 Len=0 TSval=3863858301 TSecr=3031534720"
"154","17:22:06.163218","16.170.124.74","192.168.0.74","TLSv1.2","122","Application Data"
"155","17:22:06.163482","192.168.0.74","16.170.124.74","TCP","66","59484  >  443 [ACK] Seq=1 Ack=57 Win=2048 Len=0 TSval=3087596487 TSecr=1108502015"
"156","17:22:06.163793","192.168.0.74","16.170.124.74","TCP","54","59484  >  443 [RST, ACK] Seq=1 Ack=57 Win=2048 Len=0"
"157","17:22:06.170001","192.87.28.82","192.168.0.74","TLSv1.2","602","Application Data"
"158","17:22:06.170174","192.168.0.74","192.87.28.82","TCP","66","52516  >  9001 [ACK] Seq=537 Ack=2145 Win=9058 Len=0 TSval=163913706 TSecr=1712550002"
"159","17:22:06.171377","192.168.0.74","64.65.63.120","TCP","1474","52517  >  443 [ACK] Seq=1609 Ack=537 Win=18790 Len=1408 TSval=4083282366 TSecr=2614627289 [TCP PDU reassembled in 160]"
"160","17:22:06.171401","192.168.0.74","64.65.63.120","TLSv1.2","736","Application Data"
"161","17:22:06.203886","5.28.195.2","192.168.0.74","TCP","56","443  >  52651 [RST] Seq=2 Win=0 Len=0"
"162","17:22:06.212400","64.65.63.120","192.168.0.74","TCP","66","443  >  52517 [ACK] Seq=537 Ack=3017 Win=2580 Len=0 TSval=2614627409 TSecr=4083282366"
"163","17:22:06.212402","64.65.63.120","192.168.0.74","TCP","66","443  >  52517 [ACK] Seq=537 Ack=3687 Win=2602 Len=0 TSval=2614627409 TSecr=4083282366"
"164","17:22:06.273741","16.170.124.74","192.168.0.74","TLSv1.2","122","Application Data"
"165","17:22:06.274428","192.168.0.74","16.170.124.74","TCP","66","59483  >  443 [ACK] Seq=1 Ack=57 Win=2048 Len=0 TSval=3454557892 TSecr=1241579509"
"166","17:22:06.274940","192.168.0.74","16.170.124.74","TCP","54","59483  >  443 [RST, ACK] Seq=1 Ack=57 Win=2048 Len=0"
"167","17:22:06.291374","192.87.28.82","192.168.0.74","TCP","1474","9001  >  52516 [ACK] Seq=2145 Ack=537 Win=3520 Len=1408 TSval=1712550127 TSecr=163913706 [TCP PDU reassembled in 169]"
"168","17:22:06.291378","192.87.28.82","192.168.0.74","TCP","1474","9001  >  52516 [ACK] Seq=3553 Ack=537 Win=3520 Len=1408 TSval=1712550127 TSecr=163913706 [TCP PDU reassembled in 169]"
"169","17:22:06.291384","192.87.28.82","192.168.0.74","TLSv1.2","870","Application Data"
"170","17:22:06.291613","192.168.0.74","192.87.28.82","TCP","66","52516  >  9001 [ACK] Seq=537 Ack=5765 Win=9010 Len=0 TSval=163913827 TSecr=1712550127"
"171","17:22:06.291883","192.168.0.74","192.87.28.82","TCP","66","[TCP Window Update] 52516  >  9001 [ACK] Seq=537 Ack=5765 Win=9066 Len=0 TSval=163913828 TSecr=1712550127"
"172","17:22:06.331638","192.87.28.82","192.168.0.74","TCP","1474","9001  >  52516 [ACK] Seq=5765 Ack=537 Win=3520 Len=1408 TSval=1712550168 TSecr=163913828 [TCP PDU reassembled in 174]"
"173","17:22:06.331642","192.87.28.82","192.168.0.74","TCP","1474","9001  >  52516 [ACK] Seq=7173 Ack=537 Win=3520 Len=1408 TSval=1712550168 TSecr=163913828 [TCP PDU reassembled in 174]"
"174","17:22:06.331646","192.87.28.82","192.168.0.74","TLSv1.2","870","Application Data"
"175","17:22:06.331840","192.168.0.74","192.87.28.82","TCP","66","52516  >  9001 [ACK] Seq=537 Ack=9385 Win=9010 Len=0 TSval=163913867 TSecr=1712550168"
"176","17:22:06.332085","192.168.0.74","192.87.28.82","TCP","66","[TCP Window Update] 52516  >  9001 [ACK] Seq=537 Ack=9385 Win=9066 Len=0 TSval=163913868 TSecr=1712550168"
"177","17:22:06.337917","192.168.0.74","64.65.63.120","TLSv1.2","602","Application Data"
"178","17:22:06.373581","64.65.63.120","192.168.0.74","TCP","66","443  >  52517 [ACK] Seq=537 Ack=4223 Win=2624 Len=0 TSval=2614627572 TSecr=4083282533"
"179","17:22:06.373761","192.168.0.74","64.65.63.120","TLSv1.2","602","Application Data"
"180","17:22:06.408904","64.65.63.120","192.168.0.74","TCP","66","443  >  52517 [ACK] Seq=537 Ack=4759 Win=2632 Len=0 TSval=2614627607 TSecr=4083282568"
"181","17:22:06.482721","192.87.28.82","192.168.0.74","TLSv1.2","1116","Application Data"
"182","17:22:06.482823","192.168.0.74","192.87.28.82","TCP","66","52516  >  9001 [ACK] Seq=537 Ack=10435 Win=9050 Len=0 TSval=163914019 TSecr=1712550313"
"183","17:22:06.483412","192.168.0.74","64.65.63.120","TLSv1.2","602","Application Data"
"184","17:22:06.517937","64.65.63.120","192.168.0.74","TCP","66","443  >  52517 [ACK] Seq=537 Ack=5295 Win=2641 Len=0 TSval=2614627716 TSecr=4083282678"
"185","17:22:06.531003","192.87.28.82","192.168.0.74","TLSv1.2","602","Application Data"
"186","17:22:06.531221","192.168.0.74","192.87.28.82","TCP","66","52516  >  9001 [ACK] Seq=537 Ack=10971 Win=9058 Len=0 TSval=163914067 TSecr=1712550363"
"187","17:22:06.563110","192.87.28.82","192.168.0.74","TCP","1474","9001  >  52516 [ACK] Seq=10971 Ack=537 Win=3520 Len=1408 TSval=1712550396 TSecr=163914019 [TCP PDU reassembled in 189]"
"188","17:22:06.563114","192.87.28.82","192.168.0.74","TCP","1474","9001  >  52516 [ACK] Seq=12379 Ack=537 Win=3520 Len=1408 TSval=1712550396 TSecr=163914019 [TCP PDU reassembled in 189]"
"189","17:22:06.563117","192.87.28.82","192.168.0.74","TLSv1.2","870","Application Data"
"190","17:22:06.563316","192.168.0.74","192.87.28.82","TCP","66","52516  >  9001 [ACK] Seq=537 Ack=14591 Win=9010 Len=0 TSval=163914099 TSecr=1712550396"
"191","17:22:06.563559","192.168.0.74","192.87.28.82","TCP","66","[TCP Window Update] 52516  >  9001 [ACK] Seq=537 Ack=14591 Win=9066 Len=0 TSval=163914099 TSecr=1712550396"
"192","17:22:06.570962","192.87.28.82","192.168.0.74","TCP","1474","9001  >  52516 [ACK] Seq=14591 Ack=537 Win=3520 Len=1408 TSval=1712550405 TSecr=163914067 [TCP PDU reassembled in 194]"
"193","17:22:06.570965","192.87.28.82","192.168.0.74","TCP","1474","9001  >  52516 [ACK] Seq=15999 Ack=537 Win=3520 Len=1408 TSval=1712550405 TSecr=163914067 [TCP PDU reassembled in 194]"
"194","17:22:06.570966","192.87.28.82","192.168.0.74","TLSv1.2","1320","Application Data"
"195","17:22:06.570968","192.87.28.82","192.168.0.74","TCP","1474","9001  >  52516 [ACK] Seq=18661 Ack=537 Win=3520 Len=1408 TSval=1712550405 TSecr=163914067 [TCP PDU reassembled in 196]"
"196","17:22:06.570970","192.87.28.82","192.168.0.74","TLSv1.2","800","Application Data"
"197","17:22:06.571116","192.168.0.74","192.87.28.82","TCP","66","52516  >  9001 [ACK] Seq=537 Ack=20803 Win=8969 Len=0 TSval=163914107 TSecr=1712550405"
"198","17:22:06.571336","192.168.0.74","192.87.28.82","TCP","66","[TCP Window Update] 52516  >  9001 [ACK] Seq=537 Ack=20803 Win=9066 Len=0 TSval=163914107 TSecr=1712550405"
"199","17:22:06.571617","192.168.0.74","192.87.28.82","TLSv1.2","602","Application Data"
"200","17:22:06.583153","192.87.28.82","192.168.0.74","TCP","1474","9001  >  52516 [ACK] Seq=20803 Ack=537 Win=3520 Len=1408 TSval=1712550418 TSecr=163914067 [TCP PDU reassembled in 201]"
"201","17:22:06.583156","192.87.28.82","192.168.0.74","TLSv1.2","736","Application Data"
"202","17:22:06.583280","192.168.0.74","192.87.28.82","TCP","66","52516  >  9001 [ACK] Seq=1073 Ack=22881 Win=9034 Len=0 TSval=163914119 TSecr=1712550418"
"203","17:22:06.592511","16.170.124.74","192.168.0.74","TLSv1.2","122","Application Data"
"204","17:22:06.592873","192.168.0.74","16.170.124.74","TCP","66","59485  >  443 [ACK] Seq=1 Ack=57 Win=2048 Len=0 TSval=2838149864 TSecr=1739401186"
"205","17:22:06.593128","192.168.0.74","16.170.124.74","TCP","54","59485  >  443 [RST, ACK] Seq=1 Ack=57 Win=2048 Len=0"
"206","17:22:06.617300","192.87.28.82","192.168.0.74","TLSv1.2","1116","Application Data"
"207","17:22:06.617401","192.168.0.74","192.87.28.82","TCP","66","52516  >  9001 [ACK] Seq=1073 Ack=23931 Win=9050 Len=0 TSval=163914153 TSecr=1712550452"
"208","17:22:06.623492","192.168.0.74","64.65.63.120","TLSv1.2","602","Application Data"
"209","17:22:06.624808","192.168.0.74","64.65.63.120","TCP","1474","52517  >  443 [ACK] Seq=5831 Ack=537 Win=18790 Len=1408 TSval=4083282820 TSecr=2614627716 [TCP PDU reassembled in 210]"
"210","17:22:06.624830","192.168.0.74","64.65.63.120","TLSv1.2","736","Application Data"
"211","17:22:06.629869","192.168.0.74","64.65.63.120","TLSv1.2","1474","Application Data, Application Data"
"212","17:22:06.629872","192.168.0.74","64.65.63.120","TCP","1474","52517  >  443 [ACK] Seq=9317 Ack=537 Win=18790 Len=1408 TSval=4083282825 TSecr=2614627716 [TCP PDU reassembled in 213]"
"213","17:22:06.629892","192.168.0.74","64.65.63.120","TLSv1.2","400","Application Data"
"214","17:22:06.659187","64.65.63.120","192.168.0.74","TCP","66","443  >  52517 [ACK] Seq=537 Ack=5831 Win=2649 Len=0 TSval=2614627857 TSecr=4083282818"
"215","17:22:06.663673","64.65.63.120","192.168.0.74","TCP","66","443  >  52517 [ACK] Seq=537 Ack=7909 Win=2633 Len=0 TSval=2614627862 TSecr=4083282820"
"216","17:22:06.668210","64.65.63.120","192.168.0.74","TCP","66","443  >  52517 [ACK] Seq=537 Ack=10725 Win=2611 Len=0 TSval=2614627867 TSecr=4083282825"
"217","17:22:06.668211","64.65.63.120","192.168.0.74","TCP","66","443  >  52517 [ACK] Seq=537 Ack=11059 Win=2609 Len=0 TSval=2614627867 TSecr=4083282825"
"218","17:22:06.668317","192.168.0.74","64.65.63.120","TLSv1.2","602","Application Data"
"219","17:22:06.695262","2a02:ab88:b:4100:6163:ab1b:4f48:fc2c","2a00:1450:400d:808::200e","TLSv1.2","125","Application Data"
"220","17:22:06.703899","64.65.63.120","192.168.0.74","TCP","66","443  >  52517 [ACK] Seq=537 Ack=11595 Win=2605 Len=0 TSval=2614627902 TSecr=4083282863"
"221","17:22:06.711364","2a00:1450:400d:808::200e","2a02:ab88:b:4100:6163:ab1b:4f48:fc2c","TLSv1.2","125","Application Data"
"222","17:22:06.711582","2a02:ab88:b:4100:6163:ab1b:4f48:fc2c","2a00:1450:400d:808::200e","TCP","86","56683  >  443 [ACK] Seq=40 Ack=265 Win=2048 Len=0 TSval=1895694995 TSecr=2234488317"
"223","17:22:06.740635","192.87.28.82","192.168.0.74","TCP","1474","9001  >  52516 [ACK] Seq=23931 Ack=1073 Win=3520 Len=1408 TSval=1712550573 TSecr=163914153 [TCP PDU reassembled in 225]"
"224","17:22:06.740638","192.87.28.82","192.168.0.74","TCP","1474","9001  >  52516 [ACK] Seq=25339 Ack=1073 Win=3520 Len=1408 TSval=1712550573 TSecr=163914153 [TCP PDU reassembled in 225]"
"225","17:22:06.740639","192.87.28.82","192.168.0.74","TLSv1.2","870","Application Data"
"226","17:22:06.740793","192.168.0.74","192.87.28.82","TCP","66","52516  >  9001 [ACK] Seq=1073 Ack=27551 Win=9010 Len=0 TSval=163914276 TSecr=1712550573"
"227","17:22:06.740941","192.168.0.74","192.87.28.82","TCP","66","[TCP Window Update] 52516  >  9001 [ACK] Seq=1073 Ack=27551 Win=9066 Len=0 TSval=163914277 TSecr=1712550573"
"228","17:22:06.750555","192.87.28.82","192.168.0.74","TCP","1474","9001  >  52516 [ACK] Seq=27551 Ack=1073 Win=3520 Len=1408 TSval=1712550583 TSecr=163914153 [TCP PDU reassembled in 230]"
"229","17:22:06.750558","192.87.28.82","192.168.0.74","TCP","1474","9001  >  52516 [ACK] Seq=28959 Ack=1073 Win=3520 Len=1408 TSval=1712550583 TSecr=163914153 [TCP PDU reassembled in 230]"
"230","17:22:06.750560","192.87.28.82","192.168.0.74","TLSv1.2","1320","Application Data"
"231","17:22:06.750561","192.87.28.82","192.168.0.74","TCP","1474","9001  >  52516 [ACK] Seq=31621 Ack=1073 Win=3520 Len=1408 TSval=1712550583 TSecr=163914153 [TCP PDU reassembled in 233]"
"232","17:22:06.750562","192.87.28.82","192.168.0.74","TCP","1474","9001  >  52516 [ACK] Seq=33029 Ack=1073 Win=3520 Len=1408 TSval=1712550583 TSecr=163914153 [TCP PDU reassembled in 233]"
"233","17:22:06.750564","192.87.28.82","192.168.0.74","TLSv1.2","420","Application Data"
"234","17:22:06.750686","192.168.0.74","192.87.28.82","TCP","66","52516  >  9001 [ACK] Seq=1073 Ack=34791 Win=8953 Len=0 TSval=163914286 TSecr=1712550583"
"235","17:22:06.750845","192.168.0.74","192.87.28.82","TCP","66","[TCP Window Update] 52516  >  9001 [ACK] Seq=1073 Ack=34791 Win=9066 Len=0 TSval=163914287 TSecr=1712550583"
"236","17:22:06.750999","192.168.0.74","192.87.28.82","TLSv1.2","602","Application Data"
"237","17:22:06.764634","64.65.63.120","192.168.0.74","TCP","1474","443  >  52517 [ACK] Seq=537 Ack=11595 Win=2605 Len=1408 TSval=2614627960 TSecr=4083282863 [TCP PDU reassembled in 246]"
"238","17:22:06.764636","192.87.28.82","192.168.0.74","TCP","1474","9001  >  52516 [ACK] Seq=34791 Ack=1073 Win=3520 Len=1408 TSval=1712550596 TSecr=163914153 [TCP PDU reassembled in 240]"
"239","17:22:06.764638","192.87.28.82","192.168.0.74","TCP","1474","9001  >  52516 [ACK] Seq=36199 Ack=1073 Win=3520 Len=1408 TSval=1712550596 TSecr=163914153 [TCP PDU reassembled in 240]"
"240","17:22:06.764640","192.87.28.82","192.168.0.74","TLSv1.2","1320","Application Data"
"241","17:22:06.764642","192.87.28.82","192.168.0.74","TLSv1.2","1474","Application Data"
"242","17:22:06.764790","192.168.0.74","192.87.28.82","TCP","66","52516  >  9001 [ACK] Seq=1609 Ack=40269 Win=8981 Len=0 TSval=163914300 TSecr=1712550596"
"243","17:22:06.764847","192.168.0.74","64.65.63.120","TCP","66","52517  >  443 [ACK] Seq=11595 Ack=1945 Win=18768 Len=0 TSval=4083282960 TSecr=2614627960"
"244","17:22:06.764968","192.168.0.74","192.87.28.82","TCP","66","[TCP Window Update] 52516  >  9001 [ACK] Seq=1609 Ack=40269 Win=9066 Len=0 TSval=163914301 TSecr=1712550596"
"245","17:22:06.766902","64.65.63.120","192.168.0.74","TCP","1474","443  >  52517 [PSH, ACK] Seq=1945 Ack=11595 Win=2605 Len=1408 TSval=2614627960 TSecr=4083282863 [TCP PDU reassembled in 246]"
"246","17:22:06.766904","64.65.63.120","192.168.0.74","TLSv1.2","1320","Application Data"
"247","17:22:06.767023","192.168.0.74","64.65.63.120","TCP","66","52517  >  443 [ACK] Seq=11595 Ack=4607 Win=18749 Len=0 TSval=4083282962 TSecr=2614627960"
"248","17:22:06.767680","64.65.63.120","192.168.0.74","TLSv1.2","1474","Application Data"
"249","17:22:06.767746","192.168.0.74","64.65.63.120","TCP","66","52517  >  443 [ACK] Seq=11595 Ack=6015 Win=18768 Len=0 TSval=4083282962 TSecr=2614627961"
"250","17:22:06.769033","64.65.63.120","192.168.0.74","TCP","1474","443  >  52517 [PSH, ACK] Seq=6015 Ack=11595 Win=2605 Len=1408 TSval=2614627961 TSecr=4083282863 [TCP PDU reassembled in 262]"
"251","17:22:06.769036","64.65.63.120","192.168.0.74","TCP","1474","443  >  52517 [ACK] Seq=7423 Ack=11595 Win=2605 Len=1408 TSval=2614627961 TSecr=4083282863 [TCP PDU reassembled in 262]"
"252","17:22:06.769138","192.168.0.74","64.65.63.120","TCP","66","52517  >  443 [ACK] Seq=11595 Ack=8831 Win=18746 Len=0 TSval=4083282964 TSecr=2614627961"
"253","17:22:06.769211","192.168.0.74","64.65.63.120","TCP","66","[TCP Window Update] 52517  >  443 [ACK] Seq=11595 Ack=8831 Win=18790 Len=0 TSval=4083282964 TSecr=2614627961"
"254","17:22:06.790246","192.87.28.82","192.168.0.74","TCP","1474","9001  >  52516 [ACK] Seq=40269 Ack=1073 Win=3520 Len=1408 TSval=1712550609 TSecr=163914276 [TCP PDU reassembled in 255]"
"255","17:22:06.790249","192.87.28.82","192.168.0.74","TLSv1.2","1474","Application Data"
"256","17:22:06.790252","192.87.28.82","192.168.0.74","TCP","1474","9001  >  52516 [ACK] Seq=43085 Ack=1073 Win=3520 Len=1408 TSval=1712550609 TSecr=163914276 [TCP PDU reassembled in 260]"
"257","17:22:06.790309","192.87.28.82","192.168.0.74","TCP","1474","9001  >  52516 [ACK] Seq=44493 Ack=1073 Win=3520 Len=1408 TSval=1712550609 TSecr=163914276 [TCP PDU reassembled in 260]"
"258","17:22:06.790496","192.168.0.74","192.87.28.82","TCP","66","52516  >  9001 [ACK] Seq=1609 Ack=44493 Win=9000 Len=0 TSval=163914326 TSecr=1712550609"
"259","17:22:06.790667","192.168.0.74","192.87.28.82","TCP","66","52516  >  9001 [ACK] Seq=1609 Ack=45901 Win=9066 Len=0 TSval=163914326 TSecr=1712550609"
"260","17:22:06.791590","192.87.28.82","192.168.0.74","TLSv1.2","352","Application Data"
"261","17:22:06.791591","192.87.28.82","192.168.0.74","TCP","1474","9001  >  52516 [ACK] Seq=46187 Ack=1073 Win=3520 Len=1408 TSval=1712550614 TSecr=163914277 [TCP PDU reassembled in 268]"
"262","17:22:06.791593","64.65.63.120","192.168.0.74","TLSv1.2","1474","Application Data, Application Data"
"263","17:22:06.791650","192.168.0.74","64.65.63.120","TCP","66","52517  >  443 [ACK] Seq=11595 Ack=10239 Win=18768 Len=0 TSval=4083282986 TSecr=2614627981"
"264","17:22:06.791683","192.168.0.74","192.87.28.82","TCP","66","52516  >  9001 [ACK] Seq=1609 Ack=47595 Win=9066 Len=0 TSval=163914327 TSecr=1712550614"
"265","17:22:06.793036","64.65.63.120","192.168.0.74","TCP","1474","443  >  52517 [PSH, ACK] Seq=10239 Ack=11595 Win=2605 Len=1408 TSval=2614627981 TSecr=4083282863 [TCP PDU reassembled in 267]"
"266","17:22:06.793038","64.65.63.120","192.168.0.74","TCP","1474","443  >  52517 [ACK] Seq=11647 Ack=11595 Win=2605 Len=1408 TSval=2614627981 TSecr=4083282863 [TCP PDU reassembled in 267]"
"267","17:22:06.793039","64.65.63.120","192.168.0.74","TLSv1.2","1474","Application Data"
"268","17:22:06.793040","192.87.28.82","192.168.0.74","TLSv1.2","1474","Application Data"
"269","17:22:06.793118","192.168.0.74","64.65.63.120","TCP","66","52517  >  443 [ACK] Seq=11595 Ack=14463 Win=18724 Len=0 TSval=4083282988 TSecr=2614627981"
"270","17:22:06.793238","192.168.0.74","64.65.63.120","TCP","66","[TCP Window Update] 52517  >  443 [ACK] Seq=11595 Ack=14463 Win=18790 Len=0 TSval=4083282988 TSecr=2614627981"
"271","17:22:06.794330","192.87.28.82","192.168.0.74","TCP","1474","9001  >  52516 [ACK] Seq=49003 Ack=1073 Win=3520 Len=1408 TSval=1712550619 TSecr=163914287 [TCP PDU reassembled in 274]"
"272","17:22:06.794419","192.168.0.74","192.87.28.82","TCP","66","52516  >  9001 [ACK] Seq=1609 Ack=50411 Win=9066 Len=0 TSval=163914330 TSecr=1712550619"
"273","17:22:06.795580","192.87.28.82","192.168.0.74","TCP","1474","9001  >  52516 [ACK] Seq=50411 Ack=1073 Win=3520 Len=1408 TSval=1712550619 TSecr=163914287 [TCP PDU reassembled in 274]"
"274","17:22:06.795582","192.87.28.82","192.168.0.74","TLSv1.2","1474","Application Data"
"275","17:22:06.795583","192.87.28.82","192.168.0.74","TLSv1.2","824","Application Data, Application Data"
