"No.","Time","Source","Destination","Protocol","Length","Info"
"1","20:23:02.985970","192.87.28.82","192.168.0.74","TLSv1.2","602","Application Data"
"2","20:23:02.986064","192.168.0.74","192.87.28.82","TCP","66","53922  >  9001 [ACK] Seq=1 Ack=537 Win=4020 Len=0 TSval=2983985781 TSecr=3379330114"
"3","20:23:03.022636","192.87.28.82","192.168.0.74","TCP","1474","9001  >  53922 [ACK] Seq=537 Ack=1 Win=1043 Len=1408 TSval=3379330145 TSecr=2983985663 [TCP PDU reassembled in 4]"
"4","20:23:03.022639","192.87.28.82","192.168.0.74","TLSv1.2","222","Application Data"
"5","20:23:03.022737","192.168.0.74","192.87.28.82","TCP","66","53922  >  9001 [ACK] Seq=1 Ack=1945 Win=4006 Len=0 TSval=2983985818 TSecr=3379330145"
"6","20:23:03.022774","192.168.0.74","192.87.28.82","TCP","66","53922  >  9001 [ACK] Seq=1 Ack=2101 Win=4004 Len=0 TSval=2983985818 TSecr=3379330145"
"7","20:23:03.064730","192.87.28.82","192.168.0.74","TLSv1.2","1116","Application Data"
"8","20:23:03.064853","192.168.0.74","192.87.28.82","TCP","66","53922  >  9001 [ACK] Seq=1 Ack=3151 Win=4012 Len=0 TSval=2983985860 TSecr=3379330193"
"9","20:23:03.760024","192.168.0.74","5.28.195.2","TCP","78","54462  >  443 [SYN, ECE, CWR] Seq=0 Win=65535 Len=0 MSS=1460 WS=16 TSval=2343147861 TSecr=0 SACK_PERM"
"10","20:23:03.760279","192.168.0.74","5.28.195.2","TCP","78","54463  >  80 [SYN, ECE, CWR] Seq=0 Win=65535 Len=0 MSS=1460 WS=16 TSval=4073227942 TSecr=0 SACK_PERM"
"11","20:23:03.760439","192.168.0.74","5.28.195.2","TCP","78","54464  >  5222 [SYN, ECE, CWR] Seq=0 Win=65535 Len=0 MSS=1460 WS=16 TSval=2378667117 TSecr=0 SACK_PERM"
"12","20:23:03.808322","5.28.195.2","192.168.0.74","TCP","74","443  >  54462 [SYN, ACK, ECE] Seq=0 Ack=1 Win=65535 Len=0 MSS=1240 SACK_PERM TSval=3041497035 TSecr=2343147861 WS=1024"
"13","20:23:03.808468","192.168.0.74","5.28.195.2","TCP","66","54462  >  443 [ACK] Seq=1 Ack=1 Win=1048560 Len=0 TSval=2343147910 TSecr=3041497035"
"14","20:23:03.808673","192.168.0.74","5.28.195.2","TLSv1","583","Client Hello"
"15","20:23:03.851716","5.28.195.2","192.168.0.74","TCP","66","443  >  54462 [ACK] Seq=1 Ack=518 Win=67584 Len=0 TSval=3041497077 TSecr=2343147911"
"16","20:23:03.851720","5.28.195.2","192.168.0.74","TCP","66","443  >  54462 [FIN, ACK] Seq=1 Ack=518 Win=67584 Len=0 TSval=3041497077 TSecr=2343147911"
"17","20:23:03.851985","192.168.0.74","5.28.195.2","TCP","66","54462  >  443 [ACK] Seq=518 Ack=2 Win=1048560 Len=0 TSval=2343147954 TSecr=3041497077"
"18","20:23:03.852224","192.168.0.74","5.28.195.2","TCP","66","54462  >  443 [FIN, ACK] Seq=518 Ack=2 Win=1048560 Len=0 TSval=2343147954 TSecr=3041497077"
"19","20:23:03.871625","192.168.0.74","192.87.28.82","TLSv1.2","602","Application Data"
"20","20:23:03.893918","5.28.195.2","192.168.0.74","TCP","56","443  >  54462 [RST] Seq=2 Win=0 Len=0"
"21","20:23:03.946064","192.87.28.82","192.168.0.74","TCP","66","9001  >  53922 [ACK] Seq=3151 Ack=537 Win=1043 Len=0 TSval=3379331076 TSecr=2983986667"
"22","20:23:03.946197","192.168.0.74","192.87.28.82","TLSv1.2","1116","Application Data"
"23","20:23:04.018803","192.87.28.82","192.168.0.74","TCP","66","9001  >  53922 [ACK] Seq=3151 Ack=1587 Win=1043 Len=0 TSval=3379331149 TSecr=2983986741"
"24","20:23:04.034472","64.65.63.120","192.168.0.74","TLSv1.2","602","Application Data"
"25","20:23:04.034742","192.168.0.74","64.65.63.120","TCP","66","53923  >  443 [ACK] Seq=1 Ack=537 Win=4988 Len=0 TSval=38246974 TSecr=2625485223"
"26","20:23:04.086940","64.65.63.120","192.168.0.74","TLSv1.2","602","Application Data"
"27","20:23:04.087132","192.168.0.74","64.65.63.120","TCP","66","53923  >  443 [ACK] Seq=1 Ack=1073 Win=4988 Len=0 TSval=38247026 TSecr=2625485275"
"28","20:23:04.087699","192.168.0.74","64.65.63.120","TLSv1.2","602","Application Data"
"29","20:23:04.145797","64.65.63.120","192.168.0.74","TCP","66","443  >  53923 [ACK] Seq=1073 Ack=537 Win=1645 Len=0 TSval=2625485330 TSecr=38247027"
"30","20:23:04.156974","192.87.28.82","192.168.0.74","TLSv1.2","602","Application Data"
"31","20:23:04.157155","192.168.0.74","192.87.28.82","TCP","66","53922  >  9001 [ACK] Seq=1587 Ack=3687 Win=4020 Len=0 TSval=2983986952 TSecr=3379331286"
"32","20:23:04.198669","64.65.63.120","192.168.0.74","TLSv1.2","602","Application Data"
"33","20:23:04.198766","192.168.0.74","64.65.63.120","TCP","66","53923  >  443 [ACK] Seq=537 Ack=1609 Win=4988 Len=0 TSval=38247138 TSecr=2625485389"
"34","20:23:04.761184","192.168.0.74","5.28.195.2","TCP","78","[TCP Retransmission] 54464  >  5222 [SYN] Seq=0 Win=65535 Len=0 MSS=1460 WS=16 TSval=2378668118 TSecr=0 SACK_PERM"
"35","20:23:04.761281","192.168.0.74","5.28.195.2","TCP","78","[TCP Retransmission] 54463  >  80 [SYN] Seq=0 Win=65535 Len=0 MSS=1460 WS=16 TSval=4073228943 TSecr=0 SACK_PERM"
"36","20:23:04.877049","192.168.0.74","64.65.63.120","TLSv1.2","602","Application Data"
"37","20:23:04.936364","64.65.63.120","192.168.0.74","TCP","66","443  >  53923 [ACK] Seq=1609 Ack=1073 Win=1645 Len=0 TSval=2625486122 TSecr=38247816"
"38","20:23:04.936616","192.168.0.74","64.65.63.120","TLSv1.2","602","Application Data"
"39","20:23:04.986028","64.65.63.120","192.168.0.74","TCP","66","443  >  53923 [ACK] Seq=1609 Ack=1609 Win=1641 Len=0 TSval=2625486174 TSecr=38247875"
"40","20:23:05.585654","64.65.63.120","192.168.0.74","TLSv1.2","602","Application Data"
"41","20:23:05.585896","192.168.0.74","64.65.63.120","TCP","66","53923  >  443 [ACK] Seq=1609 Ack=2145 Win=4988 Len=0 TSval=38248525 TSecr=2625486598"
"42","20:23:05.639389","64.65.63.120","192.168.0.74","TLSv1.2","602","Application Data"
"43","20:23:05.639591","192.168.0.74","64.65.63.120","TCP","66","53923  >  443 [ACK] Seq=1609 Ack=2681 Win=4988 Len=0 TSval=38248579 TSecr=2625486825"
"44","20:23:05.762385","192.168.0.74","5.28.195.2","TCP","78","[TCP Retransmission] 54464  >  5222 [SYN] Seq=0 Win=65535 Len=0 MSS=1460 WS=16 TSval=2378669119 TSecr=0 SACK_PERM"
"45","20:23:05.762419","192.168.0.74","5.28.195.2","TCP","78","[TCP Retransmission] 54463  >  80 [SYN] Seq=0 Win=65535 Len=0 MSS=1460 WS=16 TSval=4073229944 TSecr=0 SACK_PERM"
"46","20:23:05.783452","192.168.0.74","192.87.28.82","TCP","1474","53922  >  9001 [ACK] Seq=1587 Ack=3687 Win=4028 Len=1408 TSval=2983988578 TSecr=3379331286 [TCP PDU reassembled in 47]"
"47","20:23:05.783475","192.168.0.74","192.87.28.82","TLSv1.2","736","Application Data"
"48","20:23:05.832996","192.87.28.82","192.168.0.74","TCP","66","9001  >  53922 [ACK] Seq=3687 Ack=3665 Win=1011 Len=0 TSval=3379332961 TSecr=2983988578"
"49","20:23:05.843357","192.168.0.74","13.69.239.68","TLSv1.2","105","Application Data"
"50","20:23:05.843698","192.168.0.74","13.69.239.68","TLSv1.2","90","Application Data"
"51","20:23:05.843971","192.168.0.74","13.69.239.68","TCP","66","59626  >  443 [FIN, ACK] Seq=64 Ack=1 Win=2048 Len=0 TSval=1045645639 TSecr=54283605"
"52","20:23:05.901201","13.69.239.68","192.168.0.74","TCP","66","443  >  59626 [ACK] Seq=1 Ack=65 Win=16381 Len=0 TSval=54403678 TSecr=1045645638"
"53","20:23:05.901203","13.69.239.68","192.168.0.74","TCP","66","443  >  59626 [FIN, ACK] Seq=1 Ack=65 Win=16381 Len=0 TSval=54403678 TSecr=1045645638"
"54","20:23:05.901431","192.168.0.74","13.69.239.68","TCP","66","59626  >  443 [ACK] Seq=65 Ack=2 Win=2048 Len=0 TSval=1045645696 TSecr=54403678"
"55","20:23:05.905533","192.87.28.82","192.168.0.74","TLSv1.2","602","Application Data"
"56","20:23:05.905665","192.168.0.74","192.87.28.82","TCP","66","53922  >  9001 [ACK] Seq=3665 Ack=4223 Win=4020 Len=0 TSval=2983988701 TSecr=3379333035"
"57","20:23:05.923427","192.168.0.74","192.87.28.82","TLSv1.2","602","Application Data"
"58","20:23:05.923468","192.168.0.74","64.65.63.120","TLSv1.2","602","Application Data"
"59","20:23:05.954551","192.87.28.82","192.168.0.74","TLSv1.2","602","Application Data"
"60","20:23:05.954715","192.168.0.74","192.87.28.82","TCP","66","53922  >  9001 [ACK] Seq=4201 Ack=4759 Win=4020 Len=0 TSval=2983988750 TSecr=3379333082"
"61","20:23:05.974154","64.65.63.120","192.168.0.74","TCP","66","443  >  53923 [ACK] Seq=2681 Ack=2145 Win=1645 Len=0 TSval=2625487160 TSecr=38248863"
"62","20:23:05.998688","192.168.0.74","192.87.28.82","TCP","1474","53922  >  9001 [ACK] Seq=4201 Ack=4759 Win=4028 Len=1408 TSval=2983988794 TSecr=3379333082 [TCP PDU reassembled in 63]"
"63","20:23:05.998710","192.168.0.74","192.87.28.82","TLSv1.2","736","Application Data"
"64","20:23:06.000302","192.87.28.82","192.168.0.74","TCP","66","9001  >  53922 [ACK] Seq=4759 Ack=4201 Win=1043 Len=0 TSval=3379333129 TSecr=2983988718"
"65","20:23:06.031785","192.87.28.82","192.168.0.74","TCP","66","9001  >  53922 [ACK] Seq=4759 Ack=6279 Win=1011 Len=0 TSval=3379333162 TSecr=2983988794"
"66","20:23:06.059061","192.87.28.82","192.168.0.74","TLSv1.2","602","Application Data"
"67","20:23:06.059202","192.168.0.74","192.87.28.82","TCP","66","53922  >  9001 [ACK] Seq=6279 Ack=5295 Win=4020 Len=0 TSval=2983988854 TSecr=3379333189"
"68","20:23:06.137894","192.87.28.82","192.168.0.74","TCP","1474","9001  >  53922 [ACK] Seq=5295 Ack=6279 Win=1043 Len=1408 TSval=3379333268 TSecr=2983988854 [TCP PDU reassembled in 70]"
"69","20:23:06.137898","192.87.28.82","192.168.0.74","TCP","1474","9001  >  53922 [ACK] Seq=6703 Ack=6279 Win=1043 Len=1408 TSval=3379333268 TSecr=2983988854 [TCP PDU reassembled in 70]"
"70","20:23:06.137901","192.87.28.82","192.168.0.74","TLSv1.2","870","Application Data"
"71","20:23:06.138120","192.168.0.74","192.87.28.82","TCP","66","53922  >  9001 [ACK] Seq=6279 Ack=8915 Win=3972 Len=0 TSval=2983988933 TSecr=3379333268"
"72","20:23:06.138438","192.168.0.74","192.87.28.82","TCP","66","[TCP Window Update] 53922  >  9001 [ACK] Seq=6279 Ack=8915 Win=4028 Len=0 TSval=2983988934 TSecr=3379333268"
"73","20:23:06.149426","192.87.28.82","192.168.0.74","TLSv1.2","1474","Application Data"
"74","20:23:06.149430","192.87.28.82","192.168.0.74","TCP","1474","9001  >  53922 [ACK] Seq=10323 Ack=6279 Win=1043 Len=1408 TSval=3379333279 TSecr=2983988854 [TCP PDU reassembled in 75]"
"75","20:23:06.149432","192.87.28.82","192.168.0.74","TLSv1.2","1406","Application Data"
"76","20:23:06.149435","192.87.28.82","192.168.0.74","TCP","1474","9001  >  53922 [ACK] Seq=13071 Ack=6279 Win=1043 Len=1408 TSval=3379333281 TSecr=2983988854 [TCP PDU reassembled in 80]"
"77","20:23:06.149440","192.87.28.82","192.168.0.74","TCP","1474","9001  >  53922 [ACK] Seq=14479 Ack=6279 Win=1043 Len=1408 TSval=3379333281 TSecr=2983988854 [TCP PDU reassembled in 80]"
"78","20:23:06.149663","192.168.0.74","192.87.28.82","TCP","66","53922  >  9001 [ACK] Seq=6279 Ack=15887 Win=3920 Len=0 TSval=2983988945 TSecr=3379333281"
"79","20:23:06.149998","192.168.0.74","192.87.28.82","TCP","66","[TCP Window Update] 53922  >  9001 [ACK] Seq=6279 Ack=15887 Win=4028 Len=0 TSval=2983988945 TSecr=3379333281"
"80","20:23:06.151468","192.87.28.82","192.168.0.74","TLSv1.2","1320","Application Data"
"81","20:23:06.151470","192.87.28.82","192.168.0.74","TLSv1.2","1474","Application Data"
"82","20:23:06.151472","192.87.28.82","192.168.0.74","TCP","1474","9001  >  53922 [ACK] Seq=18549 Ack=6279 Win=1043 Len=1408 TSval=3379333281 TSecr=2983988854 [TCP PDU reassembled in 83]"
"83","20:23:06.151475","192.87.28.82","192.168.0.74","TLSv1.2","956","Application Data"
"84","20:23:06.151509","192.168.0.74","192.87.28.82","TCP","66","53922  >  9001 [ACK] Seq=6279 Ack=20847 Win=3951 Len=0 TSval=2983988947 TSecr=3379333281"
"85","20:23:06.151610","192.168.0.74","192.87.28.82","TCP","66","[TCP Window Update] 53922  >  9001 [ACK] Seq=6279 Ack=20847 Win=4028 Len=0 TSval=2983988947 TSecr=3379333281"
"86","20:23:06.151925","192.168.0.74","192.87.28.82","TLSv1.2","602","Application Data"
"87","20:23:06.166863","64.65.63.120","192.168.0.74","TCP","1474","443  >  53923 [ACK] Seq=2681 Ack=2145 Win=1649 Len=1408 TSval=2625487350 TSecr=38248863 [TCP PDU reassembled in 89]"
"88","20:23:06.166868","64.65.63.120","192.168.0.74","TCP","1474","443  >  53923 [PSH, ACK] Seq=4089 Ack=2145 Win=1649 Len=1408 TSval=2625487350 TSecr=38248863 [TCP PDU reassembled in 89]"
"89","20:23:06.166875","64.65.63.120","192.168.0.74","TLSv1.2","870","Application Data"
"90","20:23:06.167112","192.168.0.74","64.65.63.120","TCP","66","53923  >  443 [ACK] Seq=2145 Ack=6301 Win=4940 Len=0 TSval=38249106 TSecr=2625487350"
"91","20:23:06.167448","192.168.0.74","64.65.63.120","TCP","66","[TCP Window Update] 53923  >  443 [ACK] Seq=2145 Ack=6301 Win=4996 Len=0 TSval=38249107 TSecr=2625487350"
"92","20:23:06.171126","192.87.28.82","192.168.0.74","TCP","1474","9001  >  53922 [ACK] Seq=20847 Ack=6279 Win=1043 Len=1408 TSval=3379333300 TSecr=2983988933 [TCP PDU reassembled in 94]"
"93","20:23:06.171129","192.87.28.82","192.168.0.74","TCP","1474","9001  >  53922 [ACK] Seq=22255 Ack=6279 Win=1043 Len=1408 TSval=3379333300 TSecr=2983988933 [TCP PDU reassembled in 94]"
"94","20:23:06.171131","192.87.28.82","192.168.0.74","TLSv1.2","1474","Application Data"
"95","20:23:06.171133","192.87.28.82","192.168.0.74","TLSv1.2","1474","Application Data"
"96","20:23:06.171238","192.168.0.74","192.87.28.82","TCP","66","53922  >  9001 [ACK] Seq=6815 Ack=26479 Win=3940 Len=0 TSval=2983988966 TSecr=3379333300"
"97","20:23:06.171362","192.168.0.74","192.87.28.82","TCP","66","[TCP Window Update] 53922  >  9001 [ACK] Seq=6815 Ack=26479 Win=4028 Len=0 TSval=2983988966 TSecr=3379333300"
"98","20:23:06.175203","192.87.28.82","192.168.0.74","TCP","1474","9001  >  53922 [ACK] Seq=26479 Ack=6279 Win=1043 Len=1408 TSval=3379333304 TSecr=2983988934 [TCP PDU reassembled in 100]"
"99","20:23:06.175251","192.168.0.74","192.87.28.82","TCP","66","53922  >  9001 [ACK] Seq=6815 Ack=27887 Win=4006 Len=0 TSval=2983988970 TSecr=3379333304"
"100","20:23:06.183330","192.87.28.82","192.168.0.74","TLSv1.2","1474","Application Data"
"101","20:23:06.183337","192.87.28.82","192.168.0.74","TCP","1474","9001  >  53922 [ACK] Seq=29295 Ack=6279 Win=1043 Len=1408 TSval=3379333312 TSecr=2983988945 [TCP PDU reassembled in 103]"
"102","20:23:06.183339","192.87.28.82","192.168.0.74","TCP","1474","9001  >  53922 [ACK] Seq=30703 Ack=6279 Win=1043 Len=1408 TSval=3379333312 TSecr=2983988945 [TCP PDU reassembled in 103]"
"103","20:23:06.183341","192.87.28.82","192.168.0.74","TLSv1.2","1474","Application Data"
"104","20:23:06.183343","192.87.28.82","192.168.0.74","TCP","1474","9001  >  53922 [ACK] Seq=33519 Ack=6279 Win=1043 Len=1408 TSval=3379333312 TSecr=2983988945 [TCP PDU reassembled in 105]"
"105","20:23:06.183345","192.87.28.82","192.168.0.74","TLSv1.2","1474","Application Data"
"106","20:23:06.183350","192.87.28.82","192.168.0.74","TCP","1474","9001  >  53922 [ACK] Seq=36335 Ack=6279 Win=1043 Len=1408 TSval=3379333312 TSecr=2983988945 [TCP PDU reassembled in 110]"
"107","20:23:06.183514","192.168.0.74","192.87.28.82","TCP","66","53922  >  9001 [ACK] Seq=6815 Ack=37743 Win=3874 Len=0 TSval=2983988978 TSecr=3379333312"
"108","20:23:06.183850","192.168.0.74","192.87.28.82","TCP","66","[TCP Window Update] 53922  >  9001 [ACK] Seq=6815 Ack=37743 Win=4028 Len=0 TSval=2983988979 TSecr=3379333312"
"109","20:23:06.186320","192.87.28.82","192.168.0.74","TCP","1474","9001  >  53922 [ACK] Seq=37743 Ack=6279 Win=1043 Len=1408 TSval=3379333316 TSecr=2983988947 [TCP PDU reassembled in 110]"
"110","20:23:06.186321","192.87.28.82","192.168.0.74","TLSv1.2","1474","Application Data"
"111","20:23:06.186324","192.87.28.82","192.168.0.74","TCP","1474","9001  >  53922 [ACK] Seq=40559 Ack=6279 Win=1043 Len=1408 TSval=3379333316 TSecr=2983988947 [TCP PDU reassembled in 115]"
"112","20:23:06.186378","192.168.0.74","192.87.28.82","TLSv1.2","602","Application Data"
"113","20:23:06.186492","192.168.0.74","192.87.28.82","TCP","66","[TCP Window Update] 53922  >  9001 [ACK] Seq=7351 Ack=41967 Win=4028 Len=0 TSval=2983988982 TSecr=3379333316"
"114","20:23:06.186789","192.87.28.82","192.168.0.74","TCP","1474","9001  >  53922 [ACK] Seq=41967 Ack=6279 Win=1043 Len=1408 TSval=3379333316 TSecr=2983988947 [TCP PDU reassembled in 115]"
"115","20:23:06.186792","192.87.28.82","192.168.0.74","TLSv1.2","1474","Application Data"
"116","20:23:06.186829","192.168.0.74","192.87.28.82","TCP","66","53922  >  9001 [ACK] Seq=7351 Ack=44783 Win=3984 Len=0 TSval=2983988982 TSecr=3379333316"
"117","20:23:06.186909","192.168.0.74","192.87.28.82","TCP","66","[TCP Window Update] 53922  >  9001 [ACK] Seq=7351 Ack=44783 Win=4028 Len=0 TSval=2983988982 TSecr=3379333316"
"118","20:23:06.210172","192.87.28.82","192.168.0.74","TCP","1474","9001  >  53922 [ACK] Seq=44783 Ack=6815 Win=1043 Len=1408 TSval=3379333337 TSecr=2983988947 [TCP PDU reassembled in 120]"
"119","20:23:06.210177","192.87.28.82","192.168.0.74","TCP","1474","9001  >  53922 [ACK] Seq=46191 Ack=6815 Win=1043 Len=1408 TSval=3379333337 TSecr=2983988947 [TCP PDU reassembled in 120]"
"120","20:23:06.210180","192.87.28.82","192.168.0.74","TLSv1.2","1474","Application Data, Application Data"
"121","20:23:06.210182","192.87.28.82","192.168.0.74","TCP","1474","9001  >  53922 [ACK] Seq=49007 Ack=6815 Win=1043 Len=1408 TSval=3379333337 TSecr=2983988947 [TCP PDU reassembled in 123]"
"122","20:23:06.210185","192.87.28.82","192.168.0.74","TCP","1474","9001  >  53922 [ACK] Seq=50415 Ack=6815 Win=1043 Len=1408 TSval=3379333337 TSecr=2983988947 [TCP PDU reassembled in 123]"
"123","20:23:06.210188","192.87.28.82","192.168.0.74","TLSv1.2","1474","Application Data"
"124","20:23:06.210191","192.87.28.82","192.168.0.74","TCP","1474","9001  >  53922 [ACK] Seq=53231 Ack=6815 Win=1043 Len=1408 TSval=3379333337 TSecr=2983988966 [TCP PDU reassembled in 132]"
"125","20:23:06.210470","192.168.0.74","192.87.28.82","TCP","66","53922  >  9001 [ACK] Seq=7351 Ack=54639 Win=3874 Len=0 TSval=2983989005 TSecr=3379333337"
"126","20:23:06.210916","192.168.0.74","192.87.28.82","TCP","66","[TCP Window Update] 53922  >  9001 [ACK] Seq=7351 Ack=54639 Win=4028 Len=0 TSval=2983989006 TSecr=3379333337"
"127","20:23:06.211743","192.87.28.82","192.168.0.74","TCP","1474","9001  >  53922 [ACK] Seq=54639 Ack=6815 Win=1043 Len=1408 TSval=3379333341 TSecr=2983988970 [TCP PDU reassembled in 132]"
"128","20:23:06.211844","192.168.0.74","192.87.28.82","TLSv1.2","602","Application Data"
"129","20:23:06.224760","64.65.63.120","192.168.0.74","TLSv1.2","1474","Application Data"
"130","20:23:06.224763","64.65.63.120","192.168.0.74","TCP","1474","443  >  53923 [PSH, ACK] Seq=7709 Ack=2145 Win=1649 Len=1408 TSval=2625487399 TSecr=38248863 [TCP PDU reassembled in 149]"
"131","20:23:06.224767","64.65.63.120","192.168.0.74","TCP","1474","443  >  53923 [ACK] Seq=9117 Ack=2145 Win=1649 Len=1408 TSval=2625487399 TSecr=38248863 [TCP PDU reassembled in 149]"
"132","20:23:06.224769","192.87.28.82","192.168.0.74","TLSv1.2","1474","Application Data"
"133","20:23:06.224771","192.87.28.82","192.168.0.74","TCP","1474","9001  >  53922 [ACK] Seq=57455 Ack=6815 Win=1043 Len=1408 TSval=3379333346 TSecr=2983988979 [TCP PDU reassembled in 138]"
"134","20:23:06.224935","192.168.0.74","192.87.28.82","TCP","66","53922  >  9001 [ACK] Seq=7887 Ack=58863 Win=3984 Len=0 TSval=2983989020 TSecr=3379333346"
"135","20:23:06.225006","192.168.0.74","64.65.63.120","TCP","66","53923  >  443 [ACK] Seq=2145 Ack=10525 Win=4930 Len=0 TSval=38249164 TSecr=2625487399"
"136","20:23:06.225271","192.168.0.74","192.87.28.82","TCP","66","[TCP Window Update] 53922  >  9001 [ACK] Seq=7887 Ack=58863 Win=4028 Len=0 TSval=2983989020 TSecr=3379333346"
"137","20:23:06.225597","192.168.0.74","64.65.63.120","TCP","66","[TCP Window Update] 53923  >  443 [ACK] Seq=2145 Ack=10525 Win=4996 Len=0 TSval=38249165 TSecr=2625487399"
"138","20:23:06.225958","192.87.28.82","192.168.0.74","TLSv1.2","1474","Application Data"
"139","20:23:06.225960","192.87.28.82","192.168.0.74","TCP","1474","9001  >  53922 [ACK] Seq=60271 Ack=6815 Win=1043 Len=1408 TSval=3379333346 TSecr=2983988979 [TCP PDU reassembled in 142]"
"140","20:23:06.226010","192.168.0.74","192.87.28.82","TCP","66","53922  >  9001 [ACK] Seq=7887 Ack=61679 Win=3984 Len=0 TSval=2983989021 TSecr=3379333346"
"141","20:23:06.226094","192.168.0.74","192.87.28.82","TCP","66","[TCP Window Update] 53922  >  9001 [ACK] Seq=7887 Ack=61679 Win=4028 Len=0 TSval=2983989021 TSecr=3379333346"
"142","20:23:06.226898","192.87.28.82","192.168.0.74","TLSv1.2","1474","Application Data"
"143","20:23:06.226900","192.87.28.82","192.168.0.74","TCP","1474","9001  >  53922 [ACK] Seq=63087 Ack=6815 Win=1043 Len=1408 TSval=3379333346 TSecr=2983988979 [TCP PDU reassembled in 147]"
"144","20:23:06.226974","192.168.0.74","192.87.28.82","TCP","66","53922  >  9001 [ACK] Seq=7887 Ack=64495 Win=3984 Len=0 TSval=2983989022 TSecr=3379333346"
"145","20:23:06.227089","192.168.0.74","192.87.28.82","TCP","66","[TCP Window Update] 53922  >  9001 [ACK] Seq=7887 Ack=64495 Win=4028 Len=0 TSval=2983989022 TSecr=3379333346"
"146","20:23:06.227206","192.87.28.82","192.168.0.74","TCP","1474","9001  >  53922 [ACK] Seq=64495 Ack=6815 Win=1043 Len=1408 TSval=3379333346 TSecr=2983988979 [TCP PDU reassembled in 147]"
"147","20:23:06.228750","192.87.28.82","192.168.0.74","TLSv1.2","1474","Application Data"
"148","20:23:06.228753","192.87.28.82","192.168.0.74","TCP","1474","9001  >  53922 [ACK] Seq=67311 Ack=6815 Win=1043 Len=1408 TSval=3379333346 TSecr=2983988979 [TCP PDU reassembled in 153]"
"149","20:23:06.228756","64.65.63.120","192.168.0.74","TLSv1.2","534","Application Data, Application Data"
"150","20:23:06.228824","192.168.0.74","64.65.63.120","TCP","66","53923  >  443 [ACK] Seq=2145 Ack=10993 Win=4989 Len=0 TSval=38249168 TSecr=2625487404"
"151","20:23:06.228883","192.168.0.74","192.87.28.82","TLSv1.2","602","Application Data"
"152","20:23:06.229866","192.87.28.82","192.168.0.74","TCP","1474","9001  >  53922 [ACK] Seq=68719 Ack=7351 Win=1035 Len=1408 TSval=3379333350 TSecr=2983988981 [TCP PDU reassembled in 153]"
"153","20:23:06.229869","192.87.28.82","192.168.0.74","TLSv1.2","1474","Application Data, Application Data"
"154","20:23:06.229932","192.168.0.74","192.87.28.82","TCP","66","53922  >  9001 [ACK] Seq=8423 Ack=71535 Win=3984 Len=0 TSval=2983989025 TSecr=3379333350"
"155","20:23:06.230082","192.168.0.74","192.87.28.82","TCP","66","[TCP Window Update] 53922  >  9001 [ACK] Seq=8423 Ack=71535 Win=4028 Len=0 TSval=2983989025 TSecr=3379333350"
"156","20:23:06.230506","192.87.28.82","192.168.0.74","TCP","1474","9001  >  53922 [ACK] Seq=71535 Ack=7351 Win=1035 Len=1408 TSval=3379333350 TSecr=2983988981 [TCP PDU reassembled in 159]"
"157","20:23:06.230638","192.87.28.82","192.168.0.74","TCP","1474","9001  >  53922 [ACK] Seq=72943 Ack=7351 Win=1035 Len=1408 TSval=3379333350 TSecr=2983988981 [TCP PDU reassembled in 159]"
"158","20:23:06.230717","192.168.0.74","192.87.28.82","TCP","66","53922  >  9001 [ACK] Seq=8423 Ack=74351 Win=4028 Len=0 TSval=2983989026 TSecr=3379333350"
"159","20:23:06.231919","192.87.28.82","192.168.0.74","TLSv1.2","1474","Application Data"
"160","20:23:06.231921","192.87.28.82","192.168.0.74","TCP","1474","9001  >  53922 [ACK] Seq=75759 Ack=7351 Win=1043 Len=1408 TSval=3379333350 TSecr=2983988982 [TCP PDU reassembled in 161]"
"161","20:23:06.231924","192.87.28.82","192.168.0.74","TLSv1.2","1474","Application Data"
"162","20:23:06.232090","192.168.0.74","192.87.28.82","TCP","66","53922  >  9001 [ACK] Seq=8423 Ack=78575 Win=4028 Len=0 TSval=2983989027 TSecr=3379333350"
"163","20:23:06.233011","192.87.28.82","192.168.0.74","TCP","1474","9001  >  53922 [ACK] Seq=78575 Ack=7351 Win=1043 Len=1408 TSval=3379333350 TSecr=2983988982 [TCP PDU reassembled in 164]"
"164","20:23:06.233014","192.87.28.82","192.168.0.74","TLSv1.2","1474","Application Data"
"165","20:23:06.233016","192.87.28.82","192.168.0.74","TCP","1474","9001  >  53922 [ACK] Seq=81391 Ack=7351 Win=1043 Len=1408 TSval=3379333350 TSecr=2983988982 [TCP PDU reassembled in 168]"
"166","20:23:06.233133","192.168.0.74","192.87.28.82","TCP","66","53922  >  9001 [ACK] Seq=8423 Ack=82799 Win=4028 Len=0 TSval=2983989028 TSecr=3379333350"
"167","20:23:06.242695","192.87.28.82","192.168.0.74","TCP","1474","9001  >  53922 [ACK] Seq=82799 Ack=7351 Win=1043 Len=1408 TSval=3379333372 TSecr=2983989006 [TCP PDU reassembled in 168]"
"168","20:23:06.242698","192.87.28.82","192.168.0.74","TLSv1.2","1474","Application Data, Application Data"
"169","20:23:06.242701","192.87.28.82","192.168.0.74","TCP","1474","9001  >  53922 [ACK] Seq=85615 Ack=7351 Win=1043 Len=1408 TSval=3379333372 TSecr=2983989006 [TCP PDU reassembled in 171]"
"170","20:23:06.242703","192.87.28.82","192.168.0.74","TCP","1474","9001  >  53922 [ACK] Seq=87023 Ack=7351 Win=1043 Len=1408 TSval=3379333372 TSecr=2983989006 [TCP PDU reassembled in 171]"
"171","20:23:06.242706","192.87.28.82","192.168.0.74","TLSv1.2","1474","Application Data, Application Data"
"172","20:23:06.242710","192.87.28.82","192.168.0.74","TCP","1474","9001  >  53922 [ACK] Seq=89839 Ack=7351 Win=1043 Len=1408 TSval=3379333372 TSecr=2983989006 [TCP PDU reassembled in 174]"
"173","20:23:06.242712","192.87.28.82","192.168.0.74","TCP","1474","9001  >  53922 [ACK] Seq=91247 Ack=7351 Win=1043 Len=1408 TSval=3379333372 TSecr=2983989006 [TCP PDU reassembled in 174]"
"174","20:23:06.242714","192.87.28.82","192.168.0.74","TLSv1.2","1474","Application Data, Application Data"
"175","20:23:06.243029","192.168.0.74","192.87.28.82","TLSv1.2","602","Application Data"
"176","20:23:06.256879","192.87.28.82","192.168.0.74","TCP","1474","9001  >  53922 [ACK] Seq=94063 Ack=7887 Win=1035 Len=1408 TSval=3379333377 TSecr=2983989007 [TCP PDU reassembled in 184]"
"177","20:23:06.256885","192.87.28.82","192.168.0.74","TCP","1474","9001  >  53922 [ACK] Seq=95471 Ack=7887 Win=1035 Len=1408 TSval=3379333377 TSecr=2983989007 [TCP PDU reassembled in 184]"
"178","20:23:06.257032","192.168.0.74","192.87.28.82","TCP","66","53922  >  9001 [ACK] Seq=8959 Ack=96879 Win=3984 Len=0 TSval=2983989052 TSecr=3379333377"
"179","20:23:06.257258","192.168.0.74","192.87.28.82","TCP","66","[TCP Window Update] 53922  >  9001 [ACK] Seq=8959 Ack=96879 Win=4028 Len=0 TSval=2983989052 TSecr=3379333377"
"180","20:23:06.258555","64.65.63.120","192.168.0.74","TCP","1474","443  >  53923 [ACK] Seq=10993 Ack=2145 Win=1649 Len=1408 TSval=2625487443 TSecr=38249107 [TCP PDU reassembled in 237]"
"181","20:23:06.258558","64.65.63.120","192.168.0.74","TCP","1474","443  >  53923 [PSH, ACK] Seq=12401 Ack=2145 Win=1649 Len=1408 TSval=2625487443 TSecr=38249107 [TCP PDU reassembled in 237]"
"182","20:23:06.258706","192.168.0.74","64.65.63.120","TCP","66","53923  >  443 [ACK] Seq=2145 Ack=13809 Win=4952 Len=0 TSval=38249198 TSecr=2625487443"
"183","20:23:06.258901","192.168.0.74","64.65.63.120","TCP","66","[TCP Window Update] 53923  >  443 [ACK] Seq=2145 Ack=13809 Win=4996 Len=0 TSval=38249198 TSecr=2625487443"
"184","20:23:06.259478","192.87.28.82","192.168.0.74","TLSv1.2","1474","Application Data"
"185","20:23:06.259480","192.87.28.82","192.168.0.74","TCP","1474","9001  >  53922 [ACK] Seq=98287 Ack=7887 Win=1043 Len=1408 TSval=3379333389 TSecr=2983989020 [TCP PDU reassembled in 187]"
"186","20:23:06.259482","192.87.28.82","192.168.0.74","TCP","1474","9001  >  53922 [ACK] Seq=99695 Ack=7887 Win=1043 Len=1408 TSval=3379333389 TSecr=2983989020 [TCP PDU reassembled in 187]"
"187","20:23:06.259484","192.87.28.82","192.168.0.74","TLSv1.2","1474","Application Data"
"188","20:23:06.259485","192.87.28.82","192.168.0.74","TLSv1.2","1474","Application Data"
"189","20:23:06.259486","192.87.28.82","192.168.0.74","TCP","1474","9001  >  53922 [ACK] Seq=103919 Ack=7887 Win=1043 Len=1408 TSval=3379333389 TSecr=2983989021 [TCP PDU reassembled in 190]"
"190","20:23:06.259488","192.87.28.82","192.168.0.74","TLSv1.2","1474","Application Data"
"191","20:23:06.259490","192.87.28.82","192.168.0.74","TCP","1474","9001  >  53922 [ACK] Seq=106735 Ack=7887 Win=1043 Len=1408 TSval=3379333389 TSecr=2983989021 [TCP PDU reassembled in 195]"
"192","20:23:06.259492","192.87.28.82","192.168.0.74","TCP","1474","9001  >  53922 [ACK] Seq=108143 Ack=7887 Win=1043 Len=1408 TSval=3379333389 TSecr=2983989021 [TCP PDU reassembled in 195]"
"193","20:23:06.259630","192.168.0.74","192.87.28.82","TCP","66","53922  >  9001 [ACK] Seq=8959 Ack=109551 Win=3830 Len=0 TSval=2983989055 TSecr=3379333389"
"194","20:23:06.259895","192.168.0.74","192.87.28.82","TCP","66","[TCP Window Update] 53922  >  9001 [ACK] Seq=8959 Ack=109551 Win=4028 Len=0 TSval=2983989055 TSecr=3379333389"
"195","20:23:06.262880","192.87.28.82","192.168.0.74","TLSv1.2","1474","Application Data, Application Data"
"196","20:23:06.262884","192.87.28.82","192.168.0.74","TCP","1474","9001  >  53922 [ACK] Seq=110959 Ack=7887 Win=1043 Len=1408 TSval=3379333394 TSecr=2983989022 [TCP PDU reassembled in 199]"
"197","20:23:06.262887","192.87.28.82","192.168.0.74","TCP","1474","9001  >  53922 [ACK] Seq=112367 Ack=7887 Win=1043 Len=1408 TSval=3379333394 TSecr=2983989022 [TCP PDU reassembled in 199]"
"198","20:23:06.263209","192.168.0.74","192.87.28.82","TLSv1.2","602","Application Data"
"199","20:23:06.263915","192.87.28.82","192.168.0.74","TLSv1.2","1474","Application Data"
"200","20:23:06.263918","192.87.28.82","192.168.0.74","TCP","1474","9001  >  53922 [ACK] Seq=115183 Ack=8423 Win=1035 Len=1408 TSval=3379333394 TSecr=2983989024 [TCP PDU reassembled in 202]"
"201","20:23:06.263920","192.87.28.82","192.168.0.74","TCP","1474","9001  >  53922 [ACK] Seq=116591 Ack=8423 Win=1035 Len=1408 TSval=3379333394 TSecr=2983989024 [TCP PDU reassembled in 202]"
"202","20:23:06.263923","192.87.28.82","192.168.0.74","TLSv1.2","1474","Application Data, Application Data"
"203","20:23:06.263925","192.87.28.82","192.168.0.74","TCP","1474","9001  >  53922 [ACK] Seq=119407 Ack=8423 Win=1035 Len=1408 TSval=3379333394 TSecr=2983989024 [TCP PDU reassembled in 204]"
"204","20:23:06.263927","192.87.28.82","192.168.0.74","TLSv1.2","1474","Application Data"
"205","20:23:06.263929","192.87.28.82","192.168.0.74","TCP","1474","9001  >  53922 [ACK] Seq=122223 Ack=8423 Win=1035 Len=1408 TSval=3379333394 TSecr=2983989025 [TCP PDU reassembled in 206]"
"206","20:23:06.263932","192.87.28.82","192.168.0.74","TLSv1.2","1474","Application Data"
"207","20:23:06.263934","192.87.28.82","192.168.0.74","TCP","1474","9001  >  53922 [ACK] Seq=125039 Ack=8423 Win=1035 Len=1408 TSval=3379333394 TSecr=2983989025 [TCP PDU reassembled in 208]"
"208","20:23:06.263937","192.87.28.82","192.168.0.74","TLSv1.2","1474","Application Data"
"209","20:23:06.264026","192.168.0.74","192.87.28.82","TCP","66","53922  >  9001 [ACK] Seq=9495 Ack=127855 Win=3808 Len=0 TSval=2983989059 TSecr=3379333394"
"210","20:23:06.264681","192.168.0.74","192.87.28.82","TLSv1.2","1116","Application Data"
"211","20:23:06.265811","192.87.28.82","192.168.0.74","TCP","1474","9001  >  53922 [ACK] Seq=127855 Ack=8423 Win=1043 Len=1408 TSval=3379333397 TSecr=2983989027 [TCP PDU reassembled in 215]"
"212","20:23:06.265814","192.87.28.82","192.168.0.74","TCP","1474","9001  >  53922 [ACK] Seq=129263 Ack=8423 Win=1043 Len=1408 TSval=3379333397 TSecr=2983989027 [TCP PDU reassembled in 215]"
"213","20:23:06.265939","192.168.0.74","192.87.28.82","TCP","66","53922  >  9001 [ACK] Seq=10545 Ack=130671 Win=3984 Len=0 TSval=2983989061 TSecr=3379333397"
"214","20:23:06.266050","192.168.0.74","192.87.28.82","TCP","66","[TCP Window Update] 53922  >  9001 [ACK] Seq=10545 Ack=130671 Win=4028 Len=0 TSval=2983989061 TSecr=3379333397"
"215","20:23:06.268141","192.87.28.82","192.168.0.74","TLSv1.2","1474","Application Data"
"216","20:23:06.268144","192.87.28.82","192.168.0.74","TLSv1.2","1474","Application Data"
"217","20:23:06.268146","192.87.28.82","192.168.0.74","TCP","1474","9001  >  53922 [ACK] Seq=133487 Ack=8423 Win=1043 Len=1408 TSval=3379333397 TSecr=2983989027 [TCP PDU reassembled in 218]"
"218","20:23:06.268148","192.87.28.82","192.168.0.74","TLSv1.2","1474","Application Data"
"219","20:23:06.268150","192.87.28.82","192.168.0.74","TLSv1.2","1474","Application Data"
"220","20:23:06.268153","192.87.28.82","192.168.0.74","TCP","1474","9001  >  53922 [ACK] Seq=137711 Ack=8423 Win=1043 Len=1408 TSval=3379333397 TSecr=2983989028 [TCP PDU reassembled in 222]"
"221","20:23:06.268155","192.87.28.82","192.168.0.74","TCP","1474","9001  >  53922 [ACK] Seq=139119 Ack=8423 Win=1043 Len=1408 TSval=3379333397 TSecr=2983989028 [TCP PDU reassembled in 222]"
"222","20:23:06.268157","192.87.28.82","192.168.0.74","TLSv1.2","1474","Application Data"
"223","20:23:06.268159","192.87.28.82","192.168.0.74","TCP","1474","9001  >  53922 [ACK] Seq=141935 Ack=8423 Win=1043 Len=1408 TSval=3379333397 TSecr=2983989028 [TCP PDU reassembled in 225]"
"224","20:23:06.268375","192.168.0.74","192.87.28.82","TCP","66","53922  >  9001 [ACK] Seq=10545 Ack=143343 Win=4028 Len=0 TSval=2983989063 TSecr=3379333397"
"225","20:23:06.276302","192.87.28.82","192.168.0.74","TLSv1.2","1474","Application Data"
"226","20:23:06.276306","192.87.28.82","192.168.0.74","TCP","1474","9001  >  53922 [ACK] Seq=144751 Ack=8959 Win=1035 Len=1408 TSval=3379333405 TSecr=2983989038 [TCP PDU reassembled in 228]"
"227","20:23:06.276308","192.87.28.82","192.168.0.74","TCP","1474","9001  >  53922 [ACK] Seq=146159 Ack=8959 Win=1035 Len=1408 TSval=3379333405 TSecr=2983989038 [TCP PDU reassembled in 228]"
"228","20:23:06.276310","192.87.28.82","192.168.0.74","TLSv1.2","1474","Application Data"
"229","20:23:06.276313","192.87.28.82","192.168.0.74","TCP","1474","9001  >  53922 [ACK] Seq=148975 Ack=8959 Win=1035 Len=1408 TSval=3379333405 TSecr=2983989038 [TCP PDU reassembled in 230]"
"230","20:23:06.276315","192.87.28.82","192.168.0.74","TLSv1.2","1474","Application Data"
"231","20:23:06.276318","192.87.28.82","192.168.0.74","TCP","1474","9001  >  53922 [ACK] Seq=151791 Ack=8959 Win=1035 Len=1408 TSval=3379333405 TSecr=2983989038 [TCP PDU reassembled in 233]"
"232","20:23:06.276320","192.87.28.82","192.168.0.74","TCP","1474","9001  >  53922 [ACK] Seq=153199 Ack=8959 Win=1035 Len=1408 TSval=3379333405 TSecr=2983989038 [TCP PDU reassembled in 233]"
"233","20:23:06.276323","192.87.28.82","192.168.0.74","TLSv1.2","1474","Application Data, Application Data"
"234","20:23:06.276325","192.87.28.82","192.168.0.74","TCP","1474","9001  >  53922 [ACK] Seq=156015 Ack=8959 Win=1035 Len=1408 TSval=3379333405 TSecr=2983989038 [TCP PDU reassembled in 240]"
"235","20:23:06.276474","192.168.0.74","192.87.28.82","TCP","66","53922  >  9001 [ACK] Seq=10545 Ack=157423 Win=3808 Len=0 TSval=2983989071 TSecr=3379333405"
"236","20:23:06.276638","192.168.0.74","192.87.28.82","TCP","66","[TCP Window Update] 53922  >  9001 [ACK] Seq=10545 Ack=157423 Win=4028 Len=0 TSval=2983989072 TSecr=3379333405"
"237","20:23:06.283284","64.65.63.120","192.168.0.74","TLSv1.2","1406","Application Data, Application Data"
"238","20:23:06.283471","192.168.0.74","64.65.63.120","TCP","66","53923  >  443 [ACK] Seq=2145 Ack=15149 Win=4976 Len=0 TSval=38249222 TSecr=2625487469"
"239","20:23:06.290340","192.87.28.82","192.168.0.74","TCP","1474","9001  >  53922 [ACK] Seq=157423 Ack=8959 Win=1043 Len=1408 TSval=3379333419 TSecr=2983989052 [TCP PDU reassembled in 240]"
"240","20:23:06.290344","192.87.28.82","192.168.0.74","TLSv1.2","1474","Application Data"
"241","20:23:06.290348","192.87.28.82","192.168.0.74","TCP","1474","9001  >  53922 [ACK] Seq=160239 Ack=8959 Win=1043 Len=1408 TSval=3379333419 TSecr=2983989052 [TCP PDU reassembled in 245]"
"242","20:23:06.290351","192.87.28.82","192.168.0.74","TCP","1474","9001  >  53922 [ACK] Seq=161647 Ack=8959 Win=1043 Len=1408 TSval=3379333419 TSecr=2983989052 [TCP PDU reassembled in 245]"
"243","20:23:06.290553","192.168.0.74","192.87.28.82","TLSv1.2","602","Application Data"
"244","20:23:06.290863","192.168.0.74","192.87.28.82","TCP","66","[TCP Window Update] 53922  >  9001 [ACK] Seq=11081 Ack=163055 Win=4028 Len=0 TSval=2983989086 TSecr=3379333419"
"245","20:23:06.295000","192.87.28.82","192.168.0.74","TLSv1.2","1474","Application Data"
"246","20:23:06.295003","192.87.28.82","192.168.0.74","TLSv1.2","1474","Application Data"
"247","20:23:06.295005","192.87.28.82","192.168.0.74","TCP","1474","9001  >  53922 [ACK] Seq=165871 Ack=8959 Win=1043 Len=1408 TSval=3379333423 TSecr=2983989055 [TCP PDU reassembled in 248]"
"248","20:23:06.295007","192.87.28.82","192.168.0.74","TLSv1.2","1474","Application Data"
"249","20:23:06.295010","192.87.28.82","192.168.0.74","TCP","1474","9001  >  53922 [ACK] Seq=168687 Ack=8959 Win=1043 Len=1408 TSval=3379333423 TSecr=2983989055 [TCP PDU reassembled in 251]"
"250","20:23:06.295012","192.87.28.82","192.168.0.74","TCP","1474","9001  >  53922 [ACK] Seq=170095 Ack=8959 Win=1043 Len=1408 TSval=3379333423 TSecr=2983989055 [TCP PDU reassembled in 251]"
"251","20:23:06.295014","192.87.28.82","192.168.0.74","TLSv1.2","1474","Application Data"
"252","20:23:06.295016","192.87.28.82","192.168.0.74","TLSv1.2","1474","Application Data"
"253","20:23:06.295019","192.87.28.82","192.168.0.74","TCP","1474","9001  >  53922 [ACK] Seq=174319 Ack=8959 Win=1043 Len=1408 TSval=3379333423 TSecr=2983989055 [TCP PDU reassembled in 254]"
"254","20:23:06.295021","192.87.28.82","192.168.0.74","TLSv1.2","1474","Application Data"
"255","20:23:06.295023","192.87.28.82","192.168.0.74","TCP","1474","9001  >  53922 [ACK] Seq=177135 Ack=8959 Win=1043 Len=1408 TSval=3379333423 TSecr=2983989055 [TCP PDU reassembled in 262]"
"256","20:23:06.295025","64.65.63.120","192.168.0.74","TCP","1474","443  >  53923 [ACK] Seq=15149 Ack=2145 Win=1649 Len=1408 TSval=2625487481 TSecr=38249168 [TCP PDU reassembled in 258]"
"257","20:23:06.295028","64.65.63.120","192.168.0.74","TCP","1474","443  >  53923 [PSH, ACK] Seq=16557 Ack=2145 Win=1649 Len=1408 TSval=2625487481 TSecr=38249168 [TCP PDU reassembled in 258]"
"258","20:23:06.295030","64.65.63.120","192.168.0.74","TLSv1.2","1474","Application Data"
"259","20:23:06.295210","192.168.0.74","64.65.63.120","TCP","66","53923  >  443 [ACK] Seq=2145 Ack=19373 Win=4930 Len=0 TSval=38249234 TSecr=2625487481"
"260","20:23:06.295890","192.168.0.74","64.65.63.120","TCP","66","[TCP Window Update] 53923  >  443 [ACK] Seq=2145 Ack=19373 Win=4996 Len=0 TSval=38249235 TSecr=2625487481"
"261","20:23:06.295987","192.168.0.74","192.87.28.82","TLSv1.2","1138","Application Data, Application Data"
"262","20:23:06.297061","192.87.28.82","192.168.0.74","TLSv1.2","1474","Application Data"
"263","20:23:06.297064","192.87.28.82","192.168.0.74","TCP","1474","9001  >  53922 [ACK] Seq=179951 Ack=9495 Win=1035 Len=1408 TSval=3379333428 TSecr=2983989058 [TCP PDU reassembled in 265]"
"264","20:23:06.297066","192.87.28.82","192.168.0.74","TCP","1474","9001  >  53922 [ACK] Seq=181359 Ack=9495 Win=1035 Len=1408 TSval=3379333428 TSecr=2983989058 [TCP PDU reassembled in 265]"
"265","20:23:06.297068","192.87.28.82","192.168.0.74","TLSv1.2","1474","Application Data"
"266","20:23:06.297070","192.87.28.82","192.168.0.74","TCP","1474","9001  >  53922 [ACK] Seq=184175 Ack=9495 Win=1035 Len=1408 TSval=3379333428 TSecr=2983989058 [TCP PDU reassembled in 267]"
"267","20:23:06.297072","192.87.28.82","192.168.0.74","TLSv1.2","1474","Application Data"
"268","20:23:06.297160","192.168.0.74","192.87.28.82","TCP","66","53922  >  9001 [ACK] Seq=12153 Ack=186991 Win=3896 Len=0 TSval=2983989092 TSecr=3379333428"
"269","20:23:06.297297","192.168.0.74","192.87.28.82","TCP","66","[TCP Window Update] 53922  >  9001 [ACK] Seq=12153 Ack=186991 Win=4028 Len=0 TSval=2983989092 TSecr=3379333428"
"270","20:23:06.297494","192.168.0.74","64.65.63.120","TLSv1.2","602","Application Data"
"271","20:23:06.298890","192.87.28.82","192.168.0.74","TLSv1.2","1474","Application Data"
"272","20:23:06.298892","192.87.28.82","192.168.0.74","TCP","1474","9001  >  53922 [ACK] Seq=188399 Ack=9495 Win=1035 Len=1408 TSval=3379333428 TSecr=2983989058 [TCP PDU reassembled in 273]"
"273","20:23:06.298893","192.87.28.82","192.168.0.74","TLSv1.2","1474","Application Data"
"274","20:23:06.298895","192.87.28.82","192.168.0.74","TCP","1474","9001  >  53922 [ACK] Seq=191215 Ack=9495 Win=1035 Len=1408 TSval=3379333428 TSecr=2983989058 [TCP PDU reassembled in 276]"
