"No.","Time","Source","Destination","Protocol","Length","Info"
"1","20:20:58.719312","192.168.0.74","5.28.195.2","TCP","78","54218  >  80 [SYN] Seq=0 Win=65535 Len=0 MSS=1460 WS=16 TSval=3232926351 TSecr=0 SACK_PERM"
"2","20:20:58.719348","192.168.0.74","5.28.195.2","TCP","78","54217  >  5222 [SYN] Seq=0 Win=65535 Len=0 MSS=1460 WS=16 TSval=909007631 TSecr=0 SACK_PERM"
"3","20:20:59.383002","192.168.0.74","192.87.28.82","TLSv1.2","602","Application Data"
"4","20:20:59.468191","192.87.28.82","192.168.0.74","TCP","66","9001  >  53922 [ACK] Seq=1 Ack=537 Win=1043 Len=0 TSval=3379206596 TSecr=2983862173"
"5","20:20:59.719815","192.168.0.74","5.28.195.2","TCP","78","[TCP Retransmission] 54218  >  80 [SYN] Seq=0 Win=65535 Len=0 MSS=1460 WS=16 TSval=3232927351 TSecr=0 SACK_PERM"
"6","20:20:59.719853","192.168.0.74","5.28.195.2","TCP","78","[TCP Retransmission] 54217  >  5222 [SYN] Seq=0 Win=65535 Len=0 MSS=1460 WS=16 TSval=909008631 TSecr=0 SACK_PERM"
"7","20:20:59.824079","192.168.0.74","5.28.195.2","TCP","78","54219  >  443 [SYN, ECE, CWR] Seq=0 Win=65535 Len=0 MSS=1460 WS=16 TSval=3103953060 TSecr=0 SACK_PERM"
"8","20:20:59.861822","5.28.195.2","192.168.0.74","TCP","74","443  >  54219 [SYN, ACK, ECE] Seq=0 Ack=1 Win=65535 Len=0 MSS=1240 SACK_PERM TSval=2935020853 TSecr=3103953060 WS=1024"
"9","20:20:59.861954","192.168.0.74","5.28.195.2","TCP","66","54219  >  443 [ACK] Seq=1 Ack=1 Win=1048560 Len=0 TSval=3103953098 TSecr=2935020853"
"10","20:20:59.862220","192.168.0.74","5.28.195.2","TLSv1","583","Client Hello"
"11","20:20:59.904386","5.28.195.2","192.168.0.74","TCP","66","443  >  54219 [ACK] Seq=1 Ack=518 Win=67584 Len=0 TSval=2935020951 TSecr=3103953098"
"12","20:20:59.904388","5.28.195.2","192.168.0.74","TCP","66","443  >  54219 [FIN, ACK] Seq=1 Ack=518 Win=67584 Len=0 TSval=2935020951 TSecr=3103953098"
"13","20:20:59.904505","192.168.0.74","5.28.195.2","TCP","66","54219  >  443 [ACK] Seq=518 Ack=2 Win=1048560 Len=0 TSval=3103953140 TSecr=2935020951"
"14","20:20:59.904721","192.168.0.74","5.28.195.2","TCP","66","54219  >  443 [FIN, ACK] Seq=518 Ack=2 Win=1048560 Len=0 TSval=3103953140 TSecr=2935020951"
"15","20:20:59.944752","5.28.195.2","192.168.0.74","TCP","56","443  >  54219 [RST] Seq=2 Win=0 Len=0"
"16","20:21:00.688435","fe80::49c:fb07:3c9a:aa62","fe80::ae22:5ff:feaa:607e","ICMPv6","86","Neighbor Solicitation for fe80::ae22:5ff:feaa:607e from ee:99:94:f5:59:fd"
"17","20:21:00.706308","fe80::ae22:5ff:feaa:607e","fe80::49c:fb07:3c9a:aa62","ICMPv6","78","Neighbor Advertisement fe80::ae22:5ff:feaa:607e (rtr, sol)"
"18","20:21:00.719332","192.168.0.74","5.28.195.2","TCP","78","[TCP Retransmission] 54218  >  80 [SYN] Seq=0 Win=65535 Len=0 MSS=1460 WS=16 TSval=3232928351 TSecr=0 SACK_PERM"
"19","20:21:00.719374","192.168.0.74","5.28.195.2","TCP","78","[TCP Retransmission] 54217  >  5222 [SYN] Seq=0 Win=65535 Len=0 MSS=1460 WS=16 TSval=909009631 TSecr=0 SACK_PERM"
"20","20:21:00.886916","192.168.0.74","192.87.28.82","TLSv1.2","1116","Application Data"
"21","20:21:00.964447","192.87.28.82","192.168.0.74","TCP","66","9001  >  53922 [ACK] Seq=1 Ack=1587 Win=1043 Len=0 TSval=3379208093 TSecr=2983863677"
"22","20:21:00.964571","192.168.0.74","192.87.28.82","TLSv1.2","602","Application Data"
"23","20:21:00.973825","192.87.28.82","192.168.0.74","TLSv1.2","1116","Application Data"
"24","20:21:00.973942","192.168.0.74","192.87.28.82","TCP","66","53922  >  9001 [ACK] Seq=2123 Ack=1051 Win=4012 Len=0 TSval=2983863764 TSecr=3379208098"
"25","20:21:00.975096","192.168.0.74","192.87.28.82","TCP","1474","53922  >  9001 [ACK] Seq=2123 Ack=1051 Win=4028 Len=1408 TSval=2983863765 TSecr=3379208098 [TCP PDU reassembled in 26]"
"26","20:21:00.975122","192.168.0.74","192.87.28.82","TLSv1.2","736","Application Data"
"27","20:21:00.976724","192.168.0.74","192.87.28.82","TCP","1474","53922  >  9001 [ACK] Seq=4201 Ack=1051 Win=4028 Len=1408 TSval=2983863766 TSecr=3379208098 [TCP PDU reassembled in 28]"
"28","20:21:00.976741","192.168.0.74","192.87.28.82","TLSv1.2","736","Application Data"
"29","20:21:01.012162","192.87.28.82","192.168.0.74","TCP","66","9001  >  53922 [ACK] Seq=1051 Ack=3531 Win=1021 Len=0 TSval=3379208139 TSecr=2983863754"
"30","20:21:01.016785","192.87.28.82","192.168.0.74","TCP","66","9001  >  53922 [ACK] Seq=1051 Ack=5609 Win=1021 Len=0 TSval=3379208143 TSecr=2983863765"
"31","20:21:01.056698","192.87.28.82","192.168.0.74","TCP","66","9001  >  53922 [ACK] Seq=1051 Ack=6279 Win=1043 Len=0 TSval=3379208183 TSecr=2983863766"
"32","20:21:01.118040","192.87.28.82","192.168.0.74","TLSv1.2","602","Application Data"
"33","20:21:01.118222","192.168.0.74","192.87.28.82","TCP","66","53922  >  9001 [ACK] Seq=6279 Ack=1587 Win=4020 Len=0 TSval=2983863908 TSecr=3379208242"
"34","20:21:01.119900","192.168.0.74","192.87.28.82","TCP","1474","53922  >  9001 [ACK] Seq=6279 Ack=1587 Win=4028 Len=1408 TSval=2983863910 TSecr=3379208242 [TCP PDU reassembled in 35]"
"35","20:21:01.119931","192.168.0.74","192.87.28.82","TLSv1.2","736","Application Data"
"36","20:21:01.156972","192.87.28.82","192.168.0.74","TCP","66","9001  >  53922 [ACK] Seq=1587 Ack=8357 Win=1011 Len=0 TSval=3379208282 TSecr=2983863910"
"37","20:21:01.242869","64.65.63.120","192.168.0.74","TLSv1.2","602","Application Data"
"38","20:21:01.243026","192.168.0.74","64.65.63.120","TCP","66","53923  >  443 [ACK] Seq=1 Ack=537 Win=3756 Len=0 TSval=38124177 TSecr=2625362415"
"39","20:21:01.357368","192.87.28.82","192.168.0.74","TCP","1474","9001  >  53922 [ACK] Seq=1587 Ack=8357 Win=1043 Len=1408 TSval=3379208486 TSecr=2983863910 [TCP PDU reassembled in 41]"
"40","20:21:01.357370","192.87.28.82","192.168.0.74","TCP","1474","9001  >  53922 [ACK] Seq=2995 Ack=8357 Win=1043 Len=1408 TSval=3379208486 TSecr=2983863910 [TCP PDU reassembled in 41]"
"41","20:21:01.357372","192.87.28.82","192.168.0.74","TLSv1.2","870","Application Data"
"42","20:21:01.357373","192.87.28.82","192.168.0.74","TCP","1474","9001  >  53922 [ACK] Seq=5207 Ack=8357 Win=1043 Len=1408 TSval=3379208489 TSecr=2983863910 [TCP PDU reassembled in 46]"
"43","20:21:01.357507","192.168.0.74","192.87.28.82","TCP","66","53922  >  9001 [ACK] Seq=8357 Ack=6615 Win=3950 Len=0 TSval=2983864147 TSecr=3379208489"
"44","20:21:01.357662","192.168.0.74","192.87.28.82","TCP","66","[TCP Window Update] 53922  >  9001 [ACK] Seq=8357 Ack=6615 Win=4028 Len=0 TSval=2983864147 TSecr=3379208489"
"45","20:21:01.358804","192.87.28.82","192.168.0.74","TCP","1474","9001  >  53922 [ACK] Seq=6615 Ack=8357 Win=1043 Len=1408 TSval=3379208489 TSecr=2983863910 [TCP PDU reassembled in 46]"
"46","20:21:01.358806","192.87.28.82","192.168.0.74","TLSv1.2","870","Application Data"
"47","20:21:01.358913","192.168.0.74","192.87.28.82","TCP","66","53922  >  9001 [ACK] Seq=8357 Ack=8827 Win=3994 Len=0 TSval=2983864149 TSecr=3379208489"
"48","20:21:01.360813","192.168.0.74","192.87.28.82","TLSv1.2","602","Application Data"
"49","20:21:01.362162","192.168.0.74","192.87.28.82","TCP","1474","53922  >  9001 [ACK] Seq=8893 Ack=8827 Win=4028 Len=1408 TSval=2983864152 TSecr=3379208489 [TCP PDU reassembled in 50]"
"50","20:21:01.362177","192.168.0.74","192.87.28.82","TLSv1.2","1250","Application Data"
"51","20:21:01.381682","192.87.28.82","192.168.0.74","TLSv1.2","1474","Application Data"
"52","20:21:01.381685","192.87.28.82","192.168.0.74","TCP","1474","9001  >  53922 [ACK] Seq=10235 Ack=8357 Win=1043 Len=1408 TSval=3379208506 TSecr=2983863910 [TCP PDU reassembled in 54]"
"53","20:21:01.381686","192.87.28.82","192.168.0.74","TCP","1474","9001  >  53922 [ACK] Seq=11643 Ack=8357 Win=1043 Len=1408 TSval=3379208506 TSecr=2983863910 [TCP PDU reassembled in 54]"
"54","20:21:01.381688","192.87.28.82","192.168.0.74","TLSv1.2","512","Application Data"
"55","20:21:01.381835","192.168.0.74","192.87.28.82","TCP","66","53922  >  9001 [ACK] Seq=11485 Ack=13497 Win=3956 Len=0 TSval=2983864172 TSecr=3379208506"
"56","20:21:01.381993","192.168.0.74","192.87.28.82","TCP","66","[TCP Window Update] 53922  >  9001 [ACK] Seq=11485 Ack=13497 Win=4028 Len=0 TSval=2983864172 TSecr=3379208506"
"57","20:21:01.385101","192.168.0.74","192.87.28.82","TLSv1.2","1474","Application Data"
"58","20:21:01.385103","192.168.0.74","192.87.28.82","TCP","1474","53922  >  9001 [ACK] Seq=12893 Ack=13497 Win=4028 Len=1408 TSval=2983864175 TSecr=3379208506 [TCP PDU reassembled in 59]"
"59","20:21:01.385127","192.168.0.74","192.87.28.82","TLSv1.2","378","Application Data"
"60","20:21:01.391619","192.87.28.82","192.168.0.74","TCP","1474","9001  >  53922 [ACK] Seq=13497 Ack=8357 Win=1043 Len=1408 TSval=3379208519 TSecr=2983863910 [TCP PDU reassembled in 61]"
"61","20:21:01.391622","192.87.28.82","192.168.0.74","TLSv1.2","736","Application Data"
"62","20:21:01.391733","192.168.0.74","192.87.28.82","TCP","66","53922  >  9001 [ACK] Seq=14613 Ack=15575 Win=3996 Len=0 TSval=2983864181 TSecr=3379208519"
"63","20:21:01.394520","192.168.0.74","192.87.28.82","TLSv1.2","1474","Application Data, Application Data"
"64","20:21:01.394522","192.168.0.74","192.87.28.82","TCP","1474","53922  >  9001 [ACK] Seq=16021 Ack=15575 Win=4028 Len=1408 TSval=2983864184 TSecr=3379208519 [TCP PDU reassembled in 65]"
"65","20:21:01.394545","192.168.0.74","192.87.28.82","TLSv1.2","914","Application Data"
"66","20:21:01.398792","192.87.28.82","192.168.0.74","TCP","66","9001  >  53922 [ACK] Seq=15575 Ack=10301 Win=1021 Len=0 TSval=3379208528 TSecr=2983864151"
"67","20:21:01.419302","192.87.28.82","192.168.0.74","TCP","66","9001  >  53922 [ACK] Seq=15575 Ack=12893 Win=1021 Len=0 TSval=3379208550 TSecr=2983864152"
"68","20:21:01.419304","192.87.28.82","192.168.0.74","TCP","66","9001  >  53922 [ACK] Seq=15575 Ack=14613 Win=995 Len=0 TSval=3379208550 TSecr=2983864175"
"69","20:21:01.429405","192.87.28.82","192.168.0.74","TCP","66","9001  >  53922 [ACK] Seq=15575 Ack=17429 Win=999 Len=0 TSval=3379208559 TSecr=2983864184"
"70","20:21:01.471341","192.87.28.82","192.168.0.74","TCP","66","9001  >  53922 [ACK] Seq=15575 Ack=18277 Win=1043 Len=0 TSval=3379208599 TSecr=2983864184"
"71","20:21:01.493733","192.87.28.82","192.168.0.74","TLSv1.2","602","Application Data"
"72","20:21:01.493854","192.168.0.74","192.87.28.82","TCP","66","53922  >  9001 [ACK] Seq=18277 Ack=16111 Win=4020 Len=0 TSval=2983864284 TSecr=3379208619"
"73","20:21:01.531869","192.87.28.82","192.168.0.74","TLSv1.2","1116","Application Data"
"74","20:21:01.532000","192.168.0.74","192.87.28.82","TCP","66","53922  >  9001 [ACK] Seq=18277 Ack=17161 Win=4012 Len=0 TSval=2983864322 TSecr=3379208656"
"75","20:21:01.539835","192.87.28.82","192.168.0.74","TLSv1.2","1474","Application Data"
"76","20:21:01.539837","192.87.28.82","192.168.0.74","TLSv1.2","758","Application Data"
"77","20:21:01.539975","192.168.0.74","192.87.28.82","TCP","66","53922  >  9001 [ACK] Seq=18277 Ack=19261 Win=3996 Len=0 TSval=2983864330 TSecr=3379208664"
"78","20:21:01.562797","192.87.28.82","192.168.0.74","TCP","1474","9001  >  53922 [ACK] Seq=19261 Ack=18277 Win=1043 Len=1408 TSval=3379208688 TSecr=2983864284 [TCP PDU reassembled in 79]"
"79","20:21:01.562799","192.87.28.82","192.168.0.74","TLSv1.2","736","Application Data"
"80","20:21:01.562942","192.168.0.74","192.87.28.82","TCP","66","53922  >  9001 [ACK] Seq=18277 Ack=21339 Win=3996 Len=0 TSval=2983864353 TSecr=3379208688"
"81","20:21:01.586449","192.87.28.82","192.168.0.74","TCP","1474","9001  >  53922 [ACK] Seq=21339 Ack=18277 Win=1043 Len=1408 TSval=3379208711 TSecr=2983864330 [TCP PDU reassembled in 83]"
"82","20:21:01.586451","192.87.28.82","192.168.0.74","TCP","1474","9001  >  53922 [ACK] Seq=22747 Ack=18277 Win=1043 Len=1408 TSval=3379208711 TSecr=2983864330 [TCP PDU reassembled in 83]"
"83","20:21:01.586453","192.87.28.82","192.168.0.74","TLSv1.2","870","Application Data"
"84","20:21:01.586592","192.168.0.74","192.87.28.82","TCP","66","53922  >  9001 [ACK] Seq=18277 Ack=24959 Win=3972 Len=0 TSval=2983864376 TSecr=3379208711"
"85","20:21:01.586816","192.168.0.74","192.87.28.82","TCP","66","[TCP Window Update] 53922  >  9001 [ACK] Seq=18277 Ack=24959 Win=4028 Len=0 TSval=2983864377 TSecr=3379208711"
"86","20:21:01.642083","192.87.28.82","192.168.0.74","TLSv1.2","602","Application Data"
"87","20:21:01.642272","192.168.0.74","192.87.28.82","TCP","66","53922  >  9001 [ACK] Seq=18277 Ack=25495 Win=4020 Len=0 TSval=2983864432 TSecr=3379208766"
"88","20:21:01.663298","192.87.28.82","192.168.0.74","TCP","1474","9001  >  53922 [ACK] Seq=25495 Ack=18277 Win=1043 Len=1408 TSval=3379208793 TSecr=2983864377 [TCP PDU reassembled in 89]"
"89","20:21:01.663301","192.87.28.82","192.168.0.74","TLSv1.2","736","Application Data"
"90","20:21:01.663486","192.168.0.74","192.87.28.82","TCP","66","53922  >  9001 [ACK] Seq=18277 Ack=27573 Win=3996 Len=0 TSval=2983864453 TSecr=3379208793"
"91","20:21:01.719337","192.168.0.74","5.28.195.2","TCP","78","[TCP Retransmission] 54218  >  80 [SYN] Seq=0 Win=65535 Len=0 MSS=1460 WS=16 TSval=3232929351 TSecr=0 SACK_PERM"
"92","20:21:01.719392","192.168.0.74","5.28.195.2","TCP","78","[TCP Retransmission] 54217  >  5222 [SYN] Seq=0 Win=65535 Len=0 MSS=1460 WS=16 TSval=909010631 TSecr=0 SACK_PERM"
"93","20:21:01.983687","192.168.0.74","224.0.0.251","MDNS","98","Standard query 0x0000 PTR _sleep-proxy._udp.local, ""QM"" question PTR _meshcop._udp.local, ""QM"" question"
"94","20:21:01.983980","fe80::49c:fb07:3c9a:aa62","ff02::fb","MDNS","118","Standard query 0x0000 PTR _sleep-proxy._udp.local, ""QM"" question PTR _meshcop._udp.local, ""QM"" question"
"95","20:21:03.114290","149.154.167.41","192.168.0.74","TCP","66","443  >  54148 [FIN, ACK] Seq=1 Ack=1 Win=2048 Len=0 TSval=2860610081 TSecr=1671394462"
"96","20:21:03.114508","192.168.0.74","149.154.167.41","TCP","66","54148  >  443 [ACK] Seq=1 Ack=2 Win=65535 Len=0 TSval=1671486303 TSecr=2860610081"
"97","20:21:03.114920","192.168.0.74","149.154.167.41","TCP","66","54148  >  443 [FIN, ACK] Seq=1 Ack=2 Win=65535 Len=0 TSval=1671486304 TSecr=2860610081"
"98","20:21:03.117578","192.168.0.74","149.154.167.41","TCP","78","54223  >  443 [SYN, ECE, CWR] Seq=0 Win=65535 Len=0 MSS=1460 WS=16 TSval=901217298 TSecr=0 SACK_PERM"
"99","20:21:03.156646","149.154.167.41","192.168.0.74","TCP","56","443  >  54148 [RST] Seq=2 Win=0 Len=0"
"100","20:21:03.156648","149.154.167.41","192.168.0.74","TCP","74","443  >  54223 [SYN, ACK, ECE] Seq=0 Ack=1 Win=65535 Len=0 MSS=1240 SACK_PERM TSval=1914060782 TSecr=901217298 WS=32"
"101","20:21:03.156912","192.168.0.74","149.154.167.41","TCP","66","54223  >  443 [ACK] Seq=1 Ack=1 Win=1048560 Len=0 TSval=901217338 TSecr=1914060782"
"102","20:21:03.157455","192.168.0.74","149.154.167.41","SSL","251","Continuation Data"
"103","20:21:03.211337","149.154.167.41","192.168.0.74","SSL","155","Continuation Data"
"104","20:21:03.211481","192.168.0.74","149.154.167.41","TCP","66","54223  >  443 [ACK] Seq=186 Ack=90 Win=1048560 Len=0 TSval=901217392 TSecr=1914060835"
"105","20:21:03.720954","192.168.0.74","5.28.195.2","TCP","78","54224  >  80 [SYN, ECE, CWR] Seq=0 Win=65535 Len=0 MSS=1460 WS=16 TSval=2612034500 TSecr=0 SACK_PERM"
"106","20:21:03.720960","192.168.0.74","5.28.195.2","TCP","78","54225  >  443 [SYN, ECE, CWR] Seq=0 Win=65535 Len=0 MSS=1460 WS=16 TSval=61214312 TSecr=0 SACK_PERM"
"107","20:21:03.720995","192.168.0.74","5.28.195.2","TCP","78","54226  >  5222 [SYN, ECE, CWR] Seq=0 Win=65535 Len=0 MSS=1460 WS=16 TSval=2904128453 TSecr=0 SACK_PERM"
"108","20:21:03.762787","5.28.195.2","192.168.0.74","TCP","74","443  >  54225 [SYN, ACK, ECE] Seq=0 Ack=1 Win=65535 Len=0 MSS=1240 SACK_PERM TSval=2935024757 TSecr=61214312 WS=1024"
"109","20:21:03.762973","192.168.0.74","5.28.195.2","TCP","66","54225  >  443 [ACK] Seq=1 Ack=1 Win=1048560 Len=0 TSval=61214354 TSecr=2935024757"
"110","20:21:03.763203","192.168.0.74","5.28.195.2","TLSv1","583","Client Hello"
"111","20:21:03.805208","5.28.195.2","192.168.0.74","TCP","66","443  >  54225 [ACK] Seq=1 Ack=518 Win=67584 Len=0 TSval=2935024852 TSecr=61214354"
"112","20:21:03.806642","5.28.195.2","192.168.0.74","TCP","66","443  >  54225 [FIN, ACK] Seq=1 Ack=518 Win=67584 Len=0 TSval=2935024853 TSecr=61214354"
"113","20:21:03.806755","192.168.0.74","5.28.195.2","TCP","66","54225  >  443 [ACK] Seq=518 Ack=2 Win=1048560 Len=0 TSval=61214398 TSecr=2935024853"
"114","20:21:03.806952","192.168.0.74","5.28.195.2","TCP","66","54225  >  443 [FIN, ACK] Seq=518 Ack=2 Win=1048560 Len=0 TSval=61214398 TSecr=2935024853"
"115","20:21:03.845654","5.28.195.2","192.168.0.74","TCP","56","443  >  54225 [RST] Seq=2 Win=0 Len=0"
"116","20:21:03.891073","87.228.47.204","192.168.0.74","TCP","66","443  >  59567 [ACK] Seq=1 Ack=1 Win=623 Len=0 TSval=74673025 TSecr=900331931"
"117","20:21:03.891263","192.168.0.74","87.228.47.204","TCP","66","[TCP ACKed unseen segment] 59567  >  443 [ACK] Seq=1 Ack=2 Win=2048 Len=0 TSval=900347147 TSecr=74488520"
"118","20:21:04.562576","192.168.0.74","64.65.63.120","TLSv1.2","602","Application Data"
"119","20:21:04.637766","64.65.63.120","192.168.0.74","TCP","66","443  >  53923 [ACK] Seq=537 Ack=537 Win=1097 Len=0 TSval=2625365810 TSecr=38127496"
"120","20:21:04.722309","192.168.0.74","5.28.195.2","TCP","78","[TCP Retransmission] 54226  >  5222 [SYN] Seq=0 Win=65535 Len=0 MSS=1460 WS=16 TSval=2904129454 TSecr=0 SACK_PERM"
"121","20:21:04.722351","192.168.0.74","5.28.195.2","TCP","78","[TCP Retransmission] 54224  >  80 [SYN] Seq=0 Win=65535 Len=0 MSS=1460 WS=16 TSval=2612035501 TSecr=0 SACK_PERM"
"122","20:21:05.317372","192.168.0.74","31.192.108.181","TLSv1.2","577","Application Data"
"123","20:21:05.376893","31.192.108.181","192.168.0.74","TCP","66","443  >  59625 [ACK] Seq=1 Ack=512 Win=51 Len=0 TSval=2480318936 TSecr=1134299735"
"124","20:21:05.376896","31.192.108.181","192.168.0.74","TLSv1.2","343","Application Data"
"125","20:21:05.376897","31.192.108.181","192.168.0.74","TLSv1.2","343","Application Data"
"126","20:21:05.377198","192.168.0.74","31.192.108.181","TCP","66","59625  >  443 [ACK] Seq=512 Ack=555 Win=2040 Len=0 TSval=1134299795 TSecr=2480318938"
"127","20:21:05.379284","192.168.0.74","31.192.108.181","TLSv1.2","416","Application Data"
"128","20:21:05.408072","31.192.108.181","192.168.0.74","TLSv1.2","287","Application Data"
"129","20:21:05.408295","192.168.0.74","31.192.108.181","TCP","66","59625  >  443 [ACK] Seq=862 Ack=776 Win=2045 Len=0 TSval=1134299826 TSecr=2480318967"
"130","20:21:05.431014","31.192.108.181","192.168.0.74","TLSv1.2","296","Application Data"
"131","20:21:05.431411","192.168.0.74","31.192.108.181","TCP","66","59625  >  443 [ACK] Seq=862 Ack=1006 Win=2045 Len=0 TSval=1134299849 TSecr=2480318995"
"132","20:21:05.432289","31.192.108.181","192.168.0.74","TCP","66","443  >  59625 [ACK] Seq=776 Ack=862 Win=51 Len=0 TSval=2480318994 TSecr=1134299797"
"133","20:21:05.461779","31.192.108.181","192.168.0.74","TLSv1.2","296","Application Data"
"134","20:21:05.462099","192.168.0.74","31.192.108.181","TCP","66","59625  >  443 [ACK] Seq=862 Ack=1236 Win=2045 Len=0 TSval=1134299880 TSecr=2480319025"
"135","20:21:05.466768","192.168.0.164","224.0.0.251","MDNS","103","Standard query 0x0001 PTR _googlecast._tcp.local, ""QU"" question PTR _CC1AD845._sub._googlecast._tcp.local, ""QU"" question"
"136","20:21:05.466771","fe80::88b1:ebff:fea3:db79","ff02::fb","MDNS","123","Standard query 0x0001 PTR _googlecast._tcp.local, ""QU"" question PTR _CC1AD845._sub._googlecast._tcp.local, ""QU"" question"
"137","20:21:05.466772","192.168.0.164","224.0.0.251","MDNS","103","Standard query 0x0001 PTR _googlecast._tcp.local, ""QU"" question PTR _CC1AD845._sub._googlecast._tcp.local, ""QU"" question"
"138","20:21:05.466773","fe80::88b1:ebff:fea3:db79","ff02::fb","MDNS","123","Standard query 0x0001 PTR _googlecast._tcp.local, ""QU"" question PTR _CC1AD845._sub._googlecast._tcp.local, ""QU"" question"
"139","20:21:05.467035","192.168.0.74","13.69.239.68","TCP","78","59626  >  443 [SYN, ECE, CWR] Seq=0 Win=65535 Len=0 MSS=1460 WS=64 TSval=1045525257 TSecr=0 SACK_PERM"
"140","20:21:05.475820","192.168.0.74","5.28.195.2","TCP","78","54227  >  443 [SYN, ECE, CWR] Seq=0 Win=65535 Len=0 MSS=1460 WS=16 TSval=1217279300 TSecr=0 SACK_PERM"
"141","20:21:05.509991","5.28.195.2","192.168.0.74","TCP","74","443  >  54227 [SYN, ACK, ECE] Seq=0 Ack=1 Win=65535 Len=0 MSS=1240 SACK_PERM TSval=3291068863 TSecr=1217279300 WS=1024"
"142","20:21:05.510153","192.168.0.74","5.28.195.2","TCP","66","54227  >  443 [ACK] Seq=1 Ack=1 Win=1048560 Len=0 TSval=1217279334 TSecr=3291068863"
"143","20:21:05.510361","192.168.0.74","5.28.195.2","TLSv1","583","Client Hello"
"144","20:21:05.522008","13.69.239.68","192.168.0.74","TCP","74","443  >  59626 [SYN, ACK, ECE] Seq=0 Ack=1 Win=65535 Len=0 MSS=1420 WS=256 SACK_PERM TSval=54283297 TSecr=1045525257"
"145","20:21:05.523229","192.168.0.74","13.69.239.68","TCP","66","59626  >  443 [ACK] Seq=1 Ack=1 Win=132352 Len=0 TSval=1045525312 TSecr=54283297"
"146","20:21:05.523388","192.168.0.74","13.69.239.68","TCP","1474","59626  >  443 [ACK] Seq=1 Ack=1 Win=132352 Len=1408 TSval=1045525313 TSecr=54283297 [TCP PDU reassembled in 147]"
"147","20:21:05.523397","192.168.0.74","13.69.239.68","TLSv1.3","201","Client Hello (SNI=eu-teams.events.data.microsoft.com)"
"148","20:21:05.551882","5.28.195.2","192.168.0.74","TCP","66","443  >  54227 [ACK] Seq=1 Ack=518 Win=67584 Len=0 TSval=3291068932 TSecr=1217279334"
"149","20:21:05.551885","5.28.195.2","192.168.0.74","TCP","66","443  >  54227 [FIN, ACK] Seq=1 Ack=518 Win=67584 Len=0 TSval=3291068932 TSecr=1217279334"
"150","20:21:05.552102","192.168.0.74","5.28.195.2","TCP","66","54227  >  443 [ACK] Seq=518 Ack=2 Win=1048560 Len=0 TSval=1217279376 TSecr=3291068932"
"151","20:21:05.552328","192.168.0.74","5.28.195.2","TCP","66","54227  >  443 [FIN, ACK] Seq=518 Ack=2 Win=1048560 Len=0 TSval=1217279376 TSecr=3291068932"
"152","20:21:05.589889","13.69.239.68","192.168.0.74","TCP","66","443  >  59626 [ACK] Seq=1 Ack=1544 Win=4194304 Len=0 TSval=54283366 TSecr=1045525313"
"153","20:21:05.589895","13.69.239.68","192.168.0.74","TLSv1.3","165","Hello Retry Request, Change Cipher Spec"
"154","20:21:05.591753","192.168.0.74","13.69.239.68","TCP","66","59626  >  443 [ACK] Seq=1544 Ack=100 Win=132288 Len=0 TSval=1045525380 TSecr=54283366"
"155","20:21:05.591758","192.168.0.74","13.69.239.68","TLSv1.3","455","Change Cipher Spec, Client Hello (SNI=eu-teams.events.data.microsoft.com)"
"156","20:21:05.593065","5.28.195.2","192.168.0.74","TCP","56","443  >  54227 [RST] Seq=2 Win=0 Len=0"
"157","20:21:05.652415","13.69.239.68","192.168.0.74","TLSv1.3","1474","Server Hello"
"158","20:21:05.652421","13.69.239.68","192.168.0.74","TCP","1474","443  >  59626 [ACK] Seq=1508 Ack=1933 Win=4193792 Len=1408 TSval=54283424 TSecr=1045525382 [TCP PDU reassembled in 161]"
"159","20:21:05.652424","13.69.239.68","192.168.0.74","TCP","1474","443  >  59626 [ACK] Seq=2916 Ack=1933 Win=4193792 Len=1408 TSval=54283424 TSecr=1045525382 [TCP PDU reassembled in 161]"
"160","20:21:05.652426","13.69.239.68","192.168.0.74","TCP","1474","443  >  59626 [ACK] Seq=4324 Ack=1933 Win=4193792 Len=1408 TSval=54283424 TSecr=1045525382 [TCP PDU reassembled in 161]"
"161","20:21:05.652427","13.69.239.68","192.168.0.74","TLSv1.3","799","Application Data"
"162","20:21:05.654653","192.168.0.74","13.69.239.68","TCP","66","59626  >  443 [ACK] Seq=1933 Ack=6465 Win=125952 Len=0 TSval=1045525443 TSecr=54283424"
"163","20:21:05.654659","192.168.0.74","13.69.239.68","TCP","66","[TCP Window Update] 59626  >  443 [ACK] Seq=1933 Ack=6465 Win=131072 Len=0 TSval=1045525443 TSecr=54283424"
"164","20:21:05.672719","192.168.0.74","13.69.239.68","TLSv1.3","140","Application Data"
"165","20:21:05.674026","192.168.0.74","13.69.239.68","TLSv1.3","489","Application Data"
"166","20:21:05.674382","192.168.0.74","13.69.239.68","TCP","1474","59626  >  443 [ACK] Seq=2430 Ack=6465 Win=131072 Len=1408 TSval=1045525464 TSecr=54283424 [TCP PDU reassembled in 168]"
"167","20:21:05.674383","192.168.0.74","13.69.239.68","TCP","1474","59626  >  443 [ACK] Seq=3838 Ack=6465 Win=131072 Len=1408 TSval=1045525464 TSecr=54283424 [TCP PDU reassembled in 168]"
"168","20:21:05.674395","192.168.0.74","13.69.239.68","TLSv1.3","819","Application Data"
"169","20:21:05.722241","13.69.239.68","192.168.0.74","TLSv1.3","169","Application Data"
"170","20:21:05.722243","13.69.239.68","192.168.0.74","TLSv1.3","128","Application Data"
"171","20:21:05.722636","192.168.0.74","5.28.195.2","TCP","78","[TCP Retransmission] 54226  >  5222 [SYN] Seq=0 Win=65535 Len=0 MSS=1460 WS=16 TSval=2904130455 TSecr=0 SACK_PERM"
"172","20:21:05.722663","192.168.0.74","13.69.239.68","TCP","66","59626  >  443 [ACK] Seq=5999 Ack=6630 Win=130944 Len=0 TSval=1045525512 TSecr=54283498"
"173","20:21:05.722680","192.168.0.74","5.28.195.2","TCP","78","[TCP Retransmission] 54224  >  80 [SYN] Seq=0 Win=65535 Len=0 MSS=1460 WS=16 TSval=2612036502 TSecr=0 SACK_PERM"
"174","20:21:05.722797","192.168.0.74","13.69.239.68","TLSv1.3","97","Application Data"
"175","20:21:05.731525","13.69.239.68","192.168.0.74","TCP","66","443  >  59626 [ACK] Seq=6630 Ack=5246 Win=4194304 Len=0 TSval=54283506 TSecr=1045525464"
"176","20:21:05.731527","13.69.239.68","192.168.0.74","TCP","66","443  >  59626 [ACK] Seq=6630 Ack=5999 Win=4193536 Len=0 TSval=54283506 TSecr=1045525464"
"177","20:21:05.770082","13.69.239.68","192.168.0.74","TLSv1.3","375","Application Data, Application Data"
"178","20:21:05.770341","192.168.0.74","13.69.239.68","TCP","66","59626  >  443 [ACK] Seq=6030 Ack=6939 Win=130816 Len=0 TSval=1045525560 TSecr=54283549"
"179","20:21:05.825683","13.69.239.68","192.168.0.74","TCP","66","443  >  59626 [ACK] Seq=6939 Ack=6030 Win=4193536 Len=0 TSval=54283605 TSecr=1045525513"
"180","20:21:05.973500","CompalBroadb_aa:60:7e","ee:99:94:f5:59:fd","ARP","56","Who has 192.168.0.74? Tell 192.168.0.1"
"181","20:21:05.973558","ee:99:94:f5:59:fd","CompalBroadb_aa:60:7e","ARP","42","192.168.0.74 is at ee:99:94:f5:59:fd"
"182","20:21:06.492281","192.168.0.164","224.0.0.251","MDNS","103","Standard query 0x0002 PTR _googlecast._tcp.local, ""QM"" question PTR _CC1AD845._sub._googlecast._tcp.local, ""QM"" question"
"183","20:21:06.492284","fe80::88b1:ebff:fea3:db79","ff02::fb","MDNS","123","Standard query 0x0002 PTR _googlecast._tcp.local, ""QM"" question PTR _CC1AD845._sub._googlecast._tcp.local, ""QM"" question"
"184","20:21:06.645553","192.168.0.74","192.87.28.82","TLSv1.2","602","Application Data"
"185","20:21:06.723177","192.168.0.74","5.28.195.2","TCP","78","[TCP Retransmission] 54226  >  5222 [SYN] Seq=0 Win=65535 Len=0 MSS=1460 WS=16 TSval=2904131455 TSecr=0 SACK_PERM"
"186","20:21:06.723222","192.168.0.74","5.28.195.2","TCP","78","[TCP Retransmission] 54224  >  80 [SYN] Seq=0 Win=65535 Len=0 MSS=1460 WS=16 TSval=2612037502 TSecr=0 SACK_PERM"
"187","20:21:06.736180","192.87.28.82","192.168.0.74","TCP","66","9001  >  53922 [ACK] Seq=27573 Ack=18813 Win=1043 Len=0 TSval=3379213858 TSecr=2983869436"
"188","20:21:06.782549","192.87.28.82","192.168.0.74","TLSv1.2","602","Application Data"
"189","20:21:06.782670","192.168.0.74","192.87.28.82","TCP","66","53922  >  9001 [ACK] Seq=18813 Ack=28109 Win=4020 Len=0 TSval=2983869573 TSecr=3379213910"
"190","20:21:06.783800","192.168.0.74","192.87.28.82","TCP","1474","53922  >  9001 [ACK] Seq=18813 Ack=28109 Win=4028 Len=1408 TSval=2983869574 TSecr=3379213910 [TCP PDU reassembled in 191]"
"191","20:21:06.783821","192.168.0.74","192.87.28.82","TLSv1.2","736","Application Data"
"192","20:21:06.834200","192.87.28.82","192.168.0.74","TCP","66","9001  >  53922 [ACK] Seq=28109 Ack=20891 Win=1011 Len=0 TSval=3379213960 TSecr=2983869574"
"193","20:21:06.981881","2a02:ab88:b:4100:6163:ab1b:4f48:fc2c","2603:1063:7::c9","TLSv1.2","136","Application Data"
"194","20:21:07.032524","2603:1063:7::c9","2a02:ab88:b:4100:6163:ab1b:4f48:fc2c","TLSv1.2","125","Application Data"
"195","20:21:07.032693","2a02:ab88:b:4100:6163:ab1b:4f48:fc2c","2603:1063:7::c9","TCP","86","53384  >  443 [ACK] Seq=51 Ack=40 Win=2048 Len=0 TSval=3552738986 TSecr=1650622704"
"196","20:21:07.036578","192.87.28.82","192.168.0.74","TCP","1474","9001  >  53922 [ACK] Seq=28109 Ack=20891 Win=1043 Len=1408 TSval=3379214157 TSecr=2983869574 [TCP PDU reassembled in 198]"
"197","20:21:07.036581","192.87.28.82","192.168.0.74","TCP","1474","9001  >  53922 [ACK] Seq=29517 Ack=20891 Win=1043 Len=1408 TSval=3379214157 TSecr=2983869574 [TCP PDU reassembled in 198]"
"198","20:21:07.036583","192.87.28.82","192.168.0.74","TLSv1.2","870","Application Data"
"199","20:21:07.036745","192.168.0.74","192.87.28.82","TCP","66","53922  >  9001 [ACK] Seq=20891 Ack=29517 Win=4006 Len=0 TSval=2983869827 TSecr=3379214157"
"200","20:21:07.036810","192.168.0.74","192.87.28.82","TCP","66","53922  >  9001 [ACK] Seq=20891 Ack=31729 Win=3972 Len=0 TSval=2983869827 TSecr=3379214157"
"201","20:21:07.036970","192.168.0.74","192.87.28.82","TCP","66","[TCP Window Update] 53922  >  9001 [ACK] Seq=20891 Ack=31729 Win=4028 Len=0 TSval=2983869827 TSecr=3379214157"
"202","20:21:07.093051","192.87.28.82","192.168.0.74","TLSv1.2","1116","Application Data"
"203","20:21:07.093189","192.168.0.74","192.87.28.82","TCP","66","53922  >  9001 [ACK] Seq=20891 Ack=32779 Win=4012 Len=0 TSval=2983869883 TSecr=3379214211"
"204","20:21:07.093506","192.168.0.74","192.87.28.82","TLSv1.2","602","Application Data"
"205","20:21:07.096445","192.168.0.74","192.87.28.82","TLSv1.2","1474","Application Data"
"206","20:21:07.096483","192.168.0.74","192.87.28.82","TLSv1.2","1272","Application Data"
"207","20:21:07.141191","192.87.28.82","192.168.0.74","TCP","66","9001  >  53922 [ACK] Seq=32779 Ack=22835 Win=1021 Len=0 TSval=3379214268 TSecr=2983869884"
"208","20:21:07.178372","192.87.28.82","192.168.0.74","TCP","66","9001  >  53922 [ACK] Seq=32779 Ack=24041 Win=1043 Len=0 TSval=3379214308 TSecr=2983869886"
"209","20:21:07.263064","192.87.28.82","192.168.0.74","TLSv1.2","1116","Application Data"
"210","20:21:07.263194","192.168.0.74","192.87.28.82","TCP","66","53922  >  9001 [ACK] Seq=24041 Ack=33829 Win=4012 Len=0 TSval=2983870053 TSecr=3379214393"
"211","20:21:07.314598","192.87.28.82","192.168.0.74","TLSv1.2","602","Application Data"
"212","20:21:07.314793","192.168.0.74","192.87.28.82","TCP","66","53922  >  9001 [ACK] Seq=24041 Ack=34365 Win=4020 Len=0 TSval=2983870105 TSecr=3379214444"
"213","20:21:07.366027","192.168.0.74","192.87.28.82","TCP","1474","53922  >  9001 [ACK] Seq=24041 Ack=34365 Win=4028 Len=1408 TSval=2983870156 TSecr=3379214444 [TCP PDU reassembled in 214]"
"214","20:21:07.366051","192.168.0.74","192.87.28.82","TLSv1.2","736","Application Data"
"215","20:21:07.404362","192.87.28.82","192.168.0.74","TCP","66","9001  >  53922 [ACK] Seq=34365 Ack=26119 Win=1011 Len=0 TSval=3379214530 TSecr=2983870156"
"216","20:21:07.514575","192.168.0.164","224.0.0.251","MDNS","103","Standard query 0x0003 PTR _googlecast._tcp.local, ""QM"" question PTR _CC1AD845._sub._googlecast._tcp.local, ""QM"" question"
"217","20:21:07.514578","fe80::88b1:ebff:fea3:db79","ff02::fb","MDNS","123","Standard query 0x0003 PTR _googlecast._tcp.local, ""QM"" question PTR _CC1AD845._sub._googlecast._tcp.local, ""QM"" question"
"218","20:21:07.564023","192.87.28.82","192.168.0.74","TCP","1474","9001  >  53922 [ACK] Seq=34365 Ack=26119 Win=1043 Len=1408 TSval=3379214691 TSecr=2983870156 [TCP PDU reassembled in 220]"
"219","20:21:07.564027","192.87.28.82","192.168.0.74","TCP","1474","9001  >  53922 [ACK] Seq=35773 Ack=26119 Win=1043 Len=1408 TSval=3379214691 TSecr=2983870156 [TCP PDU reassembled in 220]"
"220","20:21:07.564029","192.87.28.82","192.168.0.74","TLSv1.2","1320","Application Data"
"221","20:21:07.564982","192.87.28.82","192.168.0.74","TCP","1474","9001  >  53922 [ACK] Seq=38435 Ack=26119 Win=1043 Len=1408 TSval=3379214691 TSecr=2983870156 [TCP PDU reassembled in 223]"
"222","20:21:07.564985","192.87.28.82","192.168.0.74","TCP","1474","9001  >  53922 [ACK] Seq=39843 Ack=26119 Win=1043 Len=1408 TSval=3379214691 TSecr=2983870156 [TCP PDU reassembled in 223]"
"223","20:21:07.564987","192.87.28.82","192.168.0.74","TLSv1.2","934","Application Data"
"224","20:21:07.565214","192.168.0.74","192.87.28.82","TCP","66","53922  >  9001 [ACK] Seq=26119 Ack=42119 Win=3907 Len=0 TSval=2983870355 TSecr=3379214691"
"225","20:21:07.565432","192.168.0.74","192.87.28.82","TCP","66","[TCP Window Update] 53922  >  9001 [ACK] Seq=26119 Ack=42119 Win=4028 Len=0 TSval=2983870355 TSecr=3379214691"
"226","20:21:07.572469","192.87.28.82","192.168.0.74","TCP","1474","9001  >  53922 [ACK] Seq=42119 Ack=26119 Win=1043 Len=1408 TSval=3379214702 TSecr=2983870156 [TCP PDU reassembled in 228]"
"227","20:21:07.572472","192.87.28.82","192.168.0.74","TCP","1474","9001  >  53922 [ACK] Seq=43527 Ack=26119 Win=1043 Len=1408 TSval=3379214702 TSecr=2983870156 [TCP PDU reassembled in 228]"
"228","20:21:07.572474","192.87.28.82","192.168.0.74","TLSv1.2","1320","Application Data"
"229","20:21:07.572614","192.168.0.74","192.87.28.82","TCP","66","53922  >  9001 [ACK] Seq=26119 Ack=46189 Win=3965 Len=0 TSval=2983870363 TSecr=3379214702"
"230","20:21:07.572748","192.168.0.74","192.87.28.82","TCP","66","[TCP Window Update] 53922  >  9001 [ACK] Seq=26119 Ack=46189 Win=4028 Len=0 TSval=2983870363 TSecr=3379214702"
"231","20:21:07.603054","192.87.28.82","192.168.0.74","TLSv1.2","1474","Application Data"
"232","20:21:07.603057","192.87.28.82","192.168.0.74","TCP","1474","9001  >  53922 [ACK] Seq=47597 Ack=26119 Win=1043 Len=1408 TSval=3379214732 TSecr=2983870355 [TCP PDU reassembled in 233]"
"233","20:21:07.603059","192.87.28.82","192.168.0.74","TLSv1.2","1406","Application Data"
"234","20:21:07.603194","192.168.0.74","192.87.28.82","TCP","66","53922  >  9001 [ACK] Seq=26119 Ack=50345 Win=3964 Len=0 TSval=2983870393 TSecr=3379214732"
"235","20:21:07.603369","192.168.0.74","192.87.28.82","TCP","66","[TCP Window Update] 53922  >  9001 [ACK] Seq=26119 Ack=50345 Win=4028 Len=0 TSval=2983870393 TSecr=3379214732"
"236","20:21:07.603827","192.168.0.74","192.87.28.82","TLSv1.2","602","Application Data"
"237","20:21:07.612091","192.87.28.82","192.168.0.74","TLSv1.2","1474","Application Data"
"238","20:21:07.612094","192.87.28.82","192.168.0.74","TCP","1474","9001  >  53922 [ACK] Seq=51753 Ack=26119 Win=1043 Len=1408 TSval=3379214736 TSecr=2983870363 [TCP PDU reassembled in 240]"
"239","20:21:07.612096","192.87.28.82","192.168.0.74","TCP","1474","9001  >  53922 [ACK] Seq=53161 Ack=26119 Win=1043 Len=1408 TSval=3379214736 TSecr=2983870363 [TCP PDU reassembled in 240]"
"240","20:21:07.612099","192.87.28.82","192.168.0.74","TLSv1.2","1026","Application Data"
"241","20:21:07.612101","192.87.28.82","192.168.0.74","TCP","1474","9001  >  53922 [ACK] Seq=55529 Ack=26119 Win=1043 Len=1408 TSval=3379214736 TSecr=2983870363 [TCP PDU reassembled in 243]"
"242","20:21:07.612102","192.87.28.82","192.168.0.74","TCP","1474","9001  >  53922 [ACK] Seq=56937 Ack=26119 Win=1043 Len=1408 TSval=3379214736 TSecr=2983870363 [TCP PDU reassembled in 243]"
"243","20:21:07.612104","192.87.28.82","192.168.0.74","TLSv1.2","1320","Application Data"
"244","20:21:07.612106","192.87.28.82","192.168.0.74","TCP","1474","9001  >  53922 [ACK] Seq=59599 Ack=26119 Win=1043 Len=1408 TSval=3379214736 TSecr=2983870363 [TCP PDU reassembled in 246]"
"245","20:21:07.612108","192.87.28.82","192.168.0.74","TCP","1474","9001  >  53922 [ACK] Seq=61007 Ack=26119 Win=1043 Len=1408 TSval=3379214736 TSecr=2983870363 [TCP PDU reassembled in 246]"
"246","20:21:07.612109","192.87.28.82","192.168.0.74","TLSv1.2","998","Application Data"
"247","20:21:07.612263","192.168.0.74","192.87.28.82","TCP","66","53922  >  9001 [ACK] Seq=26655 Ack=63347 Win=3825 Len=0 TSval=2983870402 TSecr=3379214736"
"248","20:21:07.612443","192.168.0.74","192.87.28.82","TCP","66","[TCP Window Update] 53922  >  9001 [ACK] Seq=26655 Ack=63347 Win=4028 Len=0 TSval=2983870402 TSecr=3379214736"
"249","20:21:07.620801","192.87.28.82","192.168.0.74","TCP","1474","9001  >  53922 [ACK] Seq=63347 Ack=26119 Win=1043 Len=1408 TSval=3379214742 TSecr=2983870363 [TCP PDU reassembled in 251]"
"250","20:21:07.620804","192.87.28.82","192.168.0.74","TCP","1474","9001  >  53922 [ACK] Seq=64755 Ack=26119 Win=1043 Len=1408 TSval=3379214742 TSecr=2983870363 [TCP PDU reassembled in 251]"
"251","20:21:07.620806","192.87.28.82","192.168.0.74","TLSv1.2","1320","Application Data"
"252","20:21:07.620921","192.168.0.74","192.87.28.82","TCP","66","53922  >  9001 [ACK] Seq=26655 Ack=67417 Win=3965 Len=0 TSval=2983870411 TSecr=3379214742"
"253","20:21:07.621086","192.168.0.74","192.87.28.82","TCP","66","[TCP Window Update] 53922  >  9001 [ACK] Seq=26655 Ack=67417 Win=4028 Len=0 TSval=2983870411 TSecr=3379214742"
"254","20:21:07.634188","192.87.28.82","192.168.0.74","TLSv1.2","1474","Application Data"
"255","20:21:07.634310","192.168.0.74","192.87.28.82","TLSv1.2","602","Application Data"
"256","20:21:07.641138","192.87.28.82","192.168.0.74","TCP","1474","9001  >  53922 [ACK] Seq=68825 Ack=26119 Win=1043 Len=1408 TSval=3379214765 TSecr=2983870393 [TCP PDU reassembled in 258]"
"257","20:21:07.641140","192.87.28.82","192.168.0.74","TCP","1474","9001  >  53922 [ACK] Seq=70233 Ack=26119 Win=1043 Len=1408 TSval=3379214765 TSecr=2983870393 [TCP PDU reassembled in 258]"
"258","20:21:07.641142","192.87.28.82","192.168.0.74","TLSv1.2","1474","Application Data"
"259","20:21:07.641252","192.168.0.74","192.87.28.82","TCP","66","53922  >  9001 [ACK] Seq=27191 Ack=73049 Win=3962 Len=0 TSval=2983870431 TSecr=3379214765"
"260","20:21:07.641366","192.168.0.74","192.87.28.82","TCP","66","[TCP Window Update] 53922  >  9001 [ACK] Seq=27191 Ack=73049 Win=4028 Len=0 TSval=2983870431 TSecr=3379214765"
"261","20:21:07.651559","192.87.28.82","192.168.0.74","TCP","1474","9001  >  53922 [ACK] Seq=73049 Ack=26655 Win=1043 Len=1408 TSval=3379214774 TSecr=2983870394 [TCP PDU reassembled in 263]"
"262","20:21:07.651561","192.87.28.82","192.168.0.74","TCP","1474","9001  >  53922 [ACK] Seq=74457 Ack=26655 Win=1043 Len=1408 TSval=3379214774 TSecr=2983870394 [TCP PDU reassembled in 263]"
"263","20:21:07.651563","192.87.28.82","192.168.0.74","TLSv1.2","1474","Application Data, Application Data"
"264","20:21:07.651564","192.87.28.82","192.168.0.74","TCP","1474","9001  >  53922 [ACK] Seq=77273 Ack=26655 Win=1043 Len=1408 TSval=3379214774 TSecr=2983870394 [TCP PDU reassembled in 266]"
"265","20:21:07.651566","192.87.28.82","192.168.0.74","TCP","1474","9001  >  53922 [ACK] Seq=78681 Ack=26655 Win=1043 Len=1408 TSval=3379214774 TSecr=2983870394 [TCP PDU reassembled in 266]"
"266","20:21:07.651567","192.87.28.82","192.168.0.74","TLSv1.2","440","Application Data, Application Data"
"267","20:21:07.651568","192.87.28.82","192.168.0.74","TCP","1474","9001  >  53922 [ACK] Seq=80463 Ack=26655 Win=1043 Len=1408 TSval=3379214776 TSecr=2983870394 [TCP PDU reassembled in 269]"
"268","20:21:07.651569","192.87.28.82","192.168.0.74","TCP","1474","9001  >  53922 [ACK] Seq=81871 Ack=26655 Win=1043 Len=1408 TSval=3379214776 TSecr=2983870394 [TCP PDU reassembled in 269]"
"269","20:21:07.651571","192.87.28.82","192.168.0.74","TLSv1.2","870","Application Data"
"270","20:21:07.651687","192.168.0.74","192.87.28.82","TCP","66","53922  >  9001 [ACK] Seq=27191 Ack=84083 Win=3856 Len=0 TSval=2983870442 TSecr=3379214776"
"271","20:21:07.651818","192.168.0.74","192.87.28.82","TCP","66","[TCP Window Update] 53922  >  9001 [ACK] Seq=27191 Ack=84083 Win=4028 Len=0 TSval=2983870442 TSecr=3379214776"
"272","20:21:07.660036","192.87.28.82","192.168.0.74","TLSv1.2","1474","Application Data"
"273","20:21:07.660038","192.87.28.82","192.168.0.74","TCP","1474","9001  >  53922 [ACK] Seq=85491 Ack=26655 Win=1043 Len=1408 TSval=3379214782 TSecr=2983870402 [TCP PDU reassembled in 275]"
"274","20:21:07.660040","192.87.28.82","192.168.0.74","TCP","1474","9001  >  53922 [ACK] Seq=86899 Ack=26655 Win=1043 Len=1408 TSval=3379214783 TSecr=2983870411 [TCP PDU reassembled in 275]"
"275","20:21:07.660041","192.87.28.82","192.168.0.74","TLSv1.2","1048","Application Data, Application Data"
