"No.","Time","Source","Destination","Protocol","Length","Info"
"1","20:23:46.774285","192.168.0.74","5.28.195.2","TCP","78","54528  >  80 [SYN] Seq=0 Win=65535 Len=0 MSS=1460 WS=16 TSval=3865721154 TSecr=0 SACK_PERM"
"2","20:23:46.774368","192.168.0.74","5.28.195.2","TCP","78","54527  >  5222 [SYN] Seq=0 Win=65535 Len=0 MSS=1460 WS=16 TSval=3448987626 TSecr=0 SACK_PERM"
"3","20:23:46.974195","2a02:ab88:b:4100:6163:ab1b:4f48:fc2c","2603:1063:7::c9","TLSv1.2","136","Application Data"
"4","20:23:47.028205","2603:1063:7::c9","2a02:ab88:b:4100:6163:ab1b:4f48:fc2c","TLSv1.2","125","Application Data"
"5","20:23:47.028448","2a02:ab88:b:4100:6163:ab1b:4f48:fc2c","2603:1063:7::c9","TCP","86","53384  >  443 [ACK] Seq=51 Ack=40 Win=2048 Len=0 TSval=3552898988 TSecr=1650782696"
"6","20:23:47.475722","192.168.0.74","5.28.195.2","TCP","78","54529  >  443 [SYN, ECE, CWR] Seq=0 Win=65535 Len=0 MSS=1460 WS=16 TSval=921640458 TSecr=0 SACK_PERM"
"7","20:23:47.520093","5.28.195.2","192.168.0.74","TCP","74","443  >  54529 [SYN, ACK, ECE] Seq=0 Ack=1 Win=65535 Len=0 MSS=1240 SACK_PERM TSval=2277290823 TSecr=921640458 WS=1024"
"8","20:23:47.520336","192.168.0.74","5.28.195.2","TCP","66","54529  >  443 [ACK] Seq=1 Ack=1 Win=1048560 Len=0 TSval=921640503 TSecr=2277290823"
"9","20:23:47.520611","192.168.0.74","5.28.195.2","TLSv1","583","Client Hello"
"10","20:23:47.566429","5.28.195.2","192.168.0.74","TCP","66","443  >  54529 [ACK] Seq=1 Ack=518 Win=67584 Len=0 TSval=2277290927 TSecr=921640503"
"11","20:23:47.566431","5.28.195.2","192.168.0.74","TCP","66","443  >  54529 [FIN, ACK] Seq=1 Ack=518 Win=67584 Len=0 TSval=2277290928 TSecr=921640503"
"12","20:23:47.566570","192.168.0.74","5.28.195.2","TCP","66","54529  >  443 [ACK] Seq=518 Ack=2 Win=1048560 Len=0 TSval=921640549 TSecr=2277290928"
"13","20:23:47.566708","192.168.0.74","5.28.195.2","TCP","66","54529  >  443 [FIN, ACK] Seq=518 Ack=2 Win=1048560 Len=0 TSval=921640550 TSecr=2277290928"
"14","20:23:47.611531","5.28.195.2","192.168.0.74","TCP","66","443  >  54529 [ACK] Seq=2 Ack=519 Win=67584 Len=0 TSval=2277290972 TSecr=921640550"
"15","20:23:47.775033","192.168.0.74","5.28.195.2","TCP","78","[TCP Retransmission] 54528  >  80 [SYN] Seq=0 Win=65535 Len=0 MSS=1460 WS=16 TSval=3865722155 TSecr=0 SACK_PERM"
"16","20:23:47.775113","192.168.0.74","5.28.195.2","TCP","78","[TCP Retransmission] 54527  >  5222 [SYN] Seq=0 Win=65535 Len=0 MSS=1460 WS=16 TSval=3448988627 TSecr=0 SACK_PERM"
"17","20:23:48.775861","192.168.0.74","5.28.195.2","TCP","78","[TCP Retransmission] 54528  >  80 [SYN] Seq=0 Win=65535 Len=0 MSS=1460 WS=16 TSval=3865723156 TSecr=0 SACK_PERM"
"18","20:23:48.775896","192.168.0.74","5.28.195.2","TCP","78","[TCP Retransmission] 54527  >  5222 [SYN] Seq=0 Win=65535 Len=0 MSS=1460 WS=16 TSval=3448989628 TSecr=0 SACK_PERM"
"19","20:23:48.907870","fe80::1817:fddd:60ce:b28f","fe80::49c:fb07:3c9a:aa62","TCP","396","63481  >  53352 [PSH, ACK] Seq=1 Ack=1 Win=2048 Len=310 TSval=2993140237 TSecr=3822660895"
"20","20:23:48.908186","fe80::49c:fb07:3c9a:aa62","fe80::1817:fddd:60ce:b28f","TCP","86","53352  >  63481 [ACK] Seq=1 Ack=311 Win=2048 Len=0 TSval=3822782460 TSecr=2993140237"
"21","20:23:49.066510","fe80::49c:fb07:3c9a:aa62","fe80::1817:fddd:60ce:b28f","TCP","1193","53352  >  63481 [PSH, ACK] Seq=1 Ack=311 Win=2048 Len=1107 TSval=3822782618 TSecr=2993140237"
"22","20:23:49.071946","fe80::1817:fddd:60ce:b28f","fe80::49c:fb07:3c9a:aa62","TCP","86","63481  >  53352 [ACK] Seq=311 Ack=1108 Win=2031 Len=0 TSval=2993140402 TSecr=3822782618"
"23","20:23:49.272475","fe80::1817:fddd:60ce:b28f","fe80::49c:fb07:3c9a:aa62","TCP","479","63481  >  53352 [PSH, ACK] Seq=311 Ack=1108 Win=2048 Len=393 TSval=2993140603 TSecr=3822782618"
"24","20:23:49.272714","fe80::49c:fb07:3c9a:aa62","fe80::1817:fddd:60ce:b28f","TCP","86","53352  >  63481 [ACK] Seq=1108 Ack=704 Win=2042 Len=0 TSval=3822782824 TSecr=2993140603"
"25","20:23:49.281732","fe80::49c:fb07:3c9a:aa62","fe80::1817:fddd:60ce:b28f","TCP","492","53352  >  63481 [PSH, ACK] Seq=1108 Ack=704 Win=2048 Len=406 TSval=3822782834 TSecr=2993140603"
"26","20:23:49.287188","fe80::1817:fddd:60ce:b28f","fe80::49c:fb07:3c9a:aa62","TCP","86","63481  >  53352 [ACK] Seq=704 Ack=1514 Win=2042 Len=0 TSval=2993140618 TSecr=3822782834"
"27","20:23:49.550714","CompalBroadb_aa:60:7e","ee:99:94:f5:59:fd","ARP","56","192.168.0.1 is at ac:22:05:aa:60:7e"
"28","20:23:49.776720","192.168.0.74","5.28.195.2","TCP","78","[TCP Retransmission] 54528  >  80 [SYN] Seq=0 Win=65535 Len=0 MSS=1460 WS=16 TSval=3865724157 TSecr=0 SACK_PERM"
"29","20:23:49.776752","192.168.0.74","5.28.195.2","TCP","78","[TCP Retransmission] 54527  >  5222 [SYN] Seq=0 Win=65535 Len=0 MSS=1460 WS=16 TSval=3448990629 TSecr=0 SACK_PERM"
"30","20:23:49.786708","87.228.47.204","192.168.0.74","TCP","66","443  >  59571 [ACK] Seq=1 Ack=1 Win=507 Len=0 TSval=74838913 TSecr=2111788361"
"31","20:23:49.786836","192.168.0.74","87.228.47.204","TCP","66","[TCP ACKed unseen segment] 59571  >  443 [ACK] Seq=1 Ack=2 Win=2048 Len=0 TSval=2111803685 TSecr=74823659"
"32","20:23:49.926998","192.168.0.74","5.28.195.2","TCP","78","54530  >  443 [SYN, ECE, CWR] Seq=0 Win=65535 Len=0 MSS=1460 WS=16 TSval=1738539927 TSecr=0 SACK_PERM"
"33","20:23:49.964522","5.28.195.2","192.168.0.74","TCP","74","443  >  54530 [SYN, ACK, ECE] Seq=0 Ack=1 Win=65535 Len=0 MSS=1240 SACK_PERM TSval=3041543179 TSecr=1738539927 WS=1024"
"34","20:23:49.964701","192.168.0.74","5.28.195.2","TCP","66","54530  >  443 [ACK] Seq=1 Ack=1 Win=1048560 Len=0 TSval=1738539965 TSecr=3041543179"
"35","20:23:49.964984","192.168.0.74","5.28.195.2","TLSv1","583","Client Hello"
"36","20:23:50.007822","5.28.195.2","192.168.0.74","TCP","66","443  >  54530 [ACK] Seq=1 Ack=518 Win=67584 Len=0 TSval=3041543232 TSecr=1738539965"
"37","20:23:50.193430","5.28.195.2","192.168.0.74","TCP","66","443  >  54530 [FIN, ACK] Seq=1 Ack=518 Win=67584 Len=0 TSval=3041543418 TSecr=1738539965"
"38","20:23:50.193532","192.168.0.74","5.28.195.2","TCP","66","54530  >  443 [ACK] Seq=518 Ack=2 Win=1048560 Len=0 TSval=1738540193 TSecr=3041543418"
"39","20:23:50.193665","192.168.0.74","5.28.195.2","TCP","66","54530  >  443 [FIN, ACK] Seq=518 Ack=2 Win=1048560 Len=0 TSval=1738540194 TSecr=3041543418"
"40","20:23:50.240271","5.28.195.2","192.168.0.74","TCP","56","443  >  54530 [RST] Seq=2 Win=0 Len=0"
"41","20:23:50.245437","192.168.0.74","192.87.28.82","TCP","1474","53922  >  9001 [ACK] Seq=1 Ack=1 Win=4336 Len=1408 TSval=2984033042 TSecr=3379373373 [TCP PDU reassembled in 42]"
"42","20:23:50.245455","192.168.0.74","192.87.28.82","TLSv1.2","736","Application Data"
"43","20:23:50.289245","192.87.28.82","192.168.0.74","TCP","66","9001  >  53922 [ACK] Seq=1 Ack=2079 Win=1033 Len=0 TSval=3379377417 TSecr=2984033042"
"44","20:23:50.388013","192.87.28.82","192.168.0.74","TLSv1.2","1116","Application Data"
"45","20:23:50.388170","192.168.0.74","192.87.28.82","TCP","66","53922  >  9001 [ACK] Seq=2079 Ack=1051 Win=4320 Len=0 TSval=2984033185 TSecr=3379377515"
"46","20:23:50.436729","192.87.28.82","192.168.0.74","TLSv1.2","1116","Application Data"
"47","20:23:50.436876","192.168.0.74","192.87.28.82","TCP","66","53922  >  9001 [ACK] Seq=2079 Ack=2101 Win=4320 Len=0 TSval=2984033234 TSecr=3379377561"
"48","20:23:50.474064","192.87.28.82","192.168.0.74","TLSv1.2","602","Application Data"
"49","20:23:50.474221","192.168.0.74","192.87.28.82","TCP","66","53922  >  9001 [ACK] Seq=2079 Ack=2637 Win=4328 Len=0 TSval=2984033271 TSecr=3379377602"
"50","20:23:50.521759","192.168.0.74","192.87.28.82","TCP","1474","53922  >  9001 [ACK] Seq=2079 Ack=2637 Win=4336 Len=1408 TSval=2984033319 TSecr=3379377602 [TCP PDU reassembled in 51]"
"51","20:23:50.521786","192.168.0.74","192.87.28.82","TLSv1.2","736","Application Data"
"52","20:23:50.561983","192.87.28.82","192.168.0.74","TCP","66","9001  >  53922 [ACK] Seq=2637 Ack=4157 Win=1011 Len=0 TSval=3379377687 TSecr=2984033319"
"53","20:23:50.635797","192.87.28.82","192.168.0.74","TCP","1474","9001  >  53922 [ACK] Seq=2637 Ack=4157 Win=1043 Len=1408 TSval=3379377765 TSecr=2984033319 [TCP PDU reassembled in 55]"
"54","20:23:50.635803","192.87.28.82","192.168.0.74","TCP","1474","9001  >  53922 [ACK] Seq=4045 Ack=4157 Win=1043 Len=1408 TSval=3379377765 TSecr=2984033319 [TCP PDU reassembled in 55]"
"55","20:23:50.635805","192.87.28.82","192.168.0.74","TLSv1.2","870","Application Data"
"56","20:23:50.635958","192.168.0.74","192.87.28.82","TCP","66","53922  >  9001 [ACK] Seq=4157 Ack=6257 Win=4280 Len=0 TSval=2984033433 TSecr=3379377765"
"57","20:23:50.636189","192.168.0.74","192.87.28.82","TCP","66","[TCP Window Update] 53922  >  9001 [ACK] Seq=4157 Ack=6257 Win=4336 Len=0 TSval=2984033433 TSecr=3379377765"
"58","20:23:50.680712","192.87.28.82","192.168.0.74","TCP","1474","9001  >  53922 [ACK] Seq=6257 Ack=4157 Win=1043 Len=1408 TSval=3379377807 TSecr=2984033433 [TCP PDU reassembled in 60]"
"59","20:23:50.680716","192.87.28.82","192.168.0.74","TCP","1474","9001  >  53922 [ACK] Seq=7665 Ack=4157 Win=1043 Len=1408 TSval=3379377807 TSecr=2984033433 [TCP PDU reassembled in 60]"
"60","20:23:50.680717","192.87.28.82","192.168.0.74","TLSv1.2","1320","Application Data"
"61","20:23:50.680887","192.168.0.74","192.87.28.82","TCP","66","53922  >  9001 [ACK] Seq=4157 Ack=10327 Win=4273 Len=0 TSval=2984033478 TSecr=3379377807"
"62","20:23:50.681193","192.168.0.74","192.87.28.82","TCP","66","[TCP Window Update] 53922  >  9001 [ACK] Seq=4157 Ack=10327 Win=4336 Len=0 TSval=2984033478 TSecr=3379377807"
"63","20:23:50.695780","192.87.28.82","192.168.0.74","TLSv1.2","1474","Application Data"
"64","20:23:50.695783","192.87.28.82","192.168.0.74","TCP","1474","9001  >  53922 [ACK] Seq=11735 Ack=4157 Win=1043 Len=1408 TSval=3379377818 TSecr=2984033433 [TCP PDU reassembled in 65]"
"65","20:23:50.695785","192.87.28.82","192.168.0.74","TLSv1.2","956","Application Data"
"66","20:23:50.695938","192.168.0.74","192.87.28.82","TCP","66","53922  >  9001 [ACK] Seq=4157 Ack=14033 Win=4279 Len=0 TSval=2984033493 TSecr=3379377818"
"67","20:23:50.696372","192.168.0.74","192.87.28.82","TCP","66","[TCP Window Update] 53922  >  9001 [ACK] Seq=4157 Ack=14033 Win=4336 Len=0 TSval=2984033493 TSecr=3379377818"
"68","20:23:50.709068","64.65.63.120","192.168.0.74","TCP","1474","443  >  53923 [ACK] Seq=1 Ack=1 Win=1890 Len=1408 TSval=2625531902 TSecr=38289185 [TCP PDU reassembled in 71]"
"69","20:23:50.709221","192.168.0.74","64.65.63.120","TCP","66","53923  >  443 [ACK] Seq=1 Ack=1409 Win=4974 Len=0 TSval=38293650 TSecr=2625531902"
"70","20:23:50.710758","64.65.63.120","192.168.0.74","TCP","1474","443  >  53923 [PSH, ACK] Seq=1409 Ack=1 Win=1890 Len=1408 TSval=2625531902 TSecr=38289185 [TCP PDU reassembled in 71]"
"71","20:23:50.711537","64.65.63.120","192.168.0.74","TLSv1.2","870","Application Data"
"72","20:23:50.711647","192.168.0.74","64.65.63.120","TCP","66","53923  >  443 [ACK] Seq=1 Ack=3621 Win=4962 Len=0 TSval=38293653 TSecr=2625531902"
"73","20:23:50.712026","192.168.0.74","64.65.63.120","TLSv1.2","602","Application Data"
"74","20:23:50.722520","192.87.28.82","192.168.0.74","TLSv1.2","1474","Application Data"
"75","20:23:50.722523","192.87.28.82","192.168.0.74","TCP","1474","9001  >  53922 [ACK] Seq=15441 Ack=4157 Win=1043 Len=1408 TSval=3379377853 TSecr=2984033478 [TCP PDU reassembled in 77]"
"76","20:23:50.722526","192.87.28.82","192.168.0.74","TCP","1474","9001  >  53922 [ACK] Seq=16849 Ack=4157 Win=1043 Len=1408 TSval=3379377853 TSecr=2984033478 [TCP PDU reassembled in 77]"
"77","20:23:50.722528","192.87.28.82","192.168.0.74","TLSv1.2","448","Application Data"
"78","20:23:50.722700","192.168.0.74","192.87.28.82","TCP","66","53922  >  9001 [ACK] Seq=4157 Ack=18639 Win=4265 Len=0 TSval=2984033520 TSecr=3379377853"
"79","20:23:50.723026","192.168.0.74","192.87.28.82","TCP","66","[TCP Window Update] 53922  >  9001 [ACK] Seq=4157 Ack=18639 Win=4336 Len=0 TSval=2984033520 TSecr=3379377853"
"80","20:23:50.723370","192.168.0.74","192.87.28.82","TLSv1.2","602","Application Data"
"81","20:23:50.744451","192.87.28.82","192.168.0.74","TLSv1.2","1474","Application Data"
"82","20:23:50.744454","192.87.28.82","192.168.0.74","TCP","1474","9001  >  53922 [ACK] Seq=20047 Ack=4157 Win=1043 Len=1408 TSval=3379377873 TSecr=2984033493 [TCP PDU reassembled in 83]"
"83","20:23:50.744457","192.87.28.82","192.168.0.74","TLSv1.2","1470","Application Data"
"84","20:23:50.744619","192.168.0.74","192.87.28.82","TCP","66","53922  >  9001 [ACK] Seq=4693 Ack=22859 Win=4271 Len=0 TSval=2984033542 TSecr=3379377873"
"85","20:23:50.744943","192.168.0.74","192.87.28.82","TCP","66","[TCP Window Update] 53922  >  9001 [ACK] Seq=4693 Ack=22859 Win=4336 Len=0 TSval=2984033542 TSecr=3379377873"
"86","20:23:50.759685","64.65.63.120","192.168.0.74","TCP","66","443  >  53923 [ACK] Seq=3621 Ack=537 Win=1899 Len=0 TSval=2625531955 TSecr=38293653"
"87","20:23:50.761958","64.65.63.120","192.168.0.74","TCP","1474","443  >  53923 [ACK] Seq=3621 Ack=537 Win=1899 Len=1408 TSval=2625531956 TSecr=38293653 [TCP PDU reassembled in 89]"
"88","20:23:50.761961","64.65.63.120","192.168.0.74","TCP","1474","443  >  53923 [PSH, ACK] Seq=5029 Ack=537 Win=1899 Len=1408 TSval=2625531956 TSecr=38293653 [TCP PDU reassembled in 89]"
"89","20:23:50.761963","64.65.63.120","192.168.0.74","TLSv1.2","1320","Application Data"
"90","20:23:50.762084","192.168.0.74","64.65.63.120","TCP","66","53923  >  443 [ACK] Seq=537 Ack=5029 Win=4974 Len=0 TSval=38293703 TSecr=2625531956"
"91","20:23:50.762127","192.168.0.74","64.65.63.120","TCP","66","53923  >  443 [ACK] Seq=537 Ack=7691 Win=4933 Len=0 TSval=38293703 TSecr=2625531956"
"92","20:23:50.762345","192.168.0.74","64.65.63.120","TCP","66","[TCP Window Update] 53923  >  443 [ACK] Seq=537 Ack=7691 Win=4996 Len=0 TSval=38293703 TSecr=2625531956"
"93","20:23:50.773744","192.87.28.82","192.168.0.74","TCP","1474","9001  >  53922 [ACK] Seq=22859 Ack=4693 Win=1043 Len=1408 TSval=3379377903 TSecr=2984033520 [TCP PDU reassembled in 95]"
"94","20:23:50.773746","192.87.28.82","192.168.0.74","TCP","1474","9001  >  53922 [ACK] Seq=24267 Ack=4693 Win=1043 Len=1408 TSval=3379377903 TSecr=2984033520 [TCP PDU reassembled in 95]"
"95","20:23:50.773747","192.87.28.82","192.168.0.74","TLSv1.2","870","Application Data"
"96","20:23:50.773865","192.168.0.74","192.87.28.82","TCP","66","53922  >  9001 [ACK] Seq=4693 Ack=26479 Win=4280 Len=0 TSval=2984033571 TSecr=3379377903"
"97","20:23:50.774018","192.168.0.74","192.87.28.82","TCP","66","[TCP Window Update] 53922  >  9001 [ACK] Seq=4693 Ack=26479 Win=4336 Len=0 TSval=2984033571 TSecr=3379377903"
"98","20:23:50.791662","192.87.28.82","192.168.0.74","TLSv1.2","1474","Application Data"
"99","20:23:50.791664","192.87.28.82","192.168.0.74","TCP","1474","9001  >  53922 [ACK] Seq=27887 Ack=4693 Win=1043 Len=1408 TSval=3379377921 TSecr=2984033542 [TCP PDU reassembled in 101]"
"100","20:23:50.791665","192.87.28.82","192.168.0.74","TCP","1474","9001  >  53922 [ACK] Seq=29295 Ack=4693 Win=1043 Len=1408 TSval=3379377921 TSecr=2984033542 [TCP PDU reassembled in 101]"
"101","20:23:50.791666","192.87.28.82","192.168.0.74","TLSv1.2","448","Application Data"
"102","20:23:50.791763","192.168.0.74","192.87.28.82","TCP","66","53922  >  9001 [ACK] Seq=4693 Ack=31085 Win=4265 Len=0 TSval=2984033589 TSecr=3379377921"
"103","20:23:50.791989","192.168.0.74","192.87.28.82","TCP","66","[TCP Window Update] 53922  >  9001 [ACK] Seq=4693 Ack=31085 Win=4336 Len=0 TSval=2984033589 TSecr=3379377921"
"104","20:23:50.796484","192.168.0.74","192.87.28.82","TLSv1.2","602","Application Data"
"105","20:23:50.802609","192.87.28.82","192.168.0.74","TLSv1.2","1474","Application Data"
"106","20:23:50.802611","192.87.28.82","192.168.0.74","TLSv1.2","1336","Application Data"
"107","20:23:50.802612","64.65.63.120","192.168.0.74","TLSv1.2","152","Application Data"
"108","20:23:50.802723","192.168.0.74","192.87.28.82","TCP","66","53922  >  9001 [ACK] Seq=5229 Ack=33763 Win=4295 Len=0 TSval=2984033600 TSecr=3379377932"
"109","20:23:50.802766","192.168.0.74","64.65.63.120","TCP","66","53923  >  443 [ACK] Seq=537 Ack=7777 Win=4995 Len=0 TSval=38293744 TSecr=2625532000"
"110","20:23:50.804737","64.65.63.120","192.168.0.74","TCP","1474","443  >  53923 [ACK] Seq=7777 Ack=537 Win=1899 Len=1408 TSval=2625532003 TSecr=38293703 [TCP PDU reassembled in 129]"
"111","20:23:50.804739","64.65.63.120","192.168.0.74","TCP","1474","443  >  53923 [PSH, ACK] Seq=9185 Ack=537 Win=1899 Len=1408 TSval=2625532003 TSecr=38293703 [TCP PDU reassembled in 129]"
"112","20:23:50.804824","192.168.0.74","64.65.63.120","TCP","66","53923  >  443 [ACK] Seq=537 Ack=10593 Win=4952 Len=0 TSval=38293746 TSecr=2625532003"
"113","20:23:50.804927","192.168.0.74","64.65.63.120","TCP","66","[TCP Window Update] 53923  >  443 [ACK] Seq=537 Ack=10593 Win=4996 Len=0 TSval=38293746 TSecr=2625532003"
"114","20:23:50.828411","192.87.28.82","192.168.0.74","TCP","1474","9001  >  53922 [ACK] Seq=33763 Ack=4693 Win=1043 Len=1408 TSval=3379377948 TSecr=2984033571 [TCP PDU reassembled in 115]"
"115","20:23:50.828414","192.87.28.82","192.168.0.74","TLSv1.2","1474","Application Data, Application Data"
"116","20:23:50.828527","192.168.0.74","192.87.28.82","TLSv1.2","1138","Application Data, Application Data"
"117","20:23:50.828684","192.168.0.74","192.87.28.82","TCP","66","[TCP Window Update] 53922  >  9001 [ACK] Seq=6301 Ack=36579 Win=4336 Len=0 TSval=2984033626 TSecr=3379377959"
"118","20:23:50.829061","192.168.0.74","192.87.28.82","TCP","1474","53922  >  9001 [ACK] Seq=6301 Ack=36579 Win=4336 Len=1408 TSval=2984033626 TSecr=3379377959 [TCP PDU reassembled in 119]"
"119","20:23:50.829066","192.168.0.74","192.87.28.82","TLSv1.2","1250","Application Data"
"120","20:23:50.830174","192.87.28.82","192.168.0.74","TCP","1474","9001  >  53922 [ACK] Seq=36579 Ack=4693 Win=1043 Len=1408 TSval=3379377959 TSecr=2984033589 [TCP PDU reassembled in 122]"
"121","20:23:50.830175","192.87.28.82","192.168.0.74","TCP","1474","9001  >  53922 [ACK] Seq=37987 Ack=4693 Win=1043 Len=1408 TSval=3379377959 TSecr=2984033589 [TCP PDU reassembled in 122]"
"122","20:23:50.830177","192.87.28.82","192.168.0.74","TLSv1.2","154","Application Data"
"123","20:23:50.830216","192.168.0.74","192.87.28.82","TCP","66","53922  >  9001 [ACK] Seq=8893 Ack=39483 Win=4291 Len=0 TSval=2984033627 TSecr=3379377959"
"124","20:23:50.830274","192.168.0.74","192.87.28.82","TCP","66","[TCP Window Update] 53922  >  9001 [ACK] Seq=8893 Ack=39483 Win=4336 Len=0 TSval=2984033627 TSecr=3379377959"
"125","20:23:50.830316","192.87.28.82","192.168.0.74","TCP","1474","9001  >  53922 [ACK] Seq=39483 Ack=5229 Win=1035 Len=1408 TSval=3379377961 TSecr=2984033593 [TCP PDU reassembled in 127]"
"126","20:23:50.830348","192.168.0.74","192.87.28.82","TCP","66","53922  >  9001 [ACK] Seq=8893 Ack=40891 Win=4314 Len=0 TSval=2984033627 TSecr=3379377961"
"127","20:23:50.831472","192.87.28.82","192.168.0.74","TLSv1.2","222","Application Data"
"128","20:23:50.831507","192.168.0.74","192.87.28.82","TCP","66","53922  >  9001 [ACK] Seq=8893 Ack=41047 Win=4334 Len=0 TSval=2984033628 TSecr=3379377961"
"129","20:23:50.843436","64.65.63.120","192.168.0.74","TLSv1.2","1474","Application Data, Application Data"
"130","20:23:50.843438","64.65.63.120","192.168.0.74","TCP","1474","443  >  53923 [PSH, ACK] Seq=12001 Ack=537 Win=1899 Len=1408 TSval=2625532040 TSecr=38293703 [TCP PDU reassembled in 131]"
"131","20:23:50.843439","64.65.63.120","192.168.0.74","TLSv1.2","154","Application Data"
"132","20:23:50.843539","192.168.0.74","64.65.63.120","TCP","66","53923  >  443 [ACK] Seq=537 Ack=13497 Win=4951 Len=0 TSval=38293784 TSecr=2625532041"
"133","20:23:50.843688","192.168.0.74","64.65.63.120","TCP","66","[TCP Window Update] 53923  >  443 [ACK] Seq=537 Ack=13497 Win=4996 Len=0 TSval=38293785 TSecr=2625532041"
"134","20:23:50.845326","192.87.28.82","192.168.0.74","TCP","1474","9001  >  53922 [ACK] Seq=41047 Ack=5229 Win=1043 Len=1408 TSval=3379377973 TSecr=2984033600 [TCP PDU reassembled in 135]"
"135","20:23:50.845328","192.87.28.82","192.168.0.74","TLSv1.2","222","Application Data"
"136","20:23:50.845390","192.168.0.74","192.87.28.82","TCP","66","53922  >  9001 [ACK] Seq=8893 Ack=42611 Win=4312 Len=0 TSval=2984033642 TSecr=3379377973"
"137","20:23:50.857128","192.168.0.74","192.87.28.82","TCP","1474","53922  >  9001 [ACK] Seq=8893 Ack=42611 Win=4336 Len=1408 TSval=2984033654 TSecr=3379377973 [TCP PDU reassembled in 138]"
"138","20:23:50.857148","192.168.0.74","192.87.28.82","TLSv1.2","736","Application Data"
"139","20:23:50.858354","192.168.0.74","192.87.28.82","TCP","1474","53922  >  9001 [ACK] Seq=10971 Ack=42611 Win=4336 Len=1408 TSval=2984033655 TSecr=3379377973 [TCP PDU reassembled in 140]"
"140","20:23:50.858365","192.168.0.74","192.87.28.82","TLSv1.2","736","Application Data"
"141","20:23:50.858575","192.87.28.82","192.168.0.74","TCP","1474","9001  >  53922 [ACK] Seq=42611 Ack=5229 Win=1043 Len=1408 TSval=3379377987 TSecr=2984033600 [TCP PDU reassembled in 143]"
"142","20:23:50.858576","192.87.28.82","192.168.0.74","TCP","1474","9001  >  53922 [ACK] Seq=44019 Ack=5229 Win=1043 Len=1408 TSval=3379377987 TSecr=2984033600 [TCP PDU reassembled in 143]"
"143","20:23:50.858578","192.87.28.82","192.168.0.74","TLSv1.2","870","Application Data"
"144","20:23:50.858659","192.168.0.74","192.87.28.82","TCP","66","53922  >  9001 [ACK] Seq=13049 Ack=46231 Win=4336 Len=0 TSval=2984033656 TSecr=3379377987"
"145","20:23:50.861728","192.168.0.74","192.87.28.82","TCP","1474","53922  >  9001 [ACK] Seq=13049 Ack=46231 Win=4336 Len=1408 TSval=2984033659 TSecr=3379377987 [TCP PDU reassembled in 146]"
"146","20:23:50.861743","192.168.0.74","192.87.28.82","TLSv1.2","736","Application Data"
"147","20:23:50.863125","192.168.0.74","192.87.28.82","TCP","1474","53922  >  9001 [ACK] Seq=15127 Ack=46231 Win=4336 Len=1408 TSval=2984033660 TSecr=3379377987 [TCP PDU reassembled in 148]"
"148","20:23:50.863140","192.168.0.74","192.87.28.82","TLSv1.2","736","Application Data"
"149","20:23:50.864618","192.87.28.82","192.168.0.74","TCP","66","9001  >  53922 [ACK] Seq=46231 Ack=7709 Win=1005 Len=0 TSval=3379377995 TSecr=2984033625"
"150","20:23:50.875340","192.87.28.82","192.168.0.74","TCP","1474","9001  >  53922 [ACK] Seq=46231 Ack=8893 Win=1043 Len=1408 TSval=3379378004 TSecr=2984033626 [TCP PDU reassembled in 152]"
"151","20:23:50.875342","192.87.28.82","192.168.0.74","TCP","1474","9001  >  53922 [ACK] Seq=47639 Ack=8893 Win=1043 Len=1408 TSval=3379378004 TSecr=2984033626 [TCP PDU reassembled in 152]"
"152","20:23:50.875344","192.87.28.82","192.168.0.74","TLSv1.2","870","Application Data"
"153","20:23:50.875473","192.168.0.74","192.87.28.82","TCP","66","53922  >  9001 [ACK] Seq=17205 Ack=49851 Win=4280 Len=0 TSval=2984033672 TSecr=3379378004"
"154","20:23:50.875598","192.168.0.74","192.87.28.82","TCP","66","[TCP Window Update] 53922  >  9001 [ACK] Seq=17205 Ack=49851 Win=4336 Len=0 TSval=2984033673 TSecr=3379378004"
"155","20:23:50.877112","192.87.28.82","192.168.0.74","TCP","1474","9001  >  53922 [ACK] Seq=49851 Ack=8893 Win=1043 Len=1408 TSval=3379378007 TSecr=2984033626 [TCP PDU reassembled in 156]"
"156","20:23:50.877114","192.87.28.82","192.168.0.74","TLSv1.2","1250","Application Data"
"157","20:23:50.877218","192.168.0.74","192.87.28.82","TLSv1.2","602","Application Data"
"158","20:23:50.881603","64.65.63.120","192.168.0.74","TCP","1474","443  >  53923 [ACK] Seq=13497 Ack=537 Win=1899 Len=1408 TSval=2625532080 TSecr=38293746 [TCP PDU reassembled in 160]"
"159","20:23:50.881605","64.65.63.120","192.168.0.74","TCP","1474","443  >  53923 [PSH, ACK] Seq=14905 Ack=537 Win=1899 Len=1408 TSval=2625532080 TSecr=38293746 [TCP PDU reassembled in 160]"
"160","20:23:50.881606","64.65.63.120","192.168.0.74","TLSv1.2","870","Application Data"
"161","20:23:50.881653","192.168.0.74","64.65.63.120","TCP","66","53923  >  443 [ACK] Seq=537 Ack=17117 Win=4940 Len=0 TSval=38293823 TSecr=2625532081"
"162","20:23:50.881731","192.168.0.74","64.65.63.120","TCP","66","[TCP Window Update] 53923  >  443 [ACK] Seq=537 Ack=17117 Win=4996 Len=0 TSval=38293823 TSecr=2625532081"
"163","20:23:50.882725","64.65.63.120","192.168.0.74","TCP","1474","443  >  53923 [ACK] Seq=17117 Ack=537 Win=1899 Len=1408 TSval=2625532082 TSecr=38293785 [TCP PDU reassembled in 183]"
"164","20:23:50.882727","64.65.63.120","192.168.0.74","TCP","1474","443  >  53923 [PSH, ACK] Seq=18525 Ack=537 Win=1899 Len=1408 TSval=2625532082 TSecr=38293785 [TCP PDU reassembled in 183]"
"165","20:23:50.882755","192.168.0.74","64.65.63.120","TCP","66","53923  >  443 [ACK] Seq=537 Ack=19933 Win=4952 Len=0 TSval=38293824 TSecr=2625532082"
"166","20:23:50.882816","192.168.0.74","64.65.63.120","TCP","66","[TCP Window Update] 53923  >  443 [ACK] Seq=537 Ack=19933 Win=4996 Len=0 TSval=38293824 TSecr=2625532082"
"167","20:23:50.890721","192.87.28.82","192.168.0.74","TCP","1474","9001  >  53922 [ACK] Seq=52443 Ack=8893 Win=1043 Len=1408 TSval=3379378019 TSecr=2984033642 [TCP PDU reassembled in 169]"
"168","20:23:50.890723","192.87.28.82","192.168.0.74","TCP","1474","9001  >  53922 [ACK] Seq=53851 Ack=8893 Win=1043 Len=1408 TSval=3379378019 TSecr=2984033642 [TCP PDU reassembled in 169]"
"169","20:23:50.890725","192.87.28.82","192.168.0.74","TLSv1.2","356","Application Data"
"170","20:23:50.890726","192.87.28.82","192.168.0.74","TCP","66","9001  >  53922 [ACK] Seq=55549 Ack=10971 Win=1011 Len=0 TSval=3379378020 TSecr=2984033654"
"171","20:23:50.890875","192.168.0.74","192.87.28.82","TCP","66","53922  >  9001 [ACK] Seq=17741 Ack=55549 Win=4336 Len=0 TSval=2984033688 TSecr=3379378019"
"172","20:23:50.894735","192.87.28.82","192.168.0.74","TCP","66","9001  >  53922 [ACK] Seq=55549 Ack=13049 Win=1011 Len=0 TSval=3379378024 TSecr=2984033655"
"173","20:23:50.898266","192.87.28.82","192.168.0.74","TCP","1474","9001  >  53922 [ACK] Seq=55549 Ack=13049 Win=1043 Len=1408 TSval=3379378027 TSecr=2984033656 [TCP PDU reassembled in 174]"
"174","20:23:50.898267","192.87.28.82","192.168.0.74","TLSv1.2","1250","Application Data"
"175","20:23:50.898268","192.87.28.82","192.168.0.74","TCP","66","9001  >  53922 [ACK] Seq=58141 Ack=15127 Win=1011 Len=0 TSval=3379378028 TSecr=2984033659"
"176","20:23:50.898269","192.87.28.82","192.168.0.74","TCP","66","9001  >  53922 [ACK] Seq=58141 Ack=17205 Win=1033 Len=0 TSval=3379378029 TSecr=2984033660"
"177","20:23:50.898348","192.168.0.74","192.87.28.82","TCP","66","53922  >  9001 [ACK] Seq=17741 Ack=58141 Win=4296 Len=0 TSval=2984033695 TSecr=3379378027"
"178","20:23:50.910755","192.87.28.82","192.168.0.74","TCP","1474","9001  >  53922 [ACK] Seq=58141 Ack=17205 Win=1043 Len=1408 TSval=3379378039 TSecr=2984033673 [TCP PDU reassembled in 180]"
"179","20:23:50.910757","192.87.28.82","192.168.0.74","TCP","1474","9001  >  53922 [ACK] Seq=59549 Ack=17205 Win=1043 Len=1408 TSval=3379378039 TSecr=2984033673 [TCP PDU reassembled in 180]"
"180","20:23:50.910758","192.87.28.82","192.168.0.74","TLSv1.2","356","Application Data"
"181","20:23:50.910861","192.168.0.74","192.87.28.82","TCP","66","53922  >  9001 [ACK] Seq=17741 Ack=61247 Win=4288 Len=0 TSval=2984033708 TSecr=3379378039"
"182","20:23:50.910930","192.168.0.74","192.87.28.82","TCP","66","[TCP Window Update] 53922  >  9001 [ACK] Seq=17741 Ack=61247 Win=4336 Len=0 TSval=2984033708 TSecr=3379378039"
"183","20:23:50.924620","64.65.63.120","192.168.0.74","TLSv1.2","1406","Application Data, Application Data"
"184","20:23:50.924623","64.65.63.120","192.168.0.74","TCP","1474","443  >  53923 [ACK] Seq=21273 Ack=537 Win=1899 Len=1408 TSval=2625532123 TSecr=38293824 [TCP PDU reassembled in 203]"
"185","20:23:50.924624","64.65.63.120","192.168.0.74","TCP","1474","443  >  53923 [PSH, ACK] Seq=22681 Ack=537 Win=1899 Len=1408 TSval=2625532123 TSecr=38293824 [TCP PDU reassembled in 203]"
"186","20:23:50.924771","192.168.0.74","64.65.63.120","TCP","66","53923  >  443 [ACK] Seq=537 Ack=24089 Win=4932 Len=0 TSval=38293866 TSecr=2625532123"
"187","20:23:50.924906","192.168.0.74","64.65.63.120","TCP","66","[TCP Window Update] 53923  >  443 [ACK] Seq=537 Ack=24089 Win=4996 Len=0 TSval=38293866 TSecr=2625532123"
"188","20:23:50.925009","192.168.0.74","64.65.63.120","TLSv1.2","602","Application Data"
"189","20:23:50.929008","192.87.28.82","192.168.0.74","TCP","1474","9001  >  53922 [ACK] Seq=61247 Ack=17741 Win=1043 Len=1408 TSval=3379378059 TSecr=2984033674 [TCP PDU reassembled in 191]"
"190","20:23:50.929010","192.87.28.82","192.168.0.74","TCP","1474","9001  >  53922 [ACK] Seq=62655 Ack=17741 Win=1043 Len=1408 TSval=3379378059 TSecr=2984033674 [TCP PDU reassembled in 191]"
"191","20:23:50.929012","192.87.28.82","192.168.0.74","TLSv1.2","870","Application Data"
"192","20:23:50.929140","192.168.0.74","192.87.28.82","TCP","66","53922  >  9001 [ACK] Seq=17741 Ack=64867 Win=4280 Len=0 TSval=2984033726 TSecr=3379378059"
"193","20:23:50.929212","192.168.0.74","192.87.28.82","TCP","66","[TCP Window Update] 53922  >  9001 [ACK] Seq=17741 Ack=64867 Win=4336 Len=0 TSval=2984033726 TSecr=3379378059"
"194","20:23:50.929277","192.168.0.74","192.87.28.82","TLSv1.2","602","Application Data"
"195","20:23:50.947854","192.87.28.82","192.168.0.74","TCP","1474","9001  >  53922 [ACK] Seq=64867 Ack=17741 Win=1043 Len=1408 TSval=3379378077 TSecr=2984033708 [TCP PDU reassembled in 197]"
"196","20:23:50.947856","192.87.28.82","192.168.0.74","TCP","1474","9001  >  53922 [ACK] Seq=66275 Ack=17741 Win=1043 Len=1408 TSval=3379378077 TSecr=2984033708 [TCP PDU reassembled in 197]"
"197","20:23:50.947858","192.87.28.82","192.168.0.74","TLSv1.2","1320","Application Data"
"198","20:23:50.948019","192.168.0.74","192.87.28.82","TCP","66","53922  >  9001 [ACK] Seq=18277 Ack=68937 Win=4336 Len=0 TSval=2984033745 TSecr=3379378077"
"199","20:23:50.950667","192.87.28.82","192.168.0.74","TLSv1.2","1474","Application Data"
"200","20:23:50.950668","192.87.28.82","192.168.0.74","TCP","1474","9001  >  53922 [ACK] Seq=70345 Ack=17741 Win=1043 Len=1408 TSval=3379378080 TSecr=2984033708 [TCP PDU reassembled in 201]"
"201","20:23:50.950669","192.87.28.82","192.168.0.74","TLSv1.2","956","Application Data"
"202","20:23:50.950759","192.168.0.74","192.87.28.82","TCP","66","53922  >  9001 [ACK] Seq=18277 Ack=72643 Win=4336 Len=0 TSval=2984033748 TSecr=3379378080"
"203","20:23:50.959836","64.65.63.120","192.168.0.74","TLSv1.2","1474","Application Data, Application Data"
"204","20:23:50.959839","64.65.63.120","192.168.0.74","TCP","1474","443  >  53923 [PSH, ACK] Seq=25497 Ack=537 Win=1899 Len=1408 TSval=2625532156 TSecr=38293824 [TCP PDU reassembled in 206]"
"205","20:23:50.959841","64.65.63.120","192.168.0.74","TCP","1474","443  >  53923 [ACK] Seq=26905 Ack=537 Win=1899 Len=1408 TSval=2625532156 TSecr=38293824 [TCP PDU reassembled in 206]"
"206","20:23:50.959842","64.65.63.120","192.168.0.74","TLSv1.2","1474","Application Data"
"207","20:23:50.959845","192.87.28.82","192.168.0.74","TCP","1474","9001  >  53922 [ACK] Seq=72643 Ack=17741 Win=1043 Len=1408 TSval=3379378090 TSecr=2984033708 [TCP PDU reassembled in 208]"
"208","20:23:50.959847","192.87.28.82","192.168.0.74","TLSv1.2","1250","Application Data"
"209","20:23:50.960016","192.168.0.74","64.65.63.120","TCP","66","53923  >  443 [ACK] Seq=1073 Ack=29721 Win=4908 Len=0 TSval=38293901 TSecr=2625532157"
"210","20:23:50.960046","192.168.0.74","192.87.28.82","TCP","66","53922  >  9001 [ACK] Seq=18277 Ack=75235 Win=4336 Len=0 TSval=2984033757 TSecr=3379378090"
"211","20:23:50.960182","192.168.0.74","64.65.63.120","TCP","66","[TCP Window Update] 53923  >  443 [ACK] Seq=1073 Ack=29721 Win=4996 Len=0 TSval=38293901 TSecr=2625532157"
"212","20:23:50.963219","64.65.63.120","192.168.0.74","TLSv1.2","444","Application Data"
"213","20:23:50.963281","192.168.0.74","64.65.63.120","TCP","66","53923  >  443 [ACK] Seq=1073 Ack=30099 Win=4991 Len=0 TSval=38293904 TSecr=2625532162"
"214","20:23:50.974743","192.87.28.82","192.168.0.74","TLSv1.2","1474","Application Data"
"215","20:23:50.974746","192.87.28.82","192.168.0.74","TCP","1474","9001  >  53922 [ACK] Seq=76643 Ack=18277 Win=1043 Len=1408 TSval=3379378104 TSecr=2984033726 [TCP PDU reassembled in 216]"
"216","20:23:50.974749","192.87.28.82","192.168.0.74","TLSv1.2","1406","Application Data"
"217","20:23:50.974751","192.87.28.82","192.168.0.74","TCP","1474","9001  >  53922 [ACK] Seq=79391 Ack=18277 Win=1043 Len=1408 TSval=3379378106 TSecr=2984033726 [TCP PDU reassembled in 218]"
"218","20:23:50.974753","192.87.28.82","192.168.0.74","TLSv1.2","222","Application Data"
"219","20:23:50.974911","192.168.0.74","192.87.28.82","TCP","66","53922  >  9001 [ACK] Seq=18277 Ack=80955 Win=4247 Len=0 TSval=2984033772 TSecr=3379378106"
"220","20:23:50.975080","192.168.0.74","192.87.28.82","TCP","66","[TCP Window Update] 53922  >  9001 [ACK] Seq=18277 Ack=80955 Win=4336 Len=0 TSval=2984033772 TSecr=3379378106"
"221","20:23:50.975197","192.168.0.74","192.87.28.82","TLSv1.2","602","Application Data"
"222","20:23:50.986373","64.65.63.120","192.168.0.74","TCP","1474","443  >  53923 [ACK] Seq=30099 Ack=1073 Win=1907 Len=1408 TSval=2625532185 TSecr=38293866 [TCP PDU reassembled in 224]"
"223","20:23:50.986375","64.65.63.120","192.168.0.74","TCP","1474","443  >  53923 [PSH, ACK] Seq=31507 Ack=1073 Win=1907 Len=1408 TSval=2625532185 TSecr=38293866 [TCP PDU reassembled in 224]"
"224","20:23:50.986377","64.65.63.120","192.168.0.74","TLSv1.2","1474","Application Data"
"225","20:23:50.986498","192.168.0.74","64.65.63.120","TCP","66","53923  >  443 [ACK] Seq=1073 Ack=34323 Win=4930 Len=0 TSval=38293927 TSecr=2625532185"
"226","20:23:50.986661","192.168.0.74","64.65.63.120","TCP","66","[TCP Window Update] 53923  >  443 [ACK] Seq=1073 Ack=34323 Win=4996 Len=0 TSval=38293928 TSecr=2625532185"
"227","20:23:50.986754","192.168.0.74","64.65.63.120","TLSv1.2","602","Application Data"
"228","20:23:50.995629","192.87.28.82","192.168.0.74","TLSv1.2","1474","Application Data"
"229","20:23:50.995631","192.87.28.82","192.168.0.74","TCP","1474","9001  >  53922 [ACK] Seq=82363 Ack=18277 Win=1043 Len=1408 TSval=3379378124 TSecr=2984033748 [TCP PDU reassembled in 231]"
"230","20:23:50.995633","192.87.28.82","192.168.0.74","TCP","1474","9001  >  53922 [ACK] Seq=83771 Ack=18277 Win=1043 Len=1408 TSval=3379378124 TSecr=2984033748 [TCP PDU reassembled in 231]"
"231","20:23:50.995634","192.87.28.82","192.168.0.74","TLSv1.2","448","Application Data"
"232","20:23:50.995848","192.168.0.74","192.87.28.82","TCP","66","53922  >  9001 [ACK] Seq=18813 Ack=85561 Win=4336 Len=0 TSval=2984033793 TSecr=3379378124"
"233","20:23:51.004900","64.65.63.120","192.168.0.74","TLSv1.2","512","Application Data"
"234","20:23:51.004902","64.65.63.120","192.168.0.74","TCP","1474","443  >  53923 [ACK] Seq=34769 Ack=1073 Win=1907 Len=1408 TSval=2625532205 TSecr=38293904 [TCP PDU reassembled in 240]"
"235","20:23:51.005040","192.168.0.74","64.65.63.120","TCP","66","53923  >  443 [ACK] Seq=1609 Ack=36177 Win=4968 Len=0 TSval=38293946 TSecr=2625532205"
"236","20:23:51.008827","192.87.28.82","192.168.0.74","TLSv1.2","1474","Application Data"
"237","20:23:51.008829","192.87.28.82","192.168.0.74","TCP","1474","9001  >  53922 [ACK] Seq=86969 Ack=18277 Win=1043 Len=1408 TSval=3379378139 TSecr=2984033772 [TCP PDU reassembled in 238]"
"238","20:23:51.008830","192.87.28.82","192.168.0.74","TLSv1.2","1470","Application Data"
"239","20:23:51.008970","192.168.0.74","192.87.28.82","TCP","66","53922  >  9001 [ACK] Seq=18813 Ack=89781 Win=4336 Len=0 TSval=2984033806 TSecr=3379378139"
"240","20:23:51.012154","64.65.63.120","192.168.0.74","TLSv1.2","1474","Application Data"
"241","20:23:51.012230","192.168.0.74","64.65.63.120","TCP","66","53923  >  443 [ACK] Seq=1609 Ack=37585 Win=4974 Len=0 TSval=38293953 TSecr=2625532211"
"242","20:23:51.014089","192.87.28.82","192.168.0.74","TCP","1474","9001  >  53922 [ACK] Seq=89781 Ack=18813 Win=1043 Len=1408 TSval=3379378145 TSecr=2984033772 [TCP PDU reassembled in 244]"
"243","20:23:51.014090","192.87.28.82","192.168.0.74","TCP","1474","9001  >  53922 [ACK] Seq=91189 Ack=18813 Win=1043 Len=1408 TSval=3379378145 TSecr=2984033772 [TCP PDU reassembled in 244]"
"244","20:23:51.014092","192.87.28.82","192.168.0.74","TLSv1.2","356","Application Data"
"245","20:23:51.014125","192.168.0.74","192.87.28.82","TCP","66","53922  >  9001 [ACK] Seq=18813 Ack=92887 Win=4288 Len=0 TSval=2984033811 TSecr=3379378145"
"246","20:23:51.014180","192.168.0.74","192.87.28.82","TCP","66","[TCP Window Update] 53922  >  9001 [ACK] Seq=18813 Ack=92887 Win=4336 Len=0 TSval=2984033811 TSecr=3379378145"
"247","20:23:51.026655","192.87.28.82","192.168.0.74","TCP","1474","9001  >  53922 [ACK] Seq=92887 Ack=18813 Win=1043 Len=1408 TSval=3379378156 TSecr=2984033772 [TCP PDU reassembled in 248]"
"248","20:23:51.026658","192.87.28.82","192.168.0.74","TLSv1.2","1250","Application Data"
"249","20:23:51.026864","192.168.0.74","192.87.28.82","TCP","66","53922  >  9001 [ACK] Seq=18813 Ack=95479 Win=4336 Len=0 TSval=2984033824 TSecr=3379378156"
"250","20:23:51.026973","192.168.0.74","192.87.28.82","TLSv1.2","602","Application Data"
"251","20:23:51.031186","192.87.28.82","192.168.0.74","TCP","1474","9001  >  53922 [ACK] Seq=95479 Ack=18813 Win=1043 Len=1408 TSval=3379378161 TSecr=2984033793 [TCP PDU reassembled in 253]"
"252","20:23:51.031188","192.87.28.82","192.168.0.74","TCP","1474","9001  >  53922 [ACK] Seq=96887 Ack=18813 Win=1043 Len=1408 TSval=3379378161 TSecr=2984033793 [TCP PDU reassembled in 253]"
"253","20:23:51.031191","192.87.28.82","192.168.0.74","TLSv1.2","870","Application Data"
"254","20:23:51.031331","192.168.0.74","192.87.28.82","TCP","66","53922  >  9001 [ACK] Seq=19349 Ack=99099 Win=4336 Len=0 TSval=2984033828 TSecr=3379378161"
"255","20:23:51.032701","64.65.63.120","192.168.0.74","TLSv1.2","1474","Application Data"
"256","20:23:51.032703","64.65.63.120","192.168.0.74","TCP","1474","443  >  53923 [PSH, ACK] Seq=38993 Ack=1609 Win=1916 Len=1408 TSval=2625532233 TSecr=38293928 [TCP PDU reassembled in 263]"
"257","20:23:51.032787","192.168.0.74","64.65.63.120","TCP","66","53923  >  443 [ACK] Seq=1609 Ack=40401 Win=4952 Len=0 TSval=38293974 TSecr=2625532233"
"258","20:23:51.032874","192.168.0.74","64.65.63.120","TCP","66","[TCP Window Update] 53923  >  443 [ACK] Seq=1609 Ack=40401 Win=4996 Len=0 TSval=38293974 TSecr=2625532233"
"259","20:23:51.034250","192.87.28.82","192.168.0.74","TCP","1474","9001  >  53922 [ACK] Seq=99099 Ack=18813 Win=1043 Len=1408 TSval=3379378166 TSecr=2984033793 [TCP PDU reassembled in 261]"
"260","20:23:51.035114","192.87.28.82","192.168.0.74","TCP","1474","9001  >  53922 [ACK] Seq=100507 Ack=18813 Win=1043 Len=1408 TSval=3379378166 TSecr=2984033793 [TCP PDU reassembled in 261]"
"261","20:23:51.035115","192.87.28.82","192.168.0.74","TLSv1.2","870","Application Data"
"262","20:23:51.035195","192.168.0.74","192.87.28.82","TCP","66","53922  >  9001 [ACK] Seq=19349 Ack=102719 Win=4336 Len=0 TSval=2984033832 TSecr=3379378166"
"263","20:23:51.037508","64.65.63.120","192.168.0.74","TLSv1.2","1474","Application Data"
"264","20:23:51.037510","64.65.63.120","192.168.0.74","TCP","1474","443  >  53923 [PSH, ACK] Seq=41809 Ack=1609 Win=1916 Len=1408 TSval=2625532238 TSecr=38293928 [TCP PDU reassembled in 266]"
"265","20:23:51.037636","192.168.0.74","64.65.63.120","TCP","66","53923  >  443 [ACK] Seq=1609 Ack=43217 Win=4996 Len=0 TSval=38293979 TSecr=2625532238"
"266","20:23:51.043239","64.65.63.120","192.168.0.74","TLSv1.2","444","Application Data"
"267","20:23:51.043389","192.168.0.74","64.65.63.120","TCP","66","53923  >  443 [ACK] Seq=1609 Ack=43595 Win=4996 Len=0 TSval=38293984 TSecr=2625532243"
"268","20:23:51.051647","192.87.28.82","192.168.0.74","TCP","1474","9001  >  53922 [ACK] Seq=102719 Ack=18813 Win=1043 Len=1408 TSval=3379378181 TSecr=2984033811 [TCP PDU reassembled in 269]"
"269","20:23:51.051649","192.87.28.82","192.168.0.74","TLSv1.2","222","Application Data"
"270","20:23:51.051829","192.168.0.74","192.87.28.82","TCP","66","53922  >  9001 [ACK] Seq=19349 Ack=104283 Win=4336 Len=0 TSval=2984033849 TSecr=3379378181"
